languageCode,code,bookOsisId,bookSblId,bookOrderIndex,chapterOsisId,chapterSblId,chapterOrderIndex,verseOsisId,verseSblId,verseOrderIndex,text
en,KJV,Mark,Mark,40,Mark.8,Mark 8,7,Mark.8.8,Mark 8:8,7,"So they did eat, and were filled: and they took up of the broken meat that was left seven baskets."
en,KJV,Mark,Mark,40,Mark.8,Mark 8,7,Mark.8.9,Mark 8:9,8,And they that had eaten were about four thousand: and he sent them away.
en,KJV,Mark,Mark,40,Mark.8,Mark 8,7,Mark.8.10,Mark 8:10,9,"And straightway he entered into a ship with his disciples, and came into the parts of Dalmanutha."
en,KJV,Mark,Mark,40,Mark.8,Mark 8,7,Mark.8.11,Mark 8:11,10,"And the Pharisees came forth, and began to question with him, seeking of him a sign from heaven, tempting him."
en,KJV,Mark,Mark,40,Mark.8,Mark 8,7,Mark.8.12,Mark 8:12,11,"And he sighed deeply in his spirit, and saith, Why doth this generation seek after a sign? verily I say unto you, There shall no sign be given unto this generation."
en,KJV,Mark,Mark,40,Mark.8,Mark 8,7,Mark.8.13,Mark 8:13,12,"And he left them, and entering into the ship again departed to the other side."
en,KJV,Mark,Mark,40,Mark.8,Mark 8,7,Mark.8.14,Mark 8:14,13,"Now the disciples had forgotten to take bread, neither had they in the ship with them more than one loaf."
en,KJV,Mark,Mark,40,Mark.8,Mark 8,7,Mark.8.15,Mark 8:15,14,"And he charged them, saying, Take heed, beware of the leaven of the Pharisees, and of the leaven of Herod."
en,KJV,Mark,Mark,40,Mark.8,Mark 8,7,Mark.8.16,Mark 8:16,15,"And they reasoned among themselves, saying, It is because we have no bread."
en,KJV,Mark,Mark,40,Mark.8,Mark 8,7,Mark.8.17,Mark 8:17,16,"And when Jesus knew it, he saith unto them, Why reason ye, because ye have no bread? perceive ye not yet, neither understand? have ye your heart yet hardened?"
en,KJV,Mark,Mark,40,Mark.8,Mark 8,7,Mark.8.18,Mark 8:18,17,"Having eyes, see ye not? and having ears, hear ye not? and do ye not remember?"
en,KJV,Mark,Mark,40,Mark.8,Mark 8,7,Mark.8.19,Mark 8:19,18,"When I brake the five loaves among five thousand, how many baskets full of fragments took ye up? They say unto him, Twelve."
en,KJV,Mark,Mark,40,Mark.8,Mark 8,7,Mark.8.20,Mark 8:20,19,"And when the seven among four thousand, how many baskets full of fragments took ye up? And they said, Seven."
en,KJV,Mark,Mark,40,Mark.8,Mark 8,7,Mark.8.21,Mark 8:21,20,"And he said unto them, How is it that ye do not understand?"
en,KJV,Mark,Mark,40,Mark.8,Mark 8,7,Mark.8.22,Mark 8:22,21,"And he cometh to Bethsaida; and they bring a blind man unto him, and besought him to touch him."
en,KJV,Mark,Mark,40,Mark.8,Mark 8,7,Mark.8.23,Mark 8:23,22,"And he took the blind man by the hand, and led him out of the town; and when he had spit on his eyes, and put his hands upon him, he asked him if he saw ought."
en,KJV,Mark,Mark,40,Mark.8,Mark 8,7,Mark.8.24,Mark 8:24,23,"And he looked up, and said, I see men as trees, walking."
en,KJV,Mark,Mark,40,Mark.8,Mark 8,7,Mark.8.25,Mark 8:25,24,"After that he put his hands again upon his eyes, and made him look up: and he was restored, and saw every man clearly."
en,KJV,Mark,Mark,40,Mark.8,Mark 8,7,Mark.8.26,Mark 8:26,25,"And he sent him away to his house, saying, Neither go into the town, nor tell it to any in the town."
en,KJV,Mark,Mark,40,Mark.8,Mark 8,7,Mark.8.27,Mark 8:27,26,"And Jesus went out, and his disciples, into the towns of Caesarea Philippi: and by the way he asked his disciples, saying unto them, Whom do men say that I am?"
en,KJV,Mark,Mark,40,Mark.8,Mark 8,7,Mark.8.28,Mark 8:28,27,"And they answered, John the Baptist; but some say, Elias; and others, One of the prophets."
en,KJV,Mark,Mark,40,Mark.8,Mark 8,7,Mark.8.29,Mark 8:29,28,"And he saith unto them, But whom say ye that I am? And Peter answereth and saith unto him, Thou art the Christ."
en,KJV,Mark,Mark,40,Mark.8,Mark 8,7,Mark.8.30,Mark 8:30,29,And he charged them that they should tell no man of him.
en,KJV,Mark,Mark,40,Mark.8,Mark 8,7,Mark.8.31,Mark 8:31,30,"And he began to teach them, that the Son of man must suffer many things, and be rejected of the elders, and of the chief priests, and scribes, and be killed, and after three days rise again."
en,KJV,Mark,Mark,40,Mark.8,Mark 8,7,Mark.8.32,Mark 8:32,31,"And he spake that saying openly. And Peter took him, and began to rebuke him."
en,KJV,Mark,Mark,40,Mark.8,Mark 8,7,Mark.8.33,Mark 8:33,32,"But when he had turned about and looked on his disciples, he rebuked Peter, saying, Get thee behind me, Satan: for thou savourest not the things that be of God, but the things that be of men."
en,KJV,Mark,Mark,40,Mark.8,Mark 8,7,Mark.8.34,Mark 8:34,33,"And when he had called the people unto him with his disciples also, he said unto them, Whosoever will come after me, let him deny himself, and take up his cross, and follow me."
en,KJV,Mark,Mark,40,Mark.8,Mark 8,7,Mark.8.35,Mark 8:35,34,"For whosoever will save his life shall lose it; but whosoever shall lose his life for my sake and the gospel's, the same shall save it."
en,KJV,Mark,Mark,40,Mark.8,Mark 8,7,Mark.8.36,Mark 8:36,35,"For what shall it profit a man, if he shall gain the whole world, and lose his own soul?"
en,KJV,Mark,Mark,40,Mark.8,Mark 8,7,Mark.8.37,Mark 8:37,36,Or what shall a man give in exchange for his soul?
en,KJV,Mark,Mark,40,Mark.8,Mark 8,7,Mark.8.38,Mark 8:38,37,"Whosoever therefore shall be ashamed of me and of my words in this adulterous and sinful generation; of him also shall the Son of man be ashamed, when he cometh in the glory of his Father with the holy angels."
en,KJV,Mark,Mark,40,Mark.9,Mark 9,8,Mark.9.1,Mark 9:1,0,"And he said unto them, Verily I say unto you, That there be some of them that stand here, which shall not taste of death, till they have seen the kingdom of God come with power."
en,KJV,Mark,Mark,40,Mark.9,Mark 9,8,Mark.9.2,Mark 9:2,1,"And after six days Jesus taketh with him Peter, and James, and John, and leadeth them up into an high mountain apart by themselves: and he was transfigured before them."
en,KJV,Mark,Mark,40,Mark.9,Mark 9,8,Mark.9.3,Mark 9:3,2,"And his raiment became shining, exceeding white as snow; so as no fuller on earth can white them."
en,KJV,Mark,Mark,40,Mark.9,Mark 9,8,Mark.9.4,Mark 9:4,3,And there appeared unto them Elias with Moses: and they were talking with Jesus.
en,KJV,Mark,Mark,40,Mark.9,Mark 9,8,Mark.9.5,Mark 9:5,4,"And Peter answered and said to Jesus, Master, it is good for us to be here: and let us make three tabernacles; one for thee, and one for Moses, and one for Elias."
en,KJV,Mark,Mark,40,Mark.9,Mark 9,8,Mark.9.6,Mark 9:6,5,For he wist not what to say; for they were sore afraid.
en,KJV,Mark,Mark,40,Mark.9,Mark 9,8,Mark.9.7,Mark 9:7,6,"And there was a cloud that overshadowed them: and a voice came out of the cloud, saying, This is my beloved Son: hear him."
en,KJV,Mark,Mark,40,Mark.9,Mark 9,8,Mark.9.8,Mark 9:8,7,"And suddenly, when they had looked round about, they saw no man any more, save Jesus only with themselves."
en,KJV,Mark,Mark,40,Mark.9,Mark 9,8,Mark.9.9,Mark 9:9,8,"And as they came down from the mountain, he charged them that they should tell no man what things they had seen, till the Son of man were risen from the dead."
en,KJV,Mark,Mark,40,Mark.9,Mark 9,8,Mark.9.10,Mark 9:10,9,"And they kept that saying with themselves, questioning one with another what the rising from the dead should mean."
en,KJV,Mark,Mark,40,Mark.9,Mark 9,8,Mark.9.11,Mark 9:11,10,"And they asked him, saying, Why say the scribes that Elias must first come?"
en,KJV,Mark,Mark,40,Mark.9,Mark 9,8,Mark.9.12,Mark 9:12,11,"And he answered and told them, Elias verily cometh first, and restoreth all things; and how it is written of the Son of man, that he must suffer many things, and be set at nought."
en,KJV,Mark,Mark,40,Mark.9,Mark 9,8,Mark.9.13,Mark 9:13,12,"But I say unto you, That Elias is indeed come, and they have done unto him whatsoever they listed, as it is written of him."
en,KJV,Mark,Mark,40,Mark.9,Mark 9,8,Mark.9.14,Mark 9:14,13,"And when he came to his disciples, he saw a great multitude about them, and the scribes questioning with them."
en,KJV,Mark,Mark,40,Mark.9,Mark 9,8,Mark.9.15,Mark 9:15,14,"And straightway all the people, when they beheld him, were greatly amazed, and running to him saluted him."
en,KJV,Mark,Mark,40,Mark.9,Mark 9,8,Mark.9.16,Mark 9:16,15,"And he asked the scribes, What question ye with them?"
en,KJV,Mark,Mark,40,Mark.9,Mark 9,8,Mark.9.17,Mark 9:17,16,"And one of the multitude answered and said, Master, I have brought unto thee my son, which hath a dumb spirit;"
en,KJV,Mark,Mark,40,Mark.9,Mark 9,8,Mark.9.18,Mark 9:18,17,"And wheresoever he taketh him, he teareth him: and he foameth, and gnasheth with his teeth, and pineth away: and I spake to thy disciples that they should cast him out; and they could not."
en,KJV,Mark,Mark,40,Mark.9,Mark 9,8,Mark.9.19,Mark 9:19,18,"He answereth him, and saith, O faithless generation, how long shall I be with you? how long shall I suffer you? bring him unto me."
en,KJV,Mark,Mark,40,Mark.9,Mark 9,8,Mark.9.20,Mark 9:20,19,"And they brought him unto him: and when he saw him, straightway the spirit tare him; and he fell on the ground, and wallowed foaming."
en,KJV,Mark,Mark,40,Mark.9,Mark 9,8,Mark.9.21,Mark 9:21,20,"And he asked his father, How long is it ago since this came unto him? And he said, Of a child."
en,KJV,Mark,Mark,40,Mark.9,Mark 9,8,Mark.9.22,Mark 9:22,21,"And ofttimes it hath cast him into the fire, and into the waters, to destroy him: but if thou canst do any thing, have compassion on us, and help us."
en,KJV,Mark,Mark,40,Mark.9,Mark 9,8,Mark.9.23,Mark 9:23,22,"Jesus said unto him, If thou canst believe, all things are possible to him that believeth."
en,KJV,Mark,Mark,40,Mark.9,Mark 9,8,Mark.9.24,Mark 9:24,23,"And straightway the father of the child cried out, and said with tears, Lord, I believe; help thou mine unbelief."
en,KJV,Mark,Mark,40,Mark.9,Mark 9,8,Mark.9.25,Mark 9:25,24,"When Jesus saw that the people came running together, he rebuked the foul spirit, saying unto him, Thou dumb and deaf spirit, I charge thee, come out of him, and enter no more into him."
en,KJV,Mark,Mark,40,Mark.9,Mark 9,8,Mark.9.26,Mark 9:26,25,"And the spirit cried, and rent him sore, and came out of him: and he was as one dead; insomuch that many said, He is dead."
en,KJV,Mark,Mark,40,Mark.9,Mark 9,8,Mark.9.27,Mark 9:27,26,"But Jesus took him by the hand, and lifted him up; and he arose."
en,KJV,Mark,Mark,40,Mark.9,Mark 9,8,Mark.9.28,Mark 9:28,27,"And when he was come into the house, his disciples asked him privately, Why could not we cast him out?"
en,KJV,Mark,Mark,40,Mark.9,Mark 9,8,Mark.9.29,Mark 9:29,28,"And he said unto them, This kind can come forth by nothing, but by prayer and fasting."
en,KJV,Mark,Mark,40,Mark.9,Mark 9,8,Mark.9.30,Mark 9:30,29,"And they departed thence, and passed through Galilee; and he would not that any man should know it."
en,KJV,Mark,Mark,40,Mark.9,Mark 9,8,Mark.9.31,Mark 9:31,30,"For he taught his disciples, and said unto them, The Son of man is delivered into the hands of men, and they shall kill him; and after that he is killed, he shall rise the third day."
en,KJV,Mark,Mark,40,Mark.9,Mark 9,8,Mark.9.32,Mark 9:32,31,"But they understood not that saying, and were afraid to ask him."
en,KJV,Mark,Mark,40,Mark.9,Mark 9,8,Mark.9.33,Mark 9:33,32,"And he came to Capernaum: and being in the house he asked them, What was it that ye disputed among yourselves by the way?"
en,KJV,Mark,Mark,40,Mark.9,Mark 9,8,Mark.9.34,Mark 9:34,33,"But they held their peace: for by the way they had disputed among themselves, who should be the greatest."
en,KJV,Mark,Mark,40,Mark.9,Mark 9,8,Mark.9.35,Mark 9:35,34,"And he sat down, and called the twelve, and saith unto them, If any man desire to be first, the same shall be last of all, and servant of all."
en,KJV,Mark,Mark,40,Mark.9,Mark 9,8,Mark.9.36,Mark 9:36,35,"And he took a child, and set him in the midst of them: and when he had taken him in his arms, he said unto them,"
en,KJV,Mark,Mark,40,Mark.9,Mark 9,8,Mark.9.37,Mark 9:37,36,"Whosoever shall receive one of such children in my name, receiveth me: and whosoever shall receive me, receiveth not me, but him that sent me."
en,KJV,Mark,Mark,40,Mark.9,Mark 9,8,Mark.9.38,Mark 9:38,37,"And John answered him, saying, Master, we saw one casting out devils in thy name, and he followeth not us: and we forbad him, because he followeth not us."
en,KJV,Mark,Mark,40,Mark.9,Mark 9,8,Mark.9.39,Mark 9:39,38,"But Jesus said, Forbid him not: for there is no man which shall do a miracle in my name, that can lightly speak evil of me."
en,KJV,Mark,Mark,40,Mark.9,Mark 9,8,Mark.9.40,Mark 9:40,39,For he that is not against us is on our part.
en,KJV,Mark,Mark,40,Mark.9,Mark 9,8,Mark.9.41,Mark 9:41,40,"For whosoever shall give you a cup of water to drink in my name, because ye belong to Christ, verily I say unto you, he shall not lose his reward."
en,KJV,Mark,Mark,40,Mark.9,Mark 9,8,Mark.9.42,Mark 9:42,41,"And whosoever shall offend one of these little ones that believe in me, it is better for him that a millstone were hanged about his neck, and he were cast into the sea."
en,KJV,Mark,Mark,40,Mark.9,Mark 9,8,Mark.9.43,Mark 9:43,42,"And if thy hand offend thee, cut it off: it is better for thee to enter into life maimed, than having two hands to go into hell, into the fire that never shall be quenched:"
en,KJV,Mark,Mark,40,Mark.9,Mark 9,8,Mark.9.44,Mark 9:44,43,"Where their worm dieth not, and the fire is not quenched."
en,KJV,Mark,Mark,40,Mark.9,Mark 9,8,Mark.9.45,Mark 9:45,44,"And if thy foot offend thee, cut it off: it is better for thee to enter halt into life, than having two feet to be cast into hell, into the fire that never shall be quenched:"
en,KJV,Mark,Mark,40,Mark.9,Mark 9,8,Mark.9.46,Mark 9:46,45,"Where their worm dieth not, and the fire is not quenched."
en,KJV,Mark,Mark,40,Mark.9,Mark 9,8,Mark.9.47,Mark 9:47,46,"And if thine eye offend thee, pluck it out: it is better for thee to enter into the kingdom of God with one eye, than having two eyes to be cast into hell fire:"
en,KJV,Mark,Mark,40,Mark.9,Mark 9,8,Mark.9.48,Mark 9:48,47,"Where their worm dieth not, and the fire is not quenched."
en,KJV,Mark,Mark,40,Mark.9,Mark 9,8,Mark.9.49,Mark 9:49,48,"For every one shall be salted with fire, and every sacrifice shall be salted with salt."
en,KJV,Mark,Mark,40,Mark.9,Mark 9,8,Mark.9.50,Mark 9:50,49,"Salt is good: but if the salt have lost his saltness, wherewith will ye season it? Have salt in yourselves, and have peace one with another."
en,KJV,Mark,Mark,40,Mark.10,Mark 10,9,Mark.10.1,Mark 10:1,0,"And he arose from thence, and cometh into the coasts of Judaea by the farther side of Jordan: and the people resort unto him again; and, as he was wont, he taught them again."
en,KJV,Mark,Mark,40,Mark.10,Mark 10,9,Mark.10.2,Mark 10:2,1,"And the Pharisees came to him, and asked him, Is it lawful for a man to put away his wife? tempting him."
en,KJV,Mark,Mark,40,Mark.10,Mark 10,9,Mark.10.3,Mark 10:3,2,"And he answered and said unto them, What did Moses command you?"
en,KJV,Mark,Mark,40,Mark.10,Mark 10,9,Mark.10.4,Mark 10:4,3,"And they said, Moses suffered to write a bill of divorcement, and to put her away."
en,KJV,Mark,Mark,40,Mark.10,Mark 10,9,Mark.10.5,Mark 10:5,4,"And Jesus answered and said unto them, For the hardness of your heart he wrote you this precept."
en,KJV,Mark,Mark,40,Mark.10,Mark 10,9,Mark.10.6,Mark 10:6,5,But from the beginning of the creation God made them male and female.
en,KJV,Mark,Mark,40,Mark.10,Mark 10,9,Mark.10.7,Mark 10:7,6,"For this cause shall a man leave his father and mother, and cleave to his wife;"
en,KJV,Mark,Mark,40,Mark.10,Mark 10,9,Mark.10.8,Mark 10:8,7,"And they twain shall be one flesh: so then they are no more twain, but one flesh."
en,KJV,Mark,Mark,40,Mark.10,Mark 10,9,Mark.10.9,Mark 10:9,8,"What therefore God hath joined together, let not man put asunder."
en,KJV,Mark,Mark,40,Mark.10,Mark 10,9,Mark.10.10,Mark 10:10,9,And in the house his disciples asked him again of the same matter.
en,KJV,Mark,Mark,40,Mark.10,Mark 10,9,Mark.10.11,Mark 10:11,10,"And he saith unto them, Whosoever shall put away his wife, and marry another, committeth adultery against her."
en,KJV,Mark,Mark,40,Mark.10,Mark 10,9,Mark.10.12,Mark 10:12,11,"And if a woman shall put away her husband, and be married to another, she committeth adultery."
en,KJV,Mark,Mark,40,Mark.10,Mark 10,9,Mark.10.13,Mark 10:13,12,"And they brought young children to him, that he should touch them: and his disciples rebuked those that brought them."
en,KJV,Mark,Mark,40,Mark.10,Mark 10,9,Mark.10.14,Mark 10:14,13,"But when Jesus saw it, he was much displeased, and said unto them, Suffer the little children to come unto me, and forbid them not: for of such is the kingdom of God."
en,KJV,Mark,Mark,40,Mark.10,Mark 10,9,Mark.10.15,Mark 10:15,14,"Verily I say unto you, Whosoever shall not receive the kingdom of God as a little child, he shall not enter therein."
en,KJV,Mark,Mark,40,Mark.10,Mark 10,9,Mark.10.16,Mark 10:16,15,"And he took them up in his arms, put his hands upon them, and blessed them."
en,KJV,Mark,Mark,40,Mark.10,Mark 10,9,Mark.10.17,Mark 10:17,16,"And when he was gone forth into the way, there came one running, and kneeled to him, and asked him, Good Master, what shall I do that I may inherit eternal life?"
en,KJV,Mark,Mark,40,Mark.10,Mark 10,9,Mark.10.18,Mark 10:18,17,"And Jesus said unto him, Why callest thou me good? there is none good but one, that is, God."
en,KJV,Mark,Mark,40,Mark.10,Mark 10,9,Mark.10.19,Mark 10:19,18,"Thou knowest the commandments, Do not commit adultery, Do not kill, Do not steal, Do not bear false witness, Defraud not, Honour thy father and mother."
en,KJV,Mark,Mark,40,Mark.10,Mark 10,9,Mark.10.20,Mark 10:20,19,"And he answered and said unto him, Master, all these have I observed from my youth."
en,KJV,Mark,Mark,40,Mark.10,Mark 10,9,Mark.10.21,Mark 10:21,20,"Then Jesus beholding him loved him, and said unto him, One thing thou lackest: go thy way, sell whatsoever thou hast, and give to the poor, and thou shalt have treasure in heaven: and come, take up the cross, and follow me."
en,KJV,Mark,Mark,40,Mark.10,Mark 10,9,Mark.10.22,Mark 10:22,21,"And he was sad at that saying, and went away grieved: for he had great possessions."
en,KJV,Mark,Mark,40,Mark.10,Mark 10,9,Mark.10.23,Mark 10:23,22,"And Jesus looked round about, and saith unto his disciples, How hardly shall they that have riches enter into the kingdom of God!"
en,KJV,Mark,Mark,40,Mark.10,Mark 10,9,Mark.10.24,Mark 10:24,23,"And the disciples were astonished at his words. But Jesus answereth again, and saith unto them, Children, how hard is it for them that trust in riches to enter into the kingdom of God!"
en,KJV,Mark,Mark,40,Mark.10,Mark 10,9,Mark.10.25,Mark 10:25,24,"It is easier for a camel to go through the eye of a needle, than for a rich man to enter into the kingdom of God."
en,KJV,Mark,Mark,40,Mark.10,Mark 10,9,Mark.10.26,Mark 10:26,25,"And they were astonished out of measure, saying among themselves, Who then can be saved?"
en,KJV,Mark,Mark,40,Mark.10,Mark 10,9,Mark.10.27,Mark 10:27,26,"And Jesus looking upon them saith, With men it is impossible, but not with God: for with God all things are possible."
en,KJV,Mark,Mark,40,Mark.10,Mark 10,9,Mark.10.28,Mark 10:28,27,"Then Peter began to say unto him, Lo, we have left all, and have followed thee."
en,KJV,Mark,Mark,40,Mark.10,Mark 10,9,Mark.10.29,Mark 10:29,28,"And Jesus answered and said, Verily I say unto you, There is no man that hath left house, or brethren, or sisters, or father, or mother, or wife, or children, or lands, for my sake, and the gospel's,"
en,KJV,Mark,Mark,40,Mark.10,Mark 10,9,Mark.10.30,Mark 10:30,29,"But he shall receive an hundredfold now in this time, houses, and brethren, and sisters, and mothers, and children, and lands, with persecutions; and in the world to come eternal life."
en,KJV,Mark,Mark,40,Mark.10,Mark 10,9,Mark.10.31,Mark 10:31,30,But many that are first shall be last; and the last first.
en,KJV,Mark,Mark,40,Mark.10,Mark 10,9,Mark.10.32,Mark 10:32,31,"And they were in the way going up to Jerusalem; and Jesus went before them: and they were amazed; and as they followed, they were afraid. And he took again the twelve, and began to tell them what things should happen unto him,"
en,KJV,Mark,Mark,40,Mark.10,Mark 10,9,Mark.10.33,Mark 10:33,32,"Saying, Behold, we go up to Jerusalem; and the Son of man shall be delivered unto the chief priests, and unto the scribes; and they shall condemn him to death, and shall deliver him to the Gentiles:"
en,KJV,Mark,Mark,40,Mark.10,Mark 10,9,Mark.10.34,Mark 10:34,33,"And they shall mock him, and shall scourge him, and shall spit upon him, and shall kill him: and the third day he shall rise again."
en,KJV,Mark,Mark,40,Mark.10,Mark 10,9,Mark.10.35,Mark 10:35,34,"And James and John, the sons of Zebedee, come unto him, saying, Master, we would that thou shouldest do for us whatsoever we shall desire."
en,KJV,Mark,Mark,40,Mark.10,Mark 10,9,Mark.10.36,Mark 10:36,35,"And he said unto them, What would ye that I should do for you?"
en,KJV,Mark,Mark,40,Mark.10,Mark 10,9,Mark.10.37,Mark 10:37,36,"They said unto him, Grant unto us that we may sit, one on thy right hand, and the other on thy left hand, in thy glory."
en,KJV,Mark,Mark,40,Mark.10,Mark 10,9,Mark.10.38,Mark 10:38,37,"But Jesus said unto them, Ye know not what ye ask: can ye drink of the cup that I drink of? and be baptized with the baptism that I am baptized with?"
en,KJV,Mark,Mark,40,Mark.10,Mark 10,9,Mark.10.39,Mark 10:39,38,"And they said unto him, We can. And Jesus said unto them, Ye shall indeed drink of the cup that I drink of; and with the baptism that I am baptized withal shall ye be baptized:"
en,KJV,Mark,Mark,40,Mark.10,Mark 10,9,Mark.10.40,Mark 10:40,39,But to sit on my right hand and on my left hand is not mine to give; but it shall be given to them for whom it is prepared.
en,KJV,Mark,Mark,40,Mark.10,Mark 10,9,Mark.10.41,Mark 10:41,40,"And when the ten heard it, they began to be much displeased with James and John."
en,KJV,Mark,Mark,40,Mark.10,Mark 10,9,Mark.10.42,Mark 10:42,41,"But Jesus called them to him, and saith unto them, Ye know that they which are accounted to rule over the Gentiles exercise lordship over them; and their great ones exercise authority upon them."
en,KJV,Mark,Mark,40,Mark.10,Mark 10,9,Mark.10.43,Mark 10:43,42,"But so shall it not be among you: but whosoever will be great among you, shall be your minister:"
en,KJV,Mark,Mark,40,Mark.10,Mark 10,9,Mark.10.44,Mark 10:44,43,"And whosoever of you will be the chiefest, shall be servant of all."
en,KJV,Mark,Mark,40,Mark.10,Mark 10,9,Mark.10.45,Mark 10:45,44,"For even the Son of man came not to be ministered unto, but to minister, and to give his life a ransom for many."
en,KJV,Mark,Mark,40,Mark.10,Mark 10,9,Mark.10.46,Mark 10:46,45,"And they came to Jericho: and as he went out of Jericho with his disciples and a great number of people, blind Bartimaeus, the son of Timaeus, sat by the highway side begging."
en,KJV,Mark,Mark,40,Mark.10,Mark 10,9,Mark.10.47,Mark 10:47,46,"And when he heard that it was Jesus of Nazareth, he began to cry out, and say, Jesus, thou son of David, have mercy on me."
en,KJV,Mark,Mark,40,Mark.10,Mark 10,9,Mark.10.48,Mark 10:48,47,"And many charged him that he should hold his peace: but he cried the more a great deal, Thou son of David, have mercy on me."
en,KJV,Mark,Mark,40,Mark.10,Mark 10,9,Mark.10.49,Mark 10:49,48,"And Jesus stood still, and commanded him to be called. And they call the blind man, saying unto him, Be of good comfort, rise; he calleth thee."
en,KJV,Mark,Mark,40,Mark.10,Mark 10,9,Mark.10.50,Mark 10:50,49,"And he, casting away his garment, rose, and came to Jesus."
en,KJV,Mark,Mark,40,Mark.10,Mark 10,9,Mark.10.51,Mark 10:51,50,"And Jesus answered and said unto him, What wilt thou that I should do unto thee? The blind man said unto him, Lord, that I might receive my sight."
en,KJV,Mark,Mark,40,Mark.10,Mark 10,9,Mark.10.52,Mark 10:52,51,"And Jesus said unto him, Go thy way; thy faith hath made thee whole. And immediately he received his sight, and followed Jesus in the way."
en,KJV,Mark,Mark,40,Mark.11,Mark 11,10,Mark.11.1,Mark 11:1,0,"And when they came nigh to Jerusalem, unto Bethphage and Bethany, at the mount of Olives, he sendeth forth two of his disciples,"
en,KJV,Mark,Mark,40,Mark.11,Mark 11,10,Mark.11.2,Mark 11:2,1,"And saith unto them, Go your way into the village over against you: and as soon as ye be entered into it, ye shall find a colt tied, whereon never man sat; loose him, and bring him."
en,KJV,Mark,Mark,40,Mark.11,Mark 11,10,Mark.11.3,Mark 11:3,2,"And if any man say unto you, Why do ye this? say ye that the Lord hath need of him; and straightway he will send him hither."
en,KJV,Mark,Mark,40,Mark.11,Mark 11,10,Mark.11.4,Mark 11:4,3,"And they went their way, and found the colt tied by the door without in a place where two ways met; and they loose him."
en,KJV,Mark,Mark,40,Mark.11,Mark 11,10,Mark.11.5,Mark 11:5,4,"And certain of them that stood there said unto them, What do ye, loosing the colt?"
en,KJV,Mark,Mark,40,Mark.11,Mark 11,10,Mark.11.6,Mark 11:6,5,And they said unto them even as Jesus had commanded: and they let them go.
en,KJV,Mark,Mark,40,Mark.11,Mark 11,10,Mark.11.7,Mark 11:7,6,"And they brought the colt to Jesus, and cast their garments on him; and he sat upon him."
en,KJV,Mark,Mark,40,Mark.11,Mark 11,10,Mark.11.8,Mark 11:8,7,"And many spread their garments in the way: and others cut down branches off the trees, and strawed them in the way."
en,KJV,Mark,Mark,40,Mark.11,Mark 11,10,Mark.11.9,Mark 11:9,8,"And they that went before, and they that followed, cried, saying, Hosanna; Blessed is he that cometh in the name of the Lord:"
