languageCode,code,bookOsisId,bookSblId,bookOrderIndex,chapterOsisId,chapterSblId,chapterOrderIndex,verseOsisId,verseSblId,verseOrderIndex,text
en,KJV,Mark,Mark,40,Mark.4,Mark 4,3,Mark.4.41,Mark 4:41,40,"And they feared exceedingly, and said one to another, What manner of man is this, that even the wind and the sea obey him?"
en,KJV,Mark,Mark,40,Mark.5,Mark 5,4,Mark.5.1,Mark 5:1,0,"And they came over unto the other side of the sea, into the country of the Gadarenes."
en,KJV,Mark,Mark,40,Mark.5,Mark 5,4,Mark.5.2,Mark 5:2,1,"And when he was come out of the ship, immediately there met him out of the tombs a man with an unclean spirit,"
en,KJV,Mark,Mark,40,Mark.5,Mark 5,4,Mark.5.3,Mark 5:3,2,"Who had his dwelling among the tombs; and no man could bind him, no, not with chains:"
en,KJV,Mark,Mark,40,Mark.5,Mark 5,4,Mark.5.4,Mark 5:4,3,"Because that he had been often bound with fetters and chains, and the chains had been plucked asunder by him, and the fetters broken in pieces: neither could any man tame him."
en,KJV,Mark,Mark,40,Mark.5,Mark 5,4,Mark.5.5,Mark 5:5,4,"And always, night and day, he was in the mountains, and in the tombs, crying, and cutting himself with stones."
en,KJV,Mark,Mark,40,Mark.5,Mark 5,4,Mark.5.6,Mark 5:6,5,"But when he saw Jesus afar off, he ran and worshipped him,"
en,KJV,Mark,Mark,40,Mark.5,Mark 5,4,Mark.5.7,Mark 5:7,6,"And cried with a loud voice, and said, What have I to do with thee, Jesus, thou Son of the most high God? I adjure thee by God, that thou torment me not."
en,KJV,Mark,Mark,40,Mark.5,Mark 5,4,Mark.5.8,Mark 5:8,7,"For he said unto him, Come out of the man, thou unclean spirit."
en,KJV,Mark,Mark,40,Mark.5,Mark 5,4,Mark.5.9,Mark 5:9,8,"And he asked him, What is thy name? And he answered, saying, My name is Legion: for we are many."
en,KJV,Mark,Mark,40,Mark.5,Mark 5,4,Mark.5.10,Mark 5:10,9,And he besought him much that he would not send them away out of the country.
en,KJV,Mark,Mark,40,Mark.5,Mark 5,4,Mark.5.11,Mark 5:11,10,Now there was there nigh unto the mountains a great herd of swine feeding.
en,KJV,Mark,Mark,40,Mark.5,Mark 5,4,Mark.5.12,Mark 5:12,11,"And all the devils besought him, saying, Send us into the swine, that we may enter into them."
en,KJV,Mark,Mark,40,Mark.5,Mark 5,4,Mark.5.13,Mark 5:13,12,"And forthwith Jesus gave them leave. And the unclean spirits went out, and entered into the swine: and the herd ran violently down a steep place into the sea, (they were about two thousand;) and were choked in the sea."
en,KJV,Mark,Mark,40,Mark.5,Mark 5,4,Mark.5.14,Mark 5:14,13,"And they that fed the swine fled, and told it in the city, and in the country. And they went out to see what it was that was done."
en,KJV,Mark,Mark,40,Mark.5,Mark 5,4,Mark.5.15,Mark 5:15,14,"And they come to Jesus, and see him that was possessed with the devil, and had the legion, sitting, and clothed, and in his right mind: and they were afraid."
en,KJV,Mark,Mark,40,Mark.5,Mark 5,4,Mark.5.16,Mark 5:16,15,"And they that saw it told them how it befell to him that was possessed with the devil, and also concerning the swine."
en,KJV,Mark,Mark,40,Mark.5,Mark 5,4,Mark.5.17,Mark 5:17,16,And they began to pray him to depart out of their coasts.
en,KJV,Mark,Mark,40,Mark.5,Mark 5,4,Mark.5.18,Mark 5:18,17,"And when he was come into the ship, he that had been possessed with the devil prayed him that he might be with him."
en,KJV,Mark,Mark,40,Mark.5,Mark 5,4,Mark.5.19,Mark 5:19,18,"Howbeit Jesus suffered him not, but saith unto him, Go home to thy friends, and tell them how great things the Lord hath done for thee, and hath had compassion on thee."
en,KJV,Mark,Mark,40,Mark.5,Mark 5,4,Mark.5.20,Mark 5:20,19,"And he departed, and began to publish in Decapolis how great things Jesus had done for him: and all men did marvel."
en,KJV,Mark,Mark,40,Mark.5,Mark 5,4,Mark.5.21,Mark 5:21,20,"And when Jesus was passed over again by ship unto the other side, much people gathered unto him: and he was nigh unto the sea."
en,KJV,Mark,Mark,40,Mark.5,Mark 5,4,Mark.5.22,Mark 5:22,21,"And, behold, there cometh one of the rulers of the synagogue, Jairus by name; and when he saw him, he fell at his feet,"
en,KJV,Mark,Mark,40,Mark.5,Mark 5,4,Mark.5.23,Mark 5:23,22,"And besought him greatly, saying, My little daughter lieth at the point of death: I pray thee, come and lay thy hands on her, that she may be healed; and she shall live."
en,KJV,Mark,Mark,40,Mark.5,Mark 5,4,Mark.5.24,Mark 5:24,23,"And Jesus went with him; and much people followed him, and thronged him."
en,KJV,Mark,Mark,40,Mark.5,Mark 5,4,Mark.5.25,Mark 5:25,24,"And a certain woman, which had an issue of blood twelve years,"
en,KJV,Mark,Mark,40,Mark.5,Mark 5,4,Mark.5.26,Mark 5:26,25,"And had suffered many things of many physicians, and had spent all that she had, and was nothing bettered, but rather grew worse,"
en,KJV,Mark,Mark,40,Mark.5,Mark 5,4,Mark.5.27,Mark 5:27,26,"When she had heard of Jesus, came in the press behind, and touched his garment."
en,KJV,Mark,Mark,40,Mark.5,Mark 5,4,Mark.5.28,Mark 5:28,27,"For she said, If I may touch but his clothes, I shall be whole."
en,KJV,Mark,Mark,40,Mark.5,Mark 5,4,Mark.5.29,Mark 5:29,28,And straightway the fountain of her blood was dried up; and she felt in her body that she was healed of that plague.
en,KJV,Mark,Mark,40,Mark.5,Mark 5,4,Mark.5.30,Mark 5:30,29,"And Jesus, immediately knowing in himself that virtue had gone out of him, turned him about in the press, and said, Who touched my clothes?"
en,KJV,Mark,Mark,40,Mark.5,Mark 5,4,Mark.5.31,Mark 5:31,30,"And his disciples said unto him, Thou seest the multitude thronging thee, and sayest thou, Who touched me?"
en,KJV,Mark,Mark,40,Mark.5,Mark 5,4,Mark.5.32,Mark 5:32,31,And he looked round about to see her that had done this thing.
en,KJV,Mark,Mark,40,Mark.5,Mark 5,4,Mark.5.33,Mark 5:33,32,"But the woman fearing and trembling, knowing what was done in her, came and fell down before him, and told him all the truth."
en,KJV,Mark,Mark,40,Mark.5,Mark 5,4,Mark.5.34,Mark 5:34,33,"And he said unto her, Daughter, thy faith hath made thee whole; go in peace, and be whole of thy plague."
en,KJV,Mark,Mark,40,Mark.5,Mark 5,4,Mark.5.35,Mark 5:35,34,"While he yet spake, there came from the ruler of the synagogue's house certain which said, Thy daughter is dead: why troublest thou the Master any further?"
en,KJV,Mark,Mark,40,Mark.5,Mark 5,4,Mark.5.36,Mark 5:36,35,"As soon as Jesus heard the word that was spoken, he saith unto the ruler of the synagogue, Be not afraid, only believe."
en,KJV,Mark,Mark,40,Mark.5,Mark 5,4,Mark.5.37,Mark 5:37,36,"And he suffered no man to follow him, save Peter, and James, and John the brother of James."
en,KJV,Mark,Mark,40,Mark.5,Mark 5,4,Mark.5.38,Mark 5:38,37,"And he cometh to the house of the ruler of the synagogue, and seeth the tumult, and them that wept and wailed greatly."
en,KJV,Mark,Mark,40,Mark.5,Mark 5,4,Mark.5.39,Mark 5:39,38,"And when he was come in, he saith unto them, Why make ye this ado, and weep? the damsel is not dead, but sleepeth."
en,KJV,Mark,Mark,40,Mark.5,Mark 5,4,Mark.5.40,Mark 5:40,39,"And they laughed him to scorn. But when he had put them all out, he taketh the father and the mother of the damsel, and them that were with him, and entereth in where the damsel was lying."
en,KJV,Mark,Mark,40,Mark.5,Mark 5,4,Mark.5.41,Mark 5:41,40,"And he took the damsel by the hand, and said unto her, Talitha cumi; which is, being interpreted, Damsel, I say unto thee, arise."
en,KJV,Mark,Mark,40,Mark.5,Mark 5,4,Mark.5.42,Mark 5:42,41,"And straightway the damsel arose, and walked; for she was of the age of twelve years. And they were astonished with a great astonishment."
en,KJV,Mark,Mark,40,Mark.5,Mark 5,4,Mark.5.43,Mark 5:43,42,And he charged them straitly that no man should know it; and commanded that something should be given her to eat.
en,KJV,Mark,Mark,40,Mark.6,Mark 6,5,Mark.6.1,Mark 6:1,0,"And he went out from thence, and came into his own country; and his disciples follow him."
en,KJV,Mark,Mark,40,Mark.6,Mark 6,5,Mark.6.2,Mark 6:2,1,"And when the sabbath day was come, he began to teach in the synagogue: and many hearing him were astonished, saying, From whence hath this man these things? and what wisdom is this which is given unto him, that even such mighty works are wrought by his hands?"
en,KJV,Mark,Mark,40,Mark.6,Mark 6,5,Mark.6.3,Mark 6:3,2,"Is not this the carpenter, the son of Mary, the brother of James, and Joses, and of Juda, and Simon? and are not his sisters here with us? And they were offended at him."
en,KJV,Mark,Mark,40,Mark.6,Mark 6,5,Mark.6.4,Mark 6:4,3,"But Jesus, said unto them, A prophet is not without honour, but in his own country, and among his own kin, and in his own house."
en,KJV,Mark,Mark,40,Mark.6,Mark 6,5,Mark.6.5,Mark 6:5,4,"And he could there do no mighty work, save that he laid his hands upon a few sick folk, and healed them."
en,KJV,Mark,Mark,40,Mark.6,Mark 6,5,Mark.6.6,Mark 6:6,5,"And he marvelled because of their unbelief. And he went round about the villages, teaching."
en,KJV,Mark,Mark,40,Mark.6,Mark 6,5,Mark.6.7,Mark 6:7,6,"And he called unto him the twelve, and began to send them forth by two and two; and gave them power over unclean spirits;"
en,KJV,Mark,Mark,40,Mark.6,Mark 6,5,Mark.6.8,Mark 6:8,7,"And commanded them that they should take nothing for their journey, save a staff only; no scrip, no bread, no money in their purse:"
en,KJV,Mark,Mark,40,Mark.6,Mark 6,5,Mark.6.9,Mark 6:9,8,But be shod with sandals; and not put on two coats.
en,KJV,Mark,Mark,40,Mark.6,Mark 6,5,Mark.6.10,Mark 6:10,9,"And he said unto them, In what place soever ye enter into an house, there abide till ye depart from that place."
en,KJV,Mark,Mark,40,Mark.6,Mark 6,5,Mark.6.11,Mark 6:11,10,"And whosoever shall not receive you, nor hear you, when ye depart thence, shake off the dust under your feet for a testimony against them. Verily I say unto you, It shall be more tolerable for Sodom and Gomorrha in the day of judgment, than for that city."
en,KJV,Mark,Mark,40,Mark.6,Mark 6,5,Mark.6.12,Mark 6:12,11,"And they went out, and preached that men should repent."
en,KJV,Mark,Mark,40,Mark.6,Mark 6,5,Mark.6.13,Mark 6:13,12,"And they cast out many devils, and anointed with oil many that were sick, and healed them."
en,KJV,Mark,Mark,40,Mark.6,Mark 6,5,Mark.6.14,Mark 6:14,13,"And king Herod heard of him; (for his name was spread abroad:) and he said, That John the Baptist was risen from the dead, and therefore mighty works do shew forth themselves in him."
en,KJV,Mark,Mark,40,Mark.6,Mark 6,5,Mark.6.15,Mark 6:15,14,"Others said, That it is Elias. And others said, That it is a prophet, or as one of the prophets."
en,KJV,Mark,Mark,40,Mark.6,Mark 6,5,Mark.6.16,Mark 6:16,15,"But when Herod heard thereof, he said, It is John, whom I beheaded: he is risen from the dead."
en,KJV,Mark,Mark,40,Mark.6,Mark 6,5,Mark.6.17,Mark 6:17,16,"For Herod himself had sent forth and laid hold upon John, and bound him in prison for Herodias' sake, his brother Philip's wife: for he had married her."
en,KJV,Mark,Mark,40,Mark.6,Mark 6,5,Mark.6.18,Mark 6:18,17,"For John had said unto Herod, It is not lawful for thee to have thy brother's wife."
en,KJV,Mark,Mark,40,Mark.6,Mark 6,5,Mark.6.19,Mark 6:19,18,"Therefore Herodias had a quarrel against him, and would have killed him; but she could not:"
en,KJV,Mark,Mark,40,Mark.6,Mark 6,5,Mark.6.20,Mark 6:20,19,"For Herod feared John, knowing that he was a just man and an holy, and observed him; and when he heard him, he did many things, and heard him gladly."
en,KJV,Mark,Mark,40,Mark.6,Mark 6,5,Mark.6.21,Mark 6:21,20,"And when a convenient day was come, that Herod on his birthday made a supper to his lords, high captains, and chief estates of Galilee;"
en,KJV,Mark,Mark,40,Mark.6,Mark 6,5,Mark.6.22,Mark 6:22,21,"And when the daughter of the said Herodias came in, and danced, and pleased Herod and them that sat with him, the king said unto the damsel, Ask of me whatsoever thou wilt, and I will give it thee."
en,KJV,Mark,Mark,40,Mark.6,Mark 6,5,Mark.6.23,Mark 6:23,22,"And he sware unto her, Whatsoever thou shalt ask of me, I will give it thee, unto the half of my kingdom."
en,KJV,Mark,Mark,40,Mark.6,Mark 6,5,Mark.6.24,Mark 6:24,23,"And she went forth, and said unto her mother, What shall I ask? And she said, The head of John the Baptist."
en,KJV,Mark,Mark,40,Mark.6,Mark 6,5,Mark.6.25,Mark 6:25,24,"And she came in straightway with haste unto the king, and asked, saying, I will that thou give me by and by in a charger the head of John the Baptist."
en,KJV,Mark,Mark,40,Mark.6,Mark 6,5,Mark.6.26,Mark 6:26,25,"And the king was exceeding sorry; yet for his oath's sake, and for their sakes which sat with him, he would not reject her."
en,KJV,Mark,Mark,40,Mark.6,Mark 6,5,Mark.6.27,Mark 6:27,26,"And immediately the king sent an executioner, and commanded his head to be brought: and he went and beheaded him in the prison,"
en,KJV,Mark,Mark,40,Mark.6,Mark 6,5,Mark.6.28,Mark 6:28,27,"And brought his head in a charger, and gave it to the damsel: and the damsel gave it to her mother."
en,KJV,Mark,Mark,40,Mark.6,Mark 6,5,Mark.6.29,Mark 6:29,28,"And when his disciples heard of it, they came and took up his corpse, and laid it in a tomb."
en,KJV,Mark,Mark,40,Mark.6,Mark 6,5,Mark.6.30,Mark 6:30,29,"And the apostles gathered themselves together unto Jesus, and told him all things, both what they had done, and what they had taught."
en,KJV,Mark,Mark,40,Mark.6,Mark 6,5,Mark.6.31,Mark 6:31,30,"And he said unto them, Come ye yourselves apart into a desert place, and rest a while: for there were many coming and going, and they had no leisure so much as to eat."
en,KJV,Mark,Mark,40,Mark.6,Mark 6,5,Mark.6.32,Mark 6:32,31,And they departed into a desert place by ship privately.
en,KJV,Mark,Mark,40,Mark.6,Mark 6,5,Mark.6.33,Mark 6:33,32,"And the people saw them departing, and many knew him, and ran afoot thither out of all cities, and outwent them, and came together unto him."
en,KJV,Mark,Mark,40,Mark.6,Mark 6,5,Mark.6.34,Mark 6:34,33,"And Jesus, when he came out, saw much people, and was moved with compassion toward them, because they were as sheep not having a shepherd: and he began to teach them many things."
en,KJV,Mark,Mark,40,Mark.6,Mark 6,5,Mark.6.35,Mark 6:35,34,"And when the day was now far spent, his disciples came unto him, and said, This is a desert place, and now the time is far passed:"
en,KJV,Mark,Mark,40,Mark.6,Mark 6,5,Mark.6.36,Mark 6:36,35,"Send them away, that they may go into the country round about, and into the villages, and buy themselves bread: for they have nothing to eat."
en,KJV,Mark,Mark,40,Mark.6,Mark 6,5,Mark.6.37,Mark 6:37,36,"He answered and said unto them, Give ye them to eat. And they say unto him, Shall we go and buy two hundred pennyworth of bread, and give them to eat?"
en,KJV,Mark,Mark,40,Mark.6,Mark 6,5,Mark.6.38,Mark 6:38,37,"He saith unto them, How many loaves have ye? go and see. And when they knew, they say, Five, and two fishes."
en,KJV,Mark,Mark,40,Mark.6,Mark 6,5,Mark.6.39,Mark 6:39,38,And he commanded them to make all sit down by companies upon the green grass.
en,KJV,Mark,Mark,40,Mark.6,Mark 6,5,Mark.6.40,Mark 6:40,39,"And they sat down in ranks, by hundreds, and by fifties."
en,KJV,Mark,Mark,40,Mark.6,Mark 6,5,Mark.6.41,Mark 6:41,40,"And when he had taken the five loaves and the two fishes, he looked up to heaven, and blessed, and brake the loaves, and gave them to his disciples to set before them; and the two fishes divided he among them all."
en,KJV,Mark,Mark,40,Mark.6,Mark 6,5,Mark.6.42,Mark 6:42,41,"And they did all eat, and were filled."
en,KJV,Mark,Mark,40,Mark.6,Mark 6,5,Mark.6.43,Mark 6:43,42,"And they took up twelve baskets full of the fragments, and of the fishes."
en,KJV,Mark,Mark,40,Mark.6,Mark 6,5,Mark.6.44,Mark 6:44,43,And they that did eat of the loaves were about five thousand men.
en,KJV,Mark,Mark,40,Mark.6,Mark 6,5,Mark.6.45,Mark 6:45,44,"And straightway he constrained his disciples to get into the ship, and to go to the other side before unto Bethsaida, while he sent away the people."
en,KJV,Mark,Mark,40,Mark.6,Mark 6,5,Mark.6.46,Mark 6:46,45,"And when he had sent them away, he departed into a mountain to pray."
en,KJV,Mark,Mark,40,Mark.6,Mark 6,5,Mark.6.47,Mark 6:47,46,"And when even was come, the ship was in the midst of the sea, and he alone on the land."
en,KJV,Mark,Mark,40,Mark.6,Mark 6,5,Mark.6.48,Mark 6:48,47,"And he saw them toiling in rowing; for the wind was contrary unto them: and about the fourth watch of the night he cometh unto them, walking upon the sea, and would have passed by them."
en,KJV,Mark,Mark,40,Mark.6,Mark 6,5,Mark.6.49,Mark 6:49,48,"But when they saw him walking upon the sea, they supposed it had been a spirit, and cried out:"
en,KJV,Mark,Mark,40,Mark.6,Mark 6,5,Mark.6.50,Mark 6:50,49,"For they all saw him, and were troubled. And immediately he talked with them, and saith unto them, Be of good cheer: it is I; be not afraid."
en,KJV,Mark,Mark,40,Mark.6,Mark 6,5,Mark.6.51,Mark 6:51,50,"And he went up unto them into the ship; and the wind ceased: and they were sore amazed in themselves beyond measure, and wondered."
en,KJV,Mark,Mark,40,Mark.6,Mark 6,5,Mark.6.52,Mark 6:52,51,For they considered not the miracle of the loaves: for their heart was hardened.
en,KJV,Mark,Mark,40,Mark.6,Mark 6,5,Mark.6.53,Mark 6:53,52,"And when they had passed over, they came into the land of Gennesaret, and drew to the shore."
en,KJV,Mark,Mark,40,Mark.6,Mark 6,5,Mark.6.54,Mark 6:54,53,"And when they were come out of the ship, straightway they knew him,"
en,KJV,Mark,Mark,40,Mark.6,Mark 6,5,Mark.6.55,Mark 6:55,54,"And ran through that whole region round about, and began to carry about in beds those that were sick, where they heard he was."
en,KJV,Mark,Mark,40,Mark.6,Mark 6,5,Mark.6.56,Mark 6:56,55,"And whithersoever he entered, into villages, or cities, or country, they laid the sick in the streets, and besought him that they might touch if it were but the border of his garment: and as many as touched him were made whole."
en,KJV,Mark,Mark,40,Mark.7,Mark 7,6,Mark.7.1,Mark 7:1,0,"Then came together unto him the Pharisees, and certain of the scribes, which came from Jerusalem."
en,KJV,Mark,Mark,40,Mark.7,Mark 7,6,Mark.7.2,Mark 7:2,1,"And when they saw some of his disciples eat bread with defiled, that is to say, with unwashen, hands, they found fault."
en,KJV,Mark,Mark,40,Mark.7,Mark 7,6,Mark.7.3,Mark 7:3,2,"For the Pharisees, and all the Jews, except they wash their hands oft, eat not, holding the tradition of the elders."
en,KJV,Mark,Mark,40,Mark.7,Mark 7,6,Mark.7.4,Mark 7:4,3,"And when they come from the market, except they wash, they eat not. And many other things there be, which they have received to hold, as the washing of cups, and pots, brasen vessels, and of tables."
en,KJV,Mark,Mark,40,Mark.7,Mark 7,6,Mark.7.5,Mark 7:5,4,"Then the Pharisees and scribes asked him, Why walk not thy disciples according to the tradition of the elders, but eat bread with unwashen hands?"
en,KJV,Mark,Mark,40,Mark.7,Mark 7,6,Mark.7.6,Mark 7:6,5,"He answered and said unto them, Well hath Esaias prophesied of you hypocrites, as it is written, This people honoureth me with their lips, but their heart is far from me."
en,KJV,Mark,Mark,40,Mark.7,Mark 7,6,Mark.7.7,Mark 7:7,6,"Howbeit in vain do they worship me, teaching for doctrines the commandments of men."
en,KJV,Mark,Mark,40,Mark.7,Mark 7,6,Mark.7.8,Mark 7:8,7,"For laying aside the commandment of God, ye hold the tradition of men, as the washing of pots and cups: and many other such like things ye do."
en,KJV,Mark,Mark,40,Mark.7,Mark 7,6,Mark.7.9,Mark 7:9,8,"And he said unto them, Full well ye reject the commandment of God, that ye may keep your own tradition."
en,KJV,Mark,Mark,40,Mark.7,Mark 7,6,Mark.7.10,Mark 7:10,9,"For Moses said, Honour thy father and thy mother; and, Whoso curseth father or mother, let him die the death:"
en,KJV,Mark,Mark,40,Mark.7,Mark 7,6,Mark.7.11,Mark 7:11,10,"But ye say, If a man shall say to his father or mother, It is Corban, that is to say, a gift, by whatsoever thou mightest be profited by me; he shall be free."
en,KJV,Mark,Mark,40,Mark.7,Mark 7,6,Mark.7.12,Mark 7:12,11,And ye suffer him no more to do ought for his father or his mother;
en,KJV,Mark,Mark,40,Mark.7,Mark 7,6,Mark.7.13,Mark 7:13,12,"Making the word of God of none effect through your tradition, which ye have delivered: and many such like things do ye."
en,KJV,Mark,Mark,40,Mark.7,Mark 7,6,Mark.7.14,Mark 7:14,13,"And when he had called all the people unto him, he said unto them, Hearken unto me every one of you, and understand:"
en,KJV,Mark,Mark,40,Mark.7,Mark 7,6,Mark.7.15,Mark 7:15,14,"There is nothing from without a man, that entering into him can defile him: but the things which come out of him, those are they that defile the man."
en,KJV,Mark,Mark,40,Mark.7,Mark 7,6,Mark.7.16,Mark 7:16,15,"If any man have ears to hear, let him hear."
en,KJV,Mark,Mark,40,Mark.7,Mark 7,6,Mark.7.17,Mark 7:17,16,"And when he was entered into the house from the people, his disciples asked him concerning the parable."
en,KJV,Mark,Mark,40,Mark.7,Mark 7,6,Mark.7.18,Mark 7:18,17,"And he saith unto them, Are ye so without understanding also? Do ye not perceive, that whatsoever thing from without entereth into the man, it cannot defile him;"
en,KJV,Mark,Mark,40,Mark.7,Mark 7,6,Mark.7.19,Mark 7:19,18,"Because it entereth not into his heart, but into the belly, and goeth out into the draught, purging all meats?"
en,KJV,Mark,Mark,40,Mark.7,Mark 7,6,Mark.7.20,Mark 7:20,19,"And he said, That which cometh out of the man, that defileth the man."
en,KJV,Mark,Mark,40,Mark.7,Mark 7,6,Mark.7.21,Mark 7:21,20,"For from within, out of the heart of men, proceed evil thoughts, adulteries, fornications, murders,"
en,KJV,Mark,Mark,40,Mark.7,Mark 7,6,Mark.7.22,Mark 7:22,21,"Thefts, covetousness, wickedness, deceit, lasciviousness, an evil eye, blasphemy, pride, foolishness:"
en,KJV,Mark,Mark,40,Mark.7,Mark 7,6,Mark.7.23,Mark 7:23,22,"All these evil things come from within, and defile the man."
en,KJV,Mark,Mark,40,Mark.7,Mark 7,6,Mark.7.24,Mark 7:24,23,"And from thence he arose, and went into the borders of Tyre and Sidon, and entered into an house, and would have no man know it: but he could not be hid."
en,KJV,Mark,Mark,40,Mark.7,Mark 7,6,Mark.7.25,Mark 7:25,24,"For a certain woman, whose young daughter had an unclean spirit, heard of him, and came and fell at his feet:"
en,KJV,Mark,Mark,40,Mark.7,Mark 7,6,Mark.7.26,Mark 7:26,25,"The woman was a Greek, a Syrophenician by nation; and she besought him that he would cast forth the devil out of her daughter."
en,KJV,Mark,Mark,40,Mark.7,Mark 7,6,Mark.7.27,Mark 7:27,26,"But Jesus said unto her, Let the children first be filled: for it is not meet to take the children's bread, and to cast it unto the dogs."
en,KJV,Mark,Mark,40,Mark.7,Mark 7,6,Mark.7.28,Mark 7:28,27,"And she answered and said unto him, Yes, Lord: yet the dogs under the table eat of the children's crumbs."
en,KJV,Mark,Mark,40,Mark.7,Mark 7,6,Mark.7.29,Mark 7:29,28,"And he said unto her, For this saying go thy way; the devil is gone out of thy daughter."
en,KJV,Mark,Mark,40,Mark.7,Mark 7,6,Mark.7.30,Mark 7:30,29,"And when she was come to her house, she found the devil gone out, and her daughter laid upon the bed."
en,KJV,Mark,Mark,40,Mark.7,Mark 7,6,Mark.7.31,Mark 7:31,30,"And again, departing from the coasts of Tyre and Sidon, he came unto the sea of Galilee, through the midst of the coasts of Decapolis."
en,KJV,Mark,Mark,40,Mark.7,Mark 7,6,Mark.7.32,Mark 7:32,31,"And they bring unto him one that was deaf, and had an impediment in his speech; and they beseech him to put his hand upon him."
en,KJV,Mark,Mark,40,Mark.7,Mark 7,6,Mark.7.33,Mark 7:33,32,"And he took him aside from the multitude, and put his fingers into his ears, and he spit, and touched his tongue;"
en,KJV,Mark,Mark,40,Mark.7,Mark 7,6,Mark.7.34,Mark 7:34,33,"And looking up to heaven, he sighed, and saith unto him, Ephphatha, that is, Be opened."
en,KJV,Mark,Mark,40,Mark.7,Mark 7,6,Mark.7.35,Mark 7:35,34,"And straightway his ears were opened, and the string of his tongue was loosed, and he spake plain."
en,KJV,Mark,Mark,40,Mark.7,Mark 7,6,Mark.7.36,Mark 7:36,35,"And he charged them that they should tell no man: but the more he charged them, so much the more a great deal they published it;"
en,KJV,Mark,Mark,40,Mark.7,Mark 7,6,Mark.7.37,Mark 7:37,36,"And were beyond measure astonished, saying, He hath done all things well: he maketh both the deaf to hear, and the dumb to speak."
en,KJV,Mark,Mark,40,Mark.8,Mark 8,7,Mark.8.1,Mark 8:1,0,"In those days the multitude being very great, and having nothing to eat, Jesus called his disciples unto him, and saith unto them,"
en,KJV,Mark,Mark,40,Mark.8,Mark 8,7,Mark.8.2,Mark 8:2,1,"I have compassion on the multitude, because they have now been with me three days, and have nothing to eat:"
en,KJV,Mark,Mark,40,Mark.8,Mark 8,7,Mark.8.3,Mark 8:3,2,"And if I send them away fasting to their own houses, they will faint by the way: for divers of them came from far."
en,KJV,Mark,Mark,40,Mark.8,Mark 8,7,Mark.8.4,Mark 8:4,3,"And his disciples answered him, From whence can a man satisfy these men with bread here in the wilderness?"
en,KJV,Mark,Mark,40,Mark.8,Mark 8,7,Mark.8.5,Mark 8:5,4,"And he asked them, How many loaves have ye? And they said, Seven."
en,KJV,Mark,Mark,40,Mark.8,Mark 8,7,Mark.8.6,Mark 8:6,5,"And he commanded the people to sit down on the ground: and he took the seven loaves, and gave thanks, and brake, and gave to his disciples to set before them; and they did set them before the people."
en,KJV,Mark,Mark,40,Mark.8,Mark 8,7,Mark.8.7,Mark 8:7,6,"And they had a few small fishes: and he blessed, and commanded to set them also before them."
