languageCode,code,bookOsisId,bookSblId,bookOrderIndex,chapterOsisId,chapterSblId,chapterOrderIndex,verseOsisId,verseSblId,verseOrderIndex,text
en,NIV,Ps,Ps,18,Ps.37,Ps 37,36,Ps.37.40,Ps 37:40,39,"The LORD helps them and delivers them; he delivers them from the wicked and saves them, because they take refuge in him."
en,NIV,Ps,Ps,18,Ps.38,Ps 38,37,Ps.38.1,Ps 38:1,0,"O LORD, do not rebuke me in your anger or discipline me in your wrath."
en,NIV,Ps,Ps,18,Ps.38,Ps 38,37,Ps.38.2,Ps 38:2,1,"For your arrows have pierced me, and your hand has come down upon me."
en,NIV,Ps,Ps,18,Ps.38,Ps 38,37,Ps.38.3,Ps 38:3,2,Because of your wrath there is no health in my body; my bones have no soundness because of my sin.
en,NIV,Ps,Ps,18,Ps.38,Ps 38,37,Ps.38.4,Ps 38:4,3,My guilt has overwhelmed me like a burden too heavy to bear.
en,NIV,Ps,Ps,18,Ps.38,Ps 38,37,Ps.38.5,Ps 38:5,4,My wounds fester and are loathsome because of my sinful folly.
en,NIV,Ps,Ps,18,Ps.38,Ps 38,37,Ps.38.6,Ps 38:6,5,I am bowed down and brought very low; all day long I go about mourning.
en,NIV,Ps,Ps,18,Ps.38,Ps 38,37,Ps.38.7,Ps 38:7,6,My back is filled with searing pain; there is no health in my body.
en,NIV,Ps,Ps,18,Ps.38,Ps 38,37,Ps.38.8,Ps 38:8,7,I am feeble and utterly crushed; I groan in anguish of heart.
en,NIV,Ps,Ps,18,Ps.38,Ps 38,37,Ps.38.9,Ps 38:9,8,"All my longings lie open before you, O Lord; my sighing is not hidden from you."
en,NIV,Ps,Ps,18,Ps.38,Ps 38,37,Ps.38.10,Ps 38:10,9,"My heart pounds, my strength fails me; even the light has gone from my eyes."
en,NIV,Ps,Ps,18,Ps.38,Ps 38,37,Ps.38.11,Ps 38:11,10,My friends and companions avoid me because of my wounds; my neighbors stay far away.
en,NIV,Ps,Ps,18,Ps.38,Ps 38,37,Ps.38.12,Ps 38:12,11,"Those who seek my life set their traps, those who would harm me talk of my ruin; all day long they plot deception."
en,NIV,Ps,Ps,18,Ps.38,Ps 38,37,Ps.38.13,Ps 38:13,12,"I am like a deaf man, who cannot hear, like a mute, who cannot open his mouth;"
en,NIV,Ps,Ps,18,Ps.38,Ps 38,37,Ps.38.14,Ps 38:14,13,"I have become like a man who does not hear, whose mouth can offer no reply."
en,NIV,Ps,Ps,18,Ps.38,Ps 38,37,Ps.38.15,Ps 38:15,14,"I wait for you, O LORD; you will answer, O Lord my God."
en,NIV,Ps,Ps,18,Ps.38,Ps 38,37,Ps.38.16,Ps 38:16,15,"For I said, ""Do not let them gloat or exalt themselves over me when my foot slips."""
en,NIV,Ps,Ps,18,Ps.38,Ps 38,37,Ps.38.17,Ps 38:17,16,"For I am about to fall, and my pain is ever with me."
en,NIV,Ps,Ps,18,Ps.38,Ps 38,37,Ps.38.18,Ps 38:18,17,I confess my iniquity; I am troubled by my sin.
en,NIV,Ps,Ps,18,Ps.38,Ps 38,37,Ps.38.19,Ps 38:19,18,Many are those who are my vigorous enemies; those who hate me without reason are numerous.
en,NIV,Ps,Ps,18,Ps.38,Ps 38,37,Ps.38.20,Ps 38:20,19,Those who repay my good with evil slander me when I pursue what is good.
en,NIV,Ps,Ps,18,Ps.38,Ps 38,37,Ps.38.21,Ps 38:21,20,"O LORD, do not forsake me; be not far from me, O my God."
en,NIV,Ps,Ps,18,Ps.38,Ps 38,37,Ps.38.22,Ps 38:22,21,"Come quickly to help me, O Lord my Savior."
en,NIV,Ps,Ps,18,Ps.39,Ps 39,38,Ps.39.1,Ps 39:1,0,"I said, ""I will watch my ways and keep my tongue from sin; I will put a muzzle on my mouth as long as the wicked are in my presence."""
en,NIV,Ps,Ps,18,Ps.39,Ps 39,38,Ps.39.2,Ps 39:2,1,"But when I was silent and still, not even saying anything good, my anguish increased."
en,NIV,Ps,Ps,18,Ps.39,Ps 39,38,Ps.39.3,Ps 39:3,2,"My heart grew hot within me, and as I meditated, the fire burned; then I spoke with my tongue:"
en,NIV,Ps,Ps,18,Ps.39,Ps 39,38,Ps.39.4,Ps 39:4,3,"""Show me, O LORD, my life's end and the number of my days; let me know how fleeting is my life."
en,NIV,Ps,Ps,18,Ps.39,Ps 39,38,Ps.39.5,Ps 39:5,4,You have made my days a mere handbreadth; the span of my years is as nothing before you. Each man's life is but a breath. Selah
en,NIV,Ps,Ps,18,Ps.39,Ps 39,38,Ps.39.6,Ps 39:6,5,"Man is a mere phantom as he goes to and fro: He bustles about, but only in vain; he heaps up wealth, not knowing who will get it."
en,NIV,Ps,Ps,18,Ps.39,Ps 39,38,Ps.39.7,Ps 39:7,6,"""But now, Lord, what do I look for? My hope is in you."
en,NIV,Ps,Ps,18,Ps.39,Ps 39,38,Ps.39.8,Ps 39:8,7,Save me from all my transgressions; do not make me the scorn of fools.
en,NIV,Ps,Ps,18,Ps.39,Ps 39,38,Ps.39.9,Ps 39:9,8,"I was silent; I would not open my mouth, for you are the one who has done this."
en,NIV,Ps,Ps,18,Ps.39,Ps 39,38,Ps.39.10,Ps 39:10,9,Remove your scourge from me; I am overcome by the blow of your hand.
en,NIV,Ps,Ps,18,Ps.39,Ps 39,38,Ps.39.11,Ps 39:11,10,You rebuke and discipline men for their sin; you consume their wealth like a moth- each man is but a breath. Selah
en,NIV,Ps,Ps,18,Ps.39,Ps 39,38,Ps.39.12,Ps 39:12,11,"""Hear my prayer, O LORD, listen to my cry for help; be not deaf to my weeping. For I dwell with you as an alien, a stranger, as all my fathers were."
en,NIV,Ps,Ps,18,Ps.39,Ps 39,38,Ps.39.13,Ps 39:13,12,"Look away from me, that I may rejoice again before I depart and am no more."""
en,NIV,Ps,Ps,18,Ps.40,Ps 40,39,Ps.40.1,Ps 40:1,0,I waited patiently for the LORD; he turned to me and heard my cry.
en,NIV,Ps,Ps,18,Ps.40,Ps 40,39,Ps.40.2,Ps 40:2,1,"He lifted me out of the slimy pit, out of the mud and mire; he set my feet on a rock and gave me a firm place to stand."
en,NIV,Ps,Ps,18,Ps.40,Ps 40,39,Ps.40.3,Ps 40:3,2,"He put a new song in my mouth, a hymn of praise to our God. Many will see and fear and put their trust in the LORD."
en,NIV,Ps,Ps,18,Ps.40,Ps 40,39,Ps.40.4,Ps 40:4,3,"Blessed is the man who makes the LORD his trust, who does not look to the proud, to those who turn aside to false gods."
en,NIV,Ps,Ps,18,Ps.40,Ps 40,39,Ps.40.5,Ps 40:5,4,"Many, O LORD my God, are the wonders you have done. The things you planned for us no one can recount to you; were I to speak and tell of them, they would be too many to declare."
en,NIV,Ps,Ps,18,Ps.40,Ps 40,39,Ps.40.6,Ps 40:6,5,"Sacrifice and offering you did not desire, but my ears you have pierced,; burnt offerings and sin offerings you did not require."
en,NIV,Ps,Ps,18,Ps.40,Ps 40,39,Ps.40.7,Ps 40:7,6,"Then I said, ""Here I am, I have come- it is written about me in the scroll."
en,NIV,Ps,Ps,18,Ps.40,Ps 40,39,Ps.40.8,Ps 40:8,7,"I desire to do your will, O my God; your law is within my heart."""
en,NIV,Ps,Ps,18,Ps.40,Ps 40,39,Ps.40.9,Ps 40:9,8,"I proclaim righteousness in the great assembly; I do not seal my lips, as you know, O LORD."
en,NIV,Ps,Ps,18,Ps.40,Ps 40,39,Ps.40.10,Ps 40:10,9,I do not hide your righteousness in my heart; I speak of your faithfulness and salvation. I do not conceal your love and your truth from the great assembly.
en,NIV,Ps,Ps,18,Ps.40,Ps 40,39,Ps.40.11,Ps 40:11,10,"Do not withhold your mercy from me, O LORD; may your love and your truth always protect me."
en,NIV,Ps,Ps,18,Ps.40,Ps 40,39,Ps.40.12,Ps 40:12,11,"For troubles without number surround me; my sins have overtaken me, and I cannot see. They are more than the hairs of my head, and my heart fails within me."
en,NIV,Ps,Ps,18,Ps.40,Ps 40,39,Ps.40.13,Ps 40:13,12,"Be pleased, O LORD, to save me; O LORD, come quickly to help me."
en,NIV,Ps,Ps,18,Ps.40,Ps 40,39,Ps.40.14,Ps 40:14,13,May all who seek to take my life be put to shame and confusion; may all who desire my ruin be turned back in disgrace.
en,NIV,Ps,Ps,18,Ps.40,Ps 40,39,Ps.40.15,Ps 40:15,14,"May those who say to me, ""Aha! Aha!"" be appalled at their own shame."
en,NIV,Ps,Ps,18,Ps.40,Ps 40,39,Ps.40.16,Ps 40:16,15,"But may all who seek you rejoice and be glad in you; may those who love your salvation always say, ""The LORD be exalted!"""
en,NIV,Ps,Ps,18,Ps.40,Ps 40,39,Ps.40.17,Ps 40:17,16,"Yet I am poor and needy; may the Lord think of me. You are my help and my deliverer; O my God, do not delay."
en,NIV,Ps,Ps,18,Ps.41,Ps 41,40,Ps.41.1,Ps 41:1,0,Blessed is he who has regard for the weak; the LORD delivers him in times of trouble.
en,NIV,Ps,Ps,18,Ps.41,Ps 41,40,Ps.41.2,Ps 41:2,1,The LORD will protect him and preserve his life; he will bless him in the land and not surrender him to the desire of his foes.
en,NIV,Ps,Ps,18,Ps.41,Ps 41,40,Ps.41.3,Ps 41:3,2,The LORD will sustain him on his sickbed and restore him from his bed of illness.
en,NIV,Ps,Ps,18,Ps.41,Ps 41,40,Ps.41.4,Ps 41:4,3,"I said, ""O LORD, have mercy on me; heal me, for I have sinned against you."""
en,NIV,Ps,Ps,18,Ps.41,Ps 41,40,Ps.41.5,Ps 41:5,4,"My enemies say of me in malice, ""When will he die and his name perish?"""
en,NIV,Ps,Ps,18,Ps.41,Ps 41,40,Ps.41.6,Ps 41:6,5,"Whenever one comes to see me, he speaks falsely, while his heart gathers slander; then he goes out and spreads it abroad."
en,NIV,Ps,Ps,18,Ps.41,Ps 41,40,Ps.41.7,Ps 41:7,6,"All my enemies whisper together against me; they imagine the worst for me, saying,"
en,NIV,Ps,Ps,18,Ps.41,Ps 41,40,Ps.41.8,Ps 41:8,7,"""A vile disease has beset him; he will never get up from the place where he lies."""
en,NIV,Ps,Ps,18,Ps.41,Ps 41,40,Ps.41.9,Ps 41:9,8,"Even my close friend, whom I trusted, he who shared my bread, has lifted up his heel against me."
en,NIV,Ps,Ps,18,Ps.41,Ps 41,40,Ps.41.10,Ps 41:10,9,"But you, O LORD, have mercy on me; raise me up, that I may repay them."
en,NIV,Ps,Ps,18,Ps.41,Ps 41,40,Ps.41.11,Ps 41:11,10,"I know that you are pleased with me, for my enemy does not triumph over me."
en,NIV,Ps,Ps,18,Ps.41,Ps 41,40,Ps.41.12,Ps 41:12,11,In my integrity you uphold me and set me in your presence forever.
en,NIV,Ps,Ps,18,Ps.41,Ps 41,40,Ps.41.13,Ps 41:13,12,"Praise be to the LORD, the God of Israel, from everlasting to everlasting. Amen and Amen."
en,NIV,Ps,Ps,18,Ps.42,Ps 42,41,Ps.42.1,Ps 42:1,0,"As the deer pants for streams of water, so my soul pants for you, O God."
en,NIV,Ps,Ps,18,Ps.42,Ps 42,41,Ps.42.2,Ps 42:2,1,"My soul thirsts for God, for the living God. When can I go and meet with God?"
en,NIV,Ps,Ps,18,Ps.42,Ps 42,41,Ps.42.3,Ps 42:3,2,"My tears have been my food day and night, while men say to me all day long, ""Where is your God?"""
en,NIV,Ps,Ps,18,Ps.42,Ps 42,41,Ps.42.4,Ps 42:4,3,"These things I remember as I pour out my soul: how I used to go with the multitude, leading the procession to the house of God, with shouts of joy and thanksgiving among the festive throng."
en,NIV,Ps,Ps,18,Ps.42,Ps 42,41,Ps.42.5,Ps 42:5,4,"Why are you downcast, O my soul? Why so disturbed within me? Put your hope in God, for I will yet praise him, my Savior and"
en,NIV,Ps,Ps,18,Ps.42,Ps 42,41,Ps.42.6,Ps 42:6,5,"my God. My soul is downcast within me; therefore I will remember you from the land of the Jordan, the heights of Hermon-from Mount Mizar."
en,NIV,Ps,Ps,18,Ps.42,Ps 42,41,Ps.42.7,Ps 42:7,6,Deep calls to deep in the roar of your waterfalls; all your waves and breakers have swept over me.
en,NIV,Ps,Ps,18,Ps.42,Ps 42,41,Ps.42.8,Ps 42:8,7,"By day the LORD directs his love, at night his song is with me- a prayer to the God of my life."
en,NIV,Ps,Ps,18,Ps.42,Ps 42,41,Ps.42.9,Ps 42:9,8,"I say to God my Rock, ""Why have you forgotten me? Why must I go about mourning, oppressed by the enemy?"""
en,NIV,Ps,Ps,18,Ps.42,Ps 42,41,Ps.42.10,Ps 42:10,9,"My bones suffer mortal agony as my foes taunt me, saying to me all day long, ""Where is your God?"""
en,NIV,Ps,Ps,18,Ps.42,Ps 42,41,Ps.42.11,Ps 42:11,10,"Why are you downcast, O my soul? Why so disturbed within me? Put your hope in God, for I will yet praise him, my Savior and my God."
en,NIV,Ps,Ps,18,Ps.43,Ps 43,42,Ps.43.1,Ps 43:1,0,"Vindicate me, O God, and plead my cause against an ungodly nation; rescue me from deceitful and wicked men."
en,NIV,Ps,Ps,18,Ps.43,Ps 43,42,Ps.43.2,Ps 43:2,1,"You are God my stronghold. Why have you rejected me? Why must I go about mourning, oppressed by the enemy?"
en,NIV,Ps,Ps,18,Ps.43,Ps 43,42,Ps.43.3,Ps 43:3,2,"Send forth your light and your truth, let them guide me; let them bring me to your holy mountain, to the place where you dwell."
en,NIV,Ps,Ps,18,Ps.43,Ps 43,42,Ps.43.4,Ps 43:4,3,"Then will I go to the altar of God, to God, my joy and my delight. I will praise you with the harp, O God, my God."
en,NIV,Ps,Ps,18,Ps.43,Ps 43,42,Ps.43.5,Ps 43:5,4,"Why are you downcast, O my soul? Why so disturbed within me? Put your hope in God, for I will yet praise him, my Savior and my God."
en,NIV,Ps,Ps,18,Ps.44,Ps 44,43,Ps.44.1,Ps 44:1,0,"We have heard with our ears, O God; our fathers have told us what you did in their days, in days long ago."
en,NIV,Ps,Ps,18,Ps.44,Ps 44,43,Ps.44.2,Ps 44:2,1,With your hand you drove out the nations and planted our fathers; you crushed the peoples and made our fathers flourish.
en,NIV,Ps,Ps,18,Ps.44,Ps 44,43,Ps.44.3,Ps 44:3,2,"It was not by their sword that they won the land, nor did their arm bring them victory; it was your right hand, your arm, and the light of your face, for you loved them."
en,NIV,Ps,Ps,18,Ps.44,Ps 44,43,Ps.44.4,Ps 44:4,3,"You are my King and my God, who decrees victories for Jacob."
en,NIV,Ps,Ps,18,Ps.44,Ps 44,43,Ps.44.5,Ps 44:5,4,Through you we push back our enemies; through your name we trample our foes.
en,NIV,Ps,Ps,18,Ps.44,Ps 44,43,Ps.44.6,Ps 44:6,5,"I do not trust in my bow, my sword does not bring me victory;"
en,NIV,Ps,Ps,18,Ps.44,Ps 44,43,Ps.44.7,Ps 44:7,6,"but you give us victory over our enemies, you put our adversaries to shame."
en,NIV,Ps,Ps,18,Ps.44,Ps 44,43,Ps.44.8,Ps 44:8,7,"In God we make our boast all day long, and we will praise your name forever. Selah"
en,NIV,Ps,Ps,18,Ps.44,Ps 44,43,Ps.44.9,Ps 44:9,8,But now you have rejected and humbled us; you no longer go out with our armies.
en,NIV,Ps,Ps,18,Ps.44,Ps 44,43,Ps.44.10,Ps 44:10,9,"You made us retreat before the enemy, and our adversaries have plundered us."
en,NIV,Ps,Ps,18,Ps.44,Ps 44,43,Ps.44.11,Ps 44:11,10,You gave us up to be devoured like sheep and have scattered us among the nations.
en,NIV,Ps,Ps,18,Ps.44,Ps 44,43,Ps.44.12,Ps 44:12,11,"You sold your people for a pittance, gaining nothing from their sale."
en,NIV,Ps,Ps,18,Ps.44,Ps 44,43,Ps.44.13,Ps 44:13,12,"You have made us a reproach to our neighbors, the scorn and derision of those around us."
en,NIV,Ps,Ps,18,Ps.44,Ps 44,43,Ps.44.14,Ps 44:14,13,You have made us a byword among the nations; the peoples shake their heads at us.
en,NIV,Ps,Ps,18,Ps.44,Ps 44,43,Ps.44.15,Ps 44:15,14,"My disgrace is before me all day long, and my face is covered with shame"
en,NIV,Ps,Ps,18,Ps.44,Ps 44,43,Ps.44.16,Ps 44:16,15,"at the taunts of those who reproach and revile me, because of the enemy, who is bent on revenge."
en,NIV,Ps,Ps,18,Ps.44,Ps 44,43,Ps.44.17,Ps 44:17,16,"All this happened to us, though we had not forgotten you or been false to your covenant."
en,NIV,Ps,Ps,18,Ps.44,Ps 44,43,Ps.44.18,Ps 44:18,17,Our hearts had not turned back; our feet had not strayed from your path.
en,NIV,Ps,Ps,18,Ps.44,Ps 44,43,Ps.44.19,Ps 44:19,18,But you crushed us and made us a haunt for jackals and covered us over with deep darkness.
en,NIV,Ps,Ps,18,Ps.44,Ps 44,43,Ps.44.20,Ps 44:20,19,"If we had forgotten the name of our God or spread out our hands to a foreign god,"
en,NIV,Ps,Ps,18,Ps.44,Ps 44,43,Ps.44.21,Ps 44:21,20,"would not God have discovered it, since he knows the secrets of the heart?"
en,NIV,Ps,Ps,18,Ps.44,Ps 44,43,Ps.44.22,Ps 44:22,21,Yet for your sake we face death all day long; we are considered as sheep to be slaughtered.
en,NIV,Ps,Ps,18,Ps.44,Ps 44,43,Ps.44.23,Ps 44:23,22,"Awake, O Lord! Why do you sleep? Rouse yourself! Do not reject us forever."
en,NIV,Ps,Ps,18,Ps.44,Ps 44,43,Ps.44.24,Ps 44:24,23,Why do you hide your face and forget our misery and oppression?
en,NIV,Ps,Ps,18,Ps.44,Ps 44,43,Ps.44.25,Ps 44:25,24,We are brought down to the dust; our bodies cling to the ground.
en,NIV,Ps,Ps,18,Ps.44,Ps 44,43,Ps.44.26,Ps 44:26,25,Rise up and help us; redeem us because of your unfailing love.
en,NIV,Ps,Ps,18,Ps.45,Ps 45,44,Ps.45.1,Ps 45:1,0,My heart is stirred by a noble theme as I recite my verses for the king; my tongue is the pen of a skillful writer.
en,NIV,Ps,Ps,18,Ps.45,Ps 45,44,Ps.45.2,Ps 45:2,1,"You are the most excellent of men and your lips have been anointed with grace, since God has blessed you forever."
en,NIV,Ps,Ps,18,Ps.45,Ps 45,44,Ps.45.3,Ps 45:3,2,"Gird your sword upon your side, O mighty one; clothe yourself with splendor and majesty."
en,NIV,Ps,Ps,18,Ps.45,Ps 45,44,Ps.45.4,Ps 45:4,3,"In your majesty ride forth victoriously in behalf of truth, humility and righteousness; let your right hand display awesome deeds."
en,NIV,Ps,Ps,18,Ps.45,Ps 45,44,Ps.45.5,Ps 45:5,4,Let your sharp arrows pierce the hearts of the king's enemies; let the nations fall beneath your feet.
en,NIV,Ps,Ps,18,Ps.45,Ps 45,44,Ps.45.6,Ps 45:6,5,"Your throne, O God, will last for ever and ever; a scepter of justice will be the scepter of your kingdom."
en,NIV,Ps,Ps,18,Ps.45,Ps 45,44,Ps.45.7,Ps 45:7,6,"You love righteousness and hate wickedness; therefore God, your God, has set you above your companions by anointing you with the oil of joy."
en,NIV,Ps,Ps,18,Ps.45,Ps 45,44,Ps.45.8,Ps 45:8,7,All your robes are fragrant with myrrh and aloes and cassia; from palaces adorned with ivory the music of the strings makes you glad.
en,NIV,Ps,Ps,18,Ps.45,Ps 45,44,Ps.45.9,Ps 45:9,8,Daughters of kings are among your honored women; at your right hand is the royal bride in gold of Ophir.
en,NIV,Ps,Ps,18,Ps.45,Ps 45,44,Ps.45.10,Ps 45:10,9,"Listen, O daughter, consider and give ear: Forget your people and your father's house."
en,NIV,Ps,Ps,18,Ps.45,Ps 45,44,Ps.45.11,Ps 45:11,10,"The king is enthralled by your beauty; honor him, for he is your lord."
en,NIV,Ps,Ps,18,Ps.45,Ps 45,44,Ps.45.12,Ps 45:12,11,"The Daughter of Tyre will come with a gift, men of wealth will seek your favor."
en,NIV,Ps,Ps,18,Ps.45,Ps 45,44,Ps.45.13,Ps 45:13,12,All glorious is the princess within her chamber; her gown is interwoven with gold.
en,NIV,Ps,Ps,18,Ps.45,Ps 45,44,Ps.45.14,Ps 45:14,13,In embroidered garments she is led to the king; her virgin companions follow her and are brought to you.
en,NIV,Ps,Ps,18,Ps.45,Ps 45,44,Ps.45.15,Ps 45:15,14,They are led in with joy and gladness; they enter the palace of the king.
en,NIV,Ps,Ps,18,Ps.45,Ps 45,44,Ps.45.16,Ps 45:16,15,Your sons will take the place of your fathers; you will make them princes throughout the land.
en,NIV,Ps,Ps,18,Ps.45,Ps 45,44,Ps.45.17,Ps 45:17,16,I will perpetuate your memory through all generations; therefore the nations will praise you for ever and ever.
en,NIV,Ps,Ps,18,Ps.46,Ps 46,45,Ps.46.1,Ps 46:1,0,"God is our refuge and strength, an ever-present help in trouble."
en,NIV,Ps,Ps,18,Ps.46,Ps 46,45,Ps.46.2,Ps 46:2,1,"Therefore we will not fear, though the earth give way and the mountains fall into the heart of the sea,"
en,NIV,Ps,Ps,18,Ps.46,Ps 46,45,Ps.46.3,Ps 46:3,2,though its waters roar and foam and the mountains quake with their surging. Selah
en,NIV,Ps,Ps,18,Ps.46,Ps 46,45,Ps.46.4,Ps 46:4,3,"There is a river whose streams make glad the city of God, the holy place where the Most High dwells."
en,NIV,Ps,Ps,18,Ps.46,Ps 46,45,Ps.46.5,Ps 46:5,4,"God is within her, she will not fall; God will help her at break of day."
en,NIV,Ps,Ps,18,Ps.46,Ps 46,45,Ps.46.6,Ps 46:6,5,"Nations are in uproar, kingdoms fall; he lifts his voice, the earth melts."
en,NIV,Ps,Ps,18,Ps.46,Ps 46,45,Ps.46.7,Ps 46:7,6,The LORD Almighty is with us; the God of Jacob is our fortress. Selah
en,NIV,Ps,Ps,18,Ps.46,Ps 46,45,Ps.46.8,Ps 46:8,7,"Come and see the works of the LORD, the desolations he has brought on the earth."
en,NIV,Ps,Ps,18,Ps.46,Ps 46,45,Ps.46.9,Ps 46:9,8,"He makes wars cease to the ends of the earth; he breaks the bow and shatters the spear, he burns the shields with fire."
en,NIV,Ps,Ps,18,Ps.46,Ps 46,45,Ps.46.10,Ps 46:10,9,"""Be still, and know that I am God; I will be exalted among the nations, I will be exalted in the earth."""
en,NIV,Ps,Ps,18,Ps.46,Ps 46,45,Ps.46.11,Ps 46:11,10,The LORD Almighty is with us; the God of Jacob is our fortress. Selah
en,NIV,Ps,Ps,18,Ps.47,Ps 47,46,Ps.47.1,Ps 47:1,0,"Clap your hands, all you nations; shout to God with cries of joy."
en,NIV,Ps,Ps,18,Ps.47,Ps 47,46,Ps.47.2,Ps 47:2,1,"How awesome is the LORD Most High, the great King over all the earth!"
en,NIV,Ps,Ps,18,Ps.47,Ps 47,46,Ps.47.3,Ps 47:3,2,"He subdued nations under us, peoples under our feet."
en,NIV,Ps,Ps,18,Ps.47,Ps 47,46,Ps.47.4,Ps 47:4,3,"He chose our inheritance for us, the pride of Jacob, whom he loved. Selah"
en,NIV,Ps,Ps,18,Ps.47,Ps 47,46,Ps.47.5,Ps 47:5,4,"God has ascended amid shouts of joy, the LORD amid the sounding of trumpets."
en,NIV,Ps,Ps,18,Ps.47,Ps 47,46,Ps.47.6,Ps 47:6,5,"Sing praises to God, sing praises; sing praises to our King, sing praises."
en,NIV,Ps,Ps,18,Ps.47,Ps 47,46,Ps.47.7,Ps 47:7,6,For God is the King of all the earth; sing to him a psalm of praise.
en,NIV,Ps,Ps,18,Ps.47,Ps 47,46,Ps.47.8,Ps 47:8,7,God reigns over the nations; God is seated on his holy throne.
en,NIV,Ps,Ps,18,Ps.47,Ps 47,46,Ps.47.9,Ps 47:9,8,"The nobles of the nations assemble as the people of the God of Abraham, for the kings of the earth belong to God; he is greatly exalted."
en,NIV,Ps,Ps,18,Ps.48,Ps 48,47,Ps.48.1,Ps 48:1,0,"Great is the LORD, and most worthy of praise, in the city of our God, his holy mountain."
en,NIV,Ps,Ps,18,Ps.48,Ps 48,47,Ps.48.2,Ps 48:2,1,"It is beautiful in its loftiness, the joy of the whole earth. Like the utmost heights of Zaphon is Mount Zion, the city of the Great King."
en,NIV,Ps,Ps,18,Ps.48,Ps 48,47,Ps.48.3,Ps 48:3,2,God is in her citadels; he has shown himself to be her fortress.
en,NIV,Ps,Ps,18,Ps.48,Ps 48,47,Ps.48.4,Ps 48:4,3,"When the kings joined forces, when they advanced together,"
en,NIV,Ps,Ps,18,Ps.48,Ps 48,47,Ps.48.5,Ps 48:5,4,they saw her and were astounded; they fled in terror.
en,NIV,Ps,Ps,18,Ps.48,Ps 48,47,Ps.48.6,Ps 48:6,5,"Trembling seized them there, pain like that of a woman in labor."
en,NIV,Ps,Ps,18,Ps.48,Ps 48,47,Ps.48.7,Ps 48:7,6,You destroyed them like ships of Tarshish shattered by an east wind.
en,NIV,Ps,Ps,18,Ps.48,Ps 48,47,Ps.48.8,Ps 48:8,7,"As we have heard, so have we seen in the city of the LORD Almighty, in the city of our God: God makes her secure forever. Selah"
en,NIV,Ps,Ps,18,Ps.48,Ps 48,47,Ps.48.9,Ps 48:9,8,"Within your temple, O God, we meditate on your unfailing love."
en,NIV,Ps,Ps,18,Ps.48,Ps 48,47,Ps.48.10,Ps 48:10,9,"Like your name, O God, your praise reaches to the ends of the earth; your right hand is filled with righteousness."
en,NIV,Ps,Ps,18,Ps.48,Ps 48,47,Ps.48.11,Ps 48:11,10,"Mount Zion rejoices, the villages of Judah are glad because of your judgments."
en,NIV,Ps,Ps,18,Ps.48,Ps 48,47,Ps.48.12,Ps 48:12,11,"Walk about Zion, go around her, count her towers,"
en,NIV,Ps,Ps,18,Ps.48,Ps 48,47,Ps.48.13,Ps 48:13,12,"consider well her ramparts, view her citadels, that you may tell of them to the next generation."
en,NIV,Ps,Ps,18,Ps.48,Ps 48,47,Ps.48.14,Ps 48:14,13,For this God is our God for ever and ever; he will be our guide even to the end.
en,NIV,Ps,Ps,18,Ps.49,Ps 49,48,Ps.49.1,Ps 49:1,0,"Hear this, all you peoples; listen, all who live in this world,"
en,NIV,Ps,Ps,18,Ps.49,Ps 49,48,Ps.49.2,Ps 49:2,1,"both low and high, rich and poor alike:"
en,NIV,Ps,Ps,18,Ps.49,Ps 49,48,Ps.49.3,Ps 49:3,2,My mouth will speak words of wisdom; the utterance from my heart will give understanding.
en,NIV,Ps,Ps,18,Ps.49,Ps 49,48,Ps.49.4,Ps 49:4,3,I will turn my ear to a proverb; with the harp I will expound my riddle:
en,NIV,Ps,Ps,18,Ps.49,Ps 49,48,Ps.49.5,Ps 49:5,4,"Why should I fear when evil days come, when wicked deceivers surround me-"
en,NIV,Ps,Ps,18,Ps.49,Ps 49,48,Ps.49.6,Ps 49:6,5,those who trust in their wealth and boast of their great riches?
en,NIV,Ps,Ps,18,Ps.49,Ps 49,48,Ps.49.7,Ps 49:7,6,No man can redeem the life of another or give to God a ransom for him-
en,NIV,Ps,Ps,18,Ps.49,Ps 49,48,Ps.49.8,Ps 49:8,7,"the ransom for a life is costly, no payment is ever enough-"
en,NIV,Ps,Ps,18,Ps.49,Ps 49,48,Ps.49.9,Ps 49:9,8,that he should live on forever and not see decay.
en,NIV,Ps,Ps,18,Ps.49,Ps 49,48,Ps.49.10,Ps 49:10,9,For all can see that wise men die; the foolish and the senseless alike perish and leave their wealth to others.
en,NIV,Ps,Ps,18,Ps.49,Ps 49,48,Ps.49.11,Ps 49:11,10,"Their tombs will remain their houses forever, their dwellings for endless generations, though they had named lands after themselves."
en,NIV,Ps,Ps,18,Ps.49,Ps 49,48,Ps.49.12,Ps 49:12,11,"But man, despite his riches, does not endure; he is like the beasts that perish."
en,NIV,Ps,Ps,18,Ps.49,Ps 49,48,Ps.49.13,Ps 49:13,12,"This is the fate of those who trust in themselves, and of their followers, who approve their sayings. Selah"
en,NIV,Ps,Ps,18,Ps.49,Ps 49,48,Ps.49.14,Ps 49:14,13,"Like sheep they are destined for the grave, and death will feed on them. The upright will rule over them in the morning; their forms will decay in the grave, far from their princely mansions."
en,NIV,Ps,Ps,18,Ps.49,Ps 49,48,Ps.49.15,Ps 49:15,14,But God will redeem my life from the grave; he will surely take me to himself. Selah
en,NIV,Ps,Ps,18,Ps.49,Ps 49,48,Ps.49.16,Ps 49:16,15,"Do not be overawed when a man grows rich, when the splendor of his house increases;"
en,NIV,Ps,Ps,18,Ps.49,Ps 49,48,Ps.49.17,Ps 49:17,16,"for he will take nothing with him when he dies, his splendor will not descend with him."
en,NIV,Ps,Ps,18,Ps.49,Ps 49,48,Ps.49.18,Ps 49:18,17,Though while he lived he counted himself blessed- and men praise you when you prosper-
en,NIV,Ps,Ps,18,Ps.49,Ps 49,48,Ps.49.19,Ps 49:19,18,"he will join the generation of his fathers, who will never see the light of life."
en,NIV,Ps,Ps,18,Ps.49,Ps 49,48,Ps.49.20,Ps 49:20,19,A man who has riches without understanding is like the beasts that perish.
en,NIV,Ps,Ps,18,Ps.50,Ps 50,49,Ps.50.1,Ps 50:1,0,"The Mighty One, God, the LORD, speaks and summons the earth from the rising of the sun to the place where it sets."
