languageCode,code,bookOsisId,bookSblId,bookOrderIndex,chapterOsisId,chapterSblId,chapterOrderIndex,verseOsisId,verseSblId,verseOrderIndex,text
en,NIV,Ps,Ps,18,Ps.73,Ps 73,72,Ps.73.16,Ps 73:16,15,"When I tried to understand all this, it was oppressive to me"
en,NIV,Ps,Ps,18,Ps.73,Ps 73,72,Ps.73.17,Ps 73:17,16,till I entered the sanctuary of God; then I understood their final destiny.
en,NIV,Ps,Ps,18,Ps.73,Ps 73,72,Ps.73.18,Ps 73:18,17,Surely you place them on slippery ground; you cast them down to ruin.
en,NIV,Ps,Ps,18,Ps.73,Ps 73,72,Ps.73.19,Ps 73:19,18,"How suddenly are they destroyed, completely swept away by terrors!"
en,NIV,Ps,Ps,18,Ps.73,Ps 73,72,Ps.73.20,Ps 73:20,19,"As a dream when one awakes, so when you arise, O Lord, you will despise them as fantasies."
en,NIV,Ps,Ps,18,Ps.73,Ps 73,72,Ps.73.21,Ps 73:21,20,"When my heart was grieved and my spirit embittered,"
en,NIV,Ps,Ps,18,Ps.73,Ps 73,72,Ps.73.22,Ps 73:22,21,I was senseless and ignorant; I was a brute beast before you.
en,NIV,Ps,Ps,18,Ps.73,Ps 73,72,Ps.73.23,Ps 73:23,22,Yet I am always with you; you hold me by my right hand.
en,NIV,Ps,Ps,18,Ps.73,Ps 73,72,Ps.73.24,Ps 73:24,23,"You guide me with your counsel, and afterward you will take me into glory."
en,NIV,Ps,Ps,18,Ps.73,Ps 73,72,Ps.73.25,Ps 73:25,24,Whom have I in heaven but you? And earth has nothing I desire besides you.
en,NIV,Ps,Ps,18,Ps.73,Ps 73,72,Ps.73.26,Ps 73:26,25,"My flesh and my heart may fail, but God is the strength of my heart and my portion forever."
en,NIV,Ps,Ps,18,Ps.73,Ps 73,72,Ps.73.27,Ps 73:27,26,Those who are far from you will perish; you destroy all who are unfaithful to you.
en,NIV,Ps,Ps,18,Ps.73,Ps 73,72,Ps.73.28,Ps 73:28,27,"But as for me, it is good to be near God. I have made the Sovereign LORD my refuge; I will tell of all your deeds."
en,NIV,Ps,Ps,18,Ps.74,Ps 74,73,Ps.74.1,Ps 74:1,0,"Why have you rejected us forever, O God? Why does your anger smolder against the sheep of your pasture?"
en,NIV,Ps,Ps,18,Ps.74,Ps 74,73,Ps.74.2,Ps 74:2,1,"Remember the people you purchased of old, the tribe of your inheritance, whom you redeemed- Mount Zion, where you dwelt."
en,NIV,Ps,Ps,18,Ps.74,Ps 74,73,Ps.74.3,Ps 74:3,2,"Turn your steps toward these everlasting ruins, all this destruction the enemy has brought on the sanctuary."
en,NIV,Ps,Ps,18,Ps.74,Ps 74,73,Ps.74.4,Ps 74:4,3,Your foes roared in the place where you met with us; they set up their standards as signs.
en,NIV,Ps,Ps,18,Ps.74,Ps 74,73,Ps.74.5,Ps 74:5,4,They behaved like men wielding axes to cut through a thicket of trees.
en,NIV,Ps,Ps,18,Ps.74,Ps 74,73,Ps.74.6,Ps 74:6,5,They smashed all the carved paneling with their axes and hatchets.
en,NIV,Ps,Ps,18,Ps.74,Ps 74,73,Ps.74.7,Ps 74:7,6,They burned your sanctuary to the ground; they defiled the dwelling place of your Name.
en,NIV,Ps,Ps,18,Ps.74,Ps 74,73,Ps.74.8,Ps 74:8,7,"They said in their hearts, ""We will crush them completely!"" They burned every place where God was worshiped in the land."
en,NIV,Ps,Ps,18,Ps.74,Ps 74,73,Ps.74.9,Ps 74:9,8,"We are given no miraculous signs; no prophets are left, and none of us knows how long this will be."
en,NIV,Ps,Ps,18,Ps.74,Ps 74,73,Ps.74.10,Ps 74:10,9,"How long will the enemy mock you, O God? Will the foe revile your name forever?"
en,NIV,Ps,Ps,18,Ps.74,Ps 74,73,Ps.74.11,Ps 74:11,10,"Why do you hold back your hand, your right hand? Take it from the folds of your garment and destroy them!"
en,NIV,Ps,Ps,18,Ps.74,Ps 74,73,Ps.74.12,Ps 74:12,11,"But you, O God, are my king from of old; you bring salvation upon the earth."
en,NIV,Ps,Ps,18,Ps.74,Ps 74,73,Ps.74.13,Ps 74:13,12,It was you who split open the sea by your power; you broke the heads of the monster in the waters.
en,NIV,Ps,Ps,18,Ps.74,Ps 74,73,Ps.74.14,Ps 74:14,13,It was you who crushed the heads of Leviathan and gave him as food to the creatures of the desert.
en,NIV,Ps,Ps,18,Ps.74,Ps 74,73,Ps.74.15,Ps 74:15,14,It was you who opened up springs and streams; you dried up the ever flowing rivers.
en,NIV,Ps,Ps,18,Ps.74,Ps 74,73,Ps.74.16,Ps 74:16,15,"The day is yours, and yours also the night; you established the sun and moon."
en,NIV,Ps,Ps,18,Ps.74,Ps 74,73,Ps.74.17,Ps 74:17,16,It was you who set all the boundaries of the earth; you made both summer and winter.
en,NIV,Ps,Ps,18,Ps.74,Ps 74,73,Ps.74.18,Ps 74:18,17,"Remember how the enemy has mocked you, O LORD, how foolish people have reviled your name."
en,NIV,Ps,Ps,18,Ps.74,Ps 74,73,Ps.74.19,Ps 74:19,18,Do not hand over the life of your dove to wild beasts; do not forget the lives of your afflicted people forever.
en,NIV,Ps,Ps,18,Ps.74,Ps 74,73,Ps.74.20,Ps 74:20,19,"Have regard for your covenant, because haunts of violence fill the dark places of the land."
en,NIV,Ps,Ps,18,Ps.74,Ps 74,73,Ps.74.21,Ps 74:21,20,Do not let the oppressed retreat in disgrace; may the poor and needy praise your name.
en,NIV,Ps,Ps,18,Ps.74,Ps 74,73,Ps.74.22,Ps 74:22,21,"Rise up, O God, and defend your cause; remember how fools mock you all day long."
en,NIV,Ps,Ps,18,Ps.74,Ps 74,73,Ps.74.23,Ps 74:23,22,"Do not ignore the clamor of your adversaries, the uproar of your enemies, which rises continually."
en,NIV,Ps,Ps,18,Ps.75,Ps 75,74,Ps.75.1,Ps 75:1,0,"We give thanks to you, O God, we give thanks, for your Name is near; men tell of your wonderful deeds."
en,NIV,Ps,Ps,18,Ps.75,Ps 75,74,Ps.75.2,Ps 75:2,1,"You say, ""I choose the appointed time; it is I who judge uprightly."
en,NIV,Ps,Ps,18,Ps.75,Ps 75,74,Ps.75.3,Ps 75:3,2,"When the earth and all its people quake, it is I who hold its pillars firm. Selah"
en,NIV,Ps,Ps,18,Ps.75,Ps 75,74,Ps.75.4,Ps 75:4,3,"To the arrogant I say, 'Boast no more,' and to the wicked, 'Do not lift up your horns."
en,NIV,Ps,Ps,18,Ps.75,Ps 75,74,Ps.75.5,Ps 75:5,4,"Do not lift your horns against heaven; do not speak with outstretched neck.'"""
en,NIV,Ps,Ps,18,Ps.75,Ps 75,74,Ps.75.6,Ps 75:6,5,No one from the east or the west or from the desert can exalt a man.
en,NIV,Ps,Ps,18,Ps.75,Ps 75,74,Ps.75.7,Ps 75:7,6,"But it is God who judges: He brings one down, he exalts another."
en,NIV,Ps,Ps,18,Ps.75,Ps 75,74,Ps.75.8,Ps 75:8,7,"In the hand of the LORD is a cup full of foaming wine mixed with spices; he pours it out, and all the wicked of the earth drink it down to its very dregs."
en,NIV,Ps,Ps,18,Ps.75,Ps 75,74,Ps.75.9,Ps 75:9,8,"As for me, I will declare this forever; I will sing praise to the God of Jacob."
en,NIV,Ps,Ps,18,Ps.75,Ps 75,74,Ps.75.10,Ps 75:10,9,"I will cut off the horns of all the wicked, but the horns of the righteous will be lifted up."
en,NIV,Ps,Ps,18,Ps.76,Ps 76,75,Ps.76.1,Ps 76:1,0,In Judah God is known; his name is great in Israel.
en,NIV,Ps,Ps,18,Ps.76,Ps 76,75,Ps.76.2,Ps 76:2,1,"His tent is in Salem, his dwelling place in Zion."
en,NIV,Ps,Ps,18,Ps.76,Ps 76,75,Ps.76.3,Ps 76:3,2,"There he broke the flashing arrows, the shields and the swords, the weapons of war. Selah"
en,NIV,Ps,Ps,18,Ps.76,Ps 76,75,Ps.76.4,Ps 76:4,3,"You are resplendent with light, more majestic than mountains rich with game."
en,NIV,Ps,Ps,18,Ps.76,Ps 76,75,Ps.76.5,Ps 76:5,4,"Valiant men lie plundered, they sleep their last sleep; not one of the warriors can lift his hands."
en,NIV,Ps,Ps,18,Ps.76,Ps 76,75,Ps.76.6,Ps 76:6,5,"At your rebuke, O God of Jacob, both horse and chariot lie still."
en,NIV,Ps,Ps,18,Ps.76,Ps 76,75,Ps.76.7,Ps 76:7,6,You alone are to be feared. Who can stand before you when you are angry?
en,NIV,Ps,Ps,18,Ps.76,Ps 76,75,Ps.76.8,Ps 76:8,7,"From heaven you pronounced judgment, and the land feared and was quiet-"
en,NIV,Ps,Ps,18,Ps.76,Ps 76,75,Ps.76.9,Ps 76:9,8,"when you, O God, rose up to judge, to save all the afflicted of the land. Selah"
en,NIV,Ps,Ps,18,Ps.76,Ps 76,75,Ps.76.10,Ps 76:10,9,"Surely your wrath against men brings you praise, and the survivors of your wrath are restrained."
en,NIV,Ps,Ps,18,Ps.76,Ps 76,75,Ps.76.11,Ps 76:11,10,Make vows to the LORD your God and fulfill them; let all the neighboring lands bring gifts to the One to be feared.
en,NIV,Ps,Ps,18,Ps.76,Ps 76,75,Ps.76.12,Ps 76:12,11,He breaks the spirit of rulers; he is feared by the kings of the earth.
en,NIV,Ps,Ps,18,Ps.77,Ps 77,76,Ps.77.1,Ps 77:1,0,I cried out to God for help; I cried out to God to hear me.
en,NIV,Ps,Ps,18,Ps.77,Ps 77,76,Ps.77.2,Ps 77:2,1,"When I was in distress, I sought the Lord; at night I stretched out untiring hands and my soul refused to be comforted."
en,NIV,Ps,Ps,18,Ps.77,Ps 77,76,Ps.77.3,Ps 77:3,2,"I remembered you, O God, and I groaned; I mused, and my spirit grew faint. Selah"
en,NIV,Ps,Ps,18,Ps.77,Ps 77,76,Ps.77.4,Ps 77:4,3,You kept my eyes from closing; I was too troubled to speak.
en,NIV,Ps,Ps,18,Ps.77,Ps 77,76,Ps.77.5,Ps 77:5,4,"I thought about the former days, the years of long ago;"
en,NIV,Ps,Ps,18,Ps.77,Ps 77,76,Ps.77.6,Ps 77:6,5,I remembered my songs in the night. My heart mused and my spirit inquired:
en,NIV,Ps,Ps,18,Ps.77,Ps 77,76,Ps.77.7,Ps 77:7,6,"""Will the Lord reject forever? Will he never show his favor again?"
en,NIV,Ps,Ps,18,Ps.77,Ps 77,76,Ps.77.8,Ps 77:8,7,Has his unfailing love vanished forever? Has his promise failed for all time?
en,NIV,Ps,Ps,18,Ps.77,Ps 77,76,Ps.77.9,Ps 77:9,8,"Has God forgotten to be merciful? Has he in anger withheld his compassion?"" Selah"
en,NIV,Ps,Ps,18,Ps.77,Ps 77,76,Ps.77.10,Ps 77:10,9,"Then I thought, ""To this I will appeal: the years of the right hand of the Most High."""
en,NIV,Ps,Ps,18,Ps.77,Ps 77,76,Ps.77.11,Ps 77:11,10,"I will remember the deeds of the LORD; yes, I will remember your miracles of long ago."
en,NIV,Ps,Ps,18,Ps.77,Ps 77,76,Ps.77.12,Ps 77:12,11,I will meditate on all your works and consider all your mighty deeds.
en,NIV,Ps,Ps,18,Ps.77,Ps 77,76,Ps.77.13,Ps 77:13,12,"Your ways, O God, are holy. What god is so great as our God?"
en,NIV,Ps,Ps,18,Ps.77,Ps 77,76,Ps.77.14,Ps 77:14,13,You are the God who performs miracles; you display your power among the peoples.
en,NIV,Ps,Ps,18,Ps.77,Ps 77,76,Ps.77.15,Ps 77:15,14,"With your mighty arm you redeemed your people, the descendants of Jacob and Joseph. Selah"
en,NIV,Ps,Ps,18,Ps.77,Ps 77,76,Ps.77.16,Ps 77:16,15,"The waters saw you, O God, the waters saw you and writhed; the very depths were convulsed."
en,NIV,Ps,Ps,18,Ps.77,Ps 77,76,Ps.77.17,Ps 77:17,16,"The clouds poured down water, the skies resounded with thunder; your arrows flashed back and forth."
en,NIV,Ps,Ps,18,Ps.77,Ps 77,76,Ps.77.18,Ps 77:18,17,"Your thunder was heard in the whirlwind, your lightning lit up the world; the earth trembled and quaked."
en,NIV,Ps,Ps,18,Ps.77,Ps 77,76,Ps.77.19,Ps 77:19,18,"Your path led through the sea, your way through the mighty waters, though your footprints were not seen."
en,NIV,Ps,Ps,18,Ps.77,Ps 77,76,Ps.77.20,Ps 77:20,19,You led your people like a flock by the hand of Moses and Aaron.
en,NIV,Ps,Ps,18,Ps.78,Ps 78,77,Ps.78.1,Ps 78:1,0,"O my people, hear my teaching; listen to the words of my mouth."
en,NIV,Ps,Ps,18,Ps.78,Ps 78,77,Ps.78.2,Ps 78:2,1,"I will open my mouth in parables, I will utter hidden things, things from of old-"
en,NIV,Ps,Ps,18,Ps.78,Ps 78,77,Ps.78.3,Ps 78:3,2,"what we have heard and known, what our fathers have told us."
en,NIV,Ps,Ps,18,Ps.78,Ps 78,77,Ps.78.4,Ps 78:4,3,"We will not hide them from their children; we will tell the next generation the praiseworthy deeds of the LORD, his power, and the wonders he has done."
en,NIV,Ps,Ps,18,Ps.78,Ps 78,77,Ps.78.5,Ps 78:5,4,"He decreed statutes for Jacob and established the law in Israel, which he commanded our forefathers to teach their children,"
en,NIV,Ps,Ps,18,Ps.78,Ps 78,77,Ps.78.6,Ps 78:6,5,"so the next generation would know them, even the children yet to be born, and they in turn would tell their children."
en,NIV,Ps,Ps,18,Ps.78,Ps 78,77,Ps.78.7,Ps 78:7,6,Then they would put their trust in God and would not forget his deeds but would keep his commands.
en,NIV,Ps,Ps,18,Ps.78,Ps 78,77,Ps.78.8,Ps 78:8,7,"They would not be like their forefathers- a stubborn and rebellious generation, whose hearts were not loyal to God, whose spirits were not faithful to him."
en,NIV,Ps,Ps,18,Ps.78,Ps 78,77,Ps.78.9,Ps 78:9,8,"The men of Ephraim, though armed with bows, turned back on the day of battle;"
en,NIV,Ps,Ps,18,Ps.78,Ps 78,77,Ps.78.10,Ps 78:10,9,they did not keep God's covenant and refused to live by his law.
en,NIV,Ps,Ps,18,Ps.78,Ps 78,77,Ps.78.11,Ps 78:11,10,"They forgot what he had done, the wonders he had shown them."
en,NIV,Ps,Ps,18,Ps.78,Ps 78,77,Ps.78.12,Ps 78:12,11,"He did miracles in the sight of their fathers in the land of Egypt, in the region of Zoan."
en,NIV,Ps,Ps,18,Ps.78,Ps 78,77,Ps.78.13,Ps 78:13,12,He divided the sea and led them through; he made the water stand firm like a wall.
en,NIV,Ps,Ps,18,Ps.78,Ps 78,77,Ps.78.14,Ps 78:14,13,He guided them with the cloud by day and with light from the fire all night.
en,NIV,Ps,Ps,18,Ps.78,Ps 78,77,Ps.78.15,Ps 78:15,14,He split the rocks in the desert and gave them water as abundant as the seas;
en,NIV,Ps,Ps,18,Ps.78,Ps 78,77,Ps.78.16,Ps 78:16,15,he brought streams out of a rocky crag and made water flow down like rivers.
en,NIV,Ps,Ps,18,Ps.78,Ps 78,77,Ps.78.17,Ps 78:17,16,"But they continued to sin against him, rebelling in the desert against the Most High."
en,NIV,Ps,Ps,18,Ps.78,Ps 78,77,Ps.78.18,Ps 78:18,17,They willfully put God to the test by demanding the food they craved.
en,NIV,Ps,Ps,18,Ps.78,Ps 78,77,Ps.78.19,Ps 78:19,18,"They spoke against God, saying, ""Can God spread a table in the desert?"
en,NIV,Ps,Ps,18,Ps.78,Ps 78,77,Ps.78.20,Ps 78:20,19,"When he struck the rock, water gushed out, and streams flowed abundantly. But can he also give us food? Can he supply meat for his people?"""
en,NIV,Ps,Ps,18,Ps.78,Ps 78,77,Ps.78.21,Ps 78:21,20,"When the LORD heard them, he was very angry; his fire broke out against Jacob, and his wrath rose against Israel,"
en,NIV,Ps,Ps,18,Ps.78,Ps 78,77,Ps.78.22,Ps 78:22,21,for they did not believe in God or trust in his deliverance.
en,NIV,Ps,Ps,18,Ps.78,Ps 78,77,Ps.78.23,Ps 78:23,22,Yet he gave a command to the skies above and opened the doors of the heavens;
en,NIV,Ps,Ps,18,Ps.78,Ps 78,77,Ps.78.24,Ps 78:24,23,"he rained down manna for the people to eat, he gave them the grain of heaven."
en,NIV,Ps,Ps,18,Ps.78,Ps 78,77,Ps.78.25,Ps 78:25,24,Men ate the bread of angels; he sent them all the food they could eat.
en,NIV,Ps,Ps,18,Ps.78,Ps 78,77,Ps.78.26,Ps 78:26,25,He let loose the east wind from the heavens and led forth the south wind by his power.
en,NIV,Ps,Ps,18,Ps.78,Ps 78,77,Ps.78.27,Ps 78:27,26,"He rained meat down on them like dust, flying birds like sand on the seashore."
en,NIV,Ps,Ps,18,Ps.78,Ps 78,77,Ps.78.28,Ps 78:28,27,"He made them come down inside their camp, all around their tents."
en,NIV,Ps,Ps,18,Ps.78,Ps 78,77,Ps.78.29,Ps 78:29,28,"They ate till they had more than enough, for he had given them what they craved."
en,NIV,Ps,Ps,18,Ps.78,Ps 78,77,Ps.78.30,Ps 78:30,29,"But before they turned from the food they craved, even while it was still in their mouths,"
en,NIV,Ps,Ps,18,Ps.78,Ps 78,77,Ps.78.31,Ps 78:31,30,"God's anger rose against them; he put to death the sturdiest among them, cutting down the young men of Israel."
en,NIV,Ps,Ps,18,Ps.78,Ps 78,77,Ps.78.32,Ps 78:32,31,"In spite of all this, they kept on sinning; in spite of his wonders, they did not believe."
en,NIV,Ps,Ps,18,Ps.78,Ps 78,77,Ps.78.33,Ps 78:33,32,So he ended their days in futility and their years in terror.
en,NIV,Ps,Ps,18,Ps.78,Ps 78,77,Ps.78.34,Ps 78:34,33,"Whenever God slew them, they would seek him; they eagerly turned to him again."
en,NIV,Ps,Ps,18,Ps.78,Ps 78,77,Ps.78.35,Ps 78:35,34,"They remembered that God was their Rock, that God Most High was their Redeemer."
en,NIV,Ps,Ps,18,Ps.78,Ps 78,77,Ps.78.36,Ps 78:36,35,"But then they would flatter him with their mouths, lying to him with their tongues;"
en,NIV,Ps,Ps,18,Ps.78,Ps 78,77,Ps.78.37,Ps 78:37,36,"their hearts were not loyal to him, they were not faithful to his covenant."
en,NIV,Ps,Ps,18,Ps.78,Ps 78,77,Ps.78.38,Ps 78:38,37,Yet he was merciful; he forgave their iniquities and did not destroy them. Time after time he restrained his anger and did not stir up his full wrath.
en,NIV,Ps,Ps,18,Ps.78,Ps 78,77,Ps.78.39,Ps 78:39,38,"He remembered that they were but flesh, a passing breeze that does not return."
en,NIV,Ps,Ps,18,Ps.78,Ps 78,77,Ps.78.40,Ps 78:40,39,How often they rebelled against him in the desert and grieved him in the wasteland!
en,NIV,Ps,Ps,18,Ps.78,Ps 78,77,Ps.78.41,Ps 78:41,40,Again and again they put God to the test; they vexed the Holy One of Israel.
en,NIV,Ps,Ps,18,Ps.78,Ps 78,77,Ps.78.42,Ps 78:42,41,"They did not remember his power- the day he redeemed them from the oppressor,"
en,NIV,Ps,Ps,18,Ps.78,Ps 78,77,Ps.78.43,Ps 78:43,42,"the day he displayed his miraculous signs in Egypt, his wonders in the region of Zoan."
en,NIV,Ps,Ps,18,Ps.78,Ps 78,77,Ps.78.44,Ps 78:44,43,He turned their rivers to blood; they could not drink from their streams.
en,NIV,Ps,Ps,18,Ps.78,Ps 78,77,Ps.78.45,Ps 78:45,44,"He sent swarms of flies that devoured them, and frogs that devastated them."
en,NIV,Ps,Ps,18,Ps.78,Ps 78,77,Ps.78.46,Ps 78:46,45,"He gave their crops to the grasshopper, their produce to the locust."
en,NIV,Ps,Ps,18,Ps.78,Ps 78,77,Ps.78.47,Ps 78:47,46,He destroyed their vines with hail and their sycamore-figs with sleet.
en,NIV,Ps,Ps,18,Ps.78,Ps 78,77,Ps.78.48,Ps 78:48,47,"He gave over their cattle to the hail, their livestock to bolts of lightning."
en,NIV,Ps,Ps,18,Ps.78,Ps 78,77,Ps.78.49,Ps 78:49,48,"He unleashed against them his hot anger, his wrath, indignation and hostility- a band of destroying angels."
en,NIV,Ps,Ps,18,Ps.78,Ps 78,77,Ps.78.50,Ps 78:50,49,He prepared a path for his anger; he did not spare them from death but gave them over to the plague.
en,NIV,Ps,Ps,18,Ps.78,Ps 78,77,Ps.78.51,Ps 78:51,50,"He struck down all the firstborn of Egypt, the firstfruits of manhood in the tents of Ham."
en,NIV,Ps,Ps,18,Ps.78,Ps 78,77,Ps.78.52,Ps 78:52,51,But he brought his people out like a flock; he led them like sheep through the desert.
en,NIV,Ps,Ps,18,Ps.78,Ps 78,77,Ps.78.53,Ps 78:53,52,"He guided them safely, so they were unafraid; but the sea engulfed their enemies."
en,NIV,Ps,Ps,18,Ps.78,Ps 78,77,Ps.78.54,Ps 78:54,53,"Thus he brought them to the border of his holy land, to the hill country his right hand had taken."
en,NIV,Ps,Ps,18,Ps.78,Ps 78,77,Ps.78.55,Ps 78:55,54,He drove out nations before them and allotted their lands to them as an inheritance; he settled the tribes of Israel in their homes.
en,NIV,Ps,Ps,18,Ps.78,Ps 78,77,Ps.78.56,Ps 78:56,55,But they put God to the test and rebelled against the Most High; they did not keep his statutes.
en,NIV,Ps,Ps,18,Ps.78,Ps 78,77,Ps.78.57,Ps 78:57,56,"Like their fathers they were disloyal and faithless, as unreliable as a faulty bow."
en,NIV,Ps,Ps,18,Ps.78,Ps 78,77,Ps.78.58,Ps 78:58,57,They angered him with their high places; they aroused his jealousy with their idols.
en,NIV,Ps,Ps,18,Ps.78,Ps 78,77,Ps.78.59,Ps 78:59,58,"When God heard them, he was very angry; he rejected Israel completely."
en,NIV,Ps,Ps,18,Ps.78,Ps 78,77,Ps.78.60,Ps 78:60,59,"He abandoned the tabernacle of Shiloh, the tent he had set up among men."
en,NIV,Ps,Ps,18,Ps.78,Ps 78,77,Ps.78.61,Ps 78:61,60,"He sent the ark of his might into captivity, his splendor into the hands of the enemy."
en,NIV,Ps,Ps,18,Ps.78,Ps 78,77,Ps.78.62,Ps 78:62,61,He gave his people over to the sword; he was very angry with his inheritance.
en,NIV,Ps,Ps,18,Ps.78,Ps 78,77,Ps.78.63,Ps 78:63,62,"Fire consumed their young men, and their maidens had no wedding songs;"
en,NIV,Ps,Ps,18,Ps.78,Ps 78,77,Ps.78.64,Ps 78:64,63,"their priests were put to the sword, and their widows could not weep."
en,NIV,Ps,Ps,18,Ps.78,Ps 78,77,Ps.78.65,Ps 78:65,64,"Then the Lord awoke as from sleep, as a man wakes from the stupor of wine."
en,NIV,Ps,Ps,18,Ps.78,Ps 78,77,Ps.78.66,Ps 78:66,65,He beat back his enemies; he put them to everlasting shame.
en,NIV,Ps,Ps,18,Ps.78,Ps 78,77,Ps.78.67,Ps 78:67,66,"Then he rejected the tents of Joseph, he did not choose the tribe of Ephraim;"
en,NIV,Ps,Ps,18,Ps.78,Ps 78,77,Ps.78.68,Ps 78:68,67,"but he chose the tribe of Judah, Mount Zion, which he loved."
en,NIV,Ps,Ps,18,Ps.78,Ps 78,77,Ps.78.69,Ps 78:69,68,"He built his sanctuary like the heights, like the earth that he established forever."
en,NIV,Ps,Ps,18,Ps.78,Ps 78,77,Ps.78.70,Ps 78:70,69,He chose David his servant and took him from the sheep pens;
en,NIV,Ps,Ps,18,Ps.78,Ps 78,77,Ps.78.71,Ps 78:71,70,"from tending the sheep he brought him to be the shepherd of his people Jacob, of Israel his inheritance."
en,NIV,Ps,Ps,18,Ps.78,Ps 78,77,Ps.78.72,Ps 78:72,71,And David shepherded them with integrity of heart; with skillful hands he led them.
en,NIV,Ps,Ps,18,Ps.79,Ps 79,78,Ps.79.1,Ps 79:1,0,"O God, the nations have invaded your inheritance; they have defiled your holy temple, they have reduced Jerusalem to rubble."
en,NIV,Ps,Ps,18,Ps.79,Ps 79,78,Ps.79.2,Ps 79:2,1,"They have given the dead bodies of your servants as food to the birds of the air, the flesh of your saints to the beasts of the earth."
en,NIV,Ps,Ps,18,Ps.79,Ps 79,78,Ps.79.3,Ps 79:3,2,"They have poured out blood like water all around Jerusalem, and there is no one to bury the dead."
en,NIV,Ps,Ps,18,Ps.79,Ps 79,78,Ps.79.4,Ps 79:4,3,"We are objects of reproach to our neighbors, of scorn and derision to those around us."
en,NIV,Ps,Ps,18,Ps.79,Ps 79,78,Ps.79.5,Ps 79:5,4,"How long, O LORD? Will you be angry forever? How long will your jealousy burn like fire?"
en,NIV,Ps,Ps,18,Ps.79,Ps 79,78,Ps.79.6,Ps 79:6,5,"Pour out your wrath on the nations that do not acknowledge you, on the kingdoms that do not call on your name;"
en,NIV,Ps,Ps,18,Ps.79,Ps 79,78,Ps.79.7,Ps 79:7,6,for they have devoured Jacob and destroyed his homeland.
en,NIV,Ps,Ps,18,Ps.79,Ps 79,78,Ps.79.8,Ps 79:8,7,"Do not hold against us the sins of the fathers; may your mercy come quickly to meet us, for we are in desperate need."
en,NIV,Ps,Ps,18,Ps.79,Ps 79,78,Ps.79.9,Ps 79:9,8,"Help us, O God our Savior, for the glory of your name; deliver us and forgive our sins for your name's sake."
en,NIV,Ps,Ps,18,Ps.79,Ps 79,78,Ps.79.10,Ps 79:10,9,"Why should the nations say, ""Where is their God?"" Before our eyes, make known among the nations that you avenge the outpoured blood of your servants."
en,NIV,Ps,Ps,18,Ps.79,Ps 79,78,Ps.79.11,Ps 79:11,10,May the groans of the prisoners come before you; by the strength of your arm preserve those condemned to die.
en,NIV,Ps,Ps,18,Ps.79,Ps 79,78,Ps.79.12,Ps 79:12,11,"Pay back into the laps of our neighbors seven times the reproach they have hurled at you, O Lord."
en,NIV,Ps,Ps,18,Ps.79,Ps 79,78,Ps.79.13,Ps 79:13,12,"Then we your people, the sheep of your pasture, will praise you forever; from generation to generation we will recount your praise."
en,NIV,Ps,Ps,18,Ps.80,Ps 80,79,Ps.80.1,Ps 80:1,0,"Hear us, O Shepherd of Israel, you who lead Joseph like a flock; you who sit enthroned between the cherubim, shine forth"
en,NIV,Ps,Ps,18,Ps.80,Ps 80,79,Ps.80.2,Ps 80:2,1,"before Ephraim, Benjamin and Manasseh. Awaken your might; come and save us."
en,NIV,Ps,Ps,18,Ps.80,Ps 80,79,Ps.80.3,Ps 80:3,2,"Restore us, O God; make your face shine upon us, that we may be saved."
en,NIV,Ps,Ps,18,Ps.80,Ps 80,79,Ps.80.4,Ps 80:4,3,"O LORD God Almighty, how long will your anger smolder against the prayers of your people?"
en,NIV,Ps,Ps,18,Ps.80,Ps 80,79,Ps.80.5,Ps 80:5,4,You have fed them with the bread of tears; you have made them drink tears by the bowlful.
en,NIV,Ps,Ps,18,Ps.80,Ps 80,79,Ps.80.6,Ps 80:6,5,"You have made us a source of contention to our neighbors, and our enemies mock us."
en,NIV,Ps,Ps,18,Ps.80,Ps 80,79,Ps.80.7,Ps 80:7,6,"Restore us, O God Almighty; make your face shine upon us, that we may be saved."
en,NIV,Ps,Ps,18,Ps.80,Ps 80,79,Ps.80.8,Ps 80:8,7,You brought a vine out of Egypt; you drove out the nations and planted it.
en,NIV,Ps,Ps,18,Ps.80,Ps 80,79,Ps.80.9,Ps 80:9,8,"You cleared the ground for it, and it took root and filled the land."
en,NIV,Ps,Ps,18,Ps.80,Ps 80,79,Ps.80.10,Ps 80:10,9,"The mountains were covered with its shade, the mighty cedars with its branches."
en,NIV,Ps,Ps,18,Ps.80,Ps 80,79,Ps.80.11,Ps 80:11,10,"It sent out its boughs to the Sea, its shoots as far as the River."
en,NIV,Ps,Ps,18,Ps.80,Ps 80,79,Ps.80.12,Ps 80:12,11,Why have you broken down its walls so that all who pass by pick its grapes?
en,NIV,Ps,Ps,18,Ps.80,Ps 80,79,Ps.80.13,Ps 80:13,12,Boars from the forest ravage it and the creatures of the field feed on it.
en,NIV,Ps,Ps,18,Ps.80,Ps 80,79,Ps.80.14,Ps 80:14,13,"Return to us, O God Almighty! Look down from heaven and see! Watch over this vine,"
en,NIV,Ps,Ps,18,Ps.80,Ps 80,79,Ps.80.15,Ps 80:15,14,"the root your right hand has planted, the son you have raised up for yourself."
en,NIV,Ps,Ps,18,Ps.80,Ps 80,79,Ps.80.16,Ps 80:16,15,"Your vine is cut down, it is burned with fire; at your rebuke your people perish."
en,NIV,Ps,Ps,18,Ps.80,Ps 80,79,Ps.80.17,Ps 80:17,16,"Let your hand rest on the man at your right hand, the son of man you have raised up for yourself."
en,NIV,Ps,Ps,18,Ps.80,Ps 80,79,Ps.80.18,Ps 80:18,17,"Then we will not turn away from you; revive us, and we will call on your name."
en,NIV,Ps,Ps,18,Ps.80,Ps 80,79,Ps.80.19,Ps 80:19,18,"Restore us, O LORD God Almighty; make your face shine upon us, that we may be saved."
en,NIV,Ps,Ps,18,Ps.81,Ps 81,80,Ps.81.1,Ps 81:1,0,Sing for joy to God our strength; shout aloud to the God of Jacob!
en,NIV,Ps,Ps,18,Ps.81,Ps 81,80,Ps.81.2,Ps 81:2,1,"Begin the music, strike the tambourine, play the melodious harp and lyre."
en,NIV,Ps,Ps,18,Ps.81,Ps 81,80,Ps.81.3,Ps 81:3,2,"Sound the ram's horn at the New Moon, and when the moon is full, on the day of our Feast;"
