languageCode,code,bookOsisId,bookSblId,bookOrderIndex,chapterOsisId,chapterSblId,chapterOrderIndex,verseOsisId,verseSblId,verseOrderIndex,text
en,NIV,Dan,Dan,26,Dan.4,Dan 4,3,Dan.4.25,Dan 4:25,24,You will be driven away from people and will live with the wild animals; you will eat grass like cattle and be drenched with the dew of heaven. Seven times will pass by for you until you acknowledge that the Most High is sovereign over the kingdoms of men and gives them to anyone he wishes.
en,NIV,Dan,Dan,26,Dan.4,Dan 4,3,Dan.4.26,Dan 4:26,25,The command to leave the stump of the tree with its roots means that your kingdom will be restored to you when you acknowledge that Heaven rules.
en,NIV,Dan,Dan,26,Dan.4,Dan 4,3,Dan.4.27,Dan 4:27,26,"Therefore, O king, be pleased to accept my advice: Renounce your sins by doing what is right, and your wickedness by being kind to the oppressed. It may be that then your prosperity will continue."""
en,NIV,Dan,Dan,26,Dan.4,Dan 4,3,Dan.4.28,Dan 4:28,27,All this happened to King Nebuchadnezzar.
en,NIV,Dan,Dan,26,Dan.4,Dan 4,3,Dan.4.29,Dan 4:29,28,"Twelve months later, as the king was walking on the roof of the royal palace of Babylon,"
en,NIV,Dan,Dan,26,Dan.4,Dan 4,3,Dan.4.30,Dan 4:30,29,"he said, ""Is not this the great Babylon I have built as the royal residence, by my mighty power and for the glory of my majesty?"""
en,NIV,Dan,Dan,26,Dan.4,Dan 4,3,Dan.4.31,Dan 4:31,30,"The words were still on his lips when a voice came from heaven, ""This is what is decreed for you, King Nebuchadnezzar: Your royal authority has been taken from you."
en,NIV,Dan,Dan,26,Dan.4,Dan 4,3,Dan.4.32,Dan 4:32,31,"You will be driven away from people and will live with the wild animals; you will eat grass like cattle. Seven times will pass by for you until you acknowledge that the Most High is sovereign over the kingdoms of men and gives them to anyone he wishes."""
en,NIV,Dan,Dan,26,Dan.4,Dan 4,3,Dan.4.33,Dan 4:33,32,Immediately what had been said about Nebuchadnezzar was fulfilled. He was driven away from people and ate grass like cattle. His body was drenched with the dew of heaven until his hair grew like the feathers of an eagle and his nails like the claws of a bird.
en,NIV,Dan,Dan,26,Dan.4,Dan 4,3,Dan.4.34,Dan 4:34,33,"At the end of that time, I, Nebuchadnezzar, raised my eyes toward heaven, and my sanity was restored. Then I praised the Most High; I honored and glorified him who lives forever. His dominion is an eternal dominion; his kingdom endures from generation to generation."
en,NIV,Dan,Dan,26,Dan.4,Dan 4,3,Dan.4.35,Dan 4:35,34,"All the peoples of the earth are regarded as nothing. He does as he pleases with the powers of heaven and the peoples of the earth. No one can hold back his hand or say to him: ""What have you done?"""
en,NIV,Dan,Dan,26,Dan.4,Dan 4,3,Dan.4.36,Dan 4:36,35,"At the same time that my sanity was restored, my honor and splendor were returned to me for the glory of my kingdom. My advisers and nobles sought me out, and I was restored to my throne and became even greater than before."
en,NIV,Dan,Dan,26,Dan.4,Dan 4,3,Dan.4.37,Dan 4:37,36,"Now I, Nebuchadnezzar, praise and exalt and glorify the King of heaven, because everything he does is right and all his ways are just. And those who walk in pride he is able to humble."
en,NIV,Dan,Dan,26,Dan.5,Dan 5,4,Dan.5.1,Dan 5:1,0,King Belshazzar gave a great banquet for a thousand of his nobles and drank wine with them.
en,NIV,Dan,Dan,26,Dan.5,Dan 5,4,Dan.5.2,Dan 5:2,1,"While Belshazzar was drinking his wine, he gave orders to bring in the gold and silver goblets that Nebuchadnezzar his father had taken from the temple in Jerusalem, so that the king and his nobles, his wives and his concubines might drink from them."
en,NIV,Dan,Dan,26,Dan.5,Dan 5,4,Dan.5.3,Dan 5:3,2,"So they brought in the gold goblets that had been taken from the temple of God in Jerusalem, and the king and his nobles, his wives and his concubines drank from them."
en,NIV,Dan,Dan,26,Dan.5,Dan 5,4,Dan.5.4,Dan 5:4,3,"As they drank the wine, they praised the gods of gold and silver, of bronze, iron, wood and stone."
en,NIV,Dan,Dan,26,Dan.5,Dan 5,4,Dan.5.5,Dan 5:5,4,"Suddenly the fingers of a human hand appeared and wrote on the plaster of the wall, near the lampstand in the royal palace. The king watched the hand as it wrote."
en,NIV,Dan,Dan,26,Dan.5,Dan 5,4,Dan.5.6,Dan 5:6,5,His face turned pale and he was so frightened that his knees knocked together and his legs gave way.
en,NIV,Dan,Dan,26,Dan.5,Dan 5,4,Dan.5.7,Dan 5:7,6,"The king called out for the enchanters, astrologers and diviners to be brought and said to these wise men of Babylon, ""Whoever reads this writing and tells me what it means will be clothed in purple and have a gold chain placed around his neck, and he will be made the third highest ruler in the kingdom."""
en,NIV,Dan,Dan,26,Dan.5,Dan 5,4,Dan.5.8,Dan 5:8,7,"Then all the king's wise men came in, but they could not read the writing or tell the king what it meant."
en,NIV,Dan,Dan,26,Dan.5,Dan 5,4,Dan.5.9,Dan 5:9,8,So King Belshazzar became even more terrified and his face grew more pale. His nobles were baffled.
en,NIV,Dan,Dan,26,Dan.5,Dan 5,4,Dan.5.10,Dan 5:10,9,"The queen, hearing the voices of the king and his nobles, came into the banquet hall. ""O king, live forever!"" she said. ""Don't be alarmed! Don't look so pale!"
en,NIV,Dan,Dan,26,Dan.5,Dan 5,4,Dan.5.11,Dan 5:11,10,"There is a man in your kingdom who has the spirit of the holy gods in him. In the time of your father he was found to have insight and intelligence and wisdom like that of the gods. King Nebuchadnezzar your father-your father the king, I say-appointed him chief of the magicians, enchanters, astrologers and diviners."
en,NIV,Dan,Dan,26,Dan.5,Dan 5,4,Dan.5.12,Dan 5:12,11,"This man Daniel, whom the king called Belteshazzar, was found to have a keen mind and knowledge and understanding, and also the ability to interpret dreams, explain riddles and solve difficult problems. Call for Daniel, and he will tell you what the writing means."""
en,NIV,Dan,Dan,26,Dan.5,Dan 5,4,Dan.5.13,Dan 5:13,12,"So Daniel was brought before the king, and the king said to him, ""Are you Daniel, one of the exiles my father the king brought from Judah?"
en,NIV,Dan,Dan,26,Dan.5,Dan 5,4,Dan.5.14,Dan 5:14,13,"I have heard that the spirit of the gods is in you and that you have insight, intelligence and outstanding wisdom."
en,NIV,Dan,Dan,26,Dan.5,Dan 5,4,Dan.5.15,Dan 5:15,14,"The wise men and enchanters were brought before me to read this writing and tell me what it means, but they could not explain it."
en,NIV,Dan,Dan,26,Dan.5,Dan 5,4,Dan.5.16,Dan 5:16,15,"Now I have heard that you are able to give interpretations and to solve difficult problems. If you can read this writing and tell me what it means, you will be clothed in purple and have a gold chain placed around your neck, and you will be made the third highest ruler in the kingdom."""
en,NIV,Dan,Dan,26,Dan.5,Dan 5,4,Dan.5.17,Dan 5:17,16,"Then Daniel answered the king, ""You may keep your gifts for yourself and give your rewards to someone else. Nevertheless, I will read the writing for the king and tell him what it means."
en,NIV,Dan,Dan,26,Dan.5,Dan 5,4,Dan.5.18,Dan 5:18,17,"""O king, the Most High God gave your father Nebuchadnezzar sovereignty and greatness and glory and splendor."
en,NIV,Dan,Dan,26,Dan.5,Dan 5,4,Dan.5.19,Dan 5:19,18,"Because of the high position he gave him, all the peoples and nations and men of every language dreaded and feared him. Those the king wanted to put to death, he put to death; those he wanted to spare, he spared; those he wanted to promote, he promoted; and those he wanted to humble, he humbled."
en,NIV,Dan,Dan,26,Dan.5,Dan 5,4,Dan.5.20,Dan 5:20,19,"But when his heart became arrogant and hardened with pride, he was deposed from his royal throne and stripped of his glory."
en,NIV,Dan,Dan,26,Dan.5,Dan 5,4,Dan.5.21,Dan 5:21,20,"He was driven away from people and given the mind of an animal; he lived with the wild donkeys and ate grass like cattle; and his body was drenched with the dew of heaven, until he acknowledged that the Most High God is sovereign over the kingdoms of men and sets over them anyone he wishes."
en,NIV,Dan,Dan,26,Dan.5,Dan 5,4,Dan.5.22,Dan 5:22,21,"""But you his son, O Belshazzar, have not humbled yourself, though you knew all this."
en,NIV,Dan,Dan,26,Dan.5,Dan 5,4,Dan.5.23,Dan 5:23,22,"Instead, you have set yourself up against the Lord of heaven. You had the goblets from his temple brought to you, and you and your nobles, your wives and your concubines drank wine from them. You praised the gods of silver and gold, of bronze, iron, wood and stone, which cannot see or hear or understand. But you did not honor the God who holds in his hand your life and all your ways."
en,NIV,Dan,Dan,26,Dan.5,Dan 5,4,Dan.5.24,Dan 5:24,23,Therefore he sent the hand that wrote the inscription.
en,NIV,Dan,Dan,26,Dan.5,Dan 5,4,Dan.5.25,Dan 5:25,24,"""This is the inscription that was written: Mene, Mene, Tekel, Parsin"
en,NIV,Dan,Dan,26,Dan.5,Dan 5,4,Dan.5.26,Dan 5:26,25,"""This is what these words mean: Mene: God has numbered the days of your reign and brought it to an end."
en,NIV,Dan,Dan,26,Dan.5,Dan 5,4,Dan.5.27,Dan 5:27,26,Tekel: You have been weighed on the scales and found wanting.
en,NIV,Dan,Dan,26,Dan.5,Dan 5,4,Dan.5.28,Dan 5:28,27,"Peres: Your kingdom is divided and given to the Medes and Persians."""
en,NIV,Dan,Dan,26,Dan.5,Dan 5,4,Dan.5.29,Dan 5:29,28,"Then at Belshazzar's command, Daniel was clothed in purple, a gold chain was placed around his neck, and he was proclaimed the third highest ruler in the kingdom."
en,NIV,Dan,Dan,26,Dan.5,Dan 5,4,Dan.5.30,Dan 5:30,29,"That very night Belshazzar, king of the Babylonians, was slain,"
en,NIV,Dan,Dan,26,Dan.5,Dan 5,4,Dan.5.31,Dan 5:31,30,"and Darius the Mede took over the kingdom, at the age of sixty-two."
en,NIV,Dan,Dan,26,Dan.6,Dan 6,5,Dan.6.1,Dan 6:1,0,"It pleased Darius to appoint 120 satraps to rule throughout the kingdom,"
en,NIV,Dan,Dan,26,Dan.6,Dan 6,5,Dan.6.2,Dan 6:2,1,"with three administrators over them, one of whom was Daniel. The satraps were made accountable to them so that the king might not suffer loss."
en,NIV,Dan,Dan,26,Dan.6,Dan 6,5,Dan.6.3,Dan 6:3,2,Now Daniel so distinguished himself among the administrators and the satraps by his exceptional qualities that the king planned to set him over the whole kingdom.
en,NIV,Dan,Dan,26,Dan.6,Dan 6,5,Dan.6.4,Dan 6:4,3,"At this, the administrators and the satraps tried to find grounds for charges against Daniel in his conduct of government affairs, but they were unable to do so. They could find no corruption in him, because he was trustworthy and neither corrupt nor negligent."
en,NIV,Dan,Dan,26,Dan.6,Dan 6,5,Dan.6.5,Dan 6:5,4,"Finally these men said, ""We will never find any basis for charges against this man Daniel unless it has something to do with the law of his God."""
en,NIV,Dan,Dan,26,Dan.6,Dan 6,5,Dan.6.6,Dan 6:6,5,"So the administrators and the satraps went as a group to the king and said: ""O King Darius, live forever!"
en,NIV,Dan,Dan,26,Dan.6,Dan 6,5,Dan.6.7,Dan 6:7,6,"The royal administrators, prefects, satraps, advisers and governors have all agreed that the king should issue an edict and enforce the decree that anyone who prays to any god or man during the next thirty days, except to you, O king, shall be thrown into the lions' den."
en,NIV,Dan,Dan,26,Dan.6,Dan 6,5,Dan.6.8,Dan 6:8,7,"Now, O king, issue the decree and put it in writing so that it cannot be altered-in accordance with the laws of the Medes and Persians, which cannot be repealed."""
en,NIV,Dan,Dan,26,Dan.6,Dan 6,5,Dan.6.9,Dan 6:9,8,So King Darius put the decree in writing.
en,NIV,Dan,Dan,26,Dan.6,Dan 6,5,Dan.6.10,Dan 6:10,9,"Now when Daniel learned that the decree had been published, he went home to his upstairs room where the windows opened toward Jerusalem. Three times a day he got down on his knees and prayed, giving thanks to his God, just as he had done before."
en,NIV,Dan,Dan,26,Dan.6,Dan 6,5,Dan.6.11,Dan 6:11,10,Then these men went as a group and found Daniel praying and asking God for help.
en,NIV,Dan,Dan,26,Dan.6,Dan 6,5,Dan.6.12,Dan 6:12,11,"So they went to the king and spoke to him about his royal decree: ""Did you not publish a decree that during the next thirty days anyone who prays to any god or man except to you, O king, would be thrown into the lions' den?"" The king answered, ""The decree stands-in accordance with the laws of the Medes and Persians, which cannot be repealed."""
en,NIV,Dan,Dan,26,Dan.6,Dan 6,5,Dan.6.13,Dan 6:13,12,"Then they said to the king, ""Daniel, who is one of the exiles from Judah, pays no attention to you, O king, or to the decree you put in writing. He still prays three times a day."""
en,NIV,Dan,Dan,26,Dan.6,Dan 6,5,Dan.6.14,Dan 6:14,13,"When the king heard this, he was greatly distressed; he was determined to rescue Daniel and made every effort until sundown to save him."
en,NIV,Dan,Dan,26,Dan.6,Dan 6,5,Dan.6.15,Dan 6:15,14,"Then the men went as a group to the king and said to him, ""Remember, O king, that according to the law of the Medes and Persians no decree or edict that the king issues can be changed."""
en,NIV,Dan,Dan,26,Dan.6,Dan 6,5,Dan.6.16,Dan 6:16,15,"So the king gave the order, and they brought Daniel and threw him into the lions' den. The king said to Daniel, ""May your God, whom you serve continually, rescue you!"""
en,NIV,Dan,Dan,26,Dan.6,Dan 6,5,Dan.6.17,Dan 6:17,16,"A stone was brought and placed over the mouth of the den, and the king sealed it with his own signet ring and with the rings of his nobles, so that Daniel's situation might not be changed."
en,NIV,Dan,Dan,26,Dan.6,Dan 6,5,Dan.6.18,Dan 6:18,17,Then the king returned to his palace and spent the night without eating and without any entertainment being brought to him. And he could not sleep.
en,NIV,Dan,Dan,26,Dan.6,Dan 6,5,Dan.6.19,Dan 6:19,18,"At the first light of dawn, the king got up and hurried to the lions' den."
en,NIV,Dan,Dan,26,Dan.6,Dan 6,5,Dan.6.20,Dan 6:20,19,"When he came near the den, he called to Daniel in an anguished voice, ""Daniel, servant of the living God, has your God, whom you serve continually, been able to rescue you from the lions?"""
en,NIV,Dan,Dan,26,Dan.6,Dan 6,5,Dan.6.21,Dan 6:21,20,"Daniel answered, ""O king, live forever!"
en,NIV,Dan,Dan,26,Dan.6,Dan 6,5,Dan.6.22,Dan 6:22,21,"My God sent his angel, and he shut the mouths of the lions. They have not hurt me, because I was found innocent in his sight. Nor have I ever done any wrong before you, O king."""
en,NIV,Dan,Dan,26,Dan.6,Dan 6,5,Dan.6.23,Dan 6:23,22,"The king was overjoyed and gave orders to lift Daniel out of the den. And when Daniel was lifted from the den, no wound was found on him, because he had trusted in his God."
en,NIV,Dan,Dan,26,Dan.6,Dan 6,5,Dan.6.24,Dan 6:24,23,"At the king's command, the men who had falsely accused Daniel were brought in and thrown into the lions' den, along with their wives and children. And before they reached the floor of the den, the lions overpowered them and crushed all their bones."
en,NIV,Dan,Dan,26,Dan.6,Dan 6,5,Dan.6.25,Dan 6:25,24,"Then King Darius wrote to all the peoples, nations and men of every language throughout the land: ""May you prosper greatly!"
en,NIV,Dan,Dan,26,Dan.6,Dan 6,5,Dan.6.26,Dan 6:26,25,"""I issue a decree that in every part of my kingdom people must fear and reverence the God of Daniel. ""For he is the living God and he endures forever; his kingdom will not be destroyed, his dominion will never end."
en,NIV,Dan,Dan,26,Dan.6,Dan 6,5,Dan.6.27,Dan 6:27,26,"He rescues and he saves; he performs signs and wonders in the heavens and on the earth. He has rescued Daniel from the power of the lions."""
en,NIV,Dan,Dan,26,Dan.6,Dan 6,5,Dan.6.28,Dan 6:28,27,So Daniel prospered during the reign of Darius and the reign of Cyrus the Persian.
en,NIV,Dan,Dan,26,Dan.7,Dan 7,6,Dan.7.1,Dan 7:1,0,"In the first year of Belshazzar king of Babylon, Daniel had a dream, and visions passed through his mind as he was lying on his bed. He wrote down the substance of his dream."
en,NIV,Dan,Dan,26,Dan.7,Dan 7,6,Dan.7.2,Dan 7:2,1,"Daniel said: ""In my vision at night I looked, and there before me were the four winds of heaven churning up the great sea."
en,NIV,Dan,Dan,26,Dan.7,Dan 7,6,Dan.7.3,Dan 7:3,2,"Four great beasts, each different from the others, came up out of the sea."
en,NIV,Dan,Dan,26,Dan.7,Dan 7,6,Dan.7.4,Dan 7:4,3,"""The first was like a lion, and it had the wings of an eagle. I watched until its wings were torn off and it was lifted from the ground so that it stood on two feet like a man, and the heart of a man was given to it."
en,NIV,Dan,Dan,26,Dan.7,Dan 7,6,Dan.7.5,Dan 7:5,4,"""And there before me was a second beast, which looked like a bear. It was raised up on one of its sides, and it had three ribs in its mouth between its teeth. It was told, 'Get up and eat your fill of flesh!'"
en,NIV,Dan,Dan,26,Dan.7,Dan 7,6,Dan.7.6,Dan 7:6,5,"""After that, I looked, and there before me was another beast, one that looked like a leopard. And on its back it had four wings like those of a bird. This beast had four heads, and it was given authority to rule."
en,NIV,Dan,Dan,26,Dan.7,Dan 7,6,Dan.7.7,Dan 7:7,6,"""After that, in my vision at night I looked, and there before me was a fourth beast-terrifying and frightening and very powerful. It had large iron teeth; it crushed and devoured its victims and trampled underfoot whatever was left. It was different from all the former beasts, and it had ten horns."
en,NIV,Dan,Dan,26,Dan.7,Dan 7,6,Dan.7.8,Dan 7:8,7,"""While I was thinking about the horns, there before me was another horn, a little one, which came up among them; and three of the first horns were uprooted before it. This horn had eyes like the eyes of a man and a mouth that spoke boastfully."
en,NIV,Dan,Dan,26,Dan.7,Dan 7,6,Dan.7.9,Dan 7:9,8,"""As I looked, ""thrones were set in place, and the Ancient of Days took his seat. His clothing was as white as snow; the hair of his head was white like wool. His throne was flaming with fire, and its wheels were all ablaze."
en,NIV,Dan,Dan,26,Dan.7,Dan 7,6,Dan.7.10,Dan 7:10,9,"A river of fire was flowing, coming out from before him. Thousands upon thousands attended him; ten thousand times ten thousand stood before him. The court was seated, and the books were opened."
en,NIV,Dan,Dan,26,Dan.7,Dan 7,6,Dan.7.11,Dan 7:11,10,"""Then I continued to watch because of the boastful words the horn was speaking. I kept looking until the beast was slain and its body destroyed and thrown into the blazing fire."
en,NIV,Dan,Dan,26,Dan.7,Dan 7,6,Dan.7.12,Dan 7:12,11,"(The other beasts had been stripped of their authority, but were allowed to live for a period of time.)"
en,NIV,Dan,Dan,26,Dan.7,Dan 7,6,Dan.7.13,Dan 7:13,12,"""In my vision at night I looked, and there before me was one like a son of man, coming with the clouds of heaven. He approached the Ancient of Days and was led into his presence."
en,NIV,Dan,Dan,26,Dan.7,Dan 7,6,Dan.7.14,Dan 7:14,13,"He was given authority, glory and sovereign power; all peoples, nations and men of every language worshiped him. His dominion is an everlasting dominion that will not pass away, and his kingdom is one that will never be destroyed."
en,NIV,Dan,Dan,26,Dan.7,Dan 7,6,Dan.7.15,Dan 7:15,14,"""I, Daniel, was troubled in spirit, and the visions that passed through my mind disturbed me."
en,NIV,Dan,Dan,26,Dan.7,Dan 7,6,Dan.7.16,Dan 7:16,15,"I approached one of those standing there and asked him the true meaning of all this. ""So he told me and gave me the interpretation of these things:"
en,NIV,Dan,Dan,26,Dan.7,Dan 7,6,Dan.7.17,Dan 7:17,16,'The four great beasts are four kingdoms that will rise from the earth.
en,NIV,Dan,Dan,26,Dan.7,Dan 7,6,Dan.7.18,Dan 7:18,17,"But the saints of the Most High will receive the kingdom and will possess it forever-yes, for ever and ever.'"
en,NIV,Dan,Dan,26,Dan.7,Dan 7,6,Dan.7.19,Dan 7:19,18,"""Then I wanted to know the true meaning of the fourth beast, which was different from all the others and most terrifying, with its iron teeth and bronze claws-the beast that crushed and devoured its victims and trampled underfoot whatever was left."
en,NIV,Dan,Dan,26,Dan.7,Dan 7,6,Dan.7.20,Dan 7:20,19,"I also wanted to know about the ten horns on its head and about the other horn that came up, before which three of them fell-the horn that looked more imposing than the others and that had eyes and a mouth that spoke boastfully."
en,NIV,Dan,Dan,26,Dan.7,Dan 7,6,Dan.7.21,Dan 7:21,20,"As I watched, this horn was waging war against the saints and defeating them,"
en,NIV,Dan,Dan,26,Dan.7,Dan 7,6,Dan.7.22,Dan 7:22,21,"until the Ancient of Days came and pronounced judgment in favor of the saints of the Most High, and the time came when they possessed the kingdom."
en,NIV,Dan,Dan,26,Dan.7,Dan 7,6,Dan.7.23,Dan 7:23,22,"""He gave me this explanation: 'The fourth beast is a fourth kingdom that will appear on earth. It will be different from all the other kingdoms and will devour the whole earth, trampling it down and crushing it."
en,NIV,Dan,Dan,26,Dan.7,Dan 7,6,Dan.7.24,Dan 7:24,23,"The ten horns are ten kings who will come from this kingdom. After them another king will arise, different from the earlier ones; he will subdue three kings."
en,NIV,Dan,Dan,26,Dan.7,Dan 7,6,Dan.7.25,Dan 7:25,24,"He will speak against the Most High and oppress his saints and try to change the set times and the laws. The saints will be handed over to him for a time, times and half a time."
en,NIV,Dan,Dan,26,Dan.7,Dan 7,6,Dan.7.26,Dan 7:26,25,"""'But the court will sit, and his power will be taken away and completely destroyed forever."
en,NIV,Dan,Dan,26,Dan.7,Dan 7,6,Dan.7.27,Dan 7:27,26,"Then the sovereignty, power and greatness of the kingdoms under the whole heaven will be handed over to the saints, the people of the Most High. His kingdom will be an everlasting kingdom, and all rulers will worship and obey him.'"
en,NIV,Dan,Dan,26,Dan.7,Dan 7,6,Dan.7.28,Dan 7:28,27,"""This is the end of the matter. I, Daniel, was deeply troubled by my thoughts, and my face turned pale, but I kept the matter to myself."""
en,NIV,Dan,Dan,26,Dan.8,Dan 8,7,Dan.8.1,Dan 8:1,0,"In the third year of King Belshazzar's reign, I, Daniel, had a vision, after the one that had already appeared to me."
en,NIV,Dan,Dan,26,Dan.8,Dan 8,7,Dan.8.2,Dan 8:2,1,In my vision I saw myself in the citadel of Susa in the province of Elam; in the vision I was beside the Ulai Canal.
en,NIV,Dan,Dan,26,Dan.8,Dan 8,7,Dan.8.3,Dan 8:3,2,"I looked up, and there before me was a ram with two horns, standing beside the canal, and the horns were long. One of the horns was longer than the other but grew up later."
en,NIV,Dan,Dan,26,Dan.8,Dan 8,7,Dan.8.4,Dan 8:4,3,"I watched the ram as he charged toward the west and the north and the south. No animal could stand against him, and none could rescue from his power. He did as he pleased and became great."
en,NIV,Dan,Dan,26,Dan.8,Dan 8,7,Dan.8.5,Dan 8:5,4,"As I was thinking about this, suddenly a goat with a prominent horn between his eyes came from the west, crossing the whole earth without touching the ground."
en,NIV,Dan,Dan,26,Dan.8,Dan 8,7,Dan.8.6,Dan 8:6,5,He came toward the two-horned ram I had seen standing beside the canal and charged at him in great rage.
en,NIV,Dan,Dan,26,Dan.8,Dan 8,7,Dan.8.7,Dan 8:7,6,"I saw him attack the ram furiously, striking the ram and shattering his two horns. The ram was powerless to stand against him; the goat knocked him to the ground and trampled on him, and none could rescue the ram from his power."
en,NIV,Dan,Dan,26,Dan.8,Dan 8,7,Dan.8.8,Dan 8:8,7,"The goat became very great, but at the height of his power his large horn was broken off, and in its place four prominent horns grew up toward the four winds of heaven."
en,NIV,Dan,Dan,26,Dan.8,Dan 8,7,Dan.8.9,Dan 8:9,8,"Out of one of them came another horn, which started small but grew in power to the south and to the east and toward the Beautiful Land."
en,NIV,Dan,Dan,26,Dan.8,Dan 8,7,Dan.8.10,Dan 8:10,9,"It grew until it reached the host of the heavens, and it threw some of the starry host down to the earth and trampled on them."
en,NIV,Dan,Dan,26,Dan.8,Dan 8,7,Dan.8.11,Dan 8:11,10,"It set itself up to be as great as the Prince of the host; it took away the daily sacrifice from him, and the place of his sanctuary was brought low."
en,NIV,Dan,Dan,26,Dan.8,Dan 8,7,Dan.8.12,Dan 8:12,11,"Because of rebellion, the host of the saints and the daily sacrifice were given over to it. It prospered in everything it did, and truth was thrown to the ground."
en,NIV,Dan,Dan,26,Dan.8,Dan 8,7,Dan.8.13,Dan 8:13,12,"Then I heard a holy one speaking, and another holy one said to him, ""How long will it take for the vision to be fulfilled-the vision concerning the daily sacrifice, the rebellion that causes desolation, and the surrender of the sanctuary and of the host that will be trampled underfoot?"""
en,NIV,Dan,Dan,26,Dan.8,Dan 8,7,Dan.8.14,Dan 8:14,13,"He said to me, ""It will take 2,300 evenings and mornings; then the sanctuary will be reconsecrated."""
en,NIV,Dan,Dan,26,Dan.8,Dan 8,7,Dan.8.15,Dan 8:15,14,"While I, Daniel, was watching the vision and trying to understand it, there before me stood one who looked like a man."
en,NIV,Dan,Dan,26,Dan.8,Dan 8,7,Dan.8.16,Dan 8:16,15,"And I heard a man's voice from the Ulai calling, ""Gabriel, tell this man the meaning of the vision."""
en,NIV,Dan,Dan,26,Dan.8,Dan 8,7,Dan.8.17,Dan 8:17,16,"As he came near the place where I was standing, I was terrified and fell prostrate. ""Son of man,"" he said to me, ""understand that the vision concerns the time of the end."""
