languageCode,code,bookOsisId,bookSblId,bookOrderIndex,chapterOsisId,chapterSblId,chapterOrderIndex,verseOsisId,verseSblId,verseOrderIndex,text
en,NIV,Dan,Dan,26,Dan.8,Dan 8,7,Dan.8.18,Dan 8:18,17,"While he was speaking to me, I was in a deep sleep, with my face to the ground. Then he touched me and raised me to my feet."
en,NIV,Dan,Dan,26,Dan.8,Dan 8,7,Dan.8.19,Dan 8:19,18,"He said: ""I am going to tell you what will happen later in the time of wrath, because the vision concerns the appointed time of the end."
en,NIV,Dan,Dan,26,Dan.8,Dan 8,7,Dan.8.20,Dan 8:20,19,The two-horned ram that you saw represents the kings of Media and Persia.
en,NIV,Dan,Dan,26,Dan.8,Dan 8,7,Dan.8.21,Dan 8:21,20,"The shaggy goat is the king of Greece, and the large horn between his eyes is the first king."
en,NIV,Dan,Dan,26,Dan.8,Dan 8,7,Dan.8.22,Dan 8:22,21,The four horns that replaced the one that was broken off represent four kingdoms that will emerge from his nation but will not have the same power.
en,NIV,Dan,Dan,26,Dan.8,Dan 8,7,Dan.8.23,Dan 8:23,22,"""In the latter part of their reign, when rebels have become completely wicked, a stern-faced king, a master of intrigue, will arise."
en,NIV,Dan,Dan,26,Dan.8,Dan 8,7,Dan.8.24,Dan 8:24,23,"He will become very strong, but not by his own power. He will cause astounding devastation and will succeed in whatever he does. He will destroy the mighty men and the holy people."
en,NIV,Dan,Dan,26,Dan.8,Dan 8,7,Dan.8.25,Dan 8:25,24,"He will cause deceit to prosper, and he will consider himself superior. When they feel secure, he will destroy many and take his stand against the Prince of princes. Yet he will be destroyed, but not by human power."
en,NIV,Dan,Dan,26,Dan.8,Dan 8,7,Dan.8.26,Dan 8:26,25,"""The vision of the evenings and mornings that has been given you is true, but seal up the vision, for it concerns the distant future."""
en,NIV,Dan,Dan,26,Dan.8,Dan 8,7,Dan.8.27,Dan 8:27,26,"I, Daniel, was exhausted and lay ill for several days. Then I got up and went about the king's business. I was appalled by the vision; it was beyond understanding."
en,NIV,Dan,Dan,26,Dan.9,Dan 9,8,Dan.9.1,Dan 9:1,0,"In the first year of Darius son of Ahasuerus (a Mede by descent), who was made ruler over the Babylonian kingdom-"
en,NIV,Dan,Dan,26,Dan.9,Dan 9,8,Dan.9.2,Dan 9:2,1,"in the first year of his reign, I, Daniel, understood from the Scriptures, according to the word of the LORD given to Jeremiah the prophet, that the desolation of Jerusalem would last seventy years."
en,NIV,Dan,Dan,26,Dan.9,Dan 9,8,Dan.9.3,Dan 9:3,2,"So I turned to the Lord God and pleaded with him in prayer and petition, in fasting, and in sackcloth and ashes."
en,NIV,Dan,Dan,26,Dan.9,Dan 9,8,Dan.9.4,Dan 9:4,3,"I prayed to the LORD my God and confessed: ""O Lord, the great and awesome God, who keeps his covenant of love with all who love him and obey his commands,"
en,NIV,Dan,Dan,26,Dan.9,Dan 9,8,Dan.9.5,Dan 9:5,4,we have sinned and done wrong. We have been wicked and have rebelled; we have turned away from your commands and laws.
en,NIV,Dan,Dan,26,Dan.9,Dan 9,8,Dan.9.6,Dan 9:6,5,"We have not listened to your servants the prophets, who spoke in your name to our kings, our princes and our fathers, and to all the people of the land."
en,NIV,Dan,Dan,26,Dan.9,Dan 9,8,Dan.9.7,Dan 9:7,6,"""Lord, you are righteous, but this day we are covered with shame-the men of Judah and people of Jerusalem and all Israel, both near and far, in all the countries where you have scattered us because of our unfaithfulness to you."
en,NIV,Dan,Dan,26,Dan.9,Dan 9,8,Dan.9.8,Dan 9:8,7,"O LORD, we and our kings, our princes and our fathers are covered with shame because we have sinned against you."
en,NIV,Dan,Dan,26,Dan.9,Dan 9,8,Dan.9.9,Dan 9:9,8,"The Lord our God is merciful and forgiving, even though we have rebelled against him;"
en,NIV,Dan,Dan,26,Dan.9,Dan 9,8,Dan.9.10,Dan 9:10,9,we have not obeyed the LORD our God or kept the laws he gave us through his servants the prophets.
en,NIV,Dan,Dan,26,Dan.9,Dan 9,8,Dan.9.11,Dan 9:11,10,"All Israel has transgressed your law and turned away, refusing to obey you. ""Therefore the curses and sworn judgments written in the Law of Moses, the servant of God, have been poured out on us, because we have sinned against you."
en,NIV,Dan,Dan,26,Dan.9,Dan 9,8,Dan.9.12,Dan 9:12,11,You have fulfilled the words spoken against us and against our rulers by bringing upon us great disaster. Under the whole heaven nothing has ever been done like what has been done to Jerusalem.
en,NIV,Dan,Dan,26,Dan.9,Dan 9,8,Dan.9.13,Dan 9:13,12,"Just as it is written in the Law of Moses, all this disaster has come upon us, yet we have not sought the favor of the LORD our God by turning from our sins and giving attention to your truth."
en,NIV,Dan,Dan,26,Dan.9,Dan 9,8,Dan.9.14,Dan 9:14,13,"The LORD did not hesitate to bring the disaster upon us, for the LORD our God is righteous in everything he does; yet we have not obeyed him."
en,NIV,Dan,Dan,26,Dan.9,Dan 9,8,Dan.9.15,Dan 9:15,14,"""Now, O Lord our God, who brought your people out of Egypt with a mighty hand and who made for yourself a name that endures to this day, we have sinned, we have done wrong."
en,NIV,Dan,Dan,26,Dan.9,Dan 9,8,Dan.9.16,Dan 9:16,15,"O Lord, in keeping with all your righteous acts, turn away your anger and your wrath from Jerusalem, your city, your holy hill. Our sins and the iniquities of our fathers have made Jerusalem and your people an object of scorn to all those around us."
en,NIV,Dan,Dan,26,Dan.9,Dan 9,8,Dan.9.17,Dan 9:17,16,"""Now, our God, hear the prayers and petitions of your servant. For your sake, O Lord, look with favor on your desolate sanctuary."
en,NIV,Dan,Dan,26,Dan.9,Dan 9,8,Dan.9.18,Dan 9:18,17,"Give ear, O God, and hear; open your eyes and see the desolation of the city that bears your Name. We do not make requests of you because we are righteous, but because of your great mercy."
en,NIV,Dan,Dan,26,Dan.9,Dan 9,8,Dan.9.19,Dan 9:19,18,"O Lord, listen! O Lord, forgive! O Lord, hear and act! For your sake, O my God, do not delay, because your city and your people bear your Name."""
en,NIV,Dan,Dan,26,Dan.9,Dan 9,8,Dan.9.20,Dan 9:20,19,"While I was speaking and praying, confessing my sin and the sin of my people Israel and making my request to the LORD my God for his holy hill-"
en,NIV,Dan,Dan,26,Dan.9,Dan 9,8,Dan.9.21,Dan 9:21,20,"while I was still in prayer, Gabriel, the man I had seen in the earlier vision, came to me in swift flight about the time of the evening sacrifice."
en,NIV,Dan,Dan,26,Dan.9,Dan 9,8,Dan.9.22,Dan 9:22,21,"He instructed me and said to me, ""Daniel, I have now come to give you insight and understanding."
en,NIV,Dan,Dan,26,Dan.9,Dan 9,8,Dan.9.23,Dan 9:23,22,"As soon as you began to pray, an answer was given, which I have come to tell you, for you are highly esteemed. Therefore, consider the message and understand the vision:"
en,NIV,Dan,Dan,26,Dan.9,Dan 9,8,Dan.9.24,Dan 9:24,23,"""Seventy 'sevens' are decreed for your people and your holy city to finish transgression, to put an end to sin, to atone for wickedness, to bring in everlasting righteousness, to seal up vision and prophecy and to anoint the most holy."
en,NIV,Dan,Dan,26,Dan.9,Dan 9,8,Dan.9.25,Dan 9:25,24,"""Know and understand this: From the issuing of the decree to restore and rebuild Jerusalem until the Anointed One, the ruler, comes, there will be seven 'sevens,' and sixty-two 'sevens.' It will be rebuilt with streets and a trench, but in times of trouble."
en,NIV,Dan,Dan,26,Dan.9,Dan 9,8,Dan.9.26,Dan 9:26,25,"After the sixty-two 'sevens,' the Anointed One will be cut off and will have nothing. The people of the ruler who will come will destroy the city and the sanctuary. The end will come like a flood: War will continue until the end, and desolations have been decreed."
en,NIV,Dan,Dan,26,Dan.9,Dan 9,8,Dan.9.27,Dan 9:27,26,"He will confirm a covenant with many for one 'seven.' In the middle of the 'seven' he will put an end to sacrifice and offering. And on a wing of the temple he will set up an abomination that causes desolation, until the end that is decreed is poured out on him. """
en,NIV,Dan,Dan,26,Dan.10,Dan 10,9,Dan.10.1,Dan 10:1,0,"In the third year of Cyrus king of Persia, a revelation was given to Daniel (who was called Belteshazzar). Its message was true and it concerned a great war. The understanding of the message came to him in a vision."
en,NIV,Dan,Dan,26,Dan.10,Dan 10,9,Dan.10.2,Dan 10:2,1,"At that time I, Daniel, mourned for three weeks."
en,NIV,Dan,Dan,26,Dan.10,Dan 10,9,Dan.10.3,Dan 10:3,2,I ate no choice food; no meat or wine touched my lips; and I used no lotions at all until the three weeks were over.
en,NIV,Dan,Dan,26,Dan.10,Dan 10,9,Dan.10.4,Dan 10:4,3,"On the twenty-fourth day of the first month, as I was standing on the bank of the great river, the Tigris,"
en,NIV,Dan,Dan,26,Dan.10,Dan 10,9,Dan.10.5,Dan 10:5,4,"I looked up and there before me was a man dressed in linen, with a belt of the finest gold around his waist."
en,NIV,Dan,Dan,26,Dan.10,Dan 10,9,Dan.10.6,Dan 10:6,5,"His body was like chrysolite, his face like lightning, his eyes like flaming torches, his arms and legs like the gleam of burnished bronze, and his voice like the sound of a multitude."
en,NIV,Dan,Dan,26,Dan.10,Dan 10,9,Dan.10.7,Dan 10:7,6,"I, Daniel, was the only one who saw the vision; the men with me did not see it, but such terror overwhelmed them that they fled and hid themselves."
en,NIV,Dan,Dan,26,Dan.10,Dan 10,9,Dan.10.8,Dan 10:8,7,"So I was left alone, gazing at this great vision; I had no strength left, my face turned deathly pale and I was helpless."
en,NIV,Dan,Dan,26,Dan.10,Dan 10,9,Dan.10.9,Dan 10:9,8,"Then I heard him speaking, and as I listened to him, I fell into a deep sleep, my face to the ground."
en,NIV,Dan,Dan,26,Dan.10,Dan 10,9,Dan.10.10,Dan 10:10,9,A hand touched me and set me trembling on my hands and knees.
en,NIV,Dan,Dan,26,Dan.10,Dan 10,9,Dan.10.11,Dan 10:11,10,"He said, ""Daniel, you who are highly esteemed, consider carefully the words I am about to speak to you, and stand up, for I have now been sent to you."" And when he said this to me, I stood up trembling."
en,NIV,Dan,Dan,26,Dan.10,Dan 10,9,Dan.10.12,Dan 10:12,11,"Then he continued, ""Do not be afraid, Daniel. Since the first day that you set your mind to gain understanding and to humble yourself before your God, your words were heard, and I have come in response to them."
en,NIV,Dan,Dan,26,Dan.10,Dan 10,9,Dan.10.13,Dan 10:13,12,"But the prince of the Persian kingdom resisted me twenty-one days. Then Michael, one of the chief princes, came to help me, because I was detained there with the king of Persia."
en,NIV,Dan,Dan,26,Dan.10,Dan 10,9,Dan.10.14,Dan 10:14,13,"Now I have come to explain to you what will happen to your people in the future, for the vision concerns a time yet to come."""
en,NIV,Dan,Dan,26,Dan.10,Dan 10,9,Dan.10.15,Dan 10:15,14,"While he was saying this to me, I bowed with my face toward the ground and was speechless."
en,NIV,Dan,Dan,26,Dan.10,Dan 10,9,Dan.10.16,Dan 10:16,15,"Then one who looked like a man touched my lips, and I opened my mouth and began to speak. I said to the one standing before me, ""I am overcome with anguish because of the vision, my lord, and I am helpless."
en,NIV,Dan,Dan,26,Dan.10,Dan 10,9,Dan.10.17,Dan 10:17,16,"How can I, your servant, talk with you, my lord? My strength is gone and I can hardly breathe."""
en,NIV,Dan,Dan,26,Dan.10,Dan 10,9,Dan.10.18,Dan 10:18,17,Again the one who looked like a man touched me and gave me strength.
en,NIV,Dan,Dan,26,Dan.10,Dan 10,9,Dan.10.19,Dan 10:19,18,"""Do not be afraid, O man highly esteemed,"" he said. ""Peace! Be strong now; be strong."" When he spoke to me, I was strengthened and said, ""Speak, my lord, since you have given me strength."""
en,NIV,Dan,Dan,26,Dan.10,Dan 10,9,Dan.10.20,Dan 10:20,19,"So he said, ""Do you know why I have come to you? Soon I will return to fight against the prince of Persia, and when I go, the prince of Greece will come;"
en,NIV,Dan,Dan,26,Dan.10,Dan 10,9,Dan.10.21,Dan 10:21,20,"but first I will tell you what is written in the Book of Truth. (No one supports me against them except Michael, your prince."
en,NIV,Dan,Dan,26,Dan.11,Dan 11,10,Dan.11.1,Dan 11:1,0,"And in the first year of Darius the Mede, I took my stand to support and protect him.)"
en,NIV,Dan,Dan,26,Dan.11,Dan 11,10,Dan.11.2,Dan 11:2,1,"""Now then, I tell you the truth: Three more kings will appear in Persia, and then a fourth, who will be far richer than all the others. When he has gained power by his wealth, he will stir up everyone against the kingdom of Greece."
en,NIV,Dan,Dan,26,Dan.11,Dan 11,10,Dan.11.3,Dan 11:3,2,"Then a mighty king will appear, who will rule with great power and do as he pleases."
en,NIV,Dan,Dan,26,Dan.11,Dan 11,10,Dan.11.4,Dan 11:4,3,"After he has appeared, his empire will be broken up and parceled out toward the four winds of heaven. It will not go to his descendants, nor will it have the power he exercised, because his empire will be uprooted and given to others."
en,NIV,Dan,Dan,26,Dan.11,Dan 11,10,Dan.11.5,Dan 11:5,4,"""The king of the South will become strong, but one of his commanders will become even stronger than he and will rule his own kingdom with great power."
en,NIV,Dan,Dan,26,Dan.11,Dan 11,10,Dan.11.6,Dan 11:6,5,"After some years, they will become allies. The daughter of the king of the South will go to the king of the North to make an alliance, but she will not retain her power, and he and his power will not last. In those days she will be handed over, together with her royal escort and her father and the one who supported her."
en,NIV,Dan,Dan,26,Dan.11,Dan 11,10,Dan.11.7,Dan 11:7,6,"""One from her family line will arise to take her place. He will attack the forces of the king of the North and enter his fortress; he will fight against them and be victorious."
en,NIV,Dan,Dan,26,Dan.11,Dan 11,10,Dan.11.8,Dan 11:8,7,"He will also seize their gods, their metal images and their valuable articles of silver and gold and carry them off to Egypt. For some years he will leave the king of the North alone."
en,NIV,Dan,Dan,26,Dan.11,Dan 11,10,Dan.11.9,Dan 11:9,8,Then the king of the North will invade the realm of the king of the South but will retreat to his own country.
en,NIV,Dan,Dan,26,Dan.11,Dan 11,10,Dan.11.10,Dan 11:10,9,"His sons will prepare for war and assemble a great army, which will sweep on like an irresistible flood and carry the battle as far as his fortress."
en,NIV,Dan,Dan,26,Dan.11,Dan 11,10,Dan.11.11,Dan 11:11,10,"""Then the king of the South will march out in a rage and fight against the king of the North, who will raise a large army, but it will be defeated."
en,NIV,Dan,Dan,26,Dan.11,Dan 11,10,Dan.11.12,Dan 11:12,11,"When the army is carried off, the king of the South will be filled with pride and will slaughter many thousands, yet he will not remain triumphant."
en,NIV,Dan,Dan,26,Dan.11,Dan 11,10,Dan.11.13,Dan 11:13,12,"For the king of the North will muster another army, larger than the first; and after several years, he will advance with a huge army fully equipped."
en,NIV,Dan,Dan,26,Dan.11,Dan 11,10,Dan.11.14,Dan 11:14,13,"""In those times many will rise against the king of the South. The violent men among your own people will rebel in fulfillment of the vision, but without success."
en,NIV,Dan,Dan,26,Dan.11,Dan 11,10,Dan.11.15,Dan 11:15,14,Then the king of the North will come and build up siege ramps and will capture a fortified city. The forces of the South will be powerless to resist; even their best troops will not have the strength to stand.
en,NIV,Dan,Dan,26,Dan.11,Dan 11,10,Dan.11.16,Dan 11:16,15,The invader will do as he pleases; no one will be able to stand against him. He will establish himself in the Beautiful Land and will have the power to destroy it.
en,NIV,Dan,Dan,26,Dan.11,Dan 11,10,Dan.11.17,Dan 11:17,16,"He will determine to come with the might of his entire kingdom and will make an alliance with the king of the South. And he will give him a daughter in marriage in order to overthrow the kingdom, but his plans will not succeed or help him."
en,NIV,Dan,Dan,26,Dan.11,Dan 11,10,Dan.11.18,Dan 11:18,17,"Then he will turn his attention to the coastlands and will take many of them, but a commander will put an end to his insolence and will turn his insolence back upon him."
en,NIV,Dan,Dan,26,Dan.11,Dan 11,10,Dan.11.19,Dan 11:19,18,"After this, he will turn back toward the fortresses of his own country but will stumble and fall, to be seen no more."
en,NIV,Dan,Dan,26,Dan.11,Dan 11,10,Dan.11.20,Dan 11:20,19,"""His successor will send out a tax collector to maintain the royal splendor. In a few years, however, he will be destroyed, yet not in anger or in battle."
en,NIV,Dan,Dan,26,Dan.11,Dan 11,10,Dan.11.21,Dan 11:21,20,"""He will be succeeded by a contemptible person who has not been given the honor of royalty. He will invade the kingdom when its people feel secure, and he will seize it through intrigue."
en,NIV,Dan,Dan,26,Dan.11,Dan 11,10,Dan.11.22,Dan 11:22,21,Then an overwhelming army will be swept away before him; both it and a prince of the covenant will be destroyed.
en,NIV,Dan,Dan,26,Dan.11,Dan 11,10,Dan.11.23,Dan 11:23,22,"After coming to an agreement with him, he will act deceitfully, and with only a few people he will rise to power."
en,NIV,Dan,Dan,26,Dan.11,Dan 11,10,Dan.11.24,Dan 11:24,23,"When the richest provinces feel secure, he will invade them and will achieve what neither his fathers nor his forefathers did. He will distribute plunder, loot and wealth among his followers. He will plot the overthrow of fortresses-but only for a time."
en,NIV,Dan,Dan,26,Dan.11,Dan 11,10,Dan.11.25,Dan 11:25,24,"""With a large army he will stir up his strength and courage against the king of the South. The king of the South will wage war with a large and very powerful army, but he will not be able to stand because of the plots devised against him."
en,NIV,Dan,Dan,26,Dan.11,Dan 11,10,Dan.11.26,Dan 11:26,25,"Those who eat from the king's provisions will try to destroy him; his army will be swept away, and many will fall in battle."
en,NIV,Dan,Dan,26,Dan.11,Dan 11,10,Dan.11.27,Dan 11:27,26,"The two kings, with their hearts bent on evil, will sit at the same table and lie to each other, but to no avail, because an end will still come at the appointed time."
en,NIV,Dan,Dan,26,Dan.11,Dan 11,10,Dan.11.28,Dan 11:28,27,"The king of the North will return to his own country with great wealth, but his heart will be set against the holy covenant. He will take action against it and then return to his own country."
en,NIV,Dan,Dan,26,Dan.11,Dan 11,10,Dan.11.29,Dan 11:29,28,"""At the appointed time he will invade the South again, but this time the outcome will be different from what it was before."
en,NIV,Dan,Dan,26,Dan.11,Dan 11,10,Dan.11.30,Dan 11:30,29,"Ships of the western coastlands will oppose him, and he will lose heart. Then he will turn back and vent his fury against the holy covenant. He will return and show favor to those who forsake the holy covenant."
en,NIV,Dan,Dan,26,Dan.11,Dan 11,10,Dan.11.31,Dan 11:31,30,"""His armed forces will rise up to desecrate the temple fortress and will abolish the daily sacrifice. Then they will set up the abomination that causes desolation."
en,NIV,Dan,Dan,26,Dan.11,Dan 11,10,Dan.11.32,Dan 11:32,31,"With flattery he will corrupt those who have violated the covenant, but the people who know their God will firmly resist him."
en,NIV,Dan,Dan,26,Dan.11,Dan 11,10,Dan.11.33,Dan 11:33,32,"""Those who are wise will instruct many, though for a time they will fall by the sword or be burned or captured or plundered."
en,NIV,Dan,Dan,26,Dan.11,Dan 11,10,Dan.11.34,Dan 11:34,33,"When they fall, they will receive a little help, and many who are not sincere will join them."
en,NIV,Dan,Dan,26,Dan.11,Dan 11,10,Dan.11.35,Dan 11:35,34,"Some of the wise will stumble, so that they may be refined, purified and made spotless until the time of the end, for it will still come at the appointed time."
en,NIV,Dan,Dan,26,Dan.11,Dan 11,10,Dan.11.36,Dan 11:36,35,"""The king will do as he pleases. He will exalt and magnify himself above every god and will say unheard-of things against the God of gods. He will be successful until the time of wrath is completed, for what has been determined must take place."
en,NIV,Dan,Dan,26,Dan.11,Dan 11,10,Dan.11.37,Dan 11:37,36,"He will show no regard for the gods of his fathers or for the one desired by women, nor will he regard any god, but will exalt himself above them all."
en,NIV,Dan,Dan,26,Dan.11,Dan 11,10,Dan.11.38,Dan 11:38,37,"Instead of them, he will honor a god of fortresses; a god unknown to his fathers he will honor with gold and silver, with precious stones and costly gifts."
en,NIV,Dan,Dan,26,Dan.11,Dan 11,10,Dan.11.39,Dan 11:39,38,He will attack the mightiest fortresses with the help of a foreign god and will greatly honor those who acknowledge him. He will make them rulers over many people and will distribute the land at a price.
en,NIV,Dan,Dan,26,Dan.11,Dan 11,10,Dan.11.40,Dan 11:40,39,"""At the time of the end the king of the South will engage him in battle, and the king of the North will storm out against him with chariots and cavalry and a great fleet of ships. He will invade many countries and sweep through them like a flood."
en,NIV,Dan,Dan,26,Dan.11,Dan 11,10,Dan.11.41,Dan 11:41,40,"He will also invade the Beautiful Land. Many countries will fall, but Edom, Moab and the leaders of Ammon will be delivered from his hand."
en,NIV,Dan,Dan,26,Dan.11,Dan 11,10,Dan.11.42,Dan 11:42,41,He will extend his power over many countries; Egypt will not escape.
en,NIV,Dan,Dan,26,Dan.11,Dan 11,10,Dan.11.43,Dan 11:43,42,"He will gain control of the treasures of gold and silver and all the riches of Egypt, with the Libyans and Nubians in submission."
en,NIV,Dan,Dan,26,Dan.11,Dan 11,10,Dan.11.44,Dan 11:44,43,"But reports from the east and the north will alarm him, and he will set out in a great rage to destroy and annihilate many."
en,NIV,Dan,Dan,26,Dan.11,Dan 11,10,Dan.11.45,Dan 11:45,44,"He will pitch his royal tents between the seas at the beautiful holy mountain. Yet he will come to his end, and no one will help him."
en,NIV,Dan,Dan,26,Dan.12,Dan 12,11,Dan.12.1,Dan 12:1,0,"""At that time Michael, the great prince who protects your people, will arise. There will be a time of distress such as has not happened from the beginning of nations until then. But at that time your people-everyone whose name is found written in the book-will be delivered."
en,NIV,Dan,Dan,26,Dan.12,Dan 12,11,Dan.12.2,Dan 12:2,1,"Multitudes who sleep in the dust of the earth will awake: some to everlasting life, others to shame and everlasting contempt."
en,NIV,Dan,Dan,26,Dan.12,Dan 12,11,Dan.12.3,Dan 12:3,2,"Those who are wise will shine like the brightness of the heavens, and those who lead many to righteousness, like the stars for ever and ever."
en,NIV,Dan,Dan,26,Dan.12,Dan 12,11,Dan.12.4,Dan 12:4,3,"But you, Daniel, close up and seal the words of the scroll until the time of the end. Many will go here and there to increase knowledge."""
en,NIV,Dan,Dan,26,Dan.12,Dan 12,11,Dan.12.5,Dan 12:5,4,"Then I, Daniel, looked, and there before me stood two others, one on this bank of the river and one on the opposite bank."
en,NIV,Dan,Dan,26,Dan.12,Dan 12,11,Dan.12.6,Dan 12:6,5,"One of them said to the man clothed in linen, who was above the waters of the river, ""How long will it be before these astonishing things are fulfilled?"""
en,NIV,Dan,Dan,26,Dan.12,Dan 12,11,Dan.12.7,Dan 12:7,6,"The man clothed in linen, who was above the waters of the river, lifted his right hand and his left hand toward heaven, and I heard him swear by him who lives forever, saying, ""It will be for a time, times and half a time. When the power of the holy people has been finally broken, all these things will be completed."""
en,NIV,Dan,Dan,26,Dan.12,Dan 12,11,Dan.12.8,Dan 12:8,7,"I heard, but I did not understand. So I asked, ""My lord, what will the outcome of all this be?"""
en,NIV,Dan,Dan,26,Dan.12,Dan 12,11,Dan.12.9,Dan 12:9,8,"He replied, ""Go your way, Daniel, because the words are closed up and sealed until the time of the end."
en,NIV,Dan,Dan,26,Dan.12,Dan 12,11,Dan.12.10,Dan 12:10,9,"Many will be purified, made spotless and refined, but the wicked will continue to be wicked. None of the wicked will understand, but those who are wise will understand."
en,NIV,Dan,Dan,26,Dan.12,Dan 12,11,Dan.12.11,Dan 12:11,10,"""From the time that the daily sacrifice is abolished and the abomination that causes desolation is set up, there will be 1,290 days."
en,NIV,Dan,Dan,26,Dan.12,Dan 12,11,Dan.12.12,Dan 12:12,11,"Blessed is the one who waits for and reaches the end of the 1,335 days."
en,NIV,Dan,Dan,26,Dan.12,Dan 12,11,Dan.12.13,Dan 12:13,12,"""As for you, go your way till the end. You will rest, and then at the end of the days you will rise to receive your allotted inheritance."""
