languageCode,code,bookOsisId,bookSblId,bookOrderIndex,chapterOsisId,chapterSblId,chapterOrderIndex,verseOsisId,verseSblId,verseOrderIndex,text
la,VULGATA,Deut,Deut,4,Deut.14,Deut 14,13,Deut.14.22,Deut 14:22,21,decimam partem separabis de cunctis frugibus tuis quae nascuntur in terra per annos singulos
la,VULGATA,Deut,Deut,4,Deut.14,Deut 14,13,Deut.14.23,Deut 14:23,22,et comedes in conspectu Domini Dei tui in loco quem elegerit ut in eo nomen illius invocetur decimam frumenti tui et vini et olei et primogenita de armentis et ovibus tuis ut discas timere Dominum Deum tuum omni tempore
la,VULGATA,Deut,Deut,4,Deut.14,Deut 14,13,Deut.14.24,Deut 14:24,23,cum autem longior fuerit via et locus quem elegerit Dominus Deus tuus tibique benedixerit nec potueris ad eum haec cuncta portare
la,VULGATA,Deut,Deut,4,Deut.14,Deut 14,13,Deut.14.25,Deut 14:25,24,vendes omnia et in pretium rediges portabisque manu tua et proficisceris ad locum quem elegerit Dominus Deus tuus
la,VULGATA,Deut,Deut,4,Deut.14,Deut 14,13,Deut.14.26,Deut 14:26,25,et emes ex eadem pecunia quicquid tibi placuerit sive ex armentis sive ex ovibus vinum quoque et siceram et omne quod desiderat anima tua et comedes coram Domino Deo tuo et epulaberis tu et domus tua
la,VULGATA,Deut,Deut,4,Deut.14,Deut 14,13,Deut.14.27,Deut 14:27,26,et Levita qui intra portas tuas est cave ne derelinquas eum quia non habet aliam partem in possessione tua
la,VULGATA,Deut,Deut,4,Deut.14,Deut 14,13,Deut.14.28,Deut 14:28,27,anno tertio separabis aliam decimam ex omnibus quae nascuntur tibi eo tempore et repones intra ianuas tuas
la,VULGATA,Deut,Deut,4,Deut.14,Deut 14,13,Deut.14.29,Deut 14:29,28,venietque Levites qui aliam non habet partem nec possessionem tecum et peregrinus et pupillus ac vidua qui intra portas tuas sunt et comedent et saturabuntur ut benedicat tibi Dominus Deus tuus in cunctis operibus manuum tuarum quae feceris
la,VULGATA,Deut,Deut,4,Deut.15,Deut 15,14,Deut.15.1,Deut 15:1,0,septimo anno facies remissionem
la,VULGATA,Deut,Deut,4,Deut.15,Deut 15,14,Deut.15.2,Deut 15:2,1,quae hoc ordine celebrabitur cui debetur aliquid ab amico vel proximo ac fratre suo repetere non poterit quia annus remissionis est Domini
la,VULGATA,Deut,Deut,4,Deut.15,Deut 15,14,Deut.15.3,Deut 15:3,2,a peregrino et advena exiges civem et propinquum repetendi non habes potestatem
la,VULGATA,Deut,Deut,4,Deut.15,Deut 15,14,Deut.15.4,Deut 15:4,3,et omnino indigens et mendicus non erit inter vos ut benedicat tibi Dominus in terra quam traditurus est tibi in possessionem
la,VULGATA,Deut,Deut,4,Deut.15,Deut 15,14,Deut.15.5,Deut 15:5,4,si tamen audieris vocem Domini Dei tui et custodieris universa quae iussit et quae ego hodie praecipio tibi benedicet tibi ut pollicitus est
la,VULGATA,Deut,Deut,4,Deut.15,Deut 15,14,Deut.15.6,Deut 15:6,5,fenerabis gentibus multis et ipse a nullo accipies mutuum dominaberis nationibus plurimis et tui nemo dominabitur
la,VULGATA,Deut,Deut,4,Deut.15,Deut 15,14,Deut.15.7,Deut 15:7,6,si unus de fratribus tuis qui morantur intra portas civitatis tuae in terra quam Dominus Deus tuus daturus est tibi ad paupertatem venerit non obdurabis cor tuum nec contrahes manum
la,VULGATA,Deut,Deut,4,Deut.15,Deut 15,14,Deut.15.8,Deut 15:8,7,sed aperies eam pauperi et dabis mutuum quod eum indigere perspexeris
la,VULGATA,Deut,Deut,4,Deut.15,Deut 15,14,Deut.15.9,Deut 15:9,8,cave ne forte subripiat tibi impia cogitatio et dicas in corde tuo adpropinquat septimus annus remissionis et avertas oculos a paupere fratre tuo nolens ei quod postulat mutuum commodare ne clamet contra te ad Dominum et fiat tibi in peccatum
la,VULGATA,Deut,Deut,4,Deut.15,Deut 15,14,Deut.15.10,Deut 15:10,9,sed dabis ei nec ages quippiam callide in eius necessitatibus sublevandis ut benedicat tibi Dominus Deus tuus in omni tempore et in cunctis ad quae manum miseris
la,VULGATA,Deut,Deut,4,Deut.15,Deut 15,14,Deut.15.11,Deut 15:11,10,non deerunt pauperes in terra habitationis tuae idcirco ego praecipio tibi ut aperias manum fratri tuo egeno et pauperi qui tecum versatur in terra
la,VULGATA,Deut,Deut,4,Deut.15,Deut 15,14,Deut.15.12,Deut 15:12,11,cum tibi venditus fuerit frater tuus hebraeus aut hebraea et sex annis servierit tibi in septimo anno dimittes eum liberum
la,VULGATA,Deut,Deut,4,Deut.15,Deut 15,14,Deut.15.13,Deut 15:13,12,et quem libertate donaveris nequaquam vacuum abire patieris
la,VULGATA,Deut,Deut,4,Deut.15,Deut 15,14,Deut.15.14,Deut 15:14,13,sed dabis viaticum de gregibus et de area et torculari tuo quibus Dominus Deus tuus benedixerit tibi
la,VULGATA,Deut,Deut,4,Deut.15,Deut 15,14,Deut.15.15,Deut 15:15,14,memento quod et ipse servieris in terra Aegypti et liberaverit te Dominus Deus tuus et idcirco ego nunc praecipiam tibi
la,VULGATA,Deut,Deut,4,Deut.15,Deut 15,14,Deut.15.16,Deut 15:16,15,sin autem dixerit nolo egredi eo quod diligat te et domum tuam et bene sibi apud te esse sentiat
la,VULGATA,Deut,Deut,4,Deut.15,Deut 15,14,Deut.15.17,Deut 15:17,16,adsumes subulam et perforabis aurem eius in ianua domus tuae et serviet tibi usque in aeternum ancillae quoque similiter facies
la,VULGATA,Deut,Deut,4,Deut.15,Deut 15,14,Deut.15.18,Deut 15:18,17,non avertes ab eis oculos tuos quando dimiseris eos liberos quoniam iuxta mercedem mercennarii per sex annos servivit tibi ut benedicat tibi Dominus Deus tuus in cunctis operibus quae agis
la,VULGATA,Deut,Deut,4,Deut.15,Deut 15,14,Deut.15.19,Deut 15:19,18,de primogenitis quae nascuntur in armentis et ovibus tuis quicquid sexus est masculini sanctificabis Domino Deo tuo non operaberis in primogenito bovis et non tondebis primogenita ovium
la,VULGATA,Deut,Deut,4,Deut.15,Deut 15,14,Deut.15.20,Deut 15:20,19,in conspectu Domini Dei tui comedes ea per annos singulos in loco quem elegerit Dominus tu et domus tua
la,VULGATA,Deut,Deut,4,Deut.15,Deut 15,14,Deut.15.21,Deut 15:21,20,sin autem habuerit maculam et vel claudum fuerit vel caecum aut in aliqua parte deforme vel debile non immolabitur Domino Deo tuo
la,VULGATA,Deut,Deut,4,Deut.15,Deut 15,14,Deut.15.22,Deut 15:22,21,sed intra portas urbis tuae comedes illud tam mundus quam inmundus similiter vescentur eis quasi caprea et cervo
la,VULGATA,Deut,Deut,4,Deut.15,Deut 15,14,Deut.15.23,Deut 15:23,22,hoc solum observabis ut sanguinem eorum non comedas sed effundas in terram quasi aquam
la,VULGATA,Deut,Deut,4,Deut.16,Deut 16,15,Deut.16.1,Deut 16:1,0,observa mensem novarum frugum et verni primum temporis ut facias phase Domino Deo tuo quoniam in isto mense eduxit te Dominus Deus tuus de Aegypto nocte
la,VULGATA,Deut,Deut,4,Deut.16,Deut 16,15,Deut.16.2,Deut 16:2,1,immolabisque phase Domino Deo tuo de ovibus et de bubus in loco quem elegerit Dominus Deus tuus ut habitet nomen eius ibi
la,VULGATA,Deut,Deut,4,Deut.16,Deut 16,15,Deut.16.3,Deut 16:3,2,non comedes in eo panem fermentatum septem diebus comedes absque fermento adflictionis panem quoniam in pavore egressus es de Aegypto ut memineris diei egressionis tuae de Aegypto omnibus diebus vitae tuae
la,VULGATA,Deut,Deut,4,Deut.16,Deut 16,15,Deut.16.4,Deut 16:4,3,non apparebit fermentum in omnibus terminis tuis septem diebus et non manebit de carnibus eius quod immolatum est vesperi in die primo mane
la,VULGATA,Deut,Deut,4,Deut.16,Deut 16,15,Deut.16.5,Deut 16:5,4,non poteris immolare phase in qualibet urbium tuarum quas Dominus Deus tuus daturus est tibi
la,VULGATA,Deut,Deut,4,Deut.16,Deut 16,15,Deut.16.6,Deut 16:6,5,sed in loco quem elegerit Dominus Deus tuus ut habitet nomen eius ibi immolabis phase vesperi ad solis occasum quando egressus es de Aegypto
la,VULGATA,Deut,Deut,4,Deut.16,Deut 16,15,Deut.16.7,Deut 16:7,6,et coques et comedes in loco quem elegerit Dominus Deus tuus maneque consurgens vades in tabernacula tua
la,VULGATA,Deut,Deut,4,Deut.16,Deut 16,15,Deut.16.8,Deut 16:8,7,sex diebus comedes azyma et in die septimo quia collecta est Domini Dei tui non facies opus
la,VULGATA,Deut,Deut,4,Deut.16,Deut 16,15,Deut.16.9,Deut 16:9,8,septem ebdomadas numerabis tibi ab ea die qua falcem in segetem miseris
la,VULGATA,Deut,Deut,4,Deut.16,Deut 16,15,Deut.16.10,Deut 16:10,9,et celebrabis diem festum ebdomadarum Domino Deo tuo oblationem spontaneam manus tuae quam offeres iuxta benedictionem Domini Dei tui
la,VULGATA,Deut,Deut,4,Deut.16,Deut 16,15,Deut.16.11,Deut 16:11,10,et epulaberis coram Domino Deo tuo tu et filius tuus et filia tua et servus tuus et ancilla et Levites qui est intra portas tuas et advena ac pupillus et vidua qui morantur vobiscum in loco quem elegerit Dominus Deus tuus ut habitet nomen eius ibi
la,VULGATA,Deut,Deut,4,Deut.16,Deut 16,15,Deut.16.12,Deut 16:12,11,et recordaberis quoniam servus fueris in Aegypto custodiesque ac facies quae praecepta sunt
la,VULGATA,Deut,Deut,4,Deut.16,Deut 16,15,Deut.16.13,Deut 16:13,12,sollemnitatem quoque tabernaculorum celebrabis per septem dies quando collegeris de area et torculari fruges tuas
la,VULGATA,Deut,Deut,4,Deut.16,Deut 16,15,Deut.16.14,Deut 16:14,13,et epulaberis in festivitate tua tu et filius tuus et filia et servus tuus et ancilla Levites quoque et advena et pupillus ac vidua qui intra portas tuas sunt
la,VULGATA,Deut,Deut,4,Deut.16,Deut 16,15,Deut.16.15,Deut 16:15,14,septem diebus Domino Deo tuo festa celebrabis in loco quem elegerit Dominus benedicetque tibi Dominus Deus tuus in cunctis frugibus tuis et in omni opere manuum tuarum erisque in laetitia
la,VULGATA,Deut,Deut,4,Deut.16,Deut 16,15,Deut.16.16,Deut 16:16,15,tribus vicibus per annum apparebit omne masculinum tuum in conspectu Domini Dei tui in loco quem elegerit in sollemnitate azymorum et in sollemnitate ebdomadarum et in sollemnitate tabernaculorum non apparebit ante Dominum vacuus
la,VULGATA,Deut,Deut,4,Deut.16,Deut 16,15,Deut.16.17,Deut 16:17,16,sed offeret unusquisque secundum quod habuerit iuxta benedictionem Domini Dei sui quam dederit ei
la,VULGATA,Deut,Deut,4,Deut.16,Deut 16,15,Deut.16.18,Deut 16:18,17,iudices et magistros constitues in omnibus portis tuis quas Dominus Deus tuus dederit tibi per singulas tribus tuas ut iudicent populum iusto iudicio
la,VULGATA,Deut,Deut,4,Deut.16,Deut 16,15,Deut.16.19,Deut 16:19,18,nec in alteram partem declinent non accipies personam nec munera quia munera excaecant oculos sapientium et mutant verba iustorum
la,VULGATA,Deut,Deut,4,Deut.16,Deut 16,15,Deut.16.20,Deut 16:20,19,iuste quod iustum est persequeris ut vivas et possideas terram quam Dominus Deus tuus dederit tibi
la,VULGATA,Deut,Deut,4,Deut.16,Deut 16,15,Deut.16.21,Deut 16:21,20,non plantabis lucum et omnem arborem iuxta altare Domini Dei tui
la,VULGATA,Deut,Deut,4,Deut.16,Deut 16,15,Deut.16.22,Deut 16:22,21,nec facies tibi atque constitues statuam quae odit Dominus Deus tuus
la,VULGATA,Deut,Deut,4,Deut.17,Deut 17,16,Deut.17.1,Deut 17:1,0,non immolabis Domino Deo tuo bovem et ovem in quo est macula aut quippiam vitii quia abominatio est Domini Dei tui
la,VULGATA,Deut,Deut,4,Deut.17,Deut 17,16,Deut.17.2,Deut 17:2,1,cum repperti fuerint apud te intra unam portarum tuarum quas Dominus Deus tuus dabit tibi vir aut mulier qui faciant malum in conspectu Domini Dei tui et transgrediantur pactum illius
la,VULGATA,Deut,Deut,4,Deut.17,Deut 17,16,Deut.17.3,Deut 17:3,2,ut vadant et serviant diis alienis et adorent eos solem et lunam et omnem militiam caeli quae non praecepi
la,VULGATA,Deut,Deut,4,Deut.17,Deut 17,16,Deut.17.4,Deut 17:4,3,et hoc tibi fuerit nuntiatum audiensque inquisieris diligenter et verum esse reppereris et abominatio facta est in Israhel
la,VULGATA,Deut,Deut,4,Deut.17,Deut 17,16,Deut.17.5,Deut 17:5,4,educes virum ac mulierem qui rem sceleratissimam perpetrarunt ad portas civitatis tuae et lapidibus obruentur
la,VULGATA,Deut,Deut,4,Deut.17,Deut 17,16,Deut.17.6,Deut 17:6,5,in ore duorum aut trium testium peribit qui interficietur nemo occidatur uno contra se dicente testimonium
la,VULGATA,Deut,Deut,4,Deut.17,Deut 17,16,Deut.17.7,Deut 17:7,6,manus testium prima interficiet eum et manus reliqui populi extrema mittetur ut auferas malum de medio tui
la,VULGATA,Deut,Deut,4,Deut.17,Deut 17,16,Deut.17.8,Deut 17:8,7,si difficile et ambiguum apud te iudicium esse perspexeris inter sanguinem et sanguinem causam et causam lepram et non lepram et iudicum intra portas tuas videris verba variari surge et ascende ad locum quem elegerit Dominus Deus tuus
la,VULGATA,Deut,Deut,4,Deut.17,Deut 17,16,Deut.17.9,Deut 17:9,8,veniesque ad sacerdotes levitici generis et ad iudicem qui fuerit illo tempore quaeresque ab eis qui indicabunt tibi iudicii veritatem
la,VULGATA,Deut,Deut,4,Deut.17,Deut 17,16,Deut.17.10,Deut 17:10,9,et facies quodcumque dixerint qui praesunt loco quem elegerit Dominus et docuerint te
la,VULGATA,Deut,Deut,4,Deut.17,Deut 17,16,Deut.17.11,Deut 17:11,10,iuxta legem eius sequeris sententiam eorum nec declinabis ad dextram vel ad sinistram
la,VULGATA,Deut,Deut,4,Deut.17,Deut 17,16,Deut.17.12,Deut 17:12,11,qui autem superbierit nolens oboedire sacerdotis imperio qui eo tempore ministrat Domino Deo tuo et decreto iudicis morietur homo ille et auferes malum de Israhel
la,VULGATA,Deut,Deut,4,Deut.17,Deut 17,16,Deut.17.13,Deut 17:13,12,cunctusque populus audiens timebit ut nullus deinceps intumescat superbia
la,VULGATA,Deut,Deut,4,Deut.17,Deut 17,16,Deut.17.14,Deut 17:14,13,cum ingressus fueris terram quam Dominus Deus tuus dabit tibi et possederis eam habitaverisque in illa et dixeris constituam super me regem sicut habent omnes per circuitum nationes
la,VULGATA,Deut,Deut,4,Deut.17,Deut 17,16,Deut.17.15,Deut 17:15,14,eum constitues quem Dominus Deus tuus elegerit de numero fratrum tuorum non poteris alterius gentis hominem regem facere qui non sit frater tuus
la,VULGATA,Deut,Deut,4,Deut.17,Deut 17,16,Deut.17.16,Deut 17:16,15,cumque fuerit constitutus non multiplicabit sibi equos nec reducet populum in Aegyptum equitatus numero sublevatus praesertim cum Dominus praeceperit vobis ut nequaquam amplius per eandem viam revertamini
la,VULGATA,Deut,Deut,4,Deut.17,Deut 17,16,Deut.17.17,Deut 17:17,16,non habebit uxores plurimas quae inliciant animum eius neque argenti et auri inmensa pondera
la,VULGATA,Deut,Deut,4,Deut.17,Deut 17,16,Deut.17.18,Deut 17:18,17,postquam autem sederit in solio regni sui describet sibi deuteronomium legis huius in volumine accipiens exemplar a sacerdotibus leviticae tribus
la,VULGATA,Deut,Deut,4,Deut.17,Deut 17,16,Deut.17.19,Deut 17:19,18,et habebit secum legetque illud omnibus diebus vitae suae ut discat timere Dominum Deum suum et custodire verba et caerimonias eius quae lege praecepta sunt
la,VULGATA,Deut,Deut,4,Deut.17,Deut 17,16,Deut.17.20,Deut 17:20,19,nec elevetur cor eius in superbiam super fratres suos neque declinet in partem dextram vel sinistram ut longo tempore regnet ipse et filii eius super Israhel
la,VULGATA,Deut,Deut,4,Deut.18,Deut 18,17,Deut.18.1,Deut 18:1,0,non habebunt sacerdotes et Levitae et omnes qui de eadem tribu sunt partem et hereditatem cum reliquo Israhel quia sacrificia Domini et oblationes eius comedent
la,VULGATA,Deut,Deut,4,Deut.18,Deut 18,17,Deut.18.2,Deut 18:2,1,et nihil aliud accipient de possessione fratrum suorum Dominus enim ipse est hereditas eorum sicut locutus est illis
la,VULGATA,Deut,Deut,4,Deut.18,Deut 18,17,Deut.18.3,Deut 18:3,2,hoc erit iudicium sacerdotum a populo et ab his qui offerunt victimas sive bovem sive ovem immolaverint dabunt sacerdoti armum ac ventriculum
la,VULGATA,Deut,Deut,4,Deut.18,Deut 18,17,Deut.18.4,Deut 18:4,3,primitias frumenti vini et olei et lanarum partem ex ovium tonsione
la,VULGATA,Deut,Deut,4,Deut.18,Deut 18,17,Deut.18.5,Deut 18:5,4,ipsum enim elegit Dominus Deus tuus de cunctis tribubus tuis ut stet et ministret nomini Domini ipse et filii eius in sempiternum
la,VULGATA,Deut,Deut,4,Deut.18,Deut 18,17,Deut.18.6,Deut 18:6,5,si exierit Levites de una urbium tuarum ex omni Israhel in qua habitat et voluerit venire desiderans locum quem elegerit Dominus
la,VULGATA,Deut,Deut,4,Deut.18,Deut 18,17,Deut.18.7,Deut 18:7,6,ministrabit in nomine Dei sui sicut omnes fratres eius Levitae qui stabunt eo tempore coram Domino
la,VULGATA,Deut,Deut,4,Deut.18,Deut 18,17,Deut.18.8,Deut 18:8,7,partem ciborum eandem accipiet quam et ceteri excepto eo quod in urbe sua ex paterna ei successione debetur
la,VULGATA,Deut,Deut,4,Deut.18,Deut 18,17,Deut.18.9,Deut 18:9,8,quando ingressus fueris terram quam Dominus Deus tuus dabit tibi cave ne imitari velis abominationes illarum gentium
la,VULGATA,Deut,Deut,4,Deut.18,Deut 18,17,Deut.18.10,Deut 18:10,9,nec inveniatur in te qui lustret filium suum aut filiam ducens per ignem aut qui ariolos sciscitetur et observet somnia atque auguria ne sit maleficus
la,VULGATA,Deut,Deut,4,Deut.18,Deut 18,17,Deut.18.11,Deut 18:11,10,ne incantator ne pythones consulat ne divinos et quaerat a mortuis veritatem
la,VULGATA,Deut,Deut,4,Deut.18,Deut 18,17,Deut.18.12,Deut 18:12,11,omnia enim haec abominatur Dominus et propter istiusmodi scelera delebit eos in introitu tuo
la,VULGATA,Deut,Deut,4,Deut.18,Deut 18,17,Deut.18.13,Deut 18:13,12,perfectus eris et absque macula cum Domino Deo tuo
la,VULGATA,Deut,Deut,4,Deut.18,Deut 18,17,Deut.18.14,Deut 18:14,13,gentes istae quarum possidebis terram augures et divinos audiunt tu autem a Domino Deo tuo aliter institutus es
la,VULGATA,Deut,Deut,4,Deut.18,Deut 18,17,Deut.18.15,Deut 18:15,14,prophetam de gente tua et de fratribus tuis sicut me suscitabit tibi Dominus Deus tuus ipsum audies
la,VULGATA,Deut,Deut,4,Deut.18,Deut 18,17,Deut.18.16,Deut 18:16,15,ut petisti a Domino Deo tuo in Horeb quando contio congregata est atque dixisti ultra non audiam vocem Domini Dei mei et ignem hunc maximum amplius non videbo ne moriar
la,VULGATA,Deut,Deut,4,Deut.18,Deut 18,17,Deut.18.17,Deut 18:17,16,et ait Dominus mihi bene omnia sunt locuti
la,VULGATA,Deut,Deut,4,Deut.18,Deut 18,17,Deut.18.18,Deut 18:18,17,prophetam suscitabo eis de medio fratrum suorum similem tui et ponam verba mea in ore eius loqueturque ad eos omnia quae praecepero illi
la,VULGATA,Deut,Deut,4,Deut.18,Deut 18,17,Deut.18.19,Deut 18:19,18,qui autem verba eius quae loquetur in nomine meo audire noluerit ego ultor existam
la,VULGATA,Deut,Deut,4,Deut.18,Deut 18,17,Deut.18.20,Deut 18:20,19,propheta autem qui arrogantia depravatus voluerit loqui in nomine meo quae ego non praecepi illi ut diceret aut ex nomine alienorum deorum interficietur
la,VULGATA,Deut,Deut,4,Deut.18,Deut 18,17,Deut.18.21,Deut 18:21,20,quod si tacita cogitatione responderis quomodo possum intellegere verbum quod non est locutus Dominus
la,VULGATA,Deut,Deut,4,Deut.18,Deut 18,17,Deut.18.22,Deut 18:22,21,hoc habebis signum quod in nomine Domini propheta ille praedixerit et non evenerit hoc Dominus non locutus est sed per tumorem animi sui propheta confinxit et idcirco non timebis eum
la,VULGATA,Deut,Deut,4,Deut.19,Deut 19,18,Deut.19.1,Deut 19:1,0,cum disperderit Dominus Deus tuus gentes quarum tibi traditurus est terram et possederis eam habitaverisque in urbibus eius et in aedibus
la,VULGATA,Deut,Deut,4,Deut.19,Deut 19,18,Deut.19.2,Deut 19:2,1,tres civitates separabis tibi in medio terrae quam Dominus Deus tuus dabit tibi in possessionem
la,VULGATA,Deut,Deut,4,Deut.19,Deut 19,18,Deut.19.3,Deut 19:3,2,sternens diligenter viam et in tres aequaliter partes totam terrae tuae provinciam divides ut habeat e vicino qui propter homicidium profugus est quo possit evadere
la,VULGATA,Deut,Deut,4,Deut.19,Deut 19,18,Deut.19.4,Deut 19:4,3,haec erit lex homicidae fugientis cuius vita servanda est qui percusserit proximum suum nesciens et qui heri et nudius tertius nullum contra eum habuisse odium conprobatur
la,VULGATA,Deut,Deut,4,Deut.19,Deut 19,18,Deut.19.5,Deut 19:5,4,sed abisse simpliciter cum eo in silvam ad ligna caedenda et in succisione lignorum securis fugerit manu ferrumque lapsum de manubrio amicum eius percusserit et occiderit hic ad unam supradictarum urbium confugiet et vivet
la,VULGATA,Deut,Deut,4,Deut.19,Deut 19,18,Deut.19.6,Deut 19:6,5,ne forsitan proximus eius cuius effusus est sanguis dolore stimulatus persequatur et adprehendat eum si longior via fuerit et percutiat animam eius qui non est reus mortis quia nullum contra eum qui occisus est odium prius habuisse monstratur
la,VULGATA,Deut,Deut,4,Deut.19,Deut 19,18,Deut.19.7,Deut 19:7,6,idcirco praecipio tibi ut tres civitates aequalis inter se spatii dividas
la,VULGATA,Deut,Deut,4,Deut.19,Deut 19,18,Deut.19.8,Deut 19:8,7,cum autem dilataverit Dominus Deus tuus terminos tuos sicut iuravit patribus tuis et dederit tibi cunctam terram quam eis pollicitus est
la,VULGATA,Deut,Deut,4,Deut.19,Deut 19,18,Deut.19.9,Deut 19:9,8,si tamen custodieris mandata eius et feceris quae hodie praecipio tibi ut diligas Dominum Deum tuum et ambules in viis eius omni tempore addes tibi tres alias civitates et supradictarum trium urbium numerum duplicabis
la,VULGATA,Deut,Deut,4,Deut.19,Deut 19,18,Deut.19.10,Deut 19:10,9,ut non effundatur sanguis innoxius in medio terrae quam Dominus Deus tuus dabit tibi possidendam nec sis sanguinis reus
la,VULGATA,Deut,Deut,4,Deut.19,Deut 19,18,Deut.19.11,Deut 19:11,10,si quis autem odio habens proximum suum insidiatus fuerit vitae eius surgensque percusserit illum et mortuus fuerit fugeritque ad unam de supradictis urbibus
la,VULGATA,Deut,Deut,4,Deut.19,Deut 19,18,Deut.19.12,Deut 19:12,11,mittent seniores civitatis illius et arripient eum de loco effugii tradentque in manu proximi cuius sanguis effusus est et morietur
la,VULGATA,Deut,Deut,4,Deut.19,Deut 19,18,Deut.19.13,Deut 19:13,12,nec misereberis eius et auferes innoxium sanguinem de Israhel ut bene sit tibi
la,VULGATA,Deut,Deut,4,Deut.19,Deut 19,18,Deut.19.14,Deut 19:14,13,non adsumes et transferes terminos proximi tui quos fixerunt priores in possessione tua quam Dominus Deus tuus dabit tibi in terra quam acceperis possidendam
la,VULGATA,Deut,Deut,4,Deut.19,Deut 19,18,Deut.19.15,Deut 19:15,14,non stabit testis unus contra aliquem quicquid illud peccati et facinoris fuerit sed in ore duorum aut trium testium stabit omne verbum
la,VULGATA,Deut,Deut,4,Deut.19,Deut 19,18,Deut.19.16,Deut 19:16,15,si steterit testis mendax contra hominem accusans eum praevaricationis
la,VULGATA,Deut,Deut,4,Deut.19,Deut 19,18,Deut.19.17,Deut 19:17,16,stabunt ambo quorum causa est ante Dominum in conspectu sacerdotum et iudicum qui fuerint in diebus illis
la,VULGATA,Deut,Deut,4,Deut.19,Deut 19,18,Deut.19.18,Deut 19:18,17,cumque diligentissime perscrutantes invenerint falsum testem dixisse contra fratrem suum mendacium
la,VULGATA,Deut,Deut,4,Deut.19,Deut 19,18,Deut.19.19,Deut 19:19,18,reddent ei sicut fratri suo facere cogitavit et auferes malum de medio tui
la,VULGATA,Deut,Deut,4,Deut.19,Deut 19,18,Deut.19.20,Deut 19:20,19,ut audientes ceteri timorem habeant et nequaquam talia audeant facere
la,VULGATA,Deut,Deut,4,Deut.19,Deut 19,18,Deut.19.21,Deut 19:21,20,non misereberis eius sed animam pro anima oculum pro oculo dentem pro dente manum pro manu pedem pro pede exiges
la,VULGATA,Deut,Deut,4,Deut.20,Deut 20,19,Deut.20.1,Deut 20:1,0,si exieris ad bellum contra hostes tuos et videris equitatum et currus et maiorem quam tu habes adversarii exercitus multitudinem non timebis eos quia Dominus Deus tuus tecum est qui eduxit te de terra Aegypti
la,VULGATA,Deut,Deut,4,Deut.20,Deut 20,19,Deut.20.2,Deut 20:2,1,adpropinquante autem iam proelio stabit sacerdos ante aciem et sic loquetur ad populum
la,VULGATA,Deut,Deut,4,Deut.20,Deut 20,19,Deut.20.3,Deut 20:3,2,audi Israhel vos hodie contra inimicos vestros pugnam committitis non pertimescat cor vestrum nolite metuere nolite cedere nec formidetis eos
la,VULGATA,Deut,Deut,4,Deut.20,Deut 20,19,Deut.20.4,Deut 20:4,3,quia Dominus Deus vester in medio vestri est et pro vobis contra adversarios dimicabit ut eruat vos de periculo
la,VULGATA,Deut,Deut,4,Deut.20,Deut 20,19,Deut.20.5,Deut 20:5,4,duces quoque per singulas turmas audiente exercitu proclamabunt quis est homo qui aedificavit domum novam et non dedicavit eam vadat et revertatur in domum suam ne forte moriatur in bello et alius dedicet illam
la,VULGATA,Deut,Deut,4,Deut.20,Deut 20,19,Deut.20.6,Deut 20:6,5,quis est homo qui plantavit vineam et necdum eam fecit esse communem et de qua vesci omnibus liceat vadat et revertatur in domum suam ne forte moriatur in bello et alius homo eius fungatur officio
la,VULGATA,Deut,Deut,4,Deut.20,Deut 20,19,Deut.20.7,Deut 20:7,6,quis est homo qui despondit uxorem et non accepit eam vadat et revertatur in domum suam ne forte moriatur in bello et alius homo accipiat eam
la,VULGATA,Deut,Deut,4,Deut.20,Deut 20,19,Deut.20.8,Deut 20:8,7,his dictis addent reliqua et loquentur ad populum quis est homo formidolosus et corde pavido vadat et revertatur in domum suam ne pavere faciat corda fratrum suorum sicut ipse timore perterritus est
la,VULGATA,Deut,Deut,4,Deut.20,Deut 20,19,Deut.20.9,Deut 20:9,8,cumque siluerint exercitus duces et finem loquendi fecerint unusquisque suos ad bellandum cuneos praeparabit
la,VULGATA,Deut,Deut,4,Deut.20,Deut 20,19,Deut.20.10,Deut 20:10,9,si quando accesseris ad expugnandam civitatem offeres ei primum pacem
la,VULGATA,Deut,Deut,4,Deut.20,Deut 20,19,Deut.20.11,Deut 20:11,10,si receperit et aperuerit tibi portas cunctus populus qui in ea est salvabitur et serviet tibi sub tributo
la,VULGATA,Deut,Deut,4,Deut.20,Deut 20,19,Deut.20.12,Deut 20:12,11,sin autem foedus inire noluerint et receperint contra te bellum obpugnabis eam
la,VULGATA,Deut,Deut,4,Deut.20,Deut 20,19,Deut.20.13,Deut 20:13,12,cumque tradiderit Dominus Deus tuus illam in manu tua percuties omne quod in ea generis masculini est in ore gladii
la,VULGATA,Deut,Deut,4,Deut.20,Deut 20,19,Deut.20.14,Deut 20:14,13,absque mulieribus et infantibus iumentis et ceteris quae in civitate sunt omnem praedam exercitui divides et comedes de spoliis hostium tuorum quae Dominus Deus tuus dederit tibi
la,VULGATA,Deut,Deut,4,Deut.20,Deut 20,19,Deut.20.15,Deut 20:15,14,sic facies cunctis civitatibus quae a te procul valde sunt et non sunt de his urbibus quas in possessionem accepturus es
