languageCode,code,bookOsisId,bookSblId,bookOrderIndex,chapterOsisId,chapterSblId,chapterOrderIndex,verseOsisId,verseSblId,verseOrderIndex,text
la,VULGATA,Job,Job,17,Job.1,Job 1,0,Job.1.1,Job 1:1,0,vir erat in terra Hus nomine Iob et erat vir ille simplex et rectus ac timens Deum et recedens a malo
la,VULGATA,Job,Job,17,Job.1,Job 1,0,Job.1.2,Job 1:2,1,natique sunt ei septem filii et tres filiae
la,VULGATA,Job,Job,17,Job.1,Job 1,0,Job.1.3,Job 1:3,2,et fuit possessio eius septem milia ovium et tria milia camelorum quingenta quoque iuga boum et quingentae asinae ac familia multa nimis eratque vir ille magnus inter omnes Orientales
la,VULGATA,Job,Job,17,Job.1,Job 1,0,Job.1.4,Job 1:4,3,et ibant filii eius et faciebant convivium per domos unusquisque in die suo et mittentes vocabant tres sorores suas ut comederent et biberent cum eis
la,VULGATA,Job,Job,17,Job.1,Job 1,0,Job.1.5,Job 1:5,4,cumque in orbem transissent dies convivii mittebat ad eos Iob et sanctificabat illos consurgensque diluculo offerebat holocausta per singulos dicebat enim ne forte peccaverint filii mei et benedixerint Deo in cordibus suis sic faciebat Iob cunctis diebus
la,VULGATA,Job,Job,17,Job.1,Job 1,0,Job.1.6,Job 1:6,5,quadam autem die cum venissent filii Dei ut adsisterent coram Domino adfuit inter eos etiam Satan
la,VULGATA,Job,Job,17,Job.1,Job 1,0,Job.1.7,Job 1:7,6,cui dixit Dominus unde venis qui respondens ait circuivi terram et perambulavi eam
la,VULGATA,Job,Job,17,Job.1,Job 1,0,Job.1.8,Job 1:8,7,dixitque Dominus ad eum numquid considerasti servum meum Iob quod non sit ei similis in terra homo simplex et rectus et timens Deum ac recedens a malo
la,VULGATA,Job,Job,17,Job.1,Job 1,0,Job.1.9,Job 1:9,8,cui respondens Satan ait numquid frustra timet Iob Deum
la,VULGATA,Job,Job,17,Job.1,Job 1,0,Job.1.10,Job 1:10,9,nonne tu vallasti eum ac domum eius universamque substantiam per circuitum operibus manuum eius benedixisti et possessio illius crevit in terra
la,VULGATA,Job,Job,17,Job.1,Job 1,0,Job.1.11,Job 1:11,10,sed extende paululum manum tuam et tange cuncta quae possidet nisi in facie tua benedixerit tibi
la,VULGATA,Job,Job,17,Job.1,Job 1,0,Job.1.12,Job 1:12,11,dixit ergo Dominus ad Satan ecce universa quae habet in manu tua sunt tantum in eum ne extendas manum tuam egressusque est Satan a facie Domini
la,VULGATA,Job,Job,17,Job.1,Job 1,0,Job.1.13,Job 1:13,12,cum autem quadam die filii et filiae eius comederent et biberent vinum in domo fratris sui primogeniti
la,VULGATA,Job,Job,17,Job.1,Job 1,0,Job.1.14,Job 1:14,13,nuntius venit ad Iob qui diceret boves arabant et asinae pascebantur iuxta eos
la,VULGATA,Job,Job,17,Job.1,Job 1,0,Job.1.15,Job 1:15,14,et inruerunt Sabei tuleruntque omnia et pueros percusserunt gladio et evasi ego solus ut nuntiarem tibi
la,VULGATA,Job,Job,17,Job.1,Job 1,0,Job.1.16,Job 1:16,15,cumque adhuc ille loqueretur venit alter et dixit ignis Dei cecidit e caelo et tactas oves puerosque consumpsit et effugi ego solus ut nuntiarem tibi
la,VULGATA,Job,Job,17,Job.1,Job 1,0,Job.1.17,Job 1:17,16,sed et illo adhuc loquente venit alius et dixit Chaldei fecerunt tres turmas et invaserunt camelos et tulerunt eos necnon et pueros percusserunt gladio et ego fugi solus ut nuntiarem tibi
la,VULGATA,Job,Job,17,Job.1,Job 1,0,Job.1.18,Job 1:18,17,loquebatur ille et ecce alius intravit et dixit filiis tuis et filiabus vescentibus et bibentibus vinum in domo fratris sui primogeniti
la,VULGATA,Job,Job,17,Job.1,Job 1,0,Job.1.19,Job 1:19,18,repente ventus vehemens inruit a regione deserti et concussit quattuor angulos domus quae corruens oppressit liberos tuos et mortui sunt et effugi ego solus ut nuntiarem tibi
la,VULGATA,Job,Job,17,Job.1,Job 1,0,Job.1.20,Job 1:20,19,tunc surrexit Iob et scidit tunicam suam et tonso capite corruens in terram adoravit
la,VULGATA,Job,Job,17,Job.1,Job 1,0,Job.1.21,Job 1:21,20,et dixit nudus egressus sum de utero matris meae et nudus revertar illuc Dominus dedit Dominus abstulit sit nomen Domini benedictum
la,VULGATA,Job,Job,17,Job.1,Job 1,0,Job.1.22,Job 1:22,21,in omnibus his non peccavit Iob neque stultum quid contra Deum locutus est
la,VULGATA,Job,Job,17,Job.2,Job 2,1,Job.2.1,Job 2:1,0,factum est autem cum quadam die venissent filii Dei et starent coram Domino venisset quoque Satan inter eos et staret in conspectu eius
la,VULGATA,Job,Job,17,Job.2,Job 2,1,Job.2.2,Job 2:2,1,ut diceret Dominus ad Satan unde venis qui respondens ait circuivi terram et perambulavi eam
la,VULGATA,Job,Job,17,Job.2,Job 2,1,Job.2.3,Job 2:3,2,et dixit Dominus ad Satan numquid considerasti servum meum Iob quod non sit ei similis in terra vir simplex et rectus timens Deum ac recedens a malo et adhuc retinens innocentiam tu autem commovisti me adversus eum ut adfligerem illum frustra
la,VULGATA,Job,Job,17,Job.2,Job 2,1,Job.2.4,Job 2:4,3,cui respondens Satan ait pellem pro pelle et cuncta quae habet homo dabit pro anima sua
la,VULGATA,Job,Job,17,Job.2,Job 2,1,Job.2.5,Job 2:5,4,alioquin mitte manum tuam et tange os eius et carnem et tunc videbis quod in facie benedicat tibi
la,VULGATA,Job,Job,17,Job.2,Job 2,1,Job.2.6,Job 2:6,5,dixit ergo Dominus ad Satan ecce in manu tua est verumtamen animam illius serva
la,VULGATA,Job,Job,17,Job.2,Job 2,1,Job.2.7,Job 2:7,6,egressus igitur Satan a facie Domini percussit Iob ulcere pessimo a planta pedis usque ad verticem eius
la,VULGATA,Job,Job,17,Job.2,Job 2,1,Job.2.8,Job 2:8,7,qui testa saniem deradebat sedens in sterquilinio
la,VULGATA,Job,Job,17,Job.2,Job 2,1,Job.2.9,Job 2:9,8,dixit autem illi uxor sua adhuc tu permanes in simplicitate tua benedic Deo et morere
la,VULGATA,Job,Job,17,Job.2,Job 2,1,Job.2.10,Job 2:10,9,qui ait ad illam quasi una de stultis locuta es si bona suscepimus de manu Domini quare mala non suscipiamus in omnibus his non peccavit Iob labiis suis
la,VULGATA,Job,Job,17,Job.2,Job 2,1,Job.2.11,Job 2:11,10,igitur audientes tres amici Iob omne malum quod accidisset ei venerunt singuli de loco suo Eliphaz Themanites et Baldad Suites et Sophar Naamathites condixerant enim ut pariter venientes visitarent eum et consolarentur
la,VULGATA,Job,Job,17,Job.2,Job 2,1,Job.2.12,Job 2:12,11,cumque levassent procul oculos suos non cognoverunt eum et exclamantes ploraverunt scissisque vestibus sparserunt pulverem super caput suum in caelum
la,VULGATA,Job,Job,17,Job.2,Job 2,1,Job.2.13,Job 2:13,12,et sederunt cum eo in terram septem diebus et septem noctibus et nemo loquebatur ei verbum videbant enim dolorem esse vehementem
la,VULGATA,Job,Job,17,Job.3,Job 3,2,Job.3.1,Job 3:1,0,post haec aperuit Iob os suum et maledixit diei suo
la,VULGATA,Job,Job,17,Job.3,Job 3,2,Job.3.2,Job 3:2,1,et locutus est
la,VULGATA,Job,Job,17,Job.3,Job 3,2,Job.3.3,Job 3:3,2,pereat dies in qua natus sum et nox in qua dictum est conceptus est homo
la,VULGATA,Job,Job,17,Job.3,Job 3,2,Job.3.4,Job 3:4,3,dies ille vertatur in tenebras non requirat eum Deus desuper et non inlustret lumine
la,VULGATA,Job,Job,17,Job.3,Job 3,2,Job.3.5,Job 3:5,4,obscurent eum tenebrae et umbra mortis occupet eum caligo et involvatur amaritudine
la,VULGATA,Job,Job,17,Job.3,Job 3,2,Job.3.6,Job 3:6,5,noctem illam tenebrosus turbo possideat non conputetur in diebus anni nec numeretur in mensibus
la,VULGATA,Job,Job,17,Job.3,Job 3,2,Job.3.7,Job 3:7,6,sit nox illa solitaria nec laude digna
la,VULGATA,Job,Job,17,Job.3,Job 3,2,Job.3.8,Job 3:8,7,maledicant ei qui maledicunt diei qui parati sunt suscitare Leviathan
la,VULGATA,Job,Job,17,Job.3,Job 3,2,Job.3.9,Job 3:9,8,obtenebrentur stellae caligine eius expectet lucem et non videat nec ortum surgentis aurorae
la,VULGATA,Job,Job,17,Job.3,Job 3,2,Job.3.10,Job 3:10,9,quia non conclusit ostia ventris qui portavit me nec abstulit mala ab oculis meis
la,VULGATA,Job,Job,17,Job.3,Job 3,2,Job.3.11,Job 3:11,10,quare non in vulva mortuus sum egressus ex utero non statim perii
la,VULGATA,Job,Job,17,Job.3,Job 3,2,Job.3.12,Job 3:12,11,quare exceptus genibus cur lactatus uberibus
la,VULGATA,Job,Job,17,Job.3,Job 3,2,Job.3.13,Job 3:13,12,nunc enim dormiens silerem et somno meo requiescerem
la,VULGATA,Job,Job,17,Job.3,Job 3,2,Job.3.14,Job 3:14,13,cum regibus et consulibus terrae qui aedificant sibi solitudines
la,VULGATA,Job,Job,17,Job.3,Job 3,2,Job.3.15,Job 3:15,14,aut cum principibus qui possident aurum et replent domos suas argento
la,VULGATA,Job,Job,17,Job.3,Job 3,2,Job.3.16,Job 3:16,15,aut sicut abortivum absconditum non subsisterem vel qui concepti non viderunt lucem
la,VULGATA,Job,Job,17,Job.3,Job 3,2,Job.3.17,Job 3:17,16,ibi impii cessaverunt a tumultu et ibi requieverunt fessi robore
la,VULGATA,Job,Job,17,Job.3,Job 3,2,Job.3.18,Job 3:18,17,et quondam vincti pariter sine molestia non audierunt vocem exactoris
la,VULGATA,Job,Job,17,Job.3,Job 3,2,Job.3.19,Job 3:19,18,parvus et magnus ibi sunt et servus liber a domino suo
la,VULGATA,Job,Job,17,Job.3,Job 3,2,Job.3.20,Job 3:20,19,quare data est misero lux et vita his qui in amaritudine animae sunt
la,VULGATA,Job,Job,17,Job.3,Job 3,2,Job.3.21,Job 3:21,20,qui expectant mortem et non venit quasi effodientes thesaurum
la,VULGATA,Job,Job,17,Job.3,Job 3,2,Job.3.22,Job 3:22,21,gaudentque vehementer cum invenerint sepulchrum
la,VULGATA,Job,Job,17,Job.3,Job 3,2,Job.3.23,Job 3:23,22,viro cuius abscondita est via et circumdedit eum Deus tenebris
la,VULGATA,Job,Job,17,Job.3,Job 3,2,Job.3.24,Job 3:24,23,antequam comedam suspiro et quasi inundantes aquae sic rugitus meus
la,VULGATA,Job,Job,17,Job.3,Job 3,2,Job.3.25,Job 3:25,24,quia timor quem timebam evenit mihi et quod verebar accidit
la,VULGATA,Job,Job,17,Job.3,Job 3,2,Job.3.26,Job 3:26,25,nonne dissimulavi nonne silui nonne quievi et venit super me indignatio
la,VULGATA,Job,Job,17,Job.4,Job 4,3,Job.4.1,Job 4:1,0,respondens autem Eliphaz Themanites dixit
la,VULGATA,Job,Job,17,Job.4,Job 4,3,Job.4.2,Job 4:2,1,si coeperimus loqui tibi forsitan moleste accipias sed conceptum sermonem tenere quis possit
la,VULGATA,Job,Job,17,Job.4,Job 4,3,Job.4.3,Job 4:3,2,ecce docuisti multos et manus lassas roborasti
la,VULGATA,Job,Job,17,Job.4,Job 4,3,Job.4.4,Job 4:4,3,vacillantes confirmaverunt sermones tui et genua trementia confortasti
la,VULGATA,Job,Job,17,Job.4,Job 4,3,Job.4.5,Job 4:5,4,nunc autem venit super te plaga et defecisti tetigit te et conturbatus es
la,VULGATA,Job,Job,17,Job.4,Job 4,3,Job.4.6,Job 4:6,5,timor tuus fortitudo tua patientia tua et perfectio viarum tuarum
la,VULGATA,Job,Job,17,Job.4,Job 4,3,Job.4.7,Job 4:7,6,recordare obsecro te quis umquam innocens perierit aut quando recti deleti sint
la,VULGATA,Job,Job,17,Job.4,Job 4,3,Job.4.8,Job 4:8,7,quin potius vidi eos qui operantur iniquitatem et seminant dolores et metunt eos
la,VULGATA,Job,Job,17,Job.4,Job 4,3,Job.4.9,Job 4:9,8,flante Deo perisse et spiritu irae eius esse consumptos
la,VULGATA,Job,Job,17,Job.4,Job 4,3,Job.4.10,Job 4:10,9,rugitus leonis et vox leaenae et dentes catulorum leonum contriti sunt
la,VULGATA,Job,Job,17,Job.4,Job 4,3,Job.4.11,Job 4:11,10,tigris periit eo quod non haberet praedam et catuli leonis dissipati sunt
la,VULGATA,Job,Job,17,Job.4,Job 4,3,Job.4.12,Job 4:12,11,porro ad me dictum est verbum absconditum et quasi furtive suscepit auris mea venas susurri eius
la,VULGATA,Job,Job,17,Job.4,Job 4,3,Job.4.13,Job 4:13,12,in horrore visionis nocturnae quando solet sopor occupare homines
la,VULGATA,Job,Job,17,Job.4,Job 4,3,Job.4.14,Job 4:14,13,pavor tenuit me et tremor et omnia ossa mea perterrita sunt
la,VULGATA,Job,Job,17,Job.4,Job 4,3,Job.4.15,Job 4:15,14,et cum spiritus me praesente transiret inhorruerunt pili carnis meae
la,VULGATA,Job,Job,17,Job.4,Job 4,3,Job.4.16,Job 4:16,15,stetit quidam cuius non agnoscebam vultum imago coram oculis meis et vocem quasi aurae lenis audivi
la,VULGATA,Job,Job,17,Job.4,Job 4,3,Job.4.17,Job 4:17,16,numquid homo Dei conparatione iustificabitur aut factore suo purior erit vir
la,VULGATA,Job,Job,17,Job.4,Job 4,3,Job.4.18,Job 4:18,17,ecce qui serviunt ei non sunt stabiles et in angelis suis repperit pravitatem
la,VULGATA,Job,Job,17,Job.4,Job 4,3,Job.4.19,Job 4:19,18,quanto magis hii qui habitant domos luteas qui terrenum habent fundamentum consumentur velut a tinea
la,VULGATA,Job,Job,17,Job.4,Job 4,3,Job.4.20,Job 4:20,19,de mane usque ad vesperum succidentur et quia nullus intellegit in aeternum peribunt
la,VULGATA,Job,Job,17,Job.4,Job 4,3,Job.4.21,Job 4:21,20,qui autem reliqui fuerint auferentur ex eis morientur et non in sapientia
la,VULGATA,Job,Job,17,Job.5,Job 5,4,Job.5.1,Job 5:1,0,voca ergo si est qui tibi respondeat et ad aliquem sanctorum convertere
la,VULGATA,Job,Job,17,Job.5,Job 5,4,Job.5.2,Job 5:2,1,vere stultum interficit iracundia et parvulum occidit invidia
la,VULGATA,Job,Job,17,Job.5,Job 5,4,Job.5.3,Job 5:3,2,ego vidi stultum firma radice et maledixi pulchritudini eius statim
la,VULGATA,Job,Job,17,Job.5,Job 5,4,Job.5.4,Job 5:4,3,longe fient filii eius a salute et conterentur in porta et non erit qui eruat
la,VULGATA,Job,Job,17,Job.5,Job 5,4,Job.5.5,Job 5:5,4,cuius messem famelicus comedet et ipsum rapiet armatus et ebibent sitientes divitias eius
la,VULGATA,Job,Job,17,Job.5,Job 5,4,Job.5.6,Job 5:6,5,nihil in terra sine causa fit et de humo non orietur dolor
la,VULGATA,Job,Job,17,Job.5,Job 5,4,Job.5.7,Job 5:7,6,homo ad laborem nascitur et avis ad volatum
la,VULGATA,Job,Job,17,Job.5,Job 5,4,Job.5.8,Job 5:8,7,quam ob rem ego deprecabor Dominum et ad Deum ponam eloquium meum
la,VULGATA,Job,Job,17,Job.5,Job 5,4,Job.5.9,Job 5:9,8,qui facit magna et inscrutabilia et mirabilia absque numero
la,VULGATA,Job,Job,17,Job.5,Job 5,4,Job.5.10,Job 5:10,9,qui dat pluviam super faciem terrae et inrigat aquis universa
la,VULGATA,Job,Job,17,Job.5,Job 5,4,Job.5.11,Job 5:11,10,qui ponit humiles in sublimi et maerentes erigit sospitate
la,VULGATA,Job,Job,17,Job.5,Job 5,4,Job.5.12,Job 5:12,11,qui dissipat cogitationes malignorum ne possint implere manus eorum quod coeperant
la,VULGATA,Job,Job,17,Job.5,Job 5,4,Job.5.13,Job 5:13,12,qui adprehendit sapientes in astutia eorum et consilium pravorum dissipat
la,VULGATA,Job,Job,17,Job.5,Job 5,4,Job.5.14,Job 5:14,13,per diem incurrent tenebras et quasi in nocte sic palpabunt in meridie
la,VULGATA,Job,Job,17,Job.5,Job 5,4,Job.5.15,Job 5:15,14,porro salvum faciet a gladio oris eorum et de manu violenti pauperem
la,VULGATA,Job,Job,17,Job.5,Job 5,4,Job.5.16,Job 5:16,15,et erit egeno spes iniquitas autem contrahet os suum
la,VULGATA,Job,Job,17,Job.5,Job 5,4,Job.5.17,Job 5:17,16,beatus homo qui corripitur a Domino increpationem ergo Domini ne reprobes
la,VULGATA,Job,Job,17,Job.5,Job 5,4,Job.5.18,Job 5:18,17,quia ipse vulnerat et medetur percutit et manus eius sanabunt
la,VULGATA,Job,Job,17,Job.5,Job 5,4,Job.5.19,Job 5:19,18,in sex tribulationibus liberabit te et in septima non tanget te malum
la,VULGATA,Job,Job,17,Job.5,Job 5,4,Job.5.20,Job 5:20,19,in fame eruet te de morte et in bello de manu gladii
la,VULGATA,Job,Job,17,Job.5,Job 5,4,Job.5.21,Job 5:21,20,a flagello linguae absconderis et non timebis calamitatem cum venerit
la,VULGATA,Job,Job,17,Job.5,Job 5,4,Job.5.22,Job 5:22,21,in vastitate et fame ridebis et bestiam terrae non formidabis
la,VULGATA,Job,Job,17,Job.5,Job 5,4,Job.5.23,Job 5:23,22,sed cum lapidibus regionum pactum tuum et bestiae terrae pacificae erunt tibi
la,VULGATA,Job,Job,17,Job.5,Job 5,4,Job.5.24,Job 5:24,23,et scies quod pacem habeat tabernaculum tuum et visitans speciem tuam non peccabis
la,VULGATA,Job,Job,17,Job.5,Job 5,4,Job.5.25,Job 5:25,24,scies quoque quoniam multiplex erit semen tuum et progenies tua quasi herba terrae
la,VULGATA,Job,Job,17,Job.5,Job 5,4,Job.5.26,Job 5:26,25,ingredieris in abundantia sepulchrum sicut infertur acervus in tempore suo
la,VULGATA,Job,Job,17,Job.5,Job 5,4,Job.5.27,Job 5:27,26,ecce hoc ut investigavimus ita est quod auditum mente pertracta
la,VULGATA,Job,Job,17,Job.6,Job 6,5,Job.6.1,Job 6:1,0,respondens autem Iob dixit
la,VULGATA,Job,Job,17,Job.6,Job 6,5,Job.6.2,Job 6:2,1,utinam adpenderentur peccata mea quibus iram merui et calamitas quam patior in statera
la,VULGATA,Job,Job,17,Job.6,Job 6,5,Job.6.3,Job 6:3,2,quasi harena maris haec gravior appareret unde et verba mea dolore sunt plena
la,VULGATA,Job,Job,17,Job.6,Job 6,5,Job.6.4,Job 6:4,3,quia sagittae Domini in me sunt quarum indignatio ebibit spiritum meum et terrores Domini militant contra me
la,VULGATA,Job,Job,17,Job.6,Job 6,5,Job.6.5,Job 6:5,4,numquid rugiet onager cum habuerit herbam aut mugiet bos cum ante praesepe plenum steterit
la,VULGATA,Job,Job,17,Job.6,Job 6,5,Job.6.6,Job 6:6,5,aut poterit comedi insulsum quod non est sale conditum aut potest aliquis gustare quod gustatum adfert mortem
la,VULGATA,Job,Job,17,Job.6,Job 6,5,Job.6.7,Job 6:7,6,quae prius tangere nolebat anima mea nunc prae angustia cibi mei sunt
la,VULGATA,Job,Job,17,Job.6,Job 6,5,Job.6.8,Job 6:8,7,quis det ut veniat petitio mea et quod expecto tribuat mihi Deus
la,VULGATA,Job,Job,17,Job.6,Job 6,5,Job.6.9,Job 6:9,8,et qui coepit ipse me conterat solvat manum suam et succidat me
la,VULGATA,Job,Job,17,Job.6,Job 6,5,Job.6.10,Job 6:10,9,et haec mihi sit consolatio ut adfligens me dolore non parcat nec contradicam sermonibus Sancti
la,VULGATA,Job,Job,17,Job.6,Job 6,5,Job.6.11,Job 6:11,10,quae est enim fortitudo mea ut sustineam aut quis finis meus ut patienter agam
la,VULGATA,Job,Job,17,Job.6,Job 6,5,Job.6.12,Job 6:12,11,nec fortitudo lapidum fortitudo mea nec caro mea aerea est
la,VULGATA,Job,Job,17,Job.6,Job 6,5,Job.6.13,Job 6:13,12,ecce non est auxilium mihi in me et necessarii quoque mei recesserunt a me
la,VULGATA,Job,Job,17,Job.6,Job 6,5,Job.6.14,Job 6:14,13,qui tollit ab amico suo misericordiam timorem Domini derelinquit
la,VULGATA,Job,Job,17,Job.6,Job 6,5,Job.6.15,Job 6:15,14,fratres mei praeterierunt me sicut torrens qui raptim transit in convallibus
la,VULGATA,Job,Job,17,Job.6,Job 6,5,Job.6.16,Job 6:16,15,qui timent pruinam inruet super eos nix
la,VULGATA,Job,Job,17,Job.6,Job 6,5,Job.6.17,Job 6:17,16,tempore quo fuerint dissipati peribunt et ut incaluerit solventur de loco suo
la,VULGATA,Job,Job,17,Job.6,Job 6,5,Job.6.18,Job 6:18,17,involutae sunt semitae gressuum eorum ambulabunt in vacuum et peribunt
la,VULGATA,Job,Job,17,Job.6,Job 6,5,Job.6.19,Job 6:19,18,considerate semitas Theman itinera Saba et expectate paulisper
la,VULGATA,Job,Job,17,Job.6,Job 6,5,Job.6.20,Job 6:20,19,confusi sunt quia speravi venerunt quoque usque ad me et pudore cooperti sunt
la,VULGATA,Job,Job,17,Job.6,Job 6,5,Job.6.21,Job 6:21,20,nunc venistis et modo videntes plagam meam timetis
la,VULGATA,Job,Job,17,Job.6,Job 6,5,Job.6.22,Job 6:22,21,numquid dixi adferte mihi et de substantia vestra donate mihi
la,VULGATA,Job,Job,17,Job.6,Job 6,5,Job.6.23,Job 6:23,22,vel liberate me de manu hostis et de manu robustorum eruite me
la,VULGATA,Job,Job,17,Job.6,Job 6,5,Job.6.24,Job 6:24,23,docete me et ego tacebo et si quid forte ignoravi instruite me
la,VULGATA,Job,Job,17,Job.6,Job 6,5,Job.6.25,Job 6:25,24,quare detraxistis sermonibus veritatis cum e vobis nullus sit qui possit arguere
la,VULGATA,Job,Job,17,Job.6,Job 6,5,Job.6.26,Job 6:26,25,ad increpandum tantum eloquia concinnatis et in ventum verba profertis
la,VULGATA,Job,Job,17,Job.6,Job 6,5,Job.6.27,Job 6:27,26,super pupillum inruitis et subvertere nitimini amicum vestrum
la,VULGATA,Job,Job,17,Job.6,Job 6,5,Job.6.28,Job 6:28,27,verumtamen quod coepistis explete praebete aurem et videte an mentiar
la,VULGATA,Job,Job,17,Job.6,Job 6,5,Job.6.29,Job 6:29,28,respondete obsecro absque contentione et loquentes id quod iustum est iudicate
la,VULGATA,Job,Job,17,Job.6,Job 6,5,Job.6.30,Job 6:30,29,et non invenietis in lingua mea iniquitatem nec in faucibus meis stultitia personabit
la,VULGATA,Job,Job,17,Job.7,Job 7,6,Job.7.1,Job 7:1,0,militia est vita hominis super terram et sicut dies mercennarii dies eius
la,VULGATA,Job,Job,17,Job.7,Job 7,6,Job.7.2,Job 7:2,1,sicut servus desiderat umbram et sicut mercennarius praestolatur finem operis sui
la,VULGATA,Job,Job,17,Job.7,Job 7,6,Job.7.3,Job 7:3,2,sic et ego habui menses vacuos et noctes laboriosas enumeravi mihi
la,VULGATA,Job,Job,17,Job.7,Job 7,6,Job.7.4,Job 7:4,3,si dormiero dico quando consurgam et rursum expectabo vesperam et replebor doloribus usque ad tenebras
la,VULGATA,Job,Job,17,Job.7,Job 7,6,Job.7.5,Job 7:5,4,induta est caro mea putredine et sordibus pulveris cutis mea aruit et contracta est
la,VULGATA,Job,Job,17,Job.7,Job 7,6,Job.7.6,Job 7:6,5,dies mei velocius transierunt quam a texente tela succiditur et consumpti sunt absque ulla spe
la,VULGATA,Job,Job,17,Job.7,Job 7,6,Job.7.7,Job 7:7,6,memento quia ventus est vita mea et non revertetur oculus meus ut videat bona
la,VULGATA,Job,Job,17,Job.7,Job 7,6,Job.7.8,Job 7:8,7,nec aspiciet me visus hominis oculi tui in me et non subsistam
la,VULGATA,Job,Job,17,Job.7,Job 7,6,Job.7.9,Job 7:9,8,sicut consumitur nubes et pertransit sic qui descenderit ad inferos non ascendet
la,VULGATA,Job,Job,17,Job.7,Job 7,6,Job.7.10,Job 7:10,9,nec revertetur ultra in domum suam neque cognoscet eum amplius locus eius
la,VULGATA,Job,Job,17,Job.7,Job 7,6,Job.7.11,Job 7:11,10,quapropter et ego non parcam ori meo loquar in tribulatione spiritus mei confabulabor cum amaritudine animae meae
la,VULGATA,Job,Job,17,Job.7,Job 7,6,Job.7.12,Job 7:12,11,numquid mare sum ego aut cetus quia circumdedisti me carcere
la,VULGATA,Job,Job,17,Job.7,Job 7,6,Job.7.13,Job 7:13,12,si dixero consolabitur me lectulus meus et relevabor loquens mecum in strato meo
la,VULGATA,Job,Job,17,Job.7,Job 7,6,Job.7.14,Job 7:14,13,terrebis me per somnia et per visiones horrore concuties
la,VULGATA,Job,Job,17,Job.7,Job 7,6,Job.7.15,Job 7:15,14,quam ob rem elegit suspendium anima mea et mortem ossa mea
la,VULGATA,Job,Job,17,Job.7,Job 7,6,Job.7.16,Job 7:16,15,desperavi nequaquam ultra iam vivam parce mihi nihil enim sunt dies mei
la,VULGATA,Job,Job,17,Job.7,Job 7,6,Job.7.17,Job 7:17,16,quid est homo quia magnificas eum aut quia ponis erga eum cor tuum
la,VULGATA,Job,Job,17,Job.7,Job 7,6,Job.7.18,Job 7:18,17,visitas eum diluculo et subito probas illum
la,VULGATA,Job,Job,17,Job.7,Job 7,6,Job.7.19,Job 7:19,18,usquequo non parces mihi nec dimittis me ut gluttiam salivam meam
la,VULGATA,Job,Job,17,Job.7,Job 7,6,Job.7.20,Job 7:20,19,peccavi quid faciam tibi o custos hominum quare posuisti me contrarium tibi et factus sum mihimet ipsi gravis
la,VULGATA,Job,Job,17,Job.7,Job 7,6,Job.7.21,Job 7:21,20,cur non tolles peccatum meum et quare non auferes iniquitatem meam ecce nunc in pulvere dormiam et si mane me quaesieris non subsistam
la,VULGATA,Job,Job,17,Job.8,Job 8,7,Job.8.1,Job 8:1,0,respondens autem Baldad Suites dixit
la,VULGATA,Job,Job,17,Job.8,Job 8,7,Job.8.2,Job 8:2,1,usquequo loqueris talia et spiritus multiplex sermones oris tui
la,VULGATA,Job,Job,17,Job.8,Job 8,7,Job.8.3,Job 8:3,2,numquid Deus subplantat iudicium et Omnipotens subvertit quod iustum est
la,VULGATA,Job,Job,17,Job.8,Job 8,7,Job.8.4,Job 8:4,3,etiam si filii tui peccaverunt ei et dimisit eos in manu iniquitatis suae
la,VULGATA,Job,Job,17,Job.8,Job 8,7,Job.8.5,Job 8:5,4,tu tamen si diluculo consurrexeris ad Deum et Omnipotentem fueris deprecatus
la,VULGATA,Job,Job,17,Job.8,Job 8,7,Job.8.6,Job 8:6,5,si mundus et rectus incesseris statim evigilabit ad te et pacatum reddet habitaculum iustitiae tuae
la,VULGATA,Job,Job,17,Job.8,Job 8,7,Job.8.7,Job 8:7,6,in tantum ut priora tua fuerint parva et novissima tua multiplicentur nimis
la,VULGATA,Job,Job,17,Job.8,Job 8,7,Job.8.8,Job 8:8,7,interroga enim generationem pristinam et diligenter investiga patrum memoriam
la,VULGATA,Job,Job,17,Job.8,Job 8,7,Job.8.9,Job 8:9,8,hesterni quippe sumus et ignoramus quoniam sicut umbra dies nostri sunt super terram
la,VULGATA,Job,Job,17,Job.8,Job 8,7,Job.8.10,Job 8:10,9,et ipsi docebunt te loquentur tibi et de corde suo proferent eloquia
la,VULGATA,Job,Job,17,Job.8,Job 8,7,Job.8.11,Job 8:11,10,numquid vivere potest scirpus absque humore aut crescet carectum sine aqua
la,VULGATA,Job,Job,17,Job.8,Job 8,7,Job.8.12,Job 8:12,11,cum adhuc sit in flore nec carpatur manu ante omnes herbas arescit
la,VULGATA,Job,Job,17,Job.8,Job 8,7,Job.8.13,Job 8:13,12,sic viae omnium qui obliviscuntur Deum et spes hypocritae peribit
la,VULGATA,Job,Job,17,Job.8,Job 8,7,Job.8.14,Job 8:14,13,non ei placebit vecordia sua et sicut tela aranearum fiducia eius
la,VULGATA,Job,Job,17,Job.8,Job 8,7,Job.8.15,Job 8:15,14,innitetur super domum suam et non stabit fulciet eam et non consurget
la,VULGATA,Job,Job,17,Job.8,Job 8,7,Job.8.16,Job 8:16,15,humectus videtur antequam veniat sol et in horto suo germen eius egreditur
la,VULGATA,Job,Job,17,Job.8,Job 8,7,Job.8.17,Job 8:17,16,super acervum petrarum radices eius densabuntur et inter lapides commorabitur
la,VULGATA,Job,Job,17,Job.8,Job 8,7,Job.8.18,Job 8:18,17,si absorbuerit eum de loco suo negabit eum et dicet non novi te
la,VULGATA,Job,Job,17,Job.8,Job 8,7,Job.8.19,Job 8:19,18,haec est enim laetitia viae eius ut rursum de terra alii germinentur
la,VULGATA,Job,Job,17,Job.8,Job 8,7,Job.8.20,Job 8:20,19,Deus non proiciet simplicem nec porriget manum malignis
la,VULGATA,Job,Job,17,Job.8,Job 8,7,Job.8.21,Job 8:21,20,donec impleatur risu os tuum et labia tua iubilo
la,VULGATA,Job,Job,17,Job.8,Job 8,7,Job.8.22,Job 8:22,21,qui oderunt te induentur confusione et tabernaculum impiorum non subsistet
la,VULGATA,Job,Job,17,Job.9,Job 9,8,Job.9.1,Job 9:1,0,et respondens Iob ait
la,VULGATA,Job,Job,17,Job.9,Job 9,8,Job.9.2,Job 9:2,1,vere scio quod ita sit et quod non iustificetur homo conpositus Deo
la,VULGATA,Job,Job,17,Job.9,Job 9,8,Job.9.3,Job 9:3,2,si voluerit contendere cum eo non poterit ei respondere unum pro mille
la,VULGATA,Job,Job,17,Job.9,Job 9,8,Job.9.4,Job 9:4,3,sapiens corde est et fortis robore quis restitit ei et pacem habuit
la,VULGATA,Job,Job,17,Job.9,Job 9,8,Job.9.5,Job 9:5,4,qui transtulit montes et nescierunt hii quos subvertit in furore suo
