languageCode,code,bookOsisId,bookSblId,bookOrderIndex,chapterOsisId,chapterSblId,chapterOrderIndex,verseOsisId,verseSblId,verseOrderIndex,text
la,VULGATA,Amos,Amos,29,Amos.1,Amos 1,0,Amos.1.1,Amos 1:1,0,verba Amos qui fuit in pastoralibus de Thecuae quae vidit super Israhel in diebus Oziae regis Iuda et in diebus Hieroboam filii Ioas regis Israhel ante duos annos terraemotus
la,VULGATA,Amos,Amos,29,Amos.1,Amos 1,0,Amos.1.2,Amos 1:2,1,et dixit Dominus de Sion rugiet et de Hierusalem dabit vocem suam et luxerunt speciosa pastorum et exsiccatus est vertex Carmeli
la,VULGATA,Amos,Amos,29,Amos.1,Amos 1,0,Amos.1.3,Amos 1:3,2,haec dicit Dominus super tribus sceleribus Damasci et super quattuor non convertam eum eo quod trituraverint in plaustris ferreis Galaad
la,VULGATA,Amos,Amos,29,Amos.1,Amos 1,0,Amos.1.4,Amos 1:4,3,et mittam ignem in domum Azahel et devorabit domos Benadad
la,VULGATA,Amos,Amos,29,Amos.1,Amos 1,0,Amos.1.5,Amos 1:5,4,et conteram vectem Damasci et disperdam habitatorem de campo Idoli et tenentem sceptrum de domo Voluptatis et transferetur populus Syriae Cyrenen dicit Dominus
la,VULGATA,Amos,Amos,29,Amos.1,Amos 1,0,Amos.1.6,Amos 1:6,5,haec dicit Dominus super tribus sceleribus Gazae et super quattuor non convertam eum eo quod transtulerit captivitatem perfectam ut concluderet eam in Idumea
la,VULGATA,Amos,Amos,29,Amos.1,Amos 1,0,Amos.1.7,Amos 1:7,6,et mittam ignem in murum Gazae et devorabit aedes eius
la,VULGATA,Amos,Amos,29,Amos.1,Amos 1,0,Amos.1.8,Amos 1:8,7,et disperdam habitatorem de Azoto et tenentem sceptrum de Ascalone et convertam manum meam super Accaron et peribunt reliqui Philisthinorum dicit Dominus Deus
la,VULGATA,Amos,Amos,29,Amos.1,Amos 1,0,Amos.1.9,Amos 1:9,8,haec dicit Dominus super tribus sceleribus Tyri et super quattuor non convertam eum eo quod concluserint captivitatem perfectam in Idumea et non sint recordati foederis fratrum
la,VULGATA,Amos,Amos,29,Amos.1,Amos 1,0,Amos.1.10,Amos 1:10,9,et emittam ignem in murum Tyri et devorabit aedes eius
la,VULGATA,Amos,Amos,29,Amos.1,Amos 1,0,Amos.1.11,Amos 1:11,10,haec dicit Dominus super tribus sceleribus Edom et super quattuor non convertam eum eo quod persecutus sit in gladio fratrem suum et violaverit misericordiam eius et tenuerit ultra furorem suum et indignationem suam servaverit usque in finem
la,VULGATA,Amos,Amos,29,Amos.1,Amos 1,0,Amos.1.12,Amos 1:12,11,mittam ignem in Theman et devorabit aedes Bosrae
la,VULGATA,Amos,Amos,29,Amos.1,Amos 1,0,Amos.1.13,Amos 1:13,12,haec dicit Dominus super tribus sceleribus filiorum Ammon et super quattuor non convertam eum eo quod dissecuerit praegnantes Galaad ad dilatandum terminum suum
la,VULGATA,Amos,Amos,29,Amos.1,Amos 1,0,Amos.1.14,Amos 1:14,13,et succendam ignem in muro Rabbae et devorabit aedes eius in ululatu in die belli et in turbine in die commotionis
la,VULGATA,Amos,Amos,29,Amos.1,Amos 1,0,Amos.1.15,Amos 1:15,14,et ibit Melchom in captivitatem ipse et principes eius simul dicit Dominus
la,VULGATA,Amos,Amos,29,Amos.2,Amos 2,1,Amos.2.1,Amos 2:1,0,haec dicit Dominus super tribus sceleribus Moab et super quattuor non convertam eum eo quod incenderit ossa regis Idumeae usque ad cinerem
la,VULGATA,Amos,Amos,29,Amos.2,Amos 2,1,Amos.2.2,Amos 2:2,1,et mittam ignem in Moab et devorabit aedes Carioth et morietur in sonitu Moab in clangore tubae
la,VULGATA,Amos,Amos,29,Amos.2,Amos 2,1,Amos.2.3,Amos 2:3,2,et disperdam iudicem de medio eius et omnes principes eius interficiam cum eo dicit Dominus
la,VULGATA,Amos,Amos,29,Amos.2,Amos 2,1,Amos.2.4,Amos 2:4,3,haec dicit Dominus super tribus sceleribus Iuda et super quattuor non convertam eum eo quod abiecerint legem Domini et mandata eius non custodierint deceperunt enim eos idola sua post quae abierant patres eorum
la,VULGATA,Amos,Amos,29,Amos.2,Amos 2,1,Amos.2.5,Amos 2:5,4,et mittam ignem in Iuda et devorabit aedes Hierusalem
la,VULGATA,Amos,Amos,29,Amos.2,Amos 2,1,Amos.2.6,Amos 2:6,5,haec dicit Dominus super tribus sceleribus Israhel et super quattuor non convertam eum pro eo quod vendiderit argento iustum et pauperem pro calciamentis
la,VULGATA,Amos,Amos,29,Amos.2,Amos 2,1,Amos.2.7,Amos 2:7,6,qui conterunt super pulverem terrae capita pauperum et viam humilium declinant et filius ac pater eius ierunt ad puellam ut violarent nomen sanctum meum
la,VULGATA,Amos,Amos,29,Amos.2,Amos 2,1,Amos.2.8,Amos 2:8,7,et super vestimentis pigneratis accubuerunt iuxta omne altare et vinum damnatorum bibebant in domo Dei sui
la,VULGATA,Amos,Amos,29,Amos.2,Amos 2,1,Amos.2.9,Amos 2:9,8,ego autem exterminavi Amorreum a facie eorum cuius altitudo cedrorum altitudo eius et fortis ipse quasi quercus et contrivi fructum eius desuper et radices eius subter
la,VULGATA,Amos,Amos,29,Amos.2,Amos 2,1,Amos.2.10,Amos 2:10,9,ego sum qui ascendere vos feci de terra Aegypti et eduxi vos in deserto quadraginta annis ut possideretis terram Amorrei
la,VULGATA,Amos,Amos,29,Amos.2,Amos 2,1,Amos.2.11,Amos 2:11,10,et suscitavi de filiis vestris in prophetas et de iuvenibus vestris nazarenos numquid non ita est filii Israhel dicit Dominus
la,VULGATA,Amos,Amos,29,Amos.2,Amos 2,1,Amos.2.12,Amos 2:12,11,et propinabatis nazarenis vino et prophetis mandabatis dicentes ne prophetetis
la,VULGATA,Amos,Amos,29,Amos.2,Amos 2,1,Amos.2.13,Amos 2:13,12,ecce ego stridebo super vos sicut stridet plaustrum onustum faeno
la,VULGATA,Amos,Amos,29,Amos.2,Amos 2,1,Amos.2.14,Amos 2:14,13,et peribit fuga a veloce et fortis non obtinebit virtutem suam et robustus non salvabit animam suam
la,VULGATA,Amos,Amos,29,Amos.2,Amos 2,1,Amos.2.15,Amos 2:15,14,et tenens arcum non stabit et velox pedibus suis non salvabitur et ascensor equi non salvabit animam suam
la,VULGATA,Amos,Amos,29,Amos.2,Amos 2,1,Amos.2.16,Amos 2:16,15,et robustus corde inter fortes nudus fugiet in die illa dicit Dominus
la,VULGATA,Amos,Amos,29,Amos.3,Amos 3,2,Amos.3.1,Amos 3:1,0,audite verbum quod locutus est Dominus super vos filii Israhel super omni cognatione quam eduxi de terra Aegypti dicens
la,VULGATA,Amos,Amos,29,Amos.3,Amos 3,2,Amos.3.2,Amos 3:2,1,tantummodo vos cognovi ex omnibus cognationibus terrae idcirco visitabo super vos omnes iniquitates vestras
la,VULGATA,Amos,Amos,29,Amos.3,Amos 3,2,Amos.3.3,Amos 3:3,2,numquid ambulabunt duo pariter nisi convenerit eis
la,VULGATA,Amos,Amos,29,Amos.3,Amos 3,2,Amos.3.4,Amos 3:4,3,numquid rugiet leo in saltu nisi habuerit praedam numquid dabit catulus leonis vocem de cubili suo nisi aliquid adprehenderit
la,VULGATA,Amos,Amos,29,Amos.3,Amos 3,2,Amos.3.5,Amos 3:5,4,numquid cadet avis in laqueum terrae absque aucupe numquid auferetur laqueus de terra antequam quid ceperit
la,VULGATA,Amos,Amos,29,Amos.3,Amos 3,2,Amos.3.6,Amos 3:6,5,si clanget tuba in civitate et populus non expavescet si erit malum in civitate quod Dominus non fecit
la,VULGATA,Amos,Amos,29,Amos.3,Amos 3,2,Amos.3.7,Amos 3:7,6,quia non faciet Dominus Deus verbum nisi revelaverit secretum suum ad servos suos prophetas
la,VULGATA,Amos,Amos,29,Amos.3,Amos 3,2,Amos.3.8,Amos 3:8,7,leo rugiet quis non timebit Dominus Deus locutus est quis non prophetabit
la,VULGATA,Amos,Amos,29,Amos.3,Amos 3,2,Amos.3.9,Amos 3:9,8,auditum facite in aedibus Azoti et in aedibus terrae Aegypti et dicite congregamini super montes Samariae et videte insanias multas in medio eius et calumniam patientes in penetrabilibus eius
la,VULGATA,Amos,Amos,29,Amos.3,Amos 3,2,Amos.3.10,Amos 3:10,9,et nescierunt facere rectum dicit Dominus thesaurizantes iniquitatem et rapinas in aedibus suis
la,VULGATA,Amos,Amos,29,Amos.3,Amos 3,2,Amos.3.11,Amos 3:11,10,propterea haec dicit Dominus Deus tribulabitur et circumietur terra et detrahetur ex te fortitudo tua et diripientur aedes tuae
la,VULGATA,Amos,Amos,29,Amos.3,Amos 3,2,Amos.3.12,Amos 3:12,11,haec dicit Dominus quomodo si eruat pastor de ore leonis duo crura aut extremum auriculae sic eruentur filii Israhel qui habitant in Samaria in plaga lectuli et in Damasco grabatti
la,VULGATA,Amos,Amos,29,Amos.3,Amos 3,2,Amos.3.13,Amos 3:13,12,audite et contestamini in domo Iacob dicit Dominus Deus exercituum
la,VULGATA,Amos,Amos,29,Amos.3,Amos 3,2,Amos.3.14,Amos 3:14,13,quia in die cum visitare coepero praevaricationes Israhel super eum visitabo et super altaria Bethel et amputabuntur cornua altaris et cadent in terram
la,VULGATA,Amos,Amos,29,Amos.3,Amos 3,2,Amos.3.15,Amos 3:15,14,et percutiam domum hiemalem cum domo aestiva et peribunt domus eburneae et dissipabuntur aedes multae dicit Dominus
la,VULGATA,Amos,Amos,29,Amos.4,Amos 4,3,Amos.4.1,Amos 4:1,0,audite verbum hoc vaccae pingues quae estis in monte Samariae quae calumniam facitis egenis et confringitis pauperes quae dicitis dominis vestris adferte et bibemus
la,VULGATA,Amos,Amos,29,Amos.4,Amos 4,3,Amos.4.2,Amos 4:2,1,iuravit Dominus Deus in sancto suo quia ecce dies venient super vos et levabunt vos in contis et reliquias vestras in ollis ferventibus
la,VULGATA,Amos,Amos,29,Amos.4,Amos 4,3,Amos.4.3,Amos 4:3,2,et per aperturas exibitis altera contra alteram et proiciemini in Armon dicit Dominus
la,VULGATA,Amos,Amos,29,Amos.4,Amos 4,3,Amos.4.4,Amos 4:4,3,venite ad Bethel et impie agite ad Galgalam et multiplicate praevaricationem et offerte mane victimas vestras tribus diebus decimas vestras
la,VULGATA,Amos,Amos,29,Amos.4,Amos 4,3,Amos.4.5,Amos 4:5,4,et sacrificate de fermentato laudem et vocate voluntarias oblationes et adnuntiate sic enim voluistis filii Israhel dicit Dominus Deus
la,VULGATA,Amos,Amos,29,Amos.4,Amos 4,3,Amos.4.6,Amos 4:6,5,unde et ego dedi vobis stuporem dentium in cunctis urbibus vestris et indigentiam panum in omnibus locis vestris et non estis reversi ad me dicit Dominus
la,VULGATA,Amos,Amos,29,Amos.4,Amos 4,3,Amos.4.7,Amos 4:7,6,ego quoque prohibui a vobis imbrem cum adhuc tres menses superessent usque ad messem et plui super civitatem unam et super civitatem alteram non plui pars una conpluta est et pars super quam non plui aruit
la,VULGATA,Amos,Amos,29,Amos.4,Amos 4,3,Amos.4.8,Amos 4:8,7,et venerunt duae et tres civitates ad civitatem unam ut biberent aquam et non sunt satiatae et non redistis ad me dicit Dominus
la,VULGATA,Amos,Amos,29,Amos.4,Amos 4,3,Amos.4.9,Amos 4:9,8,percussi vos in vento urente et in aurugine multitudinem hortorum vestrorum et vinearum vestrarum oliveta vestra et ficeta vestra comedit eruca et non redistis ad me dicit Dominus
la,VULGATA,Amos,Amos,29,Amos.4,Amos 4,3,Amos.4.10,Amos 4:10,9,misi in vos mortem in via Aegypti percussi in gladio iuvenes vestros usque ad captivitatem equorum vestrorum et ascendere feci putredinem castrorum vestrorum in nares vestras et non redistis ad me dicit Dominus
la,VULGATA,Amos,Amos,29,Amos.4,Amos 4,3,Amos.4.11,Amos 4:11,10,subverti vos sicut subvertit Deus Sodomam et Gomorram et facti estis quasi torris raptus de incendio et non redistis ad me dicit Dominus
la,VULGATA,Amos,Amos,29,Amos.4,Amos 4,3,Amos.4.12,Amos 4:12,11,quapropter haec faciam tibi Israhel postquam autem haec fecero tibi praeparare in occursum Dei tui Israhel
la,VULGATA,Amos,Amos,29,Amos.4,Amos 4,3,Amos.4.13,Amos 4:13,12,quia ecce formans montes et creans ventum et adnuntians homini eloquium suum faciens matutinam nebulam et gradiens super excelsa terrae Dominus Deus exercituum nomen eius
la,VULGATA,Amos,Amos,29,Amos.5,Amos 5,4,Amos.5.1,Amos 5:1,0,audite verbum istud quod ego levo super vos planctum domus Israhel cecidit non adiciet ut resurgat
la,VULGATA,Amos,Amos,29,Amos.5,Amos 5,4,Amos.5.2,Amos 5:2,1,virgo Israhel proiecta est in terram suam non est qui suscitet eam
la,VULGATA,Amos,Amos,29,Amos.5,Amos 5,4,Amos.5.3,Amos 5:3,2,quia haec dicit Dominus Deus urbs de qua egrediebantur mille relinquentur in ea centum et de qua egrediebantur centum relinquentur in ea decem in domo Israhel
la,VULGATA,Amos,Amos,29,Amos.5,Amos 5,4,Amos.5.4,Amos 5:4,3,quia haec dicit Dominus domui Israhel quaerite me et vivetis
la,VULGATA,Amos,Amos,29,Amos.5,Amos 5,4,Amos.5.5,Amos 5:5,4,et nolite quaerere Bethel et in Galgala nolite intrare et in Bersabee non transibitis quia Galgala captiva ducetur et Bethel erit inutilis
la,VULGATA,Amos,Amos,29,Amos.5,Amos 5,4,Amos.5.6,Amos 5:6,5,quaerite Dominum et vivite ne forte conburatur ut ignis domus Ioseph et devorabit et non erit qui extinguat Bethel
la,VULGATA,Amos,Amos,29,Amos.5,Amos 5,4,Amos.5.7,Amos 5:7,6,qui convertitis in absinthium iudicium et iustitiam in terra relinquitis
la,VULGATA,Amos,Amos,29,Amos.5,Amos 5,4,Amos.5.8,Amos 5:8,7,facientem Arcturum et Orionem et convertentem in mane tenebras et diem nocte mutantem qui vocat aquas maris et effundit eas super faciem terrae Dominus nomen eius
la,VULGATA,Amos,Amos,29,Amos.5,Amos 5,4,Amos.5.9,Amos 5:9,8,qui subridet vastitatem super robustum et depopulationem super potentem adfert
la,VULGATA,Amos,Amos,29,Amos.5,Amos 5,4,Amos.5.10,Amos 5:10,9,odio habuerunt in porta corripientem et loquentem perfecte abominati sunt
la,VULGATA,Amos,Amos,29,Amos.5,Amos 5,4,Amos.5.11,Amos 5:11,10,idcirco pro eo quod diripiebatis pauperem et praedam electam tollebatis ab eo domos quadro lapide aedificabitis et non habitabitis in eis vineas amantissimas plantabitis et non bibetis vinum earum
la,VULGATA,Amos,Amos,29,Amos.5,Amos 5,4,Amos.5.12,Amos 5:12,11,quia cognovi multa scelera vestra et fortia peccata vestra hostes iusti accipientes munus et pauperes in porta deprimentes
la,VULGATA,Amos,Amos,29,Amos.5,Amos 5,4,Amos.5.13,Amos 5:13,12,ideo prudens in tempore illo tacebit quia tempus malum est
la,VULGATA,Amos,Amos,29,Amos.5,Amos 5,4,Amos.5.14,Amos 5:14,13,quaerite bonum et non malum ut vivatis et erit Dominus Deus exercituum vobiscum sicut dixistis
la,VULGATA,Amos,Amos,29,Amos.5,Amos 5,4,Amos.5.15,Amos 5:15,14,odite malum et diligite bonum et constituite in porta iudicium si forte misereatur Dominus Deus exercituum reliquiis Ioseph
la,VULGATA,Amos,Amos,29,Amos.5,Amos 5,4,Amos.5.16,Amos 5:16,15,propterea haec dicit Dominus Deus exercituum Dominator in omnibus plateis planctus et in cunctis quae foris sunt dicetur vae vae et vocabunt agricolam ad luctum et ad planctum eos qui sciunt plangere
la,VULGATA,Amos,Amos,29,Amos.5,Amos 5,4,Amos.5.17,Amos 5:17,16,et in omnibus vineis erit planctus quia pertransibo in medio tui dicit Dominus
la,VULGATA,Amos,Amos,29,Amos.5,Amos 5,4,Amos.5.18,Amos 5:18,17,vae desiderantibus diem Domini ad quid eam vobis dies Domini ista tenebrae et non lux
la,VULGATA,Amos,Amos,29,Amos.5,Amos 5,4,Amos.5.19,Amos 5:19,18,quomodo si fugiat vir a facie leonis et occurrat ei ursus et ingrediatur domum et innitatur manu sua super parietem et mordeat eum coluber
la,VULGATA,Amos,Amos,29,Amos.5,Amos 5,4,Amos.5.20,Amos 5:20,19,numquid non tenebrae dies Domini et non lux et caligo et non splendor in ea
la,VULGATA,Amos,Amos,29,Amos.5,Amos 5,4,Amos.5.21,Amos 5:21,20,odi et proieci festivitates vestras et non capiam odorem coetuum vestrorum
la,VULGATA,Amos,Amos,29,Amos.5,Amos 5,4,Amos.5.22,Amos 5:22,21,quod si adtuleritis mihi holocaustomata et munera vestra non suscipiam et vota pinguium vestrorum non respiciam
la,VULGATA,Amos,Amos,29,Amos.5,Amos 5,4,Amos.5.23,Amos 5:23,22,aufer a me tumultum carminum tuorum et cantica lyrae tuae non audiam
la,VULGATA,Amos,Amos,29,Amos.5,Amos 5,4,Amos.5.24,Amos 5:24,23,et revelabitur quasi aqua iudicium et iustitia quasi torrens fortis
la,VULGATA,Amos,Amos,29,Amos.5,Amos 5,4,Amos.5.25,Amos 5:25,24,numquid hostias et sacrificium obtulistis mihi in deserto quadraginta annis domus Israhel
la,VULGATA,Amos,Amos,29,Amos.5,Amos 5,4,Amos.5.26,Amos 5:26,25,et portastis tabernaculum Moloch vestro et imaginem idolorum vestrorum sidus dei vestri quae fecistis vobis
la,VULGATA,Amos,Amos,29,Amos.5,Amos 5,4,Amos.5.27,Amos 5:27,26,et migrare vos faciam trans Damascum dixit Dominus Deus exercituum nomen eius
la,VULGATA,Amos,Amos,29,Amos.6,Amos 6,5,Amos.6.1,Amos 6:1,0,vae qui opulenti estis in Sion et confiditis in monte Samariae optimates capita populorum ingredientes pompatice domum Israhel
la,VULGATA,Amos,Amos,29,Amos.6,Amos 6,5,Amos.6.2,Amos 6:2,1,transite in Chalanne et videte et ite inde in Emath magnam et descendite in Geth Palestinorum et ad optima quaeque regna horum si latior terminus eorum termino vestro est
la,VULGATA,Amos,Amos,29,Amos.6,Amos 6,5,Amos.6.3,Amos 6:3,2,qui separati estis in diem malum et adpropinquatis solio iniquitatis
la,VULGATA,Amos,Amos,29,Amos.6,Amos 6,5,Amos.6.4,Amos 6:4,3,qui dormitis in lectis eburneis et lascivitis in stratis vestris qui comeditis agnum de grege et vitulos de medio armenti
la,VULGATA,Amos,Amos,29,Amos.6,Amos 6,5,Amos.6.5,Amos 6:5,4,qui canitis ad vocem psalterii sicut David putaverunt se habere vasa cantici
la,VULGATA,Amos,Amos,29,Amos.6,Amos 6,5,Amos.6.6,Amos 6:6,5,bibentes in fialis vinum et optimo unguento delibuti et nihil patiebantur super contritione Ioseph
la,VULGATA,Amos,Amos,29,Amos.6,Amos 6,5,Amos.6.7,Amos 6:7,6,quapropter nunc migrabunt in capite transmigrantium et auferetur factio lascivientium
la,VULGATA,Amos,Amos,29,Amos.6,Amos 6,5,Amos.6.8,Amos 6:8,7,iuravit Dominus Deus in anima sua dicit Dominus Deus exercituum detestor ego superbiam Iacob et domos eius odi et tradam civitatem cum habitatoribus suis
la,VULGATA,Amos,Amos,29,Amos.6,Amos 6,5,Amos.6.9,Amos 6:9,8,quod si reliqui fuerint decem viri in domo una et ipsi morientur
la,VULGATA,Amos,Amos,29,Amos.6,Amos 6,5,Amos.6.10,Amos 6:10,9,et tollet eum propinquus suus et conburet eum ut efferat ossa de domo et dicet ei qui in penetrabilibus domus est numquid adhuc est apud te
la,VULGATA,Amos,Amos,29,Amos.6,Amos 6,5,Amos.6.11,Amos 6:11,10,et respondebit finis est et dicet ei tace et non recorderis nominis Domini
la,VULGATA,Amos,Amos,29,Amos.6,Amos 6,5,Amos.6.12,Amos 6:12,11,quia ecce Dominus mandabit et percutiet domum maiorem ruinis et domum minorem scissionibus
la,VULGATA,Amos,Amos,29,Amos.6,Amos 6,5,Amos.6.13,Amos 6:13,12,numquid currere queunt in petris equi aut arari potest in bubalis quoniam convertistis in amaritudinem iudicium et fructum iustitiae in absinthium
la,VULGATA,Amos,Amos,29,Amos.6,Amos 6,5,Amos.6.14,Amos 6:14,13,qui laetamini in nihili qui dicitis numquid non in fortitudine nostra adsumpsimus nobis cornua
la,VULGATA,Amos,Amos,29,Amos.6,Amos 6,5,Amos.6.15,Amos 6:15,14,ecce enim suscitabo super vos domus Israhel dicit Dominus Deus exercituum gentem et conterent vos ab introitu Emath usque ad torrentem Deserti
la,VULGATA,Amos,Amos,29,Amos.7,Amos 7,6,Amos.7.1,Amos 7:1,0,haec ostendit mihi Dominus Deus et ecce fictor lucustae in principio germinantium serotini imbris et ecce serotinus post tonsorem regis
la,VULGATA,Amos,Amos,29,Amos.7,Amos 7,6,Amos.7.2,Amos 7:2,1,et factum est cum consummasset comedere herbam terrae et dixi Domine Deus propitius esto obsecro quis suscitabit Iacob quia parvulus est
la,VULGATA,Amos,Amos,29,Amos.7,Amos 7,6,Amos.7.3,Amos 7:3,2,misertus est Dominus super hoc non erit dixit Dominus
la,VULGATA,Amos,Amos,29,Amos.7,Amos 7,6,Amos.7.4,Amos 7:4,3,haec ostendit mihi Dominus Deus et ecce vocabat iudicium ad ignem Dominus Deus et devoravit abyssum multam et comedit simul partem
la,VULGATA,Amos,Amos,29,Amos.7,Amos 7,6,Amos.7.5,Amos 7:5,4,et dixi Domine Deus quiesce obsecro quis suscitabit Iacob quia parvulus est
la,VULGATA,Amos,Amos,29,Amos.7,Amos 7,6,Amos.7.6,Amos 7:6,5,misertus est Dominus super hoc sed et istud non erit dixit Dominus Deus
la,VULGATA,Amos,Amos,29,Amos.7,Amos 7,6,Amos.7.7,Amos 7:7,6,haec ostendit mihi et ecce Dominus stans super murum litum et in manu eius trulla cementarii
la,VULGATA,Amos,Amos,29,Amos.7,Amos 7,6,Amos.7.8,Amos 7:8,7,et dixit Dominus ad me quid tu vides Amos et dixi trullam cementarii et dixit Dominus ecce ego ponam trullam in medio populi mei Israhel non adiciam ultra superinducere eum
la,VULGATA,Amos,Amos,29,Amos.7,Amos 7,6,Amos.7.9,Amos 7:9,8,et demolientur excelsa idoli et sanctificationes Israhel desolabuntur et consurgam super domum Hieroboam in gladio
la,VULGATA,Amos,Amos,29,Amos.7,Amos 7,6,Amos.7.10,Amos 7:10,9,et misit Amasias sacerdos Bethel ad Hieroboam regem Israhel dicens rebellavit contra te Amos in medio domus Israhel non poterit terra sustinere universos sermones eius
la,VULGATA,Amos,Amos,29,Amos.7,Amos 7,6,Amos.7.11,Amos 7:11,10,haec enim dicit Amos in gladio morietur Hieroboam et Israhel captivus migrabit de terra sua
la,VULGATA,Amos,Amos,29,Amos.7,Amos 7,6,Amos.7.12,Amos 7:12,11,et dixit Amasias ad Amos qui vides gradere fuge in terram Iuda et comede ibi panem et ibi prophetabis
la,VULGATA,Amos,Amos,29,Amos.7,Amos 7,6,Amos.7.13,Amos 7:13,12,et in Bethel non adicies ultra ut prophetes quia sanctificatio regis est et domus regni est
la,VULGATA,Amos,Amos,29,Amos.7,Amos 7,6,Amos.7.14,Amos 7:14,13,et respondit Amos et dixit ad Amasiam non sum propheta et non sum filius prophetae sed armentarius ego sum vellicans sycomoros
la,VULGATA,Amos,Amos,29,Amos.7,Amos 7,6,Amos.7.15,Amos 7:15,14,et tulit me Dominus cum sequerer gregem et dixit ad me Dominus vade propheta ad populum meum Israhel
la,VULGATA,Amos,Amos,29,Amos.7,Amos 7,6,Amos.7.16,Amos 7:16,15,et nunc audi verbum Domini tu dicis non prophetabis super Israhel et non stillabis super domum idoli
la,VULGATA,Amos,Amos,29,Amos.7,Amos 7,6,Amos.7.17,Amos 7:17,16,propter hoc haec dicit Dominus uxor tua in civitate fornicabitur et filii tui et filiae tuae in gladio cadent et humus tua funiculo metietur et tu in terra polluta morieris et Israhel captivus migrabit de terra sua
la,VULGATA,Amos,Amos,29,Amos.8,Amos 8,7,Amos.8.1,Amos 8:1,0,haec ostendit mihi Dominus Deus et ecce uncinus pomorum
la,VULGATA,Amos,Amos,29,Amos.8,Amos 8,7,Amos.8.2,Amos 8:2,1,et dixit quid tu vides Amos et dixi uncinum pomorum et dixit Dominus ad me venit finis super populum meum Israhel non adiciam ultra ut pertranseam eum
la,VULGATA,Amos,Amos,29,Amos.8,Amos 8,7,Amos.8.3,Amos 8:3,2,et stridebunt cardines templi in die illa dicit Dominus Deus multi morientur in omni loco proicietur silentium
la,VULGATA,Amos,Amos,29,Amos.8,Amos 8,7,Amos.8.4,Amos 8:4,3,audite hoc qui conteritis pauperem et deficere facitis egenos terrae
la,VULGATA,Amos,Amos,29,Amos.8,Amos 8,7,Amos.8.5,Amos 8:5,4,dicentes quando transibit mensis et venundabimus merces et sabbatum et aperiemus frumentum ut inminuamus mensuram et augeamus siclum et subponamus stateras dolosas
la,VULGATA,Amos,Amos,29,Amos.8,Amos 8,7,Amos.8.6,Amos 8:6,5,ut possideamus in argento egenos et pauperes pro calciamentis et quisquilias frumenti vendamus
la,VULGATA,Amos,Amos,29,Amos.8,Amos 8,7,Amos.8.7,Amos 8:7,6,iuravit Dominus in superbia Iacob si oblitus fuero usque ad finem omnia opera eorum
la,VULGATA,Amos,Amos,29,Amos.8,Amos 8,7,Amos.8.8,Amos 8:8,7,numquid super isto non commovebitur terra et lugebit omnis habitator eius et ascendet quasi fluvius universus et eicietur et defluet quasi rivus Aegypti
la,VULGATA,Amos,Amos,29,Amos.8,Amos 8,7,Amos.8.9,Amos 8:9,8,et erit in die illa dicit Dominus occidet sol meridie et tenebrescere faciam terram in die luminis
la,VULGATA,Amos,Amos,29,Amos.8,Amos 8,7,Amos.8.10,Amos 8:10,9,et convertam festivitates vestras in luctum et omnia cantica vestra in planctum et inducam super omne dorsum vestrum saccum et super omne caput calvitium et ponam eam quasi luctum unigeniti et novissima eius quasi diem amarum
la,VULGATA,Amos,Amos,29,Amos.8,Amos 8,7,Amos.8.11,Amos 8:11,10,ecce dies veniunt dicit Dominus et mittam famem in terram non famem panis neque sitim aquae sed audiendi verbum Domini
la,VULGATA,Amos,Amos,29,Amos.8,Amos 8,7,Amos.8.12,Amos 8:12,11,et commovebuntur a mari usque ad mare et ab aquilone usque ad orientem circumibunt quaerentes verbum Domini et non invenient
la,VULGATA,Amos,Amos,29,Amos.8,Amos 8,7,Amos.8.13,Amos 8:13,12,in die illa deficient virgines pulchrae et adulescentes in siti
la,VULGATA,Amos,Amos,29,Amos.8,Amos 8,7,Amos.8.14,Amos 8:14,13,qui iurant in delicto Samariae et dicunt vivit deus tuus Dan et vivit via Bersabee et cadent et non resurgent ultra
la,VULGATA,Amos,Amos,29,Amos.9,Amos 9,8,Amos.9.1,Amos 9:1,0,vidi Dominum stantem super altare et dixit percute cardinem et commoveantur superliminaria avaritia enim in capite omnium et novissimum eorum in gladio interficiam non erit fuga eis fugiet et non salvabitur ex eis qui fugerit
la,VULGATA,Amos,Amos,29,Amos.9,Amos 9,8,Amos.9.2,Amos 9:2,1,si descenderint usque ad infernum inde manus mea educet eos et si ascenderint usque ad caelum inde detraham eos
la,VULGATA,Amos,Amos,29,Amos.9,Amos 9,8,Amos.9.3,Amos 9:3,2,et si absconditi fuerint in vertice Carmeli inde scrutans auferam eos et si celaverint se ab oculis meis in fundo maris ibi mandabo serpenti et mordebit eos
la,VULGATA,Amos,Amos,29,Amos.9,Amos 9,8,Amos.9.4,Amos 9:4,3,et si abierint in captivitatem coram inimicis suis ibi mandabo gladio et occidet eos et ponam oculos meos super eos in malum et non in bonum
la,VULGATA,Amos,Amos,29,Amos.9,Amos 9,8,Amos.9.5,Amos 9:5,4,et Dominus Deus exercituum qui tangit terram et tabescet et lugebunt omnes habitantes in ea et ascendet sicut rivus omnis et defluet sicut fluvius Aegypti
la,VULGATA,Amos,Amos,29,Amos.9,Amos 9,8,Amos.9.6,Amos 9:6,5,qui aedificat in caelo ascensionem suam et fasciculum suum super terram fundavit qui vocat aquas maris et effundit eas super faciem terrae Dominus nomen eius
la,VULGATA,Amos,Amos,29,Amos.9,Amos 9,8,Amos.9.7,Amos 9:7,6,numquid non ut filii Aethiopum vos estis mihi filii Israhel ait Dominus numquid non Israhel ascendere feci de terra Aegypti et Palestinos de Cappadocia et Syros de Cyrene
la,VULGATA,Amos,Amos,29,Amos.9,Amos 9,8,Amos.9.8,Amos 9:8,7,ecce oculi Domini Dei super regnum peccans et conteram illud a facie terrae verumtamen conterens non conteram domum Iacob dicit Dominus
la,VULGATA,Amos,Amos,29,Amos.9,Amos 9,8,Amos.9.9,Amos 9:9,8,ecce enim ego mandabo et concutiam in omnibus gentibus domum Israhel sicut concutitur in cribro et non cadet lapillus super terram
la,VULGATA,Amos,Amos,29,Amos.9,Amos 9,8,Amos.9.10,Amos 9:10,9,in gladio morientur omnes peccatores populi mei qui dicunt non adpropinquabit et non veniet super nos malum
