languageCode,code,bookOsisId,bookSblId,bookOrderIndex,chapterOsisId,chapterSblId,chapterOrderIndex,verseOsisId,verseSblId,verseOrderIndex,text
la,VULGATA,Jonah,Jonah,31,Jonah.1,Jonah 1,0,Jonah.1.1,Jonah 1:1,0,et factum est verbum Domini ad Ionam filium Amathi dicens
la,VULGATA,Jonah,Jonah,31,Jonah.1,Jonah 1,0,Jonah.1.2,Jonah 1:2,1,surge vade in Nineven civitatem grandem et praedica in ea quia ascendit malitia eius coram me
la,VULGATA,Jonah,Jonah,31,Jonah.1,Jonah 1,0,Jonah.1.3,Jonah 1:3,2,et surrexit Iona ut fugeret in Tharsis a facie Domini et descendit Ioppen et invenit navem euntem in Tharsis et dedit naulum eius et descendit in eam ut iret cum eis in Tharsis a facie Domini
la,VULGATA,Jonah,Jonah,31,Jonah.1,Jonah 1,0,Jonah.1.4,Jonah 1:4,3,Dominus autem misit ventum magnum in mari et facta est tempestas magna in mari et navis periclitabatur conteri
la,VULGATA,Jonah,Jonah,31,Jonah.1,Jonah 1,0,Jonah.1.5,Jonah 1:5,4,et timuerunt nautae et clamaverunt viri ad deum suum et miserunt vasa quae erant in navi in mare ut adleviaretur ab eis et Iona descendit ad interiora navis et dormiebat sopore gravi
la,VULGATA,Jonah,Jonah,31,Jonah.1,Jonah 1,0,Jonah.1.6,Jonah 1:6,5,et accessit ad eum gubernator et dixit ei quid tu sopore deprimeris surge invoca Deum tuum si forte recogitet Deus de nobis et non pereamus
la,VULGATA,Jonah,Jonah,31,Jonah.1,Jonah 1,0,Jonah.1.7,Jonah 1:7,6,et dixit vir ad collegam suum venite et mittamus sortes et sciamus quare hoc malum sit nobis et miserunt sortes et cecidit sors super Ionam
la,VULGATA,Jonah,Jonah,31,Jonah.1,Jonah 1,0,Jonah.1.8,Jonah 1:8,7,et dixerunt ad eum indica nobis cuius causa malum istud sit nobis quod est opus tuum quae terra tua et quo vel ex quo populo es tu
la,VULGATA,Jonah,Jonah,31,Jonah.1,Jonah 1,0,Jonah.1.9,Jonah 1:9,8,et dixit ad eos Hebraeus ego sum et Dominum Deum caeli ego timeo qui fecit mare et aridam
la,VULGATA,Jonah,Jonah,31,Jonah.1,Jonah 1,0,Jonah.1.10,Jonah 1:10,9,et timuerunt viri timore magno et dixerunt ad eum quid hoc fecisti cognoverunt enim viri quod a facie Domini fugeret quia indicaverat eis
la,VULGATA,Jonah,Jonah,31,Jonah.1,Jonah 1,0,Jonah.1.11,Jonah 1:11,10,et dixerunt ad eum quid faciemus tibi et cessabit mare a nobis quia mare ibat et intumescebat
la,VULGATA,Jonah,Jonah,31,Jonah.1,Jonah 1,0,Jonah.1.12,Jonah 1:12,11,et dixit ad eos tollite me et mittite in mare et cessabit mare a vobis scio enim ego quoniam propter me tempestas grandis haec super vos
la,VULGATA,Jonah,Jonah,31,Jonah.1,Jonah 1,0,Jonah.1.13,Jonah 1:13,12,et remigabant viri ut reverterentur ad aridam et non valebant quia mare ibat et intumescebat super eos
la,VULGATA,Jonah,Jonah,31,Jonah.1,Jonah 1,0,Jonah.1.14,Jonah 1:14,13,et clamaverunt ad Dominum et dixerunt quaesumus Domine ne pereamus in anima viri istius et ne des super nos sanguinem innocentem quia tu Domine sicut voluisti fecisti
la,VULGATA,Jonah,Jonah,31,Jonah.1,Jonah 1,0,Jonah.1.15,Jonah 1:15,14,et tulerunt Ionam et miserunt in mare et stetit mare a fervore suo
la,VULGATA,Jonah,Jonah,31,Jonah.1,Jonah 1,0,Jonah.1.16,Jonah 1:16,15,et timuerunt viri timore magno Dominum et immolaverunt hostias Domino et voverunt vota
la,VULGATA,Jonah,Jonah,31,Jonah.2,Jonah 2,1,Jonah.2.1,Jonah 2:1,0,et praeparavit Dominus piscem grandem ut degluttiret Ionam et erat Iona in ventre piscis tribus diebus et tribus noctibus
la,VULGATA,Jonah,Jonah,31,Jonah.2,Jonah 2,1,Jonah.2.2,Jonah 2:2,1,et oravit Iona ad Dominum Deum suum de utero piscis
la,VULGATA,Jonah,Jonah,31,Jonah.2,Jonah 2,1,Jonah.2.3,Jonah 2:3,2,et dixit clamavi de tribulatione mea ad Dominum et exaudivit me de ventre inferni clamavi et exaudisti vocem meam
la,VULGATA,Jonah,Jonah,31,Jonah.2,Jonah 2,1,Jonah.2.4,Jonah 2:4,3,et proiecisti me in profundum in corde maris et flumen circumdedit me omnes gurgites tui et fluctus tui super me transierunt
la,VULGATA,Jonah,Jonah,31,Jonah.2,Jonah 2,1,Jonah.2.5,Jonah 2:5,4,et ego dixi abiectus sum a conspectu oculorum tuorum verumtamen rursus videbo templum sanctum tuum
la,VULGATA,Jonah,Jonah,31,Jonah.2,Jonah 2,1,Jonah.2.6,Jonah 2:6,5,circumdederunt me aquae usque ad animam abyssus vallavit me pelagus operuit caput meum
la,VULGATA,Jonah,Jonah,31,Jonah.2,Jonah 2,1,Jonah.2.7,Jonah 2:7,6,ad extrema montium descendi terrae vectes concluserunt me in aeternum et sublevabis de corruptione vitam meam Domine Deus meus
la,VULGATA,Jonah,Jonah,31,Jonah.2,Jonah 2,1,Jonah.2.8,Jonah 2:8,7,cum angustiaretur in me anima mea Domini recordatus sum ut veniat ad te oratio mea ad templum sanctum tuum
la,VULGATA,Jonah,Jonah,31,Jonah.2,Jonah 2,1,Jonah.2.9,Jonah 2:9,8,qui custodiunt vanitates frustra misericordiam suam derelinquunt
la,VULGATA,Jonah,Jonah,31,Jonah.2,Jonah 2,1,Jonah.2.10,Jonah 2:10,9,ego autem in voce laudis immolabo tibi quaecumque vovi reddam pro salute Domino
la,VULGATA,Jonah,Jonah,31,Jonah.2,Jonah 2,1,Jonah.2.11,Jonah 2:11,10,et dixit Dominus pisci et evomuit Ionam in aridam
la,VULGATA,Jonah,Jonah,31,Jonah.3,Jonah 3,2,Jonah.3.1,Jonah 3:1,0,et factum est verbum Domini ad Ionam secundo dicens
la,VULGATA,Jonah,Jonah,31,Jonah.3,Jonah 3,2,Jonah.3.2,Jonah 3:2,1,surge vade ad Nineven civitatem magnam et praedica in ea praedicationem quam ego loquor ad te
la,VULGATA,Jonah,Jonah,31,Jonah.3,Jonah 3,2,Jonah.3.3,Jonah 3:3,2,et surrexit Iona et abiit in Nineven iuxta verbum Domini et Nineve erat civitas magna Dei itinere dierum trium
la,VULGATA,Jonah,Jonah,31,Jonah.3,Jonah 3,2,Jonah.3.4,Jonah 3:4,3,et coepit Iona introire in civitatem itinere diei unius et clamavit et dixit adhuc quadraginta dies et Nineve subvertetur
la,VULGATA,Jonah,Jonah,31,Jonah.3,Jonah 3,2,Jonah.3.5,Jonah 3:5,4,et crediderunt viri ninevitae in Deo et praedicaverunt ieiunium et vestiti sunt saccis a maiore usque ad minorem
la,VULGATA,Jonah,Jonah,31,Jonah.3,Jonah 3,2,Jonah.3.6,Jonah 3:6,5,et pervenit verbum ad regem Nineve et surrexit de solio suo et abiecit vestimentum suum a se et indutus est sacco et sedit in cinere
la,VULGATA,Jonah,Jonah,31,Jonah.3,Jonah 3,2,Jonah.3.7,Jonah 3:7,6,et clamavit et dixit in Nineve ex ore regis et principum eius dicens homines et iumenta et boves et pecora non gustent quicquam nec pascantur et aquam non bibant
la,VULGATA,Jonah,Jonah,31,Jonah.3,Jonah 3,2,Jonah.3.8,Jonah 3:8,7,et operiantur saccis homines et iumenta et clament ad Dominum in fortitudine et convertatur vir a via sua mala et ab iniquitate quae est in manibus eorum
la,VULGATA,Jonah,Jonah,31,Jonah.3,Jonah 3,2,Jonah.3.9,Jonah 3:9,8,quis scit si convertatur et ignoscat Deus et revertatur a furore irae suae et non peribimus
la,VULGATA,Jonah,Jonah,31,Jonah.3,Jonah 3,2,Jonah.3.10,Jonah 3:10,9,et vidit Deus opera eorum quia conversi sunt a via sua mala et misertus est Deus super malitiam quam locutus fuerat ut faceret eis et non fecit
la,VULGATA,Jonah,Jonah,31,Jonah.4,Jonah 4,3,Jonah.4.1,Jonah 4:1,0,et adflictus est Iona adflictione magna et iratus est
la,VULGATA,Jonah,Jonah,31,Jonah.4,Jonah 4,3,Jonah.4.2,Jonah 4:2,1,et oravit ad Dominum et dixit obsecro Domine numquid non hoc est verbum meum cum adhuc essem in terra mea propter hoc praeoccupavi ut fugerem in Tharsis scio enim quia tu Deus clemens et misericors es patiens et multae miserationis et ignoscens super malitia
la,VULGATA,Jonah,Jonah,31,Jonah.4,Jonah 4,3,Jonah.4.3,Jonah 4:3,2,et nunc Domine tolle quaeso animam meam a me quia melior est mihi mors quam vita
la,VULGATA,Jonah,Jonah,31,Jonah.4,Jonah 4,3,Jonah.4.4,Jonah 4:4,3,et dixit Dominus putasne bene irasceris tu
la,VULGATA,Jonah,Jonah,31,Jonah.4,Jonah 4,3,Jonah.4.5,Jonah 4:5,4,et egressus est Iona de civitate et sedit contra orientem civitatis et fecit sibimet ibi umbraculum et sedebat subter eum in umbra donec videret quid accideret civitati
la,VULGATA,Jonah,Jonah,31,Jonah.4,Jonah 4,3,Jonah.4.6,Jonah 4:6,5,et praeparavit Dominus Deus hederam et ascendit super caput Ionae ut esset umbra super caput eius et protegeret eum laboraverat enim et laetatus est Iona super hedera laetitia magna
la,VULGATA,Jonah,Jonah,31,Jonah.4,Jonah 4,3,Jonah.4.7,Jonah 4:7,6,et paravit Deus vermem ascensu diluculo in crastinum et percussit hederam et exaruit
la,VULGATA,Jonah,Jonah,31,Jonah.4,Jonah 4,3,Jonah.4.8,Jonah 4:8,7,et cum ortus fuisset sol praecepit Dominus vento calido et urenti et percussit sol super caput Ionae et aestuabat et petivit animae suae ut moreretur et dixit melius est mihi mori quam vivere
la,VULGATA,Jonah,Jonah,31,Jonah.4,Jonah 4,3,Jonah.4.9,Jonah 4:9,8,et dixit Dominus ad Ionam putasne bene irasceris tu super hederam et dixit bene irascor ego usque ad mortem
la,VULGATA,Jonah,Jonah,31,Jonah.4,Jonah 4,3,Jonah.4.10,Jonah 4:10,9,et dixit Dominus tu doles super hederam in qua non laborasti neque fecisti ut cresceret quae sub una nocte nata est et una nocte periit
la,VULGATA,Jonah,Jonah,31,Jonah.4,Jonah 4,3,Jonah.4.11,Jonah 4:11,10,et ego non parcam Nineve civitati magnae in qua sunt plus quam centum viginti milia hominum qui nesciunt quid sit inter dexteram et sinistram suam et iumenta multa
