languageCode,code,bookOsisId,bookSblId,bookOrderIndex,chapterOsisId,chapterSblId,chapterOrderIndex,verseOsisId,verseSblId,verseOrderIndex,text
uk,NPU,Amos,Amos,29,Amos.6,Amos 6,5,Amos.6.11,Amos 6:11,10,"Бо Господь ось накаже, і ворог розіб'є великий той дім на відламки, а дім малий на тріски."
uk,NPU,Amos,Amos,29,Amos.6,Amos 6,5,Amos.6.12,Amos 6:12,11,"Чи бігають коні по скелі? Чи хто виоре море худобою? Таж ви суд обернули на гіркість, а плід справедливости на полин!"
uk,NPU,Amos,Amos,29,Amos.6,Amos 6,5,Amos.6.13,Amos 6:13,12,Ви марнотою тішитеся та говорите: Хіба ж ми не власною силою набули собі роги?
uk,NPU,Amos,Amos,29,Amos.6,Amos 6,5,Amos.6.14,Amos 6:14,13,"Бо ось Я поставлю народ проти вас, доме Ізраїлів, каже Господь, Бог Саваот, і вони вас потиснуть ізвідти, де йдуть до Гамату, аж до степового потоку!"
uk,NPU,Amos,Amos,29,Amos.7,Amos 7,6,Amos.7.1,Amos 7:1,0,"Господь Бог учинив, що я бачив таке: Ось Він утворив сарану, коли почала виростати отава, і ось отава як по сінокосі царському!"
uk,NPU,Amos,Amos,29,Amos.7,Amos 7,6,Amos.7.2,Amos 7:2,1,"І сталось, як вона вже пожерла траву на землі, я сказав: Господи, Боже, прости! Як же Яків устояти може, бо такий він малий?"
uk,NPU,Amos,Amos,29,Amos.7,Amos 7,6,Amos.7.3,Amos 7:3,2,"І Господь пожалів був про те. Не станеться це, промовив Господь."
uk,NPU,Amos,Amos,29,Amos.7,Amos 7,6,Amos.7.4,Amos 7:4,3,"Господь Бог учинив, що я бачив таке: Ось Господь Бог покликав судитись огнем, і пожер той велику безодню, і частку пожер."
uk,NPU,Amos,Amos,29,Amos.7,Amos 7,6,Amos.7.5,Amos 7:5,4,"І сказав я: О, Господи, Боже, спини! Як же Яків устояти може, бо такий він малий?"
uk,NPU,Amos,Amos,29,Amos.7,Amos 7,6,Amos.7.6,Amos 7:6,5,І Господь пожалів був про те. Не станеться й це! сказав Господь Бог!
uk,NPU,Amos,Amos,29,Amos.7,Amos 7,6,Amos.7.7,Amos 7:7,6,"І Він знов учинив, що я бачив таке: Ось на мурі стрімкому стоїть Господь Бог, а в руці Його висок."
uk,NPU,Amos,Amos,29,Amos.7,Amos 7,6,Amos.7.8,Amos 7:8,7,"І промовив до мене Господь: Що ти бачиш, Амосе? А я відказав: Виска. І промовив Господь: Ось Я цього виска покладу посеред народу Мого, Ізраїля, уже більше йому не прощу!"
uk,NPU,Amos,Amos,29,Amos.7,Amos 7,6,Amos.7.9,Amos 7:9,8,"І спустошіють жертовні підгірки Ісакові, і поруйновані будуть святині Ізраїлеві, і Я стану з мечем на дім Єровоамів."
uk,NPU,Amos,Amos,29,Amos.7,Amos 7,6,Amos.7.10,Amos 7:10,9,"І послав Амація, священик Бет-Елу, до Єровоама, царя Ізраїлевого, кажучи: Амос змовлюється на тебе серед Ізраїлевого дому, не може земля змістити всіх його слів!"
uk,NPU,Amos,Amos,29,Amos.7,Amos 7,6,Amos.7.11,Amos 7:11,10,"Бо так говорить Амос: Єровоам помре від меча, а Ізраїль конче піде на вигнання з своєї землі!"
uk,NPU,Amos,Amos,29,Amos.7,Amos 7,6,Amos.7.12,Amos 7:12,11,"І сказав Амація до Амоса: Ясновидче, іди, утікай собі до Юдиного краю, і їж там хліб, і там пророкуй."
uk,NPU,Amos,Amos,29,Amos.7,Amos 7,6,Amos.7.13,Amos 7:13,12,"А в Бет-Елі вже більше не будеш пророкувати, бо він святиня царя та дім царства."
uk,NPU,Amos,Amos,29,Amos.7,Amos 7,6,Amos.7.14,Amos 7:14,13,"І відповів Амос і сказав до Амації: Я не пророк, і не син я пророків, я пастух та оброблювач диких фіґовниць."
uk,NPU,Amos,Amos,29,Amos.7,Amos 7,6,Amos.7.15,Amos 7:15,14,"І взяв мене Господь від отари, і промовив до мене Господь: Іди, пророкуй Моєму народові Ізраїлеві!"
uk,NPU,Amos,Amos,29,Amos.7,Amos 7,6,Amos.7.16,Amos 7:16,15,"А тепер послухай Господнього слова: Ти кажеш: Не будеш пророкувати на Ізраїля, і не будеш проповідувати на Ісаків дім."
uk,NPU,Amos,Amos,29,Amos.7,Amos 7,6,Amos.7.17,Amos 7:17,16,"Тому так промовляє Господь: Твоя жінка в місті буде блудлива, і сини твої та дочки твої попадають від меча, а земля твоя буде поділена шнуром, і ти помреш на нечистій землі, а Ізраїль конче піде на вигнання з своєї землі!"
uk,NPU,Amos,Amos,29,Amos.8,Amos 8,7,Amos.8.1,Amos 8:1,0,"Господь Бог учинив, що я бачив таке: Ось кіш доспілих плодів."
uk,NPU,Amos,Amos,29,Amos.8,Amos 8,7,Amos.8.2,Amos 8:2,1,"І сказав Він: Що бачиш, Амосе? А я відказав: Кіш доспілих плодів. І промовив до мене Господь: Доспів кінець Моєму народові Ізраїлеві, уже більше йому не прощу!"
uk,NPU,Amos,Amos,29,Amos.8,Amos 8,7,Amos.8.3,Amos 8:3,2,"І обернуться пісні в палатах на зойк того дня, говорить Господь Бог: буде трупів багато, бо ворог на кожному місці накидає їх!"
uk,NPU,Amos,Amos,29,Amos.8,Amos 8,7,Amos.8.4,Amos 8:4,3,"Послухайте це, ви, що топчете бідного, і що прагнете винищити всіх убогих з землі,"
uk,NPU,Amos,Amos,29,Amos.8,Amos 8,7,Amos.8.5,Amos 8:5,4,"кажучи: Коли то мине новомісяччя, щоб нам збіжжя продати? і субота, щоб нам відчинити збіжеві комори? Щоб зменшити ефу, і щоб шекля побільшити, і щоб викривляти обманну вагу,"
uk,NPU,Amos,Amos,29,Amos.8,Amos 8,7,Amos.8.6,Amos 8:6,5,"щоб купувати за срібло нужденних, а вбогого за взуття, і попродати послід збіжевий?"
uk,NPU,Amos,Amos,29,Amos.8,Amos 8,7,Amos.8.7,Amos 8:7,6,Господь присягнув славою Якова: Не забуду ніколи усіх їхніх вчинків!
uk,NPU,Amos,Amos,29,Amos.8,Amos 8,7,Amos.8.8,Amos 8:8,7,"Чи не затрясеться від цього земля, і всі мешканці її не впадуть у жалобу? Вся вона захвилюється, мов та Ріка, і бурхливо поплине й обнизиться знов, немов річка Єгипту."
uk,NPU,Amos,Amos,29,Amos.8,Amos 8,7,Amos.8.9,Amos 8:9,8,"І станеться в день той, говорить Господь Бог, і вчиню захід сонця опівдні, і для землі серед світлого дня воно стемніє."
uk,NPU,Amos,Amos,29,Amos.8,Amos 8,7,Amos.8.10,Amos 8:10,9,"І оберну ваші свята в жалобу, а всі ваші пісні в голосіння, і на всі стегна спроваджу верету, а на всякую голову лисину, і вчиню це, немов та жалоба по одинакові, кінець же отого, немов гіркий день!"
uk,NPU,Amos,Amos,29,Amos.8,Amos 8,7,Amos.8.11,Amos 8:11,10,"Ось дні настають, говорить Господь Бог, і голод пошлю Я на землю, не голод на хліб, і не спрагу на воду, але спрагу почути Господні слова!"
uk,NPU,Amos,Amos,29,Amos.8,Amos 8,7,Amos.8.12,Amos 8:12,11,"І будуть ходити від моря до моря, і з півночі до сходу блукатимуть, щоб знайти слово Господа, та не знайдуть його!"
uk,NPU,Amos,Amos,29,Amos.8,Amos 8,7,Amos.8.13,Amos 8:13,12,"Того дня будуть мліти від спраги вродливі дівчата та хлопці,"
uk,NPU,Amos,Amos,29,Amos.8,Amos 8,7,Amos.8.14,Amos 8:14,13,"що клянуться гріхом самарійським та кажуть: Як живий твій Бог, Дане, і як жива дорога до Беер-Шеви! Та вони всі попадають, і більше не встануть..."
uk,NPU,Amos,Amos,29,Amos.9,Amos 9,8,Amos.9.1,Amos 9:1,0,"Я бачив Господа, що стояв над жертівником, і Він сказав: Удар но по маковиці цих воріт, щоб затряслися пороги, і порозбивай їх на всіх їхніх головах, а їхній останок заб'ю Я мечем. Не втече їм втікач, і гонець не врятується в них!"
uk,NPU,Amos,Amos,29,Amos.9,Amos 9,8,Amos.9.2,Amos 9:2,1,"Якщо б закопались вони до шеолу, то й звідти рука Моя їх забере, і якщо б піднялися на небо, то й звідти їх скину!"
uk,NPU,Amos,Amos,29,Amos.9,Amos 9,8,Amos.9.3,Amos 9:3,2,"А якщо б поховались вони на верховині Кармелу, звідти вишукаю й заберу їх, а якщо на дні моря вони поховаються з-перед очей Моїх, то й там Я гадюці звелю, і вона їх покусає!"
uk,NPU,Amos,Amos,29,Amos.9,Amos 9,8,Amos.9.4,Amos 9:4,3,"А якщо вони підуть в полон перед своїми ворогами, то й там накажу Я мечеві і він їх повбиває, і на них Я зверну Своє око на зле, а не на добре."
uk,NPU,Amos,Amos,29,Amos.9,Amos 9,8,Amos.9.5,Amos 9:5,4,"Бо коли Господь Бог Саваот доторкнеться землі, то розтане вона, і в жалобу впадуть всі мешканці її. І вся вона вийде, немов та Ріка, і мов річка Єгипту обнизиться."
uk,NPU,Amos,Amos,29,Amos.9,Amos 9,8,Amos.9.6,Amos 9:6,5,"Він будує на небі чертоги Свої, а Свій небозвід заклав над землею, воду морську Він кличе, і виливає її на поверхню землі, Господь Йому Ймення!"
uk,NPU,Amos,Amos,29,Amos.9,Amos 9,8,Amos.9.7,Amos 9:7,6,"Хіба ж ви, Ізраїлеві сини, Мені не такі, як сини етіоплян? говорить Господь. Хіба ж не Ізраїля вивів Я з краю єгипетського, а филистимлян з Кафтору, а Арама із Кіру?"
uk,NPU,Amos,Amos,29,Amos.9,Amos 9,8,Amos.9.8,Amos 9:8,7,"Ось очі Господа Бога на грішне це царство, і з поверхні землі його вигублю, та вигублюючи, не погублю дому Якового, говорить Господь."
uk,NPU,Amos,Amos,29,Amos.9,Amos 9,8,Amos.9.9,Amos 9:9,8,"Бо ось Я звелів, і серед народів усіх пересію Ізраїлів дім, як пересівається решетом, і жодне зеренце на землю не випаде!"
uk,NPU,Amos,Amos,29,Amos.9,Amos 9,8,Amos.9.10,Amos 9:10,9,"Упадуть усі грішні народу Мого від меча, що говорять: Не досягне до нас і не стріне оце нас нещастя!"
uk,NPU,Amos,Amos,29,Amos.9,Amos 9,8,Amos.9.11,Amos 9:11,10,"Того дня Я поставлю упалу Давидову скинію і проломи в ній загороджу, і поставлю руїни його, і відбудую його, як за днів стародавніх,"
uk,NPU,Amos,Amos,29,Amos.9,Amos 9,8,Amos.9.12,Amos 9:12,11,"щоб решту Едому посіли вони, і всі ті народи, що в них кликалося Моє Ймення, говорить Господь, Який чинить оце."
uk,NPU,Amos,Amos,29,Amos.9,Amos 9,8,Amos.9.13,Amos 9:13,12,"Ось дні настають, говорить Господь, і орач із женцем зустрінеться, а топтач винограду із сіячем, і гори закрапають виноградовим соком, а всі взгір'я добром потечуть."
uk,NPU,Amos,Amos,29,Amos.9,Amos 9,8,Amos.9.14,Amos 9:14,13,"І долю народу Свого, Ізраїля, Я поверну, і побудую міста попустошені, і осядуть вони, і засадять вони виноградники, й питимуть їхнє вино, і порозводять садки, і будуть їсти їхній овоч."
uk,NPU,Amos,Amos,29,Amos.9,Amos 9,8,Amos.9.15,Amos 9:15,14,"І Я посаджу їх на їхній землі, і не будуть їх більш виривати з своєї землі, яку Я їм дав, говорить Господь, Бог твій!"
