languageCode,code,bookOsisId,bookSblId,bookOrderIndex,chapterOsisId,chapterSblId,chapterOrderIndex,verseOsisId,verseSblId,verseOrderIndex,text
ru,RUS_SYNODAL,Song,Song,21,Song.1,Song 1,0,Song.1.1,Song 1:1,0,Да лобзает он меня лобзанием уст своих! Ибо ласки твои лучше вина.
ru,RUS_SYNODAL,Song,Song,21,Song.1,Song 1,0,Song.1.2,Song 1:2,1,От благовония мастей твоих имя твое – как разлитое миро; поэтому девицы любят тебя.
ru,RUS_SYNODAL,Song,Song,21,Song.1,Song 1,0,Song.1.3,Song 1:3,2,"Влеки меня, мы побежим за тобою; – царь ввел меня в чертоги свои, – будем восхищаться и радоваться тобою, превозносить ласки твои больше, нежели вино; достойно любят тебя!"
ru,RUS_SYNODAL,Song,Song,21,Song.1,Song 1,0,Song.1.4,Song 1:4,3,"Дщери Иерусалимские! черна я, но красива, как шатры Кидарские, как завесы Соломоновы."
ru,RUS_SYNODAL,Song,Song,21,Song.1,Song 1,0,Song.1.5,Song 1:5,4,"Не смотрите на меня, что я смугла, ибо солнце опалило меня: сыновья матери моей разгневались на меня, поставили меня стеречь виноградники, – моего собственного виноградника я не стерегла."
ru,RUS_SYNODAL,Song,Song,21,Song.1,Song 1,0,Song.1.6,Song 1:6,5,"Скажи мне, ты, которого любит душа моя: где пасешь ты? где отдыхаешь в полдень? к чему мне быть скиталицею возле стад товарищей твоих?"
ru,RUS_SYNODAL,Song,Song,21,Song.1,Song 1,0,Song.1.7,Song 1:7,6,"Если ты не знаешь этого, прекраснейшая из женщин, то иди себе по следам овец и паси козлят твоих подле шатров пастушеских."
ru,RUS_SYNODAL,Song,Song,21,Song.1,Song 1,0,Song.1.8,Song 1:8,7,"Кобылице моей в колеснице фараоновой я уподобил тебя, возлюбленная моя."
ru,RUS_SYNODAL,Song,Song,21,Song.1,Song 1,0,Song.1.9,Song 1:9,8,"Прекрасны ланиты твои под подвесками, шея твоя в ожерельях;"
ru,RUS_SYNODAL,Song,Song,21,Song.1,Song 1,0,Song.1.10,Song 1:10,9,золотые подвески мы сделаем тебе с серебряными блестками.
ru,RUS_SYNODAL,Song,Song,21,Song.1,Song 1,0,Song.1.11,Song 1:11,10,"Доколе царь был за столом своим, нард мой издавал благовоние свое."
ru,RUS_SYNODAL,Song,Song,21,Song.1,Song 1,0,Song.1.12,Song 1:12,11,"Мирровый пучок – возлюбленный мой у меня, у грудей моих пребывает."
ru,RUS_SYNODAL,Song,Song,21,Song.1,Song 1,0,Song.1.13,Song 1:13,12,"Как кисть кипера, возлюбленный мой у меня в виноградниках Енгедских."
ru,RUS_SYNODAL,Song,Song,21,Song.1,Song 1,0,Song.1.14,Song 1:14,13,"О, ты прекрасна, возлюбленная моя, ты прекрасна! глаза твои голубиные."
ru,RUS_SYNODAL,Song,Song,21,Song.1,Song 1,0,Song.1.15,Song 1:15,14,"О, ты прекрасен, возлюбленный мой, и любезен! и ложе у нас – зелень;"
ru,RUS_SYNODAL,Song,Song,21,Song.1,Song 1,0,Song.1.16,Song 1:16,15,"кровли домов наших – кедры,"
ru,RUS_SYNODAL,Song,Song,21,Song.1,Song 1,0,Song.1.17,Song 1:17,16,потолки наши – кипарисы.
ru,RUS_SYNODAL,Song,Song,21,Song.2,Song 2,1,Song.2.1,Song 2:1,0,"Я нарцисс Саронский, лилия долин!"
ru,RUS_SYNODAL,Song,Song,21,Song.2,Song 2,1,Song.2.2,Song 2:2,1,"Что лилия между тернами, то возлюбленная моя между девицами."
ru,RUS_SYNODAL,Song,Song,21,Song.2,Song 2,1,Song.2.3,Song 2:3,2,"Что яблоня между лесными деревьями, то возлюбленный мой между юношами. В тени ее люблю я сидеть, и плоды ее сладки для гортани моей."
ru,RUS_SYNODAL,Song,Song,21,Song.2,Song 2,1,Song.2.4,Song 2:4,3,"Он ввел меня в дом пира, и знамя его надо мною – любовь."
ru,RUS_SYNODAL,Song,Song,21,Song.2,Song 2,1,Song.2.5,Song 2:5,4,"Подкрепите меня вином, освежите меня яблоками, ибо я изнемогаю от любви."
ru,RUS_SYNODAL,Song,Song,21,Song.2,Song 2,1,Song.2.6,Song 2:6,5,"Левая рука его у меня под головою, а правая обнимает меня."
ru,RUS_SYNODAL,Song,Song,21,Song.2,Song 2,1,Song.2.7,Song 2:7,6,"Заклинаю вас, дщери Иерусалимские, сернами или полевыми ланями: не будите и не тревожьте возлюбленной, доколе ей угодно."
ru,RUS_SYNODAL,Song,Song,21,Song.2,Song 2,1,Song.2.8,Song 2:8,7,"Голос возлюбленного моего! вот, он идет, скачет по горам, прыгает по холмам."
ru,RUS_SYNODAL,Song,Song,21,Song.2,Song 2,1,Song.2.9,Song 2:9,8,"Друг мой похож на серну или на молодого оленя. Вот, он стоит у нас за стеною, заглядывает в окно, мелькает сквозь решетку."
ru,RUS_SYNODAL,Song,Song,21,Song.2,Song 2,1,Song.2.10,Song 2:10,9,"Возлюбленный мой начал говорить мне: встань, возлюбленная моя, прекрасная моя, выйди!"
ru,RUS_SYNODAL,Song,Song,21,Song.2,Song 2,1,Song.2.11,Song 2:11,10,"Вот, зима уже прошла; дождь миновал, перестал;"
ru,RUS_SYNODAL,Song,Song,21,Song.2,Song 2,1,Song.2.12,Song 2:12,11,"цветы показались на земле; время пения настало, и голос горлицы слышен в стране нашей;"
ru,RUS_SYNODAL,Song,Song,21,Song.2,Song 2,1,Song.2.13,Song 2:13,12,"смоковницы распустили свои почки, и виноградные лозы, расцветая, издают благовоние. Встань, возлюбленная моя, прекрасная моя, выйди!"
ru,RUS_SYNODAL,Song,Song,21,Song.2,Song 2,1,Song.2.14,Song 2:14,13,"Голубица моя в ущелье скалы под кровом утеса! покажи мне лице твое, дай мне услышать голос твой, потому что голос твой сладок и лице твое приятно."
ru,RUS_SYNODAL,Song,Song,21,Song.2,Song 2,1,Song.2.15,Song 2:15,14,"Ловите нам лисиц, лисенят, которые портят виноградники, а виноградники наши в цвете."
ru,RUS_SYNODAL,Song,Song,21,Song.2,Song 2,1,Song.2.16,Song 2:16,15,"Возлюбленный мой принадлежит мне, а я ему; он пасет между лилиями."
ru,RUS_SYNODAL,Song,Song,21,Song.2,Song 2,1,Song.2.17,Song 2:17,16,"Доколе день дышит [прохладою], и убегают тени, возвратись, будь подобен серне или молодому оленю на расселинах гор."
ru,RUS_SYNODAL,Song,Song,21,Song.3,Song 3,2,Song.3.1,Song 3:1,0,"На ложе моем ночью искала я того, которого любит душа моя, искала его и не нашла его."
ru,RUS_SYNODAL,Song,Song,21,Song.3,Song 3,2,Song.3.2,Song 3:2,1,"Встану же я, пойду по городу, по улицам и площадям, и буду искать того, которого любит душа моя; искала я его и не нашла его."
ru,RUS_SYNODAL,Song,Song,21,Song.3,Song 3,2,Song.3.3,Song 3:3,2,"Встретили меня стражи, обходящие город: ""не видали ли вы того, которого любит душа моя?"""
ru,RUS_SYNODAL,Song,Song,21,Song.3,Song 3,2,Song.3.4,Song 3:4,3,"Но едва я отошла от них, как нашла того, которого любит душа моя, ухватилась за него, и не отпустила его, доколе не привела его в дом матери моей и во внутренние комнаты родительницы моей."
ru,RUS_SYNODAL,Song,Song,21,Song.3,Song 3,2,Song.3.5,Song 3:5,4,"Заклинаю вас, дщери Иерусалимские, сернами или полевыми ланями: не будите и не тревожьте возлюбленной, доколе ей угодно."
ru,RUS_SYNODAL,Song,Song,21,Song.3,Song 3,2,Song.3.6,Song 3:6,5,"Кто эта, восходящая от пустыни как бы столбы дыма, окуриваемая миррою и фимиамом, всякими порошками мироварника?"
ru,RUS_SYNODAL,Song,Song,21,Song.3,Song 3,2,Song.3.7,Song 3:7,6,"Вот одр его – Соломона: шестьдесят сильных вокруг него, из сильных Израилевых."
ru,RUS_SYNODAL,Song,Song,21,Song.3,Song 3,2,Song.3.8,Song 3:8,7,"Все они держат по мечу, опытны в бою; у каждого меч при бедре его ради страха ночного."
ru,RUS_SYNODAL,Song,Song,21,Song.3,Song 3,2,Song.3.9,Song 3:9,8,Носильный одр сделал себе царь Соломон из дерев Ливанских;
ru,RUS_SYNODAL,Song,Song,21,Song.3,Song 3,2,Song.3.10,Song 3:10,9,"столпцы его сделал из серебра, локотники его из золота, седалище его из пурпуровой ткани; внутренность его убрана с любовью дщерями Иерусалимскими."
ru,RUS_SYNODAL,Song,Song,21,Song.3,Song 3,2,Song.3.11,Song 3:11,10,"Пойдите и посмотрите, дщери Сионские, на царя Соломона в венце, которым увенчала его мать его в день бракосочетания его, в день, радостный для сердца его."
ru,RUS_SYNODAL,Song,Song,21,Song.4,Song 4,3,Song.4.1,Song 4:1,0,"О, ты прекрасна, возлюбленная моя, ты прекрасна! глаза твои голубиные под кудрями твоими; волосы твои – как стадо коз, сходящих с горы Галаадской;"
ru,RUS_SYNODAL,Song,Song,21,Song.4,Song 4,3,Song.4.2,Song 4:2,1,"зубы твои – как стадо выстриженных овец, выходящих из купальни, из которых у каждой пара ягнят, и бесплодной нет между ними;"
ru,RUS_SYNODAL,Song,Song,21,Song.4,Song 4,3,Song.4.3,Song 4:3,2,"как лента алая губы твои, и уста твои любезны; как половинки гранатового яблока – ланиты твои под кудрями твоими;"
ru,RUS_SYNODAL,Song,Song,21,Song.4,Song 4,3,Song.4.4,Song 4:4,3,"шея твоя – как столп Давидов, сооруженный для оружий, тысяча щитов висит на нем – все щиты сильных;"
ru,RUS_SYNODAL,Song,Song,21,Song.4,Song 4,3,Song.4.5,Song 4:5,4,"два сосца твои – как двойни молодой серны, пасущиеся между лилиями."
ru,RUS_SYNODAL,Song,Song,21,Song.4,Song 4,3,Song.4.6,Song 4:6,5,"Доколе день дышит [прохладою], и убегают тени, пойду я на гору мирровую и на холм фимиама."
ru,RUS_SYNODAL,Song,Song,21,Song.4,Song 4,3,Song.4.7,Song 4:7,6,"Вся ты прекрасна, возлюбленная моя, и пятна нет на тебе!"
ru,RUS_SYNODAL,Song,Song,21,Song.4,Song 4,3,Song.4.8,Song 4:8,7,"Со мною с Ливана, невеста! со мною иди с Ливана! спеши с вершины Аманы, с вершины Сенира и Ермона, от логовищ львиных, от гор барсовых!"
ru,RUS_SYNODAL,Song,Song,21,Song.4,Song 4,3,Song.4.9,Song 4:9,8,"Пленила ты сердце мое, сестра моя, невеста! пленила ты сердце мое одним взглядом очей твоих, одним ожерельем на шее твоей."
ru,RUS_SYNODAL,Song,Song,21,Song.4,Song 4,3,Song.4.10,Song 4:10,9,"О, как любезны ласки твои, сестра моя, невеста! о, как много ласки твои лучше вина, и благовоние мастей твоих лучше всех ароматов!"
ru,RUS_SYNODAL,Song,Song,21,Song.4,Song 4,3,Song.4.11,Song 4:11,10,"Сотовый мед каплет из уст твоих, невеста; мед и молоко под языком твоим, и благоухание одежды твоей подобно благоуханию Ливана!"
ru,RUS_SYNODAL,Song,Song,21,Song.4,Song 4,3,Song.4.12,Song 4:12,11,"Запертый сад – сестра моя, невеста, заключенный колодезь, запечатанный источник:"
ru,RUS_SYNODAL,Song,Song,21,Song.4,Song 4,3,Song.4.13,Song 4:13,12,"рассадники твои – сад с гранатовыми яблоками, с превосходными плодами, киперы с нардами,"
ru,RUS_SYNODAL,Song,Song,21,Song.4,Song 4,3,Song.4.14,Song 4:14,13,"нард и шафран, аир и корица со всякими благовонными деревами, мирра и алой со всякими лучшими ароматами;"
ru,RUS_SYNODAL,Song,Song,21,Song.4,Song 4,3,Song.4.15,Song 4:15,14,садовый источник – колодезь живых вод и потоки с Ливана.
ru,RUS_SYNODAL,Song,Song,21,Song.4,Song 4,3,Song.4.16,Song 4:16,15,"Поднимись [ветер] с севера и принесись с юга, повей на сад мой, – и польются ароматы его! – Пусть придет возлюбленный мой в сад свой и вкушает сладкие плоды его."
ru,RUS_SYNODAL,Song,Song,21,Song.5,Song 5,4,Song.5.1,Song 5:1,0,"Пришел я в сад мой, сестра моя, невеста; набрал мирры моей с ароматами моими, поел сотов моих с медом моим, напился вина моего с молоком моим. Ешьте, друзья, пейте и насыщайтесь, возлюбленные!"
ru,RUS_SYNODAL,Song,Song,21,Song.5,Song 5,4,Song.5.2,Song 5:2,1,"Я сплю, а сердце мое бодрствует; [вот], голос моего возлюбленного, который стучится: ""отвори мне, сестра моя, возлюбленная моя, голубица моя, чистая моя! потому что голова моя вся покрыта росою, кудри мои – ночною влагою""."
ru,RUS_SYNODAL,Song,Song,21,Song.5,Song 5,4,Song.5.3,Song 5:3,2,Я скинула хитон мой; как же мне опять надевать его? Я вымыла ноги мои; как же мне марать их?
ru,RUS_SYNODAL,Song,Song,21,Song.5,Song 5,4,Song.5.4,Song 5:4,3,"Возлюбленный мой протянул руку свою сквозь скважину, и внутренность моя взволновалась от него."
ru,RUS_SYNODAL,Song,Song,21,Song.5,Song 5,4,Song.5.5,Song 5:5,4,"Я встала, чтобы отпереть возлюбленному моему, и с рук моих капала мирра, и с перстов моих мирра капала на ручки замка."
ru,RUS_SYNODAL,Song,Song,21,Song.5,Song 5,4,Song.5.6,Song 5:6,5,"Отперла я возлюбленному моему, а возлюбленный мой повернулся и ушел. Души во мне не стало, когда он говорил; я искала его и не находила его; звала его, и он не отзывался мне."
ru,RUS_SYNODAL,Song,Song,21,Song.5,Song 5,4,Song.5.7,Song 5:7,6,"Встретили меня стражи, обходящие город, избили меня, изранили меня; сняли с меня покрывало стерегущие стены."
ru,RUS_SYNODAL,Song,Song,21,Song.5,Song 5,4,Song.5.8,Song 5:8,7,"Заклинаю вас, дщери Иерусалимские: если вы встретите возлюбленного моего, что скажете вы ему? что я изнемогаю от любви."
ru,RUS_SYNODAL,Song,Song,21,Song.5,Song 5,4,Song.5.9,Song 5:9,8,"""Чем возлюбленный твой лучше других возлюбленных, прекраснейшая из женщин? Чем возлюбленный твой лучше других, что ты так заклинаешь нас?"""
ru,RUS_SYNODAL,Song,Song,21,Song.5,Song 5,4,Song.5.10,Song 5:10,9,"Возлюбленный мой бел и румян, лучше десяти тысяч других:"
ru,RUS_SYNODAL,Song,Song,21,Song.5,Song 5,4,Song.5.11,Song 5:11,10,"голова его – чистое золото; кудри его волнистые, черные, как ворон;"
ru,RUS_SYNODAL,Song,Song,21,Song.5,Song 5,4,Song.5.12,Song 5:12,11,"глаза его – как голуби при потоках вод, купающиеся в молоке, сидящие в довольстве;"
ru,RUS_SYNODAL,Song,Song,21,Song.5,Song 5,4,Song.5.13,Song 5:13,12,"щеки его – цветник ароматный, гряды благовонных растений; губы его – лилии, источают текучую мирру;"
ru,RUS_SYNODAL,Song,Song,21,Song.5,Song 5,4,Song.5.14,Song 5:14,13,"руки его – золотые кругляки, усаженные топазами; живот его – как изваяние из слоновой кости, обложенное сапфирами;"
ru,RUS_SYNODAL,Song,Song,21,Song.5,Song 5,4,Song.5.15,Song 5:15,14,"голени его – мраморные столбы, поставленные на золотых подножиях; вид его подобен Ливану, величествен, как кедры;"
ru,RUS_SYNODAL,Song,Song,21,Song.5,Song 5,4,Song.5.16,Song 5:16,15,"уста его – сладость, и весь он – любезность. Вот кто возлюбленный мой, и вот кто друг мой, дщери Иерусалимские!"
ru,RUS_SYNODAL,Song,Song,21,Song.6,Song 6,5,Song.6.1,Song 6:1,0,"""Куда пошел возлюбленный твой, прекраснейшая из женщин? куда обратился возлюбленный твой? мы поищем его с тобою""."
ru,RUS_SYNODAL,Song,Song,21,Song.6,Song 6,5,Song.6.2,Song 6:2,1,"Мой возлюбленный пошел в сад свой, в цветники ароматные, чтобы пасти в садах и собирать лилии."
ru,RUS_SYNODAL,Song,Song,21,Song.6,Song 6,5,Song.6.3,Song 6:3,2,"Я принадлежу возлюбленному моему, а возлюбленный мой – мне; он пасет между лилиями."
ru,RUS_SYNODAL,Song,Song,21,Song.6,Song 6,5,Song.6.4,Song 6:4,3,"Прекрасна ты, возлюбленная моя, как Фирца, любезна, как Иерусалим, грозна, как полки со знаменами."
ru,RUS_SYNODAL,Song,Song,21,Song.6,Song 6,5,Song.6.5,Song 6:5,4,"Уклони очи твои от меня, потому что они волнуют меня."
ru,RUS_SYNODAL,Song,Song,21,Song.6,Song 6,5,Song.6.6,Song 6:6,5,"Волосы твои – как стадо коз, сходящих с Галаада; зубы твои – как стадо овец, выходящих из купальни, из которых у каждой пара ягнят, и бесплодной нет между ними;"
ru,RUS_SYNODAL,Song,Song,21,Song.6,Song 6,5,Song.6.7,Song 6:7,6,как половинки гранатового яблока – ланиты твои под кудрями твоими.
ru,RUS_SYNODAL,Song,Song,21,Song.6,Song 6,5,Song.6.8,Song 6:8,7,"Есть шестьдесят цариц и восемьдесят наложниц и девиц без числа,"
ru,RUS_SYNODAL,Song,Song,21,Song.6,Song 6,5,Song.6.9,Song 6:9,8,"но единственная – она, голубица моя, чистая моя; единственная она у матери своей, отличенная у родительницы своей. Увидели ее девицы, и – превознесли ее, царицы и наложницы, и – восхвалили ее."
ru,RUS_SYNODAL,Song,Song,21,Song.6,Song 6,5,Song.6.10,Song 6:10,9,"Кто эта, блистающая, как заря, прекрасная, как луна, светлая, как солнце, грозная, как полки со знаменами?"
ru,RUS_SYNODAL,Song,Song,21,Song.6,Song 6,5,Song.6.11,Song 6:11,10,"Я сошла в ореховый сад посмотреть на зелень долины, поглядеть, распустилась ли виноградная лоза, расцвели ли гранатовые яблоки?"
ru,RUS_SYNODAL,Song,Song,21,Song.6,Song 6,5,Song.6.12,Song 6:12,11,"Не знаю, как душа моя влекла меня к колесницам знатных народа моего."
ru,RUS_SYNODAL,Song,Song,21,Song.7,Song 7,6,Song.7.1,Song 7:1,0,"""Оглянись, оглянись, Суламита! оглянись, оглянись, – и мы посмотрим на тебя"". Что вам смотреть на Суламиту, как на хоровод Манаимский?"
ru,RUS_SYNODAL,Song,Song,21,Song.7,Song 7,6,Song.7.2,Song 7:2,1,"О, как прекрасны ноги твои в сандалиях, дщерь именитая! Округление бедр твоих, как ожерелье, дело рук искусного художника;"
ru,RUS_SYNODAL,Song,Song,21,Song.7,Song 7,6,Song.7.3,Song 7:3,2,"живот твой – круглая чаша, [в которой] не истощается ароматное вино; чрево твое – ворох пшеницы, обставленный лилиями;"
ru,RUS_SYNODAL,Song,Song,21,Song.7,Song 7,6,Song.7.4,Song 7:4,3,"два сосца твои – как два козленка, двойни серны;"
ru,RUS_SYNODAL,Song,Song,21,Song.7,Song 7,6,Song.7.5,Song 7:5,4,"шея твоя – как столп из слоновой кости; глаза твои – озерки Есевонские, что у ворот Батраббима; нос твой – башня Ливанская, обращенная к Дамаску;"
ru,RUS_SYNODAL,Song,Song,21,Song.7,Song 7,6,Song.7.6,Song 7:6,5,"голова твоя на тебе, как Кармил, и волосы на голове твоей, как пурпур; царь увлечен [твоими] кудрями."
ru,RUS_SYNODAL,Song,Song,21,Song.7,Song 7,6,Song.7.7,Song 7:7,6,"Как ты прекрасна, как привлекательна, возлюбленная, твоею миловидностью!"
ru,RUS_SYNODAL,Song,Song,21,Song.7,Song 7,6,Song.7.8,Song 7:8,7,"Этот стан твой похож на пальму, и груди твои на виноградные кисти."
ru,RUS_SYNODAL,Song,Song,21,Song.7,Song 7,6,Song.7.9,Song 7:9,8,"Подумал я: влез бы я на пальму, ухватился бы за ветви ее; и груди твои были бы вместо кистей винограда, и запах от ноздрей твоих, как от яблоков;"
ru,RUS_SYNODAL,Song,Song,21,Song.7,Song 7,6,Song.7.10,Song 7:10,9,"уста твои – как отличное вино. Оно течет прямо к другу моему, услаждает уста утомленных."
ru,RUS_SYNODAL,Song,Song,21,Song.7,Song 7,6,Song.7.11,Song 7:11,10,"Я принадлежу другу моему, и ко мне [обращено] желание его."
ru,RUS_SYNODAL,Song,Song,21,Song.7,Song 7,6,Song.7.12,Song 7:12,11,"Приди, возлюбленный мой, выйдем в поле, побудем в селах;"
ru,RUS_SYNODAL,Song,Song,21,Song.7,Song 7,6,Song.7.13,Song 7:13,12,"поутру пойдем в виноградники, посмотрим, распустилась ли виноградная лоза, раскрылись ли почки, расцвели ли гранатовые яблоки; там я окажу ласки мои тебе."
