languageCode,code,bookOsisId,bookSblId,bookOrderIndex,chapterOsisId,chapterSblId,chapterOrderIndex,verseOsisId,verseSblId,verseOrderIndex,text
ru,RUS_SYNODAL,Song,Song,21,Song.7,Song 7,6,Song.7.14,Song 7:14,13,"Мандрагоры уже пустили благовоние, и у дверей наших всякие превосходные плоды, новые и старые: [это] сберегла я для тебя, мой возлюбленный!"
ru,RUS_SYNODAL,Song,Song,21,Song.8,Song 8,7,Song.8.1,Song 8:1,0,"О, если бы ты был мне брат, сосавший груди матери моей! тогда я, встретив тебя на улице, целовала бы тебя, и меня не осуждали бы."
ru,RUS_SYNODAL,Song,Song,21,Song.8,Song 8,7,Song.8.2,Song 8:2,1,"Повела бы я тебя, привела бы тебя в дом матери моей. Ты учил бы меня, а я поила бы тебя ароматным вином, соком гранатовых яблоков моих."
ru,RUS_SYNODAL,Song,Song,21,Song.8,Song 8,7,Song.8.3,Song 8:3,2,"Левая рука его у меня под головою, а правая обнимает меня."
ru,RUS_SYNODAL,Song,Song,21,Song.8,Song 8,7,Song.8.4,Song 8:4,3,"Заклинаю вас, дщери Иерусалимские, – не будите и не тревожьте возлюбленной, доколе ей угодно."
ru,RUS_SYNODAL,Song,Song,21,Song.8,Song 8,7,Song.8.5,Song 8:5,4,"Кто это восходит от пустыни, опираясь на своего возлюбленного? Под яблоней разбудила я тебя: там родила тебя мать твоя, там родила тебя родительница твоя."
ru,RUS_SYNODAL,Song,Song,21,Song.8,Song 8,7,Song.8.6,Song 8:6,5,"Положи меня, как печать, на сердце твое, как перстень, на руку твою: ибо крепка, как смерть, любовь; люта, как преисподняя, ревность; стрелы ее – стрелы огненные; она пламень весьма сильный."
ru,RUS_SYNODAL,Song,Song,21,Song.8,Song 8,7,Song.8.7,Song 8:7,6,"Большие воды не могут потушить любви, и реки не зальют ее. Если бы кто давал все богатство дома своего за любовь, то он был бы отвергнут с презреньем."
ru,RUS_SYNODAL,Song,Song,21,Song.8,Song 8,7,Song.8.8,Song 8:8,7,"Есть у нас сестра, которая еще мала, и сосцов нет у нее; что нам будет делать с сестрою нашею, когда будут свататься за нее?"
ru,RUS_SYNODAL,Song,Song,21,Song.8,Song 8,7,Song.8.9,Song 8:9,8,"Если бы она была стена, то мы построили бы на ней палаты из серебра; если бы она была дверь, то мы обложили бы ее кедровыми досками."
ru,RUS_SYNODAL,Song,Song,21,Song.8,Song 8,7,Song.8.10,Song 8:10,9,"Я – стена, и сосцы у меня, как башни; потому я буду в глазах его, как достигшая полноты."
ru,RUS_SYNODAL,Song,Song,21,Song.8,Song 8,7,Song.8.11,Song 8:11,10,Виноградник был у Соломона в Ваал–Гамоне; он отдал этот виноградник сторожам; каждый должен был доставлять за плоды его тысячу сребренников.
ru,RUS_SYNODAL,Song,Song,21,Song.8,Song 8,7,Song.8.12,Song 8:12,11,"А мой виноградник у меня при себе. Тысяча пусть тебе, Соломон, а двести – стерегущим плоды его."
ru,RUS_SYNODAL,Song,Song,21,Song.8,Song 8,7,Song.8.13,Song 8:13,12,"Жительница садов! товарищи внимают голосу твоему, дай и мне послушать его."
ru,RUS_SYNODAL,Song,Song,21,Song.8,Song 8,7,Song.8.14,Song 8:14,13,"Беги, возлюбленный мой; будь подобен серне или молодому оленю на горах бальзамических!"
