languageCode,code,bookOsisId,bookSblId,bookOrderIndex,chapterOsisId,chapterSblId,chapterOrderIndex,verseOsisId,verseSblId,verseOrderIndex,text
ru,RUS_SYNODAL,Hab,Hab,34,Hab.1,Hab 1,0,Hab.1.1,Hab 1:1,0,"Пророческое видение, которое видел пророк Аввакум."
ru,RUS_SYNODAL,Hab,Hab,34,Hab.1,Hab 1,0,Hab.1.2,Hab 1:2,1,"Доколе, Господи, я буду взывать, и Ты не слышишь, буду вопиять к Тебе о насилии, и Ты не спасаешь?"
ru,RUS_SYNODAL,Hab,Hab,34,Hab.1,Hab 1,0,Hab.1.3,Hab 1:3,2,"Для чего даешь мне видеть злодейство и смотреть на бедствия? Грабительство и насилие предо мною, и восстает вражда и поднимается раздор."
ru,RUS_SYNODAL,Hab,Hab,34,Hab.1,Hab 1,0,Hab.1.4,Hab 1:4,3,"От этого закон потерял силу, и суда правильного нет: так как нечестивый одолевает праведного, то и суд происходит превратный."
ru,RUS_SYNODAL,Hab,Hab,34,Hab.1,Hab 1,0,Hab.1.5,Hab 1:5,4,"Посмотрите между народами и внимательно вглядитесь, и вы сильно изумитесь; ибо Я сделаю во дни ваши такое дело, которому вы не поверили бы, если бы вам рассказывали."
ru,RUS_SYNODAL,Hab,Hab,34,Hab.1,Hab 1,0,Hab.1.6,Hab 1:6,5,"Ибо вот, Я подниму Халдеев, народ жестокий и необузданный, который ходит по широтам земли, чтобы завладеть не принадлежащими ему селениями."
ru,RUS_SYNODAL,Hab,Hab,34,Hab.1,Hab 1,0,Hab.1.7,Hab 1:7,6,Страшен и грозен он; от него самого происходит суд его и власть его.
ru,RUS_SYNODAL,Hab,Hab,34,Hab.1,Hab 1,0,Hab.1.8,Hab 1:8,7,"Быстрее барсов кони его и прытче вечерних волков; скачет в разные стороны конница его; издалека приходят всадники его, прилетают как орел, бросающийся на добычу."
ru,RUS_SYNODAL,Hab,Hab,34,Hab.1,Hab 1,0,Hab.1.9,Hab 1:9,8,"Весь он идет для грабежа; устремив лице свое вперед, он забирает пленников, как песок."
ru,RUS_SYNODAL,Hab,Hab,34,Hab.1,Hab 1,0,Hab.1.10,Hab 1:10,9,"И над царями он издевается, и князья служат ему посмешищем; над всякою крепостью он смеется: насыплет осадный вал и берет ее."
ru,RUS_SYNODAL,Hab,Hab,34,Hab.1,Hab 1,0,Hab.1.11,Hab 1:11,10,"Тогда надмевается дух его, и он ходит и буйствует; сила его – бог его."
ru,RUS_SYNODAL,Hab,Hab,34,Hab.1,Hab 1,0,Hab.1.12,Hab 1:12,11,"Но не Ты ли издревле Господь Бог мой, Святый мой? мы не умрем! Ты, Господи, только для суда попустил его. Скала моя! для наказания Ты назначил его."
ru,RUS_SYNODAL,Hab,Hab,34,Hab.1,Hab 1,0,Hab.1.13,Hab 1:13,12,"Чистым очам Твоим не свойственно глядеть на злодеяния, и смотреть на притеснение Ты не можешь; для чего же Ты смотришь на злодеев и безмолвствуешь, когда нечестивец поглощает того, кто праведнее его,"
ru,RUS_SYNODAL,Hab,Hab,34,Hab.1,Hab 1,0,Hab.1.14,Hab 1:14,13,"и оставляешь людей как рыбу в море, как пресмыкающихся, у которых нет властителя?"
ru,RUS_SYNODAL,Hab,Hab,34,Hab.1,Hab 1,0,Hab.1.15,Hab 1:15,14,"Всех их таскает удою, захватывает в сеть свою и забирает их в неводы свои, и от того радуется и торжествует."
ru,RUS_SYNODAL,Hab,Hab,34,Hab.1,Hab 1,0,Hab.1.16,Hab 1:16,15,"За то приносит жертвы сети своей и кадит неводу своему, потому что от них тучна часть его и роскошна пища его."
ru,RUS_SYNODAL,Hab,Hab,34,Hab.1,Hab 1,0,Hab.1.17,Hab 1:17,16,Неужели для этого он должен опорожнять свою сеть и непрестанно избивать народы без пощады?
ru,RUS_SYNODAL,Hab,Hab,34,Hab.2,Hab 2,1,Hab.2.1,Hab 2:1,0,"На стражу мою стал я и, стоя на башне, наблюдал, чтобы узнать, что скажет Он во мне, и что мне отвечать по жалобе моей?"
ru,RUS_SYNODAL,Hab,Hab,34,Hab.2,Hab 2,1,Hab.2.2,Hab 2:2,1,"И отвечал мне Господь и сказал: запиши видение и начертай ясно на скрижалях, чтобы читающий легко мог прочитать,"
ru,RUS_SYNODAL,Hab,Hab,34,Hab.2,Hab 2,1,Hab.2.3,Hab 2:3,2,"ибо видение относится еще к определенному времени и говорит о конце и не обманет; и хотя бы и замедлило, жди его, ибо непременно сбудется, не отменится."
ru,RUS_SYNODAL,Hab,Hab,34,Hab.2,Hab 2,1,Hab.2.4,Hab 2:4,3,"Вот, душа надменная не успокоится, а праведный своею верою жив будет."
ru,RUS_SYNODAL,Hab,Hab,34,Hab.2,Hab 2,1,Hab.2.5,Hab 2:5,4,"Надменный человек, как бродящее вино, не успокаивается, так что расширяет душу свою как ад, и как смерть он ненасытен, и собирает к себе все народы, и захватывает себе все племена."
ru,RUS_SYNODAL,Hab,Hab,34,Hab.2,Hab 2,1,Hab.2.6,Hab 2:6,5,"Но не все ли они будут произносить о нем притчу и насмешливую песнь: ""горе тому, кто без меры обогащает себя не своим, – на долго ли? – и обременяет себя залогами!"""
ru,RUS_SYNODAL,Hab,Hab,34,Hab.2,Hab 2,1,Hab.2.7,Hab 2:7,6,"Не восстанут ли внезапно те, которые будут терзать тебя, и не поднимутся ли против тебя грабители, и ты достанешься им на расхищение?"
ru,RUS_SYNODAL,Hab,Hab,34,Hab.2,Hab 2,1,Hab.2.8,Hab 2:8,7,"Так как ты ограбил многие народы, то и тебя ограбят все остальные народы за пролитие крови человеческой, за разорение страны, города и всех живущих в нем."
ru,RUS_SYNODAL,Hab,Hab,34,Hab.2,Hab 2,1,Hab.2.9,Hab 2:9,8,"Горе тому, кто жаждет неправедных приобретений для дома своего, чтобы устроить гнездо свое на высоте и тем обезопасить себя от руки несчастья!"
ru,RUS_SYNODAL,Hab,Hab,34,Hab.2,Hab 2,1,Hab.2.10,Hab 2:10,9,"Бесславие измыслил ты для твоего дома, истребляя многие народы, и согрешил против души твоей."
ru,RUS_SYNODAL,Hab,Hab,34,Hab.2,Hab 2,1,Hab.2.11,Hab 2:11,10,Камни из стен возопиют и перекладины из дерева будут отвечать им:
ru,RUS_SYNODAL,Hab,Hab,34,Hab.2,Hab 2,1,Hab.2.12,Hab 2:12,11,"""горе строящему город на крови и созидающему крепости неправдою!"""
ru,RUS_SYNODAL,Hab,Hab,34,Hab.2,Hab 2,1,Hab.2.13,Hab 2:13,12,"Вот, не от Господа ли Саваофа это, что народы трудятся для огня и племена мучат себя напрасно?"
ru,RUS_SYNODAL,Hab,Hab,34,Hab.2,Hab 2,1,Hab.2.14,Hab 2:14,13,"Ибо земля наполнится познанием славы Господа, как воды наполняют море."
ru,RUS_SYNODAL,Hab,Hab,34,Hab.2,Hab 2,1,Hab.2.15,Hab 2:15,14,"Горе тебе, который подаешь ближнему твоему питье с примесью злобы твоей и делаешь его пьяным, чтобы видеть срамоту его!"
ru,RUS_SYNODAL,Hab,Hab,34,Hab.2,Hab 2,1,Hab.2.16,Hab 2:16,15,"Ты пресытился стыдом вместо славы; пей же и ты и показывай срамоту, – обратится и к тебе чаша десницы Господней и посрамление на славу твою."
ru,RUS_SYNODAL,Hab,Hab,34,Hab.2,Hab 2,1,Hab.2.17,Hab 2:17,16,"Ибо злодейство твое на Ливане обрушится на тебя за истребление устрашенных животных, за пролитие крови человеческой, за опустошение страны, города и всех живущих в нем."
ru,RUS_SYNODAL,Hab,Hab,34,Hab.2,Hab 2,1,Hab.2.18,Hab 2:18,17,"Что за польза от истукана, сделанного художником, этого литаго лжеучителя, хотя ваятель, делая немые кумиры, полагается на свое произведение?"
ru,RUS_SYNODAL,Hab,Hab,34,Hab.2,Hab 2,1,Hab.2.19,Hab 2:19,18,"Горе тому, кто говорит дереву: ""встань!"" и бессловесному камню: ""пробудись!"" Научит ли он чему–нибудь? Вот, он обложен золотом и серебром, но дыхания в нем нет."
ru,RUS_SYNODAL,Hab,Hab,34,Hab.2,Hab 2,1,Hab.2.20,Hab 2:20,19,А Господь – во святом храме Своем: да молчит вся земля пред лицем Его!
ru,RUS_SYNODAL,Hab,Hab,34,Hab.3,Hab 3,2,Hab.3.1,Hab 3:1,0,"Молитва Аввакума пророка, для пения."
ru,RUS_SYNODAL,Hab,Hab,34,Hab.3,Hab 3,2,Hab.3.2,Hab 3:2,1,"Господи! услышал я слух Твой и убоялся. Господи! соверши дело Твое среди лет, среди лет яви его; во гневе вспомни о милости."
ru,RUS_SYNODAL,Hab,Hab,34,Hab.3,Hab 3,2,Hab.3.3,Hab 3:3,2,"Бог от Фемана грядет и Святый – от горы Фаран. Покрыло небеса величие Его, и славою Его наполнилась земля."
ru,RUS_SYNODAL,Hab,Hab,34,Hab.3,Hab 3,2,Hab.3.4,Hab 3:4,3,"Блеск ее – как солнечный свет; от руки Его лучи, и здесь тайник Его силы!"
ru,RUS_SYNODAL,Hab,Hab,34,Hab.3,Hab 3,2,Hab.3.5,Hab 3:5,4,"Пред лицем Его идет язва, а по стопам Его – жгучий ветер."
ru,RUS_SYNODAL,Hab,Hab,34,Hab.3,Hab 3,2,Hab.3.6,Hab 3:6,5,"Он стал и поколебал землю; воззрел, и в трепет привел народы; вековые горы распались, первобытные холмы опали; пути Его вечные."
ru,RUS_SYNODAL,Hab,Hab,34,Hab.3,Hab 3,2,Hab.3.7,Hab 3:7,6,Грустными видел я шатры Ефиопские; сотряслись палатки земли Мадиамской.
ru,RUS_SYNODAL,Hab,Hab,34,Hab.3,Hab 3,2,Hab.3.8,Hab 3:8,7,"Разве на реки воспылал, Господи, гнев Твой? разве на реки – негодование Твое, или на море – ярость Твоя, что Ты восшел на коней Твоих, на колесницы Твои спасительные?"
ru,RUS_SYNODAL,Hab,Hab,34,Hab.3,Hab 3,2,Hab.3.9,Hab 3:9,8,"Ты обнажил лук Твой по клятвенному обетованию, данному коленам. Ты потоками рассек землю."
ru,RUS_SYNODAL,Hab,Hab,34,Hab.3,Hab 3,2,Hab.3.10,Hab 3:10,9,"Увидев Тебя, вострепетали горы, ринулись воды; бездна дала голос свой, высоко подняла руки свои;"
ru,RUS_SYNODAL,Hab,Hab,34,Hab.3,Hab 3,2,Hab.3.11,Hab 3:11,10,"солнце и луна остановились на месте своем пред светом летающих стрел Твоих, пред сиянием сверкающих копьев Твоих."
ru,RUS_SYNODAL,Hab,Hab,34,Hab.3,Hab 3,2,Hab.3.12,Hab 3:12,11,Во гневе шествуешь Ты по земле и в негодовании попираешь народы.
ru,RUS_SYNODAL,Hab,Hab,34,Hab.3,Hab 3,2,Hab.3.13,Hab 3:13,12,"Ты выступаешь для спасения народа Твоего, для спасения помазанного Твоего. Ты сокрушаешь главу нечестивого дома, обнажая его от основания до верха."
ru,RUS_SYNODAL,Hab,Hab,34,Hab.3,Hab 3,2,Hab.3.14,Hab 3:14,13,"Ты пронзаешь копьями его главу вождей его, когда они как вихрь ринулись разбить меня, в радости, как бы думая поглотить бедного скрытно."
ru,RUS_SYNODAL,Hab,Hab,34,Hab.3,Hab 3,2,Hab.3.15,Hab 3:15,14,"Ты с конями Твоими проложил путь по морю, через пучину великих вод."
ru,RUS_SYNODAL,Hab,Hab,34,Hab.3,Hab 3,2,Hab.3.16,Hab 3:16,15,"Я услышал, и вострепетала внутренность моя; при вести о сем задрожали губы мои, боль проникла в кости мои, и колеблется место подо мною; а я должен быть спокоен в день бедствия, когда придет на народ мой грабитель его."
ru,RUS_SYNODAL,Hab,Hab,34,Hab.3,Hab 3,2,Hab.3.17,Hab 3:17,16,"Хотя бы не расцвела смоковница и не было плода на виноградных лозах, и маслина изменила, и нива не дала пищи, хотя бы не стало овец в загоне и рогатого скота в стойлах, –"
ru,RUS_SYNODAL,Hab,Hab,34,Hab.3,Hab 3,2,Hab.3.18,Hab 3:18,17,но и тогда я буду радоваться о Господе и веселиться о Боге спасения моего.
ru,RUS_SYNODAL,Hab,Hab,34,Hab.3,Hab 3,2,Hab.3.19,Hab 3:19,18,Господь Бог – сила моя: Он сделает ноги мои как у оленя и на высоты мои возведет меня! (Начальнику хора).
