languageCode,code,bookOsisId,bookSblId,bookOrderIndex,chapterOsisId,chapterSblId,chapterOrderIndex,verseOsisId,verseSblId,verseOrderIndex,text
ru,RUS_SYNODAL,Matt,Matt,39,Matt.1,Matt 1,0,Matt.1.1,Matt 1:1,0,"Родословие Иисуса Христа, Сына Давидова, Сына Авраамова."
ru,RUS_SYNODAL,Matt,Matt,39,Matt.1,Matt 1,0,Matt.1.2,Matt 1:2,1,Авраам родил Исаака; Исаак родил Иакова; Иаков родил Иуду и братьев его;
ru,RUS_SYNODAL,Matt,Matt,39,Matt.1,Matt 1,0,Matt.1.3,Matt 1:3,2,Иуда родил Фареса и Зару от Фамари; Фарес родил Есрома; Есром родил Арама;
ru,RUS_SYNODAL,Matt,Matt,39,Matt.1,Matt 1,0,Matt.1.4,Matt 1:4,3,Арам родил Аминадава; Аминадав родил Наассона; Наассон родил Салмона;
ru,RUS_SYNODAL,Matt,Matt,39,Matt.1,Matt 1,0,Matt.1.5,Matt 1:5,4,Салмон родил Вооза от Рахавы; Вооз родил Овида от Руфи; Овид родил Иессея;
ru,RUS_SYNODAL,Matt,Matt,39,Matt.1,Matt 1,0,Matt.1.6,Matt 1:6,5,Иессей родил Давида царя; Давид царь родил Соломона от бывшей за Уриею;
ru,RUS_SYNODAL,Matt,Matt,39,Matt.1,Matt 1,0,Matt.1.7,Matt 1:7,6,Соломон родил Ровоама; Ровоам родил Авию; Авия родил Асу;
ru,RUS_SYNODAL,Matt,Matt,39,Matt.1,Matt 1,0,Matt.1.8,Matt 1:8,7,Аса родил Иосафата; Иосафат родил Иорама; Иорам родил Озию;
ru,RUS_SYNODAL,Matt,Matt,39,Matt.1,Matt 1,0,Matt.1.9,Matt 1:9,8,Озия родил Иоафама; Иоафам родил Ахаза; Ахаз родил Езекию;
ru,RUS_SYNODAL,Matt,Matt,39,Matt.1,Matt 1,0,Matt.1.10,Matt 1:10,9,Езекия родил Манассию; Манассия родил Амона; Амон родил Иосию;
ru,RUS_SYNODAL,Matt,Matt,39,Matt.1,Matt 1,0,Matt.1.11,Matt 1:11,10,"Иосия родил Иоакима; Иоаким родил Иехонию и братьев его, перед переселением в Вавилон."
ru,RUS_SYNODAL,Matt,Matt,39,Matt.1,Matt 1,0,Matt.1.12,Matt 1:12,11,"По переселении же в Вавилон, Иехония родил Салафииля; Салафииль родил Зоровавеля;"
ru,RUS_SYNODAL,Matt,Matt,39,Matt.1,Matt 1,0,Matt.1.13,Matt 1:13,12,Зоровавель родил Авиуда; Авиуд родил Елиакима; Елиаким родил Азора;
ru,RUS_SYNODAL,Matt,Matt,39,Matt.1,Matt 1,0,Matt.1.14,Matt 1:14,13,Азор родил Садока; Садок родил Ахима; Ахим родил Елиуда;
ru,RUS_SYNODAL,Matt,Matt,39,Matt.1,Matt 1,0,Matt.1.15,Matt 1:15,14,Елиуд родил Елеазара; Елеазар родил Матфана; Матфан родил Иакова;
ru,RUS_SYNODAL,Matt,Matt,39,Matt.1,Matt 1,0,Matt.1.16,Matt 1:16,15,"Иаков родил Иосифа, мужа Марии, от Которой родился Иисус, называемый Христос."
ru,RUS_SYNODAL,Matt,Matt,39,Matt.1,Matt 1,0,Matt.1.17,Matt 1:17,16,Итак всех родов от Авраама до Давида четырнадцать родов; и от Давида до переселения в Вавилон четырнадцать родов; и от переселения в Вавилон до Христа четырнадцать родов.
ru,RUS_SYNODAL,Matt,Matt,39,Matt.1,Matt 1,0,Matt.1.18,Matt 1:18,17,"Рождество Иисуса Христа было так: по обручении Матери Его Марии с Иосифом, прежде нежели сочетались они, оказалось, что Она имеет во чреве от Духа Святаго."
ru,RUS_SYNODAL,Matt,Matt,39,Matt.1,Matt 1,0,Matt.1.19,Matt 1:19,18,"Иосиф же муж Ее, будучи праведен и не желая огласить Ее, хотел тайно отпустить Ее."
ru,RUS_SYNODAL,Matt,Matt,39,Matt.1,Matt 1,0,Matt.1.20,Matt 1:20,19,"Но когда он помыслил это, – се, Ангел Господень явился ему во сне и сказал: Иосиф, сын Давидов! не бойся принять Марию, жену твою, ибо родившееся в Ней есть от Духа Святаго;"
ru,RUS_SYNODAL,Matt,Matt,39,Matt.1,Matt 1,0,Matt.1.21,Matt 1:21,20,"родит же Сына, и наречешь Ему имя Иисус, ибо Он спасет людей Своих от грехов их."
ru,RUS_SYNODAL,Matt,Matt,39,Matt.1,Matt 1,0,Matt.1.22,Matt 1:22,21,"А все сие произошло, да сбудется реченное Господом через пророка, который говорит:"
ru,RUS_SYNODAL,Matt,Matt,39,Matt.1,Matt 1,0,Matt.1.23,Matt 1:23,22,"се, Дева во чреве приимет и родит Сына, и нарекут имя Ему Еммануил, что значит: с нами Бог."
ru,RUS_SYNODAL,Matt,Matt,39,Matt.1,Matt 1,0,Matt.1.24,Matt 1:24,23,"Встав от сна, Иосиф поступил, как повелел ему Ангел Господень, и принял жену свою,"
ru,RUS_SYNODAL,Matt,Matt,39,Matt.1,Matt 1,0,Matt.1.25,Matt 1:25,24,"и не знал Ее. Как наконец Она родила Сына Своего первенца, и он нарек Ему имя: Иисус."
ru,RUS_SYNODAL,Matt,Matt,39,Matt.2,Matt 2,1,Matt.2.1,Matt 2:1,0,"Когда же Иисус родился в Вифлееме Иудейском во дни царя Ирода, пришли в Иерусалим волхвы с востока и говорят:"
ru,RUS_SYNODAL,Matt,Matt,39,Matt.2,Matt 2,1,Matt.2.2,Matt 2:2,1,где родившийся Царь Иудейский? ибо мы видели звезду Его на востоке и пришли поклониться Ему.
ru,RUS_SYNODAL,Matt,Matt,39,Matt.2,Matt 2,1,Matt.2.3,Matt 2:3,2,"Услышав это, Ирод царь встревожился, и весь Иерусалим с ним."
ru,RUS_SYNODAL,Matt,Matt,39,Matt.2,Matt 2,1,Matt.2.4,Matt 2:4,3,"И, собрав всех первосвященников и книжников народных, спрашивал у них: где должно родиться Христу?"
ru,RUS_SYNODAL,Matt,Matt,39,Matt.2,Matt 2,1,Matt.2.5,Matt 2:5,4,"Они же сказали ему: в Вифлееме Иудейском, ибо так написано через пророка:"
ru,RUS_SYNODAL,Matt,Matt,39,Matt.2,Matt 2,1,Matt.2.6,Matt 2:6,5,"и ты, Вифлеем, земля Иудина, ничем не меньше воеводств Иудиных, ибо из тебя произойдет Вождь, Который упасет народ Мой, Израиля."
ru,RUS_SYNODAL,Matt,Matt,39,Matt.2,Matt 2,1,Matt.2.7,Matt 2:7,6,"Тогда Ирод, тайно призвав волхвов, выведал от них время появления звезды"
ru,RUS_SYNODAL,Matt,Matt,39,Matt.2,Matt 2,1,Matt.2.8,Matt 2:8,7,"и, послав их в Вифлеем, сказал: пойдите, тщательно разведайте о Младенце и, когда найдете, известите меня, чтобы и мне пойти поклониться Ему."
ru,RUS_SYNODAL,Matt,Matt,39,Matt.2,Matt 2,1,Matt.2.9,Matt 2:9,8,"Они, выслушав царя, пошли. И се, звезда, которую видели они на востоке, шла перед ними, [как] наконец пришла и остановилась над [местом], где был Младенец."
ru,RUS_SYNODAL,Matt,Matt,39,Matt.2,Matt 2,1,Matt.2.10,Matt 2:10,9,"Увидев же звезду, они возрадовались радостью весьма великою,"
ru,RUS_SYNODAL,Matt,Matt,39,Matt.2,Matt 2,1,Matt.2.11,Matt 2:11,10,"и, войдя в дом, увидели Младенца с Мариею, Матерью Его, и, пав, поклонились Ему; и, открыв сокровища свои, принесли Ему дары: золото, ладан и смирну."
ru,RUS_SYNODAL,Matt,Matt,39,Matt.2,Matt 2,1,Matt.2.12,Matt 2:12,11,"И, получив во сне откровение не возвращаться к Ироду, иным путем отошли в страну свою."
ru,RUS_SYNODAL,Matt,Matt,39,Matt.2,Matt 2,1,Matt.2.13,Matt 2:13,12,"Когда же они отошли, – се, Ангел Господень является во сне Иосифу и говорит: встань, возьми Младенца и Матерь Его и беги в Египет, и будь там, доколе не скажу тебе, ибо Ирод хочет искать Младенца, чтобы погубить Его."
ru,RUS_SYNODAL,Matt,Matt,39,Matt.2,Matt 2,1,Matt.2.14,Matt 2:14,13,"Он встал, взял Младенца и Матерь Его ночью и пошел в Египет,"
ru,RUS_SYNODAL,Matt,Matt,39,Matt.2,Matt 2,1,Matt.2.15,Matt 2:15,14,"и там был до смерти Ирода, да сбудется реченное Господом через пророка, который говорит: из Египта воззвал Я Сына Моего."
ru,RUS_SYNODAL,Matt,Matt,39,Matt.2,Matt 2,1,Matt.2.16,Matt 2:16,15,"Тогда Ирод, увидев себя осмеянным волхвами, весьма разгневался, и послал избить всех младенцев в Вифлееме и во всех пределах его, от двух лет и ниже, по времени, которое выведал от волхвов."
ru,RUS_SYNODAL,Matt,Matt,39,Matt.2,Matt 2,1,Matt.2.17,Matt 2:17,16,"Тогда сбылось реченное через пророка Иеремию, который говорит:"
ru,RUS_SYNODAL,Matt,Matt,39,Matt.2,Matt 2,1,Matt.2.18,Matt 2:18,17,"глас в Раме слышен, плач и рыдание и вопль великий; Рахиль плачет о детях своих и не хочет утешиться, ибо их нет."
ru,RUS_SYNODAL,Matt,Matt,39,Matt.2,Matt 2,1,Matt.2.19,Matt 2:19,18,"По смерти же Ирода, – се, Ангел Господень во сне является Иосифу в Египте"
ru,RUS_SYNODAL,Matt,Matt,39,Matt.2,Matt 2,1,Matt.2.20,Matt 2:20,19,"и говорит: встань, возьми Младенца и Матерь Его и иди в землю Израилеву, ибо умерли искавшие души Младенца."
ru,RUS_SYNODAL,Matt,Matt,39,Matt.2,Matt 2,1,Matt.2.21,Matt 2:21,20,"Он встал, взял Младенца и Матерь Его и пришел в землю Израилеву."
ru,RUS_SYNODAL,Matt,Matt,39,Matt.2,Matt 2,1,Matt.2.22,Matt 2:22,21,"Услышав же, что Архелай царствует в Иудее вместо Ирода, отца своего, убоялся туда идти; но, получив во сне откровение, пошел в пределы Галилейские"
ru,RUS_SYNODAL,Matt,Matt,39,Matt.2,Matt 2,1,Matt.2.23,Matt 2:23,22,"и, придя, поселился в городе, называемом Назарет, да сбудется реченное через пророков, что Он Назореем наречется."
ru,RUS_SYNODAL,Matt,Matt,39,Matt.3,Matt 3,2,Matt.3.1,Matt 3:1,0,В те дни приходит Иоанн Креститель и проповедует в пустыне Иудейской
ru,RUS_SYNODAL,Matt,Matt,39,Matt.3,Matt 3,2,Matt.3.2,Matt 3:2,1,"и говорит: покайтесь, ибо приблизилось Царство Небесное."
ru,RUS_SYNODAL,Matt,Matt,39,Matt.3,Matt 3,2,Matt.3.3,Matt 3:3,2,"Ибо он тот, о котором сказал пророк Исаия: глас вопиющего в пустыне: приготовьте путь Господу, прямыми сделайте стези Ему."
ru,RUS_SYNODAL,Matt,Matt,39,Matt.3,Matt 3,2,Matt.3.4,Matt 3:4,3,"Сам же Иоанн имел одежду из верблюжьего волоса и пояс кожаный на чреслах своих, а пищею его были акриды и дикий мед."
ru,RUS_SYNODAL,Matt,Matt,39,Matt.3,Matt 3,2,Matt.3.5,Matt 3:5,4,Тогда Иерусалим и вся Иудея и вся окрестность Иорданская выходили к нему
ru,RUS_SYNODAL,Matt,Matt,39,Matt.3,Matt 3,2,Matt.3.6,Matt 3:6,5,"и крестились от него в Иордане, исповедуя грехи свои."
ru,RUS_SYNODAL,Matt,Matt,39,Matt.3,Matt 3,2,Matt.3.7,Matt 3:7,6,"Увидев же Иоанн многих фарисеев и саддукеев, идущих к нему креститься, сказал им: порождения ехиднины! кто внушил вам бежать от будущего гнева?"
ru,RUS_SYNODAL,Matt,Matt,39,Matt.3,Matt 3,2,Matt.3.8,Matt 3:8,7,сотворите же достойный плод покаяния
ru,RUS_SYNODAL,Matt,Matt,39,Matt.3,Matt 3,2,Matt.3.9,Matt 3:9,8,"и не думайте говорить в себе: ""отец у нас Авраам"", ибо говорю вам, что Бог может из камней сих воздвигнуть детей Аврааму."
ru,RUS_SYNODAL,Matt,Matt,39,Matt.3,Matt 3,2,Matt.3.10,Matt 3:10,9,"Уже и секира при корне дерев лежит: всякое дерево, не приносящее доброго плода, срубают и бросают в огонь."
ru,RUS_SYNODAL,Matt,Matt,39,Matt.3,Matt 3,2,Matt.3.11,Matt 3:11,10,"Я крещу вас в воде в покаяние, но Идущий за мною сильнее меня; я не достоин понести обувь Его; Он будет крестить вас Духом Святым и огнем;"
ru,RUS_SYNODAL,Matt,Matt,39,Matt.3,Matt 3,2,Matt.3.12,Matt 3:12,11,"лопата Его в руке Его, и Он очистит гумно Свое и соберет пшеницу Свою в житницу, а солому сожжет огнем неугасимым."
ru,RUS_SYNODAL,Matt,Matt,39,Matt.3,Matt 3,2,Matt.3.13,Matt 3:13,12,Тогда приходит Иисус из Галилеи на Иордан к Иоанну креститься от него.
ru,RUS_SYNODAL,Matt,Matt,39,Matt.3,Matt 3,2,Matt.3.14,Matt 3:14,13,"Иоанн же удерживал Его и говорил: мне надобно креститься от Тебя, и Ты ли приходишь ко мне?"
ru,RUS_SYNODAL,Matt,Matt,39,Matt.3,Matt 3,2,Matt.3.15,Matt 3:15,14,"Но Иисус сказал ему в ответ: оставь теперь, ибо так надлежит нам исполнить всякую правду. Тогда [Иоанн] допускает Его."
ru,RUS_SYNODAL,Matt,Matt,39,Matt.3,Matt 3,2,Matt.3.16,Matt 3:16,15,"И, крестившись, Иисус тотчас вышел из воды, – и се, отверзлись Ему небеса, и увидел [Иоанн] Духа Божия, Который сходил, как голубь, и ниспускался на Него."
ru,RUS_SYNODAL,Matt,Matt,39,Matt.3,Matt 3,2,Matt.3.17,Matt 3:17,16,"И се, глас с небес глаголющий: Сей есть Сын Мой возлюбленный, в Котором Мое благоволение."
ru,RUS_SYNODAL,Matt,Matt,39,Matt.4,Matt 4,3,Matt.4.1,Matt 4:1,0,"Тогда Иисус возведен был Духом в пустыню, для искушения от диавола,"
ru,RUS_SYNODAL,Matt,Matt,39,Matt.4,Matt 4,3,Matt.4.2,Matt 4:2,1,"и, постившись сорок дней и сорок ночей, напоследок взалкал."
ru,RUS_SYNODAL,Matt,Matt,39,Matt.4,Matt 4,3,Matt.4.3,Matt 4:3,2,"И приступил к Нему искуситель и сказал: если Ты Сын Божий, скажи, чтобы камни сии сделались хлебами."
ru,RUS_SYNODAL,Matt,Matt,39,Matt.4,Matt 4,3,Matt.4.4,Matt 4:4,3,"Он же сказал ему в ответ: написано: не хлебом одним будет жить человек, но всяким словом, исходящим из уст Божиих."
ru,RUS_SYNODAL,Matt,Matt,39,Matt.4,Matt 4,3,Matt.4.5,Matt 4:5,4,"Потом берет Его диавол в святой город и поставляет Его на крыле храма,"
ru,RUS_SYNODAL,Matt,Matt,39,Matt.4,Matt 4,3,Matt.4.6,Matt 4:6,5,"и говорит Ему: если Ты Сын Божий, бросься вниз, ибо написано: Ангелам Своим заповедает о Тебе, и на руках понесут Тебя, да не преткнешься о камень ногою Твоею."
ru,RUS_SYNODAL,Matt,Matt,39,Matt.4,Matt 4,3,Matt.4.7,Matt 4:7,6,Иисус сказал ему: написано также: не искушай Господа Бога твоего.
ru,RUS_SYNODAL,Matt,Matt,39,Matt.4,Matt 4,3,Matt.4.8,Matt 4:8,7,"Опять берет Его диавол на весьма высокую гору и показывает Ему все царства мира и славу их,"
ru,RUS_SYNODAL,Matt,Matt,39,Matt.4,Matt 4,3,Matt.4.9,Matt 4:9,8,"и говорит Ему: все это дам Тебе, если, пав, поклонишься мне."
ru,RUS_SYNODAL,Matt,Matt,39,Matt.4,Matt 4,3,Matt.4.10,Matt 4:10,9,"Тогда Иисус говорит ему: отойди от Меня, сатана, ибо написано: Господу Богу твоему поклоняйся и Ему одному служи."
ru,RUS_SYNODAL,Matt,Matt,39,Matt.4,Matt 4,3,Matt.4.11,Matt 4:11,10,"Тогда оставляет Его диавол, и се, Ангелы приступили и служили Ему."
ru,RUS_SYNODAL,Matt,Matt,39,Matt.4,Matt 4,3,Matt.4.12,Matt 4:12,11,"Услышав же Иисус, что Иоанн отдан [под стражу], удалился в Галилею"
ru,RUS_SYNODAL,Matt,Matt,39,Matt.4,Matt 4,3,Matt.4.13,Matt 4:13,12,"и, оставив Назарет, пришел и поселился в Капернауме приморском, в пределах Завулоновых и Неффалимовых,"
ru,RUS_SYNODAL,Matt,Matt,39,Matt.4,Matt 4,3,Matt.4.14,Matt 4:14,13,"да сбудется реченное через пророка Исаию, который говорит:"
ru,RUS_SYNODAL,Matt,Matt,39,Matt.4,Matt 4,3,Matt.4.15,Matt 4:15,14,"земля Завулонова и земля Неффалимова, на пути приморском, за Иорданом, Галилея языческая,"
ru,RUS_SYNODAL,Matt,Matt,39,Matt.4,Matt 4,3,Matt.4.16,Matt 4:16,15,"народ, сидящий во тьме, увидел свет великий, и сидящим в стране и тени смертной воссиял свет."
ru,RUS_SYNODAL,Matt,Matt,39,Matt.4,Matt 4,3,Matt.4.17,Matt 4:17,16,"С того времени Иисус начал проповедывать и говорить: покайтесь, ибо приблизилось Царство Небесное."
ru,RUS_SYNODAL,Matt,Matt,39,Matt.4,Matt 4,3,Matt.4.18,Matt 4:18,17,"Проходя же близ моря Галилейского, Он увидел двух братьев: Симона, называемого Петром, и Андрея, брата его, закидывающих сети в море, ибо они были рыболовы,"
ru,RUS_SYNODAL,Matt,Matt,39,Matt.4,Matt 4,3,Matt.4.19,Matt 4:19,18,"и говорит им: идите за Мною, и Я сделаю вас ловцами человеков."
ru,RUS_SYNODAL,Matt,Matt,39,Matt.4,Matt 4,3,Matt.4.20,Matt 4:20,19,"И они тотчас, оставив сети, последовали за Ним."
ru,RUS_SYNODAL,Matt,Matt,39,Matt.4,Matt 4,3,Matt.4.21,Matt 4:21,20,"Оттуда, идя далее, увидел Он других двух братьев, Иакова Зеведеева и Иоанна, брата его, в лодке с Зеведеем, отцом их, починивающих сети свои, и призвал их."
ru,RUS_SYNODAL,Matt,Matt,39,Matt.4,Matt 4,3,Matt.4.22,Matt 4:22,21,"И они тотчас, оставив лодку и отца своего, последовали за Ним."
ru,RUS_SYNODAL,Matt,Matt,39,Matt.4,Matt 4,3,Matt.4.23,Matt 4:23,22,"И ходил Иисус по всей Галилее, уча в синагогах их и проповедуя Евангелие Царствия, и исцеляя всякую болезнь и всякую немощь в людях."
ru,RUS_SYNODAL,Matt,Matt,39,Matt.4,Matt 4,3,Matt.4.24,Matt 4:24,23,"И прошел о Нем слух по всей Сирии; и приводили к Нему всех немощных, одержимых различными болезнями и припадками, и бесноватых, и лунатиков, и расслабленных, и Он исцелял их."
ru,RUS_SYNODAL,Matt,Matt,39,Matt.4,Matt 4,3,Matt.4.25,Matt 4:25,24,"И следовало за Ним множество народа из Галилеи и Десятиградия, и Иерусалима, и Иудеи, и из–за Иордана."
ru,RUS_SYNODAL,Matt,Matt,39,Matt.5,Matt 5,4,Matt.5.1,Matt 5:1,0,"Увидев народ, Он взошел на гору; и, когда сел, приступили к Нему ученики Его."
ru,RUS_SYNODAL,Matt,Matt,39,Matt.5,Matt 5,4,Matt.5.2,Matt 5:2,1,"И Он, отверзши уста Свои, учил их, говоря:"
ru,RUS_SYNODAL,Matt,Matt,39,Matt.5,Matt 5,4,Matt.5.3,Matt 5:3,2,"Блаженны нищие духом, ибо их есть Царство Небесное."
ru,RUS_SYNODAL,Matt,Matt,39,Matt.5,Matt 5,4,Matt.5.4,Matt 5:4,3,"Блаженны плачущие, ибо они утешатся."
ru,RUS_SYNODAL,Matt,Matt,39,Matt.5,Matt 5,4,Matt.5.5,Matt 5:5,4,"Блаженны кроткие, ибо они наследуют землю."
ru,RUS_SYNODAL,Matt,Matt,39,Matt.5,Matt 5,4,Matt.5.6,Matt 5:6,5,"Блаженны алчущие и жаждущие правды, ибо они насытятся."
ru,RUS_SYNODAL,Matt,Matt,39,Matt.5,Matt 5,4,Matt.5.7,Matt 5:7,6,"Блаженны милостивые, ибо они помилованы будут."
ru,RUS_SYNODAL,Matt,Matt,39,Matt.5,Matt 5,4,Matt.5.8,Matt 5:8,7,"Блаженны чистые сердцем, ибо они Бога узрят."
ru,RUS_SYNODAL,Matt,Matt,39,Matt.5,Matt 5,4,Matt.5.9,Matt 5:9,8,"Блаженны миротворцы, ибо они будут наречены сынами Божиими."
ru,RUS_SYNODAL,Matt,Matt,39,Matt.5,Matt 5,4,Matt.5.10,Matt 5:10,9,"Блаженны изгнанные за правду, ибо их есть Царство Небесное."
ru,RUS_SYNODAL,Matt,Matt,39,Matt.5,Matt 5,4,Matt.5.11,Matt 5:11,10,"Блаженны вы, когда будут поносить вас и гнать и всячески неправедно злословить за Меня."
ru,RUS_SYNODAL,Matt,Matt,39,Matt.5,Matt 5,4,Matt.5.12,Matt 5:12,11,"Радуйтесь и веселитесь, ибо велика ваша награда на небесах: так гнали [и] пророков, бывших прежде вас."
ru,RUS_SYNODAL,Matt,Matt,39,Matt.5,Matt 5,4,Matt.5.13,Matt 5:13,12,"Вы – соль земли. Если же соль потеряет силу, то чем сделаешь ее соленою? Она уже ни к чему негодна, как разве выбросить ее вон на попрание людям."
ru,RUS_SYNODAL,Matt,Matt,39,Matt.5,Matt 5,4,Matt.5.14,Matt 5:14,13,"Вы – свет мира. Не может укрыться город, стоящий на верху горы."
ru,RUS_SYNODAL,Matt,Matt,39,Matt.5,Matt 5,4,Matt.5.15,Matt 5:15,14,"И, зажегши свечу, не ставят ее под сосудом, но на подсвечнике, и светит всем в доме."
ru,RUS_SYNODAL,Matt,Matt,39,Matt.5,Matt 5,4,Matt.5.16,Matt 5:16,15,"Так да светит свет ваш пред людьми, чтобы они видели ваши добрые дела и прославляли Отца вашего Небесного."
ru,RUS_SYNODAL,Matt,Matt,39,Matt.5,Matt 5,4,Matt.5.17,Matt 5:17,16,"Не думайте, что Я пришел нарушить закон или пророков: не нарушить пришел Я, но исполнить."
ru,RUS_SYNODAL,Matt,Matt,39,Matt.5,Matt 5,4,Matt.5.18,Matt 5:18,17,"Ибо истинно говорю вам: доколе не прейдет небо и земля, ни одна иота или ни одна черта не прейдет из закона, пока не исполнится все."
ru,RUS_SYNODAL,Matt,Matt,39,Matt.5,Matt 5,4,Matt.5.19,Matt 5:19,18,"Итак, кто нарушит одну из заповедей сих малейших и научит так людей, тот малейшим наречется в Царстве Небесном; а кто сотворит и научит, тот великим наречется в Царстве Небесном."
