languageCode,code,bookOsisId,bookSblId,bookOrderIndex,chapterOsisId,chapterSblId,chapterOrderIndex,verseOsisId,verseSblId,verseOrderIndex,text
ru,RUS_SYNODAL,Matt,Matt,39,Matt.13,Matt 13,12,Matt.13.32,Matt 13:32,31,"которое, хотя меньше всех семян, но, когда вырастет, бывает больше всех злаков и становится деревом, так что прилетают птицы небесные и укрываются в ветвях его."
ru,RUS_SYNODAL,Matt,Matt,39,Matt.13,Matt 13,12,Matt.13.33,Matt 13:33,32,"Иную притчу сказал Он им: Царство Небесное подобно закваске, которую женщина, взяв, положила в три меры муки, доколе не вскисло все."
ru,RUS_SYNODAL,Matt,Matt,39,Matt.13,Matt 13,12,Matt.13.34,Matt 13:34,33,"Все сие Иисус говорил народу притчами, и без притчи не говорил им,"
ru,RUS_SYNODAL,Matt,Matt,39,Matt.13,Matt 13,12,Matt.13.35,Matt 13:35,34,"да сбудется реченное через пророка, который говорит: отверзу в притчах уста Мои; изреку сокровенное от создания мира."
ru,RUS_SYNODAL,Matt,Matt,39,Matt.13,Matt 13,12,Matt.13.36,Matt 13:36,35,"Тогда Иисус, отпустив народ, вошел в дом. И, приступив к Нему, ученики Его сказали: изъясни нам притчу о плевелах на поле."
ru,RUS_SYNODAL,Matt,Matt,39,Matt.13,Matt 13,12,Matt.13.37,Matt 13:37,36,Он же сказал им в ответ: сеющий доброе семя есть Сын Человеческий;
ru,RUS_SYNODAL,Matt,Matt,39,Matt.13,Matt 13,12,Matt.13.38,Matt 13:38,37,"поле есть мир; доброе семя, это сыны Царствия, а плевелы – сыны лукавого;"
ru,RUS_SYNODAL,Matt,Matt,39,Matt.13,Matt 13,12,Matt.13.39,Matt 13:39,38,"враг, посеявший их, есть диавол; жатва есть кончина века, а жнецы суть Ангелы."
ru,RUS_SYNODAL,Matt,Matt,39,Matt.13,Matt 13,12,Matt.13.40,Matt 13:40,39,"Посему как собирают плевелы и огнем сжигают, так будет при кончине века сего:"
ru,RUS_SYNODAL,Matt,Matt,39,Matt.13,Matt 13,12,Matt.13.41,Matt 13:41,40,"пошлет Сын Человеческий Ангелов Своих, и соберут из Царства Его все соблазны и делающих беззаконие,"
ru,RUS_SYNODAL,Matt,Matt,39,Matt.13,Matt 13,12,Matt.13.42,Matt 13:42,41,и ввергнут их в печь огненную; там будет плач и скрежет зубов;
ru,RUS_SYNODAL,Matt,Matt,39,Matt.13,Matt 13,12,Matt.13.43,Matt 13:43,42,"тогда праведники воссияют, как солнце, в Царстве Отца их. Кто имеет уши слышать, да слышит!"
ru,RUS_SYNODAL,Matt,Matt,39,Matt.13,Matt 13,12,Matt.13.44,Matt 13:44,43,"Еще подобно Царство Небесное сокровищу, скрытому на поле, которое, найдя, человек утаил, и от радости о нем идет и продает все, что имеет, и покупает поле то."
ru,RUS_SYNODAL,Matt,Matt,39,Matt.13,Matt 13,12,Matt.13.45,Matt 13:45,44,"Еще подобно Царство Небесное купцу, ищущему хороших жемчужин,"
ru,RUS_SYNODAL,Matt,Matt,39,Matt.13,Matt 13,12,Matt.13.46,Matt 13:46,45,"который, найдя одну драгоценную жемчужину, пошел и продал все, что имел, и купил ее."
ru,RUS_SYNODAL,Matt,Matt,39,Matt.13,Matt 13,12,Matt.13.47,Matt 13:47,46,"Еще подобно Царство Небесное неводу, закинутому в море и захватившему рыб всякого рода,"
ru,RUS_SYNODAL,Matt,Matt,39,Matt.13,Matt 13,12,Matt.13.48,Matt 13:48,47,"который, когда наполнился, вытащили на берег и, сев, хорошее собрали в сосуды, а худое выбросили вон."
ru,RUS_SYNODAL,Matt,Matt,39,Matt.13,Matt 13,12,Matt.13.49,Matt 13:49,48,"Так будет при кончине века: изыдут Ангелы, и отделят злых из среды праведных,"
ru,RUS_SYNODAL,Matt,Matt,39,Matt.13,Matt 13,12,Matt.13.50,Matt 13:50,49,и ввергнут их в печь огненную: там будет плач и скрежет зубов.
ru,RUS_SYNODAL,Matt,Matt,39,Matt.13,Matt 13,12,Matt.13.51,Matt 13:51,50,"И спросил их Иисус: поняли ли вы все это? Они говорят Ему: так, Господи!"
ru,RUS_SYNODAL,Matt,Matt,39,Matt.13,Matt 13,12,Matt.13.52,Matt 13:52,51,"Он же сказал им: поэтому всякий книжник, наученный Царству Небесному, подобен хозяину, который выносит из сокровищницы своей новое и старое."
ru,RUS_SYNODAL,Matt,Matt,39,Matt.13,Matt 13,12,Matt.13.53,Matt 13:53,52,"И, когда окончил Иисус притчи сии, пошел оттуда."
ru,RUS_SYNODAL,Matt,Matt,39,Matt.13,Matt 13,12,Matt.13.54,Matt 13:54,53,"И, придя в отечество Свое, учил их в синагоге их, так что они изумлялись и говорили: откуда у Него такая премудрость и силы?"
ru,RUS_SYNODAL,Matt,Matt,39,Matt.13,Matt 13,12,Matt.13.55,Matt 13:55,54,"не плотников ли Он сын? не Его ли Мать называется Мария, и братья Его Иаков и Иосий, и Симон, и Иуда?"
ru,RUS_SYNODAL,Matt,Matt,39,Matt.13,Matt 13,12,Matt.13.56,Matt 13:56,55,и сестры Его не все ли между нами? откуда же у Него все это?
ru,RUS_SYNODAL,Matt,Matt,39,Matt.13,Matt 13,12,Matt.13.57,Matt 13:57,56,"И соблазнялись о Нем. Иисус же сказал им: не бывает пророк без чести, разве только в отечестве своем и в доме своем."
ru,RUS_SYNODAL,Matt,Matt,39,Matt.13,Matt 13,12,Matt.13.58,Matt 13:58,57,И не совершил там многих чудес по неверию их.
ru,RUS_SYNODAL,Matt,Matt,39,Matt.14,Matt 14,13,Matt.14.1,Matt 14:1,0,В то время Ирод четвертовластник услышал молву об Иисусе
ru,RUS_SYNODAL,Matt,Matt,39,Matt.14,Matt 14,13,Matt.14.2,Matt 14:2,1,"и сказал служащим при нем: это Иоанн Креститель; он воскрес из мертвых, и потому чудеса делаются им."
ru,RUS_SYNODAL,Matt,Matt,39,Matt.14,Matt 14,13,Matt.14.3,Matt 14:3,2,"Ибо Ирод, взяв Иоанна, связал его и посадил в темницу за Иродиаду, жену Филиппа, брата своего,"
ru,RUS_SYNODAL,Matt,Matt,39,Matt.14,Matt 14,13,Matt.14.4,Matt 14:4,3,потому что Иоанн говорил ему: не должно тебе иметь ее.
ru,RUS_SYNODAL,Matt,Matt,39,Matt.14,Matt 14,13,Matt.14.5,Matt 14:5,4,"И хотел убить его, но боялся народа, потому что его почитали за пророка."
ru,RUS_SYNODAL,Matt,Matt,39,Matt.14,Matt 14,13,Matt.14.6,Matt 14:6,5,"Во время же [празднования] дня рождения Ирода дочь Иродиады плясала перед собранием и угодила Ироду,"
ru,RUS_SYNODAL,Matt,Matt,39,Matt.14,Matt 14,13,Matt.14.7,Matt 14:7,6,"посему он с клятвою обещал ей дать, чего она ни попросит."
ru,RUS_SYNODAL,Matt,Matt,39,Matt.14,Matt 14,13,Matt.14.8,Matt 14:8,7,"Она же, по наущению матери своей, сказала: дай мне здесь на блюде голову Иоанна Крестителя."
ru,RUS_SYNODAL,Matt,Matt,39,Matt.14,Matt 14,13,Matt.14.9,Matt 14:9,8,"И опечалился царь, но, ради клятвы и возлежащих с ним, повелел дать ей,"
ru,RUS_SYNODAL,Matt,Matt,39,Matt.14,Matt 14,13,Matt.14.10,Matt 14:10,9,и послал отсечь Иоанну голову в темнице.
ru,RUS_SYNODAL,Matt,Matt,39,Matt.14,Matt 14,13,Matt.14.11,Matt 14:11,10,"И принесли голову его на блюде и дали девице, а она отнесла матери своей."
ru,RUS_SYNODAL,Matt,Matt,39,Matt.14,Matt 14,13,Matt.14.12,Matt 14:12,11,"Ученики же его, придя, взяли тело его и погребли его; и пошли, возвестили Иисусу."
ru,RUS_SYNODAL,Matt,Matt,39,Matt.14,Matt 14,13,Matt.14.13,Matt 14:13,12,"И, услышав, Иисус удалился оттуда на лодке в пустынное место один; а народ, услышав о том, пошел за Ним из городов пешком."
ru,RUS_SYNODAL,Matt,Matt,39,Matt.14,Matt 14,13,Matt.14.14,Matt 14:14,13,"И, выйдя, Иисус увидел множество людей и сжалился над ними, и исцелил больных их."
ru,RUS_SYNODAL,Matt,Matt,39,Matt.14,Matt 14,13,Matt.14.15,Matt 14:15,14,"Когда же настал вечер, приступили к Нему ученики Его и сказали: место здесь пустынное и время уже позднее; отпусти народ, чтобы они пошли в селения и купили себе пищи."
ru,RUS_SYNODAL,Matt,Matt,39,Matt.14,Matt 14,13,Matt.14.16,Matt 14:16,15,"Но Иисус сказал им: не нужно им идти, вы дайте им есть."
ru,RUS_SYNODAL,Matt,Matt,39,Matt.14,Matt 14,13,Matt.14.17,Matt 14:17,16,Они же говорят Ему: у нас здесь только пять хлебов и две рыбы.
ru,RUS_SYNODAL,Matt,Matt,39,Matt.14,Matt 14,13,Matt.14.18,Matt 14:18,17,Он сказал: принесите их Мне сюда.
ru,RUS_SYNODAL,Matt,Matt,39,Matt.14,Matt 14,13,Matt.14.19,Matt 14:19,18,"И велел народу возлечь на траву и, взяв пять хлебов и две рыбы, воззрел на небо, благословил и, преломив, дал хлебы ученикам, а ученики народу."
ru,RUS_SYNODAL,Matt,Matt,39,Matt.14,Matt 14,13,Matt.14.20,Matt 14:20,19,И ели все и насытились; и набрали оставшихся кусков двенадцать коробов полных;
ru,RUS_SYNODAL,Matt,Matt,39,Matt.14,Matt 14,13,Matt.14.21,Matt 14:21,20,"а евших было около пяти тысяч человек, кроме женщин и детей."
ru,RUS_SYNODAL,Matt,Matt,39,Matt.14,Matt 14,13,Matt.14.22,Matt 14:22,21,"И тотчас понудил Иисус учеников Своих войти в лодку и отправиться прежде Его на другую сторону, пока Он отпустит народ."
ru,RUS_SYNODAL,Matt,Matt,39,Matt.14,Matt 14,13,Matt.14.23,Matt 14:23,22,"И, отпустив народ, Он взошел на гору помолиться наедине; и вечером оставался там один."
ru,RUS_SYNODAL,Matt,Matt,39,Matt.14,Matt 14,13,Matt.14.24,Matt 14:24,23,"А лодка была уже на средине моря, и ее било волнами, потому что ветер был противный."
ru,RUS_SYNODAL,Matt,Matt,39,Matt.14,Matt 14,13,Matt.14.25,Matt 14:25,24,"В четвертую же стражу ночи пошел к ним Иисус, идя по морю."
ru,RUS_SYNODAL,Matt,Matt,39,Matt.14,Matt 14,13,Matt.14.26,Matt 14:26,25,"И ученики, увидев Его идущего по морю, встревожились и говорили: это призрак; и от страха вскричали."
ru,RUS_SYNODAL,Matt,Matt,39,Matt.14,Matt 14,13,Matt.14.27,Matt 14:27,26,"Но Иисус тотчас заговорил с ними и сказал: ободритесь; это Я, не бойтесь."
ru,RUS_SYNODAL,Matt,Matt,39,Matt.14,Matt 14,13,Matt.14.28,Matt 14:28,27,"Петр сказал Ему в ответ: Господи! если это Ты, повели мне придти к Тебе по воде."
ru,RUS_SYNODAL,Matt,Matt,39,Matt.14,Matt 14,13,Matt.14.29,Matt 14:29,28,"Он же сказал: иди. И, выйдя из лодки, Петр пошел по воде, чтобы подойти к Иисусу,"
ru,RUS_SYNODAL,Matt,Matt,39,Matt.14,Matt 14,13,Matt.14.30,Matt 14:30,29,"но, видя сильный ветер, испугался и, начав утопать, закричал: Господи! спаси меня."
ru,RUS_SYNODAL,Matt,Matt,39,Matt.14,Matt 14,13,Matt.14.31,Matt 14:31,30,"Иисус тотчас простер руку, поддержал его и говорит ему: маловерный! зачем ты усомнился?"
ru,RUS_SYNODAL,Matt,Matt,39,Matt.14,Matt 14,13,Matt.14.32,Matt 14:32,31,"И, когда вошли они в лодку, ветер утих."
ru,RUS_SYNODAL,Matt,Matt,39,Matt.14,Matt 14,13,Matt.14.33,Matt 14:33,32,"Бывшие же в лодке подошли, поклонились Ему и сказали: истинно Ты Сын Божий."
ru,RUS_SYNODAL,Matt,Matt,39,Matt.14,Matt 14,13,Matt.14.34,Matt 14:34,33,"И, переправившись, прибыли в землю Геннисаретскую."
ru,RUS_SYNODAL,Matt,Matt,39,Matt.14,Matt 14,13,Matt.14.35,Matt 14:35,34,"Жители того места, узнав Его, послали во всю окрестность ту и принесли к Нему всех больных,"
ru,RUS_SYNODAL,Matt,Matt,39,Matt.14,Matt 14,13,Matt.14.36,Matt 14:36,35,"и просили Его, чтобы только прикоснуться к краю одежды Его; и которые прикасались, исцелялись."
ru,RUS_SYNODAL,Matt,Matt,39,Matt.15,Matt 15,14,Matt.15.1,Matt 15:1,0,Тогда приходят к Иисусу Иерусалимские книжники и фарисеи и говорят:
ru,RUS_SYNODAL,Matt,Matt,39,Matt.15,Matt 15,14,Matt.15.2,Matt 15:2,1,"зачем ученики Твои преступают предание старцев? ибо не умывают рук своих, когда едят хлеб."
ru,RUS_SYNODAL,Matt,Matt,39,Matt.15,Matt 15,14,Matt.15.3,Matt 15:3,2,Он же сказал им в ответ: зачем и вы преступаете заповедь Божию ради предания вашего?
ru,RUS_SYNODAL,Matt,Matt,39,Matt.15,Matt 15,14,Matt.15.4,Matt 15:4,3,Ибо Бог заповедал: почитай отца и мать; и: злословящий отца или мать смертью да умрет.
ru,RUS_SYNODAL,Matt,Matt,39,Matt.15,Matt 15,14,Matt.15.5,Matt 15:5,4,"А вы говорите: если кто скажет отцу или матери: дар [Богу] то, чем бы ты от меня пользовался,"
ru,RUS_SYNODAL,Matt,Matt,39,Matt.15,Matt 15,14,Matt.15.6,Matt 15:6,5,тот может и не почтить отца своего или мать свою; таким образом вы устранили заповедь Божию преданием вашим.
ru,RUS_SYNODAL,Matt,Matt,39,Matt.15,Matt 15,14,Matt.15.7,Matt 15:7,6,"Лицемеры! хорошо пророчествовал о вас Исаия, говоря:"
ru,RUS_SYNODAL,Matt,Matt,39,Matt.15,Matt 15,14,Matt.15.8,Matt 15:8,7,"приближаются ко Мне люди сии устами своими, и чтут Меня языком, сердце же их далеко отстоит от Меня;"
ru,RUS_SYNODAL,Matt,Matt,39,Matt.15,Matt 15,14,Matt.15.9,Matt 15:9,8,"но тщетно чтут Меня, уча учениям, заповедям человеческим."
ru,RUS_SYNODAL,Matt,Matt,39,Matt.15,Matt 15,14,Matt.15.10,Matt 15:10,9,"И, призвав народ, сказал им: слушайте и разумейте!"
ru,RUS_SYNODAL,Matt,Matt,39,Matt.15,Matt 15,14,Matt.15.11,Matt 15:11,10,"не то, что входит в уста, оскверняет человека, но то, что выходит из уст, оскверняет человека."
ru,RUS_SYNODAL,Matt,Matt,39,Matt.15,Matt 15,14,Matt.15.12,Matt 15:12,11,"Тогда ученики Его, приступив, сказали Ему: знаешь ли, что фарисеи, услышав слово сие, соблазнились?"
ru,RUS_SYNODAL,Matt,Matt,39,Matt.15,Matt 15,14,Matt.15.13,Matt 15:13,12,"Он же сказал в ответ: всякое растение, которое не Отец Мой Небесный насадил, искоренится;"
ru,RUS_SYNODAL,Matt,Matt,39,Matt.15,Matt 15,14,Matt.15.14,Matt 15:14,13,"оставьте их: они – слепые вожди слепых; а если слепой ведет слепого, то оба упадут в яму."
ru,RUS_SYNODAL,Matt,Matt,39,Matt.15,Matt 15,14,Matt.15.15,Matt 15:15,14,"Петр же, отвечая, сказал Ему: изъясни нам притчу сию."
ru,RUS_SYNODAL,Matt,Matt,39,Matt.15,Matt 15,14,Matt.15.16,Matt 15:16,15,Иисус сказал: неужели и вы еще не разумеете?
ru,RUS_SYNODAL,Matt,Matt,39,Matt.15,Matt 15,14,Matt.15.17,Matt 15:17,16,"еще ли не понимаете, что все, входящее в уста, проходит в чрево и извергается вон?"
ru,RUS_SYNODAL,Matt,Matt,39,Matt.15,Matt 15,14,Matt.15.18,Matt 15:18,17,"а исходящее из уст – из сердца исходит – сие оскверняет человека,"
ru,RUS_SYNODAL,Matt,Matt,39,Matt.15,Matt 15,14,Matt.15.19,Matt 15:19,18,"ибо из сердца исходят злые помыслы, убийства, прелюбодеяния, любодеяния, кражи, лжесвидетельства, хуления –"
ru,RUS_SYNODAL,Matt,Matt,39,Matt.15,Matt 15,14,Matt.15.20,Matt 15:20,19,это оскверняет человека; а есть неумытыми руками – не оскверняет человека.
ru,RUS_SYNODAL,Matt,Matt,39,Matt.15,Matt 15,14,Matt.15.21,Matt 15:21,20,"И, выйдя оттуда, Иисус удалился в страны Тирские и Сидонские."
ru,RUS_SYNODAL,Matt,Matt,39,Matt.15,Matt 15,14,Matt.15.22,Matt 15:22,21,"И вот, женщина Хананеянка, выйдя из тех мест, кричала Ему: помилуй меня, Господи, сын Давидов, дочь моя жестоко беснуется."
ru,RUS_SYNODAL,Matt,Matt,39,Matt.15,Matt 15,14,Matt.15.23,Matt 15:23,22,"Но Он не отвечал ей ни слова. И ученики Его, приступив, просили Его: отпусти ее, потому что кричит за нами."
ru,RUS_SYNODAL,Matt,Matt,39,Matt.15,Matt 15,14,Matt.15.24,Matt 15:24,23,Он же сказал в ответ: Я послан только к погибшим овцам дома Израилева.
ru,RUS_SYNODAL,Matt,Matt,39,Matt.15,Matt 15,14,Matt.15.25,Matt 15:25,24,"А она, подойдя, кланялась Ему и говорила: Господи! помоги мне."
ru,RUS_SYNODAL,Matt,Matt,39,Matt.15,Matt 15,14,Matt.15.26,Matt 15:26,25,Он же сказал в ответ: нехорошо взять хлеб у детей и бросить псам.
ru,RUS_SYNODAL,Matt,Matt,39,Matt.15,Matt 15,14,Matt.15.27,Matt 15:27,26,"Она сказала: так, Господи! но и псы едят крохи, которые падают со стола господ их."
ru,RUS_SYNODAL,Matt,Matt,39,Matt.15,Matt 15,14,Matt.15.28,Matt 15:28,27,"Тогда Иисус сказал ей в ответ: о, женщина! велика вера твоя; да будет тебе по желанию твоему. И исцелилась дочь ее в тот час."
ru,RUS_SYNODAL,Matt,Matt,39,Matt.15,Matt 15,14,Matt.15.29,Matt 15:29,28,"Перейдя оттуда, пришел Иисус к морю Галилейскому и, взойдя на гору, сел там."
ru,RUS_SYNODAL,Matt,Matt,39,Matt.15,Matt 15,14,Matt.15.30,Matt 15:30,29,"И приступило к Нему множество народа, имея с собою хромых, слепых, немых, увечных и иных многих, и повергли их к ногам Иисусовым; и Он исцелил их;"
ru,RUS_SYNODAL,Matt,Matt,39,Matt.15,Matt 15,14,Matt.15.31,Matt 15:31,30,"так что народ дивился, видя немых говорящими, увечных здоровыми, хромых ходящими и слепых видящими; и прославлял Бога Израилева."
ru,RUS_SYNODAL,Matt,Matt,39,Matt.15,Matt 15,14,Matt.15.32,Matt 15:32,31,"Иисус же, призвав учеников Своих, сказал им: жаль Мне народа, что уже три дня находятся при Мне, и нечего им есть; отпустить же их неевшими не хочу, чтобы не ослабели в дороге."
ru,RUS_SYNODAL,Matt,Matt,39,Matt.15,Matt 15,14,Matt.15.33,Matt 15:33,32,"И говорят Ему ученики Его: откуда нам взять в пустыне столько хлебов, чтобы накормить столько народа?"
ru,RUS_SYNODAL,Matt,Matt,39,Matt.15,Matt 15,14,Matt.15.34,Matt 15:34,33,"Говорит им Иисус: сколько у вас хлебов? Они же сказали: семь, и немного рыбок."
ru,RUS_SYNODAL,Matt,Matt,39,Matt.15,Matt 15,14,Matt.15.35,Matt 15:35,34,Тогда велел народу возлечь на землю.
ru,RUS_SYNODAL,Matt,Matt,39,Matt.15,Matt 15,14,Matt.15.36,Matt 15:36,35,"И, взяв семь хлебов и рыбы, воздал благодарение, преломил и дал ученикам Своим, а ученики народу."
ru,RUS_SYNODAL,Matt,Matt,39,Matt.15,Matt 15,14,Matt.15.37,Matt 15:37,36,"И ели все и насытились; и набрали оставшихся кусков семь корзин полных,"
ru,RUS_SYNODAL,Matt,Matt,39,Matt.15,Matt 15,14,Matt.15.38,Matt 15:38,37,"а евших было четыре тысячи человек, кроме женщин и детей."
ru,RUS_SYNODAL,Matt,Matt,39,Matt.15,Matt 15,14,Matt.15.39,Matt 15:39,38,"И, отпустив народ, Он вошел в лодку и прибыл в пределы Магдалинские."
ru,RUS_SYNODAL,Matt,Matt,39,Matt.16,Matt 16,15,Matt.16.1,Matt 16:1,0,"И приступили фарисеи и саддукеи и, искушая Его, просили показать им знамение с неба."
ru,RUS_SYNODAL,Matt,Matt,39,Matt.16,Matt 16,15,Matt.16.2,Matt 16:2,1,"Он же сказал им в ответ: вечером вы говорите: будет ведро, потому что небо красно;"
ru,RUS_SYNODAL,Matt,Matt,39,Matt.16,Matt 16,15,Matt.16.3,Matt 16:3,2,"и поутру: сегодня ненастье, потому что небо багрово. Лицемеры! различать лице неба вы умеете, а знамений времен не можете."
ru,RUS_SYNODAL,Matt,Matt,39,Matt.16,Matt 16,15,Matt.16.4,Matt 16:4,3,"Род лукавый и прелюбодейный знамения ищет, и знамение не дастся ему, кроме знамения Ионы пророка. И, оставив их, отошел."
ru,RUS_SYNODAL,Matt,Matt,39,Matt.16,Matt 16,15,Matt.16.5,Matt 16:5,4,"Переправившись на другую сторону, ученики Его забыли взять хлебов."
ru,RUS_SYNODAL,Matt,Matt,39,Matt.16,Matt 16,15,Matt.16.6,Matt 16:6,5,"Иисус сказал им: смотрите, берегитесь закваски фарисейской и саддукейской."
ru,RUS_SYNODAL,Matt,Matt,39,Matt.16,Matt 16,15,Matt.16.7,Matt 16:7,6,"Они же помышляли в себе и говорили: [это значит], что хлебов мы не взяли."
ru,RUS_SYNODAL,Matt,Matt,39,Matt.16,Matt 16,15,Matt.16.8,Matt 16:8,7,"Уразумев то, Иисус сказал им: что помышляете в себе, маловерные, что хлебов не взяли?"
ru,RUS_SYNODAL,Matt,Matt,39,Matt.16,Matt 16,15,Matt.16.9,Matt 16:9,8,"Еще ли не понимаете и не помните о пяти хлебах на пять тысяч [человек], и сколько коробов вы набрали?"
ru,RUS_SYNODAL,Matt,Matt,39,Matt.16,Matt 16,15,Matt.16.10,Matt 16:10,9,"ни о семи хлебах на четыре тысячи, и сколько корзин вы набрали?"
ru,RUS_SYNODAL,Matt,Matt,39,Matt.16,Matt 16,15,Matt.16.11,Matt 16:11,10,"как не разумеете, что не о хлебе сказал Я вам: берегитесь закваски фарисейской и саддукейской?"
