languageCode,code,bookOsisId,bookSblId,bookOrderIndex,chapterOsisId,chapterSblId,chapterOrderIndex,verseOsisId,verseSblId,verseOrderIndex,text
ru,RUS_SYNODAL,Matt,Matt,39,Matt.8,Matt 8,7,Matt.8.13,Matt 8:13,12,"И сказал Иисус сотнику: иди, и, как ты веровал, да будет тебе. И выздоровел слуга его в тот час."
ru,RUS_SYNODAL,Matt,Matt,39,Matt.8,Matt 8,7,Matt.8.14,Matt 8:14,13,"Придя в дом Петров, Иисус увидел тещу его, лежащую в горячке,"
ru,RUS_SYNODAL,Matt,Matt,39,Matt.8,Matt 8,7,Matt.8.15,Matt 8:15,14,"и коснулся руки ее, и горячка оставила ее; и она встала и служила им."
ru,RUS_SYNODAL,Matt,Matt,39,Matt.8,Matt 8,7,Matt.8.16,Matt 8:16,15,"Когда же настал вечер, к Нему привели многих бесноватых, и Он изгнал духов словом и исцелил всех больных,"
ru,RUS_SYNODAL,Matt,Matt,39,Matt.8,Matt 8,7,Matt.8.17,Matt 8:17,16,"да сбудется реченное через пророка Исаию, который говорит: Он взял на Себя наши немощи и понес болезни."
ru,RUS_SYNODAL,Matt,Matt,39,Matt.8,Matt 8,7,Matt.8.18,Matt 8:18,17,"Увидев же Иисус вокруг Себя множество народа, велел ученикам отплыть на другую сторону."
ru,RUS_SYNODAL,Matt,Matt,39,Matt.8,Matt 8,7,Matt.8.19,Matt 8:19,18,"Тогда один книжник, подойдя, сказал Ему: Учитель! я пойду за Тобою, куда бы Ты ни пошел."
ru,RUS_SYNODAL,Matt,Matt,39,Matt.8,Matt 8,7,Matt.8.20,Matt 8:20,19,"И говорит ему Иисус: лисицы имеют норы и птицы небесные – гнезда, а Сын Человеческий не имеет, где приклонить голову."
ru,RUS_SYNODAL,Matt,Matt,39,Matt.8,Matt 8,7,Matt.8.21,Matt 8:21,20,Другой же из учеников Его сказал Ему: Господи! позволь мне прежде пойти и похоронить отца моего.
ru,RUS_SYNODAL,Matt,Matt,39,Matt.8,Matt 8,7,Matt.8.22,Matt 8:22,21,"Но Иисус сказал ему: иди за Мною, и предоставь мертвым погребать своих мертвецов."
ru,RUS_SYNODAL,Matt,Matt,39,Matt.8,Matt 8,7,Matt.8.23,Matt 8:23,22,"И когда вошел Он в лодку, за Ним последовали ученики Его."
ru,RUS_SYNODAL,Matt,Matt,39,Matt.8,Matt 8,7,Matt.8.24,Matt 8:24,23,"И вот, сделалось великое волнение на море, так что лодка покрывалась волнами; а Он спал."
ru,RUS_SYNODAL,Matt,Matt,39,Matt.8,Matt 8,7,Matt.8.25,Matt 8:25,24,"Тогда ученики Его, подойдя к Нему, разбудили Его и сказали: Господи! спаси нас, погибаем."
ru,RUS_SYNODAL,Matt,Matt,39,Matt.8,Matt 8,7,Matt.8.26,Matt 8:26,25,"И говорит им: что вы [так] боязливы, маловерные? Потом, встав, запретил ветрам и морю, и сделалась великая тишина."
ru,RUS_SYNODAL,Matt,Matt,39,Matt.8,Matt 8,7,Matt.8.27,Matt 8:27,26,"Люди же, удивляясь, говорили: кто это, что и ветры и море повинуются Ему?"
ru,RUS_SYNODAL,Matt,Matt,39,Matt.8,Matt 8,7,Matt.8.28,Matt 8:28,27,"И когда Он прибыл на другой берег в страну Гергесинскую, Его встретили два бесноватые, вышедшие из гробов, весьма свирепые, так что никто не смел проходить тем путем."
ru,RUS_SYNODAL,Matt,Matt,39,Matt.8,Matt 8,7,Matt.8.29,Matt 8:29,28,"И вот, они закричали: что Тебе до нас, Иисус, Сын Божий? пришел Ты сюда прежде времени мучить нас."
ru,RUS_SYNODAL,Matt,Matt,39,Matt.8,Matt 8,7,Matt.8.30,Matt 8:30,29,Вдали же от них паслось большое стадо свиней.
ru,RUS_SYNODAL,Matt,Matt,39,Matt.8,Matt 8,7,Matt.8.31,Matt 8:31,30,"И бесы просили Его: если выгонишь нас, то пошли нас в стадо свиней."
ru,RUS_SYNODAL,Matt,Matt,39,Matt.8,Matt 8,7,Matt.8.32,Matt 8:32,31,"И Он сказал им: идите. И они, выйдя, пошли в стадо свиное. И вот, все стадо свиней бросилось с крутизны в море и погибло в воде."
ru,RUS_SYNODAL,Matt,Matt,39,Matt.8,Matt 8,7,Matt.8.33,Matt 8:33,32,"Пастухи же побежали и, придя в город, рассказали обо всем, и о том, что было с бесноватыми."
ru,RUS_SYNODAL,Matt,Matt,39,Matt.8,Matt 8,7,Matt.8.34,Matt 8:34,33,"И вот, весь город вышел навстречу Иисусу; и, увидев Его, просили, чтобы Он отошел от пределов их."
ru,RUS_SYNODAL,Matt,Matt,39,Matt.9,Matt 9,8,Matt.9.1,Matt 9:1,0,"Тогда Он, войдя в лодку, переправился [обратно] и прибыл в Свой город."
ru,RUS_SYNODAL,Matt,Matt,39,Matt.9,Matt 9,8,Matt.9.2,Matt 9:2,1,"И вот, принесли к Нему расслабленного, положенного на постели. И, видя Иисус веру их, сказал расслабленному: дерзай, чадо! прощаются тебе грехи твои."
ru,RUS_SYNODAL,Matt,Matt,39,Matt.9,Matt 9,8,Matt.9.3,Matt 9:3,2,При сем некоторые из книжников сказали сами в себе: Он богохульствует.
ru,RUS_SYNODAL,Matt,Matt,39,Matt.9,Matt 9,8,Matt.9.4,Matt 9:4,3,"Иисус же, видя помышления их, сказал: для чего вы мыслите худое в сердцах ваших?"
ru,RUS_SYNODAL,Matt,Matt,39,Matt.9,Matt 9,8,Matt.9.5,Matt 9:5,4,"ибо что легче сказать: прощаются тебе грехи, или сказать: встань и ходи?"
ru,RUS_SYNODAL,Matt,Matt,39,Matt.9,Matt 9,8,Matt.9.6,Matt 9:6,5,"Но чтобы вы знали, что Сын Человеческий имеет власть на земле прощать грехи, – тогда говорит расслабленному: встань, возьми постель твою, и иди в дом твой."
ru,RUS_SYNODAL,Matt,Matt,39,Matt.9,Matt 9,8,Matt.9.7,Matt 9:7,6,"И он встал, [взял постель свою] и пошел в дом свой."
ru,RUS_SYNODAL,Matt,Matt,39,Matt.9,Matt 9,8,Matt.9.8,Matt 9:8,7,"Народ же, видев это, удивился и прославил Бога, давшего такую власть человекам."
ru,RUS_SYNODAL,Matt,Matt,39,Matt.9,Matt 9,8,Matt.9.9,Matt 9:9,8,"Проходя оттуда, Иисус увидел человека, сидящего у сбора пошлин, по имени Матфея, и говорит ему: следуй за Мною. И он встал и последовал за Ним."
ru,RUS_SYNODAL,Matt,Matt,39,Matt.9,Matt 9,8,Matt.9.10,Matt 9:10,9,"И когда Иисус возлежал в доме, многие мытари и грешники пришли и возлегли с Ним и учениками Его."
ru,RUS_SYNODAL,Matt,Matt,39,Matt.9,Matt 9,8,Matt.9.11,Matt 9:11,10,"Увидев то, фарисеи сказали ученикам Его: для чего Учитель ваш ест и пьет с мытарями и грешниками?"
ru,RUS_SYNODAL,Matt,Matt,39,Matt.9,Matt 9,8,Matt.9.12,Matt 9:12,11,"Иисус же, услышав это, сказал им: не здоровые имеют нужду во враче, но больные,"
ru,RUS_SYNODAL,Matt,Matt,39,Matt.9,Matt 9,8,Matt.9.13,Matt 9:13,12,"пойдите, научитесь, что значит: милости хочу, а не жертвы? Ибо Я пришел призвать не праведников, но грешников к покаянию."
ru,RUS_SYNODAL,Matt,Matt,39,Matt.9,Matt 9,8,Matt.9.14,Matt 9:14,13,"Тогда приходят к Нему ученики Иоанновы и говорят: почему мы и фарисеи постимся много, а Твои ученики не постятся?"
ru,RUS_SYNODAL,Matt,Matt,39,Matt.9,Matt 9,8,Matt.9.15,Matt 9:15,14,"И сказал им Иисус: могут ли печалиться сыны чертога брачного, пока с ними жених? Но придут дни, когда отнимется у них жених, и тогда будут поститься."
ru,RUS_SYNODAL,Matt,Matt,39,Matt.9,Matt 9,8,Matt.9.16,Matt 9:16,15,"И никто к ветхой одежде не приставляет заплаты из небеленой ткани, ибо вновь пришитое отдерет от старого, и дыра будет еще хуже."
ru,RUS_SYNODAL,Matt,Matt,39,Matt.9,Matt 9,8,Matt.9.17,Matt 9:17,16,"Не вливают также вина молодого в мехи ветхие; а иначе прорываются мехи, и вино вытекает, и мехи пропадают, но вино молодое вливают в новые мехи, и сберегается то и другое."
ru,RUS_SYNODAL,Matt,Matt,39,Matt.9,Matt 9,8,Matt.9.18,Matt 9:18,17,"Когда Он говорил им сие, подошел к Нему некоторый начальник и, кланяясь Ему, говорил: дочь моя теперь умирает; но приди, возложи на нее руку Твою, и она будет жива."
ru,RUS_SYNODAL,Matt,Matt,39,Matt.9,Matt 9,8,Matt.9.19,Matt 9:19,18,"И встав, Иисус пошел за ним, и ученики Его."
ru,RUS_SYNODAL,Matt,Matt,39,Matt.9,Matt 9,8,Matt.9.20,Matt 9:20,19,"И вот, женщина, двенадцать лет страдавшая кровотечением, подойдя сзади, прикоснулась к краю одежды Его,"
ru,RUS_SYNODAL,Matt,Matt,39,Matt.9,Matt 9,8,Matt.9.21,Matt 9:21,20,"ибо она говорила сама в себе: если только прикоснусь к одежде Его, выздоровею."
ru,RUS_SYNODAL,Matt,Matt,39,Matt.9,Matt 9,8,Matt.9.22,Matt 9:22,21,"Иисус же, обратившись и увидев ее, сказал: дерзай, дщерь! вера твоя спасла тебя. Женщина с того часа стала здорова."
ru,RUS_SYNODAL,Matt,Matt,39,Matt.9,Matt 9,8,Matt.9.23,Matt 9:23,22,"И когда пришел Иисус в дом начальника и увидел свирельщиков и народ в смятении,"
ru,RUS_SYNODAL,Matt,Matt,39,Matt.9,Matt 9,8,Matt.9.24,Matt 9:24,23,"сказал им: выйдите вон, ибо не умерла девица, но спит. И смеялись над Ним."
ru,RUS_SYNODAL,Matt,Matt,39,Matt.9,Matt 9,8,Matt.9.25,Matt 9:25,24,"Когда же народ был выслан, Он, войдя, взял ее за руку, и девица встала."
ru,RUS_SYNODAL,Matt,Matt,39,Matt.9,Matt 9,8,Matt.9.26,Matt 9:26,25,И разнесся слух о сем по всей земле той.
ru,RUS_SYNODAL,Matt,Matt,39,Matt.9,Matt 9,8,Matt.9.27,Matt 9:27,26,"Когда Иисус шел оттуда, за Ним следовали двое слепых и кричали: помилуй нас, Иисус, сын Давидов!"
ru,RUS_SYNODAL,Matt,Matt,39,Matt.9,Matt 9,8,Matt.9.28,Matt 9:28,27,"Когда же Он пришел в дом, слепые приступили к Нему. И говорит им Иисус: веруете ли, что Я могу это сделать? Они говорят Ему: ей, Господи!"
ru,RUS_SYNODAL,Matt,Matt,39,Matt.9,Matt 9,8,Matt.9.29,Matt 9:29,28,Тогда Он коснулся глаз их и сказал: по вере вашей да будет вам.
ru,RUS_SYNODAL,Matt,Matt,39,Matt.9,Matt 9,8,Matt.9.30,Matt 9:30,29,"И открылись глаза их; и Иисус строго сказал им: смотрите, чтобы никто не узнал."
ru,RUS_SYNODAL,Matt,Matt,39,Matt.9,Matt 9,8,Matt.9.31,Matt 9:31,30,"А они, выйдя, разгласили о Нем по всей земле той."
ru,RUS_SYNODAL,Matt,Matt,39,Matt.9,Matt 9,8,Matt.9.32,Matt 9:32,31,"Когда же те выходили, то привели к Нему человека немого бесноватого."
ru,RUS_SYNODAL,Matt,Matt,39,Matt.9,Matt 9,8,Matt.9.33,Matt 9:33,32,"И когда бес был изгнан, немой стал говорить. И народ, удивляясь, говорил: никогда не бывало такого явления в Израиле."
ru,RUS_SYNODAL,Matt,Matt,39,Matt.9,Matt 9,8,Matt.9.34,Matt 9:34,33,А фарисеи говорили: Он изгоняет бесов силою князя бесовского.
ru,RUS_SYNODAL,Matt,Matt,39,Matt.9,Matt 9,8,Matt.9.35,Matt 9:35,34,"И ходил Иисус по всем городам и селениям, уча в синагогах их, проповедуя Евангелие Царствия и исцеляя всякую болезнь и всякую немощь в людях."
ru,RUS_SYNODAL,Matt,Matt,39,Matt.9,Matt 9,8,Matt.9.36,Matt 9:36,35,"Видя толпы народа, Он сжалился над ними, что они были изнурены и рассеяны, как овцы, не имеющие пастыря."
ru,RUS_SYNODAL,Matt,Matt,39,Matt.9,Matt 9,8,Matt.9.37,Matt 9:37,36,"Тогда говорит ученикам Своим: жатвы много, а делателей мало;"
ru,RUS_SYNODAL,Matt,Matt,39,Matt.9,Matt 9,8,Matt.9.38,Matt 9:38,37,"итак молите Господина жатвы, чтобы выслал делателей на жатву Свою."
ru,RUS_SYNODAL,Matt,Matt,39,Matt.10,Matt 10,9,Matt.10.1,Matt 10:1,0,"И призвав двенадцать учеников Своих, Он дал им власть над нечистыми духами, чтобы изгонять их и врачевать всякую болезнь и всякую немощь."
ru,RUS_SYNODAL,Matt,Matt,39,Matt.10,Matt 10,9,Matt.10.2,Matt 10:2,1,"Двенадцати же Апостолов имена суть сии: первый Симон, называемый Петром, и Андрей, брат его, Иаков Зеведеев и Иоанн, брат его,"
ru,RUS_SYNODAL,Matt,Matt,39,Matt.10,Matt 10,9,Matt.10.3,Matt 10:3,2,"Филипп и Варфоломей, Фома и Матфей мытарь, Иаков Алфеев и Леввей, прозванный Фаддеем,"
ru,RUS_SYNODAL,Matt,Matt,39,Matt.10,Matt 10,9,Matt.10.4,Matt 10:4,3,"Симон Кананит и Иуда Искариот, который и предал Его."
ru,RUS_SYNODAL,Matt,Matt,39,Matt.10,Matt 10,9,Matt.10.5,Matt 10:5,4,"Сих двенадцать послал Иисус, и заповедал им, говоря: на путь к язычникам не ходите, и в город Самарянский не входите;"
ru,RUS_SYNODAL,Matt,Matt,39,Matt.10,Matt 10,9,Matt.10.6,Matt 10:6,5,а идите наипаче к погибшим овцам дома Израилева;
ru,RUS_SYNODAL,Matt,Matt,39,Matt.10,Matt 10,9,Matt.10.7,Matt 10:7,6,"ходя же, проповедуйте, что приблизилось Царство Небесное;"
ru,RUS_SYNODAL,Matt,Matt,39,Matt.10,Matt 10,9,Matt.10.8,Matt 10:8,7,"больных исцеляйте, прокаженных очищайте, мертвых воскрешайте, бесов изгоняйте; даром получили, даром давайте."
ru,RUS_SYNODAL,Matt,Matt,39,Matt.10,Matt 10,9,Matt.10.9,Matt 10:9,8,"Не берите с собою ни золота, ни серебра, ни меди в поясы свои,"
ru,RUS_SYNODAL,Matt,Matt,39,Matt.10,Matt 10,9,Matt.10.10,Matt 10:10,9,"ни сумы на дорогу, ни двух одежд, ни обуви, ни посоха, ибо трудящийся достоин пропитания."
ru,RUS_SYNODAL,Matt,Matt,39,Matt.10,Matt 10,9,Matt.10.11,Matt 10:11,10,"В какой бы город или селение ни вошли вы, наведывайтесь, кто в нем достоин, и там оставайтесь, пока не выйдете;"
ru,RUS_SYNODAL,Matt,Matt,39,Matt.10,Matt 10,9,Matt.10.12,Matt 10:12,11,"а входя в дом, приветствуйте его, говоря: мир дому сему;"
ru,RUS_SYNODAL,Matt,Matt,39,Matt.10,Matt 10,9,Matt.10.13,Matt 10:13,12,"и если дом будет достоин, то мир ваш придет на него; если же не будет достоин, то мир ваш к вам возвратится."
ru,RUS_SYNODAL,Matt,Matt,39,Matt.10,Matt 10,9,Matt.10.14,Matt 10:14,13,"А если кто не примет вас и не послушает слов ваших, то, выходя из дома или из города того, отрясите прах от ног ваших;"
ru,RUS_SYNODAL,Matt,Matt,39,Matt.10,Matt 10,9,Matt.10.15,Matt 10:15,14,"истинно говорю вам: отраднее будет земле Содомской и Гоморрской в день суда, нежели городу тому."
ru,RUS_SYNODAL,Matt,Matt,39,Matt.10,Matt 10,9,Matt.10.16,Matt 10:16,15,"Вот, Я посылаю вас, как овец среди волков: итак будьте мудры, как змии, и просты, как голуби."
ru,RUS_SYNODAL,Matt,Matt,39,Matt.10,Matt 10,9,Matt.10.17,Matt 10:17,16,"Остерегайтесь же людей: ибо они будут отдавать вас в судилища и в синагогах своих будут бить вас,"
ru,RUS_SYNODAL,Matt,Matt,39,Matt.10,Matt 10,9,Matt.10.18,Matt 10:18,17,"и поведут вас к правителям и царям за Меня, для свидетельства перед ними и язычниками."
ru,RUS_SYNODAL,Matt,Matt,39,Matt.10,Matt 10,9,Matt.10.19,Matt 10:19,18,"Когда же будут предавать вас, не заботьтесь, как или что сказать; ибо в тот час дано будет вам, что сказать,"
ru,RUS_SYNODAL,Matt,Matt,39,Matt.10,Matt 10,9,Matt.10.20,Matt 10:20,19,"ибо не вы будете говорить, но Дух Отца вашего будет говорить в вас."
ru,RUS_SYNODAL,Matt,Matt,39,Matt.10,Matt 10,9,Matt.10.21,Matt 10:21,20,"Предаст же брат брата на смерть, и отец – сына; и восстанут дети на родителей, и умертвят их;"
ru,RUS_SYNODAL,Matt,Matt,39,Matt.10,Matt 10,9,Matt.10.22,Matt 10:22,21,и будете ненавидимы всеми за имя Мое; претерпевший же до конца спасется.
ru,RUS_SYNODAL,Matt,Matt,39,Matt.10,Matt 10,9,Matt.10.23,Matt 10:23,22,"Когда же будут гнать вас в одном городе, бегите в другой. Ибо истинно говорю вам: не успеете обойти городов Израилевых, как приидет Сын Человеческий."
ru,RUS_SYNODAL,Matt,Matt,39,Matt.10,Matt 10,9,Matt.10.24,Matt 10:24,23,"Ученик не выше учителя, и слуга не выше господина своего:"
ru,RUS_SYNODAL,Matt,Matt,39,Matt.10,Matt 10,9,Matt.10.25,Matt 10:25,24,"довольно для ученика, чтобы он был, как учитель его, и для слуги, чтобы он был, как господин его. Если хозяина дома назвали веельзевулом, не тем ли более домашних его?"
ru,RUS_SYNODAL,Matt,Matt,39,Matt.10,Matt 10,9,Matt.10.26,Matt 10:26,25,"Итак не бойтесь их, ибо нет ничего сокровенного, что не открылось бы, и тайного, что не было бы узнано."
ru,RUS_SYNODAL,Matt,Matt,39,Matt.10,Matt 10,9,Matt.10.27,Matt 10:27,26,"Что говорю вам в темноте, говорите при свете; и что на ухо слышите, проповедуйте на кровлях."
ru,RUS_SYNODAL,Matt,Matt,39,Matt.10,Matt 10,9,Matt.10.28,Matt 10:28,27,"И не бойтесь убивающих тело, души же не могущих убить; а бойтесь более Того, Кто может и душу и тело погубить в геенне."
ru,RUS_SYNODAL,Matt,Matt,39,Matt.10,Matt 10,9,Matt.10.29,Matt 10:29,28,Не две ли малые птицы продаются за ассарий? И ни одна из них не упадет на землю без [воли] Отца вашего;
ru,RUS_SYNODAL,Matt,Matt,39,Matt.10,Matt 10,9,Matt.10.30,Matt 10:30,29,у вас же и волосы на голове все сочтены;
ru,RUS_SYNODAL,Matt,Matt,39,Matt.10,Matt 10,9,Matt.10.31,Matt 10:31,30,не бойтесь же: вы лучше многих малых птиц.
ru,RUS_SYNODAL,Matt,Matt,39,Matt.10,Matt 10,9,Matt.10.32,Matt 10:32,31,"Итак всякого, кто исповедает Меня пред людьми, того исповедаю и Я пред Отцем Моим Небесным;"
ru,RUS_SYNODAL,Matt,Matt,39,Matt.10,Matt 10,9,Matt.10.33,Matt 10:33,32,"а кто отречется от Меня пред людьми, отрекусь от того и Я пред Отцем Моим Небесным."
ru,RUS_SYNODAL,Matt,Matt,39,Matt.10,Matt 10,9,Matt.10.34,Matt 10:34,33,"Не думайте, что Я пришел принести мир на землю; не мир пришел Я принести, но меч,"
ru,RUS_SYNODAL,Matt,Matt,39,Matt.10,Matt 10,9,Matt.10.35,Matt 10:35,34,"ибо Я пришел разделить человека с отцом его, и дочь с матерью ее, и невестку со свекровью ее."
ru,RUS_SYNODAL,Matt,Matt,39,Matt.10,Matt 10,9,Matt.10.36,Matt 10:36,35,И враги человеку – домашние его.
ru,RUS_SYNODAL,Matt,Matt,39,Matt.10,Matt 10,9,Matt.10.37,Matt 10:37,36,"Кто любит отца или мать более, нежели Меня, не достоин Меня; и кто любит сына или дочь более, нежели Меня, не достоин Меня;"
ru,RUS_SYNODAL,Matt,Matt,39,Matt.10,Matt 10,9,Matt.10.38,Matt 10:38,37,"и кто не берет креста своего и следует за Мною, тот не достоин Меня."
ru,RUS_SYNODAL,Matt,Matt,39,Matt.10,Matt 10,9,Matt.10.39,Matt 10:39,38,Сберегший душу свою потеряет ее; а потерявший душу свою ради Меня сбережет ее.
ru,RUS_SYNODAL,Matt,Matt,39,Matt.10,Matt 10,9,Matt.10.40,Matt 10:40,39,"Кто принимает вас, принимает Меня, а кто принимает Меня, принимает Пославшего Меня;"
ru,RUS_SYNODAL,Matt,Matt,39,Matt.10,Matt 10,9,Matt.10.41,Matt 10:41,40,"кто принимает пророка, во имя пророка, получит награду пророка; и кто принимает праведника, во имя праведника, получит награду праведника."
ru,RUS_SYNODAL,Matt,Matt,39,Matt.10,Matt 10,9,Matt.10.42,Matt 10:42,41,"И кто напоит одного из малых сих только чашею холодной воды, во имя ученика, истинно говорю вам, не потеряет награды своей."
ru,RUS_SYNODAL,Matt,Matt,39,Matt.11,Matt 11,10,Matt.11.1,Matt 11:1,0,"И когда окончил Иисус наставления двенадцати ученикам Своим, перешел оттуда учить и проповедывать в городах их."
ru,RUS_SYNODAL,Matt,Matt,39,Matt.11,Matt 11,10,Matt.11.2,Matt 11:2,1,"Иоанн же, услышав в темнице о делах Христовых, послал двоих из учеников своих"
ru,RUS_SYNODAL,Matt,Matt,39,Matt.11,Matt 11,10,Matt.11.3,Matt 11:3,2,"сказать Ему: Ты ли Тот, Который должен придти, или ожидать нам другого?"
ru,RUS_SYNODAL,Matt,Matt,39,Matt.11,Matt 11,10,Matt.11.4,Matt 11:4,3,"И сказал им Иисус в ответ: пойдите, скажите Иоанну, что слышите и видите:"
ru,RUS_SYNODAL,Matt,Matt,39,Matt.11,Matt 11,10,Matt.11.5,Matt 11:5,4,"слепые прозревают и хромые ходят, прокаженные очищаются и глухие слышат, мертвые воскресают и нищие благовествуют;"
ru,RUS_SYNODAL,Matt,Matt,39,Matt.11,Matt 11,10,Matt.11.6,Matt 11:6,5,"и блажен, кто не соблазнится о Мне."
