languageCode,code,bookOsisId,bookSblId,bookOrderIndex,chapterOsisId,chapterSblId,chapterOrderIndex,verseOsisId,verseSblId,verseOrderIndex,text
ru,RUS_SYNODAL,Matt,Matt,39,Matt.22,Matt 22,21,Matt.22.13,Matt 22:13,12,"Тогда сказал царь слугам: связав ему руки и ноги, возьмите его и бросьте во тьму внешнюю; там будет плач и скрежет зубов;"
ru,RUS_SYNODAL,Matt,Matt,39,Matt.22,Matt 22,21,Matt.22.14,Matt 22:14,13,"ибо много званых, а мало избранных."
ru,RUS_SYNODAL,Matt,Matt,39,Matt.22,Matt 22,21,Matt.22.15,Matt 22:15,14,"Тогда фарисеи пошли и совещались, как бы уловить Его в словах."
ru,RUS_SYNODAL,Matt,Matt,39,Matt.22,Matt 22,21,Matt.22.16,Matt 22:16,15,"И посылают к Нему учеников своих с иродианами, говоря: Учитель! мы знаем, что Ты справедлив, и истинно пути Божию учишь, и не заботишься об угождении кому–либо, ибо не смотришь ни на какое лице;"
ru,RUS_SYNODAL,Matt,Matt,39,Matt.22,Matt 22,21,Matt.22.17,Matt 22:17,16,"итак скажи нам: как Тебе кажется? позволительно ли давать подать кесарю, или нет?"
ru,RUS_SYNODAL,Matt,Matt,39,Matt.22,Matt 22,21,Matt.22.18,Matt 22:18,17,"Но Иисус, видя лукавство их, сказал: что искушаете Меня, лицемеры?"
ru,RUS_SYNODAL,Matt,Matt,39,Matt.22,Matt 22,21,Matt.22.19,Matt 22:19,18,"покажите Мне монету, которою платится подать. Они принесли Ему динарий."
ru,RUS_SYNODAL,Matt,Matt,39,Matt.22,Matt 22,21,Matt.22.20,Matt 22:20,19,И говорит им: чье это изображение и надпись?
ru,RUS_SYNODAL,Matt,Matt,39,Matt.22,Matt 22,21,Matt.22.21,Matt 22:21,20,"Говорят Ему: кесаревы. Тогда говорит им: итак отдавайте кесарево кесарю, а Божие Богу."
ru,RUS_SYNODAL,Matt,Matt,39,Matt.22,Matt 22,21,Matt.22.22,Matt 22:22,21,"Услышав это, они удивились и, оставив Его, ушли."
ru,RUS_SYNODAL,Matt,Matt,39,Matt.22,Matt 22,21,Matt.22.23,Matt 22:23,22,"В тот день приступили к Нему саддукеи, которые говорят, что нет воскресения, и спросили Его:"
ru,RUS_SYNODAL,Matt,Matt,39,Matt.22,Matt 22,21,Matt.22.24,Matt 22:24,23,"Учитель! Моисей сказал: если кто умрет, не имея детей, то брат его пусть возьмет за себя жену его и восстановит семя брату своему;"
ru,RUS_SYNODAL,Matt,Matt,39,Matt.22,Matt 22,21,Matt.22.25,Matt 22:25,24,"было у нас семь братьев; первый, женившись, умер и, не имея детей, оставил жену свою брату своему;"
ru,RUS_SYNODAL,Matt,Matt,39,Matt.22,Matt 22,21,Matt.22.26,Matt 22:26,25,"подобно и второй, и третий, даже до седьмого;"
ru,RUS_SYNODAL,Matt,Matt,39,Matt.22,Matt 22,21,Matt.22.27,Matt 22:27,26,после же всех умерла и жена;
ru,RUS_SYNODAL,Matt,Matt,39,Matt.22,Matt 22,21,Matt.22.28,Matt 22:28,27,"итак, в воскресении, которого из семи будет она женою? ибо все имели ее."
ru,RUS_SYNODAL,Matt,Matt,39,Matt.22,Matt 22,21,Matt.22.29,Matt 22:29,28,"Иисус сказал им в ответ: заблуждаетесь, не зная Писаний, ни силы Божией,"
ru,RUS_SYNODAL,Matt,Matt,39,Matt.22,Matt 22,21,Matt.22.30,Matt 22:30,29,"ибо в воскресении ни женятся, ни выходят замуж, но пребывают, как Ангелы Божии на небесах."
ru,RUS_SYNODAL,Matt,Matt,39,Matt.22,Matt 22,21,Matt.22.31,Matt 22:31,30,А о воскресении мертвых не читали ли вы реченного вам Богом:
ru,RUS_SYNODAL,Matt,Matt,39,Matt.22,Matt 22,21,Matt.22.32,Matt 22:32,31,"Я Бог Авраама, и Бог Исаака, и Бог Иакова? Бог не есть Бог мертвых, но живых."
ru,RUS_SYNODAL,Matt,Matt,39,Matt.22,Matt 22,21,Matt.22.33,Matt 22:33,32,"И, слыша, народ дивился учению Его."
ru,RUS_SYNODAL,Matt,Matt,39,Matt.22,Matt 22,21,Matt.22.34,Matt 22:34,33,"А фарисеи, услышав, что Он привел саддукеев в молчание, собрались вместе."
ru,RUS_SYNODAL,Matt,Matt,39,Matt.22,Matt 22,21,Matt.22.35,Matt 22:35,34,"И один из них, законник, искушая Его, спросил, говоря:"
ru,RUS_SYNODAL,Matt,Matt,39,Matt.22,Matt 22,21,Matt.22.36,Matt 22:36,35,Учитель! какая наибольшая заповедь в законе?
ru,RUS_SYNODAL,Matt,Matt,39,Matt.22,Matt 22,21,Matt.22.37,Matt 22:37,36,Иисус сказал ему: возлюби Господа Бога твоего всем сердцем твоим и всею душею твоею и всем разумением твоим:
ru,RUS_SYNODAL,Matt,Matt,39,Matt.22,Matt 22,21,Matt.22.38,Matt 22:38,37,сия есть первая и наибольшая заповедь;
ru,RUS_SYNODAL,Matt,Matt,39,Matt.22,Matt 22,21,Matt.22.39,Matt 22:39,38,"вторая же подобная ей: возлюби ближнего твоего, как самого себя;"
ru,RUS_SYNODAL,Matt,Matt,39,Matt.22,Matt 22,21,Matt.22.40,Matt 22:40,39,на сих двух заповедях утверждается весь закон и пророки.
ru,RUS_SYNODAL,Matt,Matt,39,Matt.22,Matt 22,21,Matt.22.41,Matt 22:41,40,"Когда же собрались фарисеи, Иисус спросил их:"
ru,RUS_SYNODAL,Matt,Matt,39,Matt.22,Matt 22,21,Matt.22.42,Matt 22:42,41,что вы думаете о Христе? чей Он сын? Говорят Ему: Давидов.
ru,RUS_SYNODAL,Matt,Matt,39,Matt.22,Matt 22,21,Matt.22.43,Matt 22:43,42,"Говорит им: как же Давид, по вдохновению, называет Его Господом, когда говорит:"
ru,RUS_SYNODAL,Matt,Matt,39,Matt.22,Matt 22,21,Matt.22.44,Matt 22:44,43,"сказал Господь Господу моему: седи одесную Меня, доколе положу врагов Твоих в подножие ног Твоих?"
ru,RUS_SYNODAL,Matt,Matt,39,Matt.22,Matt 22,21,Matt.22.45,Matt 22:45,44,"Итак, если Давид называет Его Господом, как же Он сын ему?"
ru,RUS_SYNODAL,Matt,Matt,39,Matt.22,Matt 22,21,Matt.22.46,Matt 22:46,45,И никто не мог отвечать Ему ни слова; и с того дня никто уже не смел спрашивать Его.
ru,RUS_SYNODAL,Matt,Matt,39,Matt.23,Matt 23,22,Matt.23.1,Matt 23:1,0,Тогда Иисус начал говорить народу и ученикам Своим
ru,RUS_SYNODAL,Matt,Matt,39,Matt.23,Matt 23,22,Matt.23.2,Matt 23:2,1,и сказал: на Моисеевом седалище сели книжники и фарисеи;
ru,RUS_SYNODAL,Matt,Matt,39,Matt.23,Matt 23,22,Matt.23.3,Matt 23:3,2,"итак все, что они велят вам соблюдать, соблюдайте и делайте; по делам же их не поступайте, ибо они говорят, и не делают:"
ru,RUS_SYNODAL,Matt,Matt,39,Matt.23,Matt 23,22,Matt.23.4,Matt 23:4,3,"связывают бремена тяжелые и неудобоносимые и возлагают на плечи людям, а сами не хотят и перстом двинуть их;"
ru,RUS_SYNODAL,Matt,Matt,39,Matt.23,Matt 23,22,Matt.23.5,Matt 23:5,4,"все же дела свои делают с тем, чтобы видели их люди: расширяют хранилища свои и увеличивают воскрилия одежд своих;"
ru,RUS_SYNODAL,Matt,Matt,39,Matt.23,Matt 23,22,Matt.23.6,Matt 23:6,5,также любят предвозлежания на пиршествах и председания в синагогах
ru,RUS_SYNODAL,Matt,Matt,39,Matt.23,Matt 23,22,Matt.23.7,Matt 23:7,6,"и приветствия в народных собраниях, и чтобы люди звали их: учитель! учитель!"
ru,RUS_SYNODAL,Matt,Matt,39,Matt.23,Matt 23,22,Matt.23.8,Matt 23:8,7,"А вы не называйтесь учителями, ибо один у вас Учитель – Христос, все же вы – братья;"
ru,RUS_SYNODAL,Matt,Matt,39,Matt.23,Matt 23,22,Matt.23.9,Matt 23:9,8,"и отцом себе не называйте никого на земле, ибо один у вас Отец, Который на небесах;"
ru,RUS_SYNODAL,Matt,Matt,39,Matt.23,Matt 23,22,Matt.23.10,Matt 23:10,9,"и не называйтесь наставниками, ибо один у вас Наставник – Христос."
ru,RUS_SYNODAL,Matt,Matt,39,Matt.23,Matt 23,22,Matt.23.11,Matt 23:11,10,Больший из вас да будет вам слуга:
ru,RUS_SYNODAL,Matt,Matt,39,Matt.23,Matt 23,22,Matt.23.12,Matt 23:12,11,"ибо, кто возвышает себя, тот унижен будет, а кто унижает себя, тот возвысится."
ru,RUS_SYNODAL,Matt,Matt,39,Matt.23,Matt 23,22,Matt.23.13,Matt 23:13,12,"Горе вам, книжники и фарисеи, лицемеры, что затворяете Царство Небесное человекам, ибо сами не входите и хотящих войти не допускаете."
ru,RUS_SYNODAL,Matt,Matt,39,Matt.23,Matt 23,22,Matt.23.14,Matt 23:14,13,"Горе вам, книжники и фарисеи, лицемеры, что поедаете домы вдов и лицемерно долго молитесь: за то примете тем большее осуждение."
ru,RUS_SYNODAL,Matt,Matt,39,Matt.23,Matt 23,22,Matt.23.15,Matt 23:15,14,"Горе вам, книжники и фарисеи, лицемеры, что обходите море и сушу, дабы обратить хотя одного; и когда это случится, делаете его сыном геенны, вдвое худшим вас."
ru,RUS_SYNODAL,Matt,Matt,39,Matt.23,Matt 23,22,Matt.23.16,Matt 23:16,15,"Горе вам, вожди слепые, которые говорите: если кто поклянется храмом, то ничего, а если кто поклянется золотом храма, то повинен."
ru,RUS_SYNODAL,Matt,Matt,39,Matt.23,Matt 23,22,Matt.23.17,Matt 23:17,16,"Безумные и слепые! что больше: золото, или храм, освящающий золото?"
ru,RUS_SYNODAL,Matt,Matt,39,Matt.23,Matt 23,22,Matt.23.18,Matt 23:18,17,"Также: если кто поклянется жертвенником, то ничего, если же кто поклянется даром, который на нем, то повинен."
ru,RUS_SYNODAL,Matt,Matt,39,Matt.23,Matt 23,22,Matt.23.19,Matt 23:19,18,"Безумные и слепые! что больше: дар, или жертвенник, освящающий дар?"
ru,RUS_SYNODAL,Matt,Matt,39,Matt.23,Matt 23,22,Matt.23.20,Matt 23:20,19,"Итак клянущийся жертвенником клянется им и всем, что на нем;"
ru,RUS_SYNODAL,Matt,Matt,39,Matt.23,Matt 23,22,Matt.23.21,Matt 23:21,20,и клянущийся храмом клянется им и Живущим в нем;
ru,RUS_SYNODAL,Matt,Matt,39,Matt.23,Matt 23,22,Matt.23.22,Matt 23:22,21,и клянущийся небом клянется Престолом Божиим и Сидящим на нем.
ru,RUS_SYNODAL,Matt,Matt,39,Matt.23,Matt 23,22,Matt.23.23,Matt 23:23,22,"Горе вам, книжники и фарисеи, лицемеры, что даете десятину с мяты, аниса и тмина, и оставили важнейшее в законе: суд, милость и веру; сие надлежало делать, и того не оставлять."
ru,RUS_SYNODAL,Matt,Matt,39,Matt.23,Matt 23,22,Matt.23.24,Matt 23:24,23,"Вожди слепые, оцеживающие комара, а верблюда поглощающие!"
ru,RUS_SYNODAL,Matt,Matt,39,Matt.23,Matt 23,22,Matt.23.25,Matt 23:25,24,"Горе вам, книжники и фарисеи, лицемеры, что очищаете внешность чаши и блюда, между тем как внутри они полны хищения и неправды."
ru,RUS_SYNODAL,Matt,Matt,39,Matt.23,Matt 23,22,Matt.23.26,Matt 23:26,25,"Фарисей слепой! очисти прежде внутренность чаши и блюда, чтобы чиста была и внешность их."
ru,RUS_SYNODAL,Matt,Matt,39,Matt.23,Matt 23,22,Matt.23.27,Matt 23:27,26,"Горе вам, книжники и фарисеи, лицемеры, что уподобляетесь окрашенным гробам, которые снаружи кажутся красивыми, а внутри полны костей мертвых и всякой нечистоты;"
ru,RUS_SYNODAL,Matt,Matt,39,Matt.23,Matt 23,22,Matt.23.28,Matt 23:28,27,"так и вы по наружности кажетесь людям праведными, а внутри исполнены лицемерия и беззакония."
ru,RUS_SYNODAL,Matt,Matt,39,Matt.23,Matt 23,22,Matt.23.29,Matt 23:29,28,"Горе вам, книжники и фарисеи, лицемеры, что строите гробницы пророкам и украшаете памятники праведников,"
ru,RUS_SYNODAL,Matt,Matt,39,Matt.23,Matt 23,22,Matt.23.30,Matt 23:30,29,"и говорите: если бы мы были во дни отцов наших, то не были бы сообщниками их в [пролитии] крови пророков;"
ru,RUS_SYNODAL,Matt,Matt,39,Matt.23,Matt 23,22,Matt.23.31,Matt 23:31,30,"таким образом вы сами против себя свидетельствуете, что вы сыновья тех, которые избили пророков;"
ru,RUS_SYNODAL,Matt,Matt,39,Matt.23,Matt 23,22,Matt.23.32,Matt 23:32,31,дополняйте же меру отцов ваших.
ru,RUS_SYNODAL,Matt,Matt,39,Matt.23,Matt 23,22,Matt.23.33,Matt 23:33,32,"Змии, порождения ехиднины! как убежите вы от осуждения в геенну?"
ru,RUS_SYNODAL,Matt,Matt,39,Matt.23,Matt 23,22,Matt.23.34,Matt 23:34,33,"Посему, вот, Я посылаю к вам пророков, и мудрых, и книжников; и вы иных убьете и распнете, а иных будете бить в синагогах ваших и гнать из города в город;"
ru,RUS_SYNODAL,Matt,Matt,39,Matt.23,Matt 23,22,Matt.23.35,Matt 23:35,34,"да придет на вас вся кровь праведная, пролитая на земле, от крови Авеля праведного до крови Захарии, сына Варахиина, которого вы убили между храмом и жертвенником."
ru,RUS_SYNODAL,Matt,Matt,39,Matt.23,Matt 23,22,Matt.23.36,Matt 23:36,35,"Истинно говорю вам, что все сие придет на род сей."
ru,RUS_SYNODAL,Matt,Matt,39,Matt.23,Matt 23,22,Matt.23.37,Matt 23:37,36,"Иерусалим, Иерусалим, избивающий пророков и камнями побивающий посланных к тебе! сколько раз хотел Я собрать детей твоих, как птица собирает птенцов своих под крылья, и вы не захотели!"
ru,RUS_SYNODAL,Matt,Matt,39,Matt.23,Matt 23,22,Matt.23.38,Matt 23:38,37,"Се, оставляется вам дом ваш пуст."
ru,RUS_SYNODAL,Matt,Matt,39,Matt.23,Matt 23,22,Matt.23.39,Matt 23:39,38,"Ибо сказываю вам: не увидите Меня отныне, доколе не воскликнете: благословен Грядый во имя Господне!"
ru,RUS_SYNODAL,Matt,Matt,39,Matt.24,Matt 24,23,Matt.24.1,Matt 24:1,0,"И выйдя, Иисус шел от храма; и приступили ученики Его, чтобы показать Ему здания храма."
ru,RUS_SYNODAL,Matt,Matt,39,Matt.24,Matt 24,23,Matt.24.2,Matt 24:2,1,Иисус же сказал им: видите ли все это? Истинно говорю вам: не останется здесь камня на камне; все будет разрушено.
ru,RUS_SYNODAL,Matt,Matt,39,Matt.24,Matt 24,23,Matt.24.3,Matt 24:3,2,"Когда же сидел Он на горе Елеонской, то приступили к Нему ученики наедине и спросили: скажи нам, когда это будет? и какой признак Твоего пришествия и кончины века?"
ru,RUS_SYNODAL,Matt,Matt,39,Matt.24,Matt 24,23,Matt.24.4,Matt 24:4,3,"Иисус сказал им в ответ: берегитесь, чтобы кто не прельстил вас,"
ru,RUS_SYNODAL,Matt,Matt,39,Matt.24,Matt 24,23,Matt.24.5,Matt 24:5,4,"ибо многие придут под именем Моим, и будут говорить: ""Я Христос"", и многих прельстят."
ru,RUS_SYNODAL,Matt,Matt,39,Matt.24,Matt 24,23,Matt.24.6,Matt 24:6,5,"Также услышите о войнах и о военных слухах. Смотрите, не ужасайтесь, ибо надлежит всему тому быть, но это еще не конец:"
ru,RUS_SYNODAL,Matt,Matt,39,Matt.24,Matt 24,23,Matt.24.7,Matt 24:7,6,"ибо восстанет народ на народ, и царство на царство; и будут глады, моры и землетрясения по местам;"
ru,RUS_SYNODAL,Matt,Matt,39,Matt.24,Matt 24,23,Matt.24.8,Matt 24:8,7,все же это – начало болезней.
ru,RUS_SYNODAL,Matt,Matt,39,Matt.24,Matt 24,23,Matt.24.9,Matt 24:9,8,Тогда будут предавать вас на мучения и убивать вас; и вы будете ненавидимы всеми народами за имя Мое;
ru,RUS_SYNODAL,Matt,Matt,39,Matt.24,Matt 24,23,Matt.24.10,Matt 24:10,9,"и тогда соблазнятся многие, и друг друга будут предавать, и возненавидят друг друга;"
ru,RUS_SYNODAL,Matt,Matt,39,Matt.24,Matt 24,23,Matt.24.11,Matt 24:11,10,"и многие лжепророки восстанут, и прельстят многих;"
ru,RUS_SYNODAL,Matt,Matt,39,Matt.24,Matt 24,23,Matt.24.12,Matt 24:12,11,"и, по причине умножения беззакония, во многих охладеет любовь;"
ru,RUS_SYNODAL,Matt,Matt,39,Matt.24,Matt 24,23,Matt.24.13,Matt 24:13,12,претерпевший же до конца спасется.
ru,RUS_SYNODAL,Matt,Matt,39,Matt.24,Matt 24,23,Matt.24.14,Matt 24:14,13,"И проповедано будет сие Евангелие Царствия по всей вселенной, во свидетельство всем народам; и тогда придет конец."
ru,RUS_SYNODAL,Matt,Matt,39,Matt.24,Matt 24,23,Matt.24.15,Matt 24:15,14,"Итак, когда увидите мерзость запустения, реченную через пророка Даниила, стоящую на святом месте, – читающий да разумеет, –"
ru,RUS_SYNODAL,Matt,Matt,39,Matt.24,Matt 24,23,Matt.24.16,Matt 24:16,15,тогда находящиеся в Иудее да бегут в горы;
ru,RUS_SYNODAL,Matt,Matt,39,Matt.24,Matt 24,23,Matt.24.17,Matt 24:17,16,"и кто на кровле, тот да не сходит взять что–нибудь из дома своего;"
ru,RUS_SYNODAL,Matt,Matt,39,Matt.24,Matt 24,23,Matt.24.18,Matt 24:18,17,"и кто на поле, тот да не обращается назад взять одежды свои."
ru,RUS_SYNODAL,Matt,Matt,39,Matt.24,Matt 24,23,Matt.24.19,Matt 24:19,18,Горе же беременным и питающим сосцами в те дни!
ru,RUS_SYNODAL,Matt,Matt,39,Matt.24,Matt 24,23,Matt.24.20,Matt 24:20,19,"Молитесь, чтобы не случилось бегство ваше зимою или в субботу,"
ru,RUS_SYNODAL,Matt,Matt,39,Matt.24,Matt 24,23,Matt.24.21,Matt 24:21,20,"ибо тогда будет великая скорбь, какой не было от начала мира доныне, и не будет."
ru,RUS_SYNODAL,Matt,Matt,39,Matt.24,Matt 24,23,Matt.24.22,Matt 24:22,21,"И если бы не сократились те дни, то не спаслась бы никакая плоть; но ради избранных сократятся те дни."
ru,RUS_SYNODAL,Matt,Matt,39,Matt.24,Matt 24,23,Matt.24.23,Matt 24:23,22,"Тогда, если кто скажет вам: вот, здесь Христос, или там, – не верьте."
ru,RUS_SYNODAL,Matt,Matt,39,Matt.24,Matt 24,23,Matt.24.24,Matt 24:24,23,"Ибо восстанут лжехристы и лжепророки, и дадут великие знамения и чудеса, чтобы прельстить, если возможно, и избранных."
ru,RUS_SYNODAL,Matt,Matt,39,Matt.24,Matt 24,23,Matt.24.25,Matt 24:25,24,"Вот, Я наперед сказал вам."
ru,RUS_SYNODAL,Matt,Matt,39,Matt.24,Matt 24,23,Matt.24.26,Matt 24:26,25,"Итак, если скажут вам: ""вот, [Он] в пустыне"", – не выходите; ""вот, [Он] в потаенных комнатах"", – не верьте;"
ru,RUS_SYNODAL,Matt,Matt,39,Matt.24,Matt 24,23,Matt.24.27,Matt 24:27,26,"ибо, как молния исходит от востока и видна бывает даже до запада, так будет пришествие Сына Человеческого;"
ru,RUS_SYNODAL,Matt,Matt,39,Matt.24,Matt 24,23,Matt.24.28,Matt 24:28,27,"ибо, где будет труп, там соберутся орлы."
ru,RUS_SYNODAL,Matt,Matt,39,Matt.24,Matt 24,23,Matt.24.29,Matt 24:29,28,"И вдруг, после скорби дней тех, солнце померкнет, и луна не даст света своего, и звезды спадут с неба, и силы небесные поколеблются;"
ru,RUS_SYNODAL,Matt,Matt,39,Matt.24,Matt 24,23,Matt.24.30,Matt 24:30,29,"тогда явится знамение Сына Человеческого на небе; и тогда восплачутся все племена земные и увидят Сына Человеческого, грядущего на облаках небесных с силою и славою великою;"
ru,RUS_SYNODAL,Matt,Matt,39,Matt.24,Matt 24,23,Matt.24.31,Matt 24:31,30,"и пошлет Ангелов Своих с трубою громогласною, и соберут избранных Его от четырех ветров, от края небес до края их."
ru,RUS_SYNODAL,Matt,Matt,39,Matt.24,Matt 24,23,Matt.24.32,Matt 24:32,31,"От смоковницы возьмите подобие: когда ветви ее становятся уже мягки и пускают листья, то знаете, что близко лето;"
ru,RUS_SYNODAL,Matt,Matt,39,Matt.24,Matt 24,23,Matt.24.33,Matt 24:33,32,"так, когда вы увидите все сие, знайте, что близко, при дверях."
ru,RUS_SYNODAL,Matt,Matt,39,Matt.24,Matt 24,23,Matt.24.34,Matt 24:34,33,"Истинно говорю вам: не прейдет род сей, как все сие будет;"
ru,RUS_SYNODAL,Matt,Matt,39,Matt.24,Matt 24,23,Matt.24.35,Matt 24:35,34,"небо и земля прейдут, но слова Мои не прейдут."
ru,RUS_SYNODAL,Matt,Matt,39,Matt.24,Matt 24,23,Matt.24.36,Matt 24:36,35,"О дне же том и часе никто не знает, ни Ангелы небесные, а только Отец Мой один;"
ru,RUS_SYNODAL,Matt,Matt,39,Matt.24,Matt 24,23,Matt.24.37,Matt 24:37,36,"но, как было во дни Ноя, так будет и в пришествие Сына Человеческого:"
ru,RUS_SYNODAL,Matt,Matt,39,Matt.24,Matt 24,23,Matt.24.38,Matt 24:38,37,"ибо, как во дни перед потопом ели, пили, женились и выходили замуж, до того дня, как вошел Ной в ковчег,"
ru,RUS_SYNODAL,Matt,Matt,39,Matt.24,Matt 24,23,Matt.24.39,Matt 24:39,38,"и не думали, пока не пришел потоп и не истребил всех, – так будет и пришествие Сына Человеческого;"
ru,RUS_SYNODAL,Matt,Matt,39,Matt.24,Matt 24,23,Matt.24.40,Matt 24:40,39,"тогда будут двое на поле: один берется, а другой оставляется;"
ru,RUS_SYNODAL,Matt,Matt,39,Matt.24,Matt 24,23,Matt.24.41,Matt 24:41,40,"две мелющие в жерновах: одна берется, а другая оставляется."
