languageCode,code,bookOsisId,bookSblId,bookOrderIndex,chapterOsisId,chapterSblId,chapterOrderIndex,verseOsisId,verseSblId,verseOrderIndex,text
ru,RUS_SYNODAL,Mark,Mark,40,Mark.6,Mark 6,5,Mark.6.31,Mark 6:31,30,"Он сказал им: пойдите вы одни в пустынное место и отдохните немного, – ибо много было приходящих и отходящих, так что и есть им было некогда."
ru,RUS_SYNODAL,Mark,Mark,40,Mark.6,Mark 6,5,Mark.6.32,Mark 6:32,31,И отправились в пустынное место в лодке одни.
ru,RUS_SYNODAL,Mark,Mark,40,Mark.6,Mark 6,5,Mark.6.33,Mark 6:33,32,"Народ увидел, [как] они отправлялись, и многие узнали их; и бежали туда пешие из всех городов, и предупредили их, и собрались к Нему."
ru,RUS_SYNODAL,Mark,Mark,40,Mark.6,Mark 6,5,Mark.6.34,Mark 6:34,33,"Иисус, выйдя, увидел множество народа и сжалился над ними, потому что они были, как овцы, не имеющие пастыря; и начал учить их много."
ru,RUS_SYNODAL,Mark,Mark,40,Mark.6,Mark 6,5,Mark.6.35,Mark 6:35,34,"И как времени прошло много, ученики Его, приступив к Нему, говорят: место [здесь] пустынное, а времени уже много, –"
ru,RUS_SYNODAL,Mark,Mark,40,Mark.6,Mark 6,5,Mark.6.36,Mark 6:36,35,"отпусти их, чтобы они пошли в окрестные деревни и селения и купили себе хлеба, ибо им нечего есть."
ru,RUS_SYNODAL,Mark,Mark,40,Mark.6,Mark 6,5,Mark.6.37,Mark 6:37,36,Он сказал им в ответ: вы дайте им есть. И сказали Ему: разве нам пойти купить хлеба динариев на двести и дать им есть?
ru,RUS_SYNODAL,Mark,Mark,40,Mark.6,Mark 6,5,Mark.6.38,Mark 6:38,37,"Но Он спросил их: сколько у вас хлебов? пойдите, посмотрите. Они, узнав, сказали: пять хлебов и две рыбы."
ru,RUS_SYNODAL,Mark,Mark,40,Mark.6,Mark 6,5,Mark.6.39,Mark 6:39,38,Тогда повелел им рассадить всех отделениями на зеленой траве.
ru,RUS_SYNODAL,Mark,Mark,40,Mark.6,Mark 6,5,Mark.6.40,Mark 6:40,39,"И сели рядами, по сто и по пятидесяти."
ru,RUS_SYNODAL,Mark,Mark,40,Mark.6,Mark 6,5,Mark.6.41,Mark 6:41,40,"Он взял пять хлебов и две рыбы, воззрев на небо, благословил и преломил хлебы и дал ученикам Своим, чтобы они раздали им; и две рыбы разделил на всех."
ru,RUS_SYNODAL,Mark,Mark,40,Mark.6,Mark 6,5,Mark.6.42,Mark 6:42,41,"И ели все, и насытились."
ru,RUS_SYNODAL,Mark,Mark,40,Mark.6,Mark 6,5,Mark.6.43,Mark 6:43,42,И набрали кусков хлеба и [остатков] от рыб двенадцать полных коробов.
ru,RUS_SYNODAL,Mark,Mark,40,Mark.6,Mark 6,5,Mark.6.44,Mark 6:44,43,Было же евших хлебы около пяти тысяч мужей.
ru,RUS_SYNODAL,Mark,Mark,40,Mark.6,Mark 6,5,Mark.6.45,Mark 6:45,44,"И тотчас понудил учеников Своих войти в лодку и отправиться вперед на другую сторону к Вифсаиде, пока Он отпустит народ."
ru,RUS_SYNODAL,Mark,Mark,40,Mark.6,Mark 6,5,Mark.6.46,Mark 6:46,45,"И, отпустив их, пошел на гору помолиться."
ru,RUS_SYNODAL,Mark,Mark,40,Mark.6,Mark 6,5,Mark.6.47,Mark 6:47,46,"Вечером лодка была посреди моря, а Он один на земле."
ru,RUS_SYNODAL,Mark,Mark,40,Mark.6,Mark 6,5,Mark.6.48,Mark 6:48,47,"И увидел их бедствующих в плавании, потому что ветер им был противный; около же четвертой стражи ночи подошел к ним, идя по морю, и хотел миновать их."
ru,RUS_SYNODAL,Mark,Mark,40,Mark.6,Mark 6,5,Mark.6.49,Mark 6:49,48,"Они, увидев Его идущего по морю, подумали, что это призрак, и вскричали."
ru,RUS_SYNODAL,Mark,Mark,40,Mark.6,Mark 6,5,Mark.6.50,Mark 6:50,49,"Ибо все видели Его и испугались. И тотчас заговорил с ними и сказал им: ободритесь; это Я, не бойтесь."
ru,RUS_SYNODAL,Mark,Mark,40,Mark.6,Mark 6,5,Mark.6.51,Mark 6:51,50,"И вошел к ним в лодку, и ветер утих. И они чрезвычайно изумлялись в себе и дивились,"
ru,RUS_SYNODAL,Mark,Mark,40,Mark.6,Mark 6,5,Mark.6.52,Mark 6:52,51,"ибо не вразумились [чудом] над хлебами, потому что сердце их было окаменено."
ru,RUS_SYNODAL,Mark,Mark,40,Mark.6,Mark 6,5,Mark.6.53,Mark 6:53,52,"И, переправившись, прибыли в землю Геннисаретскую и пристали [к] [берегу]."
ru,RUS_SYNODAL,Mark,Mark,40,Mark.6,Mark 6,5,Mark.6.54,Mark 6:54,53,"Когда вышли они из лодки, тотчас [жители], узнав Его,"
ru,RUS_SYNODAL,Mark,Mark,40,Mark.6,Mark 6,5,Mark.6.55,Mark 6:55,54,"обежали всю окрестность ту и начали на постелях приносить больных туда, где Он, как слышно было, находился."
ru,RUS_SYNODAL,Mark,Mark,40,Mark.6,Mark 6,5,Mark.6.56,Mark 6:56,55,"И куда ни приходил Он, в селения ли, в города ли, в деревни ли, клали больных на открытых местах и просили Его, чтобы им прикоснуться хотя к краю одежды Его; и которые прикасались к Нему, исцелялись."
ru,RUS_SYNODAL,Mark,Mark,40,Mark.7,Mark 7,6,Mark.7.1,Mark 7:1,0,"Собрались к Нему фарисеи и некоторые из книжников, пришедшие из Иерусалима,"
ru,RUS_SYNODAL,Mark,Mark,40,Mark.7,Mark 7,6,Mark.7.2,Mark 7:2,1,"и, увидев некоторых из учеников Его, евших хлеб нечистыми, то есть неумытыми, руками, укоряли."
ru,RUS_SYNODAL,Mark,Mark,40,Mark.7,Mark 7,6,Mark.7.3,Mark 7:3,2,"Ибо фарисеи и все Иудеи, держась предания старцев, не едят, не умыв тщательно рук;"
ru,RUS_SYNODAL,Mark,Mark,40,Mark.7,Mark 7,6,Mark.7.4,Mark 7:4,3,"и, [придя] с торга, не едят не омывшись. Есть и многое другое, чего они приняли держаться: наблюдать омовение чаш, кружек, котлов и скамей."
ru,RUS_SYNODAL,Mark,Mark,40,Mark.7,Mark 7,6,Mark.7.5,Mark 7:5,4,"Потом спрашивают Его фарисеи и книжники: зачем ученики Твои не поступают по преданию старцев, но неумытыми руками едят хлеб?"
ru,RUS_SYNODAL,Mark,Mark,40,Mark.7,Mark 7,6,Mark.7.6,Mark 7:6,5,"Он сказал им в ответ: хорошо пророчествовал о вас, лицемерах, Исаия, как написано: люди сии чтут Меня устами, сердце же их далеко отстоит от Меня,"
ru,RUS_SYNODAL,Mark,Mark,40,Mark.7,Mark 7,6,Mark.7.7,Mark 7:7,6,"но тщетно чтут Меня, уча учениям, заповедям человеческим."
ru,RUS_SYNODAL,Mark,Mark,40,Mark.7,Mark 7,6,Mark.7.8,Mark 7:8,7,"Ибо вы, оставив заповедь Божию, держитесь предания человеческого, омовения кружек и чаш, и делаете многое другое, сему подобное."
ru,RUS_SYNODAL,Mark,Mark,40,Mark.7,Mark 7,6,Mark.7.9,Mark 7:9,8,"И сказал им: хорошо ли, [что] вы отменяете заповедь Божию, чтобы соблюсти свое предание?"
ru,RUS_SYNODAL,Mark,Mark,40,Mark.7,Mark 7,6,Mark.7.10,Mark 7:10,9,Ибо Моисей сказал: почитай отца своего и мать свою; и: злословящий отца или мать смертью да умрет.
ru,RUS_SYNODAL,Mark,Mark,40,Mark.7,Mark 7,6,Mark.7.11,Mark 7:11,10,"А вы говорите: кто скажет отцу или матери: корван, то есть дар [Богу] то, чем бы ты от меня пользовался,"
ru,RUS_SYNODAL,Mark,Mark,40,Mark.7,Mark 7,6,Mark.7.12,Mark 7:12,11,"тому вы уже попускаете ничего не делать для отца своего или матери своей,"
ru,RUS_SYNODAL,Mark,Mark,40,Mark.7,Mark 7,6,Mark.7.13,Mark 7:13,12,"устраняя слово Божие преданием вашим, которое вы установили; и делаете многое сему подобное."
ru,RUS_SYNODAL,Mark,Mark,40,Mark.7,Mark 7,6,Mark.7.14,Mark 7:14,13,"И, призвав весь народ, говорил им: слушайте Меня все и разумейте:"
ru,RUS_SYNODAL,Mark,Mark,40,Mark.7,Mark 7,6,Mark.7.15,Mark 7:15,14,"ничто, входящее в человека извне, не может осквернить его; но что исходит из него, то оскверняет человека."
ru,RUS_SYNODAL,Mark,Mark,40,Mark.7,Mark 7,6,Mark.7.16,Mark 7:16,15,"Если кто имеет уши слышать, да слышит!"
ru,RUS_SYNODAL,Mark,Mark,40,Mark.7,Mark 7,6,Mark.7.17,Mark 7:17,16,"И когда Он от народа вошел в дом, ученики Его спросили Его о притче."
ru,RUS_SYNODAL,Mark,Mark,40,Mark.7,Mark 7,6,Mark.7.18,Mark 7:18,17,"Он сказал им: неужели и вы так непонятливы? Неужели не разумеете, что ничто, извне входящее в человека, не может осквернить его?"
ru,RUS_SYNODAL,Mark,Mark,40,Mark.7,Mark 7,6,Mark.7.19,Mark 7:19,18,"Потому что не в сердце его входит, а в чрево, и выходит вон, [чем] очищается всякая пища."
ru,RUS_SYNODAL,Mark,Mark,40,Mark.7,Mark 7,6,Mark.7.20,Mark 7:20,19,Далее сказал: исходящее из человека оскверняет человека.
ru,RUS_SYNODAL,Mark,Mark,40,Mark.7,Mark 7,6,Mark.7.21,Mark 7:21,20,"Ибо извнутрь, из сердца человеческого, исходят злые помыслы, прелюбодеяния, любодеяния, убийства,"
ru,RUS_SYNODAL,Mark,Mark,40,Mark.7,Mark 7,6,Mark.7.22,Mark 7:22,21,"кражи, лихоимство, злоба, коварство, непотребство, завистливое око, богохульство, гордость, безумство, –"
ru,RUS_SYNODAL,Mark,Mark,40,Mark.7,Mark 7,6,Mark.7.23,Mark 7:23,22,все это зло извнутрь исходит и оскверняет человека.
ru,RUS_SYNODAL,Mark,Mark,40,Mark.7,Mark 7,6,Mark.7.24,Mark 7:24,23,"И, отправившись оттуда, пришел в пределы Тирские и Сидонские; и, войдя в дом, не хотел, чтобы кто узнал; но не мог утаиться."
ru,RUS_SYNODAL,Mark,Mark,40,Mark.7,Mark 7,6,Mark.7.25,Mark 7:25,24,"Ибо услышала о Нем женщина, у которой дочь одержима была нечистым духом, и, придя, припала к ногам Его;"
ru,RUS_SYNODAL,Mark,Mark,40,Mark.7,Mark 7,6,Mark.7.26,Mark 7:26,25,"а женщина та была язычница, родом сирофиникиянка; и просила Его, чтобы изгнал беса из ее дочери."
ru,RUS_SYNODAL,Mark,Mark,40,Mark.7,Mark 7,6,Mark.7.27,Mark 7:27,26,"Но Иисус сказал ей: дай прежде насытиться детям, ибо нехорошо взять хлеб у детей и бросить псам."
ru,RUS_SYNODAL,Mark,Mark,40,Mark.7,Mark 7,6,Mark.7.28,Mark 7:28,27,"Она же сказала Ему в ответ: так, Господи; но и псы под столом едят крохи у детей."
ru,RUS_SYNODAL,Mark,Mark,40,Mark.7,Mark 7,6,Mark.7.29,Mark 7:29,28,"И сказал ей: за это слово, пойди; бес вышел из твоей дочери."
ru,RUS_SYNODAL,Mark,Mark,40,Mark.7,Mark 7,6,Mark.7.30,Mark 7:30,29,"И, придя в свой дом, она нашла, что бес вышел и дочь лежит на постели."
ru,RUS_SYNODAL,Mark,Mark,40,Mark.7,Mark 7,6,Mark.7.31,Mark 7:31,30,"Выйдя из пределов Тирских и Сидонских, [Иисус] опять пошел к морю Галилейскому через пределы Десятиградия."
ru,RUS_SYNODAL,Mark,Mark,40,Mark.7,Mark 7,6,Mark.7.32,Mark 7:32,31,Привели к Нему глухого косноязычного и просили Его возложить на него руку.
ru,RUS_SYNODAL,Mark,Mark,40,Mark.7,Mark 7,6,Mark.7.33,Mark 7:33,32,"[Иисус], отведя его в сторону от народа, вложил персты Свои в уши ему и, плюнув, коснулся языка его;"
ru,RUS_SYNODAL,Mark,Mark,40,Mark.7,Mark 7,6,Mark.7.34,Mark 7:34,33,"и, воззрев на небо, вздохнул и сказал ему: ""еффафа"", то есть: отверзись."
ru,RUS_SYNODAL,Mark,Mark,40,Mark.7,Mark 7,6,Mark.7.35,Mark 7:35,34,"И тотчас отверзся у него слух и разрешились узы его языка, и стал говорить чисто."
ru,RUS_SYNODAL,Mark,Mark,40,Mark.7,Mark 7,6,Mark.7.36,Mark 7:36,35,"И повелел им не сказывать никому. Но сколько Он ни запрещал им, они еще более разглашали."
ru,RUS_SYNODAL,Mark,Mark,40,Mark.7,Mark 7,6,Mark.7.37,Mark 7:37,36,"И чрезвычайно дивились, и говорили: все хорошо делает, – и глухих делает слышащими, и немых – говорящими."
ru,RUS_SYNODAL,Mark,Mark,40,Mark.8,Mark 8,7,Mark.8.1,Mark 8:1,0,"В те дни, когда собралось весьма много народа и нечего было им есть, Иисус, призвав учеников Своих, сказал им:"
ru,RUS_SYNODAL,Mark,Mark,40,Mark.8,Mark 8,7,Mark.8.2,Mark 8:2,1,"жаль Мне народа, что уже три дня находятся при Мне, и нечего им есть."
ru,RUS_SYNODAL,Mark,Mark,40,Mark.8,Mark 8,7,Mark.8.3,Mark 8:3,2,"Если неевшими отпущу их в домы их, ослабеют в дороге, ибо некоторые из них пришли издалека."
ru,RUS_SYNODAL,Mark,Mark,40,Mark.8,Mark 8,7,Mark.8.4,Mark 8:4,3,"Ученики Его отвечали Ему: откуда мог бы кто [взять] здесь в пустыне хлебов, чтобы накормить их?"
ru,RUS_SYNODAL,Mark,Mark,40,Mark.8,Mark 8,7,Mark.8.5,Mark 8:5,4,И спросил их: сколько у вас хлебов? Они сказали: семь.
ru,RUS_SYNODAL,Mark,Mark,40,Mark.8,Mark 8,7,Mark.8.6,Mark 8:6,5,"Тогда велел народу возлечь на землю; и, взяв семь хлебов и воздав благодарение, преломил и дал ученикам Своим, чтобы они раздали; и они раздали народу."
ru,RUS_SYNODAL,Mark,Mark,40,Mark.8,Mark 8,7,Mark.8.7,Mark 8:7,6,"Было у них и немного рыбок: благословив, Он велел раздать и их."
ru,RUS_SYNODAL,Mark,Mark,40,Mark.8,Mark 8,7,Mark.8.8,Mark 8:8,7,"И ели, и насытились; и набрали оставшихся кусков семь корзин."
ru,RUS_SYNODAL,Mark,Mark,40,Mark.8,Mark 8,7,Mark.8.9,Mark 8:9,8,Евших же было около четырех тысяч. И отпустил их.
ru,RUS_SYNODAL,Mark,Mark,40,Mark.8,Mark 8,7,Mark.8.10,Mark 8:10,9,"И тотчас войдя в лодку с учениками Своими, прибыл в пределы Далмануфские."
ru,RUS_SYNODAL,Mark,Mark,40,Mark.8,Mark 8,7,Mark.8.11,Mark 8:11,10,"Вышли фарисеи, начали с Ним спорить и требовали от Него знамения с неба, искушая Его."
ru,RUS_SYNODAL,Mark,Mark,40,Mark.8,Mark 8,7,Mark.8.12,Mark 8:12,11,"И Он, глубоко вздохнув, сказал: для чего род сей требует знамения? Истинно говорю вам, не дастся роду сему знамение."
ru,RUS_SYNODAL,Mark,Mark,40,Mark.8,Mark 8,7,Mark.8.13,Mark 8:13,12,"И, оставив их, опять вошел в лодку и отправился на ту сторону."
ru,RUS_SYNODAL,Mark,Mark,40,Mark.8,Mark 8,7,Mark.8.14,Mark 8:14,13,При сем ученики Его забыли взять хлебов и кроме одного хлеба не имели с собою в лодке.
ru,RUS_SYNODAL,Mark,Mark,40,Mark.8,Mark 8,7,Mark.8.15,Mark 8:15,14,"А Он заповедал им, говоря: смотрите, берегитесь закваски фарисейской и закваски Иродовой."
ru,RUS_SYNODAL,Mark,Mark,40,Mark.8,Mark 8,7,Mark.8.16,Mark 8:16,15,"И, рассуждая между собою, говорили: [это значит], что хлебов нет у нас."
ru,RUS_SYNODAL,Mark,Mark,40,Mark.8,Mark 8,7,Mark.8.17,Mark 8:17,16,"Иисус, уразумев, говорит им: что рассуждаете о том, что нет у вас хлебов? Еще ли не понимаете и не разумеете? Еще ли окаменено у вас сердце?"
ru,RUS_SYNODAL,Mark,Mark,40,Mark.8,Mark 8,7,Mark.8.18,Mark 8:18,17,"Имея очи, не видите? имея уши, не слышите? и не помните?"
ru,RUS_SYNODAL,Mark,Mark,40,Mark.8,Mark 8,7,Mark.8.19,Mark 8:19,18,"Когда Я пять хлебов преломил для пяти тысяч [человек], сколько полных коробов набрали вы кусков? Говорят Ему: двенадцать."
ru,RUS_SYNODAL,Mark,Mark,40,Mark.8,Mark 8,7,Mark.8.20,Mark 8:20,19,"А когда семь для четырех тысяч, сколько корзин набрали вы оставшихся кусков. Сказали: семь."
ru,RUS_SYNODAL,Mark,Mark,40,Mark.8,Mark 8,7,Mark.8.21,Mark 8:21,20,И сказал им: как же не разумеете?
ru,RUS_SYNODAL,Mark,Mark,40,Mark.8,Mark 8,7,Mark.8.22,Mark 8:22,21,"Приходит в Вифсаиду; и приводят к Нему слепого и просят, чтобы прикоснулся к нему."
ru,RUS_SYNODAL,Mark,Mark,40,Mark.8,Mark 8,7,Mark.8.23,Mark 8:23,22,"Он, взяв слепого за руку, вывел его вон из селения и, плюнув ему на глаза, возложил на него руки и спросил его: видит ли что?"
ru,RUS_SYNODAL,Mark,Mark,40,Mark.8,Mark 8,7,Mark.8.24,Mark 8:24,23,"Он, взглянув, сказал: вижу проходящих людей, как деревья."
ru,RUS_SYNODAL,Mark,Mark,40,Mark.8,Mark 8,7,Mark.8.25,Mark 8:25,24,Потом опять возложил руки на глаза ему и велел ему взглянуть. И он исцелел и стал видеть все ясно.
ru,RUS_SYNODAL,Mark,Mark,40,Mark.8,Mark 8,7,Mark.8.26,Mark 8:26,25,"И послал его домой, сказав: не заходи в селение и не рассказывай никому в селении."
ru,RUS_SYNODAL,Mark,Mark,40,Mark.8,Mark 8,7,Mark.8.27,Mark 8:27,26,И пошел Иисус с учениками Своими в селения Кесарии Филипповой. Дорогою Он спрашивал учеников Своих: за кого почитают Меня люди?
ru,RUS_SYNODAL,Mark,Mark,40,Mark.8,Mark 8,7,Mark.8.28,Mark 8:28,27,Они отвечали: за Иоанна Крестителя; другие же – за Илию; а иные – за одного из пророков.
ru,RUS_SYNODAL,Mark,Mark,40,Mark.8,Mark 8,7,Mark.8.29,Mark 8:29,28,Он говорит им: а вы за кого почитаете Меня? Петр сказал Ему в ответ: Ты Христос.
ru,RUS_SYNODAL,Mark,Mark,40,Mark.8,Mark 8,7,Mark.8.30,Mark 8:30,29,"И запретил им, чтобы никому не говорили о Нем."
ru,RUS_SYNODAL,Mark,Mark,40,Mark.8,Mark 8,7,Mark.8.31,Mark 8:31,30,"И начал учить их, что Сыну Человеческому много должно пострадать, быть отвержену старейшинами, первосвященниками и книжниками, и быть убиту, и в третий день воскреснуть."
ru,RUS_SYNODAL,Mark,Mark,40,Mark.8,Mark 8,7,Mark.8.32,Mark 8:32,31,"И говорил о сем открыто. Но Петр, отозвав Его, начал прекословить Ему."
ru,RUS_SYNODAL,Mark,Mark,40,Mark.8,Mark 8,7,Mark.8.33,Mark 8:33,32,"Он же, обратившись и взглянув на учеников Своих, воспретил Петру, сказав: отойди от Меня, сатана, потому что ты думаешь не о том, что Божие, но что человеческое."
ru,RUS_SYNODAL,Mark,Mark,40,Mark.8,Mark 8,7,Mark.8.34,Mark 8:34,33,"И, подозвав народ с учениками Своими, сказал им: кто хочет идти за Мною, отвергнись себя, и возьми крест свой, и следуй за Мною."
ru,RUS_SYNODAL,Mark,Mark,40,Mark.8,Mark 8,7,Mark.8.35,Mark 8:35,34,"Ибо кто хочет душу свою сберечь, тот потеряет ее, а кто потеряет душу свою ради Меня и Евангелия, тот сбережет ее."
ru,RUS_SYNODAL,Mark,Mark,40,Mark.8,Mark 8,7,Mark.8.36,Mark 8:36,35,"Ибо какая польза человеку, если он приобретет весь мир, а душе своей повредит?"
ru,RUS_SYNODAL,Mark,Mark,40,Mark.8,Mark 8,7,Mark.8.37,Mark 8:37,36,Или какой выкуп даст человек за душу свою?
ru,RUS_SYNODAL,Mark,Mark,40,Mark.8,Mark 8,7,Mark.8.38,Mark 8:38,37,"Ибо кто постыдится Меня и Моих слов в роде сем прелюбодейном и грешном, того постыдится и Сын Человеческий, когда приидет в славе Отца Своего со святыми Ангелами."
ru,RUS_SYNODAL,Mark,Mark,40,Mark.9,Mark 9,8,Mark.9.1,Mark 9:1,0,"И сказал им: истинно говорю вам: есть некоторые из стоящих здесь, которые не вкусят смерти, как уже увидят Царствие Божие, пришедшее в силе."
ru,RUS_SYNODAL,Mark,Mark,40,Mark.9,Mark 9,8,Mark.9.2,Mark 9:2,1,"И, по прошествии дней шести, взял Иисус Петра, Иакова и Иоанна, и возвел на гору высокую особо их одних, и преобразился перед ними."
ru,RUS_SYNODAL,Mark,Mark,40,Mark.9,Mark 9,8,Mark.9.3,Mark 9:3,2,"Одежды Его сделались блистающими, весьма белыми, как снег, как на земле белильщик не может выбелить."
ru,RUS_SYNODAL,Mark,Mark,40,Mark.9,Mark 9,8,Mark.9.4,Mark 9:4,3,И явился им Илия с Моисеем; и беседовали с Иисусом.
ru,RUS_SYNODAL,Mark,Mark,40,Mark.9,Mark 9,8,Mark.9.5,Mark 9:5,4,"При сем Петр сказал Иисусу: Равви! хорошо нам здесь быть; сделаем три кущи: Тебе одну, Моисею одну, и одну Илии."
ru,RUS_SYNODAL,Mark,Mark,40,Mark.9,Mark 9,8,Mark.9.6,Mark 9:6,5,"Ибо не знал, что сказать; потому что они были в страхе."
ru,RUS_SYNODAL,Mark,Mark,40,Mark.9,Mark 9,8,Mark.9.7,Mark 9:7,6,"И явилось облако, осеняющее их, и из облака исшел глас, глаголющий: Сей есть Сын Мой возлюбленный; Его слушайте."
ru,RUS_SYNODAL,Mark,Mark,40,Mark.9,Mark 9,8,Mark.9.8,Mark 9:8,7,"И, внезапно посмотрев вокруг, никого более с собою не видели, кроме одного Иисуса."
