languageCode,code,bookOsisId,bookSblId,bookOrderIndex,chapterOsisId,chapterSblId,chapterOrderIndex,verseOsisId,verseSblId,verseOrderIndex,text
ru,RUS_SYNODAL,Luke,Luke,41,Luke.11,Luke 11,10,Luke.11.22,Luke 11:22,21,"когда же сильнейший его нападет на него и победит его, тогда возьмет все оружие его, на которое он надеялся, и разделит похищенное у него."
ru,RUS_SYNODAL,Luke,Luke,41,Luke.11,Luke 11,10,Luke.11.23,Luke 11:23,22,"Кто не со Мною, тот против Меня; и кто не собирает со Мною, тот расточает."
ru,RUS_SYNODAL,Luke,Luke,41,Luke.11,Luke 11,10,Luke.11.24,Luke 11:24,23,"Когда нечистый дух выйдет из человека, то ходит по безводным местам, ища покоя, и, не находя, говорит: возвращусь в дом мой, откуда вышел;"
ru,RUS_SYNODAL,Luke,Luke,41,Luke.11,Luke 11,10,Luke.11.25,Luke 11:25,24,"и, придя, находит его выметенным и убранным;"
ru,RUS_SYNODAL,Luke,Luke,41,Luke.11,Luke 11,10,Luke.11.26,Luke 11:26,25,"тогда идет и берет с собою семь других духов, злейших себя, и, войдя, живут там, – и бывает для человека того последнее хуже первого."
ru,RUS_SYNODAL,Luke,Luke,41,Luke.11,Luke 11,10,Luke.11.27,Luke 11:27,26,"Когда же Он говорил это, одна женщина, возвысив голос из народа, сказала Ему: блаженно чрево, носившее Тебя, и сосцы, Тебя питавшие!"
ru,RUS_SYNODAL,Luke,Luke,41,Luke.11,Luke 11,10,Luke.11.28,Luke 11:28,27,А Он сказал: блаженны слышащие слово Божие и соблюдающие его.
ru,RUS_SYNODAL,Luke,Luke,41,Luke.11,Luke 11,10,Luke.11.29,Luke 11:29,28,"Когда же народ стал сходиться во множестве, Он начал говорить: род сей лукав, он ищет знамения, и знамение не дастся ему, кроме знамения Ионы пророка;"
ru,RUS_SYNODAL,Luke,Luke,41,Luke.11,Luke 11,10,Luke.11.30,Luke 11:30,29,"ибо как Иона был знамением для Ниневитян, так будет и Сын Человеческий для рода сего."
ru,RUS_SYNODAL,Luke,Luke,41,Luke.11,Luke 11,10,Luke.11.31,Luke 11:31,30,"Царица южная восстанет на суд с людьми рода сего и осудит их, ибо она приходила от пределов земли послушать мудрости Соломоновой; и вот, здесь больше Соломона."
ru,RUS_SYNODAL,Luke,Luke,41,Luke.11,Luke 11,10,Luke.11.32,Luke 11:32,31,"Ниневитяне восстанут на суд с родом сим и осудят его, ибо они покаялись от проповеди Иониной, и вот, здесь больше Ионы."
ru,RUS_SYNODAL,Luke,Luke,41,Luke.11,Luke 11,10,Luke.11.33,Luke 11:33,32,"Никто, зажегши свечу, не ставит ее в сокровенном месте, ни под сосудом, но на подсвечнике, чтобы входящие видели свет."
ru,RUS_SYNODAL,Luke,Luke,41,Luke.11,Luke 11,10,Luke.11.34,Luke 11:34,33,"Светильник тела есть око; итак, если око твое будет чисто, то и все тело твое будет светло; а если оно будет худо, то и тело твое будет темно."
ru,RUS_SYNODAL,Luke,Luke,41,Luke.11,Luke 11,10,Luke.11.35,Luke 11:35,34,"Итак, смотри: свет, который в тебе, не есть ли тьма?"
ru,RUS_SYNODAL,Luke,Luke,41,Luke.11,Luke 11,10,Luke.11.36,Luke 11:36,35,"Если же тело твое все светло и не имеет ни одной темной части, то будет светло все так, как бы светильник освещал тебя сиянием."
ru,RUS_SYNODAL,Luke,Luke,41,Luke.11,Luke 11,10,Luke.11.37,Luke 11:37,36,"Когда Он говорил это, один фарисей просил Его к себе обедать. Он пришел и возлег."
ru,RUS_SYNODAL,Luke,Luke,41,Luke.11,Luke 11,10,Luke.11.38,Luke 11:38,37,"Фарисей же удивился, увидев, что Он не умыл [рук] перед обедом."
ru,RUS_SYNODAL,Luke,Luke,41,Luke.11,Luke 11,10,Luke.11.39,Luke 11:39,38,"Но Господь сказал ему: ныне вы, фарисеи, внешность чаши и блюда очищаете, а внутренность ваша исполнена хищения и лукавства."
ru,RUS_SYNODAL,Luke,Luke,41,Luke.11,Luke 11,10,Luke.11.40,Luke 11:40,39,"Неразумные! не Тот же ли, Кто сотворил внешнее, сотворил и внутреннее?"
ru,RUS_SYNODAL,Luke,Luke,41,Luke.11,Luke 11,10,Luke.11.41,Luke 11:41,40,"Подавайте лучше милостыню из того, что у вас есть, тогда все будет у вас чисто."
ru,RUS_SYNODAL,Luke,Luke,41,Luke.11,Luke 11,10,Luke.11.42,Luke 11:42,41,"Но горе вам, фарисеям, что даете десятину с мяты, руты и всяких овощей, и нерадите о суде и любви Божией: сие надлежало делать, и того не оставлять."
ru,RUS_SYNODAL,Luke,Luke,41,Luke.11,Luke 11,10,Luke.11.43,Luke 11:43,42,"Горе вам, фарисеям, что любите председания в синагогах и приветствия в народных собраниях."
ru,RUS_SYNODAL,Luke,Luke,41,Luke.11,Luke 11,10,Luke.11.44,Luke 11:44,43,"Горе вам, книжники и фарисеи, лицемеры, что вы – как гробы скрытые, над которыми люди ходят и не знают того."
ru,RUS_SYNODAL,Luke,Luke,41,Luke.11,Luke 11,10,Luke.11.45,Luke 11:45,44,"На это некто из законников сказал Ему: Учитель! говоря это, Ты и нас обижаешь."
ru,RUS_SYNODAL,Luke,Luke,41,Luke.11,Luke 11,10,Luke.11.46,Luke 11:46,45,"Но Он сказал: и вам, законникам, горе, что налагаете на людей бремена неудобоносимые, а сами и одним перстом своим не дотрагиваетесь до них."
ru,RUS_SYNODAL,Luke,Luke,41,Luke.11,Luke 11,10,Luke.11.47,Luke 11:47,46,"Горе вам, что строите гробницы пророкам, которых избили отцы ваши:"
ru,RUS_SYNODAL,Luke,Luke,41,Luke.11,Luke 11,10,Luke.11.48,Luke 11:48,47,"сим вы свидетельствуете о делах отцов ваших и соглашаетесь с ними, ибо они избили пророков, а вы строите им гробницы."
ru,RUS_SYNODAL,Luke,Luke,41,Luke.11,Luke 11,10,Luke.11.49,Luke 11:49,48,"Потому и премудрость Божия сказала: пошлю к ним пророков и Апостолов, и из них одних убьют, а других изгонят,"
ru,RUS_SYNODAL,Luke,Luke,41,Luke.11,Luke 11,10,Luke.11.50,Luke 11:50,49,"да взыщется от рода сего кровь всех пророков, пролитая от создания мира,"
ru,RUS_SYNODAL,Luke,Luke,41,Luke.11,Luke 11,10,Luke.11.51,Luke 11:51,50,"от крови Авеля до крови Захарии, убитого между жертвенником и храмом. Ей, говорю вам, взыщется от рода сего."
ru,RUS_SYNODAL,Luke,Luke,41,Luke.11,Luke 11,10,Luke.11.52,Luke 11:52,51,"Горе вам, законникам, что вы взяли ключ разумения: сами не вошли, и входящим воспрепятствовали."
ru,RUS_SYNODAL,Luke,Luke,41,Luke.11,Luke 11,10,Luke.11.53,Luke 11:53,52,"Когда Он говорил им это, книжники и фарисеи начали сильно приступать к Нему, вынуждая у Него ответы на многое,"
ru,RUS_SYNODAL,Luke,Luke,41,Luke.11,Luke 11,10,Luke.11.54,Luke 11:54,53,"подыскиваясь под Него и стараясь уловить что–нибудь из уст Его, чтобы обвинить Его."
ru,RUS_SYNODAL,Luke,Luke,41,Luke.12,Luke 12,11,Luke.12.1,Luke 12:1,0,"Между тем, когда собрались тысячи народа, так что теснили друг друга, Он начал говорить сперва ученикам Своим: берегитесь закваски фарисейской, которая есть лицемерие."
ru,RUS_SYNODAL,Luke,Luke,41,Luke.12,Luke 12,11,Luke.12.2,Luke 12:2,1,"Нет ничего сокровенного, что не открылось бы, и тайного, чего не узнали бы."
ru,RUS_SYNODAL,Luke,Luke,41,Luke.12,Luke 12,11,Luke.12.3,Luke 12:3,2,"Посему, что вы сказали в темноте, то услышится во свете; и что говорили на ухо внутри дома, то будет провозглашено на кровлях."
ru,RUS_SYNODAL,Luke,Luke,41,Luke.12,Luke 12,11,Luke.12.4,Luke 12:4,3,"Говорю же вам, друзьям Моим: не бойтесь убивающих тело и потом не могущих ничего более сделать;"
ru,RUS_SYNODAL,Luke,Luke,41,Luke.12,Luke 12,11,Luke.12.5,Luke 12:5,4,"но скажу вам, кого бояться: бойтесь того, кто, по убиении, может ввергнуть в геенну: ей, говорю вам, того бойтесь."
ru,RUS_SYNODAL,Luke,Luke,41,Luke.12,Luke 12,11,Luke.12.6,Luke 12:6,5,Не пять ли малых птиц продаются за два ассария? и ни одна из них не забыта у Бога.
ru,RUS_SYNODAL,Luke,Luke,41,Luke.12,Luke 12,11,Luke.12.7,Luke 12:7,6,А у вас и волосы на голове все сочтены. Итак не бойтесь: вы дороже многих малых птиц.
ru,RUS_SYNODAL,Luke,Luke,41,Luke.12,Luke 12,11,Luke.12.8,Luke 12:8,7,"Сказываю же вам: всякого, кто исповедает Меня пред человеками, и Сын Человеческий исповедает пред Ангелами Божиими;"
ru,RUS_SYNODAL,Luke,Luke,41,Luke.12,Luke 12,11,Luke.12.9,Luke 12:9,8,"а кто отвергнется Меня пред человеками, тот отвержен будет пред Ангелами Божиими."
ru,RUS_SYNODAL,Luke,Luke,41,Luke.12,Luke 12,11,Luke.12.10,Luke 12:10,9,"И всякому, кто скажет слово на Сына Человеческого, прощено будет; а кто скажет хулу на Святаго Духа, тому не простится."
ru,RUS_SYNODAL,Luke,Luke,41,Luke.12,Luke 12,11,Luke.12.11,Luke 12:11,10,"Когда же приведут вас в синагоги, к начальствам и властям, не заботьтесь, как или что отвечать, или что говорить,"
ru,RUS_SYNODAL,Luke,Luke,41,Luke.12,Luke 12,11,Luke.12.12,Luke 12:12,11,"ибо Святый Дух научит вас в тот час, что должно говорить."
ru,RUS_SYNODAL,Luke,Luke,41,Luke.12,Luke 12,11,Luke.12.13,Luke 12:13,12,"Некто из народа сказал Ему: Учитель! скажи брату моему, чтобы он разделил со мною наследство."
ru,RUS_SYNODAL,Luke,Luke,41,Luke.12,Luke 12,11,Luke.12.14,Luke 12:14,13,Он же сказал человеку тому: кто поставил Меня судить или делить вас?
ru,RUS_SYNODAL,Luke,Luke,41,Luke.12,Luke 12,11,Luke.12.15,Luke 12:15,14,"При этом сказал им: смотрите, берегитесь любостяжания, ибо жизнь человека не зависит от изобилия его имения."
ru,RUS_SYNODAL,Luke,Luke,41,Luke.12,Luke 12,11,Luke.12.16,Luke 12:16,15,И сказал им притчу: у одного богатого человека был хороший урожай в поле;
ru,RUS_SYNODAL,Luke,Luke,41,Luke.12,Luke 12,11,Luke.12.17,Luke 12:17,16,и он рассуждал сам с собою: что мне делать? некуда мне собрать плодов моих?
ru,RUS_SYNODAL,Luke,Luke,41,Luke.12,Luke 12,11,Luke.12.18,Luke 12:18,17,"И сказал: вот что сделаю: сломаю житницы мои и построю большие, и соберу туда весь хлеб мой и все добро мое,"
ru,RUS_SYNODAL,Luke,Luke,41,Luke.12,Luke 12,11,Luke.12.19,Luke 12:19,18,"и скажу душе моей: душа! много добра лежит у тебя на многие годы: покойся, ешь, пей, веселись."
ru,RUS_SYNODAL,Luke,Luke,41,Luke.12,Luke 12,11,Luke.12.20,Luke 12:20,19,"Но Бог сказал ему: безумный! в сию ночь душу твою возьмут у тебя; кому же достанется то, что ты заготовил?"
ru,RUS_SYNODAL,Luke,Luke,41,Luke.12,Luke 12,11,Luke.12.21,Luke 12:21,20,"Так [бывает с тем], кто собирает сокровища для себя, а не в Бога богатеет."
ru,RUS_SYNODAL,Luke,Luke,41,Luke.12,Luke 12,11,Luke.12.22,Luke 12:22,21,"И сказал ученикам Своим: посему говорю вам, – не заботьтесь для души вашей, что вам есть, ни для тела, во что одеться:"
ru,RUS_SYNODAL,Luke,Luke,41,Luke.12,Luke 12,11,Luke.12.23,Luke 12:23,22,"душа больше пищи, и тело – одежды."
ru,RUS_SYNODAL,Luke,Luke,41,Luke.12,Luke 12,11,Luke.12.24,Luke 12:24,23,"Посмотрите на воронов: они не сеют, не жнут; нет у них ни хранилищ, ни житниц, и Бог питает их; сколько же вы лучше птиц?"
ru,RUS_SYNODAL,Luke,Luke,41,Luke.12,Luke 12,11,Luke.12.25,Luke 12:25,24,"Да и кто из вас, заботясь, может прибавить себе роста хотя на один локоть?"
ru,RUS_SYNODAL,Luke,Luke,41,Luke.12,Luke 12,11,Luke.12.26,Luke 12:26,25,"Итак, если и малейшего сделать не можете, что заботитесь о прочем?"
ru,RUS_SYNODAL,Luke,Luke,41,Luke.12,Luke 12,11,Luke.12.27,Luke 12:27,26,"Посмотрите на лилии, как они растут: не трудятся, не прядут; но говорю вам, что и Соломон во всей славе своей не одевался так, как всякая из них."
ru,RUS_SYNODAL,Luke,Luke,41,Luke.12,Luke 12,11,Luke.12.28,Luke 12:28,27,"Если же траву на поле, которая сегодня есть, а завтра будет брошена в печь, Бог так одевает, то кольми паче вас, маловеры!"
ru,RUS_SYNODAL,Luke,Luke,41,Luke.12,Luke 12,11,Luke.12.29,Luke 12:29,28,"Итак, не ищите, что вам есть, или что пить, и не беспокойтесь,"
ru,RUS_SYNODAL,Luke,Luke,41,Luke.12,Luke 12,11,Luke.12.30,Luke 12:30,29,"потому что всего этого ищут люди мира сего; ваш же Отец знает, что вы имеете нужду в том;"
ru,RUS_SYNODAL,Luke,Luke,41,Luke.12,Luke 12,11,Luke.12.31,Luke 12:31,30,"наипаче ищите Царствия Божия, и это все приложится вам."
ru,RUS_SYNODAL,Luke,Luke,41,Luke.12,Luke 12,11,Luke.12.32,Luke 12:32,31,"Не бойся, малое стадо! ибо Отец ваш благоволил дать вам Царство."
ru,RUS_SYNODAL,Luke,Luke,41,Luke.12,Luke 12,11,Luke.12.33,Luke 12:33,32,"Продавайте имения ваши и давайте милостыню. Приготовляйте себе влагалища не ветшающие, сокровище неоскудевающее на небесах, куда вор не приближается и где моль не съедает,"
ru,RUS_SYNODAL,Luke,Luke,41,Luke.12,Luke 12,11,Luke.12.34,Luke 12:34,33,"ибо где сокровище ваше, там и сердце ваше будет."
ru,RUS_SYNODAL,Luke,Luke,41,Luke.12,Luke 12,11,Luke.12.35,Luke 12:35,34,Да будут чресла ваши препоясаны и светильники горящи.
ru,RUS_SYNODAL,Luke,Luke,41,Luke.12,Luke 12,11,Luke.12.36,Luke 12:36,35,"И вы будьте подобны людям, ожидающим возвращения господина своего с брака, дабы, когда придет и постучит, тотчас отворить ему."
ru,RUS_SYNODAL,Luke,Luke,41,Luke.12,Luke 12,11,Luke.12.37,Luke 12:37,36,"Блаженны рабы те, которых господин, придя, найдет бодрствующими; истинно говорю вам, он препояшется и посадит их, и, подходя, станет служить им."
ru,RUS_SYNODAL,Luke,Luke,41,Luke.12,Luke 12,11,Luke.12.38,Luke 12:38,37,"И если придет во вторую стражу, и в третью стражу придет, и найдет их так, то блаженны рабы те."
ru,RUS_SYNODAL,Luke,Luke,41,Luke.12,Luke 12,11,Luke.12.39,Luke 12:39,38,"Вы знаете, что если бы ведал хозяин дома, в который час придет вор, то бодрствовал бы и не допустил бы подкопать дом свой."
ru,RUS_SYNODAL,Luke,Luke,41,Luke.12,Luke 12,11,Luke.12.40,Luke 12:40,39,"Будьте же и вы готовы, ибо, в который час не думаете, приидет Сын Человеческий."
ru,RUS_SYNODAL,Luke,Luke,41,Luke.12,Luke 12,11,Luke.12.41,Luke 12:41,40,"Тогда сказал Ему Петр: Господи! к нам ли притчу сию говоришь, или и ко всем?"
ru,RUS_SYNODAL,Luke,Luke,41,Luke.12,Luke 12,11,Luke.12.42,Luke 12:42,41,"Господь же сказал: кто верный и благоразумный домоправитель, которого господин поставил над слугами своими раздавать им в свое время меру хлеба?"
ru,RUS_SYNODAL,Luke,Luke,41,Luke.12,Luke 12,11,Luke.12.43,Luke 12:43,42,"Блажен раб тот, которого господин его, придя, найдет поступающим так."
ru,RUS_SYNODAL,Luke,Luke,41,Luke.12,Luke 12,11,Luke.12.44,Luke 12:44,43,"Истинно говорю вам, что над всем имением своим поставит его."
ru,RUS_SYNODAL,Luke,Luke,41,Luke.12,Luke 12,11,Luke.12.45,Luke 12:45,44,"Если же раб тот скажет в сердце своем: не скоро придет господин мой, и начнет бить слуг и служанок, есть и пить и напиваться, –"
ru,RUS_SYNODAL,Luke,Luke,41,Luke.12,Luke 12,11,Luke.12.46,Luke 12:46,45,"то придет господин раба того в день, в который он не ожидает, и в час, в который не думает, и рассечет его, и подвергнет его одной участи с неверными."
ru,RUS_SYNODAL,Luke,Luke,41,Luke.12,Luke 12,11,Luke.12.47,Luke 12:47,46,"Раб же тот, который знал волю господина своего, и не был готов, и не делал по воле его, бит будет много;"
ru,RUS_SYNODAL,Luke,Luke,41,Luke.12,Luke 12,11,Luke.12.48,Luke 12:48,47,"а который не знал, и сделал достойное наказания, бит будет меньше. И от всякого, кому дано много, много и потребуется, и кому много вверено, с того больше взыщут."
ru,RUS_SYNODAL,Luke,Luke,41,Luke.12,Luke 12,11,Luke.12.49,Luke 12:49,48,"Огонь пришел Я низвести на землю, и как желал бы, чтобы он уже возгорелся!"
ru,RUS_SYNODAL,Luke,Luke,41,Luke.12,Luke 12,11,Luke.12.50,Luke 12:50,49,"Крещением должен Я креститься; и как Я томлюсь, пока сие совершится!"
ru,RUS_SYNODAL,Luke,Luke,41,Luke.12,Luke 12,11,Luke.12.51,Luke 12:51,50,"Думаете ли вы, что Я пришел дать мир земле? Нет, говорю вам, но разделение;"
ru,RUS_SYNODAL,Luke,Luke,41,Luke.12,Luke 12,11,Luke.12.52,Luke 12:52,51,"ибо отныне пятеро в одном доме станут разделяться, трое против двух, и двое против трех:"
ru,RUS_SYNODAL,Luke,Luke,41,Luke.12,Luke 12,11,Luke.12.53,Luke 12:53,52,"отец будет против сына, и сын против отца; мать против дочери, и дочь против матери; свекровь против невестки своей, и невестка против свекрови своей."
ru,RUS_SYNODAL,Luke,Luke,41,Luke.12,Luke 12,11,Luke.12.54,Luke 12:54,53,"Сказал же и народу: когда вы видите облако, поднимающееся с запада, тотчас говорите: дождь будет, и бывает так;"
ru,RUS_SYNODAL,Luke,Luke,41,Luke.12,Luke 12,11,Luke.12.55,Luke 12:55,54,"и когда дует южный ветер, говорите: зной будет, и бывает."
ru,RUS_SYNODAL,Luke,Luke,41,Luke.12,Luke 12,11,Luke.12.56,Luke 12:56,55,"Лицемеры! лице земли и неба распознавать умеете, как же времени сего не узнаете?"
ru,RUS_SYNODAL,Luke,Luke,41,Luke.12,Luke 12,11,Luke.12.57,Luke 12:57,56,"Зачем же вы и по самим себе не судите, чему быть должно?"
ru,RUS_SYNODAL,Luke,Luke,41,Luke.12,Luke 12,11,Luke.12.58,Luke 12:58,57,"Когда ты идешь с соперником своим к начальству, то на дороге постарайся освободиться от него, чтобы он не привел тебя к судье, а судья не отдал тебя истязателю, а истязатель не вверг тебя в темницу;"
ru,RUS_SYNODAL,Luke,Luke,41,Luke.12,Luke 12,11,Luke.12.59,Luke 12:59,58,"Сказываю тебе: не выйдешь оттуда, пока не отдашь и последней полушки."
ru,RUS_SYNODAL,Luke,Luke,41,Luke.13,Luke 13,12,Luke.13.1,Luke 13:1,0,"В это время пришли некоторые и рассказали Ему о Галилеянах, которых кровь Пилат смешал с жертвами их."
ru,RUS_SYNODAL,Luke,Luke,41,Luke.13,Luke 13,12,Luke.13.2,Luke 13:2,1,"Иисус сказал им на это: думаете ли вы, что эти Галилеяне были грешнее всех Галилеян, что так пострадали?"
ru,RUS_SYNODAL,Luke,Luke,41,Luke.13,Luke 13,12,Luke.13.3,Luke 13:3,2,"Нет, говорю вам, но, если не покаетесь, все так же погибнете."
ru,RUS_SYNODAL,Luke,Luke,41,Luke.13,Luke 13,12,Luke.13.4,Luke 13:4,3,"Или думаете ли, что те восемнадцать человек, на которых упала башня Силоамская и побила их, виновнее были всех, живущих в Иерусалиме?"
ru,RUS_SYNODAL,Luke,Luke,41,Luke.13,Luke 13,12,Luke.13.5,Luke 13:5,4,"Нет, говорю вам, но, если не покаетесь, все так же погибнете."
ru,RUS_SYNODAL,Luke,Luke,41,Luke.13,Luke 13,12,Luke.13.6,Luke 13:6,5,"И сказал сию притчу: некто имел в винограднике своем посаженную смоковницу, и пришел искать плода на ней, и не нашел;"
ru,RUS_SYNODAL,Luke,Luke,41,Luke.13,Luke 13,12,Luke.13.7,Luke 13:7,6,"и сказал виноградарю: вот, я третий год прихожу искать плода на этой смоковнице и не нахожу; сруби ее: на что она и землю занимает?"
ru,RUS_SYNODAL,Luke,Luke,41,Luke.13,Luke 13,12,Luke.13.8,Luke 13:8,7,"Но он сказал ему в ответ: господин! оставь ее и на этот год, пока я окопаю ее и обложу навозом, –"
ru,RUS_SYNODAL,Luke,Luke,41,Luke.13,Luke 13,12,Luke.13.9,Luke 13:9,8,"не принесет ли плода; если же нет, то в следующий [год] срубишь ее."
ru,RUS_SYNODAL,Luke,Luke,41,Luke.13,Luke 13,12,Luke.13.10,Luke 13:10,9,В одной из синагог учил Он в субботу.
