languageCode,code,bookOsisId,bookSblId,bookOrderIndex,chapterOsisId,chapterSblId,chapterOrderIndex,verseOsisId,verseSblId,verseOrderIndex,text
ru,RUS_SYNODAL,Luke,Luke,41,Luke.1,Luke 1,0,Luke.1.1,Luke 1:1,0,"Как уже многие начали составлять повествования о совершенно известных между нами событиях,"
ru,RUS_SYNODAL,Luke,Luke,41,Luke.1,Luke 1,0,Luke.1.2,Luke 1:2,1,"как передали нам то бывшие с самого начала очевидцами и служителями Слова,"
ru,RUS_SYNODAL,Luke,Luke,41,Luke.1,Luke 1,0,Luke.1.3,Luke 1:3,2,"то рассудилось и мне, по тщательном исследовании всего сначала, по порядку описать тебе, достопочтенный Феофил,"
ru,RUS_SYNODAL,Luke,Luke,41,Luke.1,Luke 1,0,Luke.1.4,Luke 1:4,3,"чтобы ты узнал твердое основание того учения, в котором был наставлен."
ru,RUS_SYNODAL,Luke,Luke,41,Luke.1,Luke 1,0,Luke.1.5,Luke 1:5,4,"Во дни Ирода, царя Иудейского, был священник из Авиевой чреды, именем Захария, и жена его из рода Ааронова, имя ей Елисавета."
ru,RUS_SYNODAL,Luke,Luke,41,Luke.1,Luke 1,0,Luke.1.6,Luke 1:6,5,"Оба они были праведны пред Богом, поступая по всем заповедям и уставам Господним беспорочно."
ru,RUS_SYNODAL,Luke,Luke,41,Luke.1,Luke 1,0,Luke.1.7,Luke 1:7,6,"У них не было детей, ибо Елисавета была неплодна, и оба были уже в летах преклонных."
ru,RUS_SYNODAL,Luke,Luke,41,Luke.1,Luke 1,0,Luke.1.8,Luke 1:8,7,"Однажды, когда он в порядке своей чреды служил пред Богом,"
ru,RUS_SYNODAL,Luke,Luke,41,Luke.1,Luke 1,0,Luke.1.9,Luke 1:9,8,"по жребию, как обыкновенно было у священников, досталось ему войти в храм Господень для каждения,"
ru,RUS_SYNODAL,Luke,Luke,41,Luke.1,Luke 1,0,Luke.1.10,Luke 1:10,9,"а все множество народа молилось вне во время каждения, –"
ru,RUS_SYNODAL,Luke,Luke,41,Luke.1,Luke 1,0,Luke.1.11,Luke 1:11,10,"тогда явился ему Ангел Господень, стоя по правую сторону жертвенника кадильного."
ru,RUS_SYNODAL,Luke,Luke,41,Luke.1,Luke 1,0,Luke.1.12,Luke 1:12,11,"Захария, увидев его, смутился, и страх напал на него."
ru,RUS_SYNODAL,Luke,Luke,41,Luke.1,Luke 1,0,Luke.1.13,Luke 1:13,12,"Ангел же сказал ему: не бойся, Захария, ибо услышана молитва твоя, и жена твоя Елисавета родит тебе сына, и наречешь ему имя: Иоанн;"
ru,RUS_SYNODAL,Luke,Luke,41,Luke.1,Luke 1,0,Luke.1.14,Luke 1:14,13,"и будет тебе радость и веселие, и многие о рождении его возрадуются,"
ru,RUS_SYNODAL,Luke,Luke,41,Luke.1,Luke 1,0,Luke.1.15,Luke 1:15,14,"ибо он будет велик пред Господом; не будет пить вина и сикера, и Духа Святаго исполнится еще от чрева матери своей;"
ru,RUS_SYNODAL,Luke,Luke,41,Luke.1,Luke 1,0,Luke.1.16,Luke 1:16,15,и многих из сынов Израилевых обратит к Господу Богу их;
ru,RUS_SYNODAL,Luke,Luke,41,Luke.1,Luke 1,0,Luke.1.17,Luke 1:17,16,"и предъидет пред Ним в духе и силе Илии, чтобы возвратить сердца отцов детям, и непокоривым образ мыслей праведников, дабы представить Господу народ приготовленный."
ru,RUS_SYNODAL,Luke,Luke,41,Luke.1,Luke 1,0,Luke.1.18,Luke 1:18,17,"И сказал Захария Ангелу: по чему я узнаю это? ибо я стар, и жена моя в летах преклонных."
ru,RUS_SYNODAL,Luke,Luke,41,Luke.1,Luke 1,0,Luke.1.19,Luke 1:19,18,"Ангел сказал ему в ответ: я Гавриил, предстоящий пред Богом, и послан говорить с тобою и благовестить тебе сие;"
ru,RUS_SYNODAL,Luke,Luke,41,Luke.1,Luke 1,0,Luke.1.20,Luke 1:20,19,"и вот, ты будешь молчать и не будешь иметь возможности говорить до того дня, как это сбудется, за то, что ты не поверил словам моим, которые сбудутся в свое время."
ru,RUS_SYNODAL,Luke,Luke,41,Luke.1,Luke 1,0,Luke.1.21,Luke 1:21,20,"Между тем народ ожидал Захарию и дивился, что он медлит в храме."
ru,RUS_SYNODAL,Luke,Luke,41,Luke.1,Luke 1,0,Luke.1.22,Luke 1:22,21,"Он же, выйдя, не мог говорить к ним; и они поняли, что он видел видение в храме; и он объяснялся с ними знаками, и оставался нем."
ru,RUS_SYNODAL,Luke,Luke,41,Luke.1,Luke 1,0,Luke.1.23,Luke 1:23,22,"А когда окончились дни службы его, возвратился в дом свой."
ru,RUS_SYNODAL,Luke,Luke,41,Luke.1,Luke 1,0,Luke.1.24,Luke 1:24,23,"После сих дней зачала Елисавета, жена его, и таилась пять месяцев и говорила:"
ru,RUS_SYNODAL,Luke,Luke,41,Luke.1,Luke 1,0,Luke.1.25,Luke 1:25,24,"так сотворил мне Господь во дни сии, в которые призрел на меня, чтобы снять с меня поношение между людьми."
ru,RUS_SYNODAL,Luke,Luke,41,Luke.1,Luke 1,0,Luke.1.26,Luke 1:26,25,"В шестой же месяц послан был Ангел Гавриил от Бога в город Галилейский, называемый Назарет,"
ru,RUS_SYNODAL,Luke,Luke,41,Luke.1,Luke 1,0,Luke.1.27,Luke 1:27,26,"к Деве, обрученной мужу, именем Иосифу, из дома Давидова; имя же Деве: Мария."
ru,RUS_SYNODAL,Luke,Luke,41,Luke.1,Luke 1,0,Luke.1.28,Luke 1:28,27,"Ангел, войдя к Ней, сказал: радуйся, Благодатная! Господь с Тобою; благословенна Ты между женами."
ru,RUS_SYNODAL,Luke,Luke,41,Luke.1,Luke 1,0,Luke.1.29,Luke 1:29,28,"Она же, увидев его, смутилась от слов его и размышляла, что бы это было за приветствие."
ru,RUS_SYNODAL,Luke,Luke,41,Luke.1,Luke 1,0,Luke.1.30,Luke 1:30,29,"И сказал Ей Ангел: не бойся, Мария, ибо Ты обрела благодать у Бога;"
ru,RUS_SYNODAL,Luke,Luke,41,Luke.1,Luke 1,0,Luke.1.31,Luke 1:31,30,"и вот, зачнешь во чреве, и родишь Сына, и наречешь Ему имя: Иисус."
ru,RUS_SYNODAL,Luke,Luke,41,Luke.1,Luke 1,0,Luke.1.32,Luke 1:32,31,"Он будет велик и наречется Сыном Всевышнего, и даст Ему Господь Бог престол Давида, отца Его;"
ru,RUS_SYNODAL,Luke,Luke,41,Luke.1,Luke 1,0,Luke.1.33,Luke 1:33,32,"и будет царствовать над домом Иакова во веки, и Царству Его не будет конца."
ru,RUS_SYNODAL,Luke,Luke,41,Luke.1,Luke 1,0,Luke.1.34,Luke 1:34,33,"Мария же сказала Ангелу: как будет это, когда Я мужа не знаю?"
ru,RUS_SYNODAL,Luke,Luke,41,Luke.1,Luke 1,0,Luke.1.35,Luke 1:35,34,"Ангел сказал Ей в ответ: Дух Святый найдет на Тебя, и сила Всевышнего осенит Тебя; посему и рождаемое Святое наречется Сыном Божиим."
ru,RUS_SYNODAL,Luke,Luke,41,Luke.1,Luke 1,0,Luke.1.36,Luke 1:36,35,"Вот и Елисавета, родственница Твоя, называемая неплодною, и она зачала сына в старости своей, и ей уже шестой месяц,"
ru,RUS_SYNODAL,Luke,Luke,41,Luke.1,Luke 1,0,Luke.1.37,Luke 1:37,36,ибо у Бога не останется бессильным никакое слово.
ru,RUS_SYNODAL,Luke,Luke,41,Luke.1,Luke 1,0,Luke.1.38,Luke 1:38,37,"Тогда Мария сказала: се, Раба Господня; да будет Мне по слову твоему. И отошел от Нее Ангел."
ru,RUS_SYNODAL,Luke,Luke,41,Luke.1,Luke 1,0,Luke.1.39,Luke 1:39,38,"Встав же Мария во дни сии, с поспешностью пошла в нагорную страну, в город Иудин,"
ru,RUS_SYNODAL,Luke,Luke,41,Luke.1,Luke 1,0,Luke.1.40,Luke 1:40,39,"и вошла в дом Захарии, и приветствовала Елисавету."
ru,RUS_SYNODAL,Luke,Luke,41,Luke.1,Luke 1,0,Luke.1.41,Luke 1:41,40,"Когда Елисавета услышала приветствие Марии, взыграл младенец во чреве ее; и Елисавета исполнилась Святаго Духа,"
ru,RUS_SYNODAL,Luke,Luke,41,Luke.1,Luke 1,0,Luke.1.42,Luke 1:42,41,"и воскликнула громким голосом, и сказала: благословенна Ты между женами, и благословен плод чрева Твоего!"
ru,RUS_SYNODAL,Luke,Luke,41,Luke.1,Luke 1,0,Luke.1.43,Luke 1:43,42,"И откуда это мне, что пришла Матерь Господа моего ко мне?"
ru,RUS_SYNODAL,Luke,Luke,41,Luke.1,Luke 1,0,Luke.1.44,Luke 1:44,43,"Ибо когда голос приветствия Твоего дошел до слуха моего, взыграл младенец радостно во чреве моем."
ru,RUS_SYNODAL,Luke,Luke,41,Luke.1,Luke 1,0,Luke.1.45,Luke 1:45,44,"И блаженна Уверовавшая, потому что совершится сказанное Ей от Господа."
ru,RUS_SYNODAL,Luke,Luke,41,Luke.1,Luke 1,0,Luke.1.46,Luke 1:46,45,"И сказала Мария: величит душа Моя Господа,"
ru,RUS_SYNODAL,Luke,Luke,41,Luke.1,Luke 1,0,Luke.1.47,Luke 1:47,46,"и возрадовался дух Мой о Боге, Спасителе Моем,"
ru,RUS_SYNODAL,Luke,Luke,41,Luke.1,Luke 1,0,Luke.1.48,Luke 1:48,47,"что призрел Он на смирение Рабы Своей, ибо отныне будут ублажать Меня все роды;"
ru,RUS_SYNODAL,Luke,Luke,41,Luke.1,Luke 1,0,Luke.1.49,Luke 1:49,48,"что сотворил Мне величие Сильный, и свято имя Его;"
ru,RUS_SYNODAL,Luke,Luke,41,Luke.1,Luke 1,0,Luke.1.50,Luke 1:50,49,и милость Его в роды родов к боящимся Его;
ru,RUS_SYNODAL,Luke,Luke,41,Luke.1,Luke 1,0,Luke.1.51,Luke 1:51,50,явил силу мышцы Своей; рассеял надменных помышлениями сердца их;
ru,RUS_SYNODAL,Luke,Luke,41,Luke.1,Luke 1,0,Luke.1.52,Luke 1:52,51,"низложил сильных с престолов, и вознес смиренных;"
ru,RUS_SYNODAL,Luke,Luke,41,Luke.1,Luke 1,0,Luke.1.53,Luke 1:53,52,"алчущих исполнил благ, и богатящихся отпустил ни с чем;"
ru,RUS_SYNODAL,Luke,Luke,41,Luke.1,Luke 1,0,Luke.1.54,Luke 1:54,53,"воспринял Израиля, отрока Своего, воспомянув милость,"
ru,RUS_SYNODAL,Luke,Luke,41,Luke.1,Luke 1,0,Luke.1.55,Luke 1:55,54,"как говорил отцам нашим, к Аврааму и семени его до века."
ru,RUS_SYNODAL,Luke,Luke,41,Luke.1,Luke 1,0,Luke.1.56,Luke 1:56,55,"Пребыла же Мария с нею около трех месяцев, и возвратилась в дом свой."
ru,RUS_SYNODAL,Luke,Luke,41,Luke.1,Luke 1,0,Luke.1.57,Luke 1:57,56,"Елисавете же настало время родить, и она родила сына."
ru,RUS_SYNODAL,Luke,Luke,41,Luke.1,Luke 1,0,Luke.1.58,Luke 1:58,57,"И услышали соседи и родственники ее, что возвеличил Господь милость Свою над нею, и радовались с нею."
ru,RUS_SYNODAL,Luke,Luke,41,Luke.1,Luke 1,0,Luke.1.59,Luke 1:59,58,"В восьмой день пришли обрезать младенца и хотели назвать его, по имени отца его, Захариею."
ru,RUS_SYNODAL,Luke,Luke,41,Luke.1,Luke 1,0,Luke.1.60,Luke 1:60,59,"На это мать его сказала: нет, а назвать его Иоанном."
ru,RUS_SYNODAL,Luke,Luke,41,Luke.1,Luke 1,0,Luke.1.61,Luke 1:61,60,"И сказали ей: никого нет в родстве твоем, кто назывался бы сим именем."
ru,RUS_SYNODAL,Luke,Luke,41,Luke.1,Luke 1,0,Luke.1.62,Luke 1:62,61,"И спрашивали знаками у отца его, как бы он хотел назвать его."
ru,RUS_SYNODAL,Luke,Luke,41,Luke.1,Luke 1,0,Luke.1.63,Luke 1:63,62,Он потребовал дощечку и написал: Иоанн имя ему. И все удивились.
ru,RUS_SYNODAL,Luke,Luke,41,Luke.1,Luke 1,0,Luke.1.64,Luke 1:64,63,"И тотчас разрешились уста его и язык его, и он стал говорить, благословляя Бога."
ru,RUS_SYNODAL,Luke,Luke,41,Luke.1,Luke 1,0,Luke.1.65,Luke 1:65,64,И был страх на всех живущих вокруг них; и рассказывали обо всем этом по всей нагорной стране Иудейской.
ru,RUS_SYNODAL,Luke,Luke,41,Luke.1,Luke 1,0,Luke.1.66,Luke 1:66,65,Все слышавшие положили это на сердце своем и говорили: что будет младенец сей? И рука Господня была с ним.
ru,RUS_SYNODAL,Luke,Luke,41,Luke.1,Luke 1,0,Luke.1.67,Luke 1:67,66,"И Захария, отец его, исполнился Святаго Духа и пророчествовал, говоря:"
ru,RUS_SYNODAL,Luke,Luke,41,Luke.1,Luke 1,0,Luke.1.68,Luke 1:68,67,"благословен Господь Бог Израилев, что посетил народ Свой и сотворил избавление ему,"
ru,RUS_SYNODAL,Luke,Luke,41,Luke.1,Luke 1,0,Luke.1.69,Luke 1:69,68,"и воздвиг рог спасения нам в дому Давида, отрока Своего,"
ru,RUS_SYNODAL,Luke,Luke,41,Luke.1,Luke 1,0,Luke.1.70,Luke 1:70,69,"как возвестил устами бывших от века святых пророков Своих,"
ru,RUS_SYNODAL,Luke,Luke,41,Luke.1,Luke 1,0,Luke.1.71,Luke 1:71,70,что спасет нас от врагов наших и от руки всех ненавидящих нас;
ru,RUS_SYNODAL,Luke,Luke,41,Luke.1,Luke 1,0,Luke.1.72,Luke 1:72,71,"сотворит милость с отцами нашими и помянет святой завет Свой,"
ru,RUS_SYNODAL,Luke,Luke,41,Luke.1,Luke 1,0,Luke.1.73,Luke 1:73,72,"клятву, которою клялся Он Аврааму, отцу нашему, дать нам,"
ru,RUS_SYNODAL,Luke,Luke,41,Luke.1,Luke 1,0,Luke.1.74,Luke 1:74,73,"небоязненно, по избавлении от руки врагов наших,"
ru,RUS_SYNODAL,Luke,Luke,41,Luke.1,Luke 1,0,Luke.1.75,Luke 1:75,74,"служить Ему в святости и правде пред Ним, во все дни жизни нашей."
ru,RUS_SYNODAL,Luke,Luke,41,Luke.1,Luke 1,0,Luke.1.76,Luke 1:76,75,"И ты, младенец, наречешься пророком Всевышнего, ибо предъидешь пред лицем Господа приготовить пути Ему,"
ru,RUS_SYNODAL,Luke,Luke,41,Luke.1,Luke 1,0,Luke.1.77,Luke 1:77,76,"дать уразуметь народу Его спасение в прощении грехов их,"
ru,RUS_SYNODAL,Luke,Luke,41,Luke.1,Luke 1,0,Luke.1.78,Luke 1:78,77,"по благоутробному милосердию Бога нашего, которым посетил нас Восток свыше,"
ru,RUS_SYNODAL,Luke,Luke,41,Luke.1,Luke 1,0,Luke.1.79,Luke 1:79,78,"просветить сидящих во тьме и тени смертной, направить ноги наши на путь мира."
ru,RUS_SYNODAL,Luke,Luke,41,Luke.1,Luke 1,0,Luke.1.80,Luke 1:80,79,"Младенец же возрастал и укреплялся духом, и был в пустынях до дня явления своего Израилю."
ru,RUS_SYNODAL,Luke,Luke,41,Luke.2,Luke 2,1,Luke.2.1,Luke 2:1,0,В те дни вышло от кесаря Августа повеление сделать перепись по всей земле.
ru,RUS_SYNODAL,Luke,Luke,41,Luke.2,Luke 2,1,Luke.2.2,Luke 2:2,1,Эта перепись была первая в правление Квириния Сириею.
ru,RUS_SYNODAL,Luke,Luke,41,Luke.2,Luke 2,1,Luke.2.3,Luke 2:3,2,"И пошли все записываться, каждый в свой город."
ru,RUS_SYNODAL,Luke,Luke,41,Luke.2,Luke 2,1,Luke.2.4,Luke 2:4,3,"Пошел также и Иосиф из Галилеи, из города Назарета, в Иудею, в город Давидов, называемый Вифлеем, потому что он был из дома и рода Давидова,"
ru,RUS_SYNODAL,Luke,Luke,41,Luke.2,Luke 2,1,Luke.2.5,Luke 2:5,4,"записаться с Мариею, обрученною ему женою, которая была беременна."
ru,RUS_SYNODAL,Luke,Luke,41,Luke.2,Luke 2,1,Luke.2.6,Luke 2:6,5,"Когда же они были там, наступило время родить Ей;"
ru,RUS_SYNODAL,Luke,Luke,41,Luke.2,Luke 2,1,Luke.2.7,Luke 2:7,6,"и родила Сына своего Первенца, и спеленала Его, и положила Его в ясли, потому что не было им места в гостинице."
ru,RUS_SYNODAL,Luke,Luke,41,Luke.2,Luke 2,1,Luke.2.8,Luke 2:8,7,"В той стране были на поле пастухи, которые содержали ночную стражу у стада своего."
ru,RUS_SYNODAL,Luke,Luke,41,Luke.2,Luke 2,1,Luke.2.9,Luke 2:9,8,"Вдруг предстал им Ангел Господень, и слава Господня осияла их; и убоялись страхом великим."
ru,RUS_SYNODAL,Luke,Luke,41,Luke.2,Luke 2,1,Luke.2.10,Luke 2:10,9,"И сказал им Ангел: не бойтесь; я возвещаю вам великую радость, которая будет всем людям:"
ru,RUS_SYNODAL,Luke,Luke,41,Luke.2,Luke 2,1,Luke.2.11,Luke 2:11,10,"ибо ныне родился вам в городе Давидовом Спаситель, Который есть Христос Господь;"
ru,RUS_SYNODAL,Luke,Luke,41,Luke.2,Luke 2,1,Luke.2.12,Luke 2:12,11,"и вот вам знак: вы найдете Младенца в пеленах, лежащего в яслях."
ru,RUS_SYNODAL,Luke,Luke,41,Luke.2,Luke 2,1,Luke.2.13,Luke 2:13,12,"И внезапно явилось с Ангелом многочисленное воинство небесное, славящее Бога и взывающее:"
ru,RUS_SYNODAL,Luke,Luke,41,Luke.2,Luke 2,1,Luke.2.14,Luke 2:14,13,"слава в вышних Богу, и на земле мир, в человеках благоволение!"
ru,RUS_SYNODAL,Luke,Luke,41,Luke.2,Luke 2,1,Luke.2.15,Luke 2:15,14,"Когда Ангелы отошли от них на небо, пастухи сказали друг другу: пойдем в Вифлеем и посмотрим, что там случилось, о чем возвестил нам Господь."
ru,RUS_SYNODAL,Luke,Luke,41,Luke.2,Luke 2,1,Luke.2.16,Luke 2:16,15,"И, поспешив, пришли и нашли Марию и Иосифа, и Младенца, лежащего в яслях."
ru,RUS_SYNODAL,Luke,Luke,41,Luke.2,Luke 2,1,Luke.2.17,Luke 2:17,16,"Увидев же, рассказали о том, что было возвещено им о Младенце Сем."
ru,RUS_SYNODAL,Luke,Luke,41,Luke.2,Luke 2,1,Luke.2.18,Luke 2:18,17,"И все слышавшие дивились тому, что рассказывали им пастухи."
ru,RUS_SYNODAL,Luke,Luke,41,Luke.2,Luke 2,1,Luke.2.19,Luke 2:19,18,"А Мария сохраняла все слова сии, слагая в сердце Своем."
ru,RUS_SYNODAL,Luke,Luke,41,Luke.2,Luke 2,1,Luke.2.20,Luke 2:20,19,"И возвратились пастухи, славя и хваля Бога за все то, что слышали и видели, как им сказано было."
ru,RUS_SYNODAL,Luke,Luke,41,Luke.2,Luke 2,1,Luke.2.21,Luke 2:21,20,"По прошествии восьми дней, когда надлежало обрезать [Младенца], дали Ему имя Иисус, нареченное Ангелом прежде зачатия Его во чреве."
ru,RUS_SYNODAL,Luke,Luke,41,Luke.2,Luke 2,1,Luke.2.22,Luke 2:22,21,"А когда исполнились дни очищения их по закону Моисееву, принесли Его в Иерусалим, чтобы представить пред Господа,"
ru,RUS_SYNODAL,Luke,Luke,41,Luke.2,Luke 2,1,Luke.2.23,Luke 2:23,22,"как предписано в законе Господнем, чтобы всякий младенец мужеского пола, разверзающий ложесна, был посвящен Господу,"
ru,RUS_SYNODAL,Luke,Luke,41,Luke.2,Luke 2,1,Luke.2.24,Luke 2:24,23,"и чтобы принести в жертву, по реченному в законе Господнем, две горлицы или двух птенцов голубиных."
ru,RUS_SYNODAL,Luke,Luke,41,Luke.2,Luke 2,1,Luke.2.25,Luke 2:25,24,"Тогда был в Иерусалиме человек, именем Симеон. Он был муж праведный и благочестивый, чающий утешения Израилева; и Дух Святый был на нем."
ru,RUS_SYNODAL,Luke,Luke,41,Luke.2,Luke 2,1,Luke.2.26,Luke 2:26,25,"Ему было предсказано Духом Святым, что он не увидит смерти, доколе не увидит Христа Господня."
ru,RUS_SYNODAL,Luke,Luke,41,Luke.2,Luke 2,1,Luke.2.27,Luke 2:27,26,"И пришел он по вдохновению в храм. И, когда родители принесли Младенца Иисуса, чтобы совершить над Ним законный обряд,"
ru,RUS_SYNODAL,Luke,Luke,41,Luke.2,Luke 2,1,Luke.2.28,Luke 2:28,27,"он взял Его на руки, благословил Бога и сказал:"
ru,RUS_SYNODAL,Luke,Luke,41,Luke.2,Luke 2,1,Luke.2.29,Luke 2:29,28,"Ныне отпускаешь раба Твоего, Владыко, по слову Твоему, с миром,"
ru,RUS_SYNODAL,Luke,Luke,41,Luke.2,Luke 2,1,Luke.2.30,Luke 2:30,29,"ибо видели очи мои спасение Твое,"
ru,RUS_SYNODAL,Luke,Luke,41,Luke.2,Luke 2,1,Luke.2.31,Luke 2:31,30,"которое Ты уготовал пред лицем всех народов,"
ru,RUS_SYNODAL,Luke,Luke,41,Luke.2,Luke 2,1,Luke.2.32,Luke 2:32,31,свет к просвещению язычников и славу народа Твоего Израиля.
ru,RUS_SYNODAL,Luke,Luke,41,Luke.2,Luke 2,1,Luke.2.33,Luke 2:33,32,Иосиф же и Матерь Его дивились сказанному о Нем.
ru,RUS_SYNODAL,Luke,Luke,41,Luke.2,Luke 2,1,Luke.2.34,Luke 2:34,33,"И благословил их Симеон и сказал Марии, Матери Его: се, лежит Сей на падение и на восстание многих в Израиле и в предмет пререканий, –"
ru,RUS_SYNODAL,Luke,Luke,41,Luke.2,Luke 2,1,Luke.2.35,Luke 2:35,34,"и Тебе Самой оружие пройдет душу, – да откроются помышления многих сердец."
ru,RUS_SYNODAL,Luke,Luke,41,Luke.2,Luke 2,1,Luke.2.36,Luke 2:36,35,"Тут была также Анна пророчица, дочь Фануилова, от колена Асирова, достигшая глубокой старости, прожив с мужем от девства своего семь лет,"
ru,RUS_SYNODAL,Luke,Luke,41,Luke.2,Luke 2,1,Luke.2.37,Luke 2:37,36,"вдова лет восьмидесяти четырех, которая не отходила от храма, постом и молитвою служа Богу день и ночь."
ru,RUS_SYNODAL,Luke,Luke,41,Luke.2,Luke 2,1,Luke.2.38,Luke 2:38,37,"И она в то время, подойдя, славила Господа и говорила о Нем всем, ожидавшим избавления в Иерусалиме."
ru,RUS_SYNODAL,Luke,Luke,41,Luke.2,Luke 2,1,Luke.2.39,Luke 2:39,38,"И когда они совершили все по закону Господню, возвратились в Галилею, в город свой Назарет."
