languageCode,code,bookOsisId,bookSblId,bookOrderIndex,chapterOsisId,chapterSblId,chapterOrderIndex,verseOsisId,verseSblId,verseOrderIndex,text
ru,RUS_SYNODAL,Luke,Luke,41,Luke.19,Luke 19,18,Luke.19.10,Luke 19:10,9,ибо Сын Человеческий пришел взыскать и спасти погибшее.
ru,RUS_SYNODAL,Luke,Luke,41,Luke.19,Luke 19,18,Luke.19.11,Luke 19:11,10,"Когда же они слушали это, присовокупил притчу: ибо Он был близ Иерусалима, и они думали, что скоро должно открыться Царствие Божие."
ru,RUS_SYNODAL,Luke,Luke,41,Luke.19,Luke 19,18,Luke.19.12,Luke 19:12,11,"Итак сказал: некоторый человек высокого рода отправлялся в дальнюю страну, чтобы получить себе царство и возвратиться;"
ru,RUS_SYNODAL,Luke,Luke,41,Luke.19,Luke 19,18,Luke.19.13,Luke 19:13,12,"призвав же десять рабов своих, дал им десять мин и сказал им: употребляйте их в оборот, пока я возвращусь."
ru,RUS_SYNODAL,Luke,Luke,41,Luke.19,Luke 19,18,Luke.19.14,Luke 19:14,13,"Но граждане ненавидели его и отправили вслед за ним посольство, сказав: не хотим, чтобы он царствовал над нами."
ru,RUS_SYNODAL,Luke,Luke,41,Luke.19,Luke 19,18,Luke.19.15,Luke 19:15,14,"И когда возвратился, получив царство, велел призвать к себе рабов тех, которым дал серебро, чтобы узнать, кто что приобрел."
ru,RUS_SYNODAL,Luke,Luke,41,Luke.19,Luke 19,18,Luke.19.16,Luke 19:16,15,Пришел первый и сказал: господин! мина твоя принесла десять мин.
ru,RUS_SYNODAL,Luke,Luke,41,Luke.19,Luke 19,18,Luke.19.17,Luke 19:17,16,"И сказал ему: хорошо, добрый раб! за то, что ты в малом был верен, возьми в управление десять городов."
ru,RUS_SYNODAL,Luke,Luke,41,Luke.19,Luke 19,18,Luke.19.18,Luke 19:18,17,Пришел второй и сказал: господин! мина твоя принесла пять мин.
ru,RUS_SYNODAL,Luke,Luke,41,Luke.19,Luke 19,18,Luke.19.19,Luke 19:19,18,Сказал и этому: и ты будь над пятью городами.
ru,RUS_SYNODAL,Luke,Luke,41,Luke.19,Luke 19,18,Luke.19.20,Luke 19:20,19,"Пришел третий и сказал: господин! вот твоя мина, которую я хранил, завернув в платок,"
ru,RUS_SYNODAL,Luke,Luke,41,Luke.19,Luke 19,18,Luke.19.21,Luke 19:21,20,"ибо я боялся тебя, потому что ты человек жестокий: берешь, чего не клал, и жнешь, чего не сеял."
ru,RUS_SYNODAL,Luke,Luke,41,Luke.19,Luke 19,18,Luke.19.22,Luke 19:22,21,"[Господин] сказал ему: твоими устами буду судить тебя, лукавый раб! ты знал, что я человек жестокий, беру, чего не клал, и жну, чего не сеял;"
ru,RUS_SYNODAL,Luke,Luke,41,Luke.19,Luke 19,18,Luke.19.23,Luke 19:23,22,"для чего же ты не отдал серебра моего в оборот, чтобы я, придя, получил его с прибылью?"
ru,RUS_SYNODAL,Luke,Luke,41,Luke.19,Luke 19,18,Luke.19.24,Luke 19:24,23,И сказал предстоящим: возьмите у него мину и дайте имеющему десять мин.
ru,RUS_SYNODAL,Luke,Luke,41,Luke.19,Luke 19,18,Luke.19.25,Luke 19:25,24,И сказали ему: господин! у него есть десять мин.
ru,RUS_SYNODAL,Luke,Luke,41,Luke.19,Luke 19,18,Luke.19.26,Luke 19:26,25,"Сказываю вам, что всякому имеющему дано будет, а у неимеющего отнимется и то, что имеет;"
ru,RUS_SYNODAL,Luke,Luke,41,Luke.19,Luke 19,18,Luke.19.27,Luke 19:27,26,"врагов же моих тех, которые не хотели, чтобы я царствовал над ними, приведите сюда и избейте предо мною."
ru,RUS_SYNODAL,Luke,Luke,41,Luke.19,Luke 19,18,Luke.19.28,Luke 19:28,27,"Сказав это, Он пошел далее, восходя в Иерусалим."
ru,RUS_SYNODAL,Luke,Luke,41,Luke.19,Luke 19,18,Luke.19.29,Luke 19:29,28,"И когда приблизился к Виффагии и Вифании, к горе, называемой Елеонскою, послал двух учеников Своих,"
ru,RUS_SYNODAL,Luke,Luke,41,Luke.19,Luke 19,18,Luke.19.30,Luke 19:30,29,"сказав: пойдите в противолежащее селение; войдя в него, найдете молодого осла привязанного, на которого никто из людей никогда не садился; отвязав его, приведите;"
ru,RUS_SYNODAL,Luke,Luke,41,Luke.19,Luke 19,18,Luke.19.31,Luke 19:31,30,и если кто спросит вас: зачем отвязываете? скажите ему так: он надобен Господу.
ru,RUS_SYNODAL,Luke,Luke,41,Luke.19,Luke 19,18,Luke.19.32,Luke 19:32,31,"Посланные пошли и нашли, как Он сказал им."
ru,RUS_SYNODAL,Luke,Luke,41,Luke.19,Luke 19,18,Luke.19.33,Luke 19:33,32,"Когда же они отвязывали молодого осла, хозяева его сказали им: зачем отвязываете осленка?"
ru,RUS_SYNODAL,Luke,Luke,41,Luke.19,Luke 19,18,Luke.19.34,Luke 19:34,33,Они отвечали: он надобен Господу.
ru,RUS_SYNODAL,Luke,Luke,41,Luke.19,Luke 19,18,Luke.19.35,Luke 19:35,34,"И привели его к Иисусу, и, накинув одежды свои на осленка, посадили на него Иисуса."
ru,RUS_SYNODAL,Luke,Luke,41,Luke.19,Luke 19,18,Luke.19.36,Luke 19:36,35,"И, когда Он ехал, постилали одежды свои по дороге."
ru,RUS_SYNODAL,Luke,Luke,41,Luke.19,Luke 19,18,Luke.19.37,Luke 19:37,36,"А когда Он приблизился к спуску с горы Елеонской, все множество учеников начало в радости велегласно славить Бога за все чудеса, какие видели они,"
ru,RUS_SYNODAL,Luke,Luke,41,Luke.19,Luke 19,18,Luke.19.38,Luke 19:38,37,"говоря: благословен Царь, грядущий во имя Господне! мир на небесах и слава в вышних!"
ru,RUS_SYNODAL,Luke,Luke,41,Luke.19,Luke 19,18,Luke.19.39,Luke 19:39,38,И некоторые фарисеи из среды народа сказали Ему: Учитель! запрети ученикам Твоим.
ru,RUS_SYNODAL,Luke,Luke,41,Luke.19,Luke 19,18,Luke.19.40,Luke 19:40,39,"Но Он сказал им в ответ: сказываю вам, что если они умолкнут, то камни возопиют."
ru,RUS_SYNODAL,Luke,Luke,41,Luke.19,Luke 19,18,Luke.19.41,Luke 19:41,40,"И когда приблизился к городу, то, смотря на него, заплакал о нем"
ru,RUS_SYNODAL,Luke,Luke,41,Luke.19,Luke 19,18,Luke.19.42,Luke 19:42,41,"и сказал: о, если бы и ты хотя в сей твой день узнал, что служит к миру твоему! Но это сокрыто ныне от глаз твоих,"
ru,RUS_SYNODAL,Luke,Luke,41,Luke.19,Luke 19,18,Luke.19.43,Luke 19:43,42,"ибо придут на тебя дни, когда враги твои обложат тебя окопами и окружат тебя, и стеснят тебя отовсюду,"
ru,RUS_SYNODAL,Luke,Luke,41,Luke.19,Luke 19,18,Luke.19.44,Luke 19:44,43,"и разорят тебя, и побьют детей твоих в тебе, и не оставят в тебе камня на камне за то, что ты не узнал времени посещения твоего."
ru,RUS_SYNODAL,Luke,Luke,41,Luke.19,Luke 19,18,Luke.19.45,Luke 19:45,44,"И, войдя в храм, начал выгонять продающих в нем и покупающих,"
ru,RUS_SYNODAL,Luke,Luke,41,Luke.19,Luke 19,18,Luke.19.46,Luke 19:46,45,"говоря им: написано: дом Мой есть дом молитвы, а вы сделали его вертепом разбойников."
ru,RUS_SYNODAL,Luke,Luke,41,Luke.19,Luke 19,18,Luke.19.47,Luke 19:47,46,"И учил каждый день в храме. Первосвященники же и книжники и старейшины народа искали погубить Его,"
ru,RUS_SYNODAL,Luke,Luke,41,Luke.19,Luke 19,18,Luke.19.48,Luke 19:48,47,"и не находили, что бы сделать с Ним; потому что весь народ неотступно слушал Его."
ru,RUS_SYNODAL,Luke,Luke,41,Luke.20,Luke 20,19,Luke.20.1,Luke 20:1,0,"В один из тех дней, когда Он учил народ в храме и благовествовал, приступили первосвященники и книжники со старейшинами,"
ru,RUS_SYNODAL,Luke,Luke,41,Luke.20,Luke 20,19,Luke.20.2,Luke 20:2,1,"и сказали Ему: скажи нам, какою властью Ты это делаешь, или кто дал Тебе власть сию?"
ru,RUS_SYNODAL,Luke,Luke,41,Luke.20,Luke 20,19,Luke.20.3,Luke 20:3,2,"Он сказал им в ответ: спрошу и Я вас об одном, и скажите Мне:"
ru,RUS_SYNODAL,Luke,Luke,41,Luke.20,Luke 20,19,Luke.20.4,Luke 20:4,3,"крещение Иоанново с небес было, или от человеков?"
ru,RUS_SYNODAL,Luke,Luke,41,Luke.20,Luke 20,19,Luke.20.5,Luke 20:5,4,"Они же, рассуждая между собою, говорили: если скажем: с небес, то скажет: почему же вы не поверили ему?"
ru,RUS_SYNODAL,Luke,Luke,41,Luke.20,Luke 20,19,Luke.20.6,Luke 20:6,5,"а если скажем: от человеков, то весь народ побьет нас камнями, ибо он уверен, что Иоанн есть пророк."
ru,RUS_SYNODAL,Luke,Luke,41,Luke.20,Luke 20,19,Luke.20.7,Luke 20:7,6,И отвечали: не знаем откуда.
ru,RUS_SYNODAL,Luke,Luke,41,Luke.20,Luke 20,19,Luke.20.8,Luke 20:8,7,"Иисус сказал им: и Я не скажу вам, какою властью это делаю."
ru,RUS_SYNODAL,Luke,Luke,41,Luke.20,Luke 20,19,Luke.20.9,Luke 20:9,8,"И начал Он говорить к народу притчу сию: один человек насадил виноградник и отдал его виноградарям, и отлучился на долгое время;"
ru,RUS_SYNODAL,Luke,Luke,41,Luke.20,Luke 20,19,Luke.20.10,Luke 20:10,9,"и в свое время послал к виноградарям раба, чтобы они дали ему плодов из виноградника; но виноградари, прибив его, отослали ни с чем."
ru,RUS_SYNODAL,Luke,Luke,41,Luke.20,Luke 20,19,Luke.20.11,Luke 20:11,10,"Еще послал другого раба; но они и этого, прибив и обругав, отослали ни с чем."
ru,RUS_SYNODAL,Luke,Luke,41,Luke.20,Luke 20,19,Luke.20.12,Luke 20:12,11,"И еще послал третьего; но они и того, изранив, выгнали."
ru,RUS_SYNODAL,Luke,Luke,41,Luke.20,Luke 20,19,Luke.20.13,Luke 20:13,12,"Тогда сказал господин виноградника: что мне делать? Пошлю сына моего возлюбленного; может быть, увидев его, постыдятся."
ru,RUS_SYNODAL,Luke,Luke,41,Luke.20,Luke 20,19,Luke.20.14,Luke 20:14,13,"Но виноградари, увидев его, рассуждали между собою, говоря: это наследник; пойдем, убьем его, и наследство его будет наше."
ru,RUS_SYNODAL,Luke,Luke,41,Luke.20,Luke 20,19,Luke.20.15,Luke 20:15,14,"И, выведя его вон из виноградника, убили. Что же сделает с ними господин виноградника?"
ru,RUS_SYNODAL,Luke,Luke,41,Luke.20,Luke 20,19,Luke.20.16,Luke 20:16,15,"Придет и погубит виноградарей тех, и отдаст виноградник другим. Слышавшие же это сказали: да не будет!"
ru,RUS_SYNODAL,Luke,Luke,41,Luke.20,Luke 20,19,Luke.20.17,Luke 20:17,16,"Но Он, взглянув на них, сказал: что значит сие написанное: камень, который отвергли строители, тот самый сделался главою угла?"
ru,RUS_SYNODAL,Luke,Luke,41,Luke.20,Luke 20,19,Luke.20.18,Luke 20:18,17,"Всякий, кто упадет на тот камень, разобьется, а на кого он упадет, того раздавит."
ru,RUS_SYNODAL,Luke,Luke,41,Luke.20,Luke 20,19,Luke.20.19,Luke 20:19,18,"И искали в это время первосвященники и книжники, чтобы наложить на Него руки, но побоялись народа, ибо поняли, что о них сказал Он эту притчу."
ru,RUS_SYNODAL,Luke,Luke,41,Luke.20,Luke 20,19,Luke.20.20,Luke 20:20,19,"И, наблюдая за Ним, подослали лукавых людей, которые, притворившись благочестивыми, уловили бы Его в каком–либо слове, чтобы предать Его начальству и власти правителя."
ru,RUS_SYNODAL,Luke,Luke,41,Luke.20,Luke 20,19,Luke.20.21,Luke 20:21,20,"И они спросили Его: Учитель! мы знаем, что Ты правдиво говоришь и учишь и не смотришь на лице, но истинно пути Божию учишь;"
ru,RUS_SYNODAL,Luke,Luke,41,Luke.20,Luke 20,19,Luke.20.22,Luke 20:22,21,"позволительно ли нам давать подать кесарю, или нет?"
ru,RUS_SYNODAL,Luke,Luke,41,Luke.20,Luke 20,19,Luke.20.23,Luke 20:23,22,"Он же, уразумев лукавство их, сказал им: что вы Меня искушаете?"
ru,RUS_SYNODAL,Luke,Luke,41,Luke.20,Luke 20,19,Luke.20.24,Luke 20:24,23,Покажите Мне динарий: чье на нем изображение и надпись? Они отвечали: кесаревы.
ru,RUS_SYNODAL,Luke,Luke,41,Luke.20,Luke 20,19,Luke.20.25,Luke 20:25,24,"Он сказал им: итак, отдавайте кесарево кесарю, а Божие Богу."
ru,RUS_SYNODAL,Luke,Luke,41,Luke.20,Luke 20,19,Luke.20.26,Luke 20:26,25,"И не могли уловить Его в слове перед народом, и, удивившись ответу Его, замолчали."
ru,RUS_SYNODAL,Luke,Luke,41,Luke.20,Luke 20,19,Luke.20.27,Luke 20:27,26,"Тогда пришли некоторые из саддукеев, отвергающих воскресение, и спросили Его:"
ru,RUS_SYNODAL,Luke,Luke,41,Luke.20,Luke 20,19,Luke.20.28,Luke 20:28,27,"Учитель! Моисей написал нам, что если у кого умрет брат, имевший жену, и умрет бездетным, то брат его должен взять его жену и восставить семя брату своему."
ru,RUS_SYNODAL,Luke,Luke,41,Luke.20,Luke 20,19,Luke.20.29,Luke 20:29,28,"Было семь братьев, первый, взяв жену, умер бездетным;"
ru,RUS_SYNODAL,Luke,Luke,41,Luke.20,Luke 20,19,Luke.20.30,Luke 20:30,29,"взял ту жену второй, и тот умер бездетным;"
ru,RUS_SYNODAL,Luke,Luke,41,Luke.20,Luke 20,19,Luke.20.31,Luke 20:31,30,"взял ее третий; также и все семеро, и умерли, не оставив детей;"
ru,RUS_SYNODAL,Luke,Luke,41,Luke.20,Luke 20,19,Luke.20.32,Luke 20:32,31,после всех умерла и жена;
ru,RUS_SYNODAL,Luke,Luke,41,Luke.20,Luke 20,19,Luke.20.33,Luke 20:33,32,"итак, в воскресение которого из них будет она женою, ибо семеро имели ее женою?"
ru,RUS_SYNODAL,Luke,Luke,41,Luke.20,Luke 20,19,Luke.20.34,Luke 20:34,33,Иисус сказал им в ответ: чада века сего женятся и выходят замуж;
ru,RUS_SYNODAL,Luke,Luke,41,Luke.20,Luke 20,19,Luke.20.35,Luke 20:35,34,"а сподобившиеся достигнуть того века и воскресения из мертвых ни женятся, ни замуж не выходят,"
ru,RUS_SYNODAL,Luke,Luke,41,Luke.20,Luke 20,19,Luke.20.36,Luke 20:36,35,"и умереть уже не могут, ибо они равны Ангелам и суть сыны Божии, будучи сынами воскресения."
ru,RUS_SYNODAL,Luke,Luke,41,Luke.20,Luke 20,19,Luke.20.37,Luke 20:37,36,"А что мертвые воскреснут, и Моисей показал при купине, когда назвал Господа Богом Авраама и Богом Исаака и Богом Иакова."
ru,RUS_SYNODAL,Luke,Luke,41,Luke.20,Luke 20,19,Luke.20.38,Luke 20:38,37,"Бог же не есть [Бог] мертвых, но живых, ибо у Него все живы."
ru,RUS_SYNODAL,Luke,Luke,41,Luke.20,Luke 20,19,Luke.20.39,Luke 20:39,38,На это некоторые из книжников сказали: Учитель! Ты хорошо сказал.
ru,RUS_SYNODAL,Luke,Luke,41,Luke.20,Luke 20,19,Luke.20.40,Luke 20:40,39,И уже не смели спрашивать Его ни о чем. Он же сказал им:
ru,RUS_SYNODAL,Luke,Luke,41,Luke.20,Luke 20,19,Luke.20.41,Luke 20:41,40,"как говорят, что Христос есть Сын Давидов,"
ru,RUS_SYNODAL,Luke,Luke,41,Luke.20,Luke 20,19,Luke.20.42,Luke 20:42,41,"а сам Давид говорит в книге псалмов: сказал Господь Господу моему: седи одесную Меня,"
ru,RUS_SYNODAL,Luke,Luke,41,Luke.20,Luke 20,19,Luke.20.43,Luke 20:43,42,доколе положу врагов Твоих в подножие ног Твоих?
ru,RUS_SYNODAL,Luke,Luke,41,Luke.20,Luke 20,19,Luke.20.44,Luke 20:44,43,"Итак, Давид Господом называет Его; как же Он Сын ему?"
ru,RUS_SYNODAL,Luke,Luke,41,Luke.20,Luke 20,19,Luke.20.45,Luke 20:45,44,"И когда слушал весь народ, Он сказал ученикам Своим:"
ru,RUS_SYNODAL,Luke,Luke,41,Luke.20,Luke 20,19,Luke.20.46,Luke 20:46,45,"остерегайтесь книжников, которые любят ходить в длинных одеждах и любят приветствия в народных собраниях, председания в синагогах и предвозлежания на пиршествах,"
ru,RUS_SYNODAL,Luke,Luke,41,Luke.20,Luke 20,19,Luke.20.47,Luke 20:47,46,которые поедают домы вдов и лицемерно долго молятся; они примут тем большее осуждение.
ru,RUS_SYNODAL,Luke,Luke,41,Luke.21,Luke 21,20,Luke.21.1,Luke 21:1,0,"Взглянув же, Он увидел богатых, клавших дары свои в сокровищницу;"
ru,RUS_SYNODAL,Luke,Luke,41,Luke.21,Luke 21,20,Luke.21.2,Luke 21:2,1,"увидел также и бедную вдову, положившую туда две лепты,"
ru,RUS_SYNODAL,Luke,Luke,41,Luke.21,Luke 21,20,Luke.21.3,Luke 21:3,2,"и сказал: истинно говорю вам, что эта бедная вдова больше всех положила;"
ru,RUS_SYNODAL,Luke,Luke,41,Luke.21,Luke 21,20,Luke.21.4,Luke 21:4,3,"ибо все те от избытка своего положили в дар Богу, а она от скудости своей положила все пропитание свое, какое имела."
ru,RUS_SYNODAL,Luke,Luke,41,Luke.21,Luke 21,20,Luke.21.5,Luke 21:5,4,"И когда некоторые говорили о храме, что он украшен дорогими камнями и вкладами, Он сказал:"
ru,RUS_SYNODAL,Luke,Luke,41,Luke.21,Luke 21,20,Luke.21.6,Luke 21:6,5,"придут дни, в которые из того, что вы здесь видите, не останется камня на камне; все будет разрушено."
ru,RUS_SYNODAL,Luke,Luke,41,Luke.21,Luke 21,20,Luke.21.7,Luke 21:7,6,"И спросили Его: Учитель! когда же это будет? и какой признак, когда это должно произойти?"
ru,RUS_SYNODAL,Luke,Luke,41,Luke.21,Luke 21,20,Luke.21.8,Luke 21:8,7,"Он сказал: берегитесь, чтобы вас не ввели в заблуждение, ибо многие придут под именем Моим, говоря, что это Я; и это время близко: не ходите вслед их."
ru,RUS_SYNODAL,Luke,Luke,41,Luke.21,Luke 21,20,Luke.21.9,Luke 21:9,8,"Когда же услышите о войнах и смятениях, не ужасайтесь, ибо этому надлежит быть прежде; но не тотчас конец."
ru,RUS_SYNODAL,Luke,Luke,41,Luke.21,Luke 21,20,Luke.21.10,Luke 21:10,9,"Тогда сказал им: восстанет народ на народ, и царство на царство;"
ru,RUS_SYNODAL,Luke,Luke,41,Luke.21,Luke 21,20,Luke.21.11,Luke 21:11,10,"будут большие землетрясения по местам, и глады, и моры, и ужасные явления, и великие знамения с неба."
ru,RUS_SYNODAL,Luke,Luke,41,Luke.21,Luke 21,20,Luke.21.12,Luke 21:12,11,"Прежде же всего того возложат на вас руки и будут гнать [вас], предавая в синагоги и в темницы, и поведут пред царей и правителей за имя Мое;"
ru,RUS_SYNODAL,Luke,Luke,41,Luke.21,Luke 21,20,Luke.21.13,Luke 21:13,12,будет же это вам для свидетельства.
ru,RUS_SYNODAL,Luke,Luke,41,Luke.21,Luke 21,20,Luke.21.14,Luke 21:14,13,"Итак положите себе на сердце не обдумывать заранее, что отвечать,"
ru,RUS_SYNODAL,Luke,Luke,41,Luke.21,Luke 21,20,Luke.21.15,Luke 21:15,14,"ибо Я дам вам уста и премудрость, которой не возмогут противоречить ни противостоять все, противящиеся вам."
ru,RUS_SYNODAL,Luke,Luke,41,Luke.21,Luke 21,20,Luke.21.16,Luke 21:16,15,"Преданы также будете и родителями, и братьями, и родственниками, и друзьями, и некоторых из вас умертвят;"
ru,RUS_SYNODAL,Luke,Luke,41,Luke.21,Luke 21,20,Luke.21.17,Luke 21:17,16,"и будете ненавидимы всеми за имя Мое,"
ru,RUS_SYNODAL,Luke,Luke,41,Luke.21,Luke 21,20,Luke.21.18,Luke 21:18,17,"но и волос с головы вашей не пропадет, –"
ru,RUS_SYNODAL,Luke,Luke,41,Luke.21,Luke 21,20,Luke.21.19,Luke 21:19,18,терпением вашим спасайте души ваши.
ru,RUS_SYNODAL,Luke,Luke,41,Luke.21,Luke 21,20,Luke.21.20,Luke 21:20,19,"Когда же увидите Иерусалим, окруженный войсками, тогда знайте, что приблизилось запустение его:"
ru,RUS_SYNODAL,Luke,Luke,41,Luke.21,Luke 21,20,Luke.21.21,Luke 21:21,20,"тогда находящиеся в Иудее да бегут в горы; и кто в городе, выходи из него; и кто в окрестностях, не входи в него,"
ru,RUS_SYNODAL,Luke,Luke,41,Luke.21,Luke 21,20,Luke.21.22,Luke 21:22,21,"потому что это дни отмщения, да исполнится все написанное."
ru,RUS_SYNODAL,Luke,Luke,41,Luke.21,Luke 21,20,Luke.21.23,Luke 21:23,22,Горе же беременным и питающим сосцами в те дни; ибо великое будет бедствие на земле и гнев на народ сей:
ru,RUS_SYNODAL,Luke,Luke,41,Luke.21,Luke 21,20,Luke.21.24,Luke 21:24,23,"и падут от острия меча, и отведутся в плен во все народы; и Иерусалим будет попираем язычниками, доколе не окончатся времена язычников."
ru,RUS_SYNODAL,Luke,Luke,41,Luke.21,Luke 21,20,Luke.21.25,Luke 21:25,24,"И будут знамения в солнце и луне и звездах, а на земле уныние народов и недоумение; и море восшумит и возмутится;"
