languageCode,code,bookOsisId,bookSblId,bookOrderIndex,chapterOsisId,chapterSblId,chapterOrderIndex,verseOsisId,verseSblId,verseOrderIndex,text
ru,RUS_SYNODAL,Luke,Luke,41,Luke.5,Luke 5,4,Luke.5.17,Luke 5:17,16,"В один день, когда Он учил, и сидели тут фарисеи и законоучители, пришедшие из всех мест Галилеи и Иудеи и из Иерусалима, и сила Господня являлась в исцелении [больных], –"
ru,RUS_SYNODAL,Luke,Luke,41,Luke.5,Luke 5,4,Luke.5.18,Luke 5:18,17,"вот, принесли некоторые на постели человека, который был расслаблен, и старались внести его [в дом] и положить перед Иисусом;"
ru,RUS_SYNODAL,Luke,Luke,41,Luke.5,Luke 5,4,Luke.5.19,Luke 5:19,18,"и, не найдя, где пронести его за многолюдством, влезли на верх дома и сквозь кровлю спустили его с постелью на средину пред Иисуса."
ru,RUS_SYNODAL,Luke,Luke,41,Luke.5,Luke 5,4,Luke.5.20,Luke 5:20,19,"И Он, видя веру их, сказал человеку тому: прощаются тебе грехи твои."
ru,RUS_SYNODAL,Luke,Luke,41,Luke.5,Luke 5,4,Luke.5.21,Luke 5:21,20,"Книжники и фарисеи начали рассуждать, говоря: кто это, который богохульствует? кто может прощать грехи, кроме одного Бога?"
ru,RUS_SYNODAL,Luke,Luke,41,Luke.5,Luke 5,4,Luke.5.22,Luke 5:22,21,"Иисус, уразумев помышления их, сказал им в ответ: что вы помышляете в сердцах ваших?"
ru,RUS_SYNODAL,Luke,Luke,41,Luke.5,Luke 5,4,Luke.5.23,Luke 5:23,22,"Что легче сказать: прощаются тебе грехи твои, или сказать: встань и ходи?"
ru,RUS_SYNODAL,Luke,Luke,41,Luke.5,Luke 5,4,Luke.5.24,Luke 5:24,23,"Но чтобы вы знали, что Сын Человеческий имеет власть на земле прощать грехи, – сказал Он расслабленному: тебе говорю: встань, возьми постель твою и иди в дом твой."
ru,RUS_SYNODAL,Luke,Luke,41,Luke.5,Luke 5,4,Luke.5.25,Luke 5:25,24,"И он тотчас встал перед ними, взял, на чем лежал, и пошел в дом свой, славя Бога."
ru,RUS_SYNODAL,Luke,Luke,41,Luke.5,Luke 5,4,Luke.5.26,Luke 5:26,25,"И ужас объял всех, и славили Бога и, быв исполнены страха, говорили: чудные дела видели мы ныне."
ru,RUS_SYNODAL,Luke,Luke,41,Luke.5,Luke 5,4,Luke.5.27,Luke 5:27,26,"После сего [Иисус] вышел и увидел мытаря, именем Левия, сидящего у сбора пошлин, и говорит ему: следуй за Мною."
ru,RUS_SYNODAL,Luke,Luke,41,Luke.5,Luke 5,4,Luke.5.28,Luke 5:28,27,"И он, оставив все, встал и последовал за Ним."
ru,RUS_SYNODAL,Luke,Luke,41,Luke.5,Luke 5,4,Luke.5.29,Luke 5:29,28,"И сделал для Него Левий в доме своем большое угощение; и там было множество мытарей и других, которые возлежали с ними."
ru,RUS_SYNODAL,Luke,Luke,41,Luke.5,Luke 5,4,Luke.5.30,Luke 5:30,29,Книжники же и фарисеи роптали и говорили ученикам Его: зачем вы едите и пьете с мытарями и грешниками?
ru,RUS_SYNODAL,Luke,Luke,41,Luke.5,Luke 5,4,Luke.5.31,Luke 5:31,30,"Иисус же сказал им в ответ: не здоровые имеют нужду во враче, но больные;"
ru,RUS_SYNODAL,Luke,Luke,41,Luke.5,Luke 5,4,Luke.5.32,Luke 5:32,31,"Я пришел призвать не праведников, а грешников к покаянию."
ru,RUS_SYNODAL,Luke,Luke,41,Luke.5,Luke 5,4,Luke.5.33,Luke 5:33,32,"Они же сказали Ему: почему ученики Иоанновы постятся часто и молитвы творят, также и фарисейские, а Твои едят и пьют?"
ru,RUS_SYNODAL,Luke,Luke,41,Luke.5,Luke 5,4,Luke.5.34,Luke 5:34,33,"Он сказал им: можете ли заставить сынов чертога брачного поститься, когда с ними жених?"
ru,RUS_SYNODAL,Luke,Luke,41,Luke.5,Luke 5,4,Luke.5.35,Luke 5:35,34,"Но придут дни, когда отнимется у них жених, и тогда будут поститься в те дни."
ru,RUS_SYNODAL,Luke,Luke,41,Luke.5,Luke 5,4,Luke.5.36,Luke 5:36,35,"При сем сказал им притчу: никто не приставляет заплаты к ветхой одежде, отодрав от новой одежды; а иначе и новую раздерет, и к старой не подойдет заплата от новой."
ru,RUS_SYNODAL,Luke,Luke,41,Luke.5,Luke 5,4,Luke.5.37,Luke 5:37,36,"И никто не вливает молодого вина в мехи ветхие; а иначе молодое вино прорвет мехи, и само вытечет, и мехи пропадут;"
ru,RUS_SYNODAL,Luke,Luke,41,Luke.5,Luke 5,4,Luke.5.38,Luke 5:38,37,но молодое вино должно вливать в мехи новые; тогда сбережется и то и другое.
ru,RUS_SYNODAL,Luke,Luke,41,Luke.5,Luke 5,4,Luke.5.39,Luke 5:39,38,"И никто, пив старое [вино], не захочет тотчас молодого, ибо говорит: старое лучше."
ru,RUS_SYNODAL,Luke,Luke,41,Luke.6,Luke 6,5,Luke.6.1,Luke 6:1,0,"В субботу, первую по втором дне Пасхи, случилось Ему проходить засеянными полями, и ученики Его срывали колосья и ели, растирая руками."
ru,RUS_SYNODAL,Luke,Luke,41,Luke.6,Luke 6,5,Luke.6.2,Luke 6:2,1,"Некоторые же из фарисеев сказали им: зачем вы делаете то, чего не должно делать в субботы?"
ru,RUS_SYNODAL,Luke,Luke,41,Luke.6,Luke 6,5,Luke.6.3,Luke 6:3,2,"Иисус сказал им в ответ: разве вы не читали, что сделал Давид, когда взалкал сам и бывшие с ним?"
ru,RUS_SYNODAL,Luke,Luke,41,Luke.6,Luke 6,5,Luke.6.4,Luke 6:4,3,"Как он вошел в дом Божий, взял хлебы предложения, которых не должно было есть никому, кроме одних священников, и ел, и дал бывшим с ним?"
ru,RUS_SYNODAL,Luke,Luke,41,Luke.6,Luke 6,5,Luke.6.5,Luke 6:5,4,И сказал им: Сын Человеческий есть господин и субботы.
ru,RUS_SYNODAL,Luke,Luke,41,Luke.6,Luke 6,5,Luke.6.6,Luke 6:6,5,"Случилось же и в другую субботу войти Ему в синагогу и учить. Там был человек, у которого правая рука была сухая."
ru,RUS_SYNODAL,Luke,Luke,41,Luke.6,Luke 6,5,Luke.6.7,Luke 6:7,6,"Книжники же и фарисеи наблюдали за Ним, не исцелит ли в субботу, чтобы найти обвинение против Него."
ru,RUS_SYNODAL,Luke,Luke,41,Luke.6,Luke 6,5,Luke.6.8,Luke 6:8,7,"Но Он, зная помышления их, сказал человеку, имеющему сухую руку: встань и выступи на средину. И он встал и выступил."
ru,RUS_SYNODAL,Luke,Luke,41,Luke.6,Luke 6,5,Luke.6.9,Luke 6:9,8,"Тогда сказал им Иисус: спрошу Я вас: что должно делать в субботу? добро, или зло? спасти душу, или погубить? Они молчали."
ru,RUS_SYNODAL,Luke,Luke,41,Luke.6,Luke 6,5,Luke.6.10,Luke 6:10,9,"И, посмотрев на всех их, сказал тому человеку: протяни руку твою. Он так и сделал; и стала рука его здорова, как другая."
ru,RUS_SYNODAL,Luke,Luke,41,Luke.6,Luke 6,5,Luke.6.11,Luke 6:11,10,"Они же пришли в бешенство и говорили между собою, что бы им сделать с Иисусом."
ru,RUS_SYNODAL,Luke,Luke,41,Luke.6,Luke 6,5,Luke.6.12,Luke 6:12,11,В те дни взошел Он на гору помолиться и пробыл всю ночь в молитве к Богу.
ru,RUS_SYNODAL,Luke,Luke,41,Luke.6,Luke 6,5,Luke.6.13,Luke 6:13,12,"Когда же настал день, призвал учеников Своих и избрал из них двенадцать, которых и наименовал Апостолами:"
ru,RUS_SYNODAL,Luke,Luke,41,Luke.6,Luke 6,5,Luke.6.14,Luke 6:14,13,"Симона, которого и назвал Петром, и Андрея, брата его, Иакова и Иоанна, Филиппа и Варфоломея,"
ru,RUS_SYNODAL,Luke,Luke,41,Luke.6,Luke 6,5,Luke.6.15,Luke 6:15,14,"Матфея и Фому, Иакова Алфеева и Симона, прозываемого Зилотом,"
ru,RUS_SYNODAL,Luke,Luke,41,Luke.6,Luke 6,5,Luke.6.16,Luke 6:16,15,"Иуду Иаковлева и Иуду Искариота, который потом сделался предателем."
ru,RUS_SYNODAL,Luke,Luke,41,Luke.6,Luke 6,5,Luke.6.17,Luke 6:17,16,"И, сойдя с ними, стал Он на ровном месте, и множество учеников Его, и много народа из всей Иудеи и Иерусалима и приморских мест Тирских и Сидонских,"
ru,RUS_SYNODAL,Luke,Luke,41,Luke.6,Luke 6,5,Luke.6.18,Luke 6:18,17,"которые пришли послушать Его и исцелиться от болезней своих, также и страждущие от нечистых духов; и исцелялись."
ru,RUS_SYNODAL,Luke,Luke,41,Luke.6,Luke 6,5,Luke.6.19,Luke 6:19,18,"И весь народ искал прикасаться к Нему, потому что от Него исходила сила и исцеляла всех."
ru,RUS_SYNODAL,Luke,Luke,41,Luke.6,Luke 6,5,Luke.6.20,Luke 6:20,19,"И Он, возведя очи Свои на учеников Своих, говорил: Блаженны нищие духом, ибо ваше есть Царствие Божие."
ru,RUS_SYNODAL,Luke,Luke,41,Luke.6,Luke 6,5,Luke.6.21,Luke 6:21,20,"Блаженны алчущие ныне, ибо насытитесь. Блаженны плачущие ныне, ибо воссмеетесь."
ru,RUS_SYNODAL,Luke,Luke,41,Luke.6,Luke 6,5,Luke.6.22,Luke 6:22,21,"Блаженны вы, когда возненавидят вас люди и когда отлучат вас, и будут поносить, и пронесут имя ваше, как бесчестное, за Сына Человеческого."
ru,RUS_SYNODAL,Luke,Luke,41,Luke.6,Luke 6,5,Luke.6.23,Luke 6:23,22,"Возрадуйтесь в тот день и возвеселитесь, ибо велика вам награда на небесах. Так поступали с пророками отцы их."
ru,RUS_SYNODAL,Luke,Luke,41,Luke.6,Luke 6,5,Luke.6.24,Luke 6:24,23,"Напротив, горе вам, богатые! ибо вы уже получили свое утешение."
ru,RUS_SYNODAL,Luke,Luke,41,Luke.6,Luke 6,5,Luke.6.25,Luke 6:25,24,"Горе вам, пресыщенные ныне! ибо взалчете. Горе вам, смеющиеся ныне! ибо восплачете и возрыдаете."
ru,RUS_SYNODAL,Luke,Luke,41,Luke.6,Luke 6,5,Luke.6.26,Luke 6:26,25,"Горе вам, когда все люди будут говорить о вас хорошо! ибо так поступали с лжепророками отцы их."
ru,RUS_SYNODAL,Luke,Luke,41,Luke.6,Luke 6,5,Luke.6.27,Luke 6:27,26,"Но вам, слушающим, говорю: любите врагов ваших, благотворите ненавидящим вас,"
ru,RUS_SYNODAL,Luke,Luke,41,Luke.6,Luke 6,5,Luke.6.28,Luke 6:28,27,благословляйте проклинающих вас и молитесь за обижающих вас.
ru,RUS_SYNODAL,Luke,Luke,41,Luke.6,Luke 6,5,Luke.6.29,Luke 6:29,28,"Ударившему тебя по щеке подставь и другую, и отнимающему у тебя верхнюю одежду не препятствуй взять и рубашку."
ru,RUS_SYNODAL,Luke,Luke,41,Luke.6,Luke 6,5,Luke.6.30,Luke 6:30,29,"Всякому, просящему у тебя, давай, и от взявшего твое не требуй назад."
ru,RUS_SYNODAL,Luke,Luke,41,Luke.6,Luke 6,5,Luke.6.31,Luke 6:31,30,"И как хотите, чтобы с вами поступали люди, так и вы поступайте с ними."
ru,RUS_SYNODAL,Luke,Luke,41,Luke.6,Luke 6,5,Luke.6.32,Luke 6:32,31,"И если любите любящих вас, какая вам за то благодарность? ибо и грешники любящих их любят."
ru,RUS_SYNODAL,Luke,Luke,41,Luke.6,Luke 6,5,Luke.6.33,Luke 6:33,32,"И если делаете добро тем, которые вам делают добро, какая вам за то благодарность? ибо и грешники то же делают."
ru,RUS_SYNODAL,Luke,Luke,41,Luke.6,Luke 6,5,Luke.6.34,Luke 6:34,33,"И если взаймы даете тем, от которых надеетесь получить обратно, какая вам за то благодарность? ибо и грешники дают взаймы грешникам, чтобы получить обратно столько же."
ru,RUS_SYNODAL,Luke,Luke,41,Luke.6,Luke 6,5,Luke.6.35,Luke 6:35,34,"Но вы любите врагов ваших, и благотворите, и взаймы давайте, не ожидая ничего; и будет вам награда великая, и будете сынами Всевышнего; ибо Он благ и к неблагодарным и злым."
ru,RUS_SYNODAL,Luke,Luke,41,Luke.6,Luke 6,5,Luke.6.36,Luke 6:36,35,"Итак, будьте милосерды, как и Отец ваш милосерд."
ru,RUS_SYNODAL,Luke,Luke,41,Luke.6,Luke 6,5,Luke.6.37,Luke 6:37,36,"Не судите, и не будете судимы; не осуждайте, и не будете осуждены; прощайте, и прощены будете;"
ru,RUS_SYNODAL,Luke,Luke,41,Luke.6,Luke 6,5,Luke.6.38,Luke 6:38,37,"давайте, и дастся вам: мерою доброю, утрясенною, нагнетенною и переполненною отсыплют вам в лоно ваше; ибо, какою мерою мерите, такою же отмерится и вам."
ru,RUS_SYNODAL,Luke,Luke,41,Luke.6,Luke 6,5,Luke.6.39,Luke 6:39,38,Сказал также им притчу: может ли слепой водить слепого? не оба ли упадут в яму?
ru,RUS_SYNODAL,Luke,Luke,41,Luke.6,Luke 6,5,Luke.6.40,Luke 6:40,39,"Ученик не бывает выше своего учителя; но, и усовершенствовавшись, будет всякий, как учитель его."
ru,RUS_SYNODAL,Luke,Luke,41,Luke.6,Luke 6,5,Luke.6.41,Luke 6:41,40,"Что ты смотришь на сучок в глазе брата твоего, а бревна в твоем глазе не чувствуешь?"
ru,RUS_SYNODAL,Luke,Luke,41,Luke.6,Luke 6,5,Luke.6.42,Luke 6:42,41,"Или, как можешь сказать брату твоему: брат! дай, я выну сучок из глаза твоего, когда сам не видишь бревна в твоем глазе? Лицемер! вынь прежде бревно из твоего глаза, и тогда увидишь, как вынуть сучок из глаза брата твоего."
ru,RUS_SYNODAL,Luke,Luke,41,Luke.6,Luke 6,5,Luke.6.43,Luke 6:43,42,"Нет доброго дерева, которое приносило бы худой плод; и нет худого дерева, которое приносило бы плод добрый,"
ru,RUS_SYNODAL,Luke,Luke,41,Luke.6,Luke 6,5,Luke.6.44,Luke 6:44,43,"ибо всякое дерево познается по плоду своему, потому что не собирают смокв с терновника и не снимают винограда с кустарника."
ru,RUS_SYNODAL,Luke,Luke,41,Luke.6,Luke 6,5,Luke.6.45,Luke 6:45,44,"Добрый человек из доброго сокровища сердца своего выносит доброе, а злой человек из злого сокровища сердца своего выносит злое, ибо от избытка сердца говорят уста его."
ru,RUS_SYNODAL,Luke,Luke,41,Luke.6,Luke 6,5,Luke.6.46,Luke 6:46,45,"Что вы зовете Меня: Господи! Господи! – и не делаете того, что Я говорю?"
ru,RUS_SYNODAL,Luke,Luke,41,Luke.6,Luke 6,5,Luke.6.47,Luke 6:47,46,"Всякий, приходящий ко Мне и слушающий слова Мои и исполняющий их, скажу вам, кому подобен."
ru,RUS_SYNODAL,Luke,Luke,41,Luke.6,Luke 6,5,Luke.6.48,Luke 6:48,47,"Он подобен человеку, строящему дом, который копал, углубился и положил основание на камне; почему, когда случилось наводнение и вода наперла на этот дом, то не могла поколебать его, потому что он основан был на камне."
ru,RUS_SYNODAL,Luke,Luke,41,Luke.6,Luke 6,5,Luke.6.49,Luke 6:49,48,"А слушающий и неисполняющий подобен человеку, построившему дом на земле без основания, который, когда наперла на него вода, тотчас обрушился; и разрушение дома сего было великое."
ru,RUS_SYNODAL,Luke,Luke,41,Luke.7,Luke 7,6,Luke.7.1,Luke 7:1,0,"Когда Он окончил все слова Свои к слушавшему народу, то вошел в Капернаум."
ru,RUS_SYNODAL,Luke,Luke,41,Luke.7,Luke 7,6,Luke.7.2,Luke 7:2,1,"У одного сотника слуга, которым он дорожил, был болен при смерти."
ru,RUS_SYNODAL,Luke,Luke,41,Luke.7,Luke 7,6,Luke.7.3,Luke 7:3,2,"Услышав об Иисусе, он послал к Нему Иудейских старейшин просить Его, чтобы пришел исцелить слугу его."
ru,RUS_SYNODAL,Luke,Luke,41,Luke.7,Luke 7,6,Luke.7.4,Luke 7:4,3,"И они, придя к Иисусу, просили Его убедительно, говоря: он достоин, чтобы Ты сделал для него это,"
ru,RUS_SYNODAL,Luke,Luke,41,Luke.7,Luke 7,6,Luke.7.5,Luke 7:5,4,ибо он любит народ наш и построил нам синагогу.
ru,RUS_SYNODAL,Luke,Luke,41,Luke.7,Luke 7,6,Luke.7.6,Luke 7:6,5,"Иисус пошел с ними. И когда Он недалеко уже был от дома, сотник прислал к Нему друзей сказать Ему: не трудись, Господи! ибо я недостоин, чтобы Ты вошел под кров мой;"
ru,RUS_SYNODAL,Luke,Luke,41,Luke.7,Luke 7,6,Luke.7.7,Luke 7:7,6,"потому и себя самого не почел я достойным придти к Тебе; но скажи слово, и выздоровеет слуга мой."
ru,RUS_SYNODAL,Luke,Luke,41,Luke.7,Luke 7,6,Luke.7.8,Luke 7:8,7,"Ибо я и подвластный человек, но, имея у себя в подчинении воинов, говорю одному: пойди, и идет; и другому: приди, и приходит; и слуге моему: сделай то, и делает."
ru,RUS_SYNODAL,Luke,Luke,41,Luke.7,Luke 7,6,Luke.7.9,Luke 7:9,8,"Услышав сие, Иисус удивился ему и, обратившись, сказал идущему за Ним народу: сказываю вам, что и в Израиле не нашел Я такой веры."
ru,RUS_SYNODAL,Luke,Luke,41,Luke.7,Luke 7,6,Luke.7.10,Luke 7:10,9,"Посланные, возвратившись в дом, нашли больного слугу выздоровевшим."
ru,RUS_SYNODAL,Luke,Luke,41,Luke.7,Luke 7,6,Luke.7.11,Luke 7:11,10,"После сего Иисус пошел в город, называемый Наин; и с Ним шли многие из учеников Его и множество народа."
ru,RUS_SYNODAL,Luke,Luke,41,Luke.7,Luke 7,6,Luke.7.12,Luke 7:12,11,"Когда же Он приблизился к городским воротам, тут выносили умершего, единственного сына у матери, а она была вдова; и много народа шло с нею из города."
ru,RUS_SYNODAL,Luke,Luke,41,Luke.7,Luke 7,6,Luke.7.13,Luke 7:13,12,"Увидев ее, Господь сжалился над нею и сказал ей: не плачь."
ru,RUS_SYNODAL,Luke,Luke,41,Luke.7,Luke 7,6,Luke.7.14,Luke 7:14,13,"И, подойдя, прикоснулся к одру; несшие остановились, и Он сказал: юноша! тебе говорю, встань!"
ru,RUS_SYNODAL,Luke,Luke,41,Luke.7,Luke 7,6,Luke.7.15,Luke 7:15,14,"Мертвый, поднявшись, сел и стал говорить; и отдал его [Иисус] матери его."
ru,RUS_SYNODAL,Luke,Luke,41,Luke.7,Luke 7,6,Luke.7.16,Luke 7:16,15,"И всех объял страх, и славили Бога, говоря: великий пророк восстал между нами, и Бог посетил народ Свой."
ru,RUS_SYNODAL,Luke,Luke,41,Luke.7,Luke 7,6,Luke.7.17,Luke 7:17,16,Такое мнение о Нем распространилось по всей Иудее и по всей окрестности.
ru,RUS_SYNODAL,Luke,Luke,41,Luke.7,Luke 7,6,Luke.7.18,Luke 7:18,17,И возвестили Иоанну ученики его о всем том.
ru,RUS_SYNODAL,Luke,Luke,41,Luke.7,Luke 7,6,Luke.7.19,Luke 7:19,18,"Иоанн, призвав двоих из учеников своих, послал к Иисусу спросить: Ты ли Тот, Который должен придти, или ожидать нам другого?"
ru,RUS_SYNODAL,Luke,Luke,41,Luke.7,Luke 7,6,Luke.7.20,Luke 7:20,19,"Они, придя к [Иисусу], сказали: Иоанн Креститель послал нас к Тебе спросить: Ты ли Тот, Которому должно придти, или другого ожидать нам?"
ru,RUS_SYNODAL,Luke,Luke,41,Luke.7,Luke 7,6,Luke.7.21,Luke 7:21,20,"А в это время Он многих исцелил от болезней и недугов и от злых духов, и многим слепым даровал зрение."
ru,RUS_SYNODAL,Luke,Luke,41,Luke.7,Luke 7,6,Luke.7.22,Luke 7:22,21,"И сказал им Иисус в ответ: пойдите, скажите Иоанну, что вы видели и слышали: слепые прозревают, хромые ходят, прокаженные очищаются, глухие слышат, мертвые воскресают, нищие благовествуют;"
ru,RUS_SYNODAL,Luke,Luke,41,Luke.7,Luke 7,6,Luke.7.23,Luke 7:23,22,"и блажен, кто не соблазнится о Мне!"
ru,RUS_SYNODAL,Luke,Luke,41,Luke.7,Luke 7,6,Luke.7.24,Luke 7:24,23,"По отшествии же посланных Иоанном, начал говорить к народу об Иоанне: что смотреть ходили вы в пустыню? трость ли, ветром колеблемую?"
ru,RUS_SYNODAL,Luke,Luke,41,Luke.7,Luke 7,6,Luke.7.25,Luke 7:25,24,"Что же смотреть ходили вы? человека ли, одетого в мягкие одежды? Но одевающиеся пышно и роскошно живущие находятся при дворах царских."
ru,RUS_SYNODAL,Luke,Luke,41,Luke.7,Luke 7,6,Luke.7.26,Luke 7:26,25,"Что же смотреть ходили вы? пророка ли? Да, говорю вам, и больше пророка."
ru,RUS_SYNODAL,Luke,Luke,41,Luke.7,Luke 7,6,Luke.7.27,Luke 7:27,26,"Сей есть, о котором написано: вот, Я посылаю Ангела Моего пред лицем Твоим, который приготовит путь Твой пред Тобою."
ru,RUS_SYNODAL,Luke,Luke,41,Luke.7,Luke 7,6,Luke.7.28,Luke 7:28,27,Ибо говорю вам: из рожденных женами нет ни одного пророка больше Иоанна Крестителя; но меньший в Царствии Божием больше его.
