languageCode,code,bookOsisId,bookSblId,bookOrderIndex,chapterOsisId,chapterSblId,chapterOrderIndex,verseOsisId,verseSblId,verseOrderIndex,text
ru,RUS_SYNODAL,Jude,Jude,64,Jude.1,Jude 1,0,Jude.1.1,Jude 1:1,0,"Иуда, раб Иисуса Христа, брат Иакова, призванным, которые освящены Богом Отцем и сохранены Иисусом Христом:"
ru,RUS_SYNODAL,Jude,Jude,64,Jude.1,Jude 1,0,Jude.1.2,Jude 1:2,1,милость вам и мир и любовь да умножатся.
ru,RUS_SYNODAL,Jude,Jude,64,Jude.1,Jude 1,0,Jude.1.3,Jude 1:3,2,"Возлюбленные! имея все усердие писать вам об общем спасении, я почел за нужное написать вам увещание – подвизаться за веру, однажды преданную святым."
ru,RUS_SYNODAL,Jude,Jude,64,Jude.1,Jude 1,0,Jude.1.4,Jude 1:4,3,"Ибо вкрались некоторые люди, издревле предназначенные к сему осуждению, нечестивые, обращающие благодать Бога нашего в [повод к] распутству и отвергающиеся единого Владыки Бога и Господа нашего Иисуса Христа."
ru,RUS_SYNODAL,Jude,Jude,64,Jude.1,Jude 1,0,Jude.1.5,Jude 1:5,4,"Я хочу напомнить вам, уже знающим это, что Господь, избавив народ из земли Египетской, потом неверовавших погубил,"
ru,RUS_SYNODAL,Jude,Jude,64,Jude.1,Jude 1,0,Jude.1.6,Jude 1:6,5,"и ангелов, не сохранивших своего достоинства, но оставивших свое жилище, соблюдает в вечных узах, под мраком, на суд великого дня."
ru,RUS_SYNODAL,Jude,Jude,64,Jude.1,Jude 1,0,Jude.1.7,Jude 1:7,6,"Как Содом и Гоморра и окрестные города, подобно им блудодействовавшие и ходившие за иною плотию, подвергшись казни огня вечного, поставлены в пример, –"
ru,RUS_SYNODAL,Jude,Jude,64,Jude.1,Jude 1,0,Jude.1.8,Jude 1:8,7,"так точно будет и с сими мечтателями, которые оскверняют плоть, отвергают начальства и злословят высокие власти."
ru,RUS_SYNODAL,Jude,Jude,64,Jude.1,Jude 1,0,Jude.1.9,Jude 1:9,8,"Михаил Архангел, когда говорил с диаволом, споря о Моисеевом теле, не смел произнести укоризненного суда, но сказал: ""да запретит тебе Господь""."
ru,RUS_SYNODAL,Jude,Jude,64,Jude.1,Jude 1,0,Jude.1.10,Jude 1:10,9,"А сии злословят то, чего не знают; что же по природе, как бессловесные животные, знают, тем растлевают себя."
ru,RUS_SYNODAL,Jude,Jude,64,Jude.1,Jude 1,0,Jude.1.11,Jude 1:11,10,"Горе им, потому что идут путем Каиновым, предаются обольщению мзды, как Валаам, и в упорстве погибают, как Корей."
ru,RUS_SYNODAL,Jude,Jude,64,Jude.1,Jude 1,0,Jude.1.12,Jude 1:12,11,"Таковые бывают соблазном на ваших вечерях любви; пиршествуя с вами, без страха утучняют себя. Это безводные облака, носимые ветром; осенние деревья, бесплодные, дважды умершие, исторгнутые;"
ru,RUS_SYNODAL,Jude,Jude,64,Jude.1,Jude 1,0,Jude.1.13,Jude 1:13,12,"свирепые морские волны, пенящиеся срамотами своими; звезды блуждающие, которым блюдется мрак тьмы на веки."
ru,RUS_SYNODAL,Jude,Jude,64,Jude.1,Jude 1,0,Jude.1.14,Jude 1:14,13,"О них пророчествовал и Енох, седьмый от Адама, говоря: ""се, идет Господь со тьмами святых Ангелов Своих –"
ru,RUS_SYNODAL,Jude,Jude,64,Jude.1,Jude 1,0,Jude.1.15,Jude 1:15,14,"сотворить суд над всеми и обличить всех между ними нечестивых во всех делах, которые произвело их нечестие, и во всех жестоких словах, которые произносили на Него нечестивые грешники""."
ru,RUS_SYNODAL,Jude,Jude,64,Jude.1,Jude 1,0,Jude.1.16,Jude 1:16,15,"Это ропотники, ничем не довольные, поступающие по своим похотям (нечестиво и беззаконно); уста их произносят надутые слова; они оказывают лицеприятие для корысти."
ru,RUS_SYNODAL,Jude,Jude,64,Jude.1,Jude 1,0,Jude.1.17,Jude 1:17,16,"Но вы, возлюбленные, помните предсказанное Апостолами Господа нашего Иисуса Христа."
ru,RUS_SYNODAL,Jude,Jude,64,Jude.1,Jude 1,0,Jude.1.18,Jude 1:18,17,"Они говорили вам, что в последнее время появятся ругатели, поступающие по своим нечестивым похотям."
ru,RUS_SYNODAL,Jude,Jude,64,Jude.1,Jude 1,0,Jude.1.19,Jude 1:19,18,"Это люди, отделяющие себя (от единства веры), душевные, не имеющие духа."
ru,RUS_SYNODAL,Jude,Jude,64,Jude.1,Jude 1,0,Jude.1.20,Jude 1:20,19,"А вы, возлюбленные, назидая себя на святейшей вере вашей, молясь Духом Святым,"
ru,RUS_SYNODAL,Jude,Jude,64,Jude.1,Jude 1,0,Jude.1.21,Jude 1:21,20,"сохраняйте себя в любви Божией, ожидая милости от Господа нашего Иисуса Христа, для вечной жизни."
ru,RUS_SYNODAL,Jude,Jude,64,Jude.1,Jude 1,0,Jude.1.22,Jude 1:22,21,"И к одним будьте милостивы, с рассмотрением,"
ru,RUS_SYNODAL,Jude,Jude,64,Jude.1,Jude 1,0,Jude.1.23,Jude 1:23,22,"а других страхом спасайте, исторгая из огня, обличайте же со страхом, гнушаясь даже одеждою, которая осквернена плотью."
ru,RUS_SYNODAL,Jude,Jude,64,Jude.1,Jude 1,0,Jude.1.24,Jude 1:24,23,"Могущему же соблюсти вас от падения и поставить пред славою Своею непорочными в радости,"
ru,RUS_SYNODAL,Jude,Jude,64,Jude.1,Jude 1,0,Jude.1.25,Jude 1:25,24,"Единому Премудрому Богу, Спасителю нашему чрез Иисуса Христа Господа нашего, слава и величие, сила и власть прежде всех веков, ныне и во все веки. Аминь."
