languageCode,code,bookOsisId,bookSblId,bookOrderIndex,chapterOsisId,chapterSblId,chapterOrderIndex,verseOsisId,verseSblId,verseOrderIndex,text
en,ESV,Song,Song,21,Song.1,Song 1,0,Song.1.1,Song 1:1,0,"The Song of Songs, which is Solomon's."
en,ESV,Song,Song,21,Song.1,Song 1,0,Song.1.2,Song 1:2,1,Let him kiss me with the kisses of his mouth! For your love is better than wine;
en,ESV,Song,Song,21,Song.1,Song 1,0,Song.1.3,Song 1:3,2,your anointing oils are fragrant; your name is oil poured out; therefore virgins love you.
en,ESV,Song,Song,21,Song.1,Song 1,0,Song.1.4,Song 1:4,3,Draw me after you; let us run. The king has brought me into his chambers. We will exult and rejoice in you; we will extol your love more than wine; rightly do they love you.
en,ESV,Song,Song,21,Song.1,Song 1,0,Song.1.5,Song 1:5,4,"I am very dark, but lovely, O daughters of Jerusalem, like the tents of Kedar, like the curtains of Solomon."
en,ESV,Song,Song,21,Song.1,Song 1,0,Song.1.6,Song 1:6,5,"Do not gaze at me because I am dark, because the sun has looked upon me. My mother's sons were angry with me; they made me keeper of the vineyards, but my own vineyard I have not kept!"
en,ESV,Song,Song,21,Song.1,Song 1,0,Song.1.7,Song 1:7,6,"Tell me, you whom my soul loves, where you pasture your flock, where you make it lie down at noon; for why should I be like one who veils herself beside the flocks of your companions?"
en,ESV,Song,Song,21,Song.1,Song 1,0,Song.1.8,Song 1:8,7,"If you do not know, O most beautiful among women, follow in the tracks of the flock, and pasture your young goats beside the shepherds' tents."
en,ESV,Song,Song,21,Song.1,Song 1,0,Song.1.9,Song 1:9,8,"I compare you, my love, to a mare among Pharaoh's chariots."
en,ESV,Song,Song,21,Song.1,Song 1,0,Song.1.10,Song 1:10,9,"Your cheeks are lovely with ornaments, your neck with strings of jewels."
en,ESV,Song,Song,21,Song.1,Song 1,0,Song.1.11,Song 1:11,10,"We will make for you ornaments of gold, studded with silver."
en,ESV,Song,Song,21,Song.1,Song 1,0,Song.1.12,Song 1:12,11,"While the king was on his couch, my nard gave forth its fragrance."
en,ESV,Song,Song,21,Song.1,Song 1,0,Song.1.13,Song 1:13,12,My beloved is to me a sachet of myrrh that lies between my breasts.
en,ESV,Song,Song,21,Song.1,Song 1,0,Song.1.14,Song 1:14,13,My beloved is to me a cluster of henna blossoms in the vineyards of Engedi.
en,ESV,Song,Song,21,Song.1,Song 1,0,Song.1.15,Song 1:15,14,"Behold, you are beautiful, my love; behold, you are beautiful; your eyes are doves."
en,ESV,Song,Song,21,Song.1,Song 1,0,Song.1.16,Song 1:16,15,"Behold, you are beautiful, my beloved, truly delightful. Our couch is green;"
en,ESV,Song,Song,21,Song.1,Song 1,0,Song.1.17,Song 1:17,16,the beams of our house are cedar; our rafters are pine.
en,ESV,Song,Song,21,Song.2,Song 2,1,Song.2.1,Song 2:1,0,"I am a rose of Sharon, a lily of the valleys."
en,ESV,Song,Song,21,Song.2,Song 2,1,Song.2.2,Song 2:2,1,"As a lily among brambles, so is my love among the young women."
en,ESV,Song,Song,21,Song.2,Song 2,1,Song.2.3,Song 2:3,2,"As an apple tree among the trees of the forest, so is my beloved among the young men. With great delight I sat in his shadow, and his fruit was sweet to my taste,"
en,ESV,Song,Song,21,Song.2,Song 2,1,Song.2.4,Song 2:4,3,"He brought me to the banqueting house, and his banner over me was love."
en,ESV,Song,Song,21,Song.2,Song 2,1,Song.2.5,Song 2:5,4,"Sustain me with raisins; refresh me with apples, for I am sick with love."
en,ESV,Song,Song,21,Song.2,Song 2,1,Song.2.6,Song 2:6,5,"His left hand is under my head, and his right hand embraces me!"
en,ESV,Song,Song,21,Song.2,Song 2,1,Song.2.7,Song 2:7,6,"I adjure you, O daughters of Jerusalem, by the gazelles or the does of the field, that you not stir up or awaken love until it pleases."
en,ESV,Song,Song,21,Song.2,Song 2,1,Song.2.8,Song 2:8,7,"The voice of my beloved! Behold, he comes, leaping over the mountains, bounding over the hills."
en,ESV,Song,Song,21,Song.2,Song 2,1,Song.2.9,Song 2:9,8,"My beloved is like a gazelle or a young stag. Behold, there he stands behind our wall, gazing through the windows, looking through the lattice."
en,ESV,Song,Song,21,Song.2,Song 2,1,Song.2.10,Song 2:10,9,"My beloved speaks and says to me: ""Arise, my love, my beautiful one, and come away,"
en,ESV,Song,Song,21,Song.2,Song 2,1,Song.2.11,Song 2:11,10,"for behold, the winter is past; the rain is over and gone."
en,ESV,Song,Song,21,Song.2,Song 2,1,Song.2.12,Song 2:12,11,"The flowers appear on the earth, the time of singing has come, and the voice of the turtledove is heard in our land."
en,ESV,Song,Song,21,Song.2,Song 2,1,Song.2.13,Song 2:13,12,"The fig tree ripens its figs, and the vines are in blossom; they give forth fragrance. Arise, my love, my beautiful one, and come away."
en,ESV,Song,Song,21,Song.2,Song 2,1,Song.2.14,Song 2:14,13,"O my dove, in the clefts of the rock, in the crannies of the cliff, let me see your face, let me hear your voice, for your voice is sweet, and your face is lovely."
en,ESV,Song,Song,21,Song.2,Song 2,1,Song.2.15,Song 2:15,14,"Catch the foxes for us, the little foxes that spoil the vineyards, for our vineyards are in blossom."""
en,ESV,Song,Song,21,Song.2,Song 2,1,Song.2.16,Song 2:16,15,"My beloved is mine, and I am his; he grazes among the lilies."
en,ESV,Song,Song,21,Song.2,Song 2,1,Song.2.17,Song 2:17,16,"Until the day breathes and the shadows flee, turn, my beloved, be like a gazelle or a young stag on cleft mountains."
en,ESV,Song,Song,21,Song.3,Song 3,2,Song.3.1,Song 3:1,0,"On my bed by nightI sought him whom my soul loves; I sought him, but found him not."
en,ESV,Song,Song,21,Song.3,Song 3,2,Song.3.2,Song 3:2,1,"I will rise now and go about the city, in the streets and in the squares; I will seek him whom my soul loves. I sought him, but found him not."
en,ESV,Song,Song,21,Song.3,Song 3,2,Song.3.3,Song 3:3,2,"The watchmen found me as they went about in the city. ""Have you seen him whom my soul loves?"""
en,ESV,Song,Song,21,Song.3,Song 3,2,Song.3.4,Song 3:4,3,"Scarcely had I passed them when I found him whom my soul loves. I held him, and would not let him go until I had brought him into my mother's house, and into the chamber of her who conceived me."
en,ESV,Song,Song,21,Song.3,Song 3,2,Song.3.5,Song 3:5,4,"I adjure you, O daughters of Jerusalem, by the gazelles or the does of the field, that you not stir up or awaken love until it pleases."
en,ESV,Song,Song,21,Song.3,Song 3,2,Song.3.6,Song 3:6,5,"What is that coming up from the wilderness like columns of smoke, perfumed with myrrh and frankincense, with all the fragrant powders of a merchant?"
en,ESV,Song,Song,21,Song.3,Song 3,2,Song.3.7,Song 3:7,6,"Behold, it is the litter of Solomon! Around it are sixty mighty men, some of the mighty men of Israel,"
en,ESV,Song,Song,21,Song.3,Song 3,2,Song.3.8,Song 3:8,7,"all of them wearing swords and expert in war, each with his sword at his thigh, against terror by night."
en,ESV,Song,Song,21,Song.3,Song 3,2,Song.3.9,Song 3:9,8,King Solomon made himself a carriage from the wood of Lebanon.
en,ESV,Song,Song,21,Song.3,Song 3,2,Song.3.10,Song 3:10,9,"He made its posts of silver, its back of gold, its seat of purple; its interior was inlaid with love by the daughters of Jerusalem."
en,ESV,Song,Song,21,Song.3,Song 3,2,Song.3.11,Song 3:11,10,"Go out, O daughters of Zion, and look upon King Solomon, with the crown with which his mother crowned him on the day of his wedding, on the day of the gladness of his heart."
en,ESV,Song,Song,21,Song.4,Song 4,3,Song.4.1,Song 4:1,0,"Behold, you are beautiful, my love, behold, you are beautiful! Your eyes are doves behind your veil. Your hair is like a flock of goats leaping down the slopes of Gilead."
en,ESV,Song,Song,21,Song.4,Song 4,3,Song.4.2,Song 4:2,1,"Your teeth are like a flock of shorn ewes that have come up from the washing, all of which bear twins, and not one among them has lost its young."
en,ESV,Song,Song,21,Song.4,Song 4,3,Song.4.3,Song 4:3,2,"Your lips are like a scarlet thread, and your mouth is lovely. Your cheeks are like halves of a pomegranate behind your veil."
en,ESV,Song,Song,21,Song.4,Song 4,3,Song.4.4,Song 4:4,3,"Your neck is like the tower of David, built in rows of stone; on it hang a thousand shields, all of them shields of warriors."
en,ESV,Song,Song,21,Song.4,Song 4,3,Song.4.5,Song 4:5,4,"Your two breasts are like two fawns, twins of a gazelle, that graze among the lilies."
en,ESV,Song,Song,21,Song.4,Song 4,3,Song.4.6,Song 4:6,5,"Until the day breathes and the shadows flee, I will go away to the mountain of myrrh and the hill of frankincense."
en,ESV,Song,Song,21,Song.4,Song 4,3,Song.4.7,Song 4:7,6,"You are altogether beautiful, my love; there is no flaw in you."
en,ESV,Song,Song,21,Song.4,Song 4,3,Song.4.8,Song 4:8,7,"Come with me from Lebanon, my bride; come with me from Lebanon. Depart from the peak of Amana, from the peak of Senir and Hermon, from the dens of lions, from the mountains of leopards."
en,ESV,Song,Song,21,Song.4,Song 4,3,Song.4.9,Song 4:9,8,"You have captivated my heart, my sister, my bride; you have captivated my heart with one glance of your eyes, with one jewel of your necklace."
en,ESV,Song,Song,21,Song.4,Song 4,3,Song.4.10,Song 4:10,9,"How beautiful is your love, my sister, my bride! How much better is your love than wine, and the fragrance of your oils than any spice!"
en,ESV,Song,Song,21,Song.4,Song 4,3,Song.4.11,Song 4:11,10,"Your lips drip nectar, my bride; honey and milk are under your tongue; the fragrance of your garments is like the fragrance of Lebanon."
en,ESV,Song,Song,21,Song.4,Song 4,3,Song.4.12,Song 4:12,11,"A garden locked is my sister, my bride, a spring locked, a fountain sealed."
en,ESV,Song,Song,21,Song.4,Song 4,3,Song.4.13,Song 4:13,12,"Your shoots are an orchard of pomegranates with all choicest fruits, henna with nard,"
en,ESV,Song,Song,21,Song.4,Song 4,3,Song.4.14,Song 4:14,13,"nard and saffron, calamus and cinnamon, with all trees of frankincense, myrrh and aloes, with all chief spices-"
en,ESV,Song,Song,21,Song.4,Song 4,3,Song.4.15,Song 4:15,14,"a garden fountain, a well of living water, and flowing streams from Lebanon."
en,ESV,Song,Song,21,Song.4,Song 4,3,Song.4.16,Song 4:16,15,"Awake, O north wind, and come, O south wind! Blow upon my garden, let its spices flow. Let my beloved come to his garden, and eat its choicest fruits."
en,ESV,Song,Song,21,Song.5,Song 5,4,Song.5.1,Song 5:1,0,"I came to my garden, my sister, my bride, I gathered my myrrh with my spice, I ate my honeycomb with my honey, I drank my wine with my milk. Eat, friends, drink, and be drunk with love!"
en,ESV,Song,Song,21,Song.5,Song 5,4,Song.5.2,Song 5:2,1,"I slept, but my heart was awake. A sound! My beloved is knocking. ""Open to me, my sister, my love, my dove, my perfect one, for my head is wet with dew, my locks with the drops of the night."""
en,ESV,Song,Song,21,Song.5,Song 5,4,Song.5.3,Song 5:3,2,I had put off my garment; how could I put it on? I had bathed my feet; how could I soil them?
en,ESV,Song,Song,21,Song.5,Song 5,4,Song.5.4,Song 5:4,3,"My beloved put his hand to the latch, and my heart was thrilled within me."
en,ESV,Song,Song,21,Song.5,Song 5,4,Song.5.5,Song 5:5,4,"I arose to open to my beloved, and my hands dripped with myrrh, my fingers with liquid myrrh, on the handles of the bolt."
en,ESV,Song,Song,21,Song.5,Song 5,4,Song.5.6,Song 5:6,5,"I opened to my beloved, but my beloved had turned and gone. My soul failed me when he spoke. I sought him, but found him not; I called him, but he gave no answer."
en,ESV,Song,Song,21,Song.5,Song 5,4,Song.5.7,Song 5:7,6,"The watchmen found me as they went about in the city; they beat me, they bruised me, they took away my veil, those watchmen of the walls."
en,ESV,Song,Song,21,Song.5,Song 5,4,Song.5.8,Song 5:8,7,"I adjure you, O daughters of Jerusalem, if you find my beloved, that you tell him I am sick with love."
en,ESV,Song,Song,21,Song.5,Song 5,4,Song.5.9,Song 5:9,8,"What is your beloved more than another beloved, O most beautiful among women? What is your beloved more than another beloved, that you thus adjure us?"
en,ESV,Song,Song,21,Song.5,Song 5,4,Song.5.10,Song 5:10,9,"My beloved is radiant and ruddy, distinguished among ten thousand."
en,ESV,Song,Song,21,Song.5,Song 5,4,Song.5.11,Song 5:11,10,"His head is the finest gold; his locks are wavy, black as a raven."
en,ESV,Song,Song,21,Song.5,Song 5,4,Song.5.12,Song 5:12,11,"His eyes are like doves beside streams of water, bathed in milk, sitting beside a full pool."
en,ESV,Song,Song,21,Song.5,Song 5,4,Song.5.13,Song 5:13,12,"His cheeks are like beds of spices, mounds of sweet-smelling herbs. His lips are lilies, dripping liquid myrrh."
en,ESV,Song,Song,21,Song.5,Song 5,4,Song.5.14,Song 5:14,13,"His arms are rods of gold, set with jewels. His body is polished ivory, bedecked with sapphires."
en,ESV,Song,Song,21,Song.5,Song 5,4,Song.5.15,Song 5:15,14,"His legs are alabaster columns, set on bases of gold. His appearance is like Lebanon, choice as the cedars."
en,ESV,Song,Song,21,Song.5,Song 5,4,Song.5.16,Song 5:16,15,"His mouth is most sweet, and he is altogether desirable. This is my beloved and this is my friend, O daughters of Jerusalem."
en,ESV,Song,Song,21,Song.6,Song 6,5,Song.6.1,Song 6:1,0,"Where has your beloved gone, O most beautiful among women? Where has your beloved turned, that we may seek him with you?"
en,ESV,Song,Song,21,Song.6,Song 6,5,Song.6.2,Song 6:2,1,"My beloved has gone down to his garden to the beds of spices, to graze in the gardens and to gather lilies."
en,ESV,Song,Song,21,Song.6,Song 6,5,Song.6.3,Song 6:3,2,I am my beloved's and my beloved is mine; he grazes among the lilies.
en,ESV,Song,Song,21,Song.6,Song 6,5,Song.6.4,Song 6:4,3,"You are beautiful as Tirzah, my love, lovely as Jerusalem, awesome as an army with banners."
en,ESV,Song,Song,21,Song.6,Song 6,5,Song.6.5,Song 6:5,4,"Turn away your eyes from me, for they overwhelm me- Your hair is like a flock of goats leaping down the slopes of Gilead."
en,ESV,Song,Song,21,Song.6,Song 6,5,Song.6.6,Song 6:6,5,Your teeth are like a flock of ewes that have come up from the washing; all of them bear twins; not one among them has lost its young.
en,ESV,Song,Song,21,Song.6,Song 6,5,Song.6.7,Song 6:7,6,Your cheeks are like halves of a pomegranate behind your veil.
en,ESV,Song,Song,21,Song.6,Song 6,5,Song.6.8,Song 6:8,7,"There are sixty queens and eighty concubines, and virgins without number."
en,ESV,Song,Song,21,Song.6,Song 6,5,Song.6.9,Song 6:9,8,"My dove, my perfect one, is the only one, the only one of her mother, pure to her who bore her. The young women saw her and called her blessed; the queens and concubines also, and they praised her."
en,ESV,Song,Song,21,Song.6,Song 6,5,Song.6.10,Song 6:10,9,"""Who is this who looks down like the dawn, beautiful as the moon, bright as the sun, awesome as an army with banners?"""
en,ESV,Song,Song,21,Song.6,Song 6,5,Song.6.11,Song 6:11,10,"I went down to the nut orchard to look at the blossoms of the valley, to see whether the vines had budded, whether the pomegranates were in bloom."
en,ESV,Song,Song,21,Song.6,Song 6,5,Song.6.12,Song 6:12,11,"Before I was aware, my desire set me among the chariots of my kinsman, a prince."
en,ESV,Song,Song,21,Song.6,Song 6,5,Song.6.13,Song 6:13,12,"Return, return, O Shulammite, return, return, that we may look upon you. Why should you look upon the Shulammite, as upon a dance before two armies?"
en,ESV,Song,Song,21,Song.7,Song 7,6,Song.7.1,Song 7:1,0,"How beautiful are your feet in sandals, O noble daughter! Your rounded thighs are like jewels, the work of a master hand."
en,ESV,Song,Song,21,Song.7,Song 7,6,Song.7.2,Song 7:2,1,"Your navel is a rounded bowl that never lacks mixed wine. Your belly is a heap of wheat, encircled with lilies."
en,ESV,Song,Song,21,Song.7,Song 7,6,Song.7.3,Song 7:3,2,"Your two breasts are like two fawns, twins of a gazelle."
en,ESV,Song,Song,21,Song.7,Song 7,6,Song.7.4,Song 7:4,3,"Your neck is like an ivory tower. Your eyes are pools in Heshbon, by the gate of Bath-rabbim. Your nose is like a tower of Lebanon, which looks toward Damascus."
en,ESV,Song,Song,21,Song.7,Song 7,6,Song.7.5,Song 7:5,4,"Your head crowns you like Carmel, and your flowing locks are like purple; a king is held captive in the tresses."
en,ESV,Song,Song,21,Song.7,Song 7,6,Song.7.6,Song 7:6,5,"How beautiful and pleasant you are, O loved one, with all your delights!"
en,ESV,Song,Song,21,Song.7,Song 7,6,Song.7.7,Song 7:7,6,"Your stature is like a palm tree, and your breasts are like its clusters."
en,ESV,Song,Song,21,Song.7,Song 7,6,Song.7.8,Song 7:8,7,"I say I will climb the palm tree and lay hold of its fruit. Oh may your breasts be like clusters of the vine, and the scent of your breath like apples,"
en,ESV,Song,Song,21,Song.7,Song 7,6,Song.7.9,Song 7:9,8,"and your mouth like the best wine. It goes down smoothly for my beloved, gliding over lips and teeth."
en,ESV,Song,Song,21,Song.7,Song 7,6,Song.7.10,Song 7:10,9,"I am my beloved's, and his desire is for me."
en,ESV,Song,Song,21,Song.7,Song 7,6,Song.7.11,Song 7:11,10,"Come, my beloved, let us go out into the fields and lodge in the villages;"
en,ESV,Song,Song,21,Song.7,Song 7,6,Song.7.12,Song 7:12,11,"let us go out early to the vineyards and see whether the vines have budded, whether the grape blossoms have opened and the pomegranates are in bloom. There I will give you my love."
en,ESV,Song,Song,21,Song.7,Song 7,6,Song.7.13,Song 7:13,12,"The mandrakes give forth fragrance, and beside our doors are all choice fruits, new as well as old, which I have laid up for you, O my beloved."
en,ESV,Song,Song,21,Song.8,Song 8,7,Song.8.1,Song 8:1,0,"Oh that you were like a brother to me who nursed at my mother's breasts! If I found you outside, I would kiss you, and none would despise me."
en,ESV,Song,Song,21,Song.8,Song 8,7,Song.8.2,Song 8:2,1,"I would lead you and bring you into the house of my mother- she who used to teach me. I would give you spiced wine to drink, the juice of my pomegranate."
en,ESV,Song,Song,21,Song.8,Song 8,7,Song.8.3,Song 8:3,2,"His left hand is under my head, and his right hand embraces me!"
en,ESV,Song,Song,21,Song.8,Song 8,7,Song.8.4,Song 8:4,3,"I adjure you, O daughters of Jerusalem, that you not stir up or awaken love until it pleases."
en,ESV,Song,Song,21,Song.8,Song 8,7,Song.8.5,Song 8:5,4,"Who is that coming up from the wilderness, leaning on her beloved? Under the apple tree I awakened you. There your mother was in labor with you; there she who bore you was in labor."
en,ESV,Song,Song,21,Song.8,Song 8,7,Song.8.6,Song 8:6,5,"Set me as a seal upon your heart, as a seal upon your arm, for love is strong as death, jealousy is fierce as the grave. Its flashes are flashes of fire, the very flame of the LORD."
en,ESV,Song,Song,21,Song.8,Song 8,7,Song.8.7,Song 8:7,6,"Many waters cannot quench love, neither can floods drown it. If a man offered for love all the wealth of his house, he would be utterly despised."
en,ESV,Song,Song,21,Song.8,Song 8,7,Song.8.8,Song 8:8,7,"We have a little sister, and she has no breasts. What shall we do for our sister on the day when she is spoken for?"
en,ESV,Song,Song,21,Song.8,Song 8,7,Song.8.9,Song 8:9,8,"If she is a wall, we will build on her a battlement of silver, but if she is a door, we will enclose her with boards of cedar."
en,ESV,Song,Song,21,Song.8,Song 8,7,Song.8.10,Song 8:10,9,"I was a wall, and my breasts were like towers; then I was in his eyes as one who finds peace."
en,ESV,Song,Song,21,Song.8,Song 8,7,Song.8.11,Song 8:11,10,Solomon had a vineyard at Baal-hamon; he let out the vineyard to keepers; each one was to bring for its fruit a thousand pieces of silver.
en,ESV,Song,Song,21,Song.8,Song 8,7,Song.8.12,Song 8:12,11,"My vineyard, my very own, is before me; you, O Solomon, may have the thousand, and the keepers of the fruit two hundred."
en,ESV,Song,Song,21,Song.8,Song 8,7,Song.8.13,Song 8:13,12,"O you who dwell in the gardens, with companions listening for your voice; let me hear it."
en,ESV,Song,Song,21,Song.8,Song 8,7,Song.8.14,Song 8:14,13,"Make haste, my beloved, and be like a gazelle or a young stag on the mountains of spices."
