languageCode,code,bookOsisId,bookSblId,bookOrderIndex,chapterOsisId,chapterSblId,chapterOrderIndex,verseOsisId,verseSblId,verseOrderIndex,text
en,ESV,Lam,Lam,24,Lam.1,Lam 1,0,Lam.1.1,Lam 1:1,0,"How lonely sits the citythat was full of people! How like a widow has she become, she who was great among the nations! She who was a princess among the provinces has become a slave."
en,ESV,Lam,Lam,24,Lam.1,Lam 1,0,Lam.1.2,Lam 1:2,1,"She weeps bitterly in the night, with tears on her cheeks; among all her lovers she has none to comfort her; all her friends have dealt treacherously with her; they have become her enemies."
en,ESV,Lam,Lam,24,Lam.1,Lam 1,0,Lam.1.3,Lam 1:3,2,"Judah has gone into exile because of affliction and hard servitude; she dwells now among the nations, but finds no resting place; her pursuers have all overtaken her in the midst of her distress."
en,ESV,Lam,Lam,24,Lam.1,Lam 1,0,Lam.1.4,Lam 1:4,3,"The roads to Zion mourn, for none come to the festival; all her gates are desolate; her priests groan; her virgins have been afflicted, and she herself suffers bitterly."
en,ESV,Lam,Lam,24,Lam.1,Lam 1,0,Lam.1.5,Lam 1:5,4,"Her foes have become the head; her enemies prosper, because the LORD has afflicted her for the multitude of her transgressions; her children have gone away, captives before the foe."
en,ESV,Lam,Lam,24,Lam.1,Lam 1,0,Lam.1.6,Lam 1:6,5,From the daughter of Zion all her majesty has departed. Her princes have become like deer that find no pasture; they fled without strength before the pursuer.
en,ESV,Lam,Lam,24,Lam.1,Lam 1,0,Lam.1.7,Lam 1:7,6,"Jerusalem remembers in the days of her affliction and wandering all the precious things that were hers from days of old. When her people fell into the hand of the foe, and there was none to help her, her foes gloated over her; they mocked at her downfall."
en,ESV,Lam,Lam,24,Lam.1,Lam 1,0,Lam.1.8,Lam 1:8,7,"Jerusalem sinned grievously; therefore she became filthy; all who honored her despise her, for they have seen her nakedness; she herself groans and turns her face away."
en,ESV,Lam,Lam,24,Lam.1,Lam 1,0,Lam.1.9,Lam 1:9,8,"Her uncleanness was in her skirts; she took no thought of her future; therefore her fall is terrible; she has no comforter. ""O LORD, behold my affliction, for the enemy has triumphed!"""
en,ESV,Lam,Lam,24,Lam.1,Lam 1,0,Lam.1.10,Lam 1:10,9,"The enemy has stretched out his hands over all her precious things; for she has seen the nations enter her sanctuary, those whom you forbade to enter your congregation."
en,ESV,Lam,Lam,24,Lam.1,Lam 1,0,Lam.1.11,Lam 1:11,10,"All her people groan as they search for bread; they trade their treasures for food to revive their strength. ""Look, O LORD, and see, for I am despised."""
en,ESV,Lam,Lam,24,Lam.1,Lam 1,0,Lam.1.12,Lam 1:12,11,"""Is it nothing to you, all you who pass by? Look and see if there is any sorrow like my sorrow, which was brought upon me, which the LORD inflicted on the day of his fierce anger."
en,ESV,Lam,Lam,24,Lam.1,Lam 1,0,Lam.1.13,Lam 1:13,12,"""From on high he sent fire; into my bones he made it descend; he spread a net for my feet; he turned me back; he has left me stunned, faint all the day long."
en,ESV,Lam,Lam,24,Lam.1,Lam 1,0,Lam.1.14,Lam 1:14,13,"""My transgressions were bound into a yoke; by his hand they were fastened together; they were set upon my neck; he caused my strength to fail; the Lord gave me into the hands of those whom I cannot withstand."
en,ESV,Lam,Lam,24,Lam.1,Lam 1,0,Lam.1.15,Lam 1:15,14,"""The Lord rejected all my mighty men in my midst; he summoned an assembly against me to crush my young men; the Lord has trodden as in a winepress the virgin daughter of Judah."
en,ESV,Lam,Lam,24,Lam.1,Lam 1,0,Lam.1.16,Lam 1:16,15,"""For these things I weep; my eyes flow with tears; for a comforter is far from me, one to revive my spirit; my children are desolate, for the enemy has prevailed."""
en,ESV,Lam,Lam,24,Lam.1,Lam 1,0,Lam.1.17,Lam 1:17,16,"Zion stretches out her hands, but there is none to comfort her; the LORD has commanded against Jacob that his neighbors should be his foes; Jerusalem has become a filthy thing among them."
en,ESV,Lam,Lam,24,Lam.1,Lam 1,0,Lam.1.18,Lam 1:18,17,"""The LORD is in the right, for I have rebelled against his word; but hear, all you peoples, and see my suffering; my young women and my young men have gone into captivity."
en,ESV,Lam,Lam,24,Lam.1,Lam 1,0,Lam.1.19,Lam 1:19,18,"""I called to my lovers, but they deceived me; my priests and elders perished in the city, while they sought food to revive their strength."
en,ESV,Lam,Lam,24,Lam.1,Lam 1,0,Lam.1.20,Lam 1:20,19,"""Look, O LORD, for I am in distress; my stomach churns; my heart is wrung within me, because I have been very rebellious. In the street the sword bereaves; in the house it is like death."
en,ESV,Lam,Lam,24,Lam.1,Lam 1,0,Lam.1.21,Lam 1:21,20,"""They heard my groaning, yet there is no one to comfort me. All my enemies have heard of my trouble; they are glad that you have done it. You have brought the day you announced; now let them be as I am."
en,ESV,Lam,Lam,24,Lam.1,Lam 1,0,Lam.1.22,Lam 1:22,21,"""Let all their evildoing come before you, and deal with them as you have dealt with me because of all my transgressions; for my groans are many, and my heart is faint."""
en,ESV,Lam,Lam,24,Lam.2,Lam 2,1,Lam.2.1,Lam 2:1,0,How the Lord in his anger has set the daughter of Zion under a cloud! He has cast down from heaven to earth the splendor of Israel; he has not remembered his footstool in the day of his anger.
en,ESV,Lam,Lam,24,Lam.2,Lam 2,1,Lam.2.2,Lam 2:2,1,The Lord has swallowed up without mercy all the habitations of Jacob; in his wrath he has broken down the strongholds of the daughter of Judah; he has brought down to the ground in dishonor the kingdom and its rulers.
en,ESV,Lam,Lam,24,Lam.2,Lam 2,1,Lam.2.3,Lam 2:3,2,"He has cut down in fierce anger all the might of Israel; he has withdrawn from them his right hand in the face of the enemy; he has burned like a flaming fire in Jacob, consuming all around."
en,ESV,Lam,Lam,24,Lam.2,Lam 2,1,Lam.2.4,Lam 2:4,3,"He has bent his bow like an enemy, with his right hand set like a foe; and he has killed all who were delightful in our eyes in the tent of the daughter of Zion; he has poured out his fury like fire."
en,ESV,Lam,Lam,24,Lam.2,Lam 2,1,Lam.2.5,Lam 2:5,4,"The Lord has become like an enemy; he has swallowed up Israel; he has swallowed up all its palaces; he has laid in ruins its strongholds, and he has multiplied in the daughter of Judah mourning and lamentation."
en,ESV,Lam,Lam,24,Lam.2,Lam 2,1,Lam.2.6,Lam 2:6,5,"He has laid waste his booth like a garden, laid in ruins his meeting place; the LORD has made Zion forget festival and Sabbath, and in his fierce indignation has spurned king and priest."
en,ESV,Lam,Lam,24,Lam.2,Lam 2,1,Lam.2.7,Lam 2:7,6,"The Lord has scorned his altar, disowned his sanctuary; he has delivered into the hand of the enemy the walls of her palaces; they raised a clamor in the house of the LORD as on the day of festival."
en,ESV,Lam,Lam,24,Lam.2,Lam 2,1,Lam.2.8,Lam 2:8,7,The LORD determined to lay in ruins the wall of the daughter of Zion; he stretched out the measuring line; he did not restrain his hand from destroying; he caused rampart and wall to lament; they languished together.
en,ESV,Lam,Lam,24,Lam.2,Lam 2,1,Lam.2.9,Lam 2:9,8,"Her gates have sunk into the ground; he has ruined and broken her bars; her king and princes are among the nations; the law is no more, and her prophets find no vision from the LORD."
en,ESV,Lam,Lam,24,Lam.2,Lam 2,1,Lam.2.10,Lam 2:10,9,The elders of the daughter of Zion sit on the ground in silence; they have thrown dust on their heads and put on sackcloth; the young women of Jerusalem have bowed their heads to the ground.
en,ESV,Lam,Lam,24,Lam.2,Lam 2,1,Lam.2.11,Lam 2:11,10,"My eyes are spent with weeping; my stomach churns; my bile is poured out to the ground because of the destruction of the daughter of my people, because infants and babies faint in the streets of the city."
en,ESV,Lam,Lam,24,Lam.2,Lam 2,1,Lam.2.12,Lam 2:12,11,"They cry to their mothers, ""Where is bread and wine?"" as they faint like a wounded man in the streets of the city, as their life is poured out on their mothers' bosom."
en,ESV,Lam,Lam,24,Lam.2,Lam 2,1,Lam.2.13,Lam 2:13,12,"What can I say for you, to what compare you, O daughter of Jerusalem? What can I liken to you, that I may comfort you, O virgin daughter of Zion? For your ruin is vast as the sea; who can heal you?"
en,ESV,Lam,Lam,24,Lam.2,Lam 2,1,Lam.2.14,Lam 2:14,13,"Your prophets have seen for you false and deceptive visions; they have not exposed your iniquity to restore your fortunes, but have seen for you oracles that are false and misleading."
en,ESV,Lam,Lam,24,Lam.2,Lam 2,1,Lam.2.15,Lam 2:15,14,"All who pass along the way clap their hands at you; they hiss and wag their heads at the daughter of Jerusalem; ""Is this the city that was called the perfection of beauty, the joy of all the earth?"""
en,ESV,Lam,Lam,24,Lam.2,Lam 2,1,Lam.2.16,Lam 2:16,15,"All your enemies rail against you; they hiss, they gnash their teeth, they cry: ""We have swallowed her! Ah, this is the day we longed for; now we have it; we see it!"""
en,ESV,Lam,Lam,24,Lam.2,Lam 2,1,Lam.2.17,Lam 2:17,16,"The LORD has done what he purposed; he has carried out his word, which he commanded long ago; he has thrown down without pity; he has made the enemy rejoice over you and exalted the might of your foes."
en,ESV,Lam,Lam,24,Lam.2,Lam 2,1,Lam.2.18,Lam 2:18,17,"Their heart cried to the Lord. O wall of the daughter of Zion, let tears stream down like a torrent day and night! Give yourself no rest, your eyes no respite!"
en,ESV,Lam,Lam,24,Lam.2,Lam 2,1,Lam.2.19,Lam 2:19,18,"""Arise, cry out in the night, at the beginning of the night watches! Pour out your heart like water before the presence of the Lord! Lift your hands to him for the lives of your children, who faint for hunger at the head of every street."""
en,ESV,Lam,Lam,24,Lam.2,Lam 2,1,Lam.2.20,Lam 2:20,19,"Look, O LORD, and see! With whom have you dealt thus? Should women eat the fruit of their womb, the children of their tender care? Should priest and prophet be killed in the sanctuary of the Lord?"
en,ESV,Lam,Lam,24,Lam.2,Lam 2,1,Lam.2.21,Lam 2:21,20,"In the dust of the streets lie the young and the old; my young women and my young men have fallen by the sword; you have killed them in the day of your anger, slaughtering without pity."
en,ESV,Lam,Lam,24,Lam.2,Lam 2,1,Lam.2.22,Lam 2:22,21,"You summoned as if to a festival day my terrors on every side, and on the day of the anger of the LORD no one escaped or survived; those whom I held and raised my enemy destroyed."
en,ESV,Lam,Lam,24,Lam.3,Lam 3,2,Lam.3.1,Lam 3:1,0,I am the man who has seen affliction under the rod of his wrath;
en,ESV,Lam,Lam,24,Lam.3,Lam 3,2,Lam.3.2,Lam 3:2,1,he has driven and brought me into darkness without any light;
en,ESV,Lam,Lam,24,Lam.3,Lam 3,2,Lam.3.3,Lam 3:3,2,surely against me he turns his hand again and again the whole day long.
en,ESV,Lam,Lam,24,Lam.3,Lam 3,2,Lam.3.4,Lam 3:4,3,He has made my flesh and my skin waste away; he has broken my bones;
en,ESV,Lam,Lam,24,Lam.3,Lam 3,2,Lam.3.5,Lam 3:5,4,he has besieged and enveloped me with bitterness and tribulation;
en,ESV,Lam,Lam,24,Lam.3,Lam 3,2,Lam.3.6,Lam 3:6,5,he has made me dwell in darkness like the dead of long ago.
en,ESV,Lam,Lam,24,Lam.3,Lam 3,2,Lam.3.7,Lam 3:7,6,He has walled me about so that I cannot escape; he has made my chains heavy;
en,ESV,Lam,Lam,24,Lam.3,Lam 3,2,Lam.3.8,Lam 3:8,7,"though I call and cry for help, he shuts out my prayer;"
en,ESV,Lam,Lam,24,Lam.3,Lam 3,2,Lam.3.9,Lam 3:9,8,he has blocked my ways with blocks of stones; he has made my paths crooked.
en,ESV,Lam,Lam,24,Lam.3,Lam 3,2,Lam.3.10,Lam 3:10,9,"He is a bear lying in wait for me, a lion in hiding;"
en,ESV,Lam,Lam,24,Lam.3,Lam 3,2,Lam.3.11,Lam 3:11,10,he turned aside my steps and tore me to pieces; he has made me desolate;
en,ESV,Lam,Lam,24,Lam.3,Lam 3,2,Lam.3.12,Lam 3:12,11,he bent his bow and set me as a target for his arrow.
en,ESV,Lam,Lam,24,Lam.3,Lam 3,2,Lam.3.13,Lam 3:13,12,He drove into my kidneys the arrows of his quiver;
en,ESV,Lam,Lam,24,Lam.3,Lam 3,2,Lam.3.14,Lam 3:14,13,"I have become the laughingstock of all peoples, the object of their taunts all day long."
en,ESV,Lam,Lam,24,Lam.3,Lam 3,2,Lam.3.15,Lam 3:15,14,He has filled me with bitterness; he has sated me with wormwood.
en,ESV,Lam,Lam,24,Lam.3,Lam 3,2,Lam.3.16,Lam 3:16,15,"He has made my teeth grind on gravel, and made me cower in ashes;"
en,ESV,Lam,Lam,24,Lam.3,Lam 3,2,Lam.3.17,Lam 3:17,16,my soul is bereft of peace; I have forgotten what happiness is;
en,ESV,Lam,Lam,24,Lam.3,Lam 3,2,Lam.3.18,Lam 3:18,17,"so I say, ""My endurance has perished; so has my hope from the LORD."""
en,ESV,Lam,Lam,24,Lam.3,Lam 3,2,Lam.3.19,Lam 3:19,18,"Remember my affliction and my wanderings, the wormwood and the gall!"
en,ESV,Lam,Lam,24,Lam.3,Lam 3,2,Lam.3.20,Lam 3:20,19,My soul continually remembers it and is bowed down within me.
en,ESV,Lam,Lam,24,Lam.3,Lam 3,2,Lam.3.21,Lam 3:21,20,"But this I call to mind, and therefore I have hope:"
en,ESV,Lam,Lam,24,Lam.3,Lam 3,2,Lam.3.22,Lam 3:22,21,The steadfast love of the LORD never ceases; his mercies never come to an end;
en,ESV,Lam,Lam,24,Lam.3,Lam 3,2,Lam.3.23,Lam 3:23,22,they are new every morning; great is your faithfulness.
en,ESV,Lam,Lam,24,Lam.3,Lam 3,2,Lam.3.24,Lam 3:24,23,"""The LORD is my portion,"" says my soul, ""therefore I will hope in him."""
en,ESV,Lam,Lam,24,Lam.3,Lam 3,2,Lam.3.25,Lam 3:25,24,"The LORD is good to those who wait for him, to the soul who seeks him."
en,ESV,Lam,Lam,24,Lam.3,Lam 3,2,Lam.3.26,Lam 3:26,25,It is good that one should wait quietly for the salvation of the LORD.
en,ESV,Lam,Lam,24,Lam.3,Lam 3,2,Lam.3.27,Lam 3:27,26,It is good for a man that he bear the yoke in his youth.
en,ESV,Lam,Lam,24,Lam.3,Lam 3,2,Lam.3.28,Lam 3:28,27,Let him sit alone in silence when it is laid on him;
en,ESV,Lam,Lam,24,Lam.3,Lam 3,2,Lam.3.29,Lam 3:29,28,let him put his mouth in the dust- there may yet be hope;
en,ESV,Lam,Lam,24,Lam.3,Lam 3,2,Lam.3.30,Lam 3:30,29,"let him give his cheek to the one who strikes, and let him be filled with insults."
en,ESV,Lam,Lam,24,Lam.3,Lam 3,2,Lam.3.31,Lam 3:31,30,"For the Lord will not cast off forever,"
en,ESV,Lam,Lam,24,Lam.3,Lam 3,2,Lam.3.32,Lam 3:32,31,"but, though he cause grief, he will have compassion according to the abundance of his steadfast love;"
en,ESV,Lam,Lam,24,Lam.3,Lam 3,2,Lam.3.33,Lam 3:33,32,for he does not willingly afflict or grieve the children of men.
en,ESV,Lam,Lam,24,Lam.3,Lam 3,2,Lam.3.34,Lam 3:34,33,"To crush underfoot all the prisoners of the earth,"
en,ESV,Lam,Lam,24,Lam.3,Lam 3,2,Lam.3.35,Lam 3:35,34,"to deny a man justice in the presence of the Most High,"
en,ESV,Lam,Lam,24,Lam.3,Lam 3,2,Lam.3.36,Lam 3:36,35,"to subvert a man in his lawsuit, the Lord does not approve."
en,ESV,Lam,Lam,24,Lam.3,Lam 3,2,Lam.3.37,Lam 3:37,36,"Who has spoken and it came to pass, unless the Lord has commanded it?"
en,ESV,Lam,Lam,24,Lam.3,Lam 3,2,Lam.3.38,Lam 3:38,37,Is it not from the mouth of the Most High that good and bad come?
en,ESV,Lam,Lam,24,Lam.3,Lam 3,2,Lam.3.39,Lam 3:39,38,"Why should a living man complain, a man, about the punishment of his sins?"
en,ESV,Lam,Lam,24,Lam.3,Lam 3,2,Lam.3.40,Lam 3:40,39,"Let us test and examine our ways, and return to the LORD!"
en,ESV,Lam,Lam,24,Lam.3,Lam 3,2,Lam.3.41,Lam 3:41,40,Let us lift up our hearts and hands to God in heaven:
en,ESV,Lam,Lam,24,Lam.3,Lam 3,2,Lam.3.42,Lam 3:42,41,"""We have transgressed and rebelled, and you have not forgiven."
en,ESV,Lam,Lam,24,Lam.3,Lam 3,2,Lam.3.43,Lam 3:43,42,"""You have wrapped yourself with anger and pursued us, killing without pity;"
en,ESV,Lam,Lam,24,Lam.3,Lam 3,2,Lam.3.44,Lam 3:44,43,you have wrapped yourself with a cloud so that no prayer can pass through.
en,ESV,Lam,Lam,24,Lam.3,Lam 3,2,Lam.3.45,Lam 3:45,44,You have made us scum and garbage among the peoples.
en,ESV,Lam,Lam,24,Lam.3,Lam 3,2,Lam.3.46,Lam 3:46,45,"""All our enemies open their mouths against us;"
en,ESV,Lam,Lam,24,Lam.3,Lam 3,2,Lam.3.47,Lam 3:47,46,"panic and pitfall have come upon us, devastation and destruction;"
en,ESV,Lam,Lam,24,Lam.3,Lam 3,2,Lam.3.48,Lam 3:48,47,my eyes flow with rivers of tears because of the destruction of the daughter of my people.
en,ESV,Lam,Lam,24,Lam.3,Lam 3,2,Lam.3.49,Lam 3:49,48,"""My eyes will flow without ceasing, without respite,"
en,ESV,Lam,Lam,24,Lam.3,Lam 3,2,Lam.3.50,Lam 3:50,49,until the LORD from heaven looks down and sees;
en,ESV,Lam,Lam,24,Lam.3,Lam 3,2,Lam.3.51,Lam 3:51,50,my eyes cause me grief at the fate of all the daughters of my city.
en,ESV,Lam,Lam,24,Lam.3,Lam 3,2,Lam.3.52,Lam 3:52,51,"""I have been hunted like a bird by those who were my enemies without cause;"
en,ESV,Lam,Lam,24,Lam.3,Lam 3,2,Lam.3.53,Lam 3:53,52,they flung me alive into the pit and cast stones on me;
en,ESV,Lam,Lam,24,Lam.3,Lam 3,2,Lam.3.54,Lam 3:54,53,"water closed over my head; I said, 'I am lost.'"
en,ESV,Lam,Lam,24,Lam.3,Lam 3,2,Lam.3.55,Lam 3:55,54,"""I called on your name, O LORD, from the depths of the pit;"
en,ESV,Lam,Lam,24,Lam.3,Lam 3,2,Lam.3.56,Lam 3:56,55,"you heard my plea, 'Do not close your ear to my cry for help!'"
en,ESV,Lam,Lam,24,Lam.3,Lam 3,2,Lam.3.57,Lam 3:57,56,"You came near when I called on you; you said, 'Do not fear!'"
en,ESV,Lam,Lam,24,Lam.3,Lam 3,2,Lam.3.58,Lam 3:58,57,"""You have taken up my cause, O Lord; you have redeemed my life."
en,ESV,Lam,Lam,24,Lam.3,Lam 3,2,Lam.3.59,Lam 3:59,58,"You have seen the wrong done to me, O LORD; judge my cause."
en,ESV,Lam,Lam,24,Lam.3,Lam 3,2,Lam.3.60,Lam 3:60,59,"You have seen all their vengeance, all their plots against me."
en,ESV,Lam,Lam,24,Lam.3,Lam 3,2,Lam.3.61,Lam 3:61,60,"""You have heard their taunts, O LORD, all their plots against me."
en,ESV,Lam,Lam,24,Lam.3,Lam 3,2,Lam.3.62,Lam 3:62,61,The lips and thoughts of my assailants are against me all the day long.
en,ESV,Lam,Lam,24,Lam.3,Lam 3,2,Lam.3.63,Lam 3:63,62,Behold their sitting and their rising; I am the object of their taunts.
en,ESV,Lam,Lam,24,Lam.3,Lam 3,2,Lam.3.64,Lam 3:64,63,"""You will repay them, O LORD, according to the work of their hands."
en,ESV,Lam,Lam,24,Lam.3,Lam 3,2,Lam.3.65,Lam 3:65,64,You will give them dullness of heart; your curse will be on them.
en,ESV,Lam,Lam,24,Lam.3,Lam 3,2,Lam.3.66,Lam 3:66,65,"You will pursue them in anger and destroy them from under your heavens, O LORD."""
en,ESV,Lam,Lam,24,Lam.4,Lam 4,3,Lam.4.1,Lam 4:1,0,"How the gold has grown dim, how the pure gold is changed! The holy stones lie scattered at the head of every street."
en,ESV,Lam,Lam,24,Lam.4,Lam 4,3,Lam.4.2,Lam 4:2,1,"The precious sons of Zion, worth their weight in fine gold, how they are regarded as earthen pots, the work of a potter's hands!"
en,ESV,Lam,Lam,24,Lam.4,Lam 4,3,Lam.4.3,Lam 4:3,2,"Even jackals offer the breast; they nurse their young, but the daughter of my people has become cruel, like the ostriches in the wilderness."
en,ESV,Lam,Lam,24,Lam.4,Lam 4,3,Lam.4.4,Lam 4:4,3,"The tongue of the nursing infant sticks to the roof of its mouth for thirst; the children beg for food, but no one gives to them."
en,ESV,Lam,Lam,24,Lam.4,Lam 4,3,Lam.4.5,Lam 4:5,4,Those who once feasted on delicacies perish in the streets; those who were brought up in purple embrace ash heaps.
en,ESV,Lam,Lam,24,Lam.4,Lam 4,3,Lam.4.6,Lam 4:6,5,"For the chastisement of the daughter of my people has been greater than the punishment of Sodom, which was overthrown in a moment, and no hands were wrung for her."
en,ESV,Lam,Lam,24,Lam.4,Lam 4,3,Lam.4.7,Lam 4:7,6,"Her princes were purer than snow, whiter than milk; their bodies were more ruddy than coral, the beauty of their form was like sapphire."
en,ESV,Lam,Lam,24,Lam.4,Lam 4,3,Lam.4.8,Lam 4:8,7,Now their face is blacker than soot; they are not recognized in the streets; their skin has shriveled on their bones; it has become as dry as wood.
en,ESV,Lam,Lam,24,Lam.4,Lam 4,3,Lam.4.9,Lam 4:9,8,"Happier were the victims of the sword than the victims of hunger, who wasted away, pierced by lack of the fruits of the field."
en,ESV,Lam,Lam,24,Lam.4,Lam 4,3,Lam.4.10,Lam 4:10,9,The hands of compassionate women have boiled their own children; they became their food during the destruction of the daughter of my people.
en,ESV,Lam,Lam,24,Lam.4,Lam 4,3,Lam.4.11,Lam 4:11,10,"The LORD gave full vent to his wrath; he poured out his hot anger, and he kindled a fire in Zion that consumed its foundations."
en,ESV,Lam,Lam,24,Lam.4,Lam 4,3,Lam.4.12,Lam 4:12,11,"The kings of the earth did not believe, nor any of the inhabitants of the world, that foe or enemy could enter the gates of Jerusalem."
en,ESV,Lam,Lam,24,Lam.4,Lam 4,3,Lam.4.13,Lam 4:13,12,"This was for the sins of her prophets and the iniquities of her priests, who shed in the midst of her the blood of the righteous."
en,ESV,Lam,Lam,24,Lam.4,Lam 4,3,Lam.4.14,Lam 4:14,13,"They wandered, blind, through the streets; they were so defiled with blood that no one was able to touch their garments."
en,ESV,Lam,Lam,24,Lam.4,Lam 4,3,Lam.4.15,Lam 4:15,14,"""Away! Unclean!"" people cried at them. ""Away! Away! Do not touch!"" So they became fugitives and wanderers; people said among the nations, ""They shall stay with us no longer."""
en,ESV,Lam,Lam,24,Lam.4,Lam 4,3,Lam.4.16,Lam 4:16,15,"The LORD himself has scattered them; he will regard them no more; no honor was shown to the priests, no favor to the elders."
en,ESV,Lam,Lam,24,Lam.4,Lam 4,3,Lam.4.17,Lam 4:17,16,"Our eyes failed, ever watching vainly for help; in our watching we watched for a nation which could not save."
en,ESV,Lam,Lam,24,Lam.4,Lam 4,3,Lam.4.18,Lam 4:18,17,"They dogged our steps so that we could not walk in our streets; our end drew near; our days were numbered, for our end had come."
en,ESV,Lam,Lam,24,Lam.4,Lam 4,3,Lam.4.19,Lam 4:19,18,Our pursuers were swifter than the eagles in the heavens; they chased us on the mountains; they lay in wait for us in the wilderness.
en,ESV,Lam,Lam,24,Lam.4,Lam 4,3,Lam.4.20,Lam 4:20,19,"The breath of our nostrils, the LORD's anointed, was captured in their pits, of whom we said, ""Under his shadow we shall live among the nations."""
en,ESV,Lam,Lam,24,Lam.4,Lam 4,3,Lam.4.21,Lam 4:21,20,"Rejoice and be glad, O daughter of Edom, you who dwell in the land of Uz; but to you also the cup shall pass; you shall become drunk and strip yourself bare."
en,ESV,Lam,Lam,24,Lam.4,Lam 4,3,Lam.4.22,Lam 4:22,21,"The punishment of your iniquity, O daughter of Zion, is accomplished; he will keep you in exile no longer; but your iniquity, O daughter of Edom, he will punish; he will uncover your sins."
en,ESV,Lam,Lam,24,Lam.5,Lam 5,4,Lam.5.1,Lam 5:1,0,"Remember, O LORD, what has befallen us; look, and see our disgrace!"
en,ESV,Lam,Lam,24,Lam.5,Lam 5,4,Lam.5.2,Lam 5:2,1,"Our inheritance has been turned over to strangers, our homes to foreigners."
en,ESV,Lam,Lam,24,Lam.5,Lam 5,4,Lam.5.3,Lam 5:3,2,"We have become orphans, fatherless; our mothers are like widows."
en,ESV,Lam,Lam,24,Lam.5,Lam 5,4,Lam.5.4,Lam 5:4,3,We must pay for the water we drink; the wood we get must be bought.
en,ESV,Lam,Lam,24,Lam.5,Lam 5,4,Lam.5.5,Lam 5:5,4,Our pursuers are at our necks; we are weary; we are given no rest.
en,ESV,Lam,Lam,24,Lam.5,Lam 5,4,Lam.5.6,Lam 5:6,5,"We have given the hand to Egypt, and to Assyria, to get bread enough."
en,ESV,Lam,Lam,24,Lam.5,Lam 5,4,Lam.5.7,Lam 5:7,6,"Our fathers sinned, and are no more; and we bear their iniquities."
en,ESV,Lam,Lam,24,Lam.5,Lam 5,4,Lam.5.8,Lam 5:8,7,Slaves rule over us; there is none to deliver us from their hand.
en,ESV,Lam,Lam,24,Lam.5,Lam 5,4,Lam.5.9,Lam 5:9,8,"We get our bread at the peril of our lives, because of the sword in the wilderness."
en,ESV,Lam,Lam,24,Lam.5,Lam 5,4,Lam.5.10,Lam 5:10,9,Our skin is hot as an oven with the burning heat of famine.
en,ESV,Lam,Lam,24,Lam.5,Lam 5,4,Lam.5.11,Lam 5:11,10,"Women are raped in Zion, young women in the towns of Judah."
en,ESV,Lam,Lam,24,Lam.5,Lam 5,4,Lam.5.12,Lam 5:12,11,Princes are hung up by their hands; no respect is shown to the elders.
en,ESV,Lam,Lam,24,Lam.5,Lam 5,4,Lam.5.13,Lam 5:13,12,"Young men are compelled to grind at the mill, and boys stagger under loads of wood."
en,ESV,Lam,Lam,24,Lam.5,Lam 5,4,Lam.5.14,Lam 5:14,13,"The old men have left the city gate, the young men their music."
en,ESV,Lam,Lam,24,Lam.5,Lam 5,4,Lam.5.15,Lam 5:15,14,The joy of our hearts has ceased; our dancing has been turned to mourning.
en,ESV,Lam,Lam,24,Lam.5,Lam 5,4,Lam.5.16,Lam 5:16,15,"The crown has fallen from our head; woe to us, for we have sinned!"
en,ESV,Lam,Lam,24,Lam.5,Lam 5,4,Lam.5.17,Lam 5:17,16,"For this our heart has become sick, for these things our eyes have grown dim,"
en,ESV,Lam,Lam,24,Lam.5,Lam 5,4,Lam.5.18,Lam 5:18,17,for Mount Zion which lies desolate; jackals prowl over it.
en,ESV,Lam,Lam,24,Lam.5,Lam 5,4,Lam.5.19,Lam 5:19,18,"But you, O LORD, reign forever; your throne endures to all generations."
en,ESV,Lam,Lam,24,Lam.5,Lam 5,4,Lam.5.20,Lam 5:20,19,"Why do you forget us forever, why do you forsake us for so many days?"
en,ESV,Lam,Lam,24,Lam.5,Lam 5,4,Lam.5.21,Lam 5:21,20,"Restore us to yourself, O LORD, that we may be restored! Renew our days as of old-"
en,ESV,Lam,Lam,24,Lam.5,Lam 5,4,Lam.5.22,Lam 5:22,21,"unless you have utterly rejected us, and you remain exceedingly angry with us."
