languageCode,code,bookOsisId,bookSblId,bookOrderIndex,chapterOsisId,chapterSblId,chapterOrderIndex,verseOsisId,verseSblId,verseOrderIndex,text
en,ESV,Mic,Mic,32,Mic.1,Mic 1,0,Mic.1.1,Mic 1:1,0,"The word of the LORD that came to Micah of Moresheth in the days of Jotham, Ahaz, and Hezekiah, kings of Judah, which he saw concerning Samaria and Jerusalem."
en,ESV,Mic,Mic,32,Mic.1,Mic 1,0,Mic.1.2,Mic 1:2,1,"Hear, you peoples, all of you; pay attention, O earth, and all that is in it, and let the Lord GOD be a witness against you, the Lord from his holy temple."
en,ESV,Mic,Mic,32,Mic.1,Mic 1,0,Mic.1.3,Mic 1:3,2,"For behold, the LORD is coming out of his place, and will come down and tread upon the high places of the earth."
en,ESV,Mic,Mic,32,Mic.1,Mic 1,0,Mic.1.4,Mic 1:4,3,"And the mountains will melt under him, and the valleys will split open, like wax before the fire, like waters poured down a steep place."
en,ESV,Mic,Mic,32,Mic.1,Mic 1,0,Mic.1.5,Mic 1:5,4,All this is for the transgression of Jacob and for the sins of the house of Israel. What is the transgression of Jacob? Is it not Samaria? And what is the high place of Judah? Is it not Jerusalem?
en,ESV,Mic,Mic,32,Mic.1,Mic 1,0,Mic.1.6,Mic 1:6,5,"Therefore I will make Samaria a heap in the open country, a place for planting vineyards, and I will pour down her stones into the valley and uncover her foundations."
en,ESV,Mic,Mic,32,Mic.1,Mic 1,0,Mic.1.7,Mic 1:7,6,"All her carved images shall be beaten to pieces, all her wages shall be burned with fire, and all her idols I will lay waste, for from the fee of a prostitute she gathered them, and to the fee of a prostitute they shall return."
en,ESV,Mic,Mic,32,Mic.1,Mic 1,0,Mic.1.8,Mic 1:8,7,"For this I will lament and wail; I will go stripped and naked; I will make lamentation like the jackals, and mourning like the ostriches."
en,ESV,Mic,Mic,32,Mic.1,Mic 1,0,Mic.1.9,Mic 1:9,8,"For her wound is incurable, and it has come to Judah; it has reached to the gate of my people, to Jerusalem."
en,ESV,Mic,Mic,32,Mic.1,Mic 1,0,Mic.1.10,Mic 1:10,9,Tell it not in Gath; weep not at all; in Beth-le-aphrah roll yourselves in the dust.
en,ESV,Mic,Mic,32,Mic.1,Mic 1,0,Mic.1.11,Mic 1:11,10,"Pass on your way, inhabitants of Shaphir, in nakedness and shame; the inhabitants of Zaanan do not come out; the lamentation of Beth-ezel shall take away from you its standing place."
en,ESV,Mic,Mic,32,Mic.1,Mic 1,0,Mic.1.12,Mic 1:12,11,"For the inhabitants of Maroth wait anxiously for good, because disaster has come down from the LORD to the gate of Jerusalem."
en,ESV,Mic,Mic,32,Mic.1,Mic 1,0,Mic.1.13,Mic 1:13,12,"Harness the steeds to the chariots, inhabitants of Lachish; it was the beginning of sin to the daughter of Zion, for in you were found the transgressions of Israel."
en,ESV,Mic,Mic,32,Mic.1,Mic 1,0,Mic.1.14,Mic 1:14,13,Therefore you shall give parting gifts to Moresheth-gath; the houses of Achzib shall be a deceitful thing to the kings of Israel.
en,ESV,Mic,Mic,32,Mic.1,Mic 1,0,Mic.1.15,Mic 1:15,14,"I will again bring a conqueror to you, inhabitants of Mareshah; the glory of Israel shall come to Adullam."
en,ESV,Mic,Mic,32,Mic.1,Mic 1,0,Mic.1.16,Mic 1:16,15,"Make yourselves bald and cut off your hair, for the children of your delight; make yourselves as bald as the eagle, for they shall go from you into exile."
en,ESV,Mic,Mic,32,Mic.2,Mic 2,1,Mic.2.1,Mic 2:1,0,"Woe to those who devise wickedness and work evil on their beds! When the morning dawns, they perform it, because it is in the power of their hand."
en,ESV,Mic,Mic,32,Mic.2,Mic 2,1,Mic.2.2,Mic 2:2,1,"They covet fields and seize them, and houses, and take them away; they oppress a man and his house, a man and his inheritance."
en,ESV,Mic,Mic,32,Mic.2,Mic 2,1,Mic.2.3,Mic 2:3,2,"Therefore thus says the LORD: behold, against this family I am devising disaster, from which you cannot remove your necks, and you shall not walk haughtily, for it will be a time of disaster."
en,ESV,Mic,Mic,32,Mic.2,Mic 2,1,Mic.2.4,Mic 2:4,3,"In that day they shall take up a taunt song against you and moan bitterly, and say, ""We are utterly ruined; he changes the portion of my people; how he removes it from me! To an apostate he allots our fields."""
en,ESV,Mic,Mic,32,Mic.2,Mic 2,1,Mic.2.5,Mic 2:5,4,Therefore you will have none to cast the line by lot in the assembly of the LORD.
en,ESV,Mic,Mic,32,Mic.2,Mic 2,1,Mic.2.6,Mic 2:6,5,"""Do not preach""- thus they preach- ""one should not preach of such things; disgrace will not overtake us."""
en,ESV,Mic,Mic,32,Mic.2,Mic 2,1,Mic.2.7,Mic 2:7,6,"Should this be said, O house of Jacob? Has the LORD grown impatient? Are these his deeds? Do not my words do good to him who walks uprightly?"
en,ESV,Mic,Mic,32,Mic.2,Mic 2,1,Mic.2.8,Mic 2:8,7,But lately my people have risen up as an enemy; you strip the rich robe from those who pass by trustingly with no thought of war.
en,ESV,Mic,Mic,32,Mic.2,Mic 2,1,Mic.2.9,Mic 2:9,8,The women of my people you drive out from their delightful houses; from their young children you take away my splendor forever.
en,ESV,Mic,Mic,32,Mic.2,Mic 2,1,Mic.2.10,Mic 2:10,9,"Arise and go, for this is no place to rest, because of uncleanness that destroys with a grievous destruction."
en,ESV,Mic,Mic,32,Mic.2,Mic 2,1,Mic.2.11,Mic 2:11,10,"If a man should go about and utter wind and lies, saying, ""I will preach to you of wine and strong drink,"" he would be the preacher for this people!"
en,ESV,Mic,Mic,32,Mic.2,Mic 2,1,Mic.2.12,Mic 2:12,11,"I will surely assemble all of you, O Jacob; I will gather the remnant of Israel; I will set them together like sheep in a fold, like a flock in its pasture, a noisy multitude of men."
en,ESV,Mic,Mic,32,Mic.2,Mic 2,1,Mic.2.13,Mic 2:13,12,"He who opens the breach goes up before them; they break through and pass the gate, going out by it. Their king passes on before them, the LORD at their head."
en,ESV,Mic,Mic,32,Mic.3,Mic 3,2,Mic.3.1,Mic 3:1,0,"And I said:Hear, you heads of Jacob and rulers of the house of Israel! Is it not for you to know justice?-"
en,ESV,Mic,Mic,32,Mic.3,Mic 3,2,Mic.3.2,Mic 3:2,1,"you who hate the good and love the evil, who tear the skin from off my people and their flesh from off their bones,"
en,ESV,Mic,Mic,32,Mic.3,Mic 3,2,Mic.3.3,Mic 3:3,2,"who eat the flesh of my people, and flay their skin from off them, and break their bones in pieces and chop them up like meat in a pot, like flesh in a cauldron."
en,ESV,Mic,Mic,32,Mic.3,Mic 3,2,Mic.3.4,Mic 3:4,3,"Then they will cry to the LORD, but he will not answer them; he will hide his face from them at that time, because they have made their deeds evil."
en,ESV,Mic,Mic,32,Mic.3,Mic 3,2,Mic.3.5,Mic 3:5,4,"Thus says the LORD concerning the prophets who lead my people astray, who cry ""Peace"" when they have something to eat, but declare war against him who puts nothing into their mouths."
en,ESV,Mic,Mic,32,Mic.3,Mic 3,2,Mic.3.6,Mic 3:6,5,"Therefore it shall be night to you, without vision, and darkness to you, without divination. The sun shall go down on the prophets, and the day shall be black over them;"
en,ESV,Mic,Mic,32,Mic.3,Mic 3,2,Mic.3.7,Mic 3:7,6,"the seers shall be disgraced, and the diviners put to shame; they shall all cover their lips, for there is no answer from God."
en,ESV,Mic,Mic,32,Mic.3,Mic 3,2,Mic.3.8,Mic 3:8,7,"But as for me, I am filled with power, with the Spirit of the LORD, and with justice and might, to declare to Jacob his transgression and to Israel his sin."
en,ESV,Mic,Mic,32,Mic.3,Mic 3,2,Mic.3.9,Mic 3:9,8,"Hear this, you heads of the house of Jacob and rulers of the house of Israel, who detest justice and make crooked all that is straight,"
en,ESV,Mic,Mic,32,Mic.3,Mic 3,2,Mic.3.10,Mic 3:10,9,who build Zion with blood and Jerusalem with iniquity.
en,ESV,Mic,Mic,32,Mic.3,Mic 3,2,Mic.3.11,Mic 3:11,10,"Its heads give judgment for a bribe; its priests teach for a price; its prophets practice divination for money; yet they lean on the LORD and say, ""Is not the LORD in the midst of us? No disaster shall come upon us."""
en,ESV,Mic,Mic,32,Mic.3,Mic 3,2,Mic.3.12,Mic 3:12,11,"Therefore because of you Zion shall be plowed as a field; Jerusalem shall become a heap of ruins, and the mountain of the house a wooded height."
en,ESV,Mic,Mic,32,Mic.4,Mic 4,3,Mic.4.1,Mic 4:1,0,"It shall come to pass in the latter days that the mountain of the house of the LORD shall be established as the highest of the mountains, and it shall be lifted up above the hills; and peoples shall flow to it,"
en,ESV,Mic,Mic,32,Mic.4,Mic 4,3,Mic.4.2,Mic 4:2,1,"and many nations shall come, and say: ""Come, let us go up to the mountain of the LORD, to the house of the God of Jacob, that he may teach us his ways and that we may walk in his paths."" For out of Zion shall go forth the law, and the word of the LORD from Jerusalem."
en,ESV,Mic,Mic,32,Mic.4,Mic 4,3,Mic.4.3,Mic 4:3,2,"He shall judge between many peoples, and shall decide for strong nations afar off; and they shall beat their swords into plowshares, and their spears into pruning hooks; nation shall not lift up sword against nation, neither shall they learn war anymore;"
en,ESV,Mic,Mic,32,Mic.4,Mic 4,3,Mic.4.4,Mic 4:4,3,"but they shall sit every man under his vine and under his fig tree, and no one shall make them afraid, for the mouth of the LORD of hosts has spoken."
en,ESV,Mic,Mic,32,Mic.4,Mic 4,3,Mic.4.5,Mic 4:5,4,"For all the peoples walk each in the name of its god, but we will walk in the name of the LORD our God forever and ever."
en,ESV,Mic,Mic,32,Mic.4,Mic 4,3,Mic.4.6,Mic 4:6,5,"In that day, declares the LORD, I will assemble the lame and gather those who have been driven away and those whom I have afflicted;"
en,ESV,Mic,Mic,32,Mic.4,Mic 4,3,Mic.4.7,Mic 4:7,6,"and the lame I will make the remnant, and those who were cast off, a strong nation; and the LORD will reign over them in Mount Zion from this time forth and forevermore."
en,ESV,Mic,Mic,32,Mic.4,Mic 4,3,Mic.4.8,Mic 4:8,7,"And you, O tower of the flock, hill of the daughter of Zion, to you shall it come, the former dominion shall come, kingship for the daughter of Jerusalem."
en,ESV,Mic,Mic,32,Mic.4,Mic 4,3,Mic.4.9,Mic 4:9,8,"Now why do you cry aloud? Is there no king in you? Has your counselor perished, that pain seized you like a woman in labor?"
en,ESV,Mic,Mic,32,Mic.4,Mic 4,3,Mic.4.10,Mic 4:10,9,"Writhe and groan, O daughter of Zion, like a woman in labor, for now you shall go out from the city and dwell in the open country; you shall go to Babylon. There you shall be rescued; there the LORD will redeem you from the hand of your enemies."
en,ESV,Mic,Mic,32,Mic.4,Mic 4,3,Mic.4.11,Mic 4:11,10,"Now many nations are assembled against you, saying, ""Let her be defiled, and let our eyes gaze upon Zion."""
en,ESV,Mic,Mic,32,Mic.4,Mic 4,3,Mic.4.12,Mic 4:12,11,"But they do not know the thoughts of the LORD; they do not understand his plan, that he has gathered them as sheaves to the threshing floor."
en,ESV,Mic,Mic,32,Mic.4,Mic 4,3,Mic.4.13,Mic 4:13,12,"Arise and thresh, O daughter of Zion, for I will make your horn iron, and I will make your hoofs bronze; you shall beat in pieces many peoples; and shall devote their gain to the LORD, their wealth to the Lord of the whole earth."
en,ESV,Mic,Mic,32,Mic.5,Mic 5,4,Mic.5.1,Mic 5:1,0,"Now muster your troops, O daughter of troops; siege is laid against us; with a rod they strike the judge of Israel on the cheek."
en,ESV,Mic,Mic,32,Mic.5,Mic 5,4,Mic.5.2,Mic 5:2,1,"But you, O Bethlehem Ephrathah, who are too little to be among the clans of Judah, from you shall come forth for me one who is to be ruler in Israel, whose origin is from of old, from ancient days."
en,ESV,Mic,Mic,32,Mic.5,Mic 5,4,Mic.5.3,Mic 5:3,2,Therefore he shall give them up until the time when she who is in labor has given birth; then the rest of his brothers shall return to the people of Israel.
en,ESV,Mic,Mic,32,Mic.5,Mic 5,4,Mic.5.4,Mic 5:4,3,"And he shall stand and shepherd his flock in the strength of the LORD, in the majesty of the name of the LORD his God. And they shall dwell secure, for now he shall be great to the ends of the earth."
en,ESV,Mic,Mic,32,Mic.5,Mic 5,4,Mic.5.5,Mic 5:5,4,"And he shall be their peace. When the Assyrian comes into our land and treads in our palaces, then we will raise against him seven shepherds and eight princes of men;"
en,ESV,Mic,Mic,32,Mic.5,Mic 5,4,Mic.5.6,Mic 5:6,5,"they shall shepherd the land of Assyria with the sword, and the land of Nimrod at its entrances; and he shall deliver us from the Assyrian when he comes into our land and treads within our border."
en,ESV,Mic,Mic,32,Mic.5,Mic 5,4,Mic.5.7,Mic 5:7,6,"Then the remnant of Jacob shall be in the midst of many peoples like dew from the LORD, like showers on the grass, which delay not for a man nor wait for the children of man."
en,ESV,Mic,Mic,32,Mic.5,Mic 5,4,Mic.5.8,Mic 5:8,7,"And the remnant of Jacob shall be among the nations, in the midst of many peoples, like a lion among the beasts of the forest, like a young lion among the flocks of sheep, which, when it goes through, treads down and tears in pieces, and there is none to deliver."
en,ESV,Mic,Mic,32,Mic.5,Mic 5,4,Mic.5.9,Mic 5:9,8,"Your hand shall be lifted up over your adversaries, and all your enemies shall be cut off."
en,ESV,Mic,Mic,32,Mic.5,Mic 5,4,Mic.5.10,Mic 5:10,9,"And in that day, declares the LORD, I will cut off your horses from among you and will destroy your chariots;"
en,ESV,Mic,Mic,32,Mic.5,Mic 5,4,Mic.5.11,Mic 5:11,10,and I will cut off the cities of your land and throw down all your strongholds;
en,ESV,Mic,Mic,32,Mic.5,Mic 5,4,Mic.5.12,Mic 5:12,11,"and I will cut off sorceries from your hand, and you shall have no more tellers of fortunes;"
en,ESV,Mic,Mic,32,Mic.5,Mic 5,4,Mic.5.13,Mic 5:13,12,"and I will cut off your carved images and your pillars from among you, and you shall bow down no more to the work of your hands;"
en,ESV,Mic,Mic,32,Mic.5,Mic 5,4,Mic.5.14,Mic 5:14,13,and I will root out your Asherah images from among you and destroy your cities.
en,ESV,Mic,Mic,32,Mic.5,Mic 5,4,Mic.5.15,Mic 5:15,14,And in anger and wrath I will execute vengeance on the nations that did not obey.
en,ESV,Mic,Mic,32,Mic.6,Mic 6,5,Mic.6.1,Mic 6:1,0,"Hear what the LORD says:Arise, plead your case before the mountains, and let the hills hear your voice."
en,ESV,Mic,Mic,32,Mic.6,Mic 6,5,Mic.6.2,Mic 6:2,1,"Hear, you mountains, the indictment of the LORD, and you enduring foundations of the earth, for the LORD has an indictment against his people, and he will contend with Israel."
en,ESV,Mic,Mic,32,Mic.6,Mic 6,5,Mic.6.3,Mic 6:3,2,"""O my people, what have I done to you? How have I wearied you? Answer me!"
en,ESV,Mic,Mic,32,Mic.6,Mic 6,5,Mic.6.4,Mic 6:4,3,"For I brought you up from the land of Egypt and redeemed you from the house of slavery, and I sent before you Moses, Aaron, and Miriam."
en,ESV,Mic,Mic,32,Mic.6,Mic 6,5,Mic.6.5,Mic 6:5,4,"O my people, remember what Balak king of Moab devised, and what Balaam the son of Beor answered him, and what happened from Shittim to Gilgal, that you may know the saving acts of the LORD."""
en,ESV,Mic,Mic,32,Mic.6,Mic 6,5,Mic.6.6,Mic 6:6,5,"""With what shall I come before the LORD, and bow myself before God on high? Shall I come before him with burnt offerings, with calves a year old?"
en,ESV,Mic,Mic,32,Mic.6,Mic 6,5,Mic.6.7,Mic 6:7,6,"Will the LORD be pleased with thousands of rams, with ten thousands of rivers of oil? Shall I give my firstborn for my transgression, the fruit of my body for the sin of my soul?"""
en,ESV,Mic,Mic,32,Mic.6,Mic 6,5,Mic.6.8,Mic 6:8,7,"He has told you, O man, what is good; and what does the LORD require of you but to do justice, and to love kindness, and to walk humbly with your God?"
en,ESV,Mic,Mic,32,Mic.6,Mic 6,5,Mic.6.9,Mic 6:9,8,"The voice of the LORD cries to the city- and it is sound wisdom to fear your name: ""Hear of the rod and of him who appointed it!"
en,ESV,Mic,Mic,32,Mic.6,Mic 6,5,Mic.6.10,Mic 6:10,9,"Can I forget any longer the treasures of wickedness in the house of the wicked, and the scant measure that is accursed?"
en,ESV,Mic,Mic,32,Mic.6,Mic 6,5,Mic.6.11,Mic 6:11,10,Shall I acquit the man with wicked scales and with a bag of deceitful weights?
en,ESV,Mic,Mic,32,Mic.6,Mic 6,5,Mic.6.12,Mic 6:12,11,"Your rich men are full of violence; your inhabitants speak lies, and their tongue is deceitful in their mouth."
en,ESV,Mic,Mic,32,Mic.6,Mic 6,5,Mic.6.13,Mic 6:13,12,"Therefore I strike you with a grievous blow, making you desolate because of your sins."
en,ESV,Mic,Mic,32,Mic.6,Mic 6,5,Mic.6.14,Mic 6:14,13,"You shall eat, but not be satisfied, and there shall be hunger within you; you shall put away, but not preserve, and what you preserve I will give to the sword."
en,ESV,Mic,Mic,32,Mic.6,Mic 6,5,Mic.6.15,Mic 6:15,14,"You shall sow, but not reap; you shall tread olives, but not anoint yourselves with oil; you shall tread grapes, but not drink wine."
en,ESV,Mic,Mic,32,Mic.6,Mic 6,5,Mic.6.16,Mic 6:16,15,"For you have kept the statutes of Omri, and all the works of the house of Ahab; and you have walked in their counsels, that I may make you a desolation, and your inhabitants a hissing; so you shall bear the scorn of my people."""
en,ESV,Mic,Mic,32,Mic.7,Mic 7,6,Mic.7.1,Mic 7:1,0,"Woe is me! For I have become as when the summer fruit has been gathered, as when the grapes have been gleaned: there is no cluster to eat, no first-ripe fig that my soul desires."
en,ESV,Mic,Mic,32,Mic.7,Mic 7,6,Mic.7.2,Mic 7:2,1,"The godly has perished from the earth, and there is no one upright among mankind; they all lie in wait for blood, and each hunts the other with a net."
en,ESV,Mic,Mic,32,Mic.7,Mic 7,6,Mic.7.3,Mic 7:3,2,"Their hands are on what is evil, to do it well; the prince and the judge ask for a bribe, and the great man utters the evil desire of his soul; thus they weave it together."
en,ESV,Mic,Mic,32,Mic.7,Mic 7,6,Mic.7.4,Mic 7:4,3,"The best of them is like a brier, the most upright of them a thorn hedge. The day of your watchmen, of your punishment, has come; now their confusion is at hand."
en,ESV,Mic,Mic,32,Mic.7,Mic 7,6,Mic.7.5,Mic 7:5,4,Put no trust in a neighbor; have no confidence in a friend; guard the doors of your mouth from her who lies in your arms;
en,ESV,Mic,Mic,32,Mic.7,Mic 7,6,Mic.7.6,Mic 7:6,5,"for the son treats the father with contempt, the daughter rises up against her mother, the daughter-in-law against her mother-in-law; a man's enemies are the men of his own house."
en,ESV,Mic,Mic,32,Mic.7,Mic 7,6,Mic.7.7,Mic 7:7,6,"But as for me, I will look to the LORD; I will wait for the God of my salvation; my God will hear me."
en,ESV,Mic,Mic,32,Mic.7,Mic 7,6,Mic.7.8,Mic 7:8,7,"Rejoice not over me, O my enemy; when I fall, I shall rise; when I sit in darkness, the LORD will be a light to me."
en,ESV,Mic,Mic,32,Mic.7,Mic 7,6,Mic.7.9,Mic 7:9,8,"I will bear the indignation of the LORD because I have sinned against him, until he pleads my cause and executes judgment for me. He will bring me out to the light; I shall look upon his vindication."
en,ESV,Mic,Mic,32,Mic.7,Mic 7,6,Mic.7.10,Mic 7:10,9,"Then my enemy will see, and shame will cover her who said to me, ""Where is the LORD your God?"" My eyes will look upon her; now she will be trampled down like the mire of the streets."
en,ESV,Mic,Mic,32,Mic.7,Mic 7,6,Mic.7.11,Mic 7:11,10,A day for the building of your walls! In that day the boundary shall be far extended.
en,ESV,Mic,Mic,32,Mic.7,Mic 7,6,Mic.7.12,Mic 7:12,11,"In that day they will come to you, from Assyria and the cities of Egypt, and from Egypt to the River, from sea to sea and from mountain to mountain."
en,ESV,Mic,Mic,32,Mic.7,Mic 7,6,Mic.7.13,Mic 7:13,12,"But the earth will be desolate because of its inhabitants, for the fruit of their deeds."
en,ESV,Mic,Mic,32,Mic.7,Mic 7,6,Mic.7.14,Mic 7:14,13,"Shepherd your people with your staff, the flock of your inheritance, who dwell alone in a forest in the midst of a garden land; let them graze in Bashan and Gilead as in the days of old."
en,ESV,Mic,Mic,32,Mic.7,Mic 7,6,Mic.7.15,Mic 7:15,14,"As in the days when you came out of the land of Egypt, I will show them marvelous things."
en,ESV,Mic,Mic,32,Mic.7,Mic 7,6,Mic.7.16,Mic 7:16,15,The nations shall see and be ashamed of all their might; they shall lay their hands on their mouths; their ears shall be deaf;
en,ESV,Mic,Mic,32,Mic.7,Mic 7,6,Mic.7.17,Mic 7:17,16,"they shall lick the dust like a serpent, like the crawling things of the earth; they shall come trembling out of their strongholds; they shall turn in dread to the LORD our God, and they shall be in fear of you."
en,ESV,Mic,Mic,32,Mic.7,Mic 7,6,Mic.7.18,Mic 7:18,17,"Who is a God like you, pardoning iniquity and passing over transgression for the remnant of his inheritance? He does not retain his anger forever, because he delights in steadfast love."
en,ESV,Mic,Mic,32,Mic.7,Mic 7,6,Mic.7.19,Mic 7:19,18,He will again have compassion on us; he will tread our iniquities under foot. You will cast all our sins into the depths of the sea.
en,ESV,Mic,Mic,32,Mic.7,Mic 7,6,Mic.7.20,Mic 7:20,19,"You will show faithfulness to Jacob and steadfast love to Abraham, as you have sworn to our fathers from the days of old."
