languageCode,code,bookOsisId,bookSblId,bookOrderIndex,chapterOsisId,chapterSblId,chapterOrderIndex,verseOsisId,verseSblId,verseOrderIndex,text
en,ESV,Mark,Mark,40,Mark.1,Mark 1,0,Mark.1.1,Mark 1:1,0,"The beginning of the gospel of Jesus Christ, the Son of God."
en,ESV,Mark,Mark,40,Mark.1,Mark 1,0,Mark.1.2,Mark 1:2,1,"As it is written in Isaiah the prophet, ""Behold, I send my messenger before your face, who will prepare your way,"
en,ESV,Mark,Mark,40,Mark.1,Mark 1,0,Mark.1.3,Mark 1:3,2,"the voice of one crying in the wilderness: Prepare the way of the Lord, make his paths straight."""
en,ESV,Mark,Mark,40,Mark.1,Mark 1,0,Mark.1.4,Mark 1:4,3,"John appeared, baptizing in the wilderness and proclaiming a baptism of repentance for the forgiveness of sins."
en,ESV,Mark,Mark,40,Mark.1,Mark 1,0,Mark.1.5,Mark 1:5,4,"And all the country of Judea and all Jerusalem were going out to him and were being baptized by him in the river Jordan, confessing their sins."
en,ESV,Mark,Mark,40,Mark.1,Mark 1,0,Mark.1.6,Mark 1:6,5,Now John was clothed with camel's hair and wore a leather belt around his waist and ate locusts and wild honey.
en,ESV,Mark,Mark,40,Mark.1,Mark 1,0,Mark.1.7,Mark 1:7,6,"And he preached, saying, ""After me comes he who is mightier than I, the strap of whose sandals I am not worthy to stoop down and untie."
en,ESV,Mark,Mark,40,Mark.1,Mark 1,0,Mark.1.8,Mark 1:8,7,"I have baptized you with water, but he will baptize you with the Holy Spirit."""
en,ESV,Mark,Mark,40,Mark.1,Mark 1,0,Mark.1.9,Mark 1:9,8,In those days Jesus came from Nazareth of Galilee and was baptized by John in the Jordan.
en,ESV,Mark,Mark,40,Mark.1,Mark 1,0,Mark.1.10,Mark 1:10,9,"And when he came up out of the water, immediately he saw the heavens opening and the Spirit descending on him like a dove."
en,ESV,Mark,Mark,40,Mark.1,Mark 1,0,Mark.1.11,Mark 1:11,10,"And a voice came from heaven, ""You are my beloved Son; with you I am well pleased."""
en,ESV,Mark,Mark,40,Mark.1,Mark 1,0,Mark.1.12,Mark 1:12,11,The Spirit immediately drove him out into the wilderness.
en,ESV,Mark,Mark,40,Mark.1,Mark 1,0,Mark.1.13,Mark 1:13,12,"And he was in the wilderness forty days, being tempted by Satan. And he was with the wild animals, and the angels were ministering to him."
en,ESV,Mark,Mark,40,Mark.1,Mark 1,0,Mark.1.14,Mark 1:14,13,"Now after John was arrested, Jesus came into Galilee, proclaiming the gospel of God,"
en,ESV,Mark,Mark,40,Mark.1,Mark 1,0,Mark.1.15,Mark 1:15,14,"and saying, ""The time is fulfilled, and the kingdom of God is at hand; repent and believe in the gospel."""
en,ESV,Mark,Mark,40,Mark.1,Mark 1,0,Mark.1.16,Mark 1:16,15,"Passing alongside the Sea of Galilee, he saw Simon and Andrew the brother of Simon casting a net into the sea, for they were fishermen."
en,ESV,Mark,Mark,40,Mark.1,Mark 1,0,Mark.1.17,Mark 1:17,16,"And Jesus said to them, ""Follow me, and I will make you become fishers of men."""
en,ESV,Mark,Mark,40,Mark.1,Mark 1,0,Mark.1.18,Mark 1:18,17,And immediately they left their nets and followed him.
en,ESV,Mark,Mark,40,Mark.1,Mark 1,0,Mark.1.19,Mark 1:19,18,"And going on a little farther, he saw James the son of Zebedee and John his brother, who were in their boat mending the nets."
en,ESV,Mark,Mark,40,Mark.1,Mark 1,0,Mark.1.20,Mark 1:20,19,"And immediately he called them, and they left their father Zebedee in the boat with the hired servants and followed him."
en,ESV,Mark,Mark,40,Mark.1,Mark 1,0,Mark.1.21,Mark 1:21,20,"And they went into Capernaum, and immediately on the Sabbath he entered the synagogue and was teaching."
en,ESV,Mark,Mark,40,Mark.1,Mark 1,0,Mark.1.22,Mark 1:22,21,"And they were astonished at his teaching, for he taught them as one who had authority, and not as the scribes."
en,ESV,Mark,Mark,40,Mark.1,Mark 1,0,Mark.1.23,Mark 1:23,22,"And immediately there was in their synagogue a man with an unclean spirit. And he cried out,"
en,ESV,Mark,Mark,40,Mark.1,Mark 1,0,Mark.1.24,Mark 1:24,23,"""What have you to do with us, Jesus of Nazareth? Have you come to destroy us? I know who you are- the Holy One of God."""
en,ESV,Mark,Mark,40,Mark.1,Mark 1,0,Mark.1.25,Mark 1:25,24,"But Jesus rebuked him, saying, ""Be silent, and come out of him!"""
en,ESV,Mark,Mark,40,Mark.1,Mark 1,0,Mark.1.26,Mark 1:26,25,"And the unclean spirit, convulsing him and crying out with a loud voice, came out of him."
en,ESV,Mark,Mark,40,Mark.1,Mark 1,0,Mark.1.27,Mark 1:27,26,"And they were all amazed, so that they questioned among themselves, saying, ""What is this? A new teaching with authority! He commands even the unclean spirits, and they obey him."""
en,ESV,Mark,Mark,40,Mark.1,Mark 1,0,Mark.1.28,Mark 1:28,27,And at once his fame spread everywhere throughout all the surrounding region of Galilee.
en,ESV,Mark,Mark,40,Mark.1,Mark 1,0,Mark.1.29,Mark 1:29,28,"And immediately he left the synagogue and entered the house of Simon and Andrew, with James and John."
en,ESV,Mark,Mark,40,Mark.1,Mark 1,0,Mark.1.30,Mark 1:30,29,"Now Simon's mother-in-law lay ill with a fever, and immediately they told him about her."
en,ESV,Mark,Mark,40,Mark.1,Mark 1,0,Mark.1.31,Mark 1:31,30,"And he came and took her by the hand and lifted her up, and the fever left her, and she began to serve them."
en,ESV,Mark,Mark,40,Mark.1,Mark 1,0,Mark.1.32,Mark 1:32,31,That evening at sundown they brought to him all who were sick or oppressed by demons.
en,ESV,Mark,Mark,40,Mark.1,Mark 1,0,Mark.1.33,Mark 1:33,32,And the whole city was gathered together at the door.
en,ESV,Mark,Mark,40,Mark.1,Mark 1,0,Mark.1.34,Mark 1:34,33,"And he healed many who were sick with various diseases, and cast out many demons. And he would not permit the demons to speak, because they knew him."
en,ESV,Mark,Mark,40,Mark.1,Mark 1,0,Mark.1.35,Mark 1:35,34,"And rising very early in the morning, while it was still dark, he departed and went out to a desolate place, and there he prayed."
en,ESV,Mark,Mark,40,Mark.1,Mark 1,0,Mark.1.36,Mark 1:36,35,"And Simon and those who were with him searched for him,"
en,ESV,Mark,Mark,40,Mark.1,Mark 1,0,Mark.1.37,Mark 1:37,36,"and they found him and said to him, ""Everyone is looking for you."""
en,ESV,Mark,Mark,40,Mark.1,Mark 1,0,Mark.1.38,Mark 1:38,37,"And he said to them, ""Let us go on to the next towns, that I may preach there also, for that is why I came out."""
en,ESV,Mark,Mark,40,Mark.1,Mark 1,0,Mark.1.39,Mark 1:39,38,"And he went throughout all Galilee, preaching in their synagogues and casting out demons."
en,ESV,Mark,Mark,40,Mark.1,Mark 1,0,Mark.1.40,Mark 1:40,39,"And a leper came to him, imploring him, and kneeling said to him, ""If you will, you can make me clean."""
en,ESV,Mark,Mark,40,Mark.1,Mark 1,0,Mark.1.41,Mark 1:41,40,"Moved with pity, he stretched out his hand and touched him and said to him, ""I will; be clean."""
en,ESV,Mark,Mark,40,Mark.1,Mark 1,0,Mark.1.42,Mark 1:42,41,"And immediately the leprosy left him, and he was made clean."
en,ESV,Mark,Mark,40,Mark.1,Mark 1,0,Mark.1.43,Mark 1:43,42,"And Jesus sternly charged him and sent him away at once,"
en,ESV,Mark,Mark,40,Mark.1,Mark 1,0,Mark.1.44,Mark 1:44,43,"and said to him, ""See that you say nothing to anyone, but go, show yourself to the priest and offer for your cleansing what Moses commanded, for a proof to them."""
en,ESV,Mark,Mark,40,Mark.1,Mark 1,0,Mark.1.45,Mark 1:45,44,"But he went out and began to talk freely about it, and to spread the news, so that Jesus could no longer openly enter a town, but was out in desolate places, and people were coming to him from every quarter."
en,ESV,Mark,Mark,40,Mark.2,Mark 2,1,Mark.2.1,Mark 2:1,0,"And when he returned to Capernaum after some days, it was reported that he was at home."
en,ESV,Mark,Mark,40,Mark.2,Mark 2,1,Mark.2.2,Mark 2:2,1,"And many were gathered together, so that there was no more room, not even at the door. And he was preaching the word to them."
en,ESV,Mark,Mark,40,Mark.2,Mark 2,1,Mark.2.3,Mark 2:3,2,"And they came, bringing to him a paralytic carried by four men."
en,ESV,Mark,Mark,40,Mark.2,Mark 2,1,Mark.2.4,Mark 2:4,3,"And when they could not get near him because of the crowd, they removed the roof above him, and when they had made an opening, they let down the bed on which the paralytic lay."
en,ESV,Mark,Mark,40,Mark.2,Mark 2,1,Mark.2.5,Mark 2:5,4,"And when Jesus saw their faith, he said to the paralytic, ""My son, your sins are forgiven."""
en,ESV,Mark,Mark,40,Mark.2,Mark 2,1,Mark.2.6,Mark 2:6,5,"Now some of the scribes were sitting there, questioning in their hearts,"
en,ESV,Mark,Mark,40,Mark.2,Mark 2,1,Mark.2.7,Mark 2:7,6,"""Why does this man speak like that? He is blaspheming! Who can forgive sins but God alone?"""
en,ESV,Mark,Mark,40,Mark.2,Mark 2,1,Mark.2.8,Mark 2:8,7,"And immediately Jesus, perceiving in his spirit that they thus questioned within themselves, said to them, ""Why do you question these things in your hearts?"
en,ESV,Mark,Mark,40,Mark.2,Mark 2,1,Mark.2.9,Mark 2:9,8,"Which is easier, to say to the paralytic, 'Your sins are forgiven,' or to say, 'Rise, take up your bed and walk'?"
en,ESV,Mark,Mark,40,Mark.2,Mark 2,1,Mark.2.10,Mark 2:10,9,"But that you may know that the Son of Man has authority on earth to forgive sins""- he said to the paralytic-"
en,ESV,Mark,Mark,40,Mark.2,Mark 2,1,Mark.2.11,Mark 2:11,10,"""I say to you, rise, pick up your bed, and go home."""
en,ESV,Mark,Mark,40,Mark.2,Mark 2,1,Mark.2.12,Mark 2:12,11,"And he rose and immediately picked up his bed and went out before them all, so that they were all amazed and glorified God, saying, ""We never saw anything like this!"""
en,ESV,Mark,Mark,40,Mark.2,Mark 2,1,Mark.2.13,Mark 2:13,12,"He went out again beside the sea, and all the crowd was coming to him, and he was teaching them."
en,ESV,Mark,Mark,40,Mark.2,Mark 2,1,Mark.2.14,Mark 2:14,13,"And as he passed by, he saw Levi the son of Alphaeus sitting at the tax booth, and he said to him, ""Follow me."" And he rose and followed him."
en,ESV,Mark,Mark,40,Mark.2,Mark 2,1,Mark.2.15,Mark 2:15,14,"And as he reclined at table in his house, many tax collectors and sinners were reclining with Jesus and his disciples, for there were many who followed him."
en,ESV,Mark,Mark,40,Mark.2,Mark 2,1,Mark.2.16,Mark 2:16,15,"And the scribes of the Pharisees, when they saw that he was eating with sinners and tax collectors, said to his disciples, ""Why does he eat with tax collectors and sinners?"""
en,ESV,Mark,Mark,40,Mark.2,Mark 2,1,Mark.2.17,Mark 2:17,16,"And when Jesus heard it, he said to them, ""Those who are well have no need of a physician, but those who are sick. I came not to call the righteous, but sinners."""
en,ESV,Mark,Mark,40,Mark.2,Mark 2,1,Mark.2.18,Mark 2:18,17,"Now John's disciples and the Pharisees were fasting. And people came and said to him, ""Why do John's disciples and the disciples of the Pharisees fast, but your disciples do not fast?"""
en,ESV,Mark,Mark,40,Mark.2,Mark 2,1,Mark.2.19,Mark 2:19,18,"And Jesus said to them, ""Can the wedding guests fast while the bridegroom is with them? As long as they have the bridegroom with them, they cannot fast."
en,ESV,Mark,Mark,40,Mark.2,Mark 2,1,Mark.2.20,Mark 2:20,19,"The days will come when the bridegroom is taken away from them, and then they will fast in that day."
en,ESV,Mark,Mark,40,Mark.2,Mark 2,1,Mark.2.21,Mark 2:21,20,"No one sews a piece of unshrunk cloth on an old garment. If he does, the patch tears away from it, the new from the old, and a worse tear is made."
en,ESV,Mark,Mark,40,Mark.2,Mark 2,1,Mark.2.22,Mark 2:22,21,"And no one puts new wine into old wineskins. If he does, the wine will burst the skins- and the wine is destroyed, and so are the skins. But new wine is for fresh wineskins."""
en,ESV,Mark,Mark,40,Mark.2,Mark 2,1,Mark.2.23,Mark 2:23,22,"One Sabbath he was going through the grainfields, and as they made their way, his disciples began to pluck heads of grain."
en,ESV,Mark,Mark,40,Mark.2,Mark 2,1,Mark.2.24,Mark 2:24,23,"And the Pharisees were saying to him, ""Look, why are they doing what is not lawful on the Sabbath?"""
en,ESV,Mark,Mark,40,Mark.2,Mark 2,1,Mark.2.25,Mark 2:25,24,"And he said to them, ""Have you never read what David did, when he was in need and was hungry, he and those who were with him:"
en,ESV,Mark,Mark,40,Mark.2,Mark 2,1,Mark.2.26,Mark 2:26,25,"how he entered the house of God, in the time of Abiathar the high priest, and ate the bread of the Presence, which it is not lawful for any but the priests to eat, and also gave it to those who were with him?"""
en,ESV,Mark,Mark,40,Mark.2,Mark 2,1,Mark.2.27,Mark 2:27,26,"And he said to them, ""The Sabbath was made for man, not man for the Sabbath."
en,ESV,Mark,Mark,40,Mark.2,Mark 2,1,Mark.2.28,Mark 2:28,27,"So the Son of Man is lord even of the Sabbath."""
en,ESV,Mark,Mark,40,Mark.3,Mark 3,2,Mark.3.1,Mark 3:1,0,"Again he entered the synagogue, and a man was there with a withered hand."
en,ESV,Mark,Mark,40,Mark.3,Mark 3,2,Mark.3.2,Mark 3:2,1,"And they watched Jesus, to see whether he would heal him on the Sabbath, so that they might accuse him."
en,ESV,Mark,Mark,40,Mark.3,Mark 3,2,Mark.3.3,Mark 3:3,2,"And he said to the man with the withered hand, ""Come here."""
en,ESV,Mark,Mark,40,Mark.3,Mark 3,2,Mark.3.4,Mark 3:4,3,"And he said to them, ""Is it lawful on the Sabbath to do good or to do harm, to save life or to kill?"" But they were silent."
en,ESV,Mark,Mark,40,Mark.3,Mark 3,2,Mark.3.5,Mark 3:5,4,"And he looked around at them with anger, grieved at their hardness of heart, and said to the man, ""Stretch out your hand."" He stretched it out, and his hand was restored."
en,ESV,Mark,Mark,40,Mark.3,Mark 3,2,Mark.3.6,Mark 3:6,5,"The Pharisees went out and immediately held counsel with the Herodians against him, how to destroy him."
en,ESV,Mark,Mark,40,Mark.3,Mark 3,2,Mark.3.7,Mark 3:7,6,"Jesus withdrew with his disciples to the sea, and a great crowd followed, from Galilee and Judea"
en,ESV,Mark,Mark,40,Mark.3,Mark 3,2,Mark.3.8,Mark 3:8,7,"and Jerusalem and Idumea and from beyond the Jordan and from around Tyre and Sidon. When the great crowd heard all that he was doing, they came to him."
en,ESV,Mark,Mark,40,Mark.3,Mark 3,2,Mark.3.9,Mark 3:9,8,"And he told his disciples to have a boat ready for him because of the crowd, lest they crush him,"
en,ESV,Mark,Mark,40,Mark.3,Mark 3,2,Mark.3.10,Mark 3:10,9,"for he had healed many, so that all who had diseases pressed around him to touch him."
en,ESV,Mark,Mark,40,Mark.3,Mark 3,2,Mark.3.11,Mark 3:11,10,"And whenever the unclean spirits saw him, they fell down before him and cried out, ""You are the Son of God."""
en,ESV,Mark,Mark,40,Mark.3,Mark 3,2,Mark.3.12,Mark 3:12,11,And he strictly ordered them not to make him known.
en,ESV,Mark,Mark,40,Mark.3,Mark 3,2,Mark.3.13,Mark 3:13,12,"And he went up on the mountain and called to him those whom he desired, and they came to him."
en,ESV,Mark,Mark,40,Mark.3,Mark 3,2,Mark.3.14,Mark 3:14,13,And he appointed twelve (whom he also named apostles) so that they might be with him and he might send them out to preach
en,ESV,Mark,Mark,40,Mark.3,Mark 3,2,Mark.3.15,Mark 3:15,14,and have authority to cast out demons.
en,ESV,Mark,Mark,40,Mark.3,Mark 3,2,Mark.3.16,Mark 3:16,15,He appointed the twelve: Simon (to whom he gave the name Peter);
en,ESV,Mark,Mark,40,Mark.3,Mark 3,2,Mark.3.17,Mark 3:17,16,"James the son of Zebedee and John the brother of James (to whom he gave the name Boanerges, that is, Sons of Thunder);"
en,ESV,Mark,Mark,40,Mark.3,Mark 3,2,Mark.3.18,Mark 3:18,17,"Andrew, and Philip, and Bartholomew, and Matthew, and Thomas, and James the son of Alphaeus, and Thaddaeus, and Simon the Cananaean,"
en,ESV,Mark,Mark,40,Mark.3,Mark 3,2,Mark.3.19,Mark 3:19,18,"and Judas Iscariot, who betrayed him."
en,ESV,Mark,Mark,40,Mark.3,Mark 3,2,Mark.3.20,Mark 3:20,19,"Then he went home, and the crowd gathered again, so that they could not even eat."
en,ESV,Mark,Mark,40,Mark.3,Mark 3,2,Mark.3.21,Mark 3:21,20,"And when his family heard it, they went out to seize him, for they were saying, ""He is out of his mind."""
en,ESV,Mark,Mark,40,Mark.3,Mark 3,2,Mark.3.22,Mark 3:22,21,"And the scribes who came down from Jerusalem were saying, ""He is possessed by Beelzebul,"" and ""by the prince of demons he casts out the demons."""
en,ESV,Mark,Mark,40,Mark.3,Mark 3,2,Mark.3.23,Mark 3:23,22,"And he called them to him and said to them in parables, ""How can Satan cast out Satan?"
en,ESV,Mark,Mark,40,Mark.3,Mark 3,2,Mark.3.24,Mark 3:24,23,"If a kingdom is divided against itself, that kingdom cannot stand."
en,ESV,Mark,Mark,40,Mark.3,Mark 3,2,Mark.3.25,Mark 3:25,24,"And if a house is divided against itself, that house will not be able to stand."
en,ESV,Mark,Mark,40,Mark.3,Mark 3,2,Mark.3.26,Mark 3:26,25,"And if Satan has risen up against himself and is divided, he cannot stand, but is coming to an end."
en,ESV,Mark,Mark,40,Mark.3,Mark 3,2,Mark.3.27,Mark 3:27,26,"But no one can enter a strong man's house and plunder his goods, unless he first binds the strong man. Then indeed he may plunder his house."
en,ESV,Mark,Mark,40,Mark.3,Mark 3,2,Mark.3.28,Mark 3:28,27,"""Truly, I say to you, all sins will be forgiven the children of man, and whatever blasphemies they utter,"
en,ESV,Mark,Mark,40,Mark.3,Mark 3,2,Mark.3.29,Mark 3:29,28,"but whoever blasphemes against the Holy Spirit never has forgiveness, but is guilty of an eternal sin""-"
en,ESV,Mark,Mark,40,Mark.3,Mark 3,2,Mark.3.30,Mark 3:30,29,"for they had said, ""He has an unclean spirit."""
en,ESV,Mark,Mark,40,Mark.3,Mark 3,2,Mark.3.31,Mark 3:31,30,"And his mother and his brothers came, and standing outside they sent to him and called him."
en,ESV,Mark,Mark,40,Mark.3,Mark 3,2,Mark.3.32,Mark 3:32,31,"And a crowd was sitting around him, and they said to him, ""Your mother and your brothers are outside, seeking you."""
en,ESV,Mark,Mark,40,Mark.3,Mark 3,2,Mark.3.33,Mark 3:33,32,"And he answered them, ""Who are my mother and my brothers?"""
en,ESV,Mark,Mark,40,Mark.3,Mark 3,2,Mark.3.34,Mark 3:34,33,"And looking about at those who sat around him, he said, ""Here are my mother and my brothers!"
en,ESV,Mark,Mark,40,Mark.3,Mark 3,2,Mark.3.35,Mark 3:35,34,"Whoever does the will of God, he is my brother and sister and mother."""
en,ESV,Mark,Mark,40,Mark.4,Mark 4,3,Mark.4.1,Mark 4:1,0,"Again he began to teach beside the sea. And a very large crowd gathered about him, so that he got into a boat and sat in it on the sea, and the whole crowd was beside the sea on the land."
en,ESV,Mark,Mark,40,Mark.4,Mark 4,3,Mark.4.2,Mark 4:2,1,"And he was teaching them many things in parables, and in his teaching he said to them:"
en,ESV,Mark,Mark,40,Mark.4,Mark 4,3,Mark.4.3,Mark 4:3,2,"""Listen! A sower went out to sow."
en,ESV,Mark,Mark,40,Mark.4,Mark 4,3,Mark.4.4,Mark 4:4,3,"And as he sowed, some seed fell along the path, and the birds came and devoured it."
en,ESV,Mark,Mark,40,Mark.4,Mark 4,3,Mark.4.5,Mark 4:5,4,"Other seed fell on rocky ground, where it did not have much soil, and immediately it sprang up, since it had no depth of soil."
en,ESV,Mark,Mark,40,Mark.4,Mark 4,3,Mark.4.6,Mark 4:6,5,"And when the sun rose it was scorched, and since it had no root, it withered away."
en,ESV,Mark,Mark,40,Mark.4,Mark 4,3,Mark.4.7,Mark 4:7,6,"Other seed fell among thorns, and the thorns grew up and choked it, and it yielded no grain."
en,ESV,Mark,Mark,40,Mark.4,Mark 4,3,Mark.4.8,Mark 4:8,7,"And other seeds fell into good soil and produced grain, growing up and increasing and yielding thirtyfold and sixtyfold and a hundredfold."""
en,ESV,Mark,Mark,40,Mark.4,Mark 4,3,Mark.4.9,Mark 4:9,8,"And he said, ""He who has ears to hear, let him hear."""
en,ESV,Mark,Mark,40,Mark.4,Mark 4,3,Mark.4.10,Mark 4:10,9,"And when he was alone, those around him with the twelve asked him about the parables."
en,ESV,Mark,Mark,40,Mark.4,Mark 4,3,Mark.4.11,Mark 4:11,10,"And he said to them, ""To you has been given the secret of the kingdom of God, but for those outside everything is in parables,"
en,ESV,Mark,Mark,40,Mark.4,Mark 4,3,Mark.4.12,Mark 4:12,11,"so that ""they may indeed see but not perceive, and may indeed hear but not understand, lest they should turn and be forgiven."""
en,ESV,Mark,Mark,40,Mark.4,Mark 4,3,Mark.4.13,Mark 4:13,12,"And he said to them, ""Do you not understand this parable? How then will you understand all the parables?"
en,ESV,Mark,Mark,40,Mark.4,Mark 4,3,Mark.4.14,Mark 4:14,13,The sower sows the word.
en,ESV,Mark,Mark,40,Mark.4,Mark 4,3,Mark.4.15,Mark 4:15,14,"And these are the ones along the path, where the word is sown: when they hear, Satan immediately comes and takes away the word that is sown in them."
en,ESV,Mark,Mark,40,Mark.4,Mark 4,3,Mark.4.16,Mark 4:16,15,"And these are the ones sown on rocky ground: the ones who, when they hear the word, immediately receive it with joy."
en,ESV,Mark,Mark,40,Mark.4,Mark 4,3,Mark.4.17,Mark 4:17,16,"And they have no root in themselves, but endure for a while. Then, when tribulation or persecution arises on account of the word, immediately they fall away."
en,ESV,Mark,Mark,40,Mark.4,Mark 4,3,Mark.4.18,Mark 4:18,17,"And others are the ones sown among thorns. They are those who hear the word,"
en,ESV,Mark,Mark,40,Mark.4,Mark 4,3,Mark.4.19,Mark 4:19,18,"but the cares of the world and the deceitfulness of riches and the desires for other things enter in and choke the word, and it proves unfruitful."
en,ESV,Mark,Mark,40,Mark.4,Mark 4,3,Mark.4.20,Mark 4:20,19,"But those that were sown on the good soil are the ones who hear the word and accept it and bear fruit, thirtyfold and sixtyfold and a hundredfold."""
en,ESV,Mark,Mark,40,Mark.4,Mark 4,3,Mark.4.21,Mark 4:21,20,"And he said to them, ""Is a lamp brought in to be put under a basket, or under a bed, and not on a stand?"
en,ESV,Mark,Mark,40,Mark.4,Mark 4,3,Mark.4.22,Mark 4:22,21,For nothing is hidden except to be made manifest; nor is anything secret except to come to light.
en,ESV,Mark,Mark,40,Mark.4,Mark 4,3,Mark.4.23,Mark 4:23,22,"If anyone has ears to hear, let him hear."""
en,ESV,Mark,Mark,40,Mark.4,Mark 4,3,Mark.4.24,Mark 4:24,23,"And he said to them, ""Pay attention to what you hear: with the measure you use, it will be measured to you, and still more will be added to you."
en,ESV,Mark,Mark,40,Mark.4,Mark 4,3,Mark.4.25,Mark 4:25,24,"For to the one who has, more will be given, and from the one who has not, even what he has will be taken away."""
en,ESV,Mark,Mark,40,Mark.4,Mark 4,3,Mark.4.26,Mark 4:26,25,"And he said, ""The kingdom of God is as if a man should scatter seed on the ground."
en,ESV,Mark,Mark,40,Mark.4,Mark 4,3,Mark.4.27,Mark 4:27,26,"He sleeps and rises night and day, and the seed sprouts and grows; he knows not how."
en,ESV,Mark,Mark,40,Mark.4,Mark 4,3,Mark.4.28,Mark 4:28,27,"The earth produces by itself, first the blade, then the ear, then the full grain in the ear."
en,ESV,Mark,Mark,40,Mark.4,Mark 4,3,Mark.4.29,Mark 4:29,28,"But when the grain is ripe, at once he puts in the sickle, because the harvest has come."""
en,ESV,Mark,Mark,40,Mark.4,Mark 4,3,Mark.4.30,Mark 4:30,29,"And he said, ""With what can we compare the kingdom of God, or what parable shall we use for it?"
en,ESV,Mark,Mark,40,Mark.4,Mark 4,3,Mark.4.31,Mark 4:31,30,"It is like a grain of mustard seed, which, when sown on the ground, is the smallest of all the seeds on earth,"
en,ESV,Mark,Mark,40,Mark.4,Mark 4,3,Mark.4.32,Mark 4:32,31,"yet when it is sown it grows up and becomes larger than all the garden plants and puts out large branches, so that the birds of the air can make nests in its shade."""
en,ESV,Mark,Mark,40,Mark.4,Mark 4,3,Mark.4.33,Mark 4:33,32,"With many such parables he spoke the word to them, as they were able to hear it."
en,ESV,Mark,Mark,40,Mark.4,Mark 4,3,Mark.4.34,Mark 4:34,33,"He did not speak to them without a parable, but privately to his own disciples he explained everything."
en,ESV,Mark,Mark,40,Mark.4,Mark 4,3,Mark.4.35,Mark 4:35,34,"On that day, when evening had come, he said to them, ""Let us go across to the other side."""
en,ESV,Mark,Mark,40,Mark.4,Mark 4,3,Mark.4.36,Mark 4:36,35,"And leaving the crowd, they took him with them in the boat, just as he was. And other boats were with him."
en,ESV,Mark,Mark,40,Mark.4,Mark 4,3,Mark.4.37,Mark 4:37,36,"And a great windstorm arose, and the waves were breaking into the boat, so that the boat was already filling."
en,ESV,Mark,Mark,40,Mark.4,Mark 4,3,Mark.4.38,Mark 4:38,37,"But he was in the stern, asleep on the cushion. And they woke him and said to him, ""Teacher, do you not care that we are perishing?"""
en,ESV,Mark,Mark,40,Mark.4,Mark 4,3,Mark.4.39,Mark 4:39,38,"And he awoke and rebuked the wind and said to the sea, ""Peace! Be still!"" And the wind ceased, and there was a great calm."
en,ESV,Mark,Mark,40,Mark.4,Mark 4,3,Mark.4.40,Mark 4:40,39,"He said to them, ""Why are you so afraid? Have you still no faith?"""
en,ESV,Mark,Mark,40,Mark.4,Mark 4,3,Mark.4.41,Mark 4:41,40,"And they were filled with great fear and said to one another, ""Who then is this, that even wind and sea obey him?"""
en,ESV,Mark,Mark,40,Mark.5,Mark 5,4,Mark.5.1,Mark 5:1,0,"They came to the other side of the sea, to the country of the Gerasenes."
en,ESV,Mark,Mark,40,Mark.5,Mark 5,4,Mark.5.2,Mark 5:2,1,"And when Jesus had stepped out of the boat, immediately there met him out of the tombs a man with an unclean spirit."
en,ESV,Mark,Mark,40,Mark.5,Mark 5,4,Mark.5.3,Mark 5:3,2,"He lived among the tombs. And no one could bind him anymore, not even with a chain,"
en,ESV,Mark,Mark,40,Mark.5,Mark 5,4,Mark.5.4,Mark 5:4,3,"for he had often been bound with shackles and chains, but he wrenched the chains apart, and he broke the shackles in pieces. No one had the strength to subdue him."
en,ESV,Mark,Mark,40,Mark.5,Mark 5,4,Mark.5.5,Mark 5:5,4,Night and day among the tombs and on the mountains he was always crying out and bruising himself with stones.
