languageCode,code,bookOsisId,bookSblId,bookOrderIndex,chapterOsisId,chapterSblId,chapterOrderIndex,verseOsisId,verseSblId,verseOrderIndex,text
la,NOVA_VULGATA,Gen,Gen,0,Gen.1,Gen 1,0,Gen.1.1,Gen 1:1,0,In principio creavit Deus caelum et terram.
la,NOVA_VULGATA,Gen,Gen,0,Gen.1,Gen 1,0,Gen.1.2,Gen 1:2,1,"Terra autem erat inanis et vacua, et tenebrae super faciem abyssi, et spiritus Dei ferebatur super aquas."
la,NOVA_VULGATA,Gen,Gen,0,Gen.1,Gen 1,0,Gen.1.3,Gen 1:3,2,"Dixitque Deus: "" Fiat lux "". Et facta est lux."
la,NOVA_VULGATA,Gen,Gen,0,Gen.1,Gen 1,0,Gen.1.4,Gen 1:4,3,Et vidit Deus lucem quod esset bona et divisit Deus lucem ac tenebras.
la,NOVA_VULGATA,Gen,Gen,0,Gen.1,Gen 1,0,Gen.1.5,Gen 1:5,4,"Appellavitque Deus lucem Diem et tenebras Noctem. Factumque est vespere et mane, dies unus."
la,NOVA_VULGATA,Gen,Gen,0,Gen.1,Gen 1,0,Gen.1.6,Gen 1:6,5,"Dixit quoque Deus: "" Fiat firmamentum in medio aquarum et dividat aquas ab aquis ""."
la,NOVA_VULGATA,Gen,Gen,0,Gen.1,Gen 1,0,Gen.1.7,Gen 1:7,6,"Et fecit Deus firmamentum divisitque aquas, quae erant sub firmamento, ab his, quae erant super firmamentum. Et factum est ita."
la,NOVA_VULGATA,Gen,Gen,0,Gen.1,Gen 1,0,Gen.1.8,Gen 1:8,7,"Vocavitque Deus firmamentum Caelum. Et factum est vespere et mane, dies secundus."
la,NOVA_VULGATA,Gen,Gen,0,Gen.1,Gen 1,0,Gen.1.9,Gen 1:9,8,"Dixit vero Deus: "" Congregentur aquae, quae sub caelo sunt, in locum unum, et appareat arida "". Factumque est ita."
la,NOVA_VULGATA,Gen,Gen,0,Gen.1,Gen 1,0,Gen.1.10,Gen 1:10,9,Et vocavit Deus aridam Terram congregationesque aquarum appellavit Maria. Et vidit Deus quod esset bonum.
la,NOVA_VULGATA,Gen,Gen,0,Gen.1,Gen 1,0,Gen.1.11,Gen 1:11,10,"Et ait Deus: "" Germinet terra herbam virentem et herbam facientem semen et lignum pomiferum faciens fructum iuxta genus suum, cuius semen in semetipso sit super terram "". Et factum est ita."
la,NOVA_VULGATA,Gen,Gen,0,Gen.1,Gen 1,0,Gen.1.12,Gen 1:12,11,"Et protulit terra herbam virentem et herbam afferentem semen iuxta genus suum lignumque faciens fructum, qui habet in semetipso sementem secundum speciem suam. Et vidit Deus quod esset bonum."
la,NOVA_VULGATA,Gen,Gen,0,Gen.1,Gen 1,0,Gen.1.13,Gen 1:13,12,"Et factum est vespere et mane, dies tertius."
la,NOVA_VULGATA,Gen,Gen,0,Gen.1,Gen 1,0,Gen.1.14,Gen 1:14,13,"Dixit autem Deus: "" Fiant luminaria in firmamento caeli, ut dividant diem ac noctem et sint in signa et tempora et dies et annos,"
la,NOVA_VULGATA,Gen,Gen,0,Gen.1,Gen 1,0,Gen.1.15,Gen 1:15,14,ut luceant in firmamento caeli et illuminent terram. Et factum est ita.
la,NOVA_VULGATA,Gen,Gen,0,Gen.1,Gen 1,0,Gen.1.16,Gen 1:16,15,"Fecitque Deus duo magna luminaria: luminare maius, ut praeesset diei, et luminare minus, ut praeesset nocti, et stellas."
la,NOVA_VULGATA,Gen,Gen,0,Gen.1,Gen 1,0,Gen.1.17,Gen 1:17,16,"Et posuit eas Deus in firmamento caeli, ut lucerent super terram"
la,NOVA_VULGATA,Gen,Gen,0,Gen.1,Gen 1,0,Gen.1.18,Gen 1:18,17,et praeessent diei ac nocti et dividerent lucem ac tenebras. Et vidit Deus quod esset bonum.
la,NOVA_VULGATA,Gen,Gen,0,Gen.1,Gen 1,0,Gen.1.19,Gen 1:19,18,"Et factum est vespere et mane, dies quartus."
la,NOVA_VULGATA,Gen,Gen,0,Gen.1,Gen 1,0,Gen.1.20,Gen 1:20,19,"Dixit etiam Deus: "" Pullulent aquae reptile animae viventis, et volatile volet super terram sub firmamento caeli ""."
la,NOVA_VULGATA,Gen,Gen,0,Gen.1,Gen 1,0,Gen.1.21,Gen 1:21,20,"Creavitque Deus cete grandia et omnem animam viventem atque motabilem, quam pullulant aquae secundum species suas, et omne volatile secundum genus suum. Et vidit Deus quod esset bonum;"
la,NOVA_VULGATA,Gen,Gen,0,Gen.1,Gen 1,0,Gen.1.22,Gen 1:22,21,"benedixitque eis Deus dicens: "" Crescite et multiplicamini et replete aquas maris, avesque multiplicentur super terram ""."
la,NOVA_VULGATA,Gen,Gen,0,Gen.1,Gen 1,0,Gen.1.23,Gen 1:23,22,"Et factum est vespere et mane, dies quintus."
la,NOVA_VULGATA,Gen,Gen,0,Gen.1,Gen 1,0,Gen.1.24,Gen 1:24,23,"Dixit quoque Deus: "" Producat terra animam viventem in genere suo, iumenta et reptilia et bestias terrae secundum species suas "". Factumque est ita."
la,NOVA_VULGATA,Gen,Gen,0,Gen.1,Gen 1,0,Gen.1.25,Gen 1:25,24,Et fecit Deus bestias terrae iuxta species suas et iumenta secundum species suas et omne reptile terrae in genere suo. Et vidit Deus quod esset bonum.
la,NOVA_VULGATA,Gen,Gen,0,Gen.1,Gen 1,0,Gen.1.26,Gen 1:26,25,"Et ait Deus: "" Faciamus hominem ad imaginem et similitudinem nostram; et praesint piscibus maris et volatilibus caeli et bestiis universaeque terrae omnique reptili, quod movetur in terra ""."
la,NOVA_VULGATA,Gen,Gen,0,Gen.1,Gen 1,0,Gen.1.27,Gen 1:27,26,Et creavit Deus hominem ad imaginem suam;ad imaginem Dei creavit illum;masculum et feminam creavit eos.
la,NOVA_VULGATA,Gen,Gen,0,Gen.1,Gen 1,0,Gen.1.28,Gen 1:28,27,"Benedixitque illis Deus et ait illis Deus: "" Crescite et multiplicamini et replete terram et subicite eam et dominamini piscibus maris et volatilibus caeli et universis animantibus, quae moventur super terram ""."
la,NOVA_VULGATA,Gen,Gen,0,Gen.1,Gen 1,0,Gen.1.29,Gen 1:29,28,"Dixitque Deus: "" Ecce dedi vobis omnem herbam afferentem semen super terram et universa ligna, quae habent in semetipsis fructum ligni portantem sementem, ut sint vobis in escam"
la,NOVA_VULGATA,Gen,Gen,0,Gen.1,Gen 1,0,Gen.1.30,Gen 1:30,29,"et cunctis animantibus terrae omnique volucri caeli et universis, quae moventur in terra et in quibus est anima vivens, omnem herbam virentem ad vescendum "". Et factum est ita."
la,NOVA_VULGATA,Gen,Gen,0,Gen.1,Gen 1,0,Gen.1.31,Gen 1:31,30,"Viditque Deus cuncta, quae fecit, et ecce erant valde bona. Et factum est vespere et mane, dies sextus."
la,NOVA_VULGATA,Gen,Gen,0,Gen.2,Gen 2,1,Gen.2.1,Gen 2:1,0,Igitur perfecti sunt caeli et terra et omnis exercitus eorum.
la,NOVA_VULGATA,Gen,Gen,0,Gen.2,Gen 2,1,Gen.2.2,Gen 2:2,1,"Complevitque Deus die septimo opus suum, quod fecerat, et requievit die septimo ab universo opere, quod patrarat."
la,NOVA_VULGATA,Gen,Gen,0,Gen.2,Gen 2,1,Gen.2.3,Gen 2:3,2,"Et benedixit Deus diei septimo et sanctificavit illum, quia in ipso requieverat ab omni opere suo, quod creavit Deus, ut faceret."
la,NOVA_VULGATA,Gen,Gen,0,Gen.2,Gen 2,1,Gen.2.4,Gen 2:4,3,"Istae sunt generationes caeli et terrae, quando creata sunt.In die quo fecit Dominus Deus terram et caelum 足"
la,NOVA_VULGATA,Gen,Gen,0,Gen.2,Gen 2,1,Gen.2.5,Gen 2:5,4,"omne virgultum agri, antequam oriretur in terra, omnisque herba regionis, priusquam germinaret; non enim pluerat Dominus Deus super terram, et homo non erat, qui operaretur humum,"
la,NOVA_VULGATA,Gen,Gen,0,Gen.2,Gen 2,1,Gen.2.6,Gen 2:6,5,sed fons ascendebat e terra irrigans universam superficiem terrae 足
la,NOVA_VULGATA,Gen,Gen,0,Gen.2,Gen 2,1,Gen.2.7,Gen 2:7,6,"tunc formavit Dominus Deus hominem pulverem de humo et inspiravit in nares eius spiraculum vitae, et factus est homo in animam viventem."
la,NOVA_VULGATA,Gen,Gen,0,Gen.2,Gen 2,1,Gen.2.8,Gen 2:8,7,"Et plantavit Dominus Deus paradisum in Eden ad orientem, in quo posuit hominem, quem formaverat."
la,NOVA_VULGATA,Gen,Gen,0,Gen.2,Gen 2,1,Gen.2.9,Gen 2:9,8,"Produxitque Dominus Deus de humo omne lignum pulchrum visu et ad vescendum suave, lignum etiam vitae in medio paradisi lignumque scientiae boni et mali."
la,NOVA_VULGATA,Gen,Gen,0,Gen.2,Gen 2,1,Gen.2.10,Gen 2:10,9,"Et fluvius egrediebatur ex Eden ad irrigandum paradisum, qui inde dividitur in quattuor capita."
la,NOVA_VULGATA,Gen,Gen,0,Gen.2,Gen 2,1,Gen.2.11,Gen 2:11,10,"Nomen uni Phison: ipse est, qui circuit omnem terram Hevila, ubi est aurum;"
la,NOVA_VULGATA,Gen,Gen,0,Gen.2,Gen 2,1,Gen.2.12,Gen 2:12,11,et aurum terrae illius optimum est; ibi invenitur bdellium et lapis onychinus.
la,NOVA_VULGATA,Gen,Gen,0,Gen.2,Gen 2,1,Gen.2.13,Gen 2:13,12,"Et nomen fluvio secundo Geon: ipse est, qui circuit omnem terram Aethiopiae."
la,NOVA_VULGATA,Gen,Gen,0,Gen.2,Gen 2,1,Gen.2.14,Gen 2:14,13,Nomen vero fluminis tertii Tigris: ipse vadit ad orientem Assyriae. Fluvius autem quartus ipse est Euphrates.
la,NOVA_VULGATA,Gen,Gen,0,Gen.2,Gen 2,1,Gen.2.15,Gen 2:15,14,"Tulit ergo Dominus Deus hominem et posuit eum in paradiso Eden, ut operaretur et custodiret illum;"
la,NOVA_VULGATA,Gen,Gen,0,Gen.2,Gen 2,1,Gen.2.16,Gen 2:16,15,"praecepitque Dominus Deus homini dicens: "" Ex omni ligno paradisi comede;"
la,NOVA_VULGATA,Gen,Gen,0,Gen.2,Gen 2,1,Gen.2.17,Gen 2:17,16,"de ligno autem scientiae boni et mali ne comedas; in quocumque enim die comederis ex eo, morte morieris ""."
la,NOVA_VULGATA,Gen,Gen,0,Gen.2,Gen 2,1,Gen.2.18,Gen 2:18,17,"Dixit quoque Dominus Deus: "" Non est bonum esse hominem solum; faciam ei adiutorium simile sui ""."
la,NOVA_VULGATA,Gen,Gen,0,Gen.2,Gen 2,1,Gen.2.19,Gen 2:19,18,"Formatis igitur Dominus Deus de humo cunctis animantibus agri et universis volatilibus caeli, adduxit ea ad Adam, ut videret quid vocaret ea; omne enim, quod vocavit Adam animae viventis, ipsum est nomen eius."
la,NOVA_VULGATA,Gen,Gen,0,Gen.2,Gen 2,1,Gen.2.20,Gen 2:20,19,Appellavitque Adam nominibus suis cuncta pecora et universa volatilia caeli et omnes bestias agri; Adae vero non inveniebatur adiutor similis eius.
la,NOVA_VULGATA,Gen,Gen,0,Gen.2,Gen 2,1,Gen.2.21,Gen 2:21,20,"Immisit ergo Dominus Deus soporem in Adam. Cumque obdormisset, tulit unam de costis eius et replevit carnem pro ea;"
la,NOVA_VULGATA,Gen,Gen,0,Gen.2,Gen 2,1,Gen.2.22,Gen 2:22,21,"et aedificavit Dominus Deus costam, quam tulerat de Adam, in mulierem et adduxit eam ad Adam."
la,NOVA_VULGATA,Gen,Gen,0,Gen.2,Gen 2,1,Gen.2.23,Gen 2:23,22,"Dixitque Adam: Haec nunc os ex ossibus meiset caro de carne mea!Haec vocabitur Virago,quoniam de viro sumpta est haec ""."
la,NOVA_VULGATA,Gen,Gen,0,Gen.2,Gen 2,1,Gen.2.24,Gen 2:24,23,Quam ob rem relinquet vir patrem suum et matrem et adhaerebit uxori suae; et erunt in carnem unam.
la,NOVA_VULGATA,Gen,Gen,0,Gen.2,Gen 2,1,Gen.2.25,Gen 2:25,24,"Erant autem uterque nudi, Adam scilicet et uxor eius, et non erubescebant."
la,NOVA_VULGATA,Gen,Gen,0,Gen.3,Gen 3,2,Gen.3.1,Gen 3:1,0,"Et serpens erat callidior cunctis animantibus agri, quae fecerat Dominus Deus. Qui dixit ad mulierem: "" Verene praecepit vobis Deus, ut non comederetis de omni ligno paradisi? ""."
la,NOVA_VULGATA,Gen,Gen,0,Gen.3,Gen 3,2,Gen.3.2,Gen 3:2,1,"Cui respondit mulier: "" De fructu lignorum, quae sunt in paradiso, vescimur;"
la,NOVA_VULGATA,Gen,Gen,0,Gen.3,Gen 3,2,Gen.3.3,Gen 3:3,2,"de fructu vero ligni, quod est in medio paradisi, praecepit nobis Deus, ne comederemus et ne tangeremus illud, ne moriamur ""."
la,NOVA_VULGATA,Gen,Gen,0,Gen.3,Gen 3,2,Gen.3.4,Gen 3:4,3,"Dixit autem serpens ad mulierem: "" Nequaquam morte moriemini!"
la,NOVA_VULGATA,Gen,Gen,0,Gen.3,Gen 3,2,Gen.3.5,Gen 3:5,4,"Scit enim Deus quod in quocumque die comederitis ex eo, aperientur oculi vestri, et eritis sicut Deus scientes bonum et malum ""."
la,NOVA_VULGATA,Gen,Gen,0,Gen.3,Gen 3,2,Gen.3.6,Gen 3:6,5,"Vidit igitur mulier quod bonum esset lignum ad vescendum et pulchrum oculis et desiderabile esset lignum ad intellegendum; et tulit de fructu illius et comedit deditque etiam viro suo secum, qui comedit."
la,NOVA_VULGATA,Gen,Gen,0,Gen.3,Gen 3,2,Gen.3.7,Gen 3:7,6,"Et aperti sunt oculi amborum. Cumque cognovissent esse se nudos, consuerunt folia ficus et fecerunt sibi perizomata."
la,NOVA_VULGATA,Gen,Gen,0,Gen.3,Gen 3,2,Gen.3.8,Gen 3:8,7,"Et cum audissent vocem Domini Dei deambulantis in paradiso ad auram post meridiem, abscondit se Adam et uxor eius a facie Domini Dei in medio ligni paradisi."
la,NOVA_VULGATA,Gen,Gen,0,Gen.3,Gen 3,2,Gen.3.9,Gen 3:9,8,"Vocavitque Dominus Deus Adam et dixit ei: "" Ubi es? ""."
la,NOVA_VULGATA,Gen,Gen,0,Gen.3,Gen 3,2,Gen.3.10,Gen 3:10,9,"Qui ait: "" Vocem tuam audivi in paradiso et timui eo quod nudus essem et abscondi me ""."
la,NOVA_VULGATA,Gen,Gen,0,Gen.3,Gen 3,2,Gen.3.11,Gen 3:11,10,"Cui dixit: "" Quis enim indicavit tibi quod nudus esses, nisi quod ex ligno, de quo tibi praeceperam, ne comederes, comedisti? ""."
la,NOVA_VULGATA,Gen,Gen,0,Gen.3,Gen 3,2,Gen.3.12,Gen 3:12,11,"Dixitque Adam: "" Mulier, quam dedisti sociam mihi, ipsa dedit mihi de ligno, et comedi ""."
la,NOVA_VULGATA,Gen,Gen,0,Gen.3,Gen 3,2,Gen.3.13,Gen 3:13,12,"Et dixit Dominus Deus ad mulierem: "" Quid hoc fecisti? "". Quae respondit: "" Serpens decepit me, et comedi ""."
la,NOVA_VULGATA,Gen,Gen,0,Gen.3,Gen 3,2,Gen.3.14,Gen 3:14,13,"Et ait Dominus Deus ad serpentem: Quia fecisti hoc, maledictus esinter omnia pecoraet omnes bestias agri!Super pectus tuum gradieriset pulverem comedes cunctisdiebus vitae tuae."
la,NOVA_VULGATA,Gen,Gen,0,Gen.3,Gen 3,2,Gen.3.15,Gen 3:15,14,"Inimicitias ponam inter te et mulieremet semen tuum et semen illius;ipsum conteret caput tuum,et tu conteres calcaneum eius ""."
la,NOVA_VULGATA,Gen,Gen,0,Gen.3,Gen 3,2,Gen.3.16,Gen 3:16,15,"Mulieri dixit: Multiplicabo aerumnas tuaset conceptus tuos:in dolore paries filios,et ad virum tuum erit appetitus tuus,ipse autem dominabitur tui ""."
la,NOVA_VULGATA,Gen,Gen,0,Gen.3,Gen 3,2,Gen.3.17,Gen 3:17,16,"Adae vero dixit: "" Quia audisti vocem uxoris tuae et comedisti de ligno, ex quo praeceperam tibi, ne comederes,maledicta humus propter te!In laboribus comedes ex eacunctis diebus vitae tuae."
la,NOVA_VULGATA,Gen,Gen,0,Gen.3,Gen 3,2,Gen.3.18,Gen 3:18,17,"Spinas et tribulos germinabit tibi,et comedes herbas terrae;"
la,NOVA_VULGATA,Gen,Gen,0,Gen.3,Gen 3,2,Gen.3.19,Gen 3:19,18,"in sudore vultus tui vesceris pane,donec revertaris ad humum,de qua sumptus es,quia pulvis es et in pulverem reverteris ""."
la,NOVA_VULGATA,Gen,Gen,0,Gen.3,Gen 3,2,Gen.3.20,Gen 3:20,19,"Et vocavit Adam nomen uxoris suae Eva, eo quod mater esset cunctorum viventium."
la,NOVA_VULGATA,Gen,Gen,0,Gen.3,Gen 3,2,Gen.3.21,Gen 3:21,20,Fecit quoque Dominus Deus Adae et uxori eius tunicas pelliceas et induit eos.
la,NOVA_VULGATA,Gen,Gen,0,Gen.3,Gen 3,2,Gen.3.22,Gen 3:22,21,"Et ait Dominus Deus: "" Ecce homo factus est quasi unus ex nobis, ut sciat bonum et malum; nunc ergo, ne mittat manum suam et sumat etiam de ligno vitae et comedat et vivat in aeternum! ""."
la,NOVA_VULGATA,Gen,Gen,0,Gen.3,Gen 3,2,Gen.3.23,Gen 3:23,22,"Emisit eum Dominus Deus de paradiso Eden, ut operaretur humum, de qua sumptus est."
la,NOVA_VULGATA,Gen,Gen,0,Gen.3,Gen 3,2,Gen.3.24,Gen 3:24,23,Eiecitque hominem et collocavit ad orientem paradisi Eden cherubim et flammeum gladium atque versatilem ad custodiendam viam ligni vitae.
la,NOVA_VULGATA,Gen,Gen,0,Gen.4,Gen 4,3,Gen.4.1,Gen 4:1,0,"Adam vero cognovit Evam uxo rem suam, quae concepit et peperit Cain dicens: "" Acquisivi virum per Dominum ""."
la,NOVA_VULGATA,Gen,Gen,0,Gen.4,Gen 4,3,Gen.4.2,Gen 4:2,1,Rursusque peperit fratrem eius Abel. Et fuit Abel pastor ovium et Cain agricola.
la,NOVA_VULGATA,Gen,Gen,0,Gen.4,Gen 4,3,Gen.4.3,Gen 4:3,2,Factum est autem post aliquot dies ut offerret Cain de fructibus agri munus Domino.
la,NOVA_VULGATA,Gen,Gen,0,Gen.4,Gen 4,3,Gen.4.4,Gen 4:4,3,"Abel quoque obtulit de primogenitis gregis sui et de adipibus eorum. Et respexit Dominus ad Abel et ad munus eius,"
la,NOVA_VULGATA,Gen,Gen,0,Gen.4,Gen 4,3,Gen.4.5,Gen 4:5,4,"ad Cain vero et ad munus illius non respexit. Iratusque est Cain vehementer, et concidit vultus eius."
la,NOVA_VULGATA,Gen,Gen,0,Gen.4,Gen 4,3,Gen.4.6,Gen 4:6,5,"Dixitque Dominus ad eum: "" Quare iratus es, et cur concidit facies tua?"
la,NOVA_VULGATA,Gen,Gen,0,Gen.4,Gen 4,3,Gen.4.7,Gen 4:7,6,"Nonne si bene egeris, vultum attolles? Sin autem male, in foribus peccatum insidiabitur, et ad te erit appetitus eius, tu autem dominaberis illius ""."
la,NOVA_VULGATA,Gen,Gen,0,Gen.4,Gen 4,3,Gen.4.8,Gen 4:8,7,"Dixitque Cain ad Abel fratrem suum: "" Egrediamur foras "". Cumque essent in agro, consurrexit Cain adversus Abel fratrem suum et interfecit eum."
la,NOVA_VULGATA,Gen,Gen,0,Gen.4,Gen 4,3,Gen.4.9,Gen 4:9,8,"Et ait Dominus ad Cain: "" Ubi est Abel frater tuus? "". Qui respondit: "" Nescio. Num custos fratris mei sum ego? ""."
la,NOVA_VULGATA,Gen,Gen,0,Gen.4,Gen 4,3,Gen.4.10,Gen 4:10,9,"Dixitque ad eum: "" Quid fecisti? Vox sanguinis fratris tui clamat ad me de agro."
la,NOVA_VULGATA,Gen,Gen,0,Gen.4,Gen 4,3,Gen.4.11,Gen 4:11,10,"Nunc igitur maledictus eris procul ab agro, qui aperuit os suum et suscepit sanguinem fratris tui de manu tua!"
la,NOVA_VULGATA,Gen,Gen,0,Gen.4,Gen 4,3,Gen.4.12,Gen 4:12,11,"Cum operatus fueris eum, amplius non dabit tibi fructus suos; vagus et profugus eris super terram ""."
la,NOVA_VULGATA,Gen,Gen,0,Gen.4,Gen 4,3,Gen.4.13,Gen 4:13,12,"Dixitque Cain ad Dominum: "" Maior est poena mea quam ut portem eam."
la,NOVA_VULGATA,Gen,Gen,0,Gen.4,Gen 4,3,Gen.4.14,Gen 4:14,13,"Ecce eicis me hodie a facie agri, et a facie tua abscondar et ero vagus et profugus in terra; omnis igitur, qui invenerit me, occidet me ""."
la,NOVA_VULGATA,Gen,Gen,0,Gen.4,Gen 4,3,Gen.4.15,Gen 4:15,14,"Dixitque ei Dominus: "" Nequaquam ita fiet, sed omnis qui occiderit Cain, septuplum punietur! "". Posuitque Dominus Cain signum, ut non eum interficeret omnis qui invenisset eum."
la,NOVA_VULGATA,Gen,Gen,0,Gen.4,Gen 4,3,Gen.4.16,Gen 4:16,15,Egressusque Cain a facie Domini habitavit in terra Nod ad orientalem plagam Eden.
la,NOVA_VULGATA,Gen,Gen,0,Gen.4,Gen 4,3,Gen.4.17,Gen 4:17,16,"Cognovit autem Cain uxorem suam, quae concepit et peperit Henoch. Et aedificavit civitatem vocavitque nomen eius ex nomine filii sui Henoch."
la,NOVA_VULGATA,Gen,Gen,0,Gen.4,Gen 4,3,Gen.4.18,Gen 4:18,17,"Porro Henoch genuit Irad, et Irad genuit Maviael, et Maviael genuit Mathusael, et Mathusael genuit Lamech."
la,NOVA_VULGATA,Gen,Gen,0,Gen.4,Gen 4,3,Gen.4.19,Gen 4:19,18,Qui accepit uxores duas: nomen uni Ada et nomen alteri Sella.
la,NOVA_VULGATA,Gen,Gen,0,Gen.4,Gen 4,3,Gen.4.20,Gen 4:20,19,"Genuitque Ada Iabel, qui fuit pater habitantium in tentoriis atque pastorum."
la,NOVA_VULGATA,Gen,Gen,0,Gen.4,Gen 4,3,Gen.4.21,Gen 4:21,20,Et nomen fratris eius Iubal; ipse fuit pater omnium canentium cithara et organo.
la,NOVA_VULGATA,Gen,Gen,0,Gen.4,Gen 4,3,Gen.4.22,Gen 4:22,21,"Sella quoque genuit Tubalcain, qui fuit malleator et faber in cuncta opera aeris et ferri. Soror vero Tubalcain Noema."
la,NOVA_VULGATA,Gen,Gen,0,Gen.4,Gen 4,3,Gen.4.23,Gen 4:23,22,"Dixitque Lamech uxoribus suis: Ada et Sella, audite vocem meam; uxores Lamech, auscultate sermonem meum:occidi virum pro vulnere meoet adulescentulum pro livore meo;"
la,NOVA_VULGATA,Gen,Gen,0,Gen.4,Gen 4,3,Gen.4.24,Gen 4:24,23,"septuplum ultio dabitur de Cain, de Lamech vero septuagies septies ""."
la,NOVA_VULGATA,Gen,Gen,0,Gen.4,Gen 4,3,Gen.4.25,Gen 4:25,24,"Cognovit quoque Adam uxorem suam, et peperit filium vocavitque nomen eius Seth dicens: "" Posuit mihi Deus semen aliud pro Abel, quem occidit Cain ""."
la,NOVA_VULGATA,Gen,Gen,0,Gen.4,Gen 4,3,Gen.4.26,Gen 4:26,25,"Sed et Seth natus est filius, quem vocavit Enos. Tunc coeperunt invocare nomen Domini."
la,NOVA_VULGATA,Gen,Gen,0,Gen.5,Gen 5,4,Gen.5.1,Gen 5:1,0,"Hic est liber generationis Adam. In die qua creavit Deus homi nem, ad similitudinem Dei fecit illum."
la,NOVA_VULGATA,Gen,Gen,0,Gen.5,Gen 5,4,Gen.5.2,Gen 5:2,1,"Masculum et feminam creavit eos et benedixit illis; et vocavit nomen eorum Adam in die, quo creati sunt."
la,NOVA_VULGATA,Gen,Gen,0,Gen.5,Gen 5,4,Gen.5.3,Gen 5:3,2,Vixit autem Adam centum triginta annis et genuit ad similitudinem et imaginem suam vocavitque nomen eius Seth.
la,NOVA_VULGATA,Gen,Gen,0,Gen.5,Gen 5,4,Gen.5.4,Gen 5:4,3,"Et facti sunt dies Adam, postquam genuit Seth, octingenti anni, genuitque filios et filias."
la,NOVA_VULGATA,Gen,Gen,0,Gen.5,Gen 5,4,Gen.5.5,Gen 5:5,4,"Et factum est omne tempus, quod vixit Adam, anni nongenti triginta, et mortuus est."
la,NOVA_VULGATA,Gen,Gen,0,Gen.5,Gen 5,4,Gen.5.6,Gen 5:6,5,Vixit quoque Seth centum quinque annos et genuit Enos.
la,NOVA_VULGATA,Gen,Gen,0,Gen.5,Gen 5,4,Gen.5.7,Gen 5:7,6,"Vixitque Seth, postquam genuit Enos, octingentis septem annis genuitque filios et filias."
la,NOVA_VULGATA,Gen,Gen,0,Gen.5,Gen 5,4,Gen.5.8,Gen 5:8,7,"Et facti sunt omnes dies Seth nongentorum duodecim annorum, et mortuus est."
la,NOVA_VULGATA,Gen,Gen,0,Gen.5,Gen 5,4,Gen.5.9,Gen 5:9,8,Vixit vero Enos nonaginta annis et genuit Cainan.
la,NOVA_VULGATA,Gen,Gen,0,Gen.5,Gen 5,4,Gen.5.10,Gen 5:10,9,"Et vixit Enos, postquam genuit Cainan, octingentis quindecim annis et genuit filios et filias."
la,NOVA_VULGATA,Gen,Gen,0,Gen.5,Gen 5,4,Gen.5.11,Gen 5:11,10,"Factique sunt omnes dies Enos nongentorum quinque annorum, et mortuus est."
la,NOVA_VULGATA,Gen,Gen,0,Gen.5,Gen 5,4,Gen.5.12,Gen 5:12,11,Vixit quoque Cainan septuaginta annis et genuit Malaleel.
la,NOVA_VULGATA,Gen,Gen,0,Gen.5,Gen 5,4,Gen.5.13,Gen 5:13,12,"Et vixit Cainan, postquam genuit Malaleel, octingentos quadraginta annos genuitque filios et filias."
la,NOVA_VULGATA,Gen,Gen,0,Gen.5,Gen 5,4,Gen.5.14,Gen 5:14,13,"Et facti sunt omnes dies Cainan nongenti decem anni, et mortuus est."
la,NOVA_VULGATA,Gen,Gen,0,Gen.5,Gen 5,4,Gen.5.15,Gen 5:15,14,Vixit autem Malaleel sexaginta quinque annos et genuit Iared.
la,NOVA_VULGATA,Gen,Gen,0,Gen.5,Gen 5,4,Gen.5.16,Gen 5:16,15,"Et vixit Malaleel, postquam genuit Iared, octingentis triginta annis et genuit filios et filias."
la,NOVA_VULGATA,Gen,Gen,0,Gen.5,Gen 5,4,Gen.5.17,Gen 5:17,16,"Et facti sunt omnes dies Malaleel octingenti nonaginta quinque anni, et mortuus est."
la,NOVA_VULGATA,Gen,Gen,0,Gen.5,Gen 5,4,Gen.5.18,Gen 5:18,17,Vixitque Iared centum sexaginta duobus annis et genuit Henoch.
la,NOVA_VULGATA,Gen,Gen,0,Gen.5,Gen 5,4,Gen.5.19,Gen 5:19,18,"Et vixit Iared, postquam genuit Henoch, octingentos annos et genuit filios et filias."
la,NOVA_VULGATA,Gen,Gen,0,Gen.5,Gen 5,4,Gen.5.20,Gen 5:20,19,"Et facti sunt omnes dies Iared nongenti sexaginta duo anni, et mortuus est."
la,NOVA_VULGATA,Gen,Gen,0,Gen.5,Gen 5,4,Gen.5.21,Gen 5:21,20,Porro Henoch vixit sexaginta quinque annis et genuit Mathusalam.
la,NOVA_VULGATA,Gen,Gen,0,Gen.5,Gen 5,4,Gen.5.22,Gen 5:22,21,"Et ambulavit Henoch cum Deo, postquam genuit Mathusalam, trecentis annis et genuit filios et filias."
la,NOVA_VULGATA,Gen,Gen,0,Gen.5,Gen 5,4,Gen.5.23,Gen 5:23,22,"Et facti sunt omnes dies Henoch trecenti sexaginta quinque anni,"
la,NOVA_VULGATA,Gen,Gen,0,Gen.5,Gen 5,4,Gen.5.24,Gen 5:24,23,"ambulavitque cum Deo et non apparuit, quia tulit eum Deus."
la,NOVA_VULGATA,Gen,Gen,0,Gen.5,Gen 5,4,Gen.5.25,Gen 5:25,24,Vixit quoque Mathusala centum octoginta septem annos et genuit Lamech.
la,NOVA_VULGATA,Gen,Gen,0,Gen.5,Gen 5,4,Gen.5.26,Gen 5:26,25,"Et vixit Mathusala, postquam genuit Lamech, septingentos octoginta duos annos et genuit filios et filias."
la,NOVA_VULGATA,Gen,Gen,0,Gen.5,Gen 5,4,Gen.5.27,Gen 5:27,26,"Et facti sunt omnes dies Mathusalae nongenti sexaginta novem anni, et mortuus est."
la,NOVA_VULGATA,Gen,Gen,0,Gen.5,Gen 5,4,Gen.5.28,Gen 5:28,27,Vixit autem Lamech centum octoginta duobus annis et genuit filium
la,NOVA_VULGATA,Gen,Gen,0,Gen.5,Gen 5,4,Gen.5.29,Gen 5:29,28,"vocavitque nomen eius Noe dicens: "" Iste consolabitur nos ab operibus nostris et labore manuum nostrarum in agro, cui maledixit Dominus ""."
la,NOVA_VULGATA,Gen,Gen,0,Gen.5,Gen 5,4,Gen.5.30,Gen 5:30,29,"Vixitque Lamech, postquam genuit Noe, quingentos nonaginta quinque annos et genuit filios et filias."
la,NOVA_VULGATA,Gen,Gen,0,Gen.5,Gen 5,4,Gen.5.31,Gen 5:31,30,"Et facti sunt omnes dies Lamech septingenti septuaginta septem anni, et mortuus est."
la,NOVA_VULGATA,Gen,Gen,0,Gen.5,Gen 5,4,Gen.5.32,Gen 5:32,31,"Noe vero, cum quingentorum esset annorum, genuit Sem, Cham et Iapheth."
la,NOVA_VULGATA,Gen,Gen,0,Gen.6,Gen 6,5,Gen.6.1,Gen 6:1,0,"Cumque coepissent homines multiplicari super terram et fi lias procreassent,"
la,NOVA_VULGATA,Gen,Gen,0,Gen.6,Gen 6,5,Gen.6.2,Gen 6:2,1,"videntes filii Dei filias hominum quod essent pulchrae, acceperunt sibi uxores ex omnibus, quas elegerant."
la,NOVA_VULGATA,Gen,Gen,0,Gen.6,Gen 6,5,Gen.6.3,Gen 6:3,2,"Dixitque Deus: "" Non permanebit spiritus meus in homine in aeternum, quia caro est; eruntque dies illius centum viginti annorum ""."
la,NOVA_VULGATA,Gen,Gen,0,Gen.6,Gen 6,5,Gen.6.4,Gen 6:4,3,"Gigantes erant super terram in diebus illis et etiam postquam ingressi sunt filii Dei ad filias hominum, illaeque eis genuerunt: isti sunt potentes a saeculo viri famosi."
la,NOVA_VULGATA,Gen,Gen,0,Gen.6,Gen 6,5,Gen.6.5,Gen 6:5,4,"Videns autem Dominus quod multa malitia hominum esset in terra, et cuncta cogitatio cordis eorum non intenta esset nisi ad malum omni tempore,"
la,NOVA_VULGATA,Gen,Gen,0,Gen.6,Gen 6,5,Gen.6.6,Gen 6:6,5,paenituit Dominum quod hominem fecisset in terra. Et tactus dolore cordis intrinsecus:
la,NOVA_VULGATA,Gen,Gen,0,Gen.6,Gen 6,5,Gen.6.7,Gen 6:7,6,""" Delebo, inquit, hominem, quem creavi, a facie terrae, ab homine usque ad pecus, usque ad reptile et usque ad volucres caeli; paenitet enim me fecisse eos ""."
la,NOVA_VULGATA,Gen,Gen,0,Gen.6,Gen 6,5,Gen.6.8,Gen 6:8,7,Noe vero invenit gratiam coram Domino.
la,NOVA_VULGATA,Gen,Gen,0,Gen.6,Gen 6,5,Gen.6.9,Gen 6:9,8,Hae sunt generationes Noe: Noe vir iustus atque perfectus fuit in generatione sua; cum Deo ambulavit.
la,NOVA_VULGATA,Gen,Gen,0,Gen.6,Gen 6,5,Gen.6.10,Gen 6:10,9,"Et genuit tres filios: Sem, Cham et Iapheth."
la,NOVA_VULGATA,Gen,Gen,0,Gen.6,Gen 6,5,Gen.6.11,Gen 6:11,10,Corrupta est autem terra coram Deo et repleta est iniquitate.
la,NOVA_VULGATA,Gen,Gen,0,Gen.6,Gen 6,5,Gen.6.12,Gen 6:12,11,Cumque vidisset Deus terram esse corruptam 足 omnis quippe caro corruperat viam suam super terram 足
la,NOVA_VULGATA,Gen,Gen,0,Gen.6,Gen 6,5,Gen.6.13,Gen 6:13,12,"dixit ad Noe: "" Finis universae carnis venit coram me; repleta est enim terra iniquitate a facie eorum, et ecce ego disperdam eos de terra."
la,NOVA_VULGATA,Gen,Gen,0,Gen.6,Gen 6,5,Gen.6.14,Gen 6:14,13,Fac tibi arcam de lignis cupressinis; mansiunculas in arca facies et bitumine linies eam intrinsecus et extrinsecus.
