languageCode,code,bookOsisId,bookSblId,bookOrderIndex,chapterOsisId,chapterSblId,chapterOrderIndex,verseOsisId,verseSblId,verseOrderIndex,text
la,NOVA_VULGATA,Gen,Gen,0,Gen.12,Gen 12,11,Gen.12.9,Gen 12:9,8,Perrexitque Abram de mansione in mansionem usque ad Nageb.
la,NOVA_VULGATA,Gen,Gen,0,Gen.12,Gen 12,11,Gen.12.10,Gen 12:10,9,"Facta est autem fames in terra; descenditque Abram in Aegyptum, ut peregrinaretur ibi; praevaluerat enim fames in terra."
la,NOVA_VULGATA,Gen,Gen,0,Gen.12,Gen 12,11,Gen.12.11,Gen 12:11,10,"Cumque prope esset, ut ingrederetur Aegyptum, dixit Sarai uxori suae: "" Novi quod pulchra sis mulier"
la,NOVA_VULGATA,Gen,Gen,0,Gen.12,Gen 12,11,Gen.12.12,Gen 12:12,11,"et quod, cum viderint te Aegyptii, dicturi sunt: ""Uxor ipsius est""; et interficient me et te reservabunt."
la,NOVA_VULGATA,Gen,Gen,0,Gen.12,Gen 12,11,Gen.12.13,Gen 12:13,12,"Dic ergo, obsecro te, quod soror mea sis, ut bene sit mihi propter te, et vivat anima mea ob gratiam tui ""."
la,NOVA_VULGATA,Gen,Gen,0,Gen.12,Gen 12,11,Gen.12.14,Gen 12:14,13,"Cum itaque ingressus esset Abram Aegyptum, viderunt Aegyptii mulierem quod esset pulchra nimis,"
la,NOVA_VULGATA,Gen,Gen,0,Gen.12,Gen 12,11,Gen.12.15,Gen 12:15,14,et viderunt eam principes pharaonis et laudaverunt eam apud illum; et sublata est mulier in domum pharaonis.
la,NOVA_VULGATA,Gen,Gen,0,Gen.12,Gen 12,11,Gen.12.16,Gen 12:16,15,Abram vero bene usus est propter illam; fueruntque ei oves et boves et asini et servi et famulae et asinae et cameli.
la,NOVA_VULGATA,Gen,Gen,0,Gen.12,Gen 12,11,Gen.12.17,Gen 12:17,16,Flagellavit autem Dominus pharaonem plagis maximis et domum eius propter Sarai uxorem Abram.
la,NOVA_VULGATA,Gen,Gen,0,Gen.12,Gen 12,11,Gen.12.18,Gen 12:18,17,"Vocavitque pharao Abram et dixit ei: "" Quidnam est hoc quod fecisti mihi? Quare non indicasti mihi quod uxor tua esset?"
la,NOVA_VULGATA,Gen,Gen,0,Gen.12,Gen 12,11,Gen.12.19,Gen 12:19,18,"Quam ob causam dixisti esse sororem tuam, ut tollerem eam mihi in uxorem? Nunc igitur, ecce coniux tua: accipe eam et vade! ""."
la,NOVA_VULGATA,Gen,Gen,0,Gen.12,Gen 12,11,Gen.12.20,Gen 12:20,19,"Praecepitque pharao super Abram viris; et deduxerunt eum et uxorem illius et omnia, quae habebat."
la,NOVA_VULGATA,Gen,Gen,0,Gen.13,Gen 13,12,Gen.13.1,Gen 13:1,0,"Ascendit ergo Abram de Ae gypto ipse et uxor eius et om nia, quae habebat, et Lot cum eo ad Nageb."
la,NOVA_VULGATA,Gen,Gen,0,Gen.13,Gen 13,12,Gen.13.2,Gen 13:2,1,"Abram autem erat dives valde in pecoribus, argento et auro."
la,NOVA_VULGATA,Gen,Gen,0,Gen.13,Gen 13,12,Gen.13.3,Gen 13:3,2,"Et profectus est de mansione in mansionem a Nageb in Bethel usque ad locum, ubi prius fixerat tabernaculum inter Bethel et Hai,"
la,NOVA_VULGATA,Gen,Gen,0,Gen.13,Gen 13,12,Gen.13.4,Gen 13:4,3,"in loco altaris, quod fecerat prius, et invocavit ibi nomen Domini."
la,NOVA_VULGATA,Gen,Gen,0,Gen.13,Gen 13,12,Gen.13.5,Gen 13:5,4,"Sed et Lot, qui ibat cum Abram, fuerunt greges ovium et armenta et tabernacula;"
la,NOVA_VULGATA,Gen,Gen,0,Gen.13,Gen 13,12,Gen.13.6,Gen 13:6,5,"nec poterat eos capere terra, ut habitarent simul: erat quippe substantia eorum multa, et nequibant habitare communiter."
la,NOVA_VULGATA,Gen,Gen,0,Gen.13,Gen 13,12,Gen.13.7,Gen 13:7,6,Unde et facta est rixa inter pastores gregum Abram et pastores gregum Lot. Eo autem tempore Chananaeus et Pherezaeus habitabant in illa terra.
la,NOVA_VULGATA,Gen,Gen,0,Gen.13,Gen 13,12,Gen.13.8,Gen 13:8,7,"Dixit ergo Abram ad Lot: "" Ne, quaeso, sit iurgium inter me et te et inter pastores meos et pastores tuos: fratres enim sumus."
la,NOVA_VULGATA,Gen,Gen,0,Gen.13,Gen 13,12,Gen.13.9,Gen 13:9,8,"Nonne universa terra coram te est? Recede a me, obsecro: si ad sinistram ieris, ego dexteram tenebo; si tu dexteram elegeris, ego ad sinistram pergam ""."
la,NOVA_VULGATA,Gen,Gen,0,Gen.13,Gen 13,12,Gen.13.10,Gen 13:10,9,"Elevatis itaque Lot oculis, vidit omnem circa regionem Iordanis, quae universa irrigabatur, antequam subverteret Dominus Sodomam et Gomorram, sicut paradisus Domini et sicut Aegyptus usque in Segor."
la,NOVA_VULGATA,Gen,Gen,0,Gen.13,Gen 13,12,Gen.13.11,Gen 13:11,10,Elegitque sibi Lot omnem regionem circa Iordanem et recessit ad orientem; divisique sunt alterutrum a fratre suo.
la,NOVA_VULGATA,Gen,Gen,0,Gen.13,Gen 13,12,Gen.13.12,Gen 13:12,11,"Abram habitavit in terra Chanaan; Lot vero moratus est in oppidis, quae erant circa Iordanem, et tabernacula movit usque ad Sodomam."
la,NOVA_VULGATA,Gen,Gen,0,Gen.13,Gen 13,12,Gen.13.13,Gen 13:13,12,Homines autem Sodomitae pessimi erant et peccatores coram Domino nimis.
la,NOVA_VULGATA,Gen,Gen,0,Gen.13,Gen 13,12,Gen.13.14,Gen 13:14,13,"Dixitque Dominus ad Abram, postquam divisus est Lot ab eo: "" Leva oculos tuos et vide a loco, in quo nunc es, ad aquilonem et ad meridiem, ad orientem et ad occidentem:"
la,NOVA_VULGATA,Gen,Gen,0,Gen.13,Gen 13,12,Gen.13.15,Gen 13:15,14,"omnem terram, quam conspicis, tibi dabo et semini tuo usque in sempiternum;"
la,NOVA_VULGATA,Gen,Gen,0,Gen.13,Gen 13,12,Gen.13.16,Gen 13:16,15,"faciamque semen tuum sicut pulverem terrae: si quis potest hominum numerare pulverem terrae, semen quoque tuum numerare poterit."
la,NOVA_VULGATA,Gen,Gen,0,Gen.13,Gen 13,12,Gen.13.17,Gen 13:17,16,"Surge et perambula terram in longitudine et in latitudine sua, quia tibi daturus sum eam ""."
la,NOVA_VULGATA,Gen,Gen,0,Gen.13,Gen 13,12,Gen.13.18,Gen 13:18,17,"Movens igitur tabernaculum suum, Abram venit et habitavit iuxta Quercus Mambre, quae sunt in Hebron, aedificavitque ibi altare Domino."
la,NOVA_VULGATA,Gen,Gen,0,Gen.14,Gen 14,13,Gen.14.1,Gen 14:1,0,"Factum est autem in illo tempore, ut Amraphel rex Sennaar et Arioch rex Ellasar et Chodorlahomor rex Elam et Thadal rex gentium"
la,NOVA_VULGATA,Gen,Gen,0,Gen.14,Gen 14,13,Gen.14.2,Gen 14:2,1,inirent bellum contra Bara regem Sodomae et contra Bersa regem Gomorrae et contra Sennaab regem Adamae et contra Semeber regem Seboim contraque regem Belae; ipsa est Segor.
la,NOVA_VULGATA,Gen,Gen,0,Gen.14,Gen 14,13,Gen.14.3,Gen 14:3,2,"Omnes hi convenerunt in vallem Siddim, quae nunc est mare Salis."
la,NOVA_VULGATA,Gen,Gen,0,Gen.14,Gen 14,13,Gen.14.4,Gen 14:4,3,Duodecim annis servierant Chodorlahomor et tertio decimo anno recesserunt ab eo.
la,NOVA_VULGATA,Gen,Gen,0,Gen.14,Gen 14,13,Gen.14.5,Gen 14:5,4,"Igitur anno quarto decimo venit Chodorlahomor et reges, qui erant cum eo, percusseruntque Raphaim in Astharothcarnaim et Zuzim in Ham et Emim in Savecariathaim"
la,NOVA_VULGATA,Gen,Gen,0,Gen.14,Gen 14,13,Gen.14.6,Gen 14:6,5,"et Chorraeos in montibus Seir usque ad Elpharan, quae est in deserto."
la,NOVA_VULGATA,Gen,Gen,0,Gen.14,Gen 14,13,Gen.14.7,Gen 14:7,6,"Reversique sunt et venerunt ad fontem Mesphat; ipsa est Cades. Et percusserunt omnem regionem Amalecitarum et etiam Amorraeum, qui habitabat in Asasonthamar."
la,NOVA_VULGATA,Gen,Gen,0,Gen.14,Gen 14,13,Gen.14.8,Gen 14:8,7,"Et egressi sunt rex Sodomae et rex Gomorrae rexque Adamae et rex Seboim necnon et rex Belae, quae est Segor; et direxerunt contra eos aciem in valle Siddim,"
la,NOVA_VULGATA,Gen,Gen,0,Gen.14,Gen 14,13,Gen.14.9,Gen 14:9,8,scilicet adversus Chodorlahomor regem Elam et Thadal regem gentium et Amraphel regem Sennaar et Arioch regem Ellasar: quattuor reges adversus quinque.
la,NOVA_VULGATA,Gen,Gen,0,Gen.14,Gen 14,13,Gen.14.10,Gen 14:10,9,"Vallis autem Siddim habebat puteos multos bituminis. Itaque rex Sodomae et Gomorrae terga verterunt cecideruntque illuc; et, qui remanserant, fugerunt ad montem."
la,NOVA_VULGATA,Gen,Gen,0,Gen.14,Gen 14,13,Gen.14.11,Gen 14:11,10,"Tulerunt autem omnem substantiam Sodomae et Gomorrae et universa, quae ad cibum pertinent, et abierunt;"
la,NOVA_VULGATA,Gen,Gen,0,Gen.14,Gen 14,13,Gen.14.12,Gen 14:12,11,"ceperunt et Lot et substantiam eius, filium fratris Abram, qui habitabat in Sodoma."
la,NOVA_VULGATA,Gen,Gen,0,Gen.14,Gen 14,13,Gen.14.13,Gen 14:13,12,"Et ecce unus, qui evaserat, nuntiavit Abram Hebraeo, qui habitabat iuxta Quercus Mambre Amorraei fratris Eschol et fratris Aner; hi enim pepigerant foedus cum Abram."
la,NOVA_VULGATA,Gen,Gen,0,Gen.14,Gen 14,13,Gen.14.14,Gen 14:14,13,"Quod cum audisset Abram, captum videlicet Lot fratrem suum, numeravit expeditos vernaculos suos trecentos decem et octo et persecutus est usque Dan;"
la,NOVA_VULGATA,Gen,Gen,0,Gen.14,Gen 14,13,Gen.14.15,Gen 14:15,14,"et, divisis sociis, irruit super eos nocte percussitque eos et persecutus est eos usque Hoba, quae est ad laevam Damasci;"
la,NOVA_VULGATA,Gen,Gen,0,Gen.14,Gen 14,13,Gen.14.16,Gen 14:16,15,"reduxitque omnem substantiam, necnon et Lot fratrem suum cum substantia illius, mulieres quoque et populum."
la,NOVA_VULGATA,Gen,Gen,0,Gen.14,Gen 14,13,Gen.14.17,Gen 14:17,16,"Egressus est autem rex Sodomae in occursum eius, postquam reversus est a caede Chodorlahomor et regum, qui cum eo erant, in vallem Save, quae est vallis Regis."
la,NOVA_VULGATA,Gen,Gen,0,Gen.14,Gen 14,13,Gen.14.18,Gen 14:18,17,At vero Melchisedech rex Salem proferens panem et vinum 足 erat enim sacerdos Dei altissimi 足
la,NOVA_VULGATA,Gen,Gen,0,Gen.14,Gen 14,13,Gen.14.19,Gen 14:19,18,"benedixit ei et ait: Benedictus Abram a Deo excelso, qui creavit caelum et terram"
la,NOVA_VULGATA,Gen,Gen,0,Gen.14,Gen 14,13,Gen.14.20,Gen 14:20,19,"et benedictus Deus excelsus,qui tradidit hostes tuos in manus tuas "".Et dedit ei decimas ex omnibus."
la,NOVA_VULGATA,Gen,Gen,0,Gen.14,Gen 14,13,Gen.14.21,Gen 14:21,20,"Dixit autem rex Sodomae ad Abram: "" Da mihi animas; substantiam tolle tibi ""."
la,NOVA_VULGATA,Gen,Gen,0,Gen.14,Gen 14,13,Gen.14.22,Gen 14:22,21,"Qui respondit ei: "" Levo manum meam ad Dominum, Deum excelsum, creatorem caeli et terrae,"
la,NOVA_VULGATA,Gen,Gen,0,Gen.14,Gen 14,13,Gen.14.23,Gen 14:23,22,"a filo subteminis usque ad corrigiam caligae non accipiam ex omnibus, quae tua sunt, ne dicas: ""Ego ditavi Abram"";"
la,NOVA_VULGATA,Gen,Gen,0,Gen.14,Gen 14,13,Gen.14.24,Gen 14:24,23,"exceptis his, quae comederunt iuvenes, et partibus virorum, qui venerunt mecum, Aner, Eschol et Mambre: isti accipient partes suas ""."
la,NOVA_VULGATA,Gen,Gen,0,Gen.15,Gen 15,14,Gen.15.1,Gen 15:1,0,"His itaque transactis, factus est sermo Domini ad Abram per visionem dicens: ""Noli timere, Abram! Ego protector tuus sum, et merces tua magna erit nimis ""."
la,NOVA_VULGATA,Gen,Gen,0,Gen.15,Gen 15,14,Gen.15.2,Gen 15:2,1,"Dixitque Abram: "" Domine Deus, quid dabis mihi? Ego vadam absque liberis, et heres domus meae erit Damascenus Eliezer ""."
la,NOVA_VULGATA,Gen,Gen,0,Gen.15,Gen 15,14,Gen.15.3,Gen 15:3,2,"Addiditque Abram: "" En mihi non dedisti semen, et ecce vernaculus meus heres meus erit ""."
la,NOVA_VULGATA,Gen,Gen,0,Gen.15,Gen 15,14,Gen.15.4,Gen 15:4,3,"Sed ecce sermo Domini factus est ad eum: ""Non erit hic heres tuus, sed qui egredietur de visceribus tuis, ipsum habebis heredem ""."
la,NOVA_VULGATA,Gen,Gen,0,Gen.15,Gen 15,14,Gen.15.5,Gen 15:5,4,"Eduxitque eum foras et ait illi: "" Suspice caelum et numera stellas, si potes "". Et dixit ei: "" Sic erit semen tuum ""."
la,NOVA_VULGATA,Gen,Gen,0,Gen.15,Gen 15,14,Gen.15.6,Gen 15:6,5,"Credidit Domino, et reputatum est ei ad iustitiam."
la,NOVA_VULGATA,Gen,Gen,0,Gen.15,Gen 15,14,Gen.15.7,Gen 15:7,6,"Dixitque ad eum: "" Ego Dominus, qui eduxi te de Ur Chaldaeorum, ut darem tibi terram istam, et possideres eam ""."
la,NOVA_VULGATA,Gen,Gen,0,Gen.15,Gen 15,14,Gen.15.8,Gen 15:8,7,"Et ille ait: "" Domine Deus, unde scire possum quod possessurus sim eam?."
la,NOVA_VULGATA,Gen,Gen,0,Gen.15,Gen 15,14,Gen.15.9,Gen 15:9,8,"Respondens Dominus: "" Sume, inquit, mihi vitulam triennem et capram trimam et arietem annorum trium, turturem quoque et columbam ""."
la,NOVA_VULGATA,Gen,Gen,0,Gen.15,Gen 15,14,Gen.15.10,Gen 15:10,9,Qui tollens universa haec divisit ea per medium et utrasque partes contra se altrinsecus posuit; aves autem non divisit.
la,NOVA_VULGATA,Gen,Gen,0,Gen.15,Gen 15,14,Gen.15.11,Gen 15:11,10,"Descenderuntque volucres super cadavera, et abigebat eas Abram."
la,NOVA_VULGATA,Gen,Gen,0,Gen.15,Gen 15,14,Gen.15.12,Gen 15:12,11,"Cumque sol occumberet, sopor irruit super Abram, et ecce horror magnus et tenebrosus invasit eum."
la,NOVA_VULGATA,Gen,Gen,0,Gen.15,Gen 15,14,Gen.15.13,Gen 15:13,12,"Dictumque est ad eum: "" Scito praenoscens quod peregrinum futurum sit semen tuum in terra non sua, et subicient eos servituti et affligent quadringentis annis."
la,NOVA_VULGATA,Gen,Gen,0,Gen.15,Gen 15,14,Gen.15.14,Gen 15:14,13,"Verumtamen et gentem, cui servituri sunt, ego iudicabo, et post haec egredientur cum magna substantia."
la,NOVA_VULGATA,Gen,Gen,0,Gen.15,Gen 15,14,Gen.15.15,Gen 15:15,14,"Tu autem ibis ad patres tuos in pace, sepultus in senectute bona."
la,NOVA_VULGATA,Gen,Gen,0,Gen.15,Gen 15,14,Gen.15.16,Gen 15:16,15,"Generatione autem quarta revertentur huc; necdum enim completae sunt iniquitates Amorraeorum usque ad praesens tempus ""."
la,NOVA_VULGATA,Gen,Gen,0,Gen.15,Gen 15,14,Gen.15.17,Gen 15:17,16,"Cum ergo occubuisset sol, facta est caligo tenebrosa, et apparuit clibanus fumans et lampas ignis transiens inter divisiones illas."
la,NOVA_VULGATA,Gen,Gen,0,Gen.15,Gen 15,14,Gen.15.18,Gen 15:18,17,"In illo die pepigit Dominus cum Abram foedus dicens: "" Semini tuo dabo terram hanc a fluvio Aegypti usque ad magnum fluvium Euphraten,"
la,NOVA_VULGATA,Gen,Gen,0,Gen.15,Gen 15,14,Gen.15.19,Gen 15:19,18,"Cinaeos et Cenezaeos, Cedmonaeos"
la,NOVA_VULGATA,Gen,Gen,0,Gen.15,Gen 15,14,Gen.15.20,Gen 15:20,19,"et Hetthaeos et Pherezaeos, Raphaim quoque"
la,NOVA_VULGATA,Gen,Gen,0,Gen.15,Gen 15,14,Gen.15.21,Gen 15:21,20,"et Amorraeos et Chananaeos et Gergesaeos et Iebusaeos ""."
la,NOVA_VULGATA,Gen,Gen,0,Gen.16,Gen 16,15,Gen.16.1,Gen 16:1,0,"Sarai autem uxor Abram non genuerat ei liberos; sed habens ancillam Aegyptiam nomine Agar,"
la,NOVA_VULGATA,Gen,Gen,0,Gen.16,Gen 16,15,Gen.16.2,Gen 16:2,1,"dixit marito suo: "" Ecce conclusit me Dominus, ne parerem; ingredere ad ancillam meam, si forte saltem ex illa suscipiam filios "". Cumque ille acquiesceret deprecanti,"
la,NOVA_VULGATA,Gen,Gen,0,Gen.16,Gen 16,15,Gen.16.3,Gen 16:3,2,"tulit Agar Aegyptiam ancillam suam post annos decem quam habitare coeperant in terra Chanaan, et dedit eam viro suo uxorem."
la,NOVA_VULGATA,Gen,Gen,0,Gen.16,Gen 16,15,Gen.16.4,Gen 16:4,3,Qui ingressus est ad eam. At illa concepisse se videns despexit dominam suam.
la,NOVA_VULGATA,Gen,Gen,0,Gen.16,Gen 16,15,Gen.16.5,Gen 16:5,4,"Dixitque Sarai ad Abram: "" Inique agis contra me; ego dedi ancillam meam in sinum tuum, quae videns quod conceperit, despectui me habet. Iudicet Dominus inter me et te ""."
la,NOVA_VULGATA,Gen,Gen,0,Gen.16,Gen 16,15,Gen.16.6,Gen 16:6,5,"Cui respondens Abram: "" Ecce, ait, ancilla tua in manu tua est; utere ea, ut libet "". Affligente igitur eam Sarai, aufugit ab ea."
la,NOVA_VULGATA,Gen,Gen,0,Gen.16,Gen 16,15,Gen.16.7,Gen 16:7,6,"Cumque invenisset illam angelus Domini iuxta fontem aquae in deserto, ad fontem in via Sur,"
la,NOVA_VULGATA,Gen,Gen,0,Gen.16,Gen 16,15,Gen.16.8,Gen 16:8,7,"dixit: "" Agar, ancilla Sarai, unde venis et quo vadis? "". Quae respondit: "" A facie Sarai dominae meae ego fugio ""."
la,NOVA_VULGATA,Gen,Gen,0,Gen.16,Gen 16,15,Gen.16.9,Gen 16:9,8,"Dixitque ei angelus Domini: "" Revertere ad dominam tuam et humiliare sub manibus ipsius ""."
la,NOVA_VULGATA,Gen,Gen,0,Gen.16,Gen 16,15,Gen.16.10,Gen 16:10,9,"Et dixit ei angelus Domini: "" Multiplicans multiplicabo semen tuum, et non numerabitur prae multitudine ""."
la,NOVA_VULGATA,Gen,Gen,0,Gen.16,Gen 16,15,Gen.16.11,Gen 16:11,10,"Et dixit ei angelus Domini: Ecce, concepisti et paries filiumvocabisque nomen eius Ismael,eo quod audierit Dominus afflictionem tuam."
la,NOVA_VULGATA,Gen,Gen,0,Gen.16,Gen 16,15,Gen.16.12,Gen 16:12,11,"Hic erit homo onagro similis;manus eius contra omnes,et manus omnium contra eum;et e regione universorum fratrum suorum figet tabernacula ""."
la,NOVA_VULGATA,Gen,Gen,0,Gen.16,Gen 16,15,Gen.16.13,Gen 16:13,12,"Vocavit autem nomen Domini, qui loquebatur ad eam: "" Tu Deus, qui vidisti me "". Dixit enim: "" Profecto hic vidi posteriora videntis me ""."
la,NOVA_VULGATA,Gen,Gen,0,Gen.16,Gen 16,15,Gen.16.14,Gen 16:14,13,Propterea appellatur puteus ille Lahairoi (id est Viventis et Videntis me); ipse est inter Cades et Barad.
la,NOVA_VULGATA,Gen,Gen,0,Gen.16,Gen 16,15,Gen.16.15,Gen 16:15,14,"Peperitque Agar Abrae filium; qui vocavit nomen filii sui, quem pepererat Agar, Ismael."
la,NOVA_VULGATA,Gen,Gen,0,Gen.16,Gen 16,15,Gen.16.16,Gen 16:16,15,"Octoginta et sex annorum erat Abram, quando peperit ei Agar Ismaelem."
la,NOVA_VULGATA,Gen,Gen,0,Gen.17,Gen 17,16,Gen.17.1,Gen 17:1,0,"Postquam Abram nonaginta et novem annorum factus est, apparuit ei Dominus dixitque ad eum: "" Ego Deus omnipotens, ambula coram me et esto perfectus."
la,NOVA_VULGATA,Gen,Gen,0,Gen.17,Gen 17,16,Gen.17.2,Gen 17:2,1,Ponamque foedus meum inter me et te et multiplicabo te vehementer nimis.
la,NOVA_VULGATA,Gen,Gen,0,Gen.17,Gen 17,16,Gen.17.3,Gen 17:3,2,Cecidit Abram pronus in faciem.
la,NOVA_VULGATA,Gen,Gen,0,Gen.17,Gen 17,16,Gen.17.4,Gen 17:4,3,"Dixitque ei Deus: "" Ecce pactum meum tecum. Erisque pater multarum gentium,"
la,NOVA_VULGATA,Gen,Gen,0,Gen.17,Gen 17,16,Gen.17.5,Gen 17:5,4,"nec ultra vocabitur nomen tuum Abram, sed Abraham erit nomen tuum, quia patrem multarum gentium constitui te."
la,NOVA_VULGATA,Gen,Gen,0,Gen.17,Gen 17,16,Gen.17.6,Gen 17:6,5,Faciamque te crescere vehementissime et ponam te in gentes; regesque ex te egredientur.
la,NOVA_VULGATA,Gen,Gen,0,Gen.17,Gen 17,16,Gen.17.7,Gen 17:7,6,"Et statuam pactum meum inter me et te et inter semen tuum post te in generationibus suis foedere sempiterno, ut sim Deus tuus et seminis tui post te."
la,NOVA_VULGATA,Gen,Gen,0,Gen.17,Gen 17,16,Gen.17.8,Gen 17:8,7,"Daboque tibi et semini tuo post te terram peregrinationis tuae, omnem terram Chanaan in possessionem aeternam; eroque Deus eorum ""."
la,NOVA_VULGATA,Gen,Gen,0,Gen.17,Gen 17,16,Gen.17.9,Gen 17:9,8,"Dixit iterum Deus ad Abraham: "" Tu autem pactum meum custodies, et semen tuum post te in generationibus suis."
la,NOVA_VULGATA,Gen,Gen,0,Gen.17,Gen 17,16,Gen.17.10,Gen 17:10,9,"Hoc est pactum meum, quod observabitis, inter me et vos et semen tuum post te. Circumcidetur ex vobis omne masculinum,"
la,NOVA_VULGATA,Gen,Gen,0,Gen.17,Gen 17,16,Gen.17.11,Gen 17:11,10,"et circumcidetis carnem praeputii vestri, ut sit in signum foederis inter me et vos."
la,NOVA_VULGATA,Gen,Gen,0,Gen.17,Gen 17,16,Gen.17.12,Gen 17:12,11,"Infans octo dierum circumcidetur in vobis: omne masculinum in generationibus vestris, tam vernaculus quam empticius ex omnibus alienigenis, quicumque non fuerit de stirpe vestra."
la,NOVA_VULGATA,Gen,Gen,0,Gen.17,Gen 17,16,Gen.17.13,Gen 17:13,12,"Circumcidetur vernaculus et empticius, eritque pactum meum in carne vestra in foedus aeternum."
la,NOVA_VULGATA,Gen,Gen,0,Gen.17,Gen 17,16,Gen.17.14,Gen 17:14,13,"Masculus, cuius praeputii caro circumcisa non fuerit, delebitur anima illa de populo suo; pactum meum irritum fecit."
la,NOVA_VULGATA,Gen,Gen,0,Gen.17,Gen 17,16,Gen.17.15,Gen 17:15,14,"Dixit quoque Deus ad Abraham: "" Sarai uxorem tuam non vocabis nomen eius Sarai, sed Sara erit nomen eius."
la,NOVA_VULGATA,Gen,Gen,0,Gen.17,Gen 17,16,Gen.17.16,Gen 17:16,15,"Et benedicam ei; et ex illa quoque dabo tibi filium. Benedicturus sum eam, eritque in nationes; reges populorum orientur ex ea ""."
la,NOVA_VULGATA,Gen,Gen,0,Gen.17,Gen 17,16,Gen.17.17,Gen 17:17,16,"Cecidit Abraham in faciem suam et risit dicens in corde suo: "" Putasne centenario nascetur filius? Et Sara nonagenaria pariet? ""."
la,NOVA_VULGATA,Gen,Gen,0,Gen.17,Gen 17,16,Gen.17.18,Gen 17:18,17,"Dixitque ad Deum: "" Utinam Ismael vivat coram te ""."
la,NOVA_VULGATA,Gen,Gen,0,Gen.17,Gen 17,16,Gen.17.19,Gen 17:19,18,"Et ait Deus: "" Sara uxor tua pariet tibi filium, vocabisque nomen eius Isaac; et constituam pactum meum illi in foedus sempiternum et semini eius post eum."
la,NOVA_VULGATA,Gen,Gen,0,Gen.17,Gen 17,16,Gen.17.20,Gen 17:20,19,"Super Ismael quoque exaudivi te: ecce benedicam ei et crescere faciam et multiplicabo eum vehementissime; duodecim duces generabit, et faciam illum in gentem magnam."
la,NOVA_VULGATA,Gen,Gen,0,Gen.17,Gen 17,16,Gen.17.21,Gen 17:21,20,"Pactum vero meum statuam ad Isaac, quem pariet tibi Sara tempore isto in anno altero ""."
la,NOVA_VULGATA,Gen,Gen,0,Gen.17,Gen 17,16,Gen.17.22,Gen 17:22,21,"Cumque cessasset loqui cum eo, ascendit Deus ab Abraham."
la,NOVA_VULGATA,Gen,Gen,0,Gen.17,Gen 17,16,Gen.17.23,Gen 17:23,22,"Tulit ergo Abraham Ismael filium suum et omnes vernaculos domus suae universosque, quos emerat: cunctos mares ex omnibus viris domus suae; et circumcidit carnem praeputii eorum statim in ipsa die, sicut praeceperat ei Deus."
la,NOVA_VULGATA,Gen,Gen,0,Gen.17,Gen 17,16,Gen.17.24,Gen 17:24,23,"Abraham nonaginta novem erat annorum, quando circumcisus est in carne praeputii sui;"
la,NOVA_VULGATA,Gen,Gen,0,Gen.17,Gen 17,16,Gen.17.25,Gen 17:25,24,et Ismael filius eius tredecim annos impleverat tempore circumcisionis suae.
la,NOVA_VULGATA,Gen,Gen,0,Gen.17,Gen 17,16,Gen.17.26,Gen 17:26,25,Eadem die circumcisus est Abraham et Ismael filius eius;
la,NOVA_VULGATA,Gen,Gen,0,Gen.17,Gen 17,16,Gen.17.27,Gen 17:27,26,"et omnes viri domus illius, tam vernaculi quam empticii ex alienigenis, circumcisi sunt cum eo."
la,NOVA_VULGATA,Gen,Gen,0,Gen.18,Gen 18,17,Gen.18.1,Gen 18:1,0,Apparuit autem ei Dominus iuxta Quercus Mambre se denti in ostio tabernaculi sui in ipso fervore diei.
la,NOVA_VULGATA,Gen,Gen,0,Gen.18,Gen 18,17,Gen.18.2,Gen 18:2,1,"Cumque elevasset oculos, apparuerunt ei tres viri stantes prope eum. Quos cum vidisset, cucurrit in occursum eorum de ostio tabernaculi et adoravit in terram"
la,NOVA_VULGATA,Gen,Gen,0,Gen.18,Gen 18,17,Gen.18.3,Gen 18:3,2,"et dixit: "" Domine mi, si inveni gratiam in oculis tuis, ne transeas servum tuum;"
la,NOVA_VULGATA,Gen,Gen,0,Gen.18,Gen 18,17,Gen.18.4,Gen 18:4,3,"afferatur pauxillum aquae, et lavate pedes vestros et requiescite sub arbore."
la,NOVA_VULGATA,Gen,Gen,0,Gen.18,Gen 18,17,Gen.18.5,Gen 18:5,4,"Ponamque buccellam panis, et confortate cor vestrum, postea transibitis; idcirco enim declinastis ad servum vestrum "". Qui dixerunt: "" Fac ut locutus es ""."
la,NOVA_VULGATA,Gen,Gen,0,Gen.18,Gen 18,17,Gen.18.6,Gen 18:6,5,"Festinavit Abraham in tabernaculum ad Saram dixitque: "" Accelera, tria sata similae commisce et fac subcinericios panes ""."
la,NOVA_VULGATA,Gen,Gen,0,Gen.18,Gen 18,17,Gen.18.7,Gen 18:7,6,Ipse vero ad armentum cucurrit et tulit inde vitulum tenerrimum et optimum deditque puero; qui festinavit et coxit illum.
la,NOVA_VULGATA,Gen,Gen,0,Gen.18,Gen 18,17,Gen.18.8,Gen 18:8,7,"Tulit quoque butyrum et lac et vitulum, quem coxerat, et posuit coram eis. Ipse vero stabat iuxta eos sub arbore; et comederunt."
la,NOVA_VULGATA,Gen,Gen,0,Gen.18,Gen 18,17,Gen.18.9,Gen 18:9,8,"Dixeruntque ad eum: "" Ubi est Sara uxor tua? "". Ille respondit: "" Ecce in tabernaculo est ""."
la,NOVA_VULGATA,Gen,Gen,0,Gen.18,Gen 18,17,Gen.18.10,Gen 18:10,9,"Cui dixit: "" Revertens veniam ad te tempore isto, et habebit filium Sara uxor tua "". Quo audito, Sara risit ad ostium tabernaculi, quod erat post eum."
la,NOVA_VULGATA,Gen,Gen,0,Gen.18,Gen 18,17,Gen.18.11,Gen 18:11,10,"Erant autem ambo senes provectaeque aetatis, et desierant Sarae fieri muliebria."
la,NOVA_VULGATA,Gen,Gen,0,Gen.18,Gen 18,17,Gen.18.12,Gen 18:12,11,"Quae risit occulte dicens: "" Postquam consenui, et dominus meus vetulus est, voluptas mihi erit? ""."
la,NOVA_VULGATA,Gen,Gen,0,Gen.18,Gen 18,17,Gen.18.13,Gen 18:13,12,"Dixit autem Dominus ad Abraham: "" Quare risit Sara dicens: ""Num vere paritura sum anus?""""."
la,NOVA_VULGATA,Gen,Gen,0,Gen.18,Gen 18,17,Gen.18.14,Gen 18:14,13,"Numquid Domino est quidquam difficile? Revertar ad te hoc eodem tempore, et habebit Sara filium ""."
la,NOVA_VULGATA,Gen,Gen,0,Gen.18,Gen 18,17,Gen.18.15,Gen 18:15,14,"Negavit Sara dicens: "" Non risi "", timore perterrita. Ille autem dixit: Non; sed risisti ""."
la,NOVA_VULGATA,Gen,Gen,0,Gen.18,Gen 18,17,Gen.18.16,Gen 18:16,15,"Cum ergo surrexissent inde viri, direxerunt oculos contra Sodomam; et Abraham simul gradiebatur deducens eos."
la,NOVA_VULGATA,Gen,Gen,0,Gen.18,Gen 18,17,Gen.18.17,Gen 18:17,16,"Dixitque Dominus: "" Num celare potero Abraham, quae gesturus sum,"
la,NOVA_VULGATA,Gen,Gen,0,Gen.18,Gen 18,17,Gen.18.18,Gen 18:18,17,"cum futurus sit in gentem magnam ac robustissimam, et benedicendae sint in illo omnes nationes terrae?"
la,NOVA_VULGATA,Gen,Gen,0,Gen.18,Gen 18,17,Gen.18.19,Gen 18:19,18,"Nam elegi eum, ut praecipiat filiis suis et domui suae post se, ut custodiant viam Domini et faciant iustitiam et iudicium, ut adducat Dominus super Abraham omnia, quae locutus est ad eum ""."
la,NOVA_VULGATA,Gen,Gen,0,Gen.18,Gen 18,17,Gen.18.20,Gen 18:20,19,"Dixit itaque Dominus: "" Clamor contra Sodomam et Gomorram multiplicatus est, et peccatum eorum aggravatum est nimis."
la,NOVA_VULGATA,Gen,Gen,0,Gen.18,Gen 18,17,Gen.18.21,Gen 18:21,20,"Descendam et videbo utrum clamorem, qui venit ad me, opere compleverint an non; sciam ""."
la,NOVA_VULGATA,Gen,Gen,0,Gen.18,Gen 18,17,Gen.18.22,Gen 18:22,21,Converteruntque se inde viri et abierunt Sodomam; Abraham vero adhuc stabat coram Domino.
la,NOVA_VULGATA,Gen,Gen,0,Gen.18,Gen 18,17,Gen.18.23,Gen 18:23,22,"Et appropinquans ait: "" Numquid vere perdes iustum cum impio?"
la,NOVA_VULGATA,Gen,Gen,0,Gen.18,Gen 18,17,Gen.18.24,Gen 18:24,23,"Si forte fuerint quinquaginta iusti in civitate, vere perdes et non parces loco illi propter quinquaginta iustos, si fuerint in eo?"
la,NOVA_VULGATA,Gen,Gen,0,Gen.18,Gen 18,17,Gen.18.25,Gen 18:25,24,"Absit a te, ut rem hanc facias et occidas iustum cum impio, fiatque iustus sicut impius; absit a te. Nonne iudex universae terrae faciet iudicium? ""."
la,NOVA_VULGATA,Gen,Gen,0,Gen.18,Gen 18,17,Gen.18.26,Gen 18:26,25,"Dixitque Dominus: "" Si invenero Sodomae quinquaginta iustos in medio civitatis, dimittam omni loco propter eos ""."
