languageCode,code,bookOsisId,bookSblId,bookOrderIndex,chapterOsisId,chapterSblId,chapterOrderIndex,verseOsisId,verseSblId,verseOrderIndex,text
la,NOVA_VULGATA,Gen,Gen,0,Gen.27,Gen 27,26,Gen.27.11,Gen 27:11,10,"Cui ille respondit: "" Nosti quod Esau frater meus homo pilosus sit, et ego lenis."
la,NOVA_VULGATA,Gen,Gen,0,Gen.27,Gen 27,26,Gen.27.12,Gen 27:12,11,"Si attrectaverit me pater meus et senserit, timeo, ne putet me sibi voluisse illudere; et inducam super me maledictionem pro benedictione""."
la,NOVA_VULGATA,Gen,Gen,0,Gen.27,Gen 27,26,Gen.27.13,Gen 27:13,12,"Ad quem mater: "" In me sit, ait, ista maledictio, fili mi; tantum audi vocem meam et perge afferque, quae dixi ""."
la,NOVA_VULGATA,Gen,Gen,0,Gen.27,Gen 27,26,Gen.27.14,Gen 27:14,13,"Abiit et attulit deditque matri. Paravit illa cibos, sicut noverat velle patrem illius."
la,NOVA_VULGATA,Gen,Gen,0,Gen.27,Gen 27,26,Gen.27.15,Gen 27:15,14,"Et vestibus Esau valde bonis, quas apud se habebat domi, induit eum"
la,NOVA_VULGATA,Gen,Gen,0,Gen.27,Gen 27,26,Gen.27.16,Gen 27:16,15,pelliculasque haedorum circumdedit manibus et colli nuda protexit;
la,NOVA_VULGATA,Gen,Gen,0,Gen.27,Gen 27,26,Gen.27.17,Gen 27:17,16,"dedit pulmentum optimum et panes, quos coxerat, in manus filii sui Iacob."
la,NOVA_VULGATA,Gen,Gen,0,Gen.27,Gen 27,26,Gen.27.18,Gen 27:18,17,"Qui ingressus ad patrem suum dixit: "" Pater mi "". At ille respondit: "" Audio. Quis es tu, fili mi? ""."
la,NOVA_VULGATA,Gen,Gen,0,Gen.27,Gen 27,26,Gen.27.19,Gen 27:19,18,"Dixitque Iacob ad patrem suum: "" Ego sum Esau primogenitus tuus. Feci sicut praecepisti mihi; surge, sede et comede de venatione mea, ut benedicat mihi anima tua ""."
la,NOVA_VULGATA,Gen,Gen,0,Gen.27,Gen 27,26,Gen.27.20,Gen 27:20,19,"Rursum Isaac ad filium suum: "" Quomodo, inquit, tam cito invenire potuisti, fili mi? "". Qui respondit: "" Voluntas Domini Dei tui fuit, ut occurreret mihi ""."
la,NOVA_VULGATA,Gen,Gen,0,Gen.27,Gen 27,26,Gen.27.21,Gen 27:21,20,"Dixitque Isaac ad Iacob: "" Accede huc, ut tangam te, fili mi, et probem, utrum tu sis filius meus Esau an non ""."
la,NOVA_VULGATA,Gen,Gen,0,Gen.27,Gen 27,26,Gen.27.22,Gen 27:22,21,"Accessit ille ad patrem, et, palpato eo, dixit Isaac: "" Vox quidem, vox Iacob est, sed manus, manus sunt Esau ""."
la,NOVA_VULGATA,Gen,Gen,0,Gen.27,Gen 27,26,Gen.27.23,Gen 27:23,22,"Et non cognovit eum, quia pilosae manus similitudinem maioris expresserant. Benedixit ergo illi."
la,NOVA_VULGATA,Gen,Gen,0,Gen.27,Gen 27,26,Gen.27.24,Gen 27:24,23,"Ait: "" Tu es filius meus Esau? "". Respondit: "" Ego sum ""."
la,NOVA_VULGATA,Gen,Gen,0,Gen.27,Gen 27,26,Gen.27.25,Gen 27:25,24,"At ille: "" Affer, inquit, mihi, et comedam de venatione tua, fili mi, ut benedicat tibi anima mea "". Quos cum oblatos comedisset, obtulit ei etiam vinum. Quo hausto,"
la,NOVA_VULGATA,Gen,Gen,0,Gen.27,Gen 27,26,Gen.27.26,Gen 27:26,25,"dixit ad eum Isaac pater eius: "" Accede ad me et da mihi osculum, fili mi ""."
la,NOVA_VULGATA,Gen,Gen,0,Gen.27,Gen 27,26,Gen.27.27,Gen 27:27,26,"Accessit et osculatus est eum. Statimque, ut sensit vestimentorum illius fragrantiam, benedicens illi ait: Ecce odor filii meisicut odor agri pleni,cui benedixit Dominus."
la,NOVA_VULGATA,Gen,Gen,0,Gen.27,Gen 27,26,Gen.27.28,Gen 27:28,27,Det tibi Deus de rore caeliet de pinguedine terraeet abundantiam frumenti et vini.
la,NOVA_VULGATA,Gen,Gen,0,Gen.27,Gen 27,26,Gen.27.29,Gen 27:29,28,"Et serviant tibi populi,et adorent te nationes;esto dominus fratrum tuorum,et incurventur ante te filii matris tuae.Qui maledixerit tibi, sit maledictus;et, qui benedixerit tibi, sit benedictus! ""."
la,NOVA_VULGATA,Gen,Gen,0,Gen.27,Gen 27,26,Gen.27.30,Gen 27:30,29,"Vix Isaac benedictionem Iacob finierat, et Iacob egressus erat a patre suo Isaac, venit Esau frater eius"
la,NOVA_VULGATA,Gen,Gen,0,Gen.27,Gen 27,26,Gen.27.31,Gen 27:31,30,"coctosque de venatione cibos intulit patri dicens: "" Surge, pater mi, et comede de venatione filii tui, ut benedicat mihi anima tua ""."
la,NOVA_VULGATA,Gen,Gen,0,Gen.27,Gen 27,26,Gen.27.32,Gen 27:32,31,"Dixitque illi Isaac pater eius: "" Quis enim es tu? "". Qui respondit: "" Ego sum filius tuus primogenitus Esau ""."
la,NOVA_VULGATA,Gen,Gen,0,Gen.27,Gen 27,26,Gen.27.33,Gen 27:33,32,"Expavit Isaac stupore vehementi ultra modum et ait: "" Quis igitur ille est, qui dudum captam venationem attulit mihi, et comedi ex omnibus, priusquam tu venires? Benedixique ei, et erit benedictus! ""."
la,NOVA_VULGATA,Gen,Gen,0,Gen.27,Gen 27,26,Gen.27.34,Gen 27:34,33,"Auditis Esau sermonibus patris, irrugiit clamore magno et amaro ultra modum et ait patri suo: "" Benedic etiam mihi, pater mi! ""."
la,NOVA_VULGATA,Gen,Gen,0,Gen.27,Gen 27,26,Gen.27.35,Gen 27:35,34,"Qui ait: "" Venit germanus tuus fraudulenter et accepit benedictionem tuam ""."
la,NOVA_VULGATA,Gen,Gen,0,Gen.27,Gen 27,26,Gen.27.36,Gen 27:36,35,"At ille subiunxit: "" Iuste vocatum est nomen eius Iacob; supplantavit enim me en altera vice: primogenita mea ante tulit et nunc secundo surripuit benedictionem meam "".Rursumque ait: "" Numquid non reservasti mihi benedictionem? ""."
la,NOVA_VULGATA,Gen,Gen,0,Gen.27,Gen 27,26,Gen.27.37,Gen 27:37,36,"Respondit Isaac: "" Ecce, dominum tuum illum constitui et omnes fratres eius servituti illius subiugavi; frumento et vino stabilivi eum. Et tibi post haec, fili mi, ultra quid faciam? ""."
la,NOVA_VULGATA,Gen,Gen,0,Gen.27,Gen 27,26,Gen.27.38,Gen 27:38,37,"Dixitque Esau ad patrem suum: "" Num unam tantum benedictionem habes, pater mi? Mihi quoque obsecro, ut benedicas! "". Cumque eiulatu magno fleret,"
la,NOVA_VULGATA,Gen,Gen,0,Gen.27,Gen 27,26,Gen.27.39,Gen 27:39,38,"motus Isaac dixit ad eum: Ecce, procul a pinguedine terrae erit habitatio tuaet procul a rore caeli desuper."
la,NOVA_VULGATA,Gen,Gen,0,Gen.27,Gen 27,26,Gen.27.40,Gen 27:40,39,"De gladio tuo viveset fratri tuo servies.Tempusque veniet, cum excutiaset solvas iugum eius de cervicibus tuis ""."
la,NOVA_VULGATA,Gen,Gen,0,Gen.27,Gen 27,26,Gen.27.41,Gen 27:41,40,"Oderat ergo Esau Iacob pro benedictione, qua benedixerat ei pater, dixitque in corde suo: "" Appropinquabunt dies luctus patris mei, et occidam Iacob fratrem meum ""."
la,NOVA_VULGATA,Gen,Gen,0,Gen.27,Gen 27,26,Gen.27.42,Gen 27:42,41,"Nuntiata sunt Rebeccae verba Esau filii eius maioris, quae mittens et vocans Iacob filium suum minorem dixit ad eum: "" Ecce, Esau frater tuus minatur, ut occidat te."
la,NOVA_VULGATA,Gen,Gen,0,Gen.27,Gen 27,26,Gen.27.43,Gen 27:43,42,"Nunc ergo, fili mi, audi vocem meam et consurgens fuge ad Laban fratrem meum in Charran;"
la,NOVA_VULGATA,Gen,Gen,0,Gen.27,Gen 27,26,Gen.27.44,Gen 27:44,43,"habitabisque cum eo dies paucos, donec requiescat furor fratris tui,"
la,NOVA_VULGATA,Gen,Gen,0,Gen.27,Gen 27,26,Gen.27.45,Gen 27:45,44,"et cesset indignatio eius, obliviscaturque eorum, quae fecisti in eum. Postea mittam et adducam te inde huc. Cur utroque orbabor filio in uno die? ""."
la,NOVA_VULGATA,Gen,Gen,0,Gen.27,Gen 27,26,Gen.27.46,Gen 27:46,45,"Dixit quoque Rebecca ad Isaac: "" Taedet me vitae meae propter filias Heth; si acceperit Iacob uxorem de filiabus Heth sicut istis de filiabus terrae, nolo vivere ""."
la,NOVA_VULGATA,Gen,Gen,0,Gen.28,Gen 28,27,Gen.28.1,Gen 28:1,0,"Vocavit itaque Isaac Iacob et benedixit eum praecepit que ei dicens: "" Noli accipere coniugem de filiabus Chanaan;"
la,NOVA_VULGATA,Gen,Gen,0,Gen.28,Gen 28,27,Gen.28.2,Gen 28:2,1,"surge, vade in Paddanaram ad domum Bathuel patris matris tuae et accipe tibi inde uxorem de filiabus Laban avunculi tui."
la,NOVA_VULGATA,Gen,Gen,0,Gen.28,Gen 28,27,Gen.28.3,Gen 28:3,2,"Deus autem omnipotens benedicat tibi et crescere te faciat atque multiplicet, ut sis in multitudinem populorum;"
la,NOVA_VULGATA,Gen,Gen,0,Gen.28,Gen 28,27,Gen.28.4,Gen 28:4,3,"et det tibi benedictiones Abraham tibi et semini tuo tecum, ut possideas terram peregrinationis tuae, quam pollicitus est Deus avo tuo ""."
la,NOVA_VULGATA,Gen,Gen,0,Gen.28,Gen 28,27,Gen.28.5,Gen 28:5,4,"Cumque dimisisset eum Isaac, profectus est in Paddanaram ad Laban filium Bathuel Aramaei fratrem Rebeccae matris Iacob et Esau."
la,NOVA_VULGATA,Gen,Gen,0,Gen.28,Gen 28,27,Gen.28.6,Gen 28:6,5,"Videns autem Esau quod benedixisset pater suus Iacob et misisset eum in Paddanaram, ut inde uxorem duceret, et quod post benedictionem praecepisset ei dicens: "" Non accipies uxorem de filiabus Chanaan "","
la,NOVA_VULGATA,Gen,Gen,0,Gen.28,Gen 28,27,Gen.28.7,Gen 28:7,6,quodque oboediens Iacob parentibus suis isset in Paddanaram;
la,NOVA_VULGATA,Gen,Gen,0,Gen.28,Gen 28,27,Gen.28.8,Gen 28:8,7,"probans quoque quod non libenter aspiceret filias Chanaan pater suus,"
la,NOVA_VULGATA,Gen,Gen,0,Gen.28,Gen 28,27,Gen.28.9,Gen 28:9,8,"ivit ad Ismaelem et duxit uxorem, absque iis, quas habebat, Mahalath filiam Ismael filii Abraham sororem Nabaioth."
la,NOVA_VULGATA,Gen,Gen,0,Gen.28,Gen 28,27,Gen.28.10,Gen 28:10,9,Igitur egressus Iacob de Bersabee pergebat Charran.
la,NOVA_VULGATA,Gen,Gen,0,Gen.28,Gen 28,27,Gen.28.11,Gen 28:11,10,"Cumque venisset ad quendam locum et vellet in eo requiescere post solis occubitum, tulit de lapidibus, qui iacebant, et supponens capiti suo dormivit in eodem loco."
la,NOVA_VULGATA,Gen,Gen,0,Gen.28,Gen 28,27,Gen.28.12,Gen 28:12,11,"Viditque in somnio scalam stantem super terram et cacumen illius tangens caelum, angelos quoque Dei ascendentes et descendentes per eam"
la,NOVA_VULGATA,Gen,Gen,0,Gen.28,Gen 28,27,Gen.28.13,Gen 28:13,12,"et Dominum innixum scalae dicentem sibi: "" Ego sum Dominus, Deus Abraham patris tui et Deus Isaac. Terram, in qua dormis, tibi dabo et semini tuo."
la,NOVA_VULGATA,Gen,Gen,0,Gen.28,Gen 28,27,Gen.28.14,Gen 28:14,13,Eritque semen tuum quasi pulvis terrae; dilataberis ad occidentem et orientem et septentrionem et meridiem; et benedicentur in te et in semine tuo cunctae tribus terrae.
la,NOVA_VULGATA,Gen,Gen,0,Gen.28,Gen 28,27,Gen.28.15,Gen 28:15,14,"Et ecce, ego tecum sum et custodiam te, quocumque perrexeris, et reducam te in terram hanc; nec dimittam te, nisi complevero quae dixi tibi."
la,NOVA_VULGATA,Gen,Gen,0,Gen.28,Gen 28,27,Gen.28.16,Gen 28:16,15,"Cumque evigilasset Iacob de somno, ait: "" Vere Dominus est in loco isto, et ego nesciebam ""."
la,NOVA_VULGATA,Gen,Gen,0,Gen.28,Gen 28,27,Gen.28.17,Gen 28:17,16,"Pavensque: "" Quam terribilis est, inquit, locus iste! Non est hic aliud nisi domus Dei et porta caeli ""."
la,NOVA_VULGATA,Gen,Gen,0,Gen.28,Gen 28,27,Gen.28.18,Gen 28:18,17,"Surgens ergo Iacob mane tulit lapidem, quem supposuerat capiti suo, et erexit in titulum fundens oleum desuper."
la,NOVA_VULGATA,Gen,Gen,0,Gen.28,Gen 28,27,Gen.28.19,Gen 28:19,18,Appellavitque nomen loci illius Bethel; prius autem urbs vocabatur Luza.
la,NOVA_VULGATA,Gen,Gen,0,Gen.28,Gen 28,27,Gen.28.20,Gen 28:20,19,"Vovit Iacob etiam votum dicens: "" Si fuerit Deus mecum et custodierit me in via hac, per quam ambulo, et dederit mihi panem ad vescendum et vestimentum ad induendum,"
la,NOVA_VULGATA,Gen,Gen,0,Gen.28,Gen 28,27,Gen.28.21,Gen 28:21,20,"reversusque fuero prospere ad domum patris mei, erit mihi Dominus in Deum,"
la,NOVA_VULGATA,Gen,Gen,0,Gen.28,Gen 28,27,Gen.28.22,Gen 28:22,21,"et lapis iste, quem erexi in titulum, erit domus Dei; cunctorumque, quae dederis mihi, decimas offeram tibi ""."
la,NOVA_VULGATA,Gen,Gen,0,Gen.29,Gen 29,28,Gen.29.1,Gen 29:1,0,Profectus ergo Iacob venit in terram orientalium.
la,NOVA_VULGATA,Gen,Gen,0,Gen.29,Gen 29,28,Gen.29.2,Gen 29:2,1,"Et vidit puteum in agro, tres quoque greges ovium accubantes iuxta eum; nam ex illo adaquabantur pecora, et os eius grandi lapide claudebatur."
la,NOVA_VULGATA,Gen,Gen,0,Gen.29,Gen 29,28,Gen.29.3,Gen 29:3,2,"Morisque erat, ut, cunctis ovibus congregatis, devolverent lapidem et, refectis gregibus, rursum super os putei ponerent."
la,NOVA_VULGATA,Gen,Gen,0,Gen.29,Gen 29,28,Gen.29.4,Gen 29:4,3,"Dixitque ad pastores: "" Fratres, unde estis? "". Qui responderunt: "" De Charran ""."
la,NOVA_VULGATA,Gen,Gen,0,Gen.29,Gen 29,28,Gen.29.5,Gen 29:5,4,"Quos interrogans: "" Numquid, ait, nostis Laban filium Nachor? "". Dixerunt: "" Novimus ""."
la,NOVA_VULGATA,Gen,Gen,0,Gen.29,Gen 29,28,Gen.29.6,Gen 29:6,5,""" Sanusne est? "", inquit. "" Valet, inquiunt, et ecce Rachel filia eius venit cum grege ""."
la,NOVA_VULGATA,Gen,Gen,0,Gen.29,Gen 29,28,Gen.29.7,Gen 29:7,6,"Dixitque: "" Adhuc multum diei superest, nec est tempus, ut congregentur greges; date potum ovibus et sic ad pastum eas reducite ""."
la,NOVA_VULGATA,Gen,Gen,0,Gen.29,Gen 29,28,Gen.29.8,Gen 29:8,7,"Qui responderunt: "" Non possumus, donec omnia pecora congregentur et amoveamus lapidem de ore putei, ut adaquemus greges ""."
la,NOVA_VULGATA,Gen,Gen,0,Gen.29,Gen 29,28,Gen.29.9,Gen 29:9,8,"Adhuc loquebatur cum eis, et ecce Rachel veniebat cum ovibus patris sui; nam gregem ipsa pascebat."
la,NOVA_VULGATA,Gen,Gen,0,Gen.29,Gen 29,28,Gen.29.10,Gen 29:10,9,"Cum vidisset Iacob Rachel filiam Laban avunculi sui ovesque Laban avunculi sui, accedens amovit lapidem de ore putei"
la,NOVA_VULGATA,Gen,Gen,0,Gen.29,Gen 29,28,Gen.29.11,Gen 29:11,10,et adaquavit gregem Laban avunculi sui. Tunc Iacob osculatus est Rachel et elevata voce flevit;
la,NOVA_VULGATA,Gen,Gen,0,Gen.29,Gen 29,28,Gen.29.12,Gen 29:12,11,et indicavit ei quod frater esset patris eius et filius Rebeccae. At illa festinans nuntiavit patri suo.
la,NOVA_VULGATA,Gen,Gen,0,Gen.29,Gen 29,28,Gen.29.13,Gen 29:13,12,"Qui cum audisset venisse Iacob filium sororis suae, cucurrit obviam ei; complexusque eum et in oscula ruens duxit in domum suam. Auditis autem omnibus, quae evenerant,"
la,NOVA_VULGATA,Gen,Gen,0,Gen.29,Gen 29,28,Gen.29.14,Gen 29:14,13,"respondit: "" Vere os meum es et caro mea! "".Et, postquam Iacob habitavit apud eum per dies mensis unius,"
la,NOVA_VULGATA,Gen,Gen,0,Gen.29,Gen 29,28,Gen.29.15,Gen 29:15,14,"dixit ei Laban: "" Num, quia frater meus es, gratis servies mihi? Dic quid mercedis accipias ""."
la,NOVA_VULGATA,Gen,Gen,0,Gen.29,Gen 29,28,Gen.29.16,Gen 29:16,15,"Habebat vero filias duas: nomen maioris Lia, minor vero appellabatur Rachel;"
la,NOVA_VULGATA,Gen,Gen,0,Gen.29,Gen 29,28,Gen.29.17,Gen 29:17,16,"sed Lia lippis erat oculis, Rachel decora et venusto aspectu."
la,NOVA_VULGATA,Gen,Gen,0,Gen.29,Gen 29,28,Gen.29.18,Gen 29:18,17,"Quam diligens Iacob ait: "" Serviam tibi pro Rachel filia tua minore septem annis ""."
la,NOVA_VULGATA,Gen,Gen,0,Gen.29,Gen 29,28,Gen.29.19,Gen 29:19,18,"Respondit Laban: "" Melius est, ut tibi eam dem quam alteri viro; mane apud me ""."
la,NOVA_VULGATA,Gen,Gen,0,Gen.29,Gen 29,28,Gen.29.20,Gen 29:20,19,"Servivit igitur Iacob pro Rachel septem annis, et videbantur illi pauci dies prae amoris magnitudine."
la,NOVA_VULGATA,Gen,Gen,0,Gen.29,Gen 29,28,Gen.29.21,Gen 29:21,20,"Dixitque ad Laban: "" Da mihi uxorem meam, quia iam tempus expletum est, ut ingrediar ad eam ""."
la,NOVA_VULGATA,Gen,Gen,0,Gen.29,Gen 29,28,Gen.29.22,Gen 29:22,21,"Qui, vocatis omnibus viris loci ad convivium, fecit nuptias."
la,NOVA_VULGATA,Gen,Gen,0,Gen.29,Gen 29,28,Gen.29.23,Gen 29:23,22,"Et vespere sumpsit Liam filiam suam et introduxit ad eum, et venit ad eam."
la,NOVA_VULGATA,Gen,Gen,0,Gen.29,Gen 29,28,Gen.29.24,Gen 29:24,23,"Et dedit Laban ancillam filiae Zelpham nomine.Facto mane, vidit, et ecce erat Lia."
la,NOVA_VULGATA,Gen,Gen,0,Gen.29,Gen 29,28,Gen.29.25,Gen 29:25,24,"Et dixit ad socerum suum: "" Quid hoc fecisti mihi? Nonne pro Rachel servivi tibi? Quare imposuisti mihi? ""."
la,NOVA_VULGATA,Gen,Gen,0,Gen.29,Gen 29,28,Gen.29.26,Gen 29:26,25,"Respondit Laban: "" Non est in loco nostro consuetudinis, ut minorem ante maiorem tradamus ad nuptias."
la,NOVA_VULGATA,Gen,Gen,0,Gen.29,Gen 29,28,Gen.29.27,Gen 29:27,26,"Imple hebdomadam hanc, et alteram quoque dabo tibi pro opere, quo serviturus es mihi septem annis aliis ""."
la,NOVA_VULGATA,Gen,Gen,0,Gen.29,Gen 29,28,Gen.29.28,Gen 29:28,27,"Acquievit placito et, hebdomada transacta, dedit ei Laban filiam suam Rachel uxorem,"
la,NOVA_VULGATA,Gen,Gen,0,Gen.29,Gen 29,28,Gen.29.29,Gen 29:29,28,cui servam Bilham tradidit.
la,NOVA_VULGATA,Gen,Gen,0,Gen.29,Gen 29,28,Gen.29.30,Gen 29:30,29,Et ingressus etiam ad Rachel amavit eam plus quam Liam serviens apud eum septem annis aliis.
la,NOVA_VULGATA,Gen,Gen,0,Gen.29,Gen 29,28,Gen.29.31,Gen 29:31,30,"Videns autem Dominus quod despiceret Liam, aperuit vulvam eius, Rachel sterili permanente."
la,NOVA_VULGATA,Gen,Gen,0,Gen.29,Gen 29,28,Gen.29.32,Gen 29:32,31,"Et concepit Lia et genuit filium vocavitque nomen eius Ruben dicens: "" Vidit Dominus humilitatem meam; nunc amabit me vir meus ""."
la,NOVA_VULGATA,Gen,Gen,0,Gen.29,Gen 29,28,Gen.29.33,Gen 29:33,32,"Rursumque concepit et peperit filium et ait: "" Quoniam audivit me Dominus haberi contemptui, dedit etiam istum mihi ""; vocavitque nomen illius Simeon."
la,NOVA_VULGATA,Gen,Gen,0,Gen.29,Gen 29,28,Gen.29.34,Gen 29:34,33,"Concepit tertio et genuit alium filium dixitque: "" Nunc quoque copulabitur mihi maritus meus, eo quod pepererim ei tres filios ""; et idcirco appellavit nomen eius Levi."
la,NOVA_VULGATA,Gen,Gen,0,Gen.29,Gen 29,28,Gen.29.35,Gen 29:35,34,"Quarto concepit et peperit filium et ait: "" Modo confitebor Domino ""; et ob hoc vocavit eum Iudam. Cessavitque parere."
la,NOVA_VULGATA,Gen,Gen,0,Gen.30,Gen 30,29,Gen.30.1,Gen 30:1,0,"Cernens autem Rachel quod infecunda esset, invidit sorori et ait marito suo: "" Da mihi liberos, alioquin moriar ""."
la,NOVA_VULGATA,Gen,Gen,0,Gen.30,Gen 30,29,Gen.30.2,Gen 30:2,1,"Cui iratus respondit Iacob: "" Num pro Deo ego sum, qui privavit te fructu ventris? ""."
la,NOVA_VULGATA,Gen,Gen,0,Gen.30,Gen 30,29,Gen.30.3,Gen 30:3,2,"At illa: "" Ecce, inquit, famula mea Bilha; ingredere ad illam, ut pariat super genua mea, et habeam ex illa et ego filios ""."
la,NOVA_VULGATA,Gen,Gen,0,Gen.30,Gen 30,29,Gen.30.4,Gen 30:4,3,"Deditque illi Bilham famulam suam in coniugium. Quae,"
la,NOVA_VULGATA,Gen,Gen,0,Gen.30,Gen 30,29,Gen.30.5,Gen 30:5,4,"ingresso ad se Iacob, concepit et peperit filium."
la,NOVA_VULGATA,Gen,Gen,0,Gen.30,Gen 30,29,Gen.30.6,Gen 30:6,5,"Dixitque Rachel: "" Iudicavit mihi Deus et exaudivit vocem quoque meam dans mihi filium ""; et idcirco appellavit nomen illius Dan."
la,NOVA_VULGATA,Gen,Gen,0,Gen.30,Gen 30,29,Gen.30.7,Gen 30:7,6,"Rursumque Bilha famula Rachel concepit et peperit Iacob alterum filium, et"
la,NOVA_VULGATA,Gen,Gen,0,Gen.30,Gen 30,29,Gen.30.8,Gen 30:8,7,"ait Rachel: "" Certamina Dei certavi cum sorore mea et invalui ""; vocavitque eum Nephthali."
la,NOVA_VULGATA,Gen,Gen,0,Gen.30,Gen 30,29,Gen.30.9,Gen 30:9,8,"Sentiens Lia quod parere desisset, sumpsit Zelpham ancillam suam et tradidit eam Iacob in uxorem."
la,NOVA_VULGATA,Gen,Gen,0,Gen.30,Gen 30,29,Gen.30.10,Gen 30:10,9,Quae peperit Iacob filium.
la,NOVA_VULGATA,Gen,Gen,0,Gen.30,Gen 30,29,Gen.30.11,Gen 30:11,10,"Dixitque Lia: "" Feliciter! ""; et idcirco vocavit nomen eius Gad."
la,NOVA_VULGATA,Gen,Gen,0,Gen.30,Gen 30,29,Gen.30.12,Gen 30:12,11,Peperit quoque Zelpha ancilla Liae Iacob alterum filium.
la,NOVA_VULGATA,Gen,Gen,0,Gen.30,Gen 30,29,Gen.30.13,Gen 30:13,12,"Dixitque Lia: "" Pro beatitudine mea! Beatam quippe me dicent mulieres; propterea appellavit eum Aser."
la,NOVA_VULGATA,Gen,Gen,0,Gen.30,Gen 30,29,Gen.30.14,Gen 30:14,13,"Egressus autem Ruben tempore messis triticeae, repperit in agro mandragoras, quas Liae matri suae detulit. Dixitque Rachel: "" Da mihi partem de mandragoris filii tui ""."
la,NOVA_VULGATA,Gen,Gen,0,Gen.30,Gen 30,29,Gen.30.15,Gen 30:15,14,"Illa respondit: "" Parumne tibi videtur, quod praeripueris maritum mihi, ut etiam mandragoras filii mei auferas? "". Ait Rachel: "" Dormiat ergo tecum hac nocte pro mandragoris filii tui ""."
la,NOVA_VULGATA,Gen,Gen,0,Gen.30,Gen 30,29,Gen.30.16,Gen 30:16,15,"Redeuntique ad vesperam Iacob de agro egressa est in occursum eius Lia et: "" Ad me, inquit, intrabis, quia mercede conduxi te pro mandragoris filii mei "". Dormivitque cum ea nocte illa."
la,NOVA_VULGATA,Gen,Gen,0,Gen.30,Gen 30,29,Gen.30.17,Gen 30:17,16,"Et exaudivit Deus Liam, concepitque et peperit Iacob filium quintum"
la,NOVA_VULGATA,Gen,Gen,0,Gen.30,Gen 30,29,Gen.30.18,Gen 30:18,17,"et ait: "" Dedit Deus mercedem mihi, quia dedi ancillam meam viro meo ""; appellavitque nomen illius Issachar."
la,NOVA_VULGATA,Gen,Gen,0,Gen.30,Gen 30,29,Gen.30.19,Gen 30:19,18,Rursum Lia concepit et peperit Iacob sextum filium
la,NOVA_VULGATA,Gen,Gen,0,Gen.30,Gen 30,29,Gen.30.20,Gen 30:20,19,"et ait: "" Donavit me Deus dono bono; hac vice honorabit me maritus meus, eo quod genuerim ei sex filios ""; et idcirco appellavit nomen eius Zabulon."
la,NOVA_VULGATA,Gen,Gen,0,Gen.30,Gen 30,29,Gen.30.21,Gen 30:21,20,Post quem peperit filiam nomine Dinam.
la,NOVA_VULGATA,Gen,Gen,0,Gen.30,Gen 30,29,Gen.30.22,Gen 30:22,21,Recordatus quoque Deus Rachelis exaudivit eam Deus et aperuit vulvam illius.
la,NOVA_VULGATA,Gen,Gen,0,Gen.30,Gen 30,29,Gen.30.23,Gen 30:23,22,"Quae concepit et peperit filium dicens: "" Abstulit Deus opprobrium meum;"
la,NOVA_VULGATA,Gen,Gen,0,Gen.30,Gen 30,29,Gen.30.24,Gen 30:24,23,"et vocavit nomen illius Ioseph dicens: "" Addat mihi Dominus filium alterum! ""."
la,NOVA_VULGATA,Gen,Gen,0,Gen.30,Gen 30,29,Gen.30.25,Gen 30:25,24,"Nato autem Ioseph, dixit Iacob ad Laban: "" Dimitte me, ut revertar in patriam et ad terram meam."
la,NOVA_VULGATA,Gen,Gen,0,Gen.30,Gen 30,29,Gen.30.26,Gen 30:26,25,"Da mihi uxores et liberos meos, pro quibus servivi tibi, ut abeam; tu nosti servitutem, qua servivi tibi ""."
la,NOVA_VULGATA,Gen,Gen,0,Gen.30,Gen 30,29,Gen.30.27,Gen 30:27,26,"Ait illi Laban: "" Inveniam gratiam in conspectu tuo; augurio didici, quia benedixerit mihi Deus propter te."
la,NOVA_VULGATA,Gen,Gen,0,Gen.30,Gen 30,29,Gen.30.28,Gen 30:28,27,"Constitue mercedem tuam, quam dem tibi ""."
la,NOVA_VULGATA,Gen,Gen,0,Gen.30,Gen 30,29,Gen.30.29,Gen 30:29,28,"At ille respondit: "" Tu nosti quomodo servierim tibi et quanti in manibus meis facti sint greges tui."
la,NOVA_VULGATA,Gen,Gen,0,Gen.30,Gen 30,29,Gen.30.30,Gen 30:30,29,"Modicum habuisti, antequam venirem ad te, et nunc multiplicatum est vehementer, benedixitque tibi Dominus ad introitum meum. Nunc autem quando providebo etiam domui meae? ""."
la,NOVA_VULGATA,Gen,Gen,0,Gen.30,Gen 30,29,Gen.30.31,Gen 30:31,30,"Dixitque Laban: "" Quid tibi dabo? "". At ille ait: "" Nihil mihi dabis; si feceris, quod postulo, iterum pascam et custodiam pecora tua."
la,NOVA_VULGATA,Gen,Gen,0,Gen.30,Gen 30,29,Gen.30.32,Gen 30:32,31,"Gyrabo omnes greges tuos hodie; separa cuncta pecora varia et maculosa et, quodcumque furvum in ovibus et maculosum variumque in capris fuerit, erit merces mea."
la,NOVA_VULGATA,Gen,Gen,0,Gen.30,Gen 30,29,Gen.30.33,Gen 30:33,32,"Respondebitque mihi cras iustitia mea; quando veneris, ut inspicias mercedem meam, omnia, quae non fuerint varia et maculosa in capris et furva in ovibus, furti me arguent ""."
la,NOVA_VULGATA,Gen,Gen,0,Gen.30,Gen 30,29,Gen.30.34,Gen 30:34,33,"Dixit Laban: "" Gratum habeo, quod petis! ""."
la,NOVA_VULGATA,Gen,Gen,0,Gen.30,Gen 30,29,Gen.30.35,Gen 30:35,34,"Et separavit in die illo hircos striatos atque maculosos et omnes capras varias et maculosas, omne, in quo album erat, et omne furvum in ovibus, et tradidit in manu filiorum suorum."
la,NOVA_VULGATA,Gen,Gen,0,Gen.30,Gen 30,29,Gen.30.36,Gen 30:36,35,"Et posuit spatium itineris trium dierum inter se et Iacob, qui pascebat reliquos greges Laban."
la,NOVA_VULGATA,Gen,Gen,0,Gen.30,Gen 30,29,Gen.30.37,Gen 30:37,36,"Tollens ergo Iacob virgas virides populeas et amygdalinas et ex platanis, ex parte ita decorticavit eas, ut in his, quae spoliata fuerant, candor appareret."
la,NOVA_VULGATA,Gen,Gen,0,Gen.30,Gen 30,29,Gen.30.38,Gen 30:38,37,"Posuitque virgas, quas ex parte decorticaverat, in canalibus, ubi effundebatur aqua, ut, cum venissent greges ad bibendum, ante oculos haberent virgas et in aspectu earum conciperent."
la,NOVA_VULGATA,Gen,Gen,0,Gen.30,Gen 30,29,Gen.30.39,Gen 30:39,38,Factumque est ut in ipso calore coitus greges intuerentur virgas et parerent striata et varia et maculosa.
la,NOVA_VULGATA,Gen,Gen,0,Gen.30,Gen 30,29,Gen.30.40,Gen 30:40,39,Agnos autem segregavit Iacob et posuit gregem ex adverso striatorum et omnium furvorum in grege Laban et constituit sibi greges seorsum neque statuit eos cum grege Laban.
la,NOVA_VULGATA,Gen,Gen,0,Gen.30,Gen 30,29,Gen.30.41,Gen 30:41,40,"Quotiescumque igitur calefiebant pecora robusta, ponebat Iacob virgas in canalibus aquarum ante oculos pecorum, ut in earum contemplatione conciperent."
la,NOVA_VULGATA,Gen,Gen,0,Gen.30,Gen 30,29,Gen.30.42,Gen 30:42,41,"Quando vero pecora debilia erant, non ponebat eas. Factaque sunt debilia Laban et robusta Iacob;"
la,NOVA_VULGATA,Gen,Gen,0,Gen.30,Gen 30,29,Gen.30.43,Gen 30:43,42,"ditatusque est homo ultra modum et habuit greges multos, ancillas et servos, camelos et asinos."
la,NOVA_VULGATA,Gen,Gen,0,Gen.31,Gen 31,30,Gen.31.1,Gen 31:1,0,"Postquam autem audivit verba filiorum Laban dicen tium: "" Tulit Iacob omnia, quae fuerunt patris nostri, et de patris nostri facultate acquisivit has divitias "","
la,NOVA_VULGATA,Gen,Gen,0,Gen.31,Gen 31,30,Gen.31.2,Gen 31:2,1,animadvertit quoque faciem Laban quod non esset erga se sicut heri et nudiustertius.
la,NOVA_VULGATA,Gen,Gen,0,Gen.31,Gen 31,30,Gen.31.3,Gen 31:3,2,"Et dixit Dominus ad Iacob: "" Revertere in terram patrum tuorum et ad cognationem tuam, eroque tecum ""."
la,NOVA_VULGATA,Gen,Gen,0,Gen.31,Gen 31,30,Gen.31.4,Gen 31:4,3,"Misit Iacob et vocavit Rachel et Liam in agrum, ubi pascebat greges,"
la,NOVA_VULGATA,Gen,Gen,0,Gen.31,Gen 31,30,Gen.31.5,Gen 31:5,4,"dixitque eis: "" Video faciem patris vestri quod non sit erga me sicut heri et nudiustertius; Deus autem patris mei fuit mecum,"
la,NOVA_VULGATA,Gen,Gen,0,Gen.31,Gen 31,30,Gen.31.6,Gen 31:6,5,et ipsae nostis quod totis viribus meis servierim patri vestro.
