languageCode,code,bookOsisId,bookSblId,bookOrderIndex,chapterOsisId,chapterSblId,chapterOrderIndex,verseOsisId,verseSblId,verseOrderIndex,text
la,NOVA_VULGATA,Ps,Ps,18,Ps.106,Ps 106,105,Ps.106.40,Ps 106:40,39,Et exarsit ira Dominus in populum suumet abominatus est hereditatem suam
la,NOVA_VULGATA,Ps,Ps,18,Ps.106,Ps 106,105,Ps.106.41,Ps 106:41,40,"et tradidit eos in manus gentium,et dominati sunt eorum, qui oderunt eos."
la,NOVA_VULGATA,Ps,Ps,18,Ps.106,Ps 106,105,Ps.106.42,Ps 106:42,41,"Et tribulaverunt eos inimici eorum,et humiliati sunt sub manibus eorum."
la,NOVA_VULGATA,Ps,Ps,18,Ps.106,Ps 106,105,Ps.106.43,Ps 106:43,42,Saepe liberavit eos;ipsi autem exacerbaverunt eum in consilio suoet corruerunt in iniquitatibus suis.
la,NOVA_VULGATA,Ps,Ps,18,Ps.106,Ps 106,105,Ps.106.44,Ps 106:44,43,"Et vidit tribulationem eorum,cum audivit clamorem eorum. -"
la,NOVA_VULGATA,Ps,Ps,18,Ps.106,Ps 106,105,Ps.106.45,Ps 106:45,44,Et memor fuit testamenti suiet paenituit eum secundum multitudinem misericordiae suae.
la,NOVA_VULGATA,Ps,Ps,18,Ps.106,Ps 106,105,Ps.106.46,Ps 106:46,45,"Et dedit eos in miserationesin conspectu omnium, qui captivos duxerant eos."
la,NOVA_VULGATA,Ps,Ps,18,Ps.106,Ps 106,105,Ps.106.47,Ps 106:47,46,"Salvos nos fac, Domine Deus noster,et congrega nos de nationibus,ut confiteamur nomini sancto tuoet gloriemur in laude tua."
la,NOVA_VULGATA,Ps,Ps,18,Ps.106,Ps 106,105,Ps.106.48,Ps 106:48,47,"Benedictus Dominus, Deus Israel, a saeculo et usque in saeculum.Et dicet omnis populus: ""Fiat, fiat""."
la,NOVA_VULGATA,Ps,Ps,18,Ps.107,Ps 107,106,Ps.107.1,Ps 107:1,0,"ALLELUIA. Confitemini Domino, quoniam bonus, quoniam in saeculum misericordia eius."
la,NOVA_VULGATA,Ps,Ps,18,Ps.107,Ps 107,106,Ps.107.2,Ps 107:2,1,"Dicant, qui redempti sunt a Domino,quos redemit de manu adversarii"
la,NOVA_VULGATA,Ps,Ps,18,Ps.107,Ps 107,106,Ps.107.3,Ps 107:3,2,"et de regionibus congregavit eos,a solis ortu et occasu,ab aquilone et mari."
la,NOVA_VULGATA,Ps,Ps,18,Ps.107,Ps 107,106,Ps.107.4,Ps 107:4,3,"Erraverunt in solitudine, in inaquoso,viam civitatis habitationis non invenerunt."
la,NOVA_VULGATA,Ps,Ps,18,Ps.107,Ps 107,106,Ps.107.5,Ps 107:5,4,"Esurientes et sitientes,anima eorum in ipsis defecit."
la,NOVA_VULGATA,Ps,Ps,18,Ps.107,Ps 107,106,Ps.107.6,Ps 107:6,5,"Et clamaverunt ad Dominum, cum tribularentur,et de necessitatibus eorum eripuit eos."
la,NOVA_VULGATA,Ps,Ps,18,Ps.107,Ps 107,106,Ps.107.7,Ps 107:7,6,"Et deduxit eos in viam rectam,ut irent in civitatem habitationis."
la,NOVA_VULGATA,Ps,Ps,18,Ps.107,Ps 107,106,Ps.107.8,Ps 107:8,7,"Confiteantur Domino propter misericordiam eiuset mirabilia eius in filios hominum,"
la,NOVA_VULGATA,Ps,Ps,18,Ps.107,Ps 107,106,Ps.107.9,Ps 107:9,8,quia satiavit animam sitientemet animam esurientem replevit bonis.
la,NOVA_VULGATA,Ps,Ps,18,Ps.107,Ps 107,106,Ps.107.10,Ps 107:10,9,"Sedentes in tenebris et umbra mortis,vincti in mendicitate et ferro,"
la,NOVA_VULGATA,Ps,Ps,18,Ps.107,Ps 107,106,Ps.107.11,Ps 107:11,10,quia exacerbaverunt eloquia Deiet consilium Altissimi spreverunt.
la,NOVA_VULGATA,Ps,Ps,18,Ps.107,Ps 107,106,Ps.107.12,Ps 107:12,11,"Et humiliavit in laboribus cor eorum,infirmati sunt, nec fuit qui adiuvaret."
la,NOVA_VULGATA,Ps,Ps,18,Ps.107,Ps 107,106,Ps.107.13,Ps 107:13,12,"Et clamaverunt ad Dominum, cum tribularentur,et de necessitatibus eorum liberavit eos."
la,NOVA_VULGATA,Ps,Ps,18,Ps.107,Ps 107,106,Ps.107.14,Ps 107:14,13,Et eduxit eos de tenebris et umbra mortiset vincula eorum dirupit.
la,NOVA_VULGATA,Ps,Ps,18,Ps.107,Ps 107,106,Ps.107.15,Ps 107:15,14,"Confiteantur Domino propter misericordiam eiuset mirabilia eius in filios hominum,"
la,NOVA_VULGATA,Ps,Ps,18,Ps.107,Ps 107,106,Ps.107.16,Ps 107:16,15,quia contrivit portas aereaset vectes ferreos confregit.
la,NOVA_VULGATA,Ps,Ps,18,Ps.107,Ps 107,106,Ps.107.17,Ps 107:17,16,Stulti facti sunt in via iniquitatis suaeet propter iniustitias suas afflicti sunt;
la,NOVA_VULGATA,Ps,Ps,18,Ps.107,Ps 107,106,Ps.107.18,Ps 107:18,17,"omnem escam abominata est anima eorum,et appropinquaverunt usque ad portas mortis."
la,NOVA_VULGATA,Ps,Ps,18,Ps.107,Ps 107,106,Ps.107.19,Ps 107:19,18,"Et clamaverunt ad Dominum, cum tribularentur,et de necessitatibus eorum liberavit eos."
la,NOVA_VULGATA,Ps,Ps,18,Ps.107,Ps 107,106,Ps.107.20,Ps 107:20,19,Misit verbum suum et sanavit eoset eripuit eos de interitionibus eorum.
la,NOVA_VULGATA,Ps,Ps,18,Ps.107,Ps 107,106,Ps.107.21,Ps 107:21,20,Confiteantur Domino propter misericordiam eiuset mirabilia eius in filios hominum;
la,NOVA_VULGATA,Ps,Ps,18,Ps.107,Ps 107,106,Ps.107.22,Ps 107:22,21,et sacrificent sacrificium laudiset annuntient opera eius in exsultatione.
la,NOVA_VULGATA,Ps,Ps,18,Ps.107,Ps 107,106,Ps.107.23,Ps 107:23,22,"Qui descendunt mare in navibus,facientes operationem in aquis multis,"
la,NOVA_VULGATA,Ps,Ps,18,Ps.107,Ps 107,106,Ps.107.24,Ps 107:24,23,ipsi viderunt opera Dominiet mirabilia eius in profundo.
la,NOVA_VULGATA,Ps,Ps,18,Ps.107,Ps 107,106,Ps.107.25,Ps 107:25,24,"Dixit et excitavit spiritum procellae,et exaltati sunt fluctus eius."
la,NOVA_VULGATA,Ps,Ps,18,Ps.107,Ps 107,106,Ps.107.26,Ps 107:26,25,Ascendunt usque ad caeloset descendunt usque ad abyssos;anima eorum in malis tabescebat.
la,NOVA_VULGATA,Ps,Ps,18,Ps.107,Ps 107,106,Ps.107.27,Ps 107:27,26,"Turbati sunt et moti sunt sicut ebrius,et omnis sapientia eorum devorata est."
la,NOVA_VULGATA,Ps,Ps,18,Ps.107,Ps 107,106,Ps.107.28,Ps 107:28,27,"Et clamaverunt ad Dominum, cum tribularentur,et de necessitatibus eorum eduxit eos."
la,NOVA_VULGATA,Ps,Ps,18,Ps.107,Ps 107,106,Ps.107.29,Ps 107:29,28,"Et statuit procellam eius in auram,et tacuerunt fluctus eius."
la,NOVA_VULGATA,Ps,Ps,18,Ps.107,Ps 107,106,Ps.107.30,Ps 107:30,29,"Et laetati sunt, quia siluerunt,et deduxit eos in portum voluntatis eorum."
la,NOVA_VULGATA,Ps,Ps,18,Ps.107,Ps 107,106,Ps.107.31,Ps 107:31,30,Confiteantur Domino propter misericordiam eiuset mirabilia eius in filios hominum;
la,NOVA_VULGATA,Ps,Ps,18,Ps.107,Ps 107,106,Ps.107.32,Ps 107:32,31,et exaltent eum in ecclesia plebiset in conventu seniorum laudent eum.
la,NOVA_VULGATA,Ps,Ps,18,Ps.107,Ps 107,106,Ps.107.33,Ps 107:33,32,"Posuit flumina in desertumet exitus aquarum in sitim,"
la,NOVA_VULGATA,Ps,Ps,18,Ps.107,Ps 107,106,Ps.107.34,Ps 107:34,33,terram fructiferam in salsuginema malitia inhabitantium in ea.
la,NOVA_VULGATA,Ps,Ps,18,Ps.107,Ps 107,106,Ps.107.35,Ps 107:35,34,Posuit desertum in stagna aquarumet terram sine aqua in exitus aquarum.
la,NOVA_VULGATA,Ps,Ps,18,Ps.107,Ps 107,106,Ps.107.36,Ps 107:36,35,"Et collocavit illic esurientes,et constituerunt civitatem habitationis."
la,NOVA_VULGATA,Ps,Ps,18,Ps.107,Ps 107,106,Ps.107.37,Ps 107:37,36,"Et seminaverunt agros et plantaverunt vineas,et fecerunt fructum in proventum suum."
la,NOVA_VULGATA,Ps,Ps,18,Ps.107,Ps 107,106,Ps.107.38,Ps 107:38,37,"Et benedixit eis, et multiplicati sunt nimis,et iumenta eorum non minoravit."
la,NOVA_VULGATA,Ps,Ps,18,Ps.107,Ps 107,106,Ps.107.39,Ps 107:39,38,Et pauci facti sunt et vexati sunta tribulatione malorum et dolore.
la,NOVA_VULGATA,Ps,Ps,18,Ps.107,Ps 107,106,Ps.107.40,Ps 107:40,39,Effudit contemptionem super principeset errare fecit eos in deserto invio.
la,NOVA_VULGATA,Ps,Ps,18,Ps.107,Ps 107,106,Ps.107.41,Ps 107:41,40,Et suscepit pauperem de inopiaet posuit sicut oves familias.
la,NOVA_VULGATA,Ps,Ps,18,Ps.107,Ps 107,106,Ps.107.42,Ps 107:42,41,"Videbunt recti et laetabuntur,et omnis iniquitas oppilabit os suum."
la,NOVA_VULGATA,Ps,Ps,18,Ps.107,Ps 107,106,Ps.107.43,Ps 107:43,42,"Quis sapiens, et custodiet haecet intelleget misericordias Domini?."
la,NOVA_VULGATA,Ps,Ps,18,Ps.108,Ps 108,107,Ps.108.1,Ps 108:1,0,Canticum. PSALMUS. David.
la,NOVA_VULGATA,Ps,Ps,18,Ps.108,Ps 108,107,Ps.108.2,Ps 108:2,1,"Paratum cor meum, Deus,paratum cor meum,cantabo et psallam. Euge, gloria mea!"
la,NOVA_VULGATA,Ps,Ps,18,Ps.108,Ps 108,107,Ps.108.3,Ps 108:3,2,"Exsurge, psalterium et cithara,excitabo auroram."
la,NOVA_VULGATA,Ps,Ps,18,Ps.108,Ps 108,107,Ps.108.4,Ps 108:4,3,"Confitebor tibi in populis, Domine,et psallam tibi in nationibus,"
la,NOVA_VULGATA,Ps,Ps,18,Ps.108,Ps 108,107,Ps.108.5,Ps 108:5,4,"quia magna est usque ad caelos misericordia tua,et usque ad nubes veritas tua."
la,NOVA_VULGATA,Ps,Ps,18,Ps.108,Ps 108,107,Ps.108.6,Ps 108:6,5,"Exaltare super caelos, Deus,et super omnem terram gloria tua."
la,NOVA_VULGATA,Ps,Ps,18,Ps.108,Ps 108,107,Ps.108.7,Ps 108:7,6,"Ut liberentur dilecti tui,salvum fac dextera tua et exaudi me."
la,NOVA_VULGATA,Ps,Ps,18,Ps.108,Ps 108,107,Ps.108.8,Ps 108:8,7,Deus locutus est in sancto suo: Exsultabo et dividam Sichimamet convallem Succoth dimetiar;
la,NOVA_VULGATA,Ps,Ps,18,Ps.108,Ps 108,107,Ps.108.9,Ps 108:9,8,"meus est Galaad, et meus est Manasses,et Ephraim fortitudo capitis mei,Iuda sceptrum meum."
la,NOVA_VULGATA,Ps,Ps,18,Ps.108,Ps 108,107,Ps.108.10,Ps 108:10,9,"Moab lebes lavacri mei;super Idumaeam extendam calceamentum meum,super Philistaeam vociferabor ""."
la,NOVA_VULGATA,Ps,Ps,18,Ps.108,Ps 108,107,Ps.108.11,Ps 108:11,10,Quis deducet me in civitatem munitam?Quis deducet me usque in Idumaeam?.
la,NOVA_VULGATA,Ps,Ps,18,Ps.108,Ps 108,107,Ps.108.12,Ps 108:12,11,"Nonne, Deus, qui reppulisti nos?Et non exibis, Deus, in virtutibus nostris?"
la,NOVA_VULGATA,Ps,Ps,18,Ps.108,Ps 108,107,Ps.108.13,Ps 108:13,12,"Da nobis auxilium de tribulatione,quia vana salus hominis."
la,NOVA_VULGATA,Ps,Ps,18,Ps.108,Ps 108,107,Ps.108.14,Ps 108:14,13,"In Deo faciemus virtutem,et ipse conculcabit inimicos nostros."
la,NOVA_VULGATA,Ps,Ps,18,Ps.109,Ps 109,108,Ps.109.1,Ps 109:1,0,"Magistro chori. David. PSALMUS.Deus laudis meae, ne tacueris,"
la,NOVA_VULGATA,Ps,Ps,18,Ps.109,Ps 109,108,Ps.109.2,Ps 109:2,1,quia os peccatoris et os dolosi super me apertum est.Locuti sunt adversum me lingua dolosa
la,NOVA_VULGATA,Ps,Ps,18,Ps.109,Ps 109,108,Ps.109.3,Ps 109:3,2,et sermonibus odii circumdederunt meet expugnaverunt me gratis.
la,NOVA_VULGATA,Ps,Ps,18,Ps.109,Ps 109,108,Ps.109.4,Ps 109:4,3,Pro dilectione mea adversabantur mihi;ego autem orabam.
la,NOVA_VULGATA,Ps,Ps,18,Ps.109,Ps 109,108,Ps.109.5,Ps 109:5,4,Et posuerunt adversum me mala pro boniset odium pro dilectione mea.
la,NOVA_VULGATA,Ps,Ps,18,Ps.109,Ps 109,108,Ps.109.6,Ps 109:6,5,"Constitue super eum peccatorem,et adversarius stet a dextris eius."
la,NOVA_VULGATA,Ps,Ps,18,Ps.109,Ps 109,108,Ps.109.7,Ps 109:7,6,"Cum iudicatur, exeat condemnatus,et oratio eius fiat in peccatum."
la,NOVA_VULGATA,Ps,Ps,18,Ps.109,Ps 109,108,Ps.109.8,Ps 109:8,7,"Fiant dies eius pauci,et ministerium eius accipiat alter."
la,NOVA_VULGATA,Ps,Ps,18,Ps.109,Ps 109,108,Ps.109.9,Ps 109:9,8,"Fiant filii eius orphani,et uxor eius vidua."
la,NOVA_VULGATA,Ps,Ps,18,Ps.109,Ps 109,108,Ps.109.10,Ps 109:10,9,Instabiles vagentur filii eius et mendicentet eiciantur de ruinis suis. -
la,NOVA_VULGATA,Ps,Ps,18,Ps.109,Ps 109,108,Ps.109.11,Ps 109:11,10,"Scrutetur fenerator omnem substantiam eius,et diripiant alieni labores eius."
la,NOVA_VULGATA,Ps,Ps,18,Ps.109,Ps 109,108,Ps.109.12,Ps 109:12,11,"Non sit qui praebeat illi misericordiam,nec sit qui misereatur pupillis eius."
la,NOVA_VULGATA,Ps,Ps,18,Ps.109,Ps 109,108,Ps.109.13,Ps 109:13,12,"Fiant nati eius in interitum,in generatione una deleatur nomen eorum."
la,NOVA_VULGATA,Ps,Ps,18,Ps.109,Ps 109,108,Ps.109.14,Ps 109:14,13,"In memoriam redeat iniquitas patrum eius in conspectu Domini,et peccatum matris eius non deleatur."
la,NOVA_VULGATA,Ps,Ps,18,Ps.109,Ps 109,108,Ps.109.15,Ps 109:15,14,"Fiant contra Dominum semper,et disperdat de terra memoriam eorum."
la,NOVA_VULGATA,Ps,Ps,18,Ps.109,Ps 109,108,Ps.109.16,Ps 109:16,15,"Pro eo quod non est recordatus facere misericordiamet persecutus est hominem inopem et mendicumet compunctum corde, ut mortificaret."
la,NOVA_VULGATA,Ps,Ps,18,Ps.109,Ps 109,108,Ps.109.17,Ps 109:17,16,Et dilexit maledictionem: et veniat ei;et noluit benedictionem: et elongetur ab eo.
la,NOVA_VULGATA,Ps,Ps,18,Ps.109,Ps 109,108,Ps.109.18,Ps 109:18,17,"Et induit maledictionem sicut vestimentum:et intret sicut aqua in interiora eius,et sicut oleum in ossa eius."
la,NOVA_VULGATA,Ps,Ps,18,Ps.109,Ps 109,108,Ps.109.19,Ps 109:19,18,"Fiat ei sicut indumentum, quo operitur,et sicut zona, qua semper praecingitur."
la,NOVA_VULGATA,Ps,Ps,18,Ps.109,Ps 109,108,Ps.109.20,Ps 109:20,19,"Haec retributio eorum, qui adversantur mihi apud Dominum,et qui loquuntur mala adversus animam meam."
la,NOVA_VULGATA,Ps,Ps,18,Ps.109,Ps 109,108,Ps.109.21,Ps 109:21,20,"Et tu, Domine, Domine, fac mecum propter nomen tuum,quia suavis est misericordia tua;libera me,"
la,NOVA_VULGATA,Ps,Ps,18,Ps.109,Ps 109,108,Ps.109.22,Ps 109:22,21,"quia egenus et pauper ego sum,et cor meum vulneratum est intra me."
la,NOVA_VULGATA,Ps,Ps,18,Ps.109,Ps 109,108,Ps.109.23,Ps 109:23,22,"Sicut umbra, cum declinat, pertransii,excussus sum sicut locustae."
la,NOVA_VULGATA,Ps,Ps,18,Ps.109,Ps 109,108,Ps.109.24,Ps 109:24,23,"Genua mea infirmata sunt ieiunio,et caro mea contabuit absque oleo."
la,NOVA_VULGATA,Ps,Ps,18,Ps.109,Ps 109,108,Ps.109.25,Ps 109:25,24,Et ego factus sum opprobrium illis:viderunt me et moverunt capita sua.
la,NOVA_VULGATA,Ps,Ps,18,Ps.109,Ps 109,108,Ps.109.26,Ps 109:26,25,"Adiuva me, Domine Deus meus,salvum me fac secundum misericordiam tuam."
la,NOVA_VULGATA,Ps,Ps,18,Ps.109,Ps 109,108,Ps.109.27,Ps 109:27,26,"Et sciant quia manus tua haec:tu, Domine, hoc fecisti."
la,NOVA_VULGATA,Ps,Ps,18,Ps.109,Ps 109,108,Ps.109.28,Ps 109:28,27,"Maledicant illi, et tu benedicas;qui insurgunt in me, confundantur,servus autem tuus laetabitur."
la,NOVA_VULGATA,Ps,Ps,18,Ps.109,Ps 109,108,Ps.109.29,Ps 109:29,28,"Induantur, qui detrahunt mihi, pudoreet operiantur sicut diploide confusione sua."
la,NOVA_VULGATA,Ps,Ps,18,Ps.109,Ps 109,108,Ps.109.30,Ps 109:30,29,"Confitebor Domino nimis in ore meoet in medio multorum laudabo eum,"
la,NOVA_VULGATA,Ps,Ps,18,Ps.109,Ps 109,108,Ps.109.31,Ps 109:31,30,"quia astitit a dextris pauperis,ut salvam faceret a iudicantibus animam eius."
la,NOVA_VULGATA,Ps,Ps,18,Ps.110,Ps 110,109,Ps.110.1,Ps 110:1,0,"David. PSALMUS.Dixit Dominus Domino meo: "" Sede a dextris meis,donec ponam inimicos tuos scabellum pedum tuorum ""."
la,NOVA_VULGATA,Ps,Ps,18,Ps.110,Ps 110,109,Ps.110.2,Ps 110:2,1,Virgam potentiae tuae emittet Dominus ex Sion:dominare in medio inimicorum tuorum.
la,NOVA_VULGATA,Ps,Ps,18,Ps.110,Ps 110,109,Ps.110.3,Ps 110:3,2,"Tecum principatus in die virtutis tuae,in splendoribus sanctis,ex utero ante luciferum genui te."
la,NOVA_VULGATA,Ps,Ps,18,Ps.110,Ps 110,109,Ps.110.4,Ps 110:4,3,"Iuravit Dominus et non paenitebit eum: Tu es sacerdos in aeternum secundum ordinem Melchisedech ""."
la,NOVA_VULGATA,Ps,Ps,18,Ps.110,Ps 110,109,Ps.110.5,Ps 110:5,4,"Dominus a dextris tuis,conquassabit in die irae suae reges."
la,NOVA_VULGATA,Ps,Ps,18,Ps.110,Ps 110,109,Ps.110.6,Ps 110:6,5,"Iudicabit in nationibus: cumulantur cadavera,conquassabit capita in terra spatiosa."
la,NOVA_VULGATA,Ps,Ps,18,Ps.110,Ps 110,109,Ps.110.7,Ps 110:7,6,"De torrente in via bibet,propterea exaltabit caput."
la,NOVA_VULGATA,Ps,Ps,18,Ps.111,Ps 111,110,Ps.111.1,Ps 111:1,0,"ALLELUIA.ALEPH. Confitebor Domino in toto corde meo,BETH. in consilio iustorum et congregatione."
la,NOVA_VULGATA,Ps,Ps,18,Ps.111,Ps 111,110,Ps.111.2,Ps 111:2,1,"GHIMEL. Magna opera Domini,DALETH. exquirenda omnibus, qui cupiunt ea."
la,NOVA_VULGATA,Ps,Ps,18,Ps.111,Ps 111,110,Ps.111.3,Ps 111:3,2,"HE. Decor et magnificentia opus eius,VAU. et iustitia eius manet in saeculum saeculi."
la,NOVA_VULGATA,Ps,Ps,18,Ps.111,Ps 111,110,Ps.111.4,Ps 111:4,3,"ZAIN. Memoriam fecit mirabilium suorum,HETH. misericors et miserator Dominus."
la,NOVA_VULGATA,Ps,Ps,18,Ps.111,Ps 111,110,Ps.111.5,Ps 111:5,4,TETH. Escam dedit timentibus se;IOD. memor erit in saeculum testamenti sui.
la,NOVA_VULGATA,Ps,Ps,18,Ps.111,Ps 111,110,Ps.111.6,Ps 111:6,5,"CAPH. Virtutem operum suorum annuntiavit populo suo,LAMED. ut det illis hereditatem gentium;"
la,NOVA_VULGATA,Ps,Ps,18,Ps.111,Ps 111,110,Ps.111.7,Ps 111:7,6,"MEM. opera manuum eius veritas et iudicium.NUN. Fidelia omnia mandata eius,"
la,NOVA_VULGATA,Ps,Ps,18,Ps.111,Ps 111,110,Ps.111.8,Ps 111:8,7,"SAMECH. confirmata in saeculum saeculi,AIN. facta in veritate et aequitate."
la,NOVA_VULGATA,Ps,Ps,18,Ps.111,Ps 111,110,Ps.111.9,Ps 111:9,8,"PHE. Redemptionem misit populo suo,SADE. mandavit in aeternum testamentum suum.COPH. Sanctum et terribile nomen eius."
la,NOVA_VULGATA,Ps,Ps,18,Ps.111,Ps 111,110,Ps.111.10,Ps 111:10,9,"RES. Initium sapientiae timor Domini,SIN. intellectus bonus omnibus facientibus ea;TAU. laudatio eius manet in saeculum saeculi."
la,NOVA_VULGATA,Ps,Ps,18,Ps.112,Ps 112,111,Ps.112.1,Ps 112:1,0,"ALLELUIA.ALEPH. Beatus vir, qui timet Dominum,BETH. in mandatis eius cupit nimis."
la,NOVA_VULGATA,Ps,Ps,18,Ps.112,Ps 112,111,Ps.112.2,Ps 112:2,1,"GHIMEL. Potens in terra erit semen eius,DALETH. generatio rectorum benedicetur."
la,NOVA_VULGATA,Ps,Ps,18,Ps.112,Ps 112,111,Ps.112.3,Ps 112:3,2,"HE. Gloria et divitiae in domo eius,VAU. et iustitia eius manet in saeculum saeculi."
la,NOVA_VULGATA,Ps,Ps,18,Ps.112,Ps 112,111,Ps.112.4,Ps 112:4,3,"ZAIN. Exortum est in tenebris lumen rectis,HETH. misericors et miserator et iustus."
la,NOVA_VULGATA,Ps,Ps,18,Ps.112,Ps 112,111,Ps.112.5,Ps 112:5,4,"TETH. Iucundus homo, qui miseretur et commodat,IOD. disponet res suas in iudicio,"
la,NOVA_VULGATA,Ps,Ps,18,Ps.112,Ps 112,111,Ps.112.6,Ps 112:6,5,"CAPH. quia in aeternum non commovebitur.LAMED. In memoria aeterna erit iustus,"
la,NOVA_VULGATA,Ps,Ps,18,Ps.112,Ps 112,111,Ps.112.7,Ps 112:7,6,"MEM. ab auditione mala non timebit.NUN. Paratum cor eius, sperans in Domino,"
la,NOVA_VULGATA,Ps,Ps,18,Ps.112,Ps 112,111,Ps.112.8,Ps 112:8,7,"SAMECH. confirmatum est cor eius, non timebit,AIN. donec despiciat inimicos suos."
la,NOVA_VULGATA,Ps,Ps,18,Ps.112,Ps 112,111,Ps.112.9,Ps 112:9,8,"PHE. Distribuit, dedit pauperibus;SADE. iustitia eius manet in saeculum saeculi,COPH. cornu eius exaltabitur in gloria."
la,NOVA_VULGATA,Ps,Ps,18,Ps.112,Ps 112,111,Ps.112.10,Ps 112:10,9,"RES. Peccator videbit et irascetur,SIN. dentibus suis fremet et tabescet.TAU. Desiderium peccatorum peribit."
la,NOVA_VULGATA,Ps,Ps,18,Ps.113,Ps 113,112,Ps.113.1,Ps 113:1,0,"ALLELUIA.Laudate, pueri Domini,laudate nomen Domini."
la,NOVA_VULGATA,Ps,Ps,18,Ps.113,Ps 113,112,Ps.113.2,Ps 113:2,1,Sit nomen Domini benedictumex hoc nunc et usque in saeculum.
la,NOVA_VULGATA,Ps,Ps,18,Ps.113,Ps 113,112,Ps.113.3,Ps 113:3,2,A solis ortu usque ad occasumlaudabile nomen Domini.
la,NOVA_VULGATA,Ps,Ps,18,Ps.113,Ps 113,112,Ps.113.4,Ps 113:4,3,"Excelsus super omnes gentes Dominus,super caelos gloria eius."
la,NOVA_VULGATA,Ps,Ps,18,Ps.113,Ps 113,112,Ps.113.5,Ps 113:5,4,"Quis sicut Dominus Deus noster,qui in altis habitat"
la,NOVA_VULGATA,Ps,Ps,18,Ps.113,Ps 113,112,Ps.113.6,Ps 113:6,5,"et se inclinat, ut respiciatin caelum et in terram?"
la,NOVA_VULGATA,Ps,Ps,18,Ps.113,Ps 113,112,Ps.113.7,Ps 113:7,6,"Suscitans de terra inopem,de stercore erigens pauperem,"
la,NOVA_VULGATA,Ps,Ps,18,Ps.113,Ps 113,112,Ps.113.8,Ps 113:8,7,"ut collocet eum cum principibus,cum principibus populi sui."
la,NOVA_VULGATA,Ps,Ps,18,Ps.113,Ps 113,112,Ps.113.9,Ps 113:9,8,"Qui habitare facit sterilem in domo,matrem filiorum laetantem."
la,NOVA_VULGATA,Ps,Ps,18,Ps.114,Ps 114,113,Ps.114.1,Ps 114:1,0,"ALLELUIA.In exitu Israel de Aegypto,domus Iacob de populo barbaro,"
la,NOVA_VULGATA,Ps,Ps,18,Ps.114,Ps 114,113,Ps.114.2,Ps 114:2,1,"factus est Iuda sanctuarium eius,Israel potestas eius."
la,NOVA_VULGATA,Ps,Ps,18,Ps.114,Ps 114,113,Ps.114.3,Ps 114:3,2,"Mare vidit et fugit,Iordanis conversus est retrorsum;"
la,NOVA_VULGATA,Ps,Ps,18,Ps.114,Ps 114,113,Ps.114.4,Ps 114:4,3,"montes saltaverunt ut arietes,et colles sicut agni ovium. -"
la,NOVA_VULGATA,Ps,Ps,18,Ps.114,Ps 114,113,Ps.114.5,Ps 114:5,4,"Quid est tibi, mare, quod fugisti?Et tu, Iordanis, quia conversus es retrorsum?"
la,NOVA_VULGATA,Ps,Ps,18,Ps.114,Ps 114,113,Ps.114.6,Ps 114:6,5,"Montes, quod saltastis sicut arietes,et colles, sicut agni ovium?"
la,NOVA_VULGATA,Ps,Ps,18,Ps.114,Ps 114,113,Ps.114.7,Ps 114:7,6,"A facie Domini contremisce, terra,a facie Dei Iacob,"
la,NOVA_VULGATA,Ps,Ps,18,Ps.114,Ps 114,113,Ps.114.8,Ps 114:8,7,qui convertit petram in stagna aquarumet silicem in fontes aquarum.
la,NOVA_VULGATA,Ps,Ps,18,Ps.115,Ps 115,114,Ps.115.1,Ps 115:1,0,"Non nobis, Domine, non nobis,sed nomini tuo da gloriamsuper misericordia tua et veritate tua."
la,NOVA_VULGATA,Ps,Ps,18,Ps.115,Ps 115,114,Ps.115.2,Ps 115:2,1,"Quare dicent gentes: Ubi est Deus eorum? ""."
la,NOVA_VULGATA,Ps,Ps,18,Ps.115,Ps 115,114,Ps.115.3,Ps 115:3,2,"Deus autem noster in caelo;omnia, quaecumque voluit, fecit."
la,NOVA_VULGATA,Ps,Ps,18,Ps.115,Ps 115,114,Ps.115.4,Ps 115:4,3,"Simulacra gentium argentum et aurum,opera manuum hominum."
la,NOVA_VULGATA,Ps,Ps,18,Ps.115,Ps 115,114,Ps.115.5,Ps 115:5,4,"Os habent et non loquentur,oculos habent et non videbunt."
la,NOVA_VULGATA,Ps,Ps,18,Ps.115,Ps 115,114,Ps.115.6,Ps 115:6,5,"Aures habent et non audient,nares habent et non odorabunt."
la,NOVA_VULGATA,Ps,Ps,18,Ps.115,Ps 115,114,Ps.115.7,Ps 115:7,6,"Manus habent et non palpabunt,pedes habent et non ambulabunt;non clamabunt in gutture suo."
la,NOVA_VULGATA,Ps,Ps,18,Ps.115,Ps 115,114,Ps.115.8,Ps 115:8,7,"Similes illis erunt, qui faciunt ea,et omnes, qui confidunt in eis."
la,NOVA_VULGATA,Ps,Ps,18,Ps.115,Ps 115,114,Ps.115.9,Ps 115:9,8,Domus Israel speravit in Domino:adiutorium eorum et scutum eorum est.
la,NOVA_VULGATA,Ps,Ps,18,Ps.115,Ps 115,114,Ps.115.10,Ps 115:10,9,Domus Aaron speravit in Domino:adiutorium eorum et scutum eorum est.
la,NOVA_VULGATA,Ps,Ps,18,Ps.115,Ps 115,114,Ps.115.11,Ps 115:11,10,"Qui timent Dominum, speraverunt in Domino:adiutorium eorum et scutum eorum est."
la,NOVA_VULGATA,Ps,Ps,18,Ps.115,Ps 115,114,Ps.115.12,Ps 115:12,11,"Dominus memor fuit nostriet benedicet nobis:benedicet domui Israel,benedicet domui Aaron,"
la,NOVA_VULGATA,Ps,Ps,18,Ps.115,Ps 115,114,Ps.115.13,Ps 115:13,12,"benedicet omnibus, qui timent Dominum,pusillis cum maioribus."
la,NOVA_VULGATA,Ps,Ps,18,Ps.115,Ps 115,114,Ps.115.14,Ps 115:14,13,"Adiciat Dominus super vos,super vos et super filios vestros."
la,NOVA_VULGATA,Ps,Ps,18,Ps.115,Ps 115,114,Ps.115.15,Ps 115:15,14,"Benedicti vos a Domino,qui fecit caelum et terram."
la,NOVA_VULGATA,Ps,Ps,18,Ps.115,Ps 115,114,Ps.115.16,Ps 115:16,15,"Caeli, caeli sunt Domino,terram autem dedit filiis hominum."
la,NOVA_VULGATA,Ps,Ps,18,Ps.115,Ps 115,114,Ps.115.17,Ps 115:17,16,"Non mortui laudabunt te, Domine,neque omnes, qui descendunt in silentium,"
la,NOVA_VULGATA,Ps,Ps,18,Ps.115,Ps 115,114,Ps.115.18,Ps 115:18,17,"sed nos, qui vivimus, benedicimus Dominoex hoc nunc et usque in saeculum."
la,NOVA_VULGATA,Ps,Ps,18,Ps.116,Ps 116,115,Ps.116.1,Ps 116:1,0,"ALLELUIA.Dilexi, quoniam exaudit Dominusvocem deprecationis meae."
la,NOVA_VULGATA,Ps,Ps,18,Ps.116,Ps 116,115,Ps.116.2,Ps 116:2,1,"Quia inclinavit aurem suam mihi,cum in diebus meis invocabam."
la,NOVA_VULGATA,Ps,Ps,18,Ps.116,Ps 116,115,Ps.116.3,Ps 116:3,2,"Circumdederunt me funes mortis,et angustiae inferni invenerunt me. Tribulationem et dolorem inveni"
la,NOVA_VULGATA,Ps,Ps,18,Ps.116,Ps 116,115,Ps.116.4,Ps 116:4,3,"et nomen Domini invocabam: O Domine, libera animam meam ""."
la,NOVA_VULGATA,Ps,Ps,18,Ps.116,Ps 116,115,Ps.116.5,Ps 116:5,4,"Misericors Dominus et iustus,et Deus noster miseretur."
la,NOVA_VULGATA,Ps,Ps,18,Ps.116,Ps 116,115,Ps.116.6,Ps 116:6,5,"Custodiens parvulos Dominus;humiliatus sum, et salvum me faciet."
la,NOVA_VULGATA,Ps,Ps,18,Ps.116,Ps 116,115,Ps.116.7,Ps 116:7,6,"Convertere, anima mea, in requiem tuam,quia Dominus benefecit tibi;"
la,NOVA_VULGATA,Ps,Ps,18,Ps.116,Ps 116,115,Ps.116.8,Ps 116:8,7,"quia eripuit animam meam de morte,oculos meos a lacrimis,pedes meos a lapsu."
la,NOVA_VULGATA,Ps,Ps,18,Ps.116,Ps 116,115,Ps.116.9,Ps 116:9,8,Ambulabo coram Dominoin regione vivorum. -
la,NOVA_VULGATA,Ps,Ps,18,Ps.116,Ps 116,115,Ps.116.10,Ps 116:10,9,"Credidi, etiam cum locutus sum: "" Ego humiliatus sum nimis ""."
la,NOVA_VULGATA,Ps,Ps,18,Ps.116,Ps 116,115,Ps.116.11,Ps 116:11,10,"Ego dixi in trepidatione mea: "" Omnis homo mendax ""."
la,NOVA_VULGATA,Ps,Ps,18,Ps.116,Ps 116,115,Ps.116.12,Ps 116:12,11,"Quid retribuam Dominopro omnibus, quae retribuit mihi?"
la,NOVA_VULGATA,Ps,Ps,18,Ps.116,Ps 116,115,Ps.116.13,Ps 116:13,12,Calicem salutaris accipiamet nomen Domini invocabo.
la,NOVA_VULGATA,Ps,Ps,18,Ps.116,Ps 116,115,Ps.116.14,Ps 116:14,13,Vota mea Domino reddamcoram omni populo eius.
la,NOVA_VULGATA,Ps,Ps,18,Ps.116,Ps 116,115,Ps.116.15,Ps 116:15,14,Pretiosa in conspectu Dominimors sanctorum eius.
la,NOVA_VULGATA,Ps,Ps,18,Ps.116,Ps 116,115,Ps.116.16,Ps 116:16,15,"O Domine, ego servus tuus,ego servus tuus et filius ancillae tuae.Dirupisti vincula mea:"
la,NOVA_VULGATA,Ps,Ps,18,Ps.116,Ps 116,115,Ps.116.17,Ps 116:17,16,tibi sacrificabo hostiam laudiset nomen Domini invocabo.
la,NOVA_VULGATA,Ps,Ps,18,Ps.116,Ps 116,115,Ps.116.18,Ps 116:18,17,Vota mea Domino reddamcoram omni populo eius
la,NOVA_VULGATA,Ps,Ps,18,Ps.116,Ps 116,115,Ps.116.19,Ps 116:19,18,"in atriis domus Domini,in medio tui, Ierusalem."
la,NOVA_VULGATA,Ps,Ps,18,Ps.117,Ps 117,116,Ps.117.1,Ps 117:1,0,"ALLELUIA.Laudate Dominum, omnes gentes;collaudate eum, omnes populi."
la,NOVA_VULGATA,Ps,Ps,18,Ps.117,Ps 117,116,Ps.117.2,Ps 117:2,1,"Quoniam confirmata est super nos misericordia eius,et veritas Domini manet in aeternum."
la,NOVA_VULGATA,Ps,Ps,18,Ps.118,Ps 118,117,Ps.118.1,Ps 118:1,0,"ALLELUIA.Confitemini Domino, quoniam bonus,quoniam in saeculum misericordia eius."
la,NOVA_VULGATA,Ps,Ps,18,Ps.118,Ps 118,117,Ps.118.2,Ps 118:2,1,"Dicat nunc Israel, quoniam bonus,quoniam in saeculum misericordia eius."
la,NOVA_VULGATA,Ps,Ps,18,Ps.118,Ps 118,117,Ps.118.3,Ps 118:3,2,"Dicat nunc domus Aaron,quoniam in saeculum misericordia eius."
la,NOVA_VULGATA,Ps,Ps,18,Ps.118,Ps 118,117,Ps.118.4,Ps 118:4,3,"Dicant nunc, qui timent Dominum,quoniam in saeculum misericordia eius."
