languageCode,code,bookOsisId,bookSblId,bookOrderIndex,chapterOsisId,chapterSblId,chapterOrderIndex,verseOsisId,verseSblId,verseOrderIndex,text
la,NOVA_VULGATA,Zeph,Zeph,35,Zeph.1,Zeph 1,0,Zeph.1.1,Zeph 1:1,0,"Verbum Domini, quod factum est ad Sophoniam filium Chusi filii Godoliae filii Amariae filii Ezechiae, in diebus Iosiae filii Amon regis Iudae."
la,NOVA_VULGATA,Zeph,Zeph,35,Zeph.1,Zeph 1,0,Zeph.1.2,Zeph 1:2,1,""" Auferens auferam omniaa facie terrae,dicit Dominus,"
la,NOVA_VULGATA,Zeph,Zeph,35,Zeph.1,Zeph 1,0,Zeph.1.3,Zeph 1:3,2,"auferam hominem et pecus,auferam volatile caeliet pisces maris.Et ruinae impiorum erunt;et disperdam homines a facie terrae,dicit Dominus."
la,NOVA_VULGATA,Zeph,Zeph,35,Zeph.1,Zeph 1,0,Zeph.1.4,Zeph 1:4,3,Et extendam manum meam super Iudamet super omnes habitantes Ierusalem;et disperdam de loco hoc reliquias Baalet nomina aedituorum cum sacerdotibus
la,NOVA_VULGATA,Zeph,Zeph,35,Zeph.1,Zeph 1,0,Zeph.1.5,Zeph 1:5,4,"et eos, qui adorant super tectamilitiam caeliet adorant et iurant in Dominoet iurant in Melchom,"
la,NOVA_VULGATA,Zeph,Zeph,35,Zeph.1,Zeph 1,0,Zeph.1.6,Zeph 1:6,5,"et qui avertuntur de post tergum Domini,et qui non quaerunt Dominum nec investigant eum ""."
la,NOVA_VULGATA,Zeph,Zeph,35,Zeph.1,Zeph 1,0,Zeph.1.7,Zeph 1:7,6,"Silete a facie Domini Dei,quia iuxta est dies Domini;quia praeparavit Dominus hostiam,sanctificavit vocatos suos."
la,NOVA_VULGATA,Zeph,Zeph,35,Zeph.1,Zeph 1,0,Zeph.1.8,Zeph 1:8,7,""" Et erit in die hostiae Domini:visitabo super principeset super filios regiset super omnes, qui induti suntveste peregrina;"
la,NOVA_VULGATA,Zeph,Zeph,35,Zeph.1,Zeph 1,0,Zeph.1.9,Zeph 1:9,8,"et visitabo super omnem,qui arroganter ingreditur super limen in die illa,qui complent domum domini suiiniquitate et dolo."
la,NOVA_VULGATA,Zeph,Zeph,35,Zeph.1,Zeph 1,0,Zeph.1.10,Zeph 1:10,9,"Et erit in die illa,dicit Dominus,vox clamoris a porta Piscium,et ululatus ab urbe Nova,et contritio magna a collibus."
la,NOVA_VULGATA,Zeph,Zeph,35,Zeph.1,Zeph 1,0,Zeph.1.11,Zeph 1:11,10,"Ululate, habitatores Pilae,quia interiit omnis populus Chanaan,disperierunt omnes involuti argento."
la,NOVA_VULGATA,Zeph,Zeph,35,Zeph.1,Zeph 1,0,Zeph.1.12,Zeph 1:12,11,"Et erit in tempore illo:scrutabor Ierusalem in lucerniset visitabo super virosdefixos in faecibus suis,qui dicunt in cordibus suis:Non faciet bene Dominuset non faciet male""."
la,NOVA_VULGATA,Zeph,Zeph,35,Zeph.1,Zeph 1,0,Zeph.1.13,Zeph 1:13,12,"Et erunt opes eorum in direptionem,et domus eorum in desertum;et aedificabunt domoset non habitabunt,et plantabunt vineaset non bibent vinum earum ""."
la,NOVA_VULGATA,Zeph,Zeph,35,Zeph.1,Zeph 1,0,Zeph.1.14,Zeph 1:14,13,"Iuxta est dies Domini magnus,iuxta et velox nimis;vox diei Domini amara,tribulabitur ibi fortis."
la,NOVA_VULGATA,Zeph,Zeph,35,Zeph.1,Zeph 1,0,Zeph.1.15,Zeph 1:15,14,"Dies irae dies illa,dies tribulationis et angustiae,dies vastitatis et desolationis,dies tenebrarum et caliginis,dies nebulae et turbinis,"
la,NOVA_VULGATA,Zeph,Zeph,35,Zeph.1,Zeph 1,0,Zeph.1.16,Zeph 1:16,15,dies tubae et clangorissuper civitates munitaset super angulos excelsos.
la,NOVA_VULGATA,Zeph,Zeph,35,Zeph.1,Zeph 1,0,Zeph.1.17,Zeph 1:17,16,"Et tribulabo homines,et ambulabunt ut caeci,quia Domino peccaverunt;et effundetur sanguis eorum sicut humus,et viscera eorum sicut stercora."
la,NOVA_VULGATA,Zeph,Zeph,35,Zeph.1,Zeph 1,0,Zeph.1.18,Zeph 1:18,17,"Sed et argentum eorum et aurum eorumnon poterit liberare eosin die irae Domini;in igne zeli eiusdevorabitur omnis terra,quia consummationem cum festinatione facietcunctis habitantibus terram."
la,NOVA_VULGATA,Zeph,Zeph,35,Zeph.2,Zeph 2,1,Zeph.2.1,Zeph 2:1,0,"Convenite, congregamini,gens non amabilis,"
la,NOVA_VULGATA,Zeph,Zeph,35,Zeph.2,Zeph 2,1,Zeph.2.2,Zeph 2:2,1,"priusquam dispergaminiquasi pulvis transeuntes,antequam veniat super vosira furoris Domini,antequam veniat super vosdies furoris Domini."
la,NOVA_VULGATA,Zeph,Zeph,35,Zeph.2,Zeph 2,1,Zeph.2.3,Zeph 2:3,2,"Quaerite Dominum,omnes mansueti terrae,qui iudicium eius estis operati;quaerite iustitiam, quaerite mansuetudinem,si quomodo abscondaminiin die furoris Domini."
la,NOVA_VULGATA,Zeph,Zeph,35,Zeph.2,Zeph 2,1,Zeph.2.4,Zeph 2:4,3,"Quia Gaza deserta erit,et Ascalon desolata,Azotum in meridie eicient,et Accaron eradicabitur."
la,NOVA_VULGATA,Zeph,Zeph,35,Zeph.2,Zeph 2,1,Zeph.2.5,Zeph 2:5,4,"Vae, qui habitatis funiculum maris, gens Cretensium!Verbum Domini super vos,Chanaan, terra Philisthinorum: Disperdam te,ita ut non sit inhabitator ""."
la,NOVA_VULGATA,Zeph,Zeph,35,Zeph.2,Zeph 2,1,Zeph.2.6,Zeph 2:6,5,Et erit funiculus marisrequies pastorum et caulae pecorum.
la,NOVA_VULGATA,Zeph,Zeph,35,Zeph.2,Zeph 2,1,Zeph.2.7,Zeph 2:7,6,"Et erit funiculus marisreliquiis domus Iudae:ibi pascentur,in domibus Ascalonis ad vesperam requiescent,quia visitabit eos Dominus Deus eorumet convertet sortem eorum."
la,NOVA_VULGATA,Zeph,Zeph,35,Zeph.2,Zeph 2,1,Zeph.2.8,Zeph 2:8,7,""" Audivi opprobrium Moabet blasphemias filiorum Ammon, qui exprobraverunt populo meoet magnificati sunt super terminos eorum."
la,NOVA_VULGATA,Zeph,Zeph,35,Zeph.2,Zeph 2,1,Zeph.2.9,Zeph 2:9,8,"Propterea vivo ego,dicit Dominus exercituum, Deus Israel,quia Moab ut Sodoma erit,et filii Ammon quasi Gomorra,possessio spinarum et acervi saliset desertum usque in aeternum;reliquiae populi mei diripient eos,et residui gentis meae possidebunt illos ""."
la,NOVA_VULGATA,Zeph,Zeph,35,Zeph.2,Zeph 2,1,Zeph.2.10,Zeph 2:10,9,"Hoc eis eveniet pro superbia sua, quia blasphemaverunt et magnificati suntsuper populum Domini exercituum."
la,NOVA_VULGATA,Zeph,Zeph,35,Zeph.2,Zeph 2,1,Zeph.2.11,Zeph 2:11,10,"Horribilis Dominus super eos,quia attenuabit omnes deos terrae;et adorabunt eum, singuli de loco suo,omnes insulae gentium."
la,NOVA_VULGATA,Zeph,Zeph,35,Zeph.2,Zeph 2,1,Zeph.2.12,Zeph 2:12,11,""" Sed et vos, Aethiopes,interfecti gladio meo eritis ""."
la,NOVA_VULGATA,Zeph,Zeph,35,Zeph.2,Zeph 2,1,Zeph.2.13,Zeph 2:13,12,"Et extendet manum suam super aquilonemet perdet Assyriam;et ponet Nineven in solitudinemet in aridam, quasi desertum."
la,NOVA_VULGATA,Zeph,Zeph,35,Zeph.2,Zeph 2,1,Zeph.2.14,Zeph 2:14,13,"Et accubabunt in medio eius greges,omne genus animalium.Et onocrotalus et ululain capitellis eius morabuntur;vox cantat in fenestra,corvus in limine,quoniam tabulatum cedrinum sublatum est."
la,NOVA_VULGATA,Zeph,Zeph,35,Zeph.2,Zeph 2,1,Zeph.2.15,Zeph 2:15,14,"Haec est civitas exsultans,habitans in confidentia,quae dicebat in corde suo: Ego sum, et extra me non est alia amplius! "".Quomodo facta est in desertum,cubile bestiae?Omnis, qui transit per eam,sibilabit et movebit manum suam."
la,NOVA_VULGATA,Zeph,Zeph,35,Zeph.3,Zeph 3,2,Zeph.3.1,Zeph 3:1,0,"Vae, provocatrix et inquinata,civitas violenta!"
la,NOVA_VULGATA,Zeph,Zeph,35,Zeph.3,Zeph 3,2,Zeph.3.2,Zeph 3:2,1,"Non audivit vocem,non suscepit disciplinam;in Domino non est confisa,ad Deum suum non appropiavit."
la,NOVA_VULGATA,Zeph,Zeph,35,Zeph.3,Zeph 3,2,Zeph.3.3,Zeph 3:3,2,"Principes eius in medio eiusleones rugientes;iudices eius lupi deserti,ossa non relinquunt in mane."
la,NOVA_VULGATA,Zeph,Zeph,35,Zeph.3,Zeph 3,2,Zeph.3.4,Zeph 3:4,3,"Prophetae eius vaniloqui,viri fallaces;sacerdotes eius polluerunt sanctum, iniuste egerunt contra legem."
la,NOVA_VULGATA,Zeph,Zeph,35,Zeph.3,Zeph 3,2,Zeph.3.5,Zeph 3:5,4,"Dominus iustus in medio eiusnon faciet iniquitatem;mane, mane iudicium suum dabit, sicut lucem, quae non deficit;nescivit autem iniquus confusionem."
la,NOVA_VULGATA,Zeph,Zeph,35,Zeph.3,Zeph 3,2,Zeph.3.6,Zeph 3:6,5,""" Disperdidi gentes,dissipati sunt anguli earum;desertas feci vias eorum,dum non est qui transeat;desolatae sunt civitates eorum,non remanente viro nec ullo habitatore."
la,NOVA_VULGATA,Zeph,Zeph,35,Zeph.3,Zeph 3,2,Zeph.3.7,Zeph 3:7,6,"Dixi: Nunc timebis me,suscipies disciplinam!Et non evanescent ab oculis eius omnia, in quibus visitavi eam.Verumtamen acceleraverunt corrumpereomnes actiones suas."
la,NOVA_VULGATA,Zeph,Zeph,35,Zeph.3,Zeph 3,2,Zeph.3.8,Zeph 3:8,7,"Quapropter exspecta me,dicit Dominus,in die qua surgam ut testis;quia iudicium meum, ut congregem genteset colligam regna,ut effundam super eas indignationem meam,omnem iram furoris mei;in igne enim zeli meidevorabitur omnis terra."
la,NOVA_VULGATA,Zeph,Zeph,35,Zeph.3,Zeph 3,2,Zeph.3.9,Zeph 3:9,8,"Quia tunc reddam populislabium purum,ut invocent omnes in nomine Dominiet serviant ei umero uno."
la,NOVA_VULGATA,Zeph,Zeph,35,Zeph.3,Zeph 3,2,Zeph.3.10,Zeph 3:10,9,"Ultra flumina Aethiopiae,inde supplices mei,filii dispersorum meorumdeferent munus mihi."
la,NOVA_VULGATA,Zeph,Zeph,35,Zeph.3,Zeph 3,2,Zeph.3.11,Zeph 3:11,10,"In die illa non confunderissuper cunctis actionibus tuis,quibus praevaricata es in me;quia tunc auferam de medio tuimagniloquos superbos tuos,et non adicies exaltari ampliusin monte sancto meo."
la,NOVA_VULGATA,Zeph,Zeph,35,Zeph.3,Zeph 3,2,Zeph.3.12,Zeph 3:12,11,"Et derelinquam in medio tuipopulum pauperem et egenum "".Et sperabunt in nomine Dominireliquiae Israel."
la,NOVA_VULGATA,Zeph,Zeph,35,Zeph.3,Zeph 3,2,Zeph.3.13,Zeph 3:13,12,"Non facient iniquitatemnec loquentur mendacium;et non invenietur in ore eorumlingua dolosa,quoniam ipsi pascentur et accubabunt,et non erit qui exterreat."
la,NOVA_VULGATA,Zeph,Zeph,35,Zeph.3,Zeph 3,2,Zeph.3.14,Zeph 3:14,13,"Lauda, filia Sion;iubilate, Israel!Laetare et exsulta in omni corde,filia Ierusalem!"
la,NOVA_VULGATA,Zeph,Zeph,35,Zeph.3,Zeph 3,2,Zeph.3.15,Zeph 3:15,14,"Abstulit Dominus iudicium tuum,avertit inimicos tuos;rex Israel, Dominus, in medio tui,non timebis malum ultra."
la,NOVA_VULGATA,Zeph,Zeph,35,Zeph.3,Zeph 3,2,Zeph.3.16,Zeph 3:16,15,"In die illa dicetur Ierusalem: Noli timere, Sion;ne dissolvantur manus tuae!"
la,NOVA_VULGATA,Zeph,Zeph,35,Zeph.3,Zeph 3,2,Zeph.3.17,Zeph 3:17,16,"Dominus Deus tuus in medio tui,fortis ipse salvabit;gaudebit super te in laetitia,commotus in dilectione sua;exsultabit super te in laude"
la,NOVA_VULGATA,Zeph,Zeph,35,Zeph.3,Zeph 3,2,Zeph.3.18,Zeph 3:18,17,"sicut in die conventus "". Auferam a te calamitatem,ut non ultra habeas super ea opprobrium."
la,NOVA_VULGATA,Zeph,Zeph,35,Zeph.3,Zeph 3,2,Zeph.3.19,Zeph 3:19,18,"Ecce ego interficiamomnes, qui afflixerunt tein tempore illo;et salvabo claudicantemet eam, quae eiecta fuerat, congregabo;et ponam eos in laudem et in nomen in omni terra confusionis eorum,"
la,NOVA_VULGATA,Zeph,Zeph,35,Zeph.3,Zeph 3,2,Zeph.3.20,Zeph 3:20,19,"in tempore illo, quo adducam vos,et in tempore, quo congregabo vos. Dabo enim vos in nomen et in laudemomnibus populis terrae,cum convertero sortem vestramcoram oculis vestris "",dicit Dominus."
