languageCode,code,bookOsisId,bookSblId,bookOrderIndex,chapterOsisId,chapterSblId,chapterOrderIndex,verseOsisId,verseSblId,verseOrderIndex,text
la,NOVA_VULGATA,Acts,Acts,43,Acts.16,Acts 16,15,Acts.16.5,Acts 16:5,4,Ecclesiae quidem confirmabantur fide et abundabant numero cotidie.
la,NOVA_VULGATA,Acts,Acts,43,Acts.16,Acts 16,15,Acts.16.6,Acts 16:6,5,"Transierunt autem Phrygiam et Galatiae regionem, vetati a Sancto Spiritu loqui verbum in Asia;"
la,NOVA_VULGATA,Acts,Acts,43,Acts.16,Acts 16,15,Acts.16.7,Acts 16:7,6,"cum venissent autem circa Mysiam, tentabant ire Bithyniam, et non permisit eos Spiritus Iesu;"
la,NOVA_VULGATA,Acts,Acts,43,Acts.16,Acts 16,15,Acts.16.8,Acts 16:8,7,"cum autem praeterissent Mysiam, descenderunt Troadem."
la,NOVA_VULGATA,Acts,Acts,43,Acts.16,Acts 16,15,Acts.16.9,Acts 16:9,8,"Et visio per noctem Paulo ostensa est: vir Macedo quidam erat stans et deprecans eum et dicens: "" Transiens in Macedoniam, adiuva nos! ""."
la,NOVA_VULGATA,Acts,Acts,43,Acts.16,Acts 16,15,Acts.16.10,Acts 16:10,9,"Ut autem visum vidit, statim quaesivimus proficisci in Macedoniam, certi facti quia vocasset nos Deus evangelizare eis."
la,NOVA_VULGATA,Acts,Acts,43,Acts.16,Acts 16,15,Acts.16.11,Acts 16:11,10,Navigantes autem a Troade recto cursu venimus Samothraciam et sequenti die Neapolim
la,NOVA_VULGATA,Acts,Acts,43,Acts.16,Acts 16,15,Acts.16.12,Acts 16:12,11,"et inde Philippos, quae est prima partis Macedoniae civitas, colonia. Eramus autem in hac urbe diebus aliquot commorantes."
la,NOVA_VULGATA,Acts,Acts,43,Acts.16,Acts 16,15,Acts.16.13,Acts 16:13,12,"Die autem sabbatorum egressi sumus foras portam iuxta flumen, ubi putabamus orationem esse, et sedentes loquebamur mulieribus, quae convenerant."
la,NOVA_VULGATA,Acts,Acts,43,Acts.16,Acts 16,15,Acts.16.14,Acts 16:14,13,"Et quaedam mulier nomine Lydia, purpuraria civitatis Thyatirenorum colens Deum, audiebat, cuius Dominus aperuit cor intendere his, quae dicebantur a Paulo."
la,NOVA_VULGATA,Acts,Acts,43,Acts.16,Acts 16,15,Acts.16.15,Acts 16:15,14,"Cum autem baptizata esset et domus eius, deprecata est dicens: "" Si iudicastis me fidelem Domino esse, introite in domum meam et manete ""; et coegit nos."
la,NOVA_VULGATA,Acts,Acts,43,Acts.16,Acts 16,15,Acts.16.16,Acts 16:16,15,"Factum est autem, euntibus nobis ad orationem, puellam quandam habentem spiritum pythonem obviare nobis, quae quaestum magnum praestabat dominis suis divinando."
la,NOVA_VULGATA,Acts,Acts,43,Acts.16,Acts 16,15,Acts.16.17,Acts 16:17,16,"Haec subsecuta Paulum et nos clamabat dicens: "" Isti homines servi Dei Altissimi sunt, qui annuntiant vobis viam salutis ""."
la,NOVA_VULGATA,Acts,Acts,43,Acts.16,Acts 16,15,Acts.16.18,Acts 16:18,17,"Hoc autem faciebat multis diebus. Dolens autem Paulus et conversus spiritui dixit: "" Praecipio tibi in nomine Iesu Christi exire ab ea ""; et exiit eadem hora."
la,NOVA_VULGATA,Acts,Acts,43,Acts.16,Acts 16,15,Acts.16.19,Acts 16:19,18,"Videntes autem domini eius quia exivit spes quaestus eorum, apprehendentes Paulum et Silam traxerunt in forum ad principes;"
la,NOVA_VULGATA,Acts,Acts,43,Acts.16,Acts 16,15,Acts.16.20,Acts 16:20,19,"et producentes eos magistratibus dixerunt: "" Hi homines conturbant civitatem nostram, cum sint Iudaei,"
la,NOVA_VULGATA,Acts,Acts,43,Acts.16,Acts 16,15,Acts.16.21,Acts 16:21,20,"et annuntiant mores, quos non licet nobis suscipere neque facere, cum simus Romani ""."
la,NOVA_VULGATA,Acts,Acts,43,Acts.16,Acts 16,15,Acts.16.22,Acts 16:22,21,"Et concurrit plebs adversus eos; et magistratus, scissis tunicis eorum, iusserunt virgis caedi"
la,NOVA_VULGATA,Acts,Acts,43,Acts.16,Acts 16,15,Acts.16.23,Acts 16:23,22,"et, cum multas plagas eis imposuissent, miserunt eos in carcerem, praecipientes custodi, ut caute custodiret eos;"
la,NOVA_VULGATA,Acts,Acts,43,Acts.16,Acts 16,15,Acts.16.24,Acts 16:24,23,"qui cum tale praeceptum accepisset, misit eos in interiorem carcerem et pedes eorum strinxit in ligno."
la,NOVA_VULGATA,Acts,Acts,43,Acts.16,Acts 16,15,Acts.16.25,Acts 16:25,24,"Media autem nocte, Paulus et Silas orantes laudabant Deum, et audiebant eos, qui in custodia erant;"
la,NOVA_VULGATA,Acts,Acts,43,Acts.16,Acts 16,15,Acts.16.26,Acts 16:26,25,"subito vero terraemotus factus est magnus, ita ut moverentur fundamenta carceris, et aperta sunt statim ostia omnia, et universorum vincula soluta sunt."
la,NOVA_VULGATA,Acts,Acts,43,Acts.16,Acts 16,15,Acts.16.27,Acts 16:27,26,"Expergefactus autem custos carceris et videns apertas ianuas carceris, evaginato gladio volebat se interficere, aestimans fugisse vinctos."
la,NOVA_VULGATA,Acts,Acts,43,Acts.16,Acts 16,15,Acts.16.28,Acts 16:28,27,"Clamavit autem Paulus magna voce dicens: "" Nihil feceris tibi mali; universi enim hic sumus ""."
la,NOVA_VULGATA,Acts,Acts,43,Acts.16,Acts 16,15,Acts.16.29,Acts 16:29,28,"Petitoque lumine, intro cucurrit et tremefactus procidit Paulo et Silae;"
la,NOVA_VULGATA,Acts,Acts,43,Acts.16,Acts 16,15,Acts.16.30,Acts 16:30,29,"et producens eos foras ait: "" Domini, quid me oportet facere, ut salvus fiam? ""."
la,NOVA_VULGATA,Acts,Acts,43,Acts.16,Acts 16,15,Acts.16.31,Acts 16:31,30,"At illi dixerunt: "" Crede in Domino Iesu et salvus eris tu et domus tua."
la,NOVA_VULGATA,Acts,Acts,43,Acts.16,Acts 16,15,Acts.16.32,Acts 16:32,31,"Et locuti sunt ei verbum Domini cum omnibus, qui erant in domo eius."
la,NOVA_VULGATA,Acts,Acts,43,Acts.16,Acts 16,15,Acts.16.33,Acts 16:33,32,"Et tollens eos in illa hora noctis lavit eos a plagis, et baptizatus est ipse et omnes eius continuo;"
la,NOVA_VULGATA,Acts,Acts,43,Acts.16,Acts 16,15,Acts.16.34,Acts 16:34,33,"cumque perduxisset eos in domum, apposuit mensam et laetatus est cum omni domo sua credens Deo."
la,NOVA_VULGATA,Acts,Acts,43,Acts.16,Acts 16,15,Acts.16.35,Acts 16:35,34,"Et cum dies factus esset, miserunt magistratus lictores dicentes: "" Dimitte homines illos! ""."
la,NOVA_VULGATA,Acts,Acts,43,Acts.16,Acts 16,15,Acts.16.36,Acts 16:36,35,"Nuntiavit autem custos carceris verba haec Paulo: "" Miserunt magistratus, ut dimittamini; nunc igitur exeuntes ite in pace ""."
la,NOVA_VULGATA,Acts,Acts,43,Acts.16,Acts 16,15,Acts.16.37,Acts 16:37,36,"Paulus autem dixit eis: "" Caesos nos publice, indemnatos, cum homines Romani essemus, miserunt in carcerem; et nunc occulte nos eiciunt? Non ita, sed veniant et ipsi nos educant ""."
la,NOVA_VULGATA,Acts,Acts,43,Acts.16,Acts 16,15,Acts.16.38,Acts 16:38,37,Nuntiaverunt autem magistratibus lictores verba haec. Timueruntque audito quod Romani essent;
la,NOVA_VULGATA,Acts,Acts,43,Acts.16,Acts 16,15,Acts.16.39,Acts 16:39,38,"et venientes deprecati sunt eos et educentes rogabant, ut egrederentur urbem."
la,NOVA_VULGATA,Acts,Acts,43,Acts.16,Acts 16,15,Acts.16.40,Acts 16:40,39,"Exeuntes autem de carcere introierunt ad Lydiam et, visis fratribus, consolati sunt eos et profecti sunt."
la,NOVA_VULGATA,Acts,Acts,43,Acts.17,Acts 17,16,Acts.17.1,Acts 17:1,0,"Cum autem perambulassent Amphipolim et Apolloniam, venerunt Thessalonicam, ubi erat synagoga Iudaeorum."
la,NOVA_VULGATA,Acts,Acts,43,Acts.17,Acts 17,16,Acts.17.2,Acts 17:2,1,Secundum consuetudinem autem suam Paulus introivit ad eos et per sabbata tria disserebat eis de Scripturis
la,NOVA_VULGATA,Acts,Acts,43,Acts.17,Acts 17,16,Acts.17.3,Acts 17:3,2,"adaperiens et comprobans quia Christum oportebat pati et resurgere a mortuis, et: "" Hic est Christus, Iesus, quem ego annuntio vobis ""."
la,NOVA_VULGATA,Acts,Acts,43,Acts.17,Acts 17,16,Acts.17.4,Acts 17:4,3,Et quidam ex eis crediderunt et adiuncti sunt Paulo et Silae et de colentibus Graecis multitudo magna et mulieres nobiles non paucae.
la,NOVA_VULGATA,Acts,Acts,43,Acts.17,Acts 17,16,Acts.17.5,Acts 17:5,4,Zelantes autem Iudaei assumentesque de foro viros quosdam malos et turba facta concitaverunt civitatem; et assistentes domui Iasonis quaerebant eos producere in populum.
la,NOVA_VULGATA,Acts,Acts,43,Acts.17,Acts 17,16,Acts.17.6,Acts 17:6,5,"Et cum non invenissent eos, trahebant Iasonem et quosdam fratres ad politarchas clamantes: "" Qui orbem concitaverunt, isti et huc venerunt,"
la,NOVA_VULGATA,Acts,Acts,43,Acts.17,Acts 17,16,Acts.17.7,Acts 17:7,6,"quos suscepit Iason; et hi omnes contra decreta Caesaris faciunt, regem alium dicentes esse, Iesum ""."
la,NOVA_VULGATA,Acts,Acts,43,Acts.17,Acts 17,16,Acts.17.8,Acts 17:8,7,Concitaverunt autem plebem et politarchas audientes haec;
la,NOVA_VULGATA,Acts,Acts,43,Acts.17,Acts 17,16,Acts.17.9,Acts 17:9,8,"et accepto satis ab Iasone et a ceteris, dimiserunt eos."
la,NOVA_VULGATA,Acts,Acts,43,Acts.17,Acts 17,16,Acts.17.10,Acts 17:10,9,"Fratres vero confestim per noctem dimiserunt Paulum et Silam in Beroeam; qui cum advenissent, in synagogam Iudaeorum introierunt."
la,NOVA_VULGATA,Acts,Acts,43,Acts.17,Acts 17,16,Acts.17.11,Acts 17:11,10,"Hi autem erant nobiliores eorum, qui sunt Thessalonicae, qui susceperunt verbum cum omni aviditate, cotidie scrutantes Scripturas, si haec ita se haberent."
la,NOVA_VULGATA,Acts,Acts,43,Acts.17,Acts 17,16,Acts.17.12,Acts 17:12,11,Et multi quidem crediderunt ex eis et Graecarum mulierum honestarum et virorum non pauci.
la,NOVA_VULGATA,Acts,Acts,43,Acts.17,Acts 17,16,Acts.17.13,Acts 17:13,12,"Cum autem cognovissent in Thessalonica Iudaei quia et Beroeae annuntiatum est a Paulo verbum Dei, venerunt et illuc commoventes et turbantes multitudinem."
la,NOVA_VULGATA,Acts,Acts,43,Acts.17,Acts 17,16,Acts.17.14,Acts 17:14,13,"Statimque tunc Paulum dimiserunt fratres, ut iret usque ad mare; Silas autem et Timotheus remanserunt ibi."
la,NOVA_VULGATA,Acts,Acts,43,Acts.17,Acts 17,16,Acts.17.15,Acts 17:15,14,"Qui autem deducebant Paulum, perduxerunt usque Athenas; et accepto mandato ad Silam et Timotheum, ut quam celerrime venirent ad illum, profecti sunt."
la,NOVA_VULGATA,Acts,Acts,43,Acts.17,Acts 17,16,Acts.17.16,Acts 17:16,15,"Paulus autem cum Athenis eos exspectaret, irritabatur spiritus eius in ipso videns idololatriae deditam civitatem."
la,NOVA_VULGATA,Acts,Acts,43,Acts.17,Acts 17,16,Acts.17.17,Acts 17:17,16,"Disputabat igitur in synagoga cum Iudaeis et colentibus et in foro per omnes dies ad eos, qui aderant."
la,NOVA_VULGATA,Acts,Acts,43,Acts.17,Acts 17,16,Acts.17.18,Acts 17:18,17,"Quidam autem ex Epicureis et Stoicis philosophi disserebant cum eo. Et quidam dicebant: "" Quid vult seminiverbius hic dicere? ""; alii vero: "" Novorum daemoniorum videtur annuntiator esse "", quia Iesum et resurrectionem evangelizabat."
la,NOVA_VULGATA,Acts,Acts,43,Acts.17,Acts 17,16,Acts.17.19,Acts 17:19,18,"Et apprehensum eum ad Areopagum duxerunt dicentes: "" Possumus scire quae est haec nova, quae a te dicitur, doctrina?"
la,NOVA_VULGATA,Acts,Acts,43,Acts.17,Acts 17,16,Acts.17.20,Acts 17:20,19,"Mira enim quaedam infers auribus nostris; volumus ergo scire quidnam velint haec esse ""."
la,NOVA_VULGATA,Acts,Acts,43,Acts.17,Acts 17,16,Acts.17.21,Acts 17:21,20,Athenienses autem omnes et advenae hospites ad nihil aliud vacabant nisi aut dicere aut audire aliquid novi.
la,NOVA_VULGATA,Acts,Acts,43,Acts.17,Acts 17,16,Acts.17.22,Acts 17:22,21,"Stans autem Paulus in medio Areopagi ait: "" Viri Athenienses, per omnia quasi superstitiosiores vos video;"
la,NOVA_VULGATA,Acts,Acts,43,Acts.17,Acts 17,16,Acts.17.23,Acts 17:23,22,"praeteriens enim et videns simulacra vestra inveni et aram, in qua scriptum erat: ""Ignoto deo"". Quod ergo ignorantes colitis, hoc ego annuntio vobis."
la,NOVA_VULGATA,Acts,Acts,43,Acts.17,Acts 17,16,Acts.17.24,Acts 17:24,23,"Deus, qui fecit mundum et omnia, quae in eo sunt, hic, caeli et terrae cum sit Dominus, non in manufactis templis inhabitat"
la,NOVA_VULGATA,Acts,Acts,43,Acts.17,Acts 17,16,Acts.17.25,Acts 17:25,24,"nec manibus humanis colitur indigens aliquo, cum ipse det omnibus vitam et inspirationem et omnia;"
la,NOVA_VULGATA,Acts,Acts,43,Acts.17,Acts 17,16,Acts.17.26,Acts 17:26,25,"fecitque ex uno omne genus hominum inhabitare super universam faciem terrae, definiens statuta tempora et terminos habitationis eorum,"
la,NOVA_VULGATA,Acts,Acts,43,Acts.17,Acts 17,16,Acts.17.27,Acts 17:27,26,"quaerere Deum, si forte attrectent eum et inveniant, quamvis non longe sit ab unoquoque nostrum."
la,NOVA_VULGATA,Acts,Acts,43,Acts.17,Acts 17,16,Acts.17.28,Acts 17:28,27,"In ipso enim vivimus et movemur et sumus, sicut et quidam vestrum poetarum dixerunt:Ipsius enim et genus sumus""."
la,NOVA_VULGATA,Acts,Acts,43,Acts.17,Acts 17,16,Acts.17.29,Acts 17:29,28,"Genus ergo cum simus Dei, non debemus aestimare auro aut argento aut lapidi, sculpturae artis et cogitationis hominis, divinum esse simile."
la,NOVA_VULGATA,Acts,Acts,43,Acts.17,Acts 17,16,Acts.17.30,Acts 17:30,29,"Et tempora quidem ignorantiae despiciens Deus, nunc annuntiat hominibus, ut omnes ubique paenitentiam agant,"
la,NOVA_VULGATA,Acts,Acts,43,Acts.17,Acts 17,16,Acts.17.31,Acts 17:31,30,"eo quod statuit diem, in qua iudicaturus est orbem in iustitia in viro, quem constituit, fidem praebens omnibus suscitans eum a mortuis ""."
la,NOVA_VULGATA,Acts,Acts,43,Acts.17,Acts 17,16,Acts.17.32,Acts 17:32,31,"Cum audissent autem resurrectionem mortuorum, quidam quidem irridebant, quidam vero dixerunt: "" Audiemus te de hoc iterum ""."
la,NOVA_VULGATA,Acts,Acts,43,Acts.17,Acts 17,16,Acts.17.33,Acts 17:33,32,Sic Paulus exivit de medio eorum.
la,NOVA_VULGATA,Acts,Acts,43,Acts.17,Acts 17,16,Acts.17.34,Acts 17:34,33,Quidam vero viri adhaerentes ei crediderunt; in quibus et Dionysius Areopagita et mulier nomine Damaris et alii cum eis.
la,NOVA_VULGATA,Acts,Acts,43,Acts.18,Acts 18,17,Acts.18.1,Acts 18:1,0,Post haec discedens ab Athe nis venit Corinthum.
la,NOVA_VULGATA,Acts,Acts,43,Acts.18,Acts 18,17,Acts.18.2,Acts 18:2,1,"Et in veniens quendam Iudaeum nomine Aquilam, Ponticum genere, qui nuper venerat ab Italia, et Priscillam uxorem eius, eo quod praecepisset Claudius discedere omnes Iudaeos a Roma, accessit ad eos"
la,NOVA_VULGATA,Acts,Acts,43,Acts.18,Acts 18,17,Acts.18.3,Acts 18:3,2,"et, quia eiusdem erat artis, manebat apud eos et operabatur; erant autem scenofactoriae artis."
la,NOVA_VULGATA,Acts,Acts,43,Acts.18,Acts 18,17,Acts.18.4,Acts 18:4,3,Disputabat autem in synagoga per omne sabbatum suadebatque Iudaeis et Graecis.
la,NOVA_VULGATA,Acts,Acts,43,Acts.18,Acts 18,17,Acts.18.5,Acts 18:5,4,"Cum venissent autem de Macedonia Silas et Timotheus, instabat verbo Paulus testificans Iudaeis esse Christum Iesum."
la,NOVA_VULGATA,Acts,Acts,43,Acts.18,Acts 18,17,Acts.18.6,Acts 18:6,5,"Contradicentibus autem eis et blasphemantibus, excutiens vestimenta dixit ad eos: "" Sanguis vester super caput vestrum! Mundus ego. Ex hoc nunc ad gentes vadam ""."
la,NOVA_VULGATA,Acts,Acts,43,Acts.18,Acts 18,17,Acts.18.7,Acts 18:7,6,"Et migrans inde intravit in domum cuiusdam nomine Titi Iusti, colentis Deum, cuius domus erat coniuncta synagogae."
la,NOVA_VULGATA,Acts,Acts,43,Acts.18,Acts 18,17,Acts.18.8,Acts 18:8,7,"Crispus autem archisynagogus credidit Domino cum omni domo sua, et multi Corinthiorum audientes credebant et baptizabantur."
la,NOVA_VULGATA,Acts,Acts,43,Acts.18,Acts 18,17,Acts.18.9,Acts 18:9,8,"Dixit autem Dominus nocte per visionem Paulo: "" Noli timere, sed loquere et ne taceas,"
la,NOVA_VULGATA,Acts,Acts,43,Acts.18,Acts 18,17,Acts.18.10,Acts 18:10,9,"quia ego sum tecum, et nemo apponetur tibi, ut noceat te, quoniam populus est mihi multus in hac civitate ""."
la,NOVA_VULGATA,Acts,Acts,43,Acts.18,Acts 18,17,Acts.18.11,Acts 18:11,10,Sedit autem annum et sex menses docens apud eos verbum Dei.
la,NOVA_VULGATA,Acts,Acts,43,Acts.18,Acts 18,17,Acts.18.12,Acts 18:12,11,"Gallione autem proconsule Achaiae, insurrexerunt uno animo Iudaei in Paulum et adduxerunt eum ad tribunal"
la,NOVA_VULGATA,Acts,Acts,43,Acts.18,Acts 18,17,Acts.18.13,Acts 18:13,12,"dicentes: "" Contra legem hic persuadet hominibus colere Deum ""."
la,NOVA_VULGATA,Acts,Acts,43,Acts.18,Acts 18,17,Acts.18.14,Acts 18:14,13,"Incipiente autem Paulo aperire os, dixit Gallio ad Iudaeos: "" Si quidem esset iniquum aliquid aut facinus pessimum, o Iudaei, merito vos sustinerem;"
la,NOVA_VULGATA,Acts,Acts,43,Acts.18,Acts 18,17,Acts.18.15,Acts 18:15,14,"si vero quaestiones sunt de verbo et nominibus et lege vestra, vos ipsi videritis; iudex ego horum nolo esse ""."
la,NOVA_VULGATA,Acts,Acts,43,Acts.18,Acts 18,17,Acts.18.16,Acts 18:16,15,Et minavit eos a tribunali.
la,NOVA_VULGATA,Acts,Acts,43,Acts.18,Acts 18,17,Acts.18.17,Acts 18:17,16,"Apprehendentes autem omnes Sosthenen, principem synagogae, percutiebant ante tribunal; et nihil horum Gallioni curae erat."
la,NOVA_VULGATA,Acts,Acts,43,Acts.18,Acts 18,17,Acts.18.18,Acts 18:18,17,"Paulus vero, cum adhuc sustinuisset dies multos, fratribus valefaciens navigabat Syriam, et cum eo Priscilla et Aquila, qui sibi totonderat in Cenchreis caput; habebat enim votum."
la,NOVA_VULGATA,Acts,Acts,43,Acts.18,Acts 18,17,Acts.18.19,Acts 18:19,18,"Deveneruntque Ephesum, et illos ibi reliquit; ipse vero ingressus synagogam disputabat cum Iudaeis."
la,NOVA_VULGATA,Acts,Acts,43,Acts.18,Acts 18,17,Acts.18.20,Acts 18:20,19,"Rogantibus autem eis, ut ampliore tempore maneret, non consensit,"
la,NOVA_VULGATA,Acts,Acts,43,Acts.18,Acts 18,17,Acts.18.21,Acts 18:21,20,"sed valefaciens et dicens: "" Iterum revertar ad vos Deo volente "", navigavit ab Epheso;"
la,NOVA_VULGATA,Acts,Acts,43,Acts.18,Acts 18,17,Acts.18.22,Acts 18:22,21,et descendens Caesaream ascendit et salutavit ecclesiam et descendit Antiochiam.
la,NOVA_VULGATA,Acts,Acts,43,Acts.18,Acts 18,17,Acts.18.23,Acts 18:23,22,"Et facto ibi aliquanto tempore, profectus est perambulans ex ordine Galaticam regionem et Phrygiam, confirmans omnes discipulos."
la,NOVA_VULGATA,Acts,Acts,43,Acts.18,Acts 18,17,Acts.18.24,Acts 18:24,23,"Iudaeus autem quidam Apollo nomine, Alexandrinus natione, vir eloquens, devenit Ephesum, potens in Scripturis."
la,NOVA_VULGATA,Acts,Acts,43,Acts.18,Acts 18,17,Acts.18.25,Acts 18:25,24,"Hic erat catechizatus viam Domini; et fervens spiritu loquebatur et docebat diligenter ea, quae sunt de Iesu, sciens tantum baptisma Ioannis."
la,NOVA_VULGATA,Acts,Acts,43,Acts.18,Acts 18,17,Acts.18.26,Acts 18:26,25,"Hic ergo coepit fiducialiter agere in synagoga; quem cum audissent Priscilla et Aquila, assumpserunt eum et diligentius exposuerunt ei viam Dei."
la,NOVA_VULGATA,Acts,Acts,43,Acts.18,Acts 18,17,Acts.18.27,Acts 18:27,26,"Cum autem vellet transire in Achaiam, exhortati fratres scripserunt discipulis, ut susciperent eum; qui cum venisset, contulit multum his, qui crediderant per gratiam;"
la,NOVA_VULGATA,Acts,Acts,43,Acts.18,Acts 18,17,Acts.18.28,Acts 18:28,27,"vehementer enim Iudaeos revincebat publice, ostendens per Scripturas esse Christum Iesum."
la,NOVA_VULGATA,Acts,Acts,43,Acts.19,Acts 19,18,Acts.19.1,Acts 19:1,0,"Factum est autem, cum Apollo esset Corinthi, ut Paulus, peragratis superioribus partibus, veniret Ephesum et inveniret quosdam discipulos;"
la,NOVA_VULGATA,Acts,Acts,43,Acts.19,Acts 19,18,Acts.19.2,Acts 19:2,1,"dixitque ad eos: "" Si Spiritum Sanctum accepistis credentes? "". At illi ad eum: "" Sed neque, si Spiritus Sanctus est, audivimus ""."
la,NOVA_VULGATA,Acts,Acts,43,Acts.19,Acts 19,18,Acts.19.3,Acts 19:3,2,"Ille vero ait: "" In quo ergo baptizati estis? "". Qui dixerunt: "" In Ioannis baptismate ""."
la,NOVA_VULGATA,Acts,Acts,43,Acts.19,Acts 19,18,Acts.19.4,Acts 19:4,3,"Dixit autem Paulus: "" Ioannes baptizavit baptisma paenitentiae, populo dicens in eum, qui venturus esset post ipsum ut crederent, hoc est in Iesum ""."
la,NOVA_VULGATA,Acts,Acts,43,Acts.19,Acts 19,18,Acts.19.5,Acts 19:5,4,"His auditis, baptizati sunt in nomine Domini Iesu;"
la,NOVA_VULGATA,Acts,Acts,43,Acts.19,Acts 19,18,Acts.19.6,Acts 19:6,5,"et cum imposuisset illis manus Paulus, venit Spiritus Sanctus super eos, et loquebantur linguis et prophetabant."
la,NOVA_VULGATA,Acts,Acts,43,Acts.19,Acts 19,18,Acts.19.7,Acts 19:7,6,Erant autem omnes viri fere duodecim.
la,NOVA_VULGATA,Acts,Acts,43,Acts.19,Acts 19,18,Acts.19.8,Acts 19:8,7,Introgressus autem synagogam cum fiducia loquebatur per tres menses disputans et suadens de regno Dei.
la,NOVA_VULGATA,Acts,Acts,43,Acts.19,Acts 19,18,Acts.19.9,Acts 19:9,8,"Cum autem quidam indurarentur et non crederent maledicentes viam coram multitudine, discedens ab eis segregavit discipulos, cotidie disputans in schola Tyranni."
la,NOVA_VULGATA,Acts,Acts,43,Acts.19,Acts 19,18,Acts.19.10,Acts 19:10,9,"Hoc autem factum est per biennium, ita ut omnes, qui habitabant in Asia, audirent verbum Domini, Iudaei atque Graeci."
la,NOVA_VULGATA,Acts,Acts,43,Acts.19,Acts 19,18,Acts.19.11,Acts 19:11,10,"Virtutesque non quaslibet Deus faciebat per manus Pauli,"
la,NOVA_VULGATA,Acts,Acts,43,Acts.19,Acts 19,18,Acts.19.12,Acts 19:12,11,"ita ut etiam super languidos deferrentur a corpore eius sudaria vel semicinctia, et recederent ab eis languores, et spiritus nequam egrederentur."
la,NOVA_VULGATA,Acts,Acts,43,Acts.19,Acts 19,18,Acts.19.13,Acts 19:13,12,"Tentaverunt autem quidam et de circumeuntibus Iudaeis exorcistis invocare super eos, qui habebant spiritus malos, nomen Domini Iesu dicentes: "" Adiuro vos per Iesum, quem Paulus praedicat ""."
la,NOVA_VULGATA,Acts,Acts,43,Acts.19,Acts 19,18,Acts.19.14,Acts 19:14,13,"Erant autem cuiusdam Scevae Iudaei principis sacerdotum septem filii, qui hoc faciebant."
la,NOVA_VULGATA,Acts,Acts,43,Acts.19,Acts 19,18,Acts.19.15,Acts 19:15,14,"Respondens autem spiritus nequam dixit eis: "" Iesum novi et Paulum scio; vos autem qui estis? ""."
la,NOVA_VULGATA,Acts,Acts,43,Acts.19,Acts 19,18,Acts.19.16,Acts 19:16,15,"Et insiliens homo in eos, in quo erat spiritus malus, dominatus amborum invaluit contra eos, ita ut nudi et vulnerati effugerent de domo illa."
la,NOVA_VULGATA,Acts,Acts,43,Acts.19,Acts 19,18,Acts.19.17,Acts 19:17,16,"Hoc autem notum factum est omnibus Iudaeis atque Graecis, qui habitabant Ephesi, et cecidit timor super omnes illos, et magnificabatur nomen Domini Iesu."
la,NOVA_VULGATA,Acts,Acts,43,Acts.19,Acts 19,18,Acts.19.18,Acts 19:18,17,Multique credentium veniebant confitentes et annuntiantes actus suos.
la,NOVA_VULGATA,Acts,Acts,43,Acts.19,Acts 19,18,Acts.19.19,Acts 19:19,18,"Multi autem ex his, qui fuerant curiosa sectati, conferentes libros combusserunt coram omnibus; et computaverunt pretia illorum et invenerunt argenti quinquaginta milia."
la,NOVA_VULGATA,Acts,Acts,43,Acts.19,Acts 19,18,Acts.19.20,Acts 19:20,19,Ita fortiter verbum Domini crescebat et convalescebat.
la,NOVA_VULGATA,Acts,Acts,43,Acts.19,Acts 19,18,Acts.19.21,Acts 19:21,20,"His autem expletis, proposuit Paulus in Spiritu, transita Macedonia et Achaia, ire Hierosolymam, dicens: "" Postquam fuero ibi, oportet me et Romam videre ""."
la,NOVA_VULGATA,Acts,Acts,43,Acts.19,Acts 19,18,Acts.19.22,Acts 19:22,21,"Mittens autem in Macedoniam duos ex ministrantibus sibi, Timotheum et Erastum, ipse remansit ad tempus in Asia."
la,NOVA_VULGATA,Acts,Acts,43,Acts.19,Acts 19,18,Acts.19.23,Acts 19:23,22,Facta est autem in illo tempore turbatio non minima de via.
la,NOVA_VULGATA,Acts,Acts,43,Acts.19,Acts 19,18,Acts.19.24,Acts 19:24,23,"Demetrius enim quidam nomine, argentarius, faciens aedes argenteas Dianae praestabat artificibus non modicum quaestum;"
la,NOVA_VULGATA,Acts,Acts,43,Acts.19,Acts 19,18,Acts.19.25,Acts 19:25,24,"quos congregans et eos, qui eiusmodi erant opifices, dixit: "" Viri, scitis quia de hoc artificio acquisitio est nobis;"
la,NOVA_VULGATA,Acts,Acts,43,Acts.19,Acts 19,18,Acts.19.26,Acts 19:26,25,"et videtis et auditis quia non solum Ephesi, sed paene totius Asiae Paulus hic suadens avertit multam turbam dicens quoniam non sunt dii, qui manibus fiunt."
la,NOVA_VULGATA,Acts,Acts,43,Acts.19,Acts 19,18,Acts.19.27,Acts 19:27,26,"Non solum autem haec periclitatur nobis pars in redargutionem venire, sed et magnae deae Dianae templum in nihilum reputari, et destrui incipiet maiestas eius, quam tota Asia et orbis colit ""."
la,NOVA_VULGATA,Acts,Acts,43,Acts.19,Acts 19,18,Acts.19.28,Acts 19:28,27,"His auditis, repleti sunt ira et clamabant dicentes: "" Magna Diana Ephesiorum! "";"
la,NOVA_VULGATA,Acts,Acts,43,Acts.19,Acts 19,18,Acts.19.29,Acts 19:29,28,"et impleta est civitas confusione, et impetum fecerunt uno animo in theatrum, rapto Gaio et Aristarcho Macedonibus, comitibus Pauli."
la,NOVA_VULGATA,Acts,Acts,43,Acts.19,Acts 19,18,Acts.19.30,Acts 19:30,29,"Paulo autem volente intrare in populum, non permiserunt discipuli;"
la,NOVA_VULGATA,Acts,Acts,43,Acts.19,Acts 19,18,Acts.19.31,Acts 19:31,30,"quidam autem de Asiarchis, qui erant amici eius, miserunt ad eum rogantes, ne se daret in theatrum."
la,NOVA_VULGATA,Acts,Acts,43,Acts.19,Acts 19,18,Acts.19.32,Acts 19:32,31,"Alii autem aliud clamabant; erat enim ecclesia confusa, et plures nesciebant qua ex causa convenissent."
la,NOVA_VULGATA,Acts,Acts,43,Acts.19,Acts 19,18,Acts.19.33,Acts 19:33,32,"De turba autem instruxerunt Alexandrum, propellentibus eum Iudaeis; Alexander ergo, manu silentio postulato, volebat rationem reddere populo."
la,NOVA_VULGATA,Acts,Acts,43,Acts.19,Acts 19,18,Acts.19.34,Acts 19:34,33,"Quem ut cognoverunt Iudaeum esse, vox facta est una omnium quasi per horas duas clamantium: "" Magna Diana Ephesiorum ""."
la,NOVA_VULGATA,Acts,Acts,43,Acts.19,Acts 19,18,Acts.19.35,Acts 19:35,34,"Et cum sedasset scriba turbam, dixit: "" Viri Ephesii, quis enim est hominum, qui nesciat Ephesiorum civitatem cultricem esse magnae Dianae et simulacri a Iove delapsi?"
la,NOVA_VULGATA,Acts,Acts,43,Acts.19,Acts 19,18,Acts.19.36,Acts 19:36,35,"Cum ergo his contradici non possit, oportet vos sedatos esse et nihil temere agere."
la,NOVA_VULGATA,Acts,Acts,43,Acts.19,Acts 19,18,Acts.19.37,Acts 19:37,36,Adduxistis enim homines istos neque sacrilegos neque blasphemantes deam nostram.
la,NOVA_VULGATA,Acts,Acts,43,Acts.19,Acts 19,18,Acts.19.38,Acts 19:38,37,"Quod si Demetrius et, qui cum eo sunt, artifices habent adversus aliquem causam, conventus forenses aguntur, et proconsules sunt: accusent invicem."
