languageCode,code,bookOsisId,bookSblId,bookOrderIndex,chapterOsisId,chapterSblId,chapterOrderIndex,verseOsisId,verseSblId,verseOrderIndex,text
la,NOVA_VULGATA,Acts,Acts,43,Acts.19,Acts 19,18,Acts.19.39,Acts 19:39,38,"Si quid autem ulterius quaeritis, in legitima ecclesia poterit absolvi."
la,NOVA_VULGATA,Acts,Acts,43,Acts.19,Acts 19,18,Acts.19.40,Acts 19:40,39,"Nam et periclitamur argui seditionis hodiernae, cum nullus obnoxius sit, de quo non possimus reddere rationem concursus istius "". Et cum haec dixisset, dimisit ecclesiam."
la,NOVA_VULGATA,Acts,Acts,43,Acts.20,Acts 20,19,Acts.20.1,Acts 20:1,0,"Postquam autem cessavit tumultus, accersitis Paulus discipulis et exhortatus eos, valedixit et profectus est, ut iret in Macedoniam."
la,NOVA_VULGATA,Acts,Acts,43,Acts.20,Acts 20,19,Acts.20.2,Acts 20:2,1,"Cum autem perambulasset partes illas et exhortatus eos fuisset multo sermone, venit ad Graeciam;"
la,NOVA_VULGATA,Acts,Acts,43,Acts.20,Acts 20,19,Acts.20.3,Acts 20:3,2,"cumque fecisset menses tres, factae sunt illi insidiae a Iudaeis navigaturo in Syriam, habuitque consilium, ut reverteretur per Macedoniam."
la,NOVA_VULGATA,Acts,Acts,43,Acts.20,Acts 20,19,Acts.20.4,Acts 20:4,3,"Comitabatur autem eum Sopater Pyrrhi Beroeensis, Thessalonicensium vero Aristarchus et Secundus et Gaius Derbeus et Timotheus, Asiani vero Tychicus et Trophimus."
la,NOVA_VULGATA,Acts,Acts,43,Acts.20,Acts 20,19,Acts.20.5,Acts 20:5,4,"Hi cum praecessissent, sustinebant nos Troade;"
la,NOVA_VULGATA,Acts,Acts,43,Acts.20,Acts 20,19,Acts.20.6,Acts 20:6,5,"nos vero navigavimus post dies Azymorum a Philippis et venimus ad eos Troadem in diebus quinque, ubi demorati sumus diebus septem."
la,NOVA_VULGATA,Acts,Acts,43,Acts.20,Acts 20,19,Acts.20.7,Acts 20:7,6,"In una autem sabbatorum, cum convenissemus ad frangendum panem, Paulus disputabat eis, profecturus in crastinum, protraxitque sermonem usque in mediam noctem."
la,NOVA_VULGATA,Acts,Acts,43,Acts.20,Acts 20,19,Acts.20.8,Acts 20:8,7,"Erant autem lampades copiosae in cenaculo, ubi eramus congregati;"
la,NOVA_VULGATA,Acts,Acts,43,Acts.20,Acts 20,19,Acts.20.9,Acts 20:9,8,"sedens autem quidam adulescens nomine Eutychus super fenestram, cum mergeretur somno gravi, disputante diutius Paulo, eductus somno cecidit de tertio cenaculo deorsum et sublatus est mortuus."
la,NOVA_VULGATA,Acts,Acts,43,Acts.20,Acts 20,19,Acts.20.10,Acts 20:10,9,"Cum descendisset autem Paulus, incubuit super eum et complexus dixit: "" Nolite turbari, anima enim ipsius in eo est! ""."
la,NOVA_VULGATA,Acts,Acts,43,Acts.20,Acts 20,19,Acts.20.11,Acts 20:11,10,"Ascendens autem frangensque panem et gustans satisque allocutus usque in lucem, sic profectus est."
la,NOVA_VULGATA,Acts,Acts,43,Acts.20,Acts 20,19,Acts.20.12,Acts 20:12,11,Adduxerunt autem puerum viventem et consolati sunt non minime.
la,NOVA_VULGATA,Acts,Acts,43,Acts.20,Acts 20,19,Acts.20.13,Acts 20:13,12,"Nos autem praecedentes navi enavigavimus in Asson, inde suscepturi Paulum; sic enim disposuerat volens ipse per terram iter facere."
la,NOVA_VULGATA,Acts,Acts,43,Acts.20,Acts 20,19,Acts.20.14,Acts 20:14,13,"Cum autem convenisset nos in Asson, assumpto eo, venimus Mitylenen"
la,NOVA_VULGATA,Acts,Acts,43,Acts.20,Acts 20,19,Acts.20.15,Acts 20:15,14,et inde navigantes sequenti die pervenimus contra Chium et alia applicuimus Samum et sequenti venimus Miletum.
la,NOVA_VULGATA,Acts,Acts,43,Acts.20,Acts 20,19,Acts.20.16,Acts 20:16,15,"Proposuerat enim Paulus transnavigare Ephesum, ne qua mora illi fieret in Asia; festinabat enim, si possibile sibi esset, ut diem Pentecosten faceret Hierosolymis."
la,NOVA_VULGATA,Acts,Acts,43,Acts.20,Acts 20,19,Acts.20.17,Acts 20:17,16,A Mileto autem mittens Ephesum convocavit presbyteros ecclesiae.
la,NOVA_VULGATA,Acts,Acts,43,Acts.20,Acts 20,19,Acts.20.18,Acts 20:18,17,"Qui cum venissent ad eum, dixit eis: "" Vos scitis a prima die, qua ingressus sum in Asiam, qualiter vobiscum per omne tempus fuerim,"
la,NOVA_VULGATA,Acts,Acts,43,Acts.20,Acts 20,19,Acts.20.19,Acts 20:19,18,"serviens Domino cum omni humilitate et lacrimis et tentationibus, quae mihi acciderunt in insidiis Iudaeorum;"
la,NOVA_VULGATA,Acts,Acts,43,Acts.20,Acts 20,19,Acts.20.20,Acts 20:20,19,"quomodo nihil subtraxerim utilium, quominus annuntiarem vobis et docerem vos publice et per domos,"
la,NOVA_VULGATA,Acts,Acts,43,Acts.20,Acts 20,19,Acts.20.21,Acts 20:21,20,testificans Iudaeis atque Graecis in Deum paenitentiam et fidem in Dominum nostrum Iesum.
la,NOVA_VULGATA,Acts,Acts,43,Acts.20,Acts 20,19,Acts.20.22,Acts 20:22,21,"Et nunc ecce alligatus ego Spiritu vado in Ierusalem, quae in ea eventura sint mihi ignorans,"
la,NOVA_VULGATA,Acts,Acts,43,Acts.20,Acts 20,19,Acts.20.23,Acts 20:23,22,nisi quod Spiritus Sanctus per omnes civitates protestatur mihi dicens quoniam vincula et tribulationes me manent.
la,NOVA_VULGATA,Acts,Acts,43,Acts.20,Acts 20,19,Acts.20.24,Acts 20:24,23,"Sed nihili facio animam meam pretiosam mihi, dummodo consummem cursum meum et ministerium, quod accepi a Domino Iesu, testificari evangelium gratiae Dei."
la,NOVA_VULGATA,Acts,Acts,43,Acts.20,Acts 20,19,Acts.20.25,Acts 20:25,24,"Et nunc ecce ego scio quia amplius non videbitis faciem meam vos omnes, per quos transivi praedicans regnum;"
la,NOVA_VULGATA,Acts,Acts,43,Acts.20,Acts 20,19,Acts.20.26,Acts 20:26,25,"quapropter contestor vos hodierna die, quia mundus sum a sanguine omnium;"
la,NOVA_VULGATA,Acts,Acts,43,Acts.20,Acts 20,19,Acts.20.27,Acts 20:27,26,"non enim subterfugi, quominus annuntiarem omne consilium Dei vobis."
la,NOVA_VULGATA,Acts,Acts,43,Acts.20,Acts 20,19,Acts.20.28,Acts 20:28,27,"Attendite vobis et universo gregi, in quo vos Spiritus Sanctus posuit episcopos, pascere ecclesiam Dei, quam acquisivit sanguine suo."
la,NOVA_VULGATA,Acts,Acts,43,Acts.20,Acts 20,19,Acts.20.29,Acts 20:29,28,Ego scio quoniam intrabunt post discessionem meam lupi graves in vos non parcentes gregi;
la,NOVA_VULGATA,Acts,Acts,43,Acts.20,Acts 20,19,Acts.20.30,Acts 20:30,29,"et ex vobis ipsis exsurgent viri loquentes perversa, ut abstrahant discipulos post se."
la,NOVA_VULGATA,Acts,Acts,43,Acts.20,Acts 20,19,Acts.20.31,Acts 20:31,30,"Propter quod vigilate, memoria retinentes quoniam per triennium nocte et die non cessavi cum lacrimis monens unumquemque vestrum."
la,NOVA_VULGATA,Acts,Acts,43,Acts.20,Acts 20,19,Acts.20.32,Acts 20:32,31,"Et nunc commendo vos Deo et verbo gratiae ipsius, qui potens est aedificare et dare hereditatem in sanctificatis omnibus."
la,NOVA_VULGATA,Acts,Acts,43,Acts.20,Acts 20,19,Acts.20.33,Acts 20:33,32,Argentum aut aurum aut vestem nullius concupivi;
la,NOVA_VULGATA,Acts,Acts,43,Acts.20,Acts 20,19,Acts.20.34,Acts 20:34,33,"ipsi scitis quoniam ad ea, quae mihi opus erant et his, qui mecum sunt, ministraverunt manus istae."
la,NOVA_VULGATA,Acts,Acts,43,Acts.20,Acts 20,19,Acts.20.35,Acts 20:35,34,"Omnia ostendi vobis quoniam sic laborantes oportet suscipere infirmos, ac meminisse verborum Domini Iesu, quoniam ipse dixit: ""Beatius est magis dare quam accipere!"" ""."
la,NOVA_VULGATA,Acts,Acts,43,Acts.20,Acts 20,19,Acts.20.36,Acts 20:36,35,"Et cum haec dixisset, positis genibus suis, cum omnibus illis oravit."
la,NOVA_VULGATA,Acts,Acts,43,Acts.20,Acts 20,19,Acts.20.37,Acts 20:37,36,Magnus autem fletus factus est omnium; et procumbentes super collum Pauli osculabantur eum
la,NOVA_VULGATA,Acts,Acts,43,Acts.20,Acts 20,19,Acts.20.38,Acts 20:38,37,"dolentes maxime in verbo, quod dixerat, quoniam amplius faciem eius non essent visuri. Et deducebant eum ad navem."
la,NOVA_VULGATA,Acts,Acts,43,Acts.21,Acts 21,20,Acts.21.1,Acts 21:1,0,"Cum autem factum esset, ut navigaremus abstracti ab eis, recto cursu venimus Cho et sequenti die Rhodum et inde Patara;"
la,NOVA_VULGATA,Acts,Acts,43,Acts.21,Acts 21,20,Acts.21.2,Acts 21:2,1,"et cum invenissemus navem transfretantem in Phoenicen, ascendentes navigavimus."
la,NOVA_VULGATA,Acts,Acts,43,Acts.21,Acts 21,20,Acts.21.3,Acts 21:3,2,"Cum paruissemus autem Cypro, et relinquentes eam ad sinistram navigabamus in Syriam et venimus Tyrum, ibi enim navis erat expositura onus."
la,NOVA_VULGATA,Acts,Acts,43,Acts.21,Acts 21,20,Acts.21.4,Acts 21:4,3,"Inventis autem discipulis, mansimus ibi diebus septem; qui Paulo dicebant per Spiritum, ne iret Hierosolymam."
la,NOVA_VULGATA,Acts,Acts,43,Acts.21,Acts 21,20,Acts.21.5,Acts 21:5,4,"Et explicitis diebus, profecti ibamus, deducentibus nos omnibus cum uxoribus et filiis usque foras civitatem; et positis genibus in litore orantes,"
la,NOVA_VULGATA,Acts,Acts,43,Acts.21,Acts 21,20,Acts.21.6,Acts 21:6,5,valefecimus invicem et ascendimus in navem; illi autem redierunt in sua.
la,NOVA_VULGATA,Acts,Acts,43,Acts.21,Acts 21,20,Acts.21.7,Acts 21:7,6,"Nos vero, navigatione explicita, a Tyro devenimus Ptolemaida et, salutatis fratribus, mansimus die una apud illos."
la,NOVA_VULGATA,Acts,Acts,43,Acts.21,Acts 21,20,Acts.21.8,Acts 21:8,7,"Alia autem die profecti venimus Caesaream et intrantes in domum Philippi evangelistae, qui erat de septem, mansimus apud eum."
la,NOVA_VULGATA,Acts,Acts,43,Acts.21,Acts 21,20,Acts.21.9,Acts 21:9,8,Huic autem erant filiae quattuor virgines prophetantes.
la,NOVA_VULGATA,Acts,Acts,43,Acts.21,Acts 21,20,Acts.21.10,Acts 21:10,9,"Et cum moraremur plures dies, supervenit quidam a Iudaea propheta nomine Agabus;"
la,NOVA_VULGATA,Acts,Acts,43,Acts.21,Acts 21,20,Acts.21.11,Acts 21:11,10,"is cum venisset ad nos et tulisset zonam Pauli, alligans sibi pedes et manus dixit: "" Haec dicit Spiritus Sanctus: Virum, cuius est zona haec, sic alligabunt in Ierusalem Iudaei et tradent in manus gentium ""."
la,NOVA_VULGATA,Acts,Acts,43,Acts.21,Acts 21,20,Acts.21.12,Acts 21:12,11,"Quod cum audissemus, rogabamus nos et, qui loci illius erant, ne ipse ascenderet Ierusalem."
la,NOVA_VULGATA,Acts,Acts,43,Acts.21,Acts 21,20,Acts.21.13,Acts 21:13,12,"Tunc respondit Paulus: "" Quid facitis flentes et affligentes cor meum? Ego enim non solum alligari sed et mori in Ierusalem paratus sum propter nomen Domini Iesu ""."
la,NOVA_VULGATA,Acts,Acts,43,Acts.21,Acts 21,20,Acts.21.14,Acts 21:14,13,"Et cum ei suadere non possemus, quievimus dicentes: "" Domini voluntas fiat! ""."
la,NOVA_VULGATA,Acts,Acts,43,Acts.21,Acts 21,20,Acts.21.15,Acts 21:15,14,Post dies autem istos praeparati ascendebamus Hierosolymam;
la,NOVA_VULGATA,Acts,Acts,43,Acts.21,Acts 21,20,Acts.21.16,Acts 21:16,15,"venerunt autem et ex discipulis a Caesarea nobiscum adducentes apud quem hospitaremur, Mnasonem quendam Cyprium, antiquum discipulum."
la,NOVA_VULGATA,Acts,Acts,43,Acts.21,Acts 21,20,Acts.21.17,Acts 21:17,16,"Et cum venissemus Hierosolymam, libenter exceperunt nos fratres."
la,NOVA_VULGATA,Acts,Acts,43,Acts.21,Acts 21,20,Acts.21.18,Acts 21:18,17,"Sequenti autem die introibat Paulus nobiscum ad Iacobum, omnesque collecti sunt presbyteri."
la,NOVA_VULGATA,Acts,Acts,43,Acts.21,Acts 21,20,Acts.21.19,Acts 21:19,18,"Quos cum salutasset, narrabat per singula, quae fecisset Deus in gentibus per ministerium ipsius."
la,NOVA_VULGATA,Acts,Acts,43,Acts.21,Acts 21,20,Acts.21.20,Acts 21:20,19,"At illi cum audissent, glorificabant Deum dixeruntque ei: "" Vides, frater, quot milia sint in Iudaeis, qui crediderunt, et omnes aemulatores sunt legis;"
la,NOVA_VULGATA,Acts,Acts,43,Acts.21,Acts 21,20,Acts.21.21,Acts 21:21,20,"audierunt autem de te quia discessionem doceas a Moyse omnes, qui per gentes sunt, Iudaeos, dicens non debere circumcidere eos filios suos neque secundum consuetudines ambulare."
la,NOVA_VULGATA,Acts,Acts,43,Acts.21,Acts 21,20,Acts.21.22,Acts 21:22,21,Quid ergo est? Utique audient te supervenisse.
la,NOVA_VULGATA,Acts,Acts,43,Acts.21,Acts 21,20,Acts.21.23,Acts 21:23,22,"Hoc ergo fac, quod tibi dicimus. Sunt nobis viri quattuor votum habentes super se;"
la,NOVA_VULGATA,Acts,Acts,43,Acts.21,Acts 21,20,Acts.21.24,Acts 21:24,23,"his assumptis, sanctifica te cum illis et impende pro illis, ut radant capita, et scient omnes quia, quae de te audierunt, nihil sunt, sed ambulas et ipse custodiens legem."
la,NOVA_VULGATA,Acts,Acts,43,Acts.21,Acts 21,20,Acts.21.25,Acts 21:25,24,"De his autem, qui crediderunt, gentibus nos scripsimus iudicantes, ut abstineant ab idolothyto et sanguine et suffocato et fornicatione ""."
la,NOVA_VULGATA,Acts,Acts,43,Acts.21,Acts 21,20,Acts.21.26,Acts 21:26,25,"Tunc Paulus, assumptis viris, postera die purificatus cum illis intravit in templum annuntians expletionem dierum purificationis, donec offerretur pro unoquoque eorum oblatio."
la,NOVA_VULGATA,Acts,Acts,43,Acts.21,Acts 21,20,Acts.21.27,Acts 21:27,26,"Dum autem septem dies consummarentur, hi, qui de Asia erant, Iudaei cum vidissent eum in templo, concitaverunt omnem turbam et iniecerunt ei manus"
la,NOVA_VULGATA,Acts,Acts,43,Acts.21,Acts 21,20,Acts.21.28,Acts 21:28,27,"clamantes: "" Viri Israelitae, adiuvate! Hic est homo, qui adversus populum et legem et locum hunc omnes ubique docens, insuper et Graecos induxit in templum et polluit sanctum locum istum ""."
la,NOVA_VULGATA,Acts,Acts,43,Acts.21,Acts 21,20,Acts.21.29,Acts 21:29,28,"Viderant enim Trophimum Ephesium in civitate cum ipso, quem aestimabant quoniam in templum induxisset Paulus."
la,NOVA_VULGATA,Acts,Acts,43,Acts.21,Acts 21,20,Acts.21.30,Acts 21:30,29,"Commotaque est civitas tota, et facta est concursio populi, et apprehendentes Paulum trahebant eum extra templum, et statim clausae sunt ianuae."
la,NOVA_VULGATA,Acts,Acts,43,Acts.21,Acts 21,20,Acts.21.31,Acts 21:31,30,"Quaerentibus autem eum occidere, nuntiatum est tribuno cohortis quia tota confunditur Ierusalem,"
la,NOVA_VULGATA,Acts,Acts,43,Acts.21,Acts 21,20,Acts.21.32,Acts 21:32,31,"qui statim, assumptis militibus et centurionibus, decucurrit ad illos; qui cum vidissent tribunum et milites, cessaverunt percutere Paulum."
la,NOVA_VULGATA,Acts,Acts,43,Acts.21,Acts 21,20,Acts.21.33,Acts 21:33,32,Tunc accedens tribunus apprehendit eum et iussit alligari catenis duabus et interrogabat quis esset et quid fecisset.
la,NOVA_VULGATA,Acts,Acts,43,Acts.21,Acts 21,20,Acts.21.34,Acts 21:34,33,"Alii autem aliud clamabant in turba; et cum non posset certum cognoscere prae tumultu, iussit duci eum in castra."
la,NOVA_VULGATA,Acts,Acts,43,Acts.21,Acts 21,20,Acts.21.35,Acts 21:35,34,"Et cum venisset ad gradus, contigit ut portaretur a militibus propter vim turbae;"
la,NOVA_VULGATA,Acts,Acts,43,Acts.21,Acts 21,20,Acts.21.36,Acts 21:36,35,"sequebatur enim multitudo populi clamantes: "" Tolle eum! ""."
la,NOVA_VULGATA,Acts,Acts,43,Acts.21,Acts 21,20,Acts.21.37,Acts 21:37,36,"Et cum coepisset induci in castra, Paulus dicit tribuno: "" Si licet mihi loqui aliquid ad te? "". Qui dixit: "" Graece nosti?"
la,NOVA_VULGATA,Acts,Acts,43,Acts.21,Acts 21,20,Acts.21.38,Acts 21:38,37,"Nonne tu es Aegyptius, qui ante hos dies tumultum concitasti et eduxisti in desertum quattuor milia virorum sicariorum? ""."
la,NOVA_VULGATA,Acts,Acts,43,Acts.21,Acts 21,20,Acts.21.39,Acts 21:39,38,"Et dixit Paulus: "" Ego homo sum quidem Iudaeus a Tarso Ciliciae, non ignotae civitatis municeps; rogo autem te, permitte mihi loqui ad populum."
la,NOVA_VULGATA,Acts,Acts,43,Acts.21,Acts 21,20,Acts.21.40,Acts 21:40,39,"Et cum ille permisisset, Paulus stans in gradibus annuit manu ad plebem et, magno silentio facto, allocutus est Hebraea lingua dicens:"
la,NOVA_VULGATA,Acts,Acts,43,Acts.22,Acts 22,21,Acts.22.1,Acts 22:1,0,""" Viri fratres et patres, audi te a me, quam ad vos nunc reddo, rationem."
la,NOVA_VULGATA,Acts,Acts,43,Acts.22,Acts 22,21,Acts.22.2,Acts 22:2,1,"Cum audissent autem quia Hebraea lingua loquebatur ad illos, magis praestiterunt silentium. Et dixit:"
la,NOVA_VULGATA,Acts,Acts,43,Acts.22,Acts 22,21,Acts.22.3,Acts 22:3,2,""" Ego sum vir Iudaeus, natus Tarso Ciliciae, enutritus autem in ista civitate, secus pedes Gamaliel eruditus iuxta veritatem paternae legis, aemulator Dei, sicut et vos omnes estis hodie."
la,NOVA_VULGATA,Acts,Acts,43,Acts.22,Acts 22,21,Acts.22.4,Acts 22:4,3,"Qui hanc viam persecutus sum usque ad mortem, alligans et tradens in custodias viros ac mulieres,"
la,NOVA_VULGATA,Acts,Acts,43,Acts.22,Acts 22,21,Acts.22.5,Acts 22:5,4,"sicut et princeps sacerdotum testimonium mihi reddit et omne concilium; a quibus et epistulas accipiens ad fratres, Damascum pergebam, ut adducerem et eos, qui ibi essent, vinctos in Ierusalem, uti punirentur."
la,NOVA_VULGATA,Acts,Acts,43,Acts.22,Acts 22,21,Acts.22.6,Acts 22:6,5,"Factum est autem, eunte me et appropinquante Damasco, circa mediam diem subito de caelo circumfulsit me lux copiosa;"
la,NOVA_VULGATA,Acts,Acts,43,Acts.22,Acts 22,21,Acts.22.7,Acts 22:7,6,"et decidi in terram et audivi vocem dicentem mihi: ""Saul, Saul, quid me persequeris?""."
la,NOVA_VULGATA,Acts,Acts,43,Acts.22,Acts 22,21,Acts.22.8,Acts 22:8,7,"Ego autem respondi: ""Quis es, Domine?"". Dixitque ad me: ""Ego sum Iesus Nazarenus, quem tu persequeris""."
la,NOVA_VULGATA,Acts,Acts,43,Acts.22,Acts 22,21,Acts.22.9,Acts 22:9,8,"Et, qui mecum erant, lumen quidem viderunt, vocem autem non audierunt eius, qui loquebatur mecum."
la,NOVA_VULGATA,Acts,Acts,43,Acts.22,Acts 22,21,Acts.22.10,Acts 22:10,9,"Et dixi: ""Quid faciam, Domine?"". Dominus autem dixit ad me: ""Surgens vade Damascum, et ibi tibi dicetur de omnibus, quae statutum est tibi, ut faceres""."
la,NOVA_VULGATA,Acts,Acts,43,Acts.22,Acts 22,21,Acts.22.11,Acts 22:11,10,"Et cum non viderem prae claritate luminis illius, ad manum deductus a comitibus veni Damascum."
la,NOVA_VULGATA,Acts,Acts,43,Acts.22,Acts 22,21,Acts.22.12,Acts 22:12,11,"Ananias autem quidam vir religiosus secundum legem, testimonium habens ab omnibus habitantibus Iudaeis,"
la,NOVA_VULGATA,Acts,Acts,43,Acts.22,Acts 22,21,Acts.22.13,Acts 22:13,12,"veniens ad me et astans dixit mihi: ""Saul frater, respice!"". Et ego eadem hora respexi in eum."
la,NOVA_VULGATA,Acts,Acts,43,Acts.22,Acts 22,21,Acts.22.14,Acts 22:14,13,"At ille dixit: ""Deus patrum nostrorum praeordinavit te, ut cognosceres voluntatem eius et videres Iustum et audires vocem ex ore eius,"
la,NOVA_VULGATA,Acts,Acts,43,Acts.22,Acts 22,21,Acts.22.15,Acts 22:15,14,"quia eris testis illi ad omnes homines eorum, quae vidisti et audisti."
la,NOVA_VULGATA,Acts,Acts,43,Acts.22,Acts 22,21,Acts.22.16,Acts 22:16,15,"Et nunc quid moraris? Exsurgens baptizare et ablue peccata tua, invocato nomine ipsius""."
la,NOVA_VULGATA,Acts,Acts,43,Acts.22,Acts 22,21,Acts.22.17,Acts 22:17,16,"Factum est autem, revertenti mihi in Ierusalem et oranti in templo fieri me in stupore mentis"
la,NOVA_VULGATA,Acts,Acts,43,Acts.22,Acts 22,21,Acts.22.18,Acts 22:18,17,"et videre illum dicentem mihi: ""Festina et exi velociter ex Ierusalem, quoniam non recipient testimonium tuum de me""."
la,NOVA_VULGATA,Acts,Acts,43,Acts.22,Acts 22,21,Acts.22.19,Acts 22:19,18,"Et ego dixi: ""Domine, ipsi sciunt quia ego eram concludens in carcerem et caedens per synagogas eos, qui credebant in te;"
la,NOVA_VULGATA,Acts,Acts,43,Acts.22,Acts 22,21,Acts.22.20,Acts 22:20,19,"et cum funderetur sanguis Stephani testis tui, et ipse astabam et consentiebam et custodiebam vestimenta interficientium illum""."
la,NOVA_VULGATA,Acts,Acts,43,Acts.22,Acts 22,21,Acts.22.21,Acts 22:21,20,"Et dixit ad me: ""Vade, quoniam ego in nationes longe mittam te"" ""."
la,NOVA_VULGATA,Acts,Acts,43,Acts.22,Acts 22,21,Acts.22.22,Acts 22:22,21,"Audiebant autem eum usque ad hoc verbum et levaverunt vocem suam dicentes: "" Tolle de terra eiusmodi, non enim fas est eum vivere! ""."
la,NOVA_VULGATA,Acts,Acts,43,Acts.22,Acts 22,21,Acts.22.23,Acts 22:23,22,"Vociferantibus autem eis et proicientibus vestimenta sua et pulverem iactantibus in aerem,"
la,NOVA_VULGATA,Acts,Acts,43,Acts.22,Acts 22,21,Acts.22.24,Acts 22:24,23,"iussit tribunus induci eum in castra dicens flagellis eum interrogari, ut sciret propter quam causam sic acclamarent ei."
la,NOVA_VULGATA,Acts,Acts,43,Acts.22,Acts 22,21,Acts.22.25,Acts 22:25,24,"Et cum astrinxissent eum loris, dixit astanti centurioni Paulus: "" Si hominem Romanum et indemnatum licet vobis flagellare? ""."
la,NOVA_VULGATA,Acts,Acts,43,Acts.22,Acts 22,21,Acts.22.26,Acts 22:26,25,"Quo audito, centurio accedens ad tribunum nuntiavit dicens: "" Quid acturus es? Hic enim homo Romanus est ""."
la,NOVA_VULGATA,Acts,Acts,43,Acts.22,Acts 22,21,Acts.22.27,Acts 22:27,26,"Accedens autem tribunus dixit illi: "" Dic mihi, tu Romanus es? "". At ille dixit: "" Etiam ""."
la,NOVA_VULGATA,Acts,Acts,43,Acts.22,Acts 22,21,Acts.22.28,Acts 22:28,27,"Et respondit tribunus: "" Ego multa summa civitatem hanc consecutus sum. Et Paulus ait: "" Ego autem et natus sum ""."
la,NOVA_VULGATA,Acts,Acts,43,Acts.22,Acts 22,21,Acts.22.29,Acts 22:29,28,"Protinus ergo discesserunt ab illo, qui eum interrogaturi erant; tribunus quoque timuit, postquam rescivit quia Romanus esset, et quia alligasset eum."
la,NOVA_VULGATA,Acts,Acts,43,Acts.22,Acts 22,21,Acts.22.30,Acts 22:30,29,"Postera autem die, volens scire diligenter qua ex causa accusaretur a Iudaeis, solvit eum et iussit principes sacerdotum convenire et omne concilium et producens Paulum statuit coram illis."
la,NOVA_VULGATA,Acts,Acts,43,Acts.23,Acts 23,22,Acts.23.1,Acts 23:1,0,"Intendens autem concilium Paulus ait: "" Viri fratres, ego omni conscientia bona conversatus sum ante Deum usque in hodiernum diem ""."
la,NOVA_VULGATA,Acts,Acts,43,Acts.23,Acts 23,22,Acts.23.2,Acts 23:2,1,Princeps autem sacerdotum Ananias praecepit astantibus sibi percutere os eius.
la,NOVA_VULGATA,Acts,Acts,43,Acts.23,Acts 23,22,Acts.23.3,Acts 23:3,2,"Tunc Paulus ad eum dixit: "" Percutiet te Deus, paries dealbate! Et tu sedes iudicans me secundum legem et contra legem iubes me percuti? ""."
la,NOVA_VULGATA,Acts,Acts,43,Acts.23,Acts 23,22,Acts.23.4,Acts 23:4,3,"Et, qui astabant, dixerunt: "" Summum sacerdotem Dei maledicis?""."
la,NOVA_VULGATA,Acts,Acts,43,Acts.23,Acts 23,22,Acts.23.5,Acts 23:5,4,"Dixit autem Paulus: "" Nesciebam, fratres, quia princeps est sacerdotum; scriptum est enim: ""Principem populi tui non maledices"" ""."
la,NOVA_VULGATA,Acts,Acts,43,Acts.23,Acts 23,22,Acts.23.6,Acts 23:6,5,"Sciens autem Paulus quia una pars esset sadducaeorum, et altera pharisaeorum, exclamabat in concilio: "" Viri fratres, ego pharisaeus sum, filius pharisaeorum; de spe et resurrectione mortuorum ego iudicor ""."
la,NOVA_VULGATA,Acts,Acts,43,Acts.23,Acts 23,22,Acts.23.7,Acts 23:7,6,"Et cum haec diceret, facta est dissensio inter pharisaeos et sadducaeos; et divisa est multitudo."
la,NOVA_VULGATA,Acts,Acts,43,Acts.23,Acts 23,22,Acts.23.8,Acts 23:8,7,Sadducaei enim dicunt non esse resurrectionem neque angelum neque spiritum; pharisaei autem utrumque confitentur.
la,NOVA_VULGATA,Acts,Acts,43,Acts.23,Acts 23,22,Acts.23.9,Acts 23:9,8,"Factus est autem clamor magnus; et surgentes scribae quidam partis pharisaeorum pugnabant dicentes: "" Nihil mali invenimus in homine isto: quod si spiritus locutus est ei aut angelus "";"
la,NOVA_VULGATA,Acts,Acts,43,Acts.23,Acts 23,22,Acts.23.10,Acts 23:10,9,"et cum magna dissensio facta esset, timens tribunus ne discerperetur Paulus ab ipsis, iussit milites descendere, ut raperent eum de medio eorum ac deducerent in castra."
la,NOVA_VULGATA,Acts,Acts,43,Acts.23,Acts 23,22,Acts.23.11,Acts 23:11,10,"Sequenti autem nocte, assistens ei Dominus ait: "" Constans esto! Sicut enim testificatus es, quae sunt de me, in Ierusalem, sic te oportet et Romae testificari ""."
la,NOVA_VULGATA,Acts,Acts,43,Acts.23,Acts 23,22,Acts.23.12,Acts 23:12,11,"Facta autem die, faciebant concursum Iudaei et devoverunt se dicentes neque manducaturos neque bibituros, donec occiderent Paulum."
la,NOVA_VULGATA,Acts,Acts,43,Acts.23,Acts 23,22,Acts.23.13,Acts 23:13,12,"Erant autem plus quam quadraginta, qui hanc coniurationem fecerant;"
la,NOVA_VULGATA,Acts,Acts,43,Acts.23,Acts 23,22,Acts.23.14,Acts 23:14,13,"qui accedentes ad principes sacerdotum et seniores dixerunt: "" Devotione devovimus nos nihil gustaturos, donec occidamus Paulum."
la,NOVA_VULGATA,Acts,Acts,43,Acts.23,Acts 23,22,Acts.23.15,Acts 23:15,14,"Nunc ergo vos notum facite tribuno cum concilio, ut producat illum ad vos, tamquam aliquid certius cognituri de eo; nos vero, priusquam appropiet, parati sumus interficere illum ""."
la,NOVA_VULGATA,Acts,Acts,43,Acts.23,Acts 23,22,Acts.23.16,Acts 23:16,15,"Quod cum audisset filius sororis Pauli insidias, venit et intravit in castra nuntiavitque Paulo."
la,NOVA_VULGATA,Acts,Acts,43,Acts.23,Acts 23,22,Acts.23.17,Acts 23:17,16,"Vocans autem Paulus ad se unum ex centurionibus ait: "" Adulescentem hunc perduc ad tribunum, habet enim aliquid indicare illi ""."
la,NOVA_VULGATA,Acts,Acts,43,Acts.23,Acts 23,22,Acts.23.18,Acts 23:18,17,"Et ille quidem assumens eum duxit ad tribunum et ait: "" Vinctus Paulus vocans rogavit me hunc adulescentem perducere ad te, habentem aliquid loqui tibi ""."
la,NOVA_VULGATA,Acts,Acts,43,Acts.23,Acts 23,22,Acts.23.19,Acts 23:19,18,"Apprehendens autem tribunus manum illius, secessit cum eo seorsum et interrogabat: "" Quid est, quod habes indicare mihi? ""."
la,NOVA_VULGATA,Acts,Acts,43,Acts.23,Acts 23,22,Acts.23.20,Acts 23:20,19,"Ille autem dixit: "" Iudaei constituerunt rogare te, ut crastina die Paulum producas in concilium, quasi aliquid certius inquisiturum sit de illo."
la,NOVA_VULGATA,Acts,Acts,43,Acts.23,Acts 23,22,Acts.23.21,Acts 23:21,20,"Tu ergo ne credideris illis; insidiantur enim ei ex eis viri amplius quadraginta, qui se devoverunt non manducare neque bibere, donec interficiant eum; et nunc parati sunt exspectantes promissum tuum ""."
la,NOVA_VULGATA,Acts,Acts,43,Acts.23,Acts 23,22,Acts.23.22,Acts 23:22,21,"Tribunus igitur dimisit adulescentem praecipiens, ne cui eloqueretur quoniam "" haec nota mihi fecisti ""."
la,NOVA_VULGATA,Acts,Acts,43,Acts.23,Acts 23,22,Acts.23.23,Acts 23:23,22,"Et vocatis duobus centurionibus, dixit: "" Parate milites ducentos, ut eant usque Caesaream, et equites septuaginta et lancearios ducentos, a tertia hora noctis,"
